{"organizations": ["AT&T AT&T Inc.", "AT&T Partner Exchange", "AT&T Intellectual Property", "AT&T Inc", "AT&T Partner Solutions", "Network Operations Center", "AT&T Inc.", "AT&T"], "uuid": "e593fe661b85ad906a259690fe7ee57934fcb589", "thread": {"social": {"gplus": {"shares": 0}, "pinterest": {"shares": 0}, "vk": {"shares": 0}, "linkedin": {"shares": 0}, "facebook": {"likes": 0, "shares": 0, "comments": 0}, "stumbledupon": {"shares": 0}}, "site_full": "science-technology.news-articles.net", "main_image": "", "site_section": "http://science-technology.news-articles.net/content/rss.php", "section_title": "Science and Technology @ News Articles Network", "url": "http://science-technology.news-articles.net/content/solution-providers-their-game-partner-exchange.xhtml", "country": "US", "title": "Solution Providers Up Their Game With AT&T Partner Exchange", "performance_score": 0, "site": "news-articles.net", "participants_count": 0, "title_full": "Solution Providers Up Their Game With AT&T Partner Exchange", "spam_score": 0.0, "site_type": "news", "published": "2015-10-20T17:34:00.000+03:00", "replies_count": 0, "uuid": "e593fe661b85ad906a259690fe7ee57934fcb589"}, "author": "", "url": "http://science-technology.news-articles.net/content/solution-providers-their-game-partner-exchange.xhtml", "ord_in_thread": 0, "title": "Solution Providers Up Their Game With AT&T Partner Exchange", "locations": ["U.S.", "DALLAS"], "entities": {"persons": [], "locations": [], "organizations": []}, "highlightText": "", "language": "english", "persons": ["Brooks McCorcle", "McCorcle", "Rob Chamberlin", "Max Silber", "DataXoom"], "text": "Solution Providers Up Their Game With AT&T Partner Exchange   Solution Providers Up Their Game With AT&T Partner Exchange -- DALLAS, Oct. 20,   AT&T Inc. AT&T Inc. <-   DALLAS , Oct. 20,   Since launching the [[UEdFZ2NtVnNQVndpYm05bWIyeHNiM2RjSWlCdmJtTnNhV05yUFNkc2FXNXJUMjVEYkdsamF5aDBhR2x6S1NjZ2FISmxaajFjSW1oMGRIQTZMeTkzZDNjdVlYUjBMbU52YlM5d1lYSjBibVZ5WlhoamFHRnVaMlZjSWlCeVpXdzlYQ0p1YjJadmJHeHZkMXdpSUhSaGNtZGxkRDFjSWw5aWJHRnVhMXdpUGtGVUpsUXFJRkJoY25SdVpYSWdSWGhqYUdGdVoyVThMMkUrfA==]]® reseller program in early 2013, we have kept the momentum strong. This [[UEdFZ2NtVnNQVndpYm05bWIyeHNiM2RjSWlCdmJtTnNhV05yUFNkc2FXNXJUMjVEYkdsamF5aDBhR2x6S1NjZ2FISmxaajFjSW1oMGRIQTZMeTloWW05MWRDNWhkSFF1WTI5dEwzTjBiM0o1TDJGMGRGOXdZWEowYm1WeVgyVjRZMmhoYm1kbFgybHVkSEp2WkhWalpYTmZibVYzWDJabFlYUjFjbVZ6WDNSdlgyaGxiSEJmWVdOalpXeGxjbUYwWlY5emIyeDFkR2x2Ymw5d2NtOTJhV1JsY25OZlluVnphVzVsYzNOZlpYWnZiSFYwYVc5dUxtaDBiV3hjSWlCeVpXdzlYQ0p1YjJadmJHeHZkMXdpSUhSaGNtZGxkRDFjSWw5aWJHRnVhMXdpUG5CaGMzUWdlV1ZoY2p3dllUND18]] has been no exception. And at our 2 nd annual AT&T Partner Exchange Summit, we highlighted 5 of the latest program offerings available to help our nearly 400 solution providers up their game even further. Solution providers can now take advantage of the following: Mobility Employee Sponsorship Program – Extend a discount on wireless services to customers' employees. This unlocks additional opportunities to enhance customer value. Marketing as a Service** – Connect to select third parties that provide turn-key marketing campaigns that can help cost effectively drive customer demand. Order Status Tool – View daily status updates on a customer's order, increasing responsiveness with 24/7 system access for enabled products and services. Network Operations Center as a Service** – Collaborate with third parties that provide white-labeled services for network monitoring, tier-one support, ticket resolution and more to help better manage the customer experience. Enablement Playbook – Explore valuable resources offered in AT&T Partner Exchange. By design, this interactive guide helps maximize success and fuel the transformation to a recurring revenue model. \"Solution providers have embraced the dynamic, collaborative nature of our program,\" said Brooks McCorcle , president, AT&T Partner Solutions. \"By inviting them in to work with us, we implement the portfolio and program additions they need, when they need them.\" \"AT&T Partner Exchange is the only true reseller program in the industry that gives us access to the strategic wireline and wireless solutions our customers demand. And its collaborative, responsive culture is unmatched,\" said Max Silber , vice president of mobility, MetTel. \"We requested a Mobility Employee Sponsorship Program to help meet our customers' needs, and AT&T Partner Exchange quickly delivered, allowing us to win more deals and drive incremental revenue. The program also constantly enables us to move faster for our customers. Using the recently released Order Status Tool, we've already seen an increase in our productivity.\" \"We're helping solution providers transform, innovate and grow. We've seen more than 225% year-over-year growth in the number of wireline deals our solution providers have closed, and we believe we're a leading model for what a true vendor/solution provider relationship should look like in the channel,\" McCorcle said. Momentum in mobility has also ramped. As of Sept. 2015 , solution providers have driven a 200% increase in the number of mobility subscribers coming through AT&T Partner Exchange this year. \"Businesses want to be more productive on the go and capitalize on trends like wearable technology. AT&T Partner Exchange gives us access to the wireless connectivity and resources we need to help our customers efficiently mobilize their people, processes and things,\" said Rob Chamberlin , co-founder and executive vice president, DataXoom. \"AT&T Partner Exchange directly and positively impacted our customer satisfaction index. Using the program's automated platforms and capabilities allows us to better deliver mobility solutions to our customers, which is a must-have competitive advantage in today's marketplace.\" Solution providers want to be able to move fast, so they can help their customers stay ahead of the complex landscape. They turn to AT&T Partner Exchange for access to the instant capabilities they need to help accelerate commerce. In 2015 alone, there have been more than 12 million calls on our Application Programming Interface (API) platform. This significant usage confirms that speed and agility are exactly what solution providers look for to elevate the value they can provide. We intentionally pair our suite of strategic wireline, wireless and cloud services with our ever-growing arsenal of innovative, self-serve technologies. Solution providers in AT&T Partner Exchange retain full control of the customer relationship – from acquisition to care. These 5 additions are just the latest features available to help our solution providers quickly and easily own the entire customer experience while maximizing the value they can deliver. * AT&T products and services are provided or offered by subsidiaries and affiliates of AT&T Inc. under the AT&T brand and not by AT&T Inc. ** Products and services are offered strictly by third-party providers, and any purchase of products or services is between the relevant solution provider and such providers. About AT&T AT&T Inc. (NYSE: [[UEdFZ2NtVnNQVndpYm05bWIyeHNiM2RjSWlCb2NtVm1QU2RvZEhSd09pOHZjM1IxWkdsdkxUVXVabWx1WVc1amFXRnNZMjl1ZEdWdWRDNWpiMjB2Y0hKdVpYZHpQMUJoWjJVOVVYVnZkR1VtVkdsamEyVnlQVlFuSUhSaGNtZGxkRDBuWDJKc1lXNXJKeUIwYVhSc1pUMG5WQ2NnYjI1amJHbGphejBuYkdsdWEwOXVRMnhwWTJzb2RHaHBjeWtuSUhKbGJEMG5ibTltYjJ4c2IzY25QbFE4TDJFK3w=]]) helps millions around the globe connect with leading entertainment, mobile, high speed Internet and voice services. We're the world's largest provider of pay TV. We have TV customers in the U.S. and 11 Latin American countries. In the U.S., our wireless network has the nation's strongest 4G LTE signal and most reliable 4G [[UEdFZ2NtVnNQVndpYm05bWIyeHNiM2RjSWlCdmJtTnNhV05yUFNkc2FXNXJUMjVEYkdsamF5aDBhR2x6S1NjZ2FISmxaajFjSW1oMGRIQTZMeTkzZDNjdVlYUjBMbU52YlM5dVpYUjNiM0pyTDF3aUlISmxiRDFjSW01dlptOXNiRzkzWENJZ2RHRnlaMlYwUFZ3aVgySnNZVzVyWENJK1RGUkZQQzloUGc9PXw=]]. We offer the best global coverage of any U.S. wireless provider*. And we help businesses worldwide serve their customers better with our mobility and highly secure cloud solutions. Additional information about AT&T products and services is available at [[UEdFZ2NtVnNQVndpYm05bWIyeHNiM2RjSWlCdmJtTnNhV05yUFNkc2FXNXJUMjVEYkdsamF5aDBhR2x6S1NjZ2FISmxaajFjSW1oMGRIQTZMeTloWW05MWRDNWhkSFF1WTI5dEwxd2lJSEpsYkQxY0ltNXZabTlzYkc5M1hDSWdkR0Z5WjJWMFBWd2lYMkpzWVc1clhDSSthSFIwY0RvdkwyRmliM1YwTG1GMGRDNWpiMjA4TDJFK3w=]] . Follow our news on Twitter at @ATT, on Facebook at [[UEdFZ2NtVnNQVndpYm05bWIyeHNiM2RjSWlCdmJtTnNhV05yUFNkc2FXNXJUMjVEYkdsamF5aDBhR2x6S1NjZ2FISmxaajFjSW1oMGRIQTZMeTkzZDNjdVptRmpaV0p2YjJzdVkyOXRMMkYwZEZ3aUlISmxiRDFjSW01dlptOXNiRzkzWENJZ2RHRnlaMlYwUFZ3aVgySnNZVzVyWENJK2FIUjBjRG92TDNkM2R5NW1ZV05sWW05dmF5NWpiMjB2WVhSMFBDOWhQZz09fA==]] and YouTube at [[UEdFZ2NtVnNQVndpYm05bWIyeHNiM2RjSWlCdmJtTnNhV05yUFNkc2FXNXJUMjVEYkdsamF5aDBhR2x6S1NjZ2FISmxaajFjSW1oMGRIQTZMeTkzZDNjdWVXOTFkSFZpWlM1amIyMHZZWFIwWENJZ2NtVnNQVndpYm05bWIyeHNiM2RjSWlCMFlYSm5aWFE5WENKZllteGhibXRjSWo1b2RIUndPaTh2ZDNkM0xubHZkWFIxWW1VdVkyOXRMMkYwZER3dllUND18]]. © 2015 AT&T Intellectual Property. All rights reserved. AT&T, the Globe logo and other marks are trademarks and service marks of AT&T Intellectual Property and/or AT&T affiliated companies. All other marks contained herein are the property of their respective owners. Signal strength and reliability claims based on nationwide carriers' 4G LTE. Signal strength claim based ONLY on avg. 4G LTE signal strength. 4G LTE not available everywhere. *Global coverage claim based on offering discounted voice and data roaming; LTE roaming; voice roaming; and world-capable smartphone and tablets in more countries than any other U.S. based carrier. International service required. Coverage not available in all areas. Coverage may vary per country and be limited/restricted in some countries. Logo - [[UEdFZ2NtVnNQVndpYm05bWIyeHNiM2RjSWlCdmJtTnNhV05yUFNkc2FXNXJUMjVEYkdsamF5aDBhR2x6S1NjZ2FISmxaajFjSW1oMGRIQTZMeTl3YUc5MGIzTXVjSEp1WlhkemQybHlaUzVqYjIwdmNISnVhQzh5TURFME1EUXdPQzlEUnprNU9UTTFURTlIVDF3aUlISmxiRDFjSW01dlptOXNiRzkzWENJZ2RHRnlaMlYwUFZ3aVgySnNZVzVyWENJK2FIUjBjRG92TDNCb2IzUnZjeTV3Y201bGQzTjNhWEpsTG1OdmJTOXdjbTVvTHpJd01UUXdOREE0TDBOSE9UazVNelZNVDBkUFBDOWhQZz09fA==]]", "external_links": [], "published": "2015-10-20T17:34:00.000+03:00", "crawled": "2015-10-20T17:19:12.035+03:00", "highlightTitle": ""}