{"organizations": ["U.S. Securities and Exchange Commission", "Comparative Financial Information Aviat Networks, Inc.", "Continuing Operations Attributable", "Conference Call Details Aviat Networks", "SEC", "GAAP", "Aviat Networks", "Facebook"], "uuid": "2e5e3a850d8b444ff3f5f1724e056a9f461bf900", "thread": {"social": {"gplus": {"shares": 0}, "pinterest": {"shares": 0}, "vk": {"shares": 0}, "linkedin": {"shares": 0}, "facebook": {"likes": 0, "shares": 0, "comments": 0}, "stumbledupon": {"shares": 0}}, "site_full": "science-technology.news-articles.net", "main_image": "", "site_section": "http://science-technology.news-articles.net/content/rss.php", "section_title": "Science and Technology @ News Articles Network", "url": "http://science-technology.news-articles.net/content/aviat-networks-announces-fourth-quarter-fiscal-year-financial-results.xhtml", "country": "US", "title": "Aviat Networks Announces Fourth Quarter and Fiscal Year 2015 Financial Results", "performance_score": 0, "site": "news-articles.net", "participants_count": 0, "title_full": "Aviat Networks Announces Fourth Quarter and Fiscal Year 2015 Financial Results", "spam_score": 0.0, "site_type": "news", "published": "2015-10-01T09:59:00.000+03:00", "replies_count": 0, "uuid": "2e5e3a850d8b444ff3f5f1724e056a9f461bf900"}, "author": "", "url": "http://science-technology.news-articles.net/content/aviat-networks-announces-fourth-quarter-fiscal-year-financial-results.xhtml", "ord_in_thread": 0, "title": "Aviat Networks Announces Fourth Quarter and Fiscal Year 2015 Financial Results", "locations": ["California", "North America", "Calif.", "U.S.", "SANTA CLARA", "Santa Clara"], "entities": {"persons": [], "locations": [], "organizations": []}, "highlightText": "", "language": "english", "persons": ["Michael Pangia"], "text": "Aviat Networks Announces Fourth Quarter and Fiscal Year 2015 Financial Results   Published on 2015-09-30 22:46:21 Aviat Networks Announces Fourth Quarter and Fiscal Year 2015 Financial Results -- SANTA CLARA, Calif., Sept.   <-   SANTA CLARA, Calif. , Sept.   Aviat Networks, Inc. (NASDAQ: AVNW ), the leading expert in microwave networking solutions, today reported financial results for the fourth quarter and fiscal year 2015, which ended July 3, 2015. Financial Highlights for Q4FY15 Book to bill was above 1 GAAP Gross Margin at 21.3%; Non-GAAP Gross Margin at 21.4% GAAP Operating Expense at $23.9 million ; Non-GAAP Operating Expense at $23.2 million GAAP Net Loss Attributable to Aviat Networks at $(1.6) million , or $(0.03) per share Non-GAAP Loss from Continuing Operations Attributable to Aviat Networks at $(5.0) million , or $(0.08) per share Financial Highlights for FY15 GAAP Gross Margin at 24.0%; non-GAAP Gross Margin at 24.1% Non-GAAP Operating Expense at $99.4 million GAAP Net Loss Attributable to Aviat Networks of $(24.7) million , or $(0.40) per share Non-GAAP Loss from Continuing Operations Attributable to Aviat Networks of $(20.6) million , or $(0.33) per share The first three quarters of fiscal 2015 and the quarterly and fiscal 2014 financial statements have been revised to reflect corrections to our accrued liability related to cost of services revenue in prior periods. A reconciliation of GAAP to non-GAAP financial measures for the fourth quarter and fiscal year along with the accompanying notes is provided on Table 4 below. \"Deployments with global tier-1 mobile operators, along with demand for our CTR product line and services portfolio drove revenue and bookings growth during the quarter. We continued to make significant progress implementing cost efficiencies and generating cash flow from operations,\" said Michael Pangia , president and CEO, Aviat Networks. \"These improvements set the foundation for stronger performance in fiscal 2016.\" GAAP Financial Results For the fourth quarter of fiscal 2015, revenue was $87.8 million , compared with $85.4 million in the year-ago quarter. Aviat reported net loss attributable to Aviat Networks, including discontinued operations, of $(1.6) million , or $(0.03) per share, compared with a net loss of $(13.3) million , or $(0.21) per share, in the year-ago quarter. Loss from continuing operations attributable to Aviat Networks for the quarter was $(1.6) million , or $(0.03) per diluted share, compared with a loss from continuing operations of $(13.5) million , or $(0.22) per share, in the year-ago quarter. Cash and cash equivalents were $34.7 million as of July 3, 2015 compared with $35.0 million as of the end of the third quarter of fiscal 2015. Non-GAAP Financial Results Non-GAAP loss from continuing operations attributable to Aviat Networks for the quarter was $(5.0) million , or $(0.08) per share, compared with a non-GAAP loss from continuing operations of $(8.7) million , or $(0.14) per diluted share, in the year-ago quarter. The fourth quarter of fiscal 2015 non-GAAP income from continuing operations attributable to Aviat Networks excluded $0.8 million of pre-tax charges composed primarily of the following: $0.5 million of share-based compensation expense; $0.2 million of restructuring charges; and $0.1 million of amortization of purchased intangibles. Fourth quarter of fiscal 2015 Adjusted EBITDA attributable to Aviat Networks was $(2.5) million , or $(0.04) per share attributable to Aviat Networks shareholders, compared with $(6.3) million in the year ago quarter. In addition to the $0.8 million of pre-tax charges excluded from non-GAAP income from continuing operations noted above, fourth quarter of fiscal 2015 Adjusted EBITDA also excludes $2.0 million of pre-tax charges comprised of the following: $1.9 million of depreciation and amortization on property, plant and equipment; and $0.1 million of interest expense. A reconciliation of GAAP to non-GAAP financial measures for the fourth quarter and fiscal year along with accompanying notes is provided on Table 4 below. Fourth Quarter of Fiscal 2015 Revenue by Region Revenue in the North America region was $38.5 million in the fourth quarter of fiscal 2015, compared with $37.2 million in the year-ago quarter. International revenue was $49.3 million , compared with $48.2 million in the year-ago quarter. First Quarter of Fiscal 2016 Outlook Aviat Networks currently expects the following: Revenue in the range of $78 million to $83 million ; Breakeven to positive Adjusted EBITDA; and Cash breakeven to cash generation. Conference Call Details Aviat Networks will host a conference call at 8:30 a.m. ET on October 1, 2015 to discuss its financial results. To listen to the live conference call, please dial toll free 888-395-3227 or 719-325-2402, access code 8371663, by 8:20 a.m. ET . Investors are invited to listen via webcast, which will be broadcast live and via replay approximately two hours after the call at http://investors.aviatnetworks.com/events.cfm . Non-GAAP Measures and Comparative Financial Information Aviat Networks, Inc. reports information in accordance with U.S. Generally Accepted Accounting Principles (\"GAAP\"). Management of Aviat Networks monitors gross margin, research and development expenses, selling and administrative expenses, operating income or loss, income tax provision or benefit, income or loss from continuing operations attributable to Aviat Networks, basic and diluted income or loss per share from continuing operations attributable to Aviat Networks shareholders, adjusted earnings (losses) before interest, tax, depreciation and amortization (\"Adjusted EBITDA\") attributable to Aviat Networks shareholders adjusted to exclude certain costs, charges, gains and losses, on a non-GAAP basis for planning and forecasting results in future periods, and may use these measures for some management compensation purposes. These measures exclude certain costs, expenses, gains and losses as shown on the attached Reconciliation of Non-GAAP Financial Measures table (table 4). As a result, management is presenting these non-GAAP measures in addition to results reported in accordance with GAAP to better communicate underlying operational and financial performance in each period. Management believes these non-GAAP measures provide information that is useful to investors in understanding period-over-period operating results separate and apart from items that may, or could, have a disproportionate positive or negative impact on results in any given period. Management also believes that these non-GAAP measures enhance the ability of an investor to analyze trends in Aviat Networks' business and to better understand our performance. Aviat Networks' management does not, nor does it suggest that investors should, consider such non-GAAP financial measures in isolation from, or as a substitute for, financial information prepared in accordance with GAAP. Aviat Networks presents these non-GAAP financial measures in reporting its financial results to provide investors with an additional tool to evaluate its financial performance. Reconciliations of these non-GAAP financial measures with the most directly comparable financial measures calculated in accordance with GAAP are included in the tables below. About Aviat Networks Aviat Networks, Inc. (NASDAQ: AVNW ) is a leading global provider of microwave networking solutions transforming communications networks to handle the exploding growth of IP-centric, multi-Gigabit data services. With more than one million systems sold over 140 countries, Aviat Networks provides LTE-proven microwave networking solutions to mobile operators, including some of the largest and most advanced 4G/LTE networks in the world. Public safety, utility, government and defense organizations also trust Aviat Networks' solutions for their mission-critical applications where reliability is paramount. In conjunction with its networking solutions, Aviat Networks provides a comprehensive suite of localized professional and support services enabling customers to effectively and seamlessly migrate to next generation Carrier Ethernet/IP networks. For more than 50 years, customers have relied on Aviat Networks' high performance and scalable solutions to help them maximize their investments and solve their most challenging network problems. Headquartered in Santa Clara, California , Aviat Networks operates in more than 100 countries around the world. For more information, visit www.aviatnetworks.com or connect with Aviat Networks on Twitter , Facebook and LinkedIn . Forward-Looking Statements The information contained in this document includes forward-looking statements within the meaning of the Private Securities Litigation Reform Act of 1995, Section 21E of the Securities Exchange Act and Section 27A of the Securities Act including expectations regarding cash generation, profitability and growth opportunities; and expectations and outlook regarding the first quarter of fiscal year 2016. All statements, trend analyses and other information contained herein about the markets for the services and products of Aviat Networks and trends in revenue, as well as other statements identified by the use of forward-looking terminology, including \"anticipate,\" \"believe,\" \"plan,\" \"estimate,\" \"expect,\" \"goal,\" \"will,\" \"see,\" \"continue,\" \"delivering,\" \"view,\" and \"intend,\" or the negative of these terms or other similar expressions, constitute forward-looking statements. These forward-looking statements are based on estimates reflecting the current beliefs of the senior management of Aviat Networks. These forward-looking statements involve a number of risks and uncertainties that could cause actual results to differ materially from those suggested by the forward-looking statements. Forward-looking statements should therefore be considered in light of various important factors, including those set forth in this document. Important factors that could cause actual results to differ materially from estimates or projections contained in the forward-looking statements include the following: material weaknesses identified in our system of internal control and associated remediation efforts and investments and other actions needed to remedy those material weaknesses; continued price and margin erosion as a result of increased competition in the microwave transmission industry; the impact of the volume, timing and customer, product and geographic mix of our product orders; our ability to meet financial covenant requirements which could impact our liquidity; our ability to meet projected new product development dates or anticipated cost reductions of new products; our suppliers' inability to perform and deliver on time as a result of their financial condition, component shortages or other supply chain constraints; customer acceptance of new products; the ability of our subcontractors to timely perform; continued weakness in the global economy affecting customer spending; retention of our key personnel; our ability to manage and maintain key customer relationships; uncertain economic conditions in the telecommunications sector combined with operator and supplier consolidation; the timing of our receipt of payment for products or services from our customers; our failure to protect our intellectual property rights or defend against intellectual property infringement claims by others; the results of restructuring efforts; the effects of currency and interest rate risks; and the impact of political turmoil in countries where we have significant business. For more information regarding the risks and uncertainties for our business, see \"Risk Factors\" in our Form 10-K filed with the U.S. Securities and Exchange Commission (\"SEC\") on December 19, 2014 as well as other reports filed by Aviat Networks, Inc. with the SEC from time to time. Aviat Networks undertakes no obligation to update publicly any forward-looking statement for any reason, except as required by law, even as new information becomes available or other events occur in the future. Financial Tables to Follow:", "external_links": [], "published": "2015-10-01T09:59:00.000+03:00", "crawled": "2015-10-01T09:45:52.541+03:00", "highlightTitle": ""}