{"organizations": ["U.S. Securities and Exchange Commission", "Board of Directors", "Alibaba", "Youku Tudou Inc.", "Conyers Dill & Pearman", "Alibaba Group Holding Limited", "J.P. Morgan Securities", "Meagher & Flom LLP", "Youku Tudou Special Committee Engages Financial Advisor and Legal Counsel Youku Tudou Special Committee Engages Financial Advisor and Legal Counsel   Youku Tudou Special Committee Engages Financial Advisor"], "uuid": "c145bf3743566ca9691953eeac17f2902259b5b1", "thread": {"social": {"gplus": {"shares": 0}, "pinterest": {"shares": 0}, "vk": {"shares": 0}, "linkedin": {"shares": 0}, "facebook": {"likes": 0, "shares": 0, "comments": 0}, "stumbledupon": {"shares": 0}}, "site_full": "science-technology.news-articles.net", "main_image": "", "site_section": "http://science-technology.news-articles.net/content/rss.php", "section_title": "Science and Technology @ News Articles Network", "url": "http://science-technology.news-articles.net/content/youku-tudou-special-committee-engages-financial-advisor-legal-counsel.xhtml", "country": "US", "title": "Youku Tudou Special Committee Engages Financial Advisor and Legal Counsel", "performance_score": 0, "site": "news-articles.net", "participants_count": 0, "title_full": "Youku Tudou Special Committee Engages Financial Advisor and Legal Counsel", "spam_score": 0.0, "site_type": "news", "published": "2015-10-22T23:15:00.000+03:00", "replies_count": 0, "uuid": "c145bf3743566ca9691953eeac17f2902259b5b1"}, "author": "", "url": "http://science-technology.news-articles.net/content/youku-tudou-special-committee-engages-financial-advisor-legal-counsel.xhtml", "ord_in_thread": 0, "title": "Youku Tudou Special Committee Engages Financial Advisor and Legal Counsel", "locations": ["Arps", "U.S.", "Skadden", "Cayman Islands", "Asia Pacific", "BEIJING", "China"], "entities": {"persons": [], "locations": [], "organizations": []}, "highlightText": "", "language": "english", "persons": ["Youku Tudou", "Ryan Cheung"], "text": "Youku Tudou Special Committee Engages Financial Advisor and Legal Counsel   Youku Tudou Special Committee Engages Financial Advisor and Legal Counsel -- BEIJING, Oct. 22, 2015 /PRNewswire/ --  > BEIJING , Oct. 22, 2015 /PRNewswire/ -- Youku Tudou Inc. (NYSE: YOKU ), a leading multi-screen entertainment and media company in China (\"Youku Tudou\" or the \"Company\"), today announced that the independent special committee of the Company's Board of Directors (the \"Special Committee\") has retained J.P. Morgan Securities ( Asia Pacific ) Limited as its financial advisor, Skadden, Arps, Slate, Meagher & Flom LLP as its U.S. legal counsel and Conyers Dill & Pearman as its Cayman Islands legal counsel in connection with its review and evaluation of the nonbinding proposal, dated October 16, 2015 , from Alibaba Group Holding Limited (\"Alibaba\") for a \"going-private\" transaction in which it would acquire all of the outstanding ordinary shares of the Company, including ordinary shares represented by American depositary shares (each representing 18 ordinary shares of the Company), that are not owned by Alibaba. The board of directors cautions the Company's shareholders and others considering trading in its securities that no decision has been made on the response to the proposal. There can be no assurance that any definitive offer will be made, that any agreement will be executed or that this or any other transaction will be approved or consummated. The Company does not undertake any obligation to provide any updates with respect to this or any other transaction, except as required under applicable law. About Youku Tudou Inc. Youku Tudou Inc. (NYSE: YOKU ) is a leading multi-screen entertainment and media company in China . Youku Tudou is China's leading Internet television platform, enabling users to search, view and share high-quality video content quickly and easily across multiple devices. Its Youku brand and Tudou brand are among the most recognized online video brands in China . Youku Tudou's American depositary shares, each representing 18 of Youku Tudou's Class A ordinary shares, are traded on the NYSE under the symbol \"YOKU.\" Safe Harbor Statement This announcement contains forward-looking statements. These forward-looking statements can be identified by terminology such as \"will,\" \"expects,\" \"anticipates,\" \"future,\" \"intends,\" \"plans,\" \"believes,\" \"estimates,\" \"may,\" \"intend,\" \"confident,\" \"is currently reviewing,\" \"it is possible,\" \"subject to\" and similar statements. Youku Tudou may also make written or oral forward-looking statements in its reports filed or furnished with the U.S. Securities and Exchange Commission, including Forms 20-F and 6-K, in its annual report to shareholders, in press releases and other written materials and in oral statements made by its officers, directors or employees to third parties. Statements that are not historical facts, including statements about Youku Tudou's beliefs and expectations, are forward-looking statements and are subject to change. Forward-looking statements involve inherent risks and uncertainties. A number of important factors could cause actual results to differ materially from those contained, either expressly or impliedly, in any of the forward-looking statements in this press release. Potential risks and uncertainties are outlined in Youku Tudou's filings with the U.S. Securities and Exchange Commission. All information provided in this press release is current as of the date of this press release, and Youku Tudou does not undertake any obligation to update any such information, except as required under applicable law. For more information, please contact: Ryan Cheung", "external_links": [], "published": "2015-10-22T23:15:00.000+03:00", "crawled": "2015-10-22T23:00:37.160+03:00", "highlightTitle": ""}