{"organizations": ["NASA", "CNN Leadership <div class=\"banner\" id=\"cnn_300x250_sync_freewheel-rail_0_banner\"><span id=\"cnn_300x250_sync_freewheel-rail_0\" class=\"_fwph\"><form id=\"_fw_form_cnn_300x250_sync_freewheel-rail_0\" style=\"display:none\"><input type=\"hidden\" name=\"_fw_input_cnn_300x250_sync_freewheel-rail_0\" id=\"_fw_input_cnn_300x250_sync_freewheel-rail_0\" value=\"ptgt=s&envp=g_js&w=300&h=250&slau=300x250_sync&adUnit=300x250_sync\"></form><span id=\"_fw_container_cnn_300x250_sync_freewheel-rail_0\" class=\"cn-shingle__ad\"></span></span></div> Treasure", "Melonyce McAfee", "CNN"], "uuid": "f1fecd16a361c57fb02b90a1819204257c06da31", "thread": {"social": {"gplus": {"shares": 0}, "pinterest": {"shares": 0}, "vk": {"shares": 0}, "linkedin": {"shares": 0}, "facebook": {"likes": 0, "shares": 0, "comments": 0}, "stumbledupon": {"shares": 0}}, "site_full": "edition.cnn.com", "main_image": "http://i2.cdn.turner.com/cnnnext/dam/assets/151006181849-27-astronauts-on-the-moon-large-169.jpg", "site_section": "http://rss.cnn.com/rss/cnn_tech.rss", "section_title": "CNN.com - Technology", "url": "http://edition.cnn.com/2015/10/07/tech/moon-photos-nasa-feat/index.html?eref=rss_tech", "country": "US", "title": "Treasure trove of Apollo moon photos released", "performance_score": 0, "site": "cnn.com", "participants_count": 0, "title_full": "Treasure trove of Apollo moon photos released", "spam_score": 0.0, "site_type": "news", "published": "2015-10-08T20:25:00.000+03:00", "replies_count": 0, "uuid": "f1fecd16a361c57fb02b90a1819204257c06da31"}, "author": "", "url": "http://edition.cnn.com/2015/10/07/tech/moon-photos-nasa-feat/index.html?eref=rss_tech", "ord_in_thread": 0, "title": "Treasure trove of Apollo moon photos released", "locations": ["moon", "Earth"], "entities": {"persons": [], "locations": [], "organizations": []}, "highlightText": "", "language": "english", "persons": ["Harrison Schmitt", "Schweickart", "Lovell", "Aldrin", "Russell Schweickart", "Alan Shepard", "John Young", "Buzz Aldrin", "Walter Cunningham", "Alan Bean", "David Scott", "Neil Armstrong", "Fred Haise", "Jim Lovell", "Pete Conrad", "John Swigert", "Charlie Duke"], "text": "CNN Leadership <div class=\"banner\" id=\"cnn_300x250_sync_freewheel-rail_0_banner\"><span id=\"cnn_300x250_sync_freewheel-rail_0\" class=\"_fwph\"><form id=\"_fw_form_cnn_300x250_sync_freewheel-rail_0\" style=\"display:none\"><input type=\"hidden\" name=\"_fw_input_cnn_300x250_sync_freewheel-rail_0\" id=\"_fw_input_cnn_300x250_sync_freewheel-rail_0\" value=\"ptgt=s&envp=g_js&w=300&h=250&slau=300x250_sync&adUnit=300x250_sync\"></form><span id=\"_fw_container_cnn_300x250_sync_freewheel-rail_0\" class=\"cn-shingle__ad\"></span></span></div> Treasure trove of Apollo moon photos released By Melonyce McAfee, CNN Updated 1240 GMT (1940 HKT) October 8, 2015 27 photos: Photos from NASA's Apollo missions With Earth in the background, NASA astronaut David Scott works in space during the Apollo 9 mission in March 1969. More than 8,000 photos from NASA's Apollo missions were recently uploaded to Flickr. Here are a few from each mission. Hide Caption 1 of 27 27 photos: Photos from NASA's Apollo missions Astronaut Walter Cunningham aboard Apollo 7 in October 1968. Apollo 7 was the first manned Apollo flight. Hide Caption 2 of 27 27 photos: Photos from NASA's Apollo missions Apollo 7 was a test flight around Earth that laid the foundation for future trips to the moon. Hide Caption 3 of 27 27 photos: Photos from NASA's Apollo missions The moon, as seen from Apollo 8 in December 1968. Apollo 8 orbited the moon and broadcast television images back to Earth. NASA used red and blue filters for the TV feed. Hide Caption 4 of 27 27 photos: Photos from NASA's Apollo missions Apollo 9 tested a lunar module above Earth to make sure it was ready to carry astronauts on a future trip to the moon. Hide Caption 27 photos: Photos from NASA's Apollo missions Astronaut Russell Schweickart's feet are seen during one of Apollo 9's spaceflights. Hide Caption 27 photos: Photos from NASA's Apollo missions Schweickart operates a 70-millimeter Hasselblad camera during the fourth day of Apollo 9's mission. Hide Caption 7 of 27 27 photos: Photos from NASA's Apollo missions During Apollo 10, the lunar module was flown around the moon as a \"dress rehearsal\" for a later landing. Hide Caption 8 of 27 27 photos: Photos from NASA's Apollo missions Apollo 11 commander Neil Armstrong is photographed inside the lunar module after he and Buzz Aldrin walked on the moon's surface on July 20, 1969. Hide Caption 9 of 27 27 photos: Photos from NASA's Apollo missions Aldrin walks down the steps of the lunar module, codenamed \"Eagle,\" as he prepares to walk on the moon. Hide Caption 27 photos: Photos from NASA's Apollo missions A close-up view of an astronaut's boot on the moon's surface during Apollo 11. Hide Caption 27 photos: Photos from NASA's Apollo missions Apollo 12, in November 1969, also put astronauts on the lunar surface. Hide Caption 12 of 27 27 photos: Photos from NASA's Apollo missions Astronaut Alan Bean holds a sample of lunar soil during Apollo 12. Pete Conrad's reflection can be seen in Bean's visor as he takes the photo. Hide Caption 13 of 27 27 photos: Photos from NASA's Apollo missions This shot of the moon's surface was taken aboard Apollo 13, which famously had to abort its landing and return to Earth after an explosion threatened the crew. Hide Caption 14 of 27 27 photos: Photos from NASA's Apollo missions Astronaut John Swigert, right, and the other two astronauts aboard Apollo 13 -- Fred Haise and Jim Lovell -- safely returned to Earth after improvising a solution to the craft's carbon-dioxide removal system. Hide Caption 27 photos: Photos from NASA's Apollo missions A close-up of the \"mailbox\" solution that saved the astronauts aboard Apollo 13. Hide Caption 27 photos: Photos from NASA's Apollo missions Lovell sleeps in the lunar module of Apollo 13. Hide Caption 17 of 27 27 photos: Photos from NASA's Apollo missions Apollo 14 commander Alan Shepard poses next to the American flag while walking on the moon's surface in February 1971. Hide Caption 27 photos: Photos from NASA's Apollo missions David Scott rides a lunar rover during the Apollo 15 mission in July 1971. Hide Caption 27 photos: Photos from NASA's Apollo missions Scott studies a boulder on the moon during Apollo 15. Hide Caption 27 photos: Photos from NASA's Apollo missions The lunar module from Apollo 15 is seen in orbit. Hide Caption 27 photos: Photos from NASA's Apollo missions Apollo 16 commander John Young examines a boulder on the moon in April 1972. Hide Caption 27 photos: Photos from NASA's Apollo missions Astronaut Charlie Duke tries to break a sample loose during Apollo 16. Hide Caption 27 photos: Photos from NASA's Apollo missions An astronaut works in space as Apollo 17 orbits the moon in December 1972. Hide Caption 24 of 27 27 photos: Photos from NASA's Apollo missions Apollo 17 was the last of the Apollo missions. Humans have not been to the moon since. Hide Caption 27 photos: Photos from NASA's Apollo missions An astronaut rides on a lunar module during Apollo 17. Hide Caption 26 of 27 27 photos: Photos from NASA's Apollo missions Astronaut Harrison Schmitt is photographed next to the American flag while walking on the moon during Apollo 17. Hide Caption", "external_links": [], "published": "2015-10-08T20:25:00.000+03:00", "crawled": "2015-10-08T21:06:18.807+03:00", "highlightTitle": ""}