{"organizations": ["Center for Transportation Training and Research", "Transportation Research Board", "Oakland", "AC Transit", "Texas Southern University", "Department of Transportation Studies", "Sharon D. Banks Award Recipient Transportation Research Board", "Walter E. Washington Convention Center", "National Academies of Sciences", "TRB Executive Committee", "National Academy of Sciences", "Sharon D. Banks Award for Humanitarian Leadership"], "uuid": "5b0968854a70e1466cad8ce52187898a7531ce46", "thread": {"social": {"gplus": {"shares": 0}, "pinterest": {"shares": 0}, "vk": {"shares": 0}, "linkedin": {"shares": 0}, "facebook": {"likes": 0, "shares": 0, "comments": 0}, "stumbledupon": {"shares": 0}}, "site_full": "www.trb.org", "main_image": "", "site_section": "http://www.trb.org/Rss.aspx?sn=DataandInformationTechnologyRSSFeed", "section_title": "Data and Information Technology RSS Feed", "url": "http://www.trb.org/Main/Blurbs/169761.aspx", "country": "US", "title": "2016 TRB Annual Meeting: Carol A. Lewis, 2016 Sharon D. Banks Award Recipient", "performance_score": 0, "site": "trb.org", "participants_count": 0, "title_full": "2016 TRB Annual Meeting: Carol A. Lewis, 2016 Sharon D. Banks Award Recipient", "spam_score": 0.0, "site_type": "news", "published": "2015-10-23T07:06:00.000+03:00", "replies_count": 0, "uuid": "5b0968854a70e1466cad8ce52187898a7531ce46"}, "author": "", "url": "http://www.trb.org/Main/Blurbs/169761.aspx", "ord_in_thread": 0, "title": "2016 TRB Annual Meeting: Carol A. Lewis, 2016 Sharon D. Banks Award Recipient", "locations": ["United States", "California", "D.C", "Washington", "Houston", "DC", "Texas"], "entities": {"persons": [], "locations": [], "organizations": []}, "highlightText": "", "language": "english", "persons": ["Sharon", "Lewis", "Sharon D. Banks", "Carol A. Lewis"], "text": "Transportation Research Board > Blurbs > 2016 TRB Annual Meeting: Carol A. Lewis, 2016 Sharon D. Banks Award Recipient Text Size: 2016 TRB Annual Meeting: Carol A. Lewis, 2016 Sharon D. Banks Award Recipient http://www.trb.org/AnnualMeeting/AnnualMeeting.aspx 169761 2016 TRB Annual Meeting: Carol A. Lewis, 2016 Sharon D. Banks Award Recipient Carol A. Lewis, Professor in the Department of Transportation Studies, and Director of the Center for Transportation Training and Research at Texas Southern University, has been selected as the recipient of the Transportation Research Board’s 2016 Sharon D. Banks Award for Humanitarian Leadership in Transportation. She is recognized for her unique blend of transportation accomplishments, successes in the mentoring and nurturing of young people, and tireless promotion of responsible growth and protection of neighborhoods. Lewis' people-oriented approach to planning is credited with the difference in lives of countless students, fellow researchers and professors, younger professionals, community groups, and transit riders throughout the Houston, Texas area. The Banks Award, which will be presented on January 13, 2016, during the Chairman’s Luncheon at the TRB 95th Annual Meeting, honors the memory of Sharon D. Banks, who was General Manager of AC Transit, Oakland, California, from 1991 to 1999 and who chaired the TRB Executive Committee in 1998. She died in 1999. The award recognizes individuals whose accomplishments exemplify her ideals of humanity and service by making a significant difference in the lives of those who use, deliver, or support transportation services. The TRB 95th Annual Meeting takes place January 10-14, 2016, at the Walter E. Washington Convention Center, in Washington, D.C. The meeting covers all transportation issues, with more than 5,000 presentations in nearly 750 sessions. A number of sessions and workshops will focus on the meeting’s spotlight theme: Research Convergence for a Multi-Modal Future. The meeting is expected to attract more than 12,000 transportation professionals from throughout the United States and 70 other countries. This Summary Last Modified On: 10/23/2015 The National Academies of Sciences, Engineering, and Medicine 500 Fifth Street, NW | Washington, DC 20001 | T: 202.334.2000 Copyright © 2015 National Academy of Sciences. All Rights Reserved. Terms of Use and Privacy Statement Loading...", "external_links": [], "published": "2015-10-23T07:06:00.000+03:00", "crawled": "2015-10-23T16:20:08.266+03:00", "highlightTitle": ""}