{"organizations": ["Číne", "Ltd", "Penang", "Pekingu", "Ltd.", "Malajzii", "JA Solar Holdings Co."], "uuid": "f6ac190ce8f69e0732c278da9d3c6590173b0cfd", "thread": {"social": {"gplus": {"shares": 0}, "pinterest": {"shares": 0}, "vk": {"shares": 0}, "linkedin": {"shares": 0}, "facebook": {"likes": 0, "shares": 0, "comments": 0}, "stumbledupon": {"shares": 0}}, "site_full": "science-technology.news-articles.net", "main_image": "", "site_section": "http://science-technology.news-articles.net/content/rss.php", "section_title": "Science and Technology @ News Articles Network", "url": "http://science-technology.news-articles.net/content/solar-spta-vrobu-solrnych-panelov-malajzii.xhtml", "country": "US", "title": "JA Solar spta vrobu solrnych panelov 400MW v Malajzii", "performance_score": 0, "site": "news-articles.net", "participants_count": 0, "title_full": "JA Solar spta vrobu solrnych panelov 400MW v Malajzii", "spam_score": 0.0, "site_type": "news", "published": "2015-10-26T11:40:00.000+02:00", "replies_count": 0, "uuid": "f6ac190ce8f69e0732c278da9d3c6590173b0cfd"}, "author": "", "url": "http://science-technology.news-articles.net/content/solar-spta-vrobu-solrnych-panelov-malajzii.xhtml", "ord_in_thread": 0, "title": "JA Solar spta vrobu solrnych panelov 400MW v Malajzii", "locations": ["PENANG", "Malajzia", "Malaysia", "China"], "entities": {"persons": [], "locations": [], "organizations": []}, "highlightText": "", "language": "english", "persons": ["Pán Baofang Jin", "Bayan Lepas"], "text": "JA Solar spta vrobu solrnych panelov 400MW v Malajzii   <-   Prvá výrobný podnik mimo Číny - PENANG , Malajzia, 26. októbra 2015 /PRNewswire/ -- JA Solar Holdings Co., Ltd. (Nasdaq: [[UEdFZ2NtVnNQVndpYm05bWIyeHNiM2RjSWlCb2NtVm1QU2RvZEhSd09pOHZjM1IxWkdsdkxUVXVabWx1WVc1amFXRnNZMjl1ZEdWdWRDNWpiMjB2Y0hKdVpYZHpQMUJoWjJVOVVYVnZkR1VtVkdsamEyVnlQVXBCVTA4bklIUmhjbWRsZEQwblgySnNZVzVySnlCMGFYUnNaVDBuU2tGVFR5Y2diMjVqYkdsamF6MG5iR2x1YTA5dVEyeHBZMnNvZEdocGN5a25JSEpsYkQwbmJtOW1iMnhzYjNjblBrcEJVMDg4TDJFK3w=]]) („JA Solar\" alebo „spoločnosť\"), jeden z najväčších svetových výrobcov vysokovýkonných produktov na výrobu solárnej energie, dnes oznámila, že spúšťa výrobu vysokovýkonných fotovoltaických (PV) solárnych panelov 400MW („podnik\") v malajzijskom Penangu. Logo - [[UEdFZ2NtVnNQVndpYm05bWIyeHNiM2RjSWlCdmJtTnNhV05yUFNkc2FXNXJUMjVEYkdsamF5aDBhR2x6S1NjZ2FISmxaajFjSW1oMGRIQTZMeTl3YUc5MGIzTXVjSEp1WlhkemQybHlaUzVqYjIwdmNISnVhQzh5TURFMU1EVXlNaTh5TVRnd05EWk1UMGRQWENJZ2NtVnNQVndpYm05bWIyeHNiM2RjSWlCMFlYSm5aWFE5WENKZllteGhibXRjSWo1b2RIUndPaTh2Y0dodmRHOXpMbkJ5Ym1WM2MzZHBjbVV1WTI5dEwzQnlibWd2TWpBeE5UQTFNakl2TWpFNE1EUTJURTlIVHp3dllUND18]] Novootvorený podnik je prvým výrobným podnikom spoločnosti JA Solar mimo územia Číny China a svojim vybavením ponúka možnosť vyrábať vysokovýkonné multikryštalické solárne panely pre fotovoltaické elektrárne. Tieto panely budú primárne využité na výrobu modulov od JA Solar mimo Číny s cieľom poskytnúť konkurenčné produkty pre zámorské trhy. Spoločnosť JA Solar investovala približne 300 miliónov MYR do výrobného podniku nachádzajúceho sa v industriálnom parku Penang Bayan Lepas. Nový podnik vytvorí 700 pracovných príležitostí pre miestnu ekonomiku a je pripravený na expanziu výrobnej kapacity, ak to budúci rast dopytu bude vyžadovať. Pán Baofang Jin , prezident a výkonný riaditeľ spoločnosti JA Solar uviedol: „Sme radi, že môžeme spustiť výrobnú prevádzku v Malajzii, nakoľko je to krajina, ktorá ponúka mnoho atraktívnych možností, priateľské prostredie pre investície a podporu pre vznik obchodných príležitostí. Strategická poloha mesta Penang v juhovýchodnej časti Ázie, jej prístup k letiskám a prístavom, ako aj dostupnosť spoľahlivej infraštruktúry, to sú všetko výhody tejto novej výrobnej prevádzky, ktoré nás pri objavovaní nových vývozných trhov oslovili. „S radosťou oznamujeme, že JA Solar Malaysia spĺňa všetky miestne predpisy, že získala potrebné obchodné, výrobné a environmentálne licencie a potvrdenia od štátnych orgánov, vrátane Malajzijského úradu pre investičný rozvoj a Ministerstva životného prostredia. Naďalej budeme pokračovať v spolupráci s príslušnými federálnymi a štátnymi orgánmi v záujme dodržiavania všetkých predpisov a nariadení.\" O spoločnosti JA Solar Holdings Co., Ltd. JA Solar Holdings Co., Ltd. je popredným výrobcom vysokovýkonných produktov na výrobu solárnej energie, ktorá premieňa slnečný svit na elektrinu pre účely domácností, obchodných prevádzok a verejného sektoru. Spoločnosť je jedným z najväčších svetových výrobcov produktov na výrobu solárnej energie. Jej štandardné a vysokovýkonné produkty sa radia medzi svetovúšpičku vo výkonnosti a úspore nákladov. Spoločnosť distribuuje svoje produkty pod vlastnou značkou, ale vyrába aj pod hlavičkou svojich klientov. Produkty, ktoré táto spoločnosť vyexpedovala v roku 2014, dokážu vyrobiť až 3,1 GW solárnej energie. JA Solar má vedenie v Pekingu, v Číne a svoje výrobné podniky má v Číne a v Malajzii. \nSOURCE JA Solar Holdings Co., Ltd. Served by: 127.0.0.1 ~ (c) 2004 - 2015, News Articles Network » Categories", "external_links": [], "published": "2015-10-26T11:40:00.000+02:00", "crawled": "2015-10-26T11:23:31.308+02:00", "highlightTitle": ""}