{"organizations": ["Infosys Infosys", "Accelerate Creation of App Solutions", "Infosys", "IBM", "United States Securities and Exchange Commission", "Infosys Innovation Lab", "Infosys Logo", "Securities and Exchange Commission"], "uuid": "12141a0aca8c6b0f94a687c9926f80b8c39b8c6f", "thread": {"social": {"gplus": {"shares": 0}, "pinterest": {"shares": 0}, "vk": {"shares": 0}, "linkedin": {"shares": 0}, "facebook": {"likes": 0, "shares": 0, "comments": 0}, "stumbledupon": {"shares": 0}}, "site_full": "science-technology.news-articles.net", "main_image": "", "site_section": "http://science-technology.news-articles.net/content/rss.php", "section_title": "Science and Technology @ News Articles Network", "url": "http://science-technology.news-articles.net/content/infosys-creates-ibm-bluemix-powered-innovation-lab-accelerate-creation-app-solutions.xhtml", "country": "US", "title": "Infosys Creates IBM Bluemix-powered Innovation Lab to Accelerate Creation of App Solutions", "performance_score": 0, "site": "news-articles.net", "participants_count": 0, "title_full": "Infosys Creates IBM Bluemix-powered Innovation Lab to Accelerate Creation of App Solutions", "spam_score": 0.0, "site_type": "news", "published": "2015-10-16T16:11:00.000+03:00", "replies_count": 0, "uuid": "12141a0aca8c6b0f94a687c9926f80b8c39b8c6f"}, "author": "", "url": "http://science-technology.news-articles.net/content/infosys-creates-ibm-bluemix-powered-innovation-lab-accelerate-creation-app-solutions.xhtml", "ord_in_thread": 0, "title": "Infosys Creates IBM Bluemix-powered Innovation Lab to Accelerate Creation of App Solutions", "locations": ["BANGALORE", "India"], "entities": {"persons": [], "locations": [], "organizations": []}, "highlightText": "", "language": "english", "persons": ["Srikantan Moorthy", "Steve Robinson", "Bluemix"], "text": "Infosys Creates IBM Bluemix-powered Innovation Lab to Accelerate Creation of App Solutions  16 05:30:11 Infosys Creates IBM Bluemix-powered Innovation Lab to Accelerate Creation of App Solutions -- BANGALORE, October 16,   Infosys Logo  ><- stripped tags -> BANGALORE , October 16,   IBM and Infosys (NYSE: [[UEdFZ2NtVnNQVndpYm05bWIyeHNiM2RjSWlCb2NtVm1QU2RvZEhSd09pOHZjM1IxWkdsdkxUVXVabWx1WVc1amFXRnNZMjl1ZEdWdWRDNWpiMjB2Y0hKdVpYZHpQMUJoWjJVOVVYVnZkR1VtVkdsamEyVnlQVWxPUmxrbklIUmhjbWRsZEQwblgySnNZVzVySnlCMGFYUnNaVDBuU1U1R1dTY2diMjVqYkdsamF6MG5iR2x1YTA5dVEyeHBZMnNvZEdocGN5a25JSEpsYkQwbmJtOW1iMnhzYjNjblBrbE9SbGs4TDJFK3w=]]), a global leader in consulting, technology, outsourcing and next-generation services, today announced a collaboration in which Infosys will tap Bluemix, IBM's Cloud platform to rapidly prototype, develop and deploy the next generation of Cloud apps for its global client base. (Logo: [[UEdFZ2NtVnNQVndpYm05bWIyeHNiM2RjSWlCdmJtTnNhV05yUFNkc2FXNXJUMjVEYkdsamF5aDBhR2x6S1NjZ2RHRnlaMlYwUFNkZllteGhibXNuSUdoeVpXWTlYQ0pvZEhSd09pOHZjR2h2ZEc5ekxuQnlibVYzYzNkcGNtVXVZMjl0TDNCeWJtZ3ZNakF4TXpBeE1qSXZOVGc1TVRZeVhDSWdjbVZzUFZ3aWJtOW1iMnhzYjNkY0lqNW9kSFJ3T2k4dmNHaHZkRzl6TG5CeWJtVjNjM2RwY21VdVkyOXRMM0J5Ym1ndk1qQXhNekF4TWpJdk5UZzVNVFl5UEM5aFBnPT18]]) The collaboration includes the launch of Bluemix-powered Innovation Lab for co-creation of apps with clients; training of Infosys developers on Bluemix and cloud app development skills; as well as Infosys' adoption of Bluemix dedicated to leverage its vast library of cognitive computing and analytics solutions and other services to build client apps. Srikantan Moorthy , Head of Application Development and Maintenance, Infosys , said, \"Digital transformation is unleashing the power of smarter processes for our clients. Our goal is to bring these advanced technologies to clients' application landscape in the most rapid and collaborative way possible. Infosys will also incorporate Bluemix-related curriculum into its on-boarding and training process.\" Steve Robinson , General Manager, IBM Cloud , said, \"Today a massive digital transformation is underway unpinned by the disruptive forces of cognitive computing, analytics and IoT all delivered through the cloud. Through Bluemix, developers can accelerate the deployment of these next-generation apps that leverage the most innovative advancements in technology. This collaboration with Infosys will further advance our joint clients journey and the adoption of Bluemix.\" Powered by Bluemix, the Infosys Innovation Lab will function as a place to innovate and co-create apps with a broad range of global clients. Staffed with a dedicated team of designers, extreme agile specialists, and industry and technology architects, the Lab is designed to rapidly deliver app prototypes. IBM launched Bluemix with a US$ 1 billion investment in 2014, that matured quickly to become the largest Cloud Foundry deployments in the world, and providing a developer-friendly catalog of over 120 tools and software-services, combining the most prominent open-source, IBM and third-party technologies. About Infosys Infosys is a global leader in consulting, technology, outsourcing and next-generation services. We enable clients, in more than 50 countries, to stay a step ahead of emerging business trends and outperform the competition. We help them transform and thrive in a changing world by co-creating breakthrough solutions that combine strategic insights and execution excellence. Visit http://www.infosys.com to see how Infosys (NYSE: INFY ), with US$ 8.7 billion in annual revenues and 187,000+ employees, is helping enterprises renew themselves while also creating new avenues to generate value. Safe Harbor Certain statements in this press release concerning our future growth prospects are forward-looking statements regarding our future business expectations intended to qualify for the 'safe harbor' under the Private Securities Litigation Reform Act of 1995, which involve a number of risks and uncertainties that could cause actual results to differ materially from those in such forward-looking statements. The risks and uncertainties relating to these statements include, but are not limited to, risks and uncertainties regarding fluctuations in earnings, fluctuations in foreign exchange rates, our ability to manage growth, intense competition in IT services including those factors which may affect our cost advantage, wage increases in India , our ability to attract and retain highly skilled professionals, time and cost overruns on fixed-price, fixed-time frame contracts, client concentration, restrictions on immigration, industry segment concentration, our ability to manage our international operations, reduced demand for technology in our key focus areas, disruptions in telecommunication networks or system failures, our ability to successfully complete and integrate potential acquisitions, liability for damages on our service contracts, the success of the companies in which Infosys has made strategic investments, withdrawal or expiration of governmental fiscal incentives, political instability and regional conflicts, legal restrictions on raising capital or acquiring companies outside India , and unauthorized use of our intellectual property and general economic conditions affecting our industry. Additional risks that could affect our future operating results are more fully described in our United States Securities and Exchange Commission filings including our Annual Report on Form 20-F for the fiscal year ended March 31, 2015 . These filings are available at http://www.sec.gov . Infosys may, from time to time, make additional written and oral forward-looking statements, including statements contained in the company's filings with the Securities and Exchange Commission and our reports to shareholders. Any forward-looking statements contained herein are based on assumptions that we believe to be reasonable as of this date. The company does not undertake to update any forward-looking statements that may be made from time to time by or on behalf of the company unless it is required by law. \nSOURCE Infosys Served by: 127.0.0.1 ~ (c) 2004 - 2015, News Articles Network Â» Categories", "external_links": [], "published": "2015-10-16T16:11:00.000+03:00", "crawled": "2015-10-16T15:57:02.764+03:00", "highlightTitle": ""}