{"organizations": ["Communications and Services", "LLC", "Infosys Infosys", "Infosys", "United States Securities and Exchange Commission", "Infosys Logo", "Securities and Exchange Commission", "Global Head of Energy"], "uuid": "a1ee644e5e015e8d5ac7931c98accb8d063bd65b", "thread": {"social": {"gplus": {"shares": 0}, "pinterest": {"shares": 0}, "vk": {"shares": 0}, "linkedin": {"shares": 0}, "facebook": {"likes": 0, "shares": 0, "comments": 0}, "stumbledupon": {"shares": 0}}, "site_full": "science-technology.news-articles.net", "main_image": "", "site_section": "http://science-technology.news-articles.net/content/rss.php", "section_title": "Science and Technology @ News Articles Network", "url": "http://science-technology.news-articles.net/content/infosys-acquire-noah-consulting-million.xhtml", "country": "US", "title": "Infosys to Acquire Noah Consulting for US$70 Million", "performance_score": 0, "site": "news-articles.net", "participants_count": 0, "title_full": "Infosys to Acquire Noah Consulting for US$70 Million", "spam_score": 0.0, "site_type": "news", "published": "2015-10-19T12:44:00.000+03:00", "replies_count": 0, "uuid": "a1ee644e5e015e8d5ac7931c98accb8d063bd65b"}, "author": "", "url": "http://science-technology.news-articles.net/content/infosys-acquire-noah-consulting-million.xhtml", "ord_in_thread": 0, "title": "Infosys to Acquire Noah Consulting for US$70 Million", "locations": ["BANGALORE", "India"], "entities": {"persons": [], "locations": [], "organizations": []}, "highlightText": "", "language": "english", "persons": ["Noah", "Rajesh Murthy", "John Ruddy", "Sanjay Purohit"], "text": "Infosys to Acquire Noah Consulting for US$70 Million   Infosys to Acquire Noah Consulting for US$70 Million -- BANGALORE, October 19,   Infosys Logo  ><- stripped tags -> BANGALORE , October 19,   Infosys (NYSE: [[UEdFZ2NtVnNQVndpYm05bWIyeHNiM2RjSWlCb2NtVm1QU2RvZEhSd09pOHZjM1IxWkdsdkxUVXVabWx1WVc1amFXRnNZMjl1ZEdWdWRDNWpiMjB2Y0hKdVpYZHpQMUJoWjJVOVVYVnZkR1VtVkdsamEyVnlQVWxPUmxrbklISmxiRDBuYm05bWIyeHNiM2NuSUhSaGNtZGxkRDBuWDJKc1lXNXJKeUIwYVhSc1pUMG5TVTVHV1NjZ2IyNWpiR2xqYXowbmJHbHVhMDl1UTJ4cFkyc29kR2hwY3lrbklISmxiRDBuYm05bWIyeHNiM2NuUGtsT1JsazhMMkUrfA==]]), a global leader in consulting, technology, outsourcing and next generation services, today announced a definitive agreement to acquire Noah Consulting, LLC, a leading provider of advanced information management consulting services for the oil and gas industry. This acquisition was an all-cash deal, with an aggregate purchase consideration of US$70 million . (Logo: [[UEdFZ2NtVnNQVndpYm05bWIyeHNiM2RjSWlCdmJtTnNhV05yUFNkc2FXNXJUMjVEYkdsamF5aDBhR2x6S1NjZ2RHRnlaMlYwUFNkZllteGhibXNuSUdoeVpXWTlYQ0pvZEhSd09pOHZjR2h2ZEc5ekxuQnlibVYzYzNkcGNtVXVZMjl0TDNCeWJtZ3ZNakF4TXpBeE1qSXZOVGc1TVRZeVhDSWdjbVZzUFZ3aWJtOW1iMnhzYjNkY0lqNW9kSFJ3T2k4dmNHaHZkRzl6TG5CeWJtVjNjM2RwY21VdVkyOXRMM0J5Ym1ndk1qQXhNekF4TWpJdk5UZzVNVFl5UEM5aFBnPT18]] ) Noah Consulting helps upstream oil and gas companies, including super majors, independents and oil field service companies plan, architect and deploy information solutions to unlock the value of their oil and gas assets. Noah's deep domain expertise in upstream oil and gas, coupled with their tools, solution accelerators and proprietary methodologies, makes them a leader in driving strategic data management engagements. This acquisition combines Noah's deep industry knowledge, information strategy planning, data governance and architecture capabilities with Infosys' ability to provide technology and outsourcing services on a global scale to oil and gas clients. Commenting on the acquisition, Rajesh Murthy , EVP and Global Head of Energy, Communications and Services, Infosys, said, \"The upstream oil and gas industry is facing unprecedented challenges that demand faster and better ways of achieving return on investment. This requires a well-defined and executed information and data management strategy that will allow companies to increase efficiencies across the life cycle - from exploration to production. With this acquisition, we are uniquely positioned to offer end-to-end data management services to oil and gas companies globally.\" \"Our oil and gas clients are adjusting to a new normal of lower oil prices. There is an urgency to improve the efficiency and effectiveness of their operations in a safe and reliable manner. This acquisition is part of Infosys' strategy to bring next generation data analytics solutions to the oil and gas industry,\" said Sanjay Purohit , EVP and Global Head of Infosys Consulting . John Ruddy , President of Noah Consulting, said, \"We are excited about the new capabilities that the combination of Noah and Infosys will bring to our clients. Together, we can effect transformational change for our oil and gas clients by using information management to integrate supply chain, safety, environmental and financial data with geoscience, engineering and other operational and technical data - an industry challenge that has never been addressed effectively. We look forward to making a difference together.\" The transaction is expected to close before the end of the third quarter of FY 2016, subject to customary closing conditions. About Infosys Infosys is a global leader in consulting, technology, outsourcing and next-generation services. We enable clients, in more than 50 countries, to stay a step ahead of emerging business trends and outperform the competition. We help them transform and thrive in a changing world by co-creating breakthrough solutions that combine strategic insights and execution excellence. Visit [[UEdFZ2NtVnNQVndpYm05bWIyeHNiM2RjSWlCdmJtTnNhV05yUFNkc2FXNXJUMjVEYkdsamF5aDBhR2x6S1NjZ2RHRnlaMlYwUFNkZllteGhibXNuSUdoeVpXWTlYQ0pvZEhSd09pOHZkM2QzTG1sdVptOXplWE11WTI5dFhDSWdjbVZzUFZ3aWJtOW1iMnhzYjNkY0lqNTNkM2N1YVc1bWIzTjVjeTVqYjIwOEwyRSt8]] to see how Infosys (NYSE: [[UEdFZ2NtVnNQVndpYm05bWIyeHNiM2RjSWlCb2NtVm1QU2RvZEhSd09pOHZjM1IxWkdsdkxUVXVabWx1WVc1amFXRnNZMjl1ZEdWdWRDNWpiMjB2Y0hKdVpYZHpQMUJoWjJVOVVYVnZkR1VtVkdsamEyVnlQVWxPUmxrbklIUmhjbWRsZEQwblgySnNZVzVySnlCMGFYUnNaVDBuU1U1R1dTY2diMjVqYkdsamF6MG5iR2x1YTA5dVEyeHBZMnNvZEdocGN5a25JSEpsYkQwbmJtOW1iMnhzYjNjblBrbE9SbGs4TDJFK3w=]]), with US$ 8.7 billion in annual revenues and 187,000+ employees, is helping enterprises renew themselves while also creating new avenues to generate value. Safe Harbor Certain statements in this press release concerning our future growth prospects are forward-looking statements regarding our future business expectations intended to qualify for the 'safe harbor' under the Private Securities Litigation Reform Act of 1995, which involve a number of risks and uncertainties that could cause actual results to differ materially from those in such forward-looking statements. The risks and uncertainties relating to these statements include, but are not limited to, risks and uncertainties regarding fluctuations in earnings, fluctuations in foreign exchange rates, our ability to manage growth, intense competition in IT services including those factors which may affect our cost advantage, wage increases in India , our ability to attract and retain highly skilled professionals, time and cost overruns on fixed-price, fixed-time frame contracts, client concentration, restrictions on immigration, industry segment concentration, our ability to manage our international operations, reduced demand for technology in our key focus areas, disruptions in telecommunication networks or system failures, our ability to successfully complete and integrate potential acquisitions, liability for damages on our service contracts, the success of the companies in which Infosys has made strategic investments, withdrawal or expiration of governmental fiscal incentives, political instability and regional conflicts, legal restrictions on raising capital or acquiring companies outside India , and unauthorized use of our intellectual property and general economic conditions affecting our industry. Additional risks that could affect our future operating results are more fully described in our United States Securities and Exchange Commission filings including our Annual Report on Form 20-F for the fiscal year ended March 31, 2015 . These filings are available at [[UEdFZ2NtVnNQVndpYm05bWIyeHNiM2RjSWlCdmJtTnNhV05yUFNkc2FXNXJUMjVEYkdsamF5aDBhR2x6S1NjZ2RHRnlaMlYwUFNkZllteGhibXNuSUdoeVpXWTlYQ0pvZEhSd09pOHZkM2QzTG1sdVptOXplWE11WTI5dEwweHBibXR6TDNKbFpHbHlaV04wYkdsdWF5NWhjM0I0UDJsa1BYTmxZeTFuYjNZdVlYTndlRndpSUhKbGJEMWNJbTV2Wm05c2JHOTNYQ0krZDNkM0xuTmxZeTVuYjNZOEwyRSt8]]. Infosys may, from time to time, make additional written and oral forward-looking statements, including statements contained in the company's filings with the Securities and Exchange Commission and our reports to shareholders. Any forward-looking statements contained herein are based on assumptions that we believe to be reasonable as of this date. The company does not undertake to update any forward-looking statements that may be made from time to time by or on behalf of the company unless it is required by law. \nSOURCE Infosys Served by: 127.0.0.1 ~ (c) 2004 - 2015, News Articles Network Â» Categories", "external_links": [], "published": "2015-10-19T12:44:00.000+03:00", "crawled": "2015-10-19T12:29:12.073+03:00", "highlightTitle": ""}