{"organizations": ["U.S. Bank Stadium", "NFL", "Minnesota Vikings", "Vikings", "U.S. Bank Stadium Founding Partners Founding Partners of U.S. Bank Stadium", "Founding Partner of U.S. Bank Stadium"], "uuid": "15c06a563b4b0a2b41bd71db4f8f9f4fd8db910c", "thread": {"social": {"gplus": {"shares": 0}, "pinterest": {"shares": 0}, "vk": {"shares": 0}, "linkedin": {"shares": 0}, "facebook": {"likes": 0, "shares": 0, "comments": 0}, "stumbledupon": {"shares": 0}}, "site_full": "science-technology.news-articles.net", "main_image": "", "site_section": "http://science-technology.news-articles.net/content/rss.php", "section_title": "Science and Technology @ News Articles Network", "url": "http://science-technology.news-articles.net/content/centurylink-named-founding-partner-bank-stadium-exclusive-communications-provider-minnesota-vikings.xhtml", "country": "US", "title": "CenturyLink named Founding Partner of U.S. Bank Stadium and exclusive communications provider for Minnesota Vikings", "performance_score": 0, "site": "news-articles.net", "participants_count": 0, "title_full": "CenturyLink named Founding Partner of U.S. Bank Stadium and exclusive communications provider for Minnesota Vikings", "spam_score": 0.0, "site_type": "news", "published": "2015-10-26T21:12:00.000+02:00", "replies_count": 0, "uuid": "15c06a563b4b0a2b41bd71db4f8f9f4fd8db910c"}, "author": "", "url": "http://science-technology.news-articles.net/content/centurylink-named-founding-partner-bank-stadium-exclusive-communications-provider-minnesota-vikings.xhtml", "ord_in_thread": 0, "title": "CenturyLink named Founding Partner of U.S. Bank Stadium and exclusive communications provider for Minnesota Vikings", "locations": ["North America", "Minnesota", "U.S.", "U.S. Bank Stadium", "Minn.", "Europe", "Asia", "Midwest"], "entities": {"persons": [], "locations": [], "organizations": []}, "highlightText": "", "language": "english", "persons": ["Paul", "Duane Ring", "Mark Wilf"], "text": "CenturyLink named Founding Partner of U.S. Bank Stadium and exclusive communications provider for Minnesota Vikings   Published on 2015-10-26 07:29:36 CenturyLink named Founding Partner of U.S. Bank Stadium and exclusive communications... -- EDEN PRAIRIE, Minn., Oct.   CenturyLink logo. CenturyLink logo. <-  <- stripped tags -> EDEN PRAIRIE, Minn. , Oct.   [[UEdFZ2NtVnNQVndpYm05bWIyeHNiM2RjSWlCdmJtTnNhV05yUFNkc2FXNXJUMjVEYkdsamF5aDBhR2x6S1NjZ2FISmxaajFjSW1oMGRIQTZMeTkzZDNjdVkyVnVkSFZ5ZVd4cGJtc3VZMjl0TDF3aUlISmxiRDFjSW01dlptOXNiRzkzWENJZ2RHRnlaMlYwUFZ3aVgySnNZVzVyWENJK1EyVnVkSFZ5ZVV4cGJtc3NJRWx1WXk0OEwyRSt8]] (NYSE: [[UEdFZ2NtVnNQVndpYm05bWIyeHNiM2RjSWlCb2NtVm1QU2RvZEhSd09pOHZjM1IxWkdsdkxUVXVabWx1WVc1amFXRnNZMjl1ZEdWdWRDNWpiMjB2Y0hKdVpYZHpQMUJoWjJVOVVYVnZkR1VtVkdsamEyVnlQVU5VVENjZ2NtVnNQU2R1YjJadmJHeHZkeWNnZEdGeVoyVjBQU2RmWW14aGJtc25JSFJwZEd4bFBTZERWRXduSUc5dVkyeHBZMnM5SjJ4cGJtdFBia05zYVdOcktIUm9hWE1wSnlCeVpXdzlKMjV2Wm05c2JHOTNKejVEVkV3OEwyRSt8]]) and the Minnesota Vikings announced today that CenturyLink has been named a Founding Partner of U.S. Bank Stadium, as well as the exclusive communications provider of the Vikings. The 10-year agreement includes significant immersion of CenturyLink's communication infrastructure and services within U.S. Bank Stadium. \"We are thrilled to partner with CenturyLink to provide an advanced communications and technology infrastructure inside U.S. Bank Stadium,\" said Vikings Owner/President Mark Wilf . \"Because of this partnership and CenturyLink's technology, Vikings fans will be able to enjoy the ultimate game day connectivity and our organization will operate in an effective and efficient manner for many years moving forward.\" Within U.S. Bank Stadium, CenturyLink will provide an integrated IP network, which will enable 1,300 Wi-Fi access points and allow stadium-wide Internet access, as well as provide content distribution to more than 2,000 high-definition televisions. CenturyLink's cloud-based technology and predictive analytics will enable the Vikings to enhance the fan experience. The game day experience, via the Vikings mobile app, will be made possible as a result of CenturyLink's advanced and robust Wi-Fi and networking infrastructure. The sponsorship provides multiple touchpoints for CenturyLink, including in-stadium digital and static signage, scoreboard promotional features, digital and traditional media marketing assets, hospitality, television and radio advertising. \"CenturyLink's partnership with the Vikings allows fans to have an enhanced game day experience with state-of-the-art stadium technology,\" said Duane Ring , CenturyLink Midwest region president. \"We are excited about this agreement, as it will allow us to showcase CenturyLink's brand and our products, including high-speed Internet and Prism TV, as well as cloud-based technology and predictive analytics. We look forward to connecting with one of the NFL's most passionate fan bases.\" About U.S. Bank Stadium Founding Partners Founding Partners of U.S. Bank Stadium will have iconic branding positions within the world-class sports and entertainment venue that will serve as the Minnesota Vikings home beginning in 2016. Founding Partners will help provide a superior experience for stadium users and also align with the Vikings efforts to have a positive impact on the Minneapolis-St. Paul community and the State of Minnesota . About CenturyLink CenturyLink (NYSE: CTL ) is a global communications, hosting, cloud and IT services company enabling millions of customers to transform their businesses and their lives through innovative technology solutions. CenturyLink offers network and data systems management, Big Data analytics and IT consulting, and operates more than 55 data centers in North America , Europe and Asia . The company provides broadband, voice, video, data and managed services over a robust 250,000-route-mile U.S. fiber network and a 300,000-route-mile international transport network. Visit CenturyLink for more information.", "external_links": [], "published": "2015-10-26T21:12:00.000+02:00", "crawled": "2015-10-26T20:57:28.423+02:00", "highlightTitle": ""}