{"organizations": ["Japan Embedded Systems Technology Association", "Embedded Technology & IoT Technology Exhibitions", "Intel", "Microsoft Japan", "Qualcomm"], "uuid": "a99fd6e864f71f86ff99e3ee5efdfe835f9bf386", "thread": {"social": {"gplus": {"shares": 0}, "pinterest": {"shares": 0}, "vk": {"shares": 0}, "linkedin": {"shares": 0}, "facebook": {"likes": 0, "shares": 0, "comments": 0}, "stumbledupon": {"shares": 0}}, "site_full": "businesswireindia.com", "main_image": "", "site_section": "http://businesswireindia.com/RSSFeeds/subcat-technology.xml", "section_title": "BusinessWire India.com - Technology", "url": "http://businesswireindia.com/news/news-details/embedded-technology-iot-technology-exhibitions-be-held-concurrently-no/45552", "country": "US", "title": "Embedded Technology & IoT Technology Exhibitions to Be Held Concurrently in NovemberAdvanced Registration Launched October 5th (Mon.) on the Official Website", "performance_score": 0, "site": "businesswireindia.com", "participants_count": 0, "title_full": "Embedded Technology & IoT Technology Exhibitions to Be Held Concurrently in NovemberAdvanced Registration Launched October 5th (Mon.) on the Official Website", "spam_score": 0.0, "site_type": "news", "published": "2015-10-05T14:33:00.000+03:00", "replies_count": 0, "uuid": "a99fd6e864f71f86ff99e3ee5efdfe835f9bf386"}, "author": "", "url": "http://businesswireindia.com/news/news-details/embedded-technology-iot-technology-exhibitions-be-held-concurrently-no/45552", "ord_in_thread": 0, "title": "Embedded Technology & IoT Technology Exhibitions to Be Held Concurrently in NovemberAdvanced Registration Launched October 5th (Mon.) on the Official Website", "locations": ["Pacifico Yokohama", "Tokyo", "Japan"], "entities": {"persons": [], "locations": [], "organizations": []}, "highlightText": "", "language": "english", "persons": [], "text": "Company : Embedded Technology 2015/IoT Technology 2015 Monday, October 5, 2015 5:03PM IST (11:33AM GMT) (BW)(EMBEDDED-TECH/IOT-TECH) Embedded Technology & IoT Technology Exhibitions to Be Held Concurrently in NovemberAdvanced Registration Launched October 5th (Mon.) on the Official Website Must-see technological experts awaits – choose from over 100 available conferences to register! Tokyo, Japan Today on October 5th (Mon.), Japan Embedded Systems Technology Association (JASA), opens advanced registration for “Embedded Technology 2015” (\"ET2015\") and “IoT Technology 2015” exhibitions. Both exhibitions are to be held simultaneously at Pacifico Yokohama from November 18th (Wed.) to 20th (Fri.), 2015. This Smart News Release features multimedia. View the full release here: http://www.businesswire.com/news/home/20151004005020/en/ Embedded Technology 2014 (Photo: Secretariat of ET) ET2015 will welcome the first IoT Technology 2015, an exhibition specially dedicated to IoT technologies. Incorporating this exhibition under one roof will bring together a wide range of technologies and solutions sought after by industry. The exhibition will reveal cutting-edge solutions from industry leading manufacturers and vendors including Intel, ARM, Microsoft Japan, ALTERA JAPAN, Socionext, Qualcomm, SCSK, and more. An array of Embedded Technology and IoT-related conferences will also be offered on topics such as security, methods to effectively utilize big data and automated driving, and many more. ET2015 / IoT Technology 2015 Official Website: http://www.jasa.or.jp/expo/english/ *Admission is free with advanced registration through the official website. Attendance to all conferences is free. Newly Established IoT Technical Solutions and Hardware Sessions In addition to IoT technical sessions that delve into a number of trending technological themes which include big data, image recognition, and protection of personal information, expert seminars specially dedicated to hardware technologies will be newly established. (Conference Info List: http://www.jasa.or.jp/expo/english/conf/ ) First-time held \"Embedded IoT Hackathon\". An Embedded IoT Hackathon will feature 10 teams of technical experts testing their skills at hacking IoT. In this \"hacking marathon,\" teams compete on implementation and success of a service or system in solving a given challenge within a limited time. This event has been planned with the aim of discovering and developing \"Embedded IoT talent.\" (Embedded IoT Hackathon: http://www.jasa.or.jp/expo/english/event/hackathon.html )", "external_links": [], "published": "2015-10-05T14:33:00.000+03:00", "crawled": "2015-10-05T16:54:32.794+03:00", "highlightTitle": ""}