{"organizations": ["ARUP", "Regeneron Pharmaceuticals, Inc.", "Pharma Corporation", "Mosquito Shield Franchise Corporation", "Chronic Care Management Suite", "MTPC", "Oculus Health Releases Disease Management Modules", "Pixel Film Studios", "Mitsubishi Tanabe Pharma for Investigational Pain Therapy Fasinumab", "Medical Research", "FCPX", "Regeneron", "American Association for the Study of Liver Diseases Annual Meeting   Boston", "Digital Pathology System for Research Use Only", "South Florida Entrepreneurs", "Tobira Therapeutics", "Leica Biosystems"], "uuid": "5c60451f8ee2ddaeb3e88bf138157346297c7060", "thread": {"social": {"gplus": {"shares": 0}, "pinterest": {"shares": 0}, "vk": {"shares": 0}, "linkedin": {"shares": 0}, "facebook": {"likes": 0, "shares": 0, "comments": 0}, "stumbledupon": {"shares": 0}}, "site_full": "www.bio-medicine.org", "main_image": "", "site_section": "http://feeds.bio-medicine.org/latest-medical-technology", "section_title": "Latest Medical Technology from Bio-Medicine.Org", "url": "http://www.bio-medicine.org/medicine-technology-1/Tobira-Therapeutics-Announces-Presentations-Related-to-Cenicrivirocs-Development-Program-in-NASH-at-the-American-Association-for-the-Study-of-Liver-Di-48544-1/", "country": "US", "title": "Tobira Therapeutics Announces Presentations Related to Cenicriviroc's Development Program in NASH at the American Association for the Study of Liver Diseases Annual Meeting", "performance_score": 0, "site": "bio-medicine.org", "participants_count": 0, "title_full": "Tobira Therapeutics Announces Presentations Related to Cenicriviroc's Development Program in NASH at the American Association for the Study of Liver Diseases Annual Meeting", "spam_score": 0.0, "site_type": "news", "published": "2015-10-01T21:28:00.000+03:00", "replies_count": 0, "uuid": "5c60451f8ee2ddaeb3e88bf138157346297c7060"}, "author": "", "url": "http://www.bio-medicine.org/medicine-technology-1/Tobira-Therapeutics-Announces-Presentations-Related-to-Cenicrivirocs-Development-Program-in-NASH-at-the-American-Association-for-the-Study-of-Liver-Di-48544-1/", "ord_in_thread": 0, "title": "Tobira Therapeutics Announces Presentations Related to Cenicriviroc's Development Program in NASH at the American Association for the Study of Liver Diseases Annual Meeting", "locations": ["US", "Broward County", "Fort Lauderdale", "Massachusetts", "Kashmir", "Electropathy", "FL", "Asia", "China"], "entities": {"persons": [], "locations": [], "organizations": []}, "highlightText": "", "language": "english", "persons": ["Claudio Nicoletti", "Susan G. Komen", "Herbert Herzog"], "text": " 10/1/2015)... Oct. 1, 2015 Regeneron Pharmaceuticals, Inc. (NASDAQ: ... Pharma Corporation (TSE: 4508) (MTPC) providing MTPC with exclusive ... NGF antibody in late-stage development for musculoskeletal pain. ... obtain exclusive development and commercial rights to fasinumab ... nine other Asian countries, excluding China.   1, 2015 Leica Biosystems ... for telepathology, providing rapid remote access for real-time ... applications. (Photo: http://photos.prnewswire.com/prnh/20151001/273087 ... the Aperio LV1 enables remote users to access ... navigate like a conventional microscope. Users can securely   , Oct. 1, 2015 Tobira Therapeutics, ... the development and commercialization of novel treatments for ... presentations at the AASLD Annual Meeting (the Liver ... CA from November 13-17, 2015. ... community to address the unmet needs of patients ... [ 0 ] Regeneron Announces Collaboration with Mitsubishi Tanabe Pharma for Investigational Pain Therapy Fasinumab in Asia [ 0 ] Leica Biosystems Introduces the Aperio LV1 - Live View, Remote, Digital Pathology System for Research Use Only [ 0 ] Tobira Therapeutics Announces Presentations Related to Cenicriviroc's Development Program in NASH at the American Association for the Study of Liver Diseases Annual Meeting   Boston, Massachusetts   ... ... Management solution, has announced the addition of disease specific management modules to its ... effective management of chronic conditions such as diabetes, heart disease, hypertension, asthma, and   , ... October 01, 2015 , ... In response to ... to fill it, MENAJI Advanced Men’s Skincare , which has been providing undetectable ... male public through thorough consultant training. , “The time has come for us to   October 01, 2015 , ... ProChrono Social is a set of titles ... timeline with extreme ease. Easily lay ProChrono Social over personalized footage, pictures, or a ... to create with efficiency. , ProChrono Social allows FCPX users to build a self-animating,   October 01, 2015 , ... Mosquito Shield Franchise Corporation will introduce ... the Franchise Expo in Fort Lauderdale, FL. , The regional event, which offers ... expansion opportunities, takes place Oct. 3 and Oct. 4 at the Broward County Convention   ... For the third year in a row, Atlanta-based Perimeter Plastic Surgery will ... breast surgeries for the month of October to the Susan G. Komen organization. , ... because the need to find a cure for breast cancer and support those who ... [ 0 ] Oculus Health Releases Disease Management Modules to their Chronic Care Management Suite [ 0 ] MENAJI Advanced Men’s Skincare Launches In-Store Training at Frends Beauty Supply LA [ 0 ] ProChrono Social is released by Pixel Film Studios for Final Cut Pro X [ 0 ] Mosquito Shield Opens New Franchise Opportunities to South Florida Entrepreneurs [ 0 ] Perimeter Plastic Surgery Supports National Breast Cancer Awareness Month ... shown that female mice tend to create new brain cells ... that outlines how chemical messages may shape their choice of ... at the university looked at the effects of sex pheromones, ... choose their mates, on the brains of female mice. They ... ... revealed that hoarders have a brain disorder resulting in an ... society and damages their relationships. ,A sub-type ... store items considered by most people to be worthless or ... many mental disorders, it is believed in part to have ... ... (IL-12),that may provide resistance against food allergy. ... to a food protein as if it was harmful. ... normally help the body fight parasites. In the most ... shock. ,The study was conducted by ... ... in Electropathy, an alternative system of medicine, climbed atop a ... themselves, unless the State Government promised them jobs. ... set themselves afire or jump from the tower if the ... ,The doctors, who have been on a protest for over ... ... been identified and offers a potential target for therapy.There is ... only way for sufferers to manage the problem is to ... at hand. ,Scientists led by Dr Claudio Nicoletti ... that a molecule called Interleukin-12 (IL-12) is absent during allergic ... ... body releases when stressed, can unlock Y2 receptors in the ... size and number. By blocking those receptors, it may be ... ,The study was done by Professor Herbert Herzog, ... of Medical Research, together with scientists from the US and ... Male Pheromones Build Brain Cells in Female Mice Hoarding can Endanger Lives, Says New Study Boffins Identify Molecule That Might Treat Food Allergy Unemployed Electropaths Threaten to Commit Suicide in Kashmir Potential Target for Allergy Therapy Blocking the Y2 Receptors can Prevent Obesity ... Laboratories is a national reference laboratory and ... and development. ARUP offers an extensive test ... tests in clinical and anatomic pathology. Owned ... clients include more than half of the ... ... is a national reference laboratory and a ... development. ARUP offers an extensive test menu ... in clinical and anatomic pathology. Owned by ... include more than half of the nation's ... ... is a national reference laboratory and a ... development. ARUP offers an extensive test menu ... in clinical and anatomic pathology. Owned by ... include more than half of the nation's ... ... Laboratories is a national reference laboratory and ... and development. ARUP offers an extensive test ... tests in clinical and anatomic pathology. Owned ... clients include more than half of the ...", "external_links": [], "published": "2015-10-01T21:28:00.000+03:00", "crawled": "2015-10-01T23:32:53.396+03:00", "highlightTitle": ""}