{"organizations": ["EMI Group", "Professional School of Audio", "October   Ovation Music & Studios, Inc.", "Ovation Music & Studios, Inc.", "Nashville Area Location Ovation Music & Studios, Inc", "Capital Records", "Inc", "Ovation Music & Studios", "Universal Music Group", "Sony Music Entertainment", "About Ovation Music & Studios", "Warner Music Group", "Ovation Music & Studios, Inc", "House of Blues Studios", "Quad Studios", "Sound Kitchen Studios"], "uuid": "e63833adc740e098e0f96ade4a57cbf14c1eeeb9", "thread": {"social": {"gplus": {"shares": 0}, "pinterest": {"shares": 0}, "vk": {"shares": 0}, "linkedin": {"shares": 0}, "facebook": {"likes": 0, "shares": 0, "comments": 0}, "stumbledupon": {"shares": 0}}, "site_full": "science-technology.news-articles.net", "main_image": "", "site_section": "http://science-technology.news-articles.net/content/rss.php", "section_title": "Science and Technology @ News Articles Network", "url": "http://science-technology.news-articles.net/content/ovation-music-studios-begins-expansion-nashville-area-location.xhtml", "country": "US", "title": "Ovation Music & Studios, Inc. Begins Expansion with Nashville Area Location", "performance_score": 0, "site": "news-articles.net", "participants_count": 0, "title_full": "Ovation Music & Studios, Inc. Begins Expansion with Nashville Area Location", "spam_score": 0.0, "site_type": "news", "published": "2015-10-13T15:52:00.000+03:00", "replies_count": 0, "uuid": "e63833adc740e098e0f96ade4a57cbf14c1eeeb9"}, "author": "", "url": "http://science-technology.news-articles.net/content/ovation-music-studios-begins-expansion-nashville-area-location.xhtml", "ord_in_thread": 0, "title": "Ovation Music & Studios, Inc. Begins Expansion with Nashville Area Location", "locations": ["New York", "U.S.", "Nashville", "Tennessee", "U.S", "South Florida", "Florida", "Los Angeles", "Gallatin"], "entities": {"persons": [], "locations": [], "organizations": []}, "highlightText": "", "language": "english", "persons": ["Gibson", "Keith De Tone", "Elijah Ellis"], "text": "Ovation Music & Studios, Inc. Begins Expansion with Nashville Area Location   Published on 2015-10-13 05:15:31 Ovation Music & Studios, Inc. Begins Expansion with Nashville Area Location -- BOCA RATON, Florida, October   <-   BOCA RATON, Florida , October   Ovation Music & Studios, Inc. (OTC: OVMS) (the \"Company\") http://ovationmusicstudios.com/index.php , and https://www.facebook.com/ovation.gallatin , signed a lease in June and in September started construction to open a new location in Gallatin, Tennessee , just outside of Nashville . Nashville is the \"home of country music\", and is a major music recording and production center. The music industries' major recording labels, including Universal Music Group, Capital Records, Sony Music Entertainment, Warner Music Group, EMI Group, as well as numerous independent labels, have recording studios and offices in Nashville . The Company has begun the build out of the location, and has hired Elijah Ellis to manage the location. Elijah Ellis is a well known Nashville musician, formally a touring blues musician, and vintage instrument collector and trader. The Company initially plans to build location territories around the South Florida and Nashville, Tennessee markets. Keith De Tone , the Company's CEO & Chairman stated, \"This is the first step in establishing the Ovation footprint in the Nashville market. We cannot be more excited about Ovation being part of the Nashville music scene and a music educator in this market.\" Nashville's Music Row is home to hundreds of businesses related to the country music, gospel music, rock and roll, jazz as well as contemporary Christian music industries. Music Row is the heart of Nashville's entertainment industry. Numerous record labels, publishing houses, music licensing firms, video production houses, along with other business who serve the music industry, as well as radio networks, radio stations and recording studios. Some of the top recording studios include, Blackbird Studio, Sound Kitchen Studios, House of Blues Studios, Quad Studios and Sound Stage Studios. \"We have a personal and educational relationship with The Blackbird Academy - Professional School of Audio,as one of our team is a recent graduate as a sound engineer, \" Keith De Tone , CEO. The Blackbird Academy is affiliated with Blackbird Studio. Nashville's Music Row area has been home to the headquarters of guitar company Gibson since 1984. Since the 1960s, Nashville has been the second-largest music production center (after New York ) in the U.S. A comprehensive study of Nashville's music and entertainment industry shows it has a $10 billion annual economic impact on the Nashville region. The Nashville area has more music industry jobs than any other U.S. city in relation to population and total employment, even more than New York or Los Angeles . The music industry helps create and sustain more than 56,000 jobs in the Nashville area, supporting more than $3.2 billion of labor income annually. See 'Music Council's New Report Says Industry Jobs Clustered in Nashville at Higher Rate Than in NYC or LA', http://www.nashville.gov/Mayors-Office/Priorities/Economic-Development/Programs-and-Services/Music-City-Music-Council.aspx . About Ovation Music & Studios, Inc . Ovation Music & Studios, Inc. is a music education company that provides individual and group lessons, rehearsal studios, professional recording studios, and live performances with its Rock Shop™ and Jazz Jam™ ensembles. Ovation Music & Studios is developed for students of all ages. Their unique method provides professional musicians and teachers in one-to-one voice and instrument lessons. When the students have developed skill in the instrument as well as in music theory and ear training they are combined into rock bands and/or jazz ensembles which perform in public venues. Forward-Looking Statements This release may contain statements that are \"forward-looking statements\". Forward-looking statements include, without limitation, any statement that may predict, forecast, indicate, or imply future results, performance or achievements, and may contain the words \"estimate\", \"project\", \"intend\", \"forecast\", \"anticipate\", \"plan\", \"planning\", \"expect\", \"believe\", \"will likely\", \"should\", \"could\", \"would\", \"may\" or words or expressions of similar meaning. These statements are based on current estimates and projections about the Company's business, which are derived in part on assumptions of its management, and are not guarantees of future performance, as such performance is difficult to predict. Actual outcomes and results may differ materially from what is expressed or forecasted in forward-looking statements due to numerous factors. Such factors include, but are not limited to, the Company's limited operating history, ability to execute effectively its business plan, economic and political conditions, changes in consumer behavior and the introduction of competing products having technological and/or other advantage, the Company's, the limited financial resources, and conditions of equity markets. Actual results may differ materially from the results predicted and reported results should not be considered as an indication of future performance. No information in this press release should be construed as an indication of the Company's future revenues or financial results. Ovation Music & Studios, Inc. Contact Investor Relations at: + 1-877-658-0376 \nSOURCE Ovation Music & Studios, Inc. Served by: 127.0.0.1 ~ (c) 2004 - 2015, News Articles Network » Categories", "external_links": [], "published": "2015-10-13T15:52:00.000+03:00", "crawled": "2015-10-13T15:36:08.771+03:00", "highlightTitle": ""}