{"organizations": ["Rentokil North America", "Pitbull Pest Control", "Stanford Phillips of Northwest", "Entomological Society of America", "Edge Pest Control", "Rentokil", "NPMA", "McCauley Services", "Commercial Committee", "Structural Pest Management Association of Ontario", "Purity Pest Control"], "uuid": "bec4ab5ab43eee38a64c2cab4efe3786d949895b", "thread": {"social": {"gplus": {"shares": 0}, "pinterest": {"shares": 0}, "vk": {"shares": 0}, "linkedin": {"shares": 0}, "facebook": {"likes": 0, "shares": 0, "comments": 0}, "stumbledupon": {"shares": 0}}, "site_full": "www.pctonline.com", "main_image": "http://www.pctonline.com/FileUploads/image/Stanford_award2.jpg", "site_section": "http://www.pctonline.com/rss.ashx", "section_title": "PCT - Pest Control Technology", "url": "http://www.pctonline.com/Article/Phillips-Naumann-NPMA-awards.aspx", "country": "US", "title": "Phillips, Naumann Presented with Industry Awards", "performance_score": 0, "site": "pctonline.com", "participants_count": 0, "title_full": "Phillips, Naumann Presented with Industry Awards", "spam_score": 0.0, "site_type": "news", "published": "2015-10-22T03:00:00.000+03:00", "replies_count": 0, "uuid": "bec4ab5ab43eee38a64c2cab4efe3786d949895b"}, "author": "", "url": "http://www.pctonline.com/Article/Phillips-Naumann-NPMA-awards.aspx", "ord_in_thread": 0, "title": "Phillips, Naumann Presented with Industry Awards", "locations": ["Tenn.", "US", "NASHVILLE"], "entities": {"persons": [], "locations": [], "organizations": []}, "highlightText": "", "language": "english", "persons": ["Andrew Richardson", "Joey Toth", "Daniel Collins", "Alison Levine", "McCauley", "Todd Ferguson", "Naumann", "Phillips", "John Myers", "Deni Naumann", "Michael Goldman", "Justin McCauley", "Goldman"], "text": "Subscribe Phillips, Naumann Presented with Industry Awards Stanford Phillips of Northwest Exterminating was presented with the Young Entrepreneur Award, while Copesan President Deni Naumann was given NPMA's Women of Excellence Award at PestWorld's Thursday General Session, a Syngenta-sponsored presentation given by mountain climber/author Alison Levine. October 22, 2015 NASHVILLE, Tenn. — Stanford Phillips of Northwest Exterminating was presented with the Young Entrepreneur Award, while Copesan President Deni Naumann was given NPMA's Women of Excellence Award at PestWorld's Thursday General Session, a Syngenta-sponsored presentation given by mountain climber/author Alison Levine . Phillips was recognized with the Young Entrepreneur Award, sponsored by Rentokil. John Myers, president and CEO, Rentokil North America, presented Phillips with the award. Additionally, three individuals were acknowledged as Rising Stars - and received Young Achiever Awards. These individuals were Andrew Richardson with Edge Pest Control, Joey Toth with Pitbull Pest Control and Daniel Collins with On Point Pest Control. NPMA's Women of Excellence Award was presented to Copesan President Deni Naumann. She was recognized for her outstanding leadership and contributions to the development and growth of other women in the industry. Presenting the award was Todd Ferguson, president of Target Specialty Products. Several other awards were presented prior to the session: •The Entomological Society of America (ESA) presented the ACE Professional Award to Michael Goldman. This award recognizes the superior contributions of an Associate Certified Entomologist (ACE) in the field of structural pest management. Goldman, president of Purity Pest Control, has been in the pest management industry for over 35 years and was the first non-US resident to earn the ACE designation after ESA amended the program rules to require a US pesticide applicators license to apply for the ACE. He is a past president (2 terms) of the Structural Pest Management Association of Ontario and served as Conference Chairman for over 12 years. •NPMA named its Commercial Committee its “Committee of the Year.” •Justin McCauley of Arkansas-based McCauley Services was recognized as Committee Chair of the Year. McCauley has been instrumental in the development of the upcoming Pestech 3.0. PestWorld 2015 Kicks Off With Spirited Opening Ceremony October 20, 2015 \nMore than 3,000 industry professionals from 80-plus countries have traveled to Nashville, Tenn., for PestWorld 2015. Kicking off this year's conference was Street Corner Symphony, runners up on the... Read More ESA Announces Recently Credentialed ACEs, BCEs October 19, 2015 \nThe Entomological Society of America (ESA) announced newly credentialed Associate Certified Entomologists (ACEs) and Board Certified Entomologists (BCEs), including 15 professionals from Clark Pest... Read More McCloud Releases White Paper on Food Processing Facilities Training for PMPs October 18, 2015 \nBecause ongoing training and education for pest management professionals is critical to protecting a food facility, McCloud Services has developed a white paper, “Technical Training for Pest... Read More The Pulse", "external_links": [], "published": "2015-10-22T03:00:00.000+03:00", "crawled": "2015-10-23T08:22:28.057+03:00", "highlightTitle": ""}