{"organizations": ["CTC Media CTC Media", "CTC Media, Inc.", "TNS", "CTC", "CTC Media, Inc", "Transmedia Projects Department", "CTC Media"], "uuid": "e699e1c71c411f50c705ddede0067d8bf71c8cde", "thread": {"social": {"gplus": {"shares": 0}, "pinterest": {"shares": 0}, "vk": {"shares": 0}, "linkedin": {"shares": 0}, "facebook": {"likes": 0, "shares": 0, "comments": 0}, "stumbledupon": {"shares": 0}}, "site_full": "globenewswire.com", "main_image": "http://globenewswire.com/Attachment/LogoDisplay/349086?filename=349086.jpg&amp;size=1", "site_section": "http://globenewswire.com//Rss/industry/5553/Broadcasting%2026%20Entertainment", "section_title": "GlobeNewswire: Industry News on Broadcasting 26 Entertainment", "url": "http://globenewswire.com/news-release/2015/10/21/778416/0/en/CTC-Media-Offers-Premium-Online-Access-to-TV-Series.html?f=22&fvtc=3&fvtv=5553", "country": "US", "title": "CTC Media Offers Premium Online Access to TV Series", "performance_score": 0, "site": "globenewswire.com", "participants_count": 0, "title_full": "CTC Media Offers Premium Online Access to TV Series", "spam_score": 0.0, "site_type": "news", "published": "2015-10-21T12:45:00.000+03:00", "replies_count": 0, "uuid": "e699e1c71c411f50c705ddede0067d8bf71c8cde"}, "author": "", "url": "http://globenewswire.com/news-release/2015/10/21/778416/0/en/CTC-Media-Offers-Premium-Online-Access-to-TV-Series.html?f=22&fvtc=3&fvtv=5553", "ord_in_thread": 0, "title": "CTC Media Offers Premium Online Access to TV Series", "locations": ["Belarus", "North America", "Armenia", "Domashny", "MOSCOW", "Kyrgyzstan", "Europe", "Kazakhstan", "Molodezhka", "Georgia", "Russia", "Middle East", "Azerbaijan", "Central Asia"], "entities": {"persons": [], "locations": [], "organizations": []}, "highlightText": "", "language": "english", "persons": ["Alexey Pivovarov", "Molodezhka", "Peretz"], "text": "CTC Media Offers Premium Online Access to TV Series October 21, 2015 05:45 ET | Source: CTC Media, Inc. MOSCOW, Oct. 21, 2015 (GLOBE NEWSWIRE) -- CTC Media, Inc. (NASDAQ: CTCM ), Russia's leading independent media company, and Yandex.Money offer viewers a unique opportunity to watch the hottest TV premieres before they are aired! On October 21, 5 days before the launch of the third season of the popular TV series Molodezhka on CTC, CTC Media will offer viewers exclusive access to the first four episodes of the new season. Viewers will be able to buy 4 episodes of Molodezhka five days before the launch on videomore.ru website. Molodezhka is one of the most popular CTC projects on air and in the Internet. The first two seasons of the series had over 70 million views on licensed platforms alone. Special edition of the Second Screen app for Molodezhka had over one million downloads during the season. Yandex.Money will process payments using the universal Yandex Payment Solution. Viewers will be able to pay using their Yandex.Money wallets or major credit cards. Other payment options will be available in future, including online banking, MasterPass, mobile payments and cash via payment terminals and mobile phone stores. Alexey Pivovarov, Director of Transmedia Projects Department, CTC Media : “We wanted to offer a surprise to the viewers of one of the nation's most popular series during the launch of the third season. Our viewers will get a chance to watch the latest episodes of Molodezhka before they are aired. Yandex.Money offers easy access to new episodes, and we hope that our new service will be popular among the fans of our series.” About CTC Media CTC Media is the leading Russian independent media company. The group manages four television channels in Russia (CTC, Domashny, Peretz and CTC Love) as well as Channel 31 in Kazakhstan. The international version of CTC Channel is available in North America, Europe, Central Asia, Armenia, Georgia, Azerbaijan, the Middle East and Kyrgyzstan. The international version of Peretz is available in Belarus in Kyrgyzstan as well. CTC Media also owns several digital entertainment media assets including videomore.ru, domashniy.ru, ctc.ru, peretz.ru and CarambaTV. CTC Media is traded on NASDAQ under the symbol CTCM. About Yandex.Money Yandex.Money is the largest payment service in Russia, according to the TNS poll conducted in 2015. As of May 2015, the service hosted about 22 million user accounts with about 12,000 new accounts opened daily. Yandex.Money offers its users an opportunity to send and accept payments using electronic money, cash, Visa and MasterCard. Non-registered users can use Yandex.Money website for bill payments. Owners of electronic wallets have access to a range of additional features such as having a bank card issued and linked to their account, or setting up reminders or automatic payments. Follow Yandex.Money in our blog , on Twitter or Facebook. \nFor further information, please contact: \nCTC Media", "external_links": [], "published": "2015-10-21T12:45:00.000+03:00", "crawled": "2015-10-21T17:22:40.851+03:00", "highlightTitle": ""}