{"organizations": ["Network Writers MALCOLM-JAMAL Warner", "AM Kristy Symonds Entertainment", "Cancer Council Emeralds"], "uuid": "e9941a587140637a9d5bfc547c925158a0f2f205", "thread": {"social": {"gplus": {"shares": 0}, "pinterest": {"shares": 0}, "vk": {"shares": 0}, "linkedin": {"shares": 0}, "facebook": {"likes": 0, "shares": 0, "comments": 0}, "stumbledupon": {"shares": 0}}, "site_full": "www.news.com.au", "main_image": "http://cdn.newsapi.com.au/image/v1/63c0a318eaadb02b409a9326af85f993", "site_section": "http://feeds.news.com.au/public/rss/2.0/news_ent_3169.xml", "section_title": "NEWS.com.au | Entertainment", "url": "http://www.news.com.au/entertainment/celebrity-life/shia-labeouf-is-in-trouble-again-this-time-for-public-intoxication/story-fnk822dn-1227564430198?from=public_rss", "country": "IL", "title": "LaBeouf ‘either extremely drunk or on drugs’", "performance_score": 0, "site": "news.com.au", "participants_count": 0, "title_full": "LaBeouf ‘either extremely drunk or on drugs’", "spam_score": 0.0, "site_type": "news", "published": "2015-10-10T07:29:00.000+03:00", "replies_count": 0, "uuid": "e9941a587140637a9d5bfc547c925158a0f2f205"}, "author": "", "url": "http://www.news.com.au/entertainment/celebrity-life/shia-labeouf-is-in-trouble-again-this-time-for-public-intoxication/story-fnk822dn-1227564430198?from=public_rss", "ord_in_thread": 0, "title": "LaBeouf ‘either extremely drunk or on drugs’", "locations": ["US", "SYDNEY", "Los Angeles"], "entities": {"persons": [], "locations": [], "organizations": []}, "highlightText": "", "language": "english", "persons": ["Briana Domjen", "Julie Bishop", "Robbie Williams", "Ronan", "Lindsey Kupfer", "Melissa Hoyer", "Robbie", "James Blunt", "Benedict Brook NADIYA", "Ronan Keating", "Bill Cosby", "Wilson"], "text": "LaBeouf ‘either extremely drunk or on drugs’ 15:29 PM Lindsey Kupfer SHIA Labeouf is in trouble again. This time he’s been arrested for public intoxication following a run-in with police outside a bar. Millions of people love this woman 15:01 PM Benedict Brook NADIYA is a 30-year-old mum of three who’s normal in pretty much every way ... save for her one huge talent. With it, she’s done something remarkable. James Blunt to be a dad 14:02 PM Briana Domjen EXCLUSIVE THE You’re Beautiful singer and his wife are expecting their first child, The Sunday Telegraph can reveal. Setback for Cosby in assault case 13:37 PM Network writer and AP A US judge has refused to throw out a defamation case by three women against Bill Cosby - the same day the comedian’s set to testify in a molestation case. Ronan and wife sing up a Storm 12:40 PM Briana Domjen SYDNEY’S celebrity set put on their best black tie and descended on Town Hall last night to support X Factor star Ronan Keating’s annual charity event the Cancer Council Emeralds and Ivy Ball. Cosby’s on-screen son speaks out 11:38 AM AP and Network Writers MALCOLM-JAMAL Warner, Bill Cosby’s on-screen son, has addressed the allegations against his one-time dad. Rebel Wilson models own fashion collection 7:22 AM Melissa Hoyer ACTOR Rebel Wilson and Foreign Minister Julie Bishop have announced their commitment to the big wide world of fashion while in Los Angeles. Robbie delivers the total package 6:52 AM Kristy Symonds Entertainment reporter THE biggest problem with Robbie Williams in concert is that just two hours with the cheeky pop star is simply never enough.", "external_links": [], "published": "2015-10-10T07:29:00.000+03:00", "crawled": "2015-10-10T08:16:27.566+03:00", "highlightTitle": ""}