{"organizations": ["Associated Press", "Universal Pictures", "Facebook Email Twitter Google", "Microsoft", "Facebook", "AP"], "uuid": "4c344c99cd2be439abc0f97293def179cd073d4e", "thread": {"social": {"gplus": {"shares": 0}, "pinterest": {"shares": 0}, "vk": {"shares": 0}, "linkedin": {"shares": 0}, "facebook": {"likes": 0, "shares": 0, "comments": 0}, "stumbledupon": {"shares": 0}}, "site_full": "www.wtsp.com", "main_image": "http://www.gannett-cdn.com/-mm-/489efad1142179deef9ce5ef3cf126cd99e1a3f1/r=x633&amp;c=1200x630/http/cdn.tegna-tv.com/-mm-/92c4781fb537a30c7af5f9b3e646b228f84480ca/c=0-198-2302-1499/local/-/media/2015/10/08/WTSP/WTSP/635799239533912576-GettyImages-483637314.jpg", "site_section": "http://rssfeeds.wtsp.com/_/20/110077714/wtsp/entertainmentnews", "section_title": "WTSP - Entertainment", "url": "http://www.wtsp.com/story/entertainment/2015/10/08/straight-outta-compton-director-set-fast-furious/73611814/", "country": "US", "title": "'Straight Outta Compton' director set for 'Fast & Furious'", "performance_score": 0, "site": "wtsp.com", "participants_count": 0, "title_full": "'Straight Outta Compton' director set for 'Fast & Furious'", "spam_score": 0.0, "site_type": "news", "published": "2015-10-09T01:00:00.000+03:00", "replies_count": 0, "uuid": "4c344c99cd2be439abc0f97293def179cd073d4e"}, "author": "", "url": "http://www.wtsp.com/story/entertainment/2015/10/08/straight-outta-compton-director-set-fast-furious/73611814/", "ord_in_thread": 0, "title": "'Straight Outta Compton' director set for 'Fast & Furious'", "locations": ["California", "Los Angeles"], "entities": {"persons": [], "locations": [], "organizations": []}, "highlightText": "", "language": "english", "persons": ["F. Gary Gray", "Gary Gray", "Kevin"], "text": "Facebook Email Twitter Google+ LinkedIn Pinterest 'Straight Outta Compton' director set for 'Fast & Furious' F. Gary Gray, who made waves this summer with his profitable and critically acclaimed N.W.A biopic \"Straight Outta Compton,\" has been set to direct the eighth film in the \"Fast & Furious\" franchise. Post to Facebook 'Straight Outta Compton' director set for 'Fast & Furious' F. Gary Gray, who made waves this summer with his profitable and critically acclaimed N.W.A biopic \"Straight Outta Compton,\" has been set to direct the eighth film in the \"Fast & Furious\" franchise. Check out this story on wtsp.com: http://on.wtsp.com/1LkHuuJ Cancel Send A link has been sent to your friend's email address. Posted! A link has been posted to your Facebook feed. Join the Conversation To find out more about Facebook commenting please read the Conversation Guidelines and FAQs 'Straight Outta Compton' director set for 'Fast & Furious' Associated Press, AP 6 p.m. EDT October 8, 2015 Director F. Gary Gray arrives at the premiere of Universal Pictures and Legendary Pictures''Straight Outta Compton' at the Microsoft Theatre on August 10, 2015 in Los Angeles, California. (Photo: Kevin Winter/Getty Images) CONNECT TWEET LINKEDIN COMMENT EMAIL MORE \nLOS ANGELES (AP) - F. Gary Gray, who made waves this summer with his profitable and critically acclaimed N.W.A biopic \"Straight Outta Compton,\" has been set to direct the eighth film in the \"Fast & Furious\" franchise. \nGray announced the news on his Facebook page on Thursday and Universal Pictures confirmed. \nStar and producer Vin Diesel posted a photo of himself and Gray with some \"Fast & Furious\" images on Facebook earlier this week, hinting that the \"Compton\" director was indeed the front runner to take over the extremely successful series. \n\"Furious 7,\" released earlier this year, grossed a staggering $1.5 billion worldwide. James Wan directed that film, which featured Paul Walker's final appearance in the series. Walker died in 2013. \nThe eighth installment is set for an April 14, 2017 release. Read or Share this story: http://on.wtsp.com/1LkHuuJ More Stories", "external_links": [], "published": "2015-10-09T01:00:00.000+03:00", "crawled": "2015-10-09T01:10:51.405+03:00", "highlightTitle": ""}