{"organizations": ["Inside Lara Bingle", "AM Victoria Nielsen", "Lara Bingle"], "uuid": "1b3fe7b35588b5a3771b0ae0dfe95c00f7c26d6e", "thread": {"social": {"gplus": {"shares": 0}, "pinterest": {"shares": 0}, "vk": {"shares": 0}, "linkedin": {"shares": 0}, "facebook": {"likes": 0, "shares": 0, "comments": 0}, "stumbledupon": {"shares": 0}}, "site_full": "www.news.com.au", "main_image": "http://cdn.newsapi.com.au/image/v1/6082e5c3798a8a4addb00618af935f0c", "site_section": "http://feeds.news.com.au/public/rss/2.0/news_ent_3169.xml", "section_title": "NEWS.com.au | Entertainment", "url": "http://www.news.com.au/entertainment/movies/pulp-fiction-director-quentin-tarantino-in-australia-for-the-hateful-eight-film-premiere-in-2016/story-fnk850z8-1227567151651?from=public_rss", "country": "IL", "title": "Tarantino is coming to Australia", "performance_score": 0, "site": "news.com.au", "participants_count": 0, "title_full": "Tarantino is coming to Australia", "spam_score": 0.0, "site_type": "news", "published": "2015-10-13T03:54:00.000+03:00", "replies_count": 0, "uuid": "1b3fe7b35588b5a3771b0ae0dfe95c00f7c26d6e"}, "author": "", "url": "http://www.news.com.au/entertainment/movies/pulp-fiction-director-quentin-tarantino-in-australia-for-the-hateful-eight-film-premiere-in-2016/story-fnk850z8-1227567151651?from=public_rss", "ord_in_thread": 0, "title": "Tarantino is coming to Australia", "locations": ["Australia", "China", "Melbourne", "Sydney"], "entities": {"persons": [], "locations": [], "organizations": []}, "highlightText": "", "language": "english", "persons": ["Chris Hemsworth", "James Wigney", "Harper", "Tarantino", "Emma Reynolds", "Quentin Tarantino", "Calvin Harris", "Colin Vickery", "Johnny Depp", "JOHNNY Depp", "Corey Sinclair"], "text": "Chris Hemsworth’s first Instagram post is creepy 11:13 AM Staff Writers HE’S a little behind the eight ball with social media, but Chris Hemsworth has finally joined Instagram. Johnny Depp never wants to win an Oscar 11:10 AM WENN JOHNNY Depp’s been nominated three times for an Oscar — but he says he’d rather not win one. Tarantino is coming to Australia 10:47 AM James Wigney LEGENDARY director Quentin Tarantino will come to Sydney and Melbourne to promote and be at the premiere of his highly anticipated next movie. The rivalries that divide pop music 10:43 AM Corey Sinclair “WHY does the media pit women against each other?” We’ve all heard stars use that line before but sometimes they reveal what they truly think of each other. Truth about China’s real estate billions 10:34 AM Emma Reynolds CHINESE investors are pouring their wealth into Australia’s best properties, but there are concerns about exactly where the billions are coming from. Calvin: Break-up rumour is ‘bulls--t’ 10:14 AM Network Writer PICTURES of him leaving a seedy massage parlour have sent social media into overdrive with break-up rumours. Now Calvin Harris has fired back. Five reasons this is Australia’s new favourite show 9:27 AM Colin Vickery National TV Writer CHANNEL 7 has a monster hit on its hands with 800 Words. If you’re not watching already, here’s why you should. Inside Lara Bingle’s Harper’s Bazaar shoot 9:06 AM Victoria Nielsen IT’S BEEN a while since we’ve seen Lara Bingle in model mode. Now we can see inside her latest photo shoot.", "external_links": [], "published": "2015-10-13T03:54:00.000+03:00", "crawled": "2015-10-13T04:18:01.632+03:00", "highlightTitle": ""}