{"organizations": ["Foxtel"], "uuid": "445ac73c5894ef9cea3ca275620b803e7f64442c", "thread": {"social": {"gplus": {"shares": 0}, "pinterest": {"shares": 0}, "vk": {"shares": 0}, "linkedin": {"shares": 0}, "facebook": {"likes": 0, "shares": 0, "comments": 0}, "stumbledupon": {"shares": 0}}, "site_full": "www.news.com.au", "main_image": "http://cdn.newsapi.com.au/image/v1/faae7aaf724f7b75f084632d91853f8c", "site_section": "http://feeds.news.com.au/public/rss/2.0/news_ent_3169.xml", "section_title": "NEWS.com.au | Entertainment", "url": "http://www.news.com.au/entertainment/celebrity-life/cold-hearted-john-stamos-on-relationship-with-paula-abdul/story-fnk825aa-1227555038780?from=public_rss", "country": "IL", "title": "‘Cold hearted’ Stamos on Abdul", "performance_score": 0, "site": "news.com.au", "participants_count": 0, "title_full": "‘Cold hearted’ Stamos on Abdul", "spam_score": 0.0, "site_type": "news", "published": "2015-10-02T21:17:00.000+03:00", "replies_count": 0, "uuid": "445ac73c5894ef9cea3ca275620b803e7f64442c"}, "author": "", "url": "http://www.news.com.au/entertainment/celebrity-life/cold-hearted-john-stamos-on-relationship-with-paula-abdul/story-fnk825aa-1227555038780?from=public_rss", "ord_in_thread": 0, "title": "‘Cold hearted’ Stamos on Abdul", "locations": ["Australia", "Tasmania"], "entities": {"persons": [], "locations": [], "organizations": []}, "highlightText": "", "language": "english", "persons": ["Cindy", "Andrew Fenton", "Cindy Crawford", "Julie Bishop", "GEORGE Clooney", "ANNA VLACH MEL Greig", "Mel", "JESSICA HOWARD", "Paula Abdul", "JOHN Stamos", "Ridley Scott", "ANNA VLACH", "Maria Lewis", "George", "Mel Greig"], "text": "‘Cold hearted’ Stamos on Abdul 4:17 AM Network Writers JOHN Stamos has dished on his former relationship with Paula Abdul, including comments that she wrote her hit Cold Hearted about him. How Cindy ended up in George’s bed 1:05 AM Network Writers GEORGE Clooney has shared details of how he ended up in bed with his best mate’s wife, none other than supermodel Cindy Crawford. Smaller Taste on the cards 0:00 AM JESSICA HOWARD STALLHOLDER applications for this year’s Taste of Tasmania are down 38 per cent on last year. Mel deeply hurt by nurse tweet 23:48 PM ANNA VLACH MEL Greig is deeply disappointed a fellow Celebrity Apprentice cast mate retweeted a comment that branded her a “murderer”. Mel deeply hurt by cast mate’s retweet 23:15 PM ANNA VLACH FORMER radio presenter Mel Greig says she is deeply disappointed that a fellow Celebrity Apprentice contestant retweeted a comment that branded her a “murderer”. Julie Bishop is Alien’s only hope 22:00 PM Neala Johnson National Film Writer DIRECTOR Ridley Scott will be in Australia “in a heartbeat” to film a new movie if Foreign Affairs Minister Julie Bishop approves him “nowish”. Ten TV shows that will not die 22:00 PM Andrew Fenton Entertainment Writer SHOWS with loyal followings that were once destined for the TV graveyard are being picked up by Foxtel and streaming sites to boost subscriber numbers. The massive film coming to Australia 19:09 PM Maria Lewis THE MARTIAN director Ridley Scott is the man of the moment. And he’s just confirmed he’ll be filming his next big movie in Australia in January.", "external_links": [], "published": "2015-10-02T21:17:00.000+03:00", "crawled": "2015-10-03T01:22:51.647+03:00", "highlightTitle": ""}