{"organizations": ["AM Leigh Paatsch National", "NBC", "Getty Network Vision News Corp Australia Network Share Email"], "uuid": "e4939e4d0f3fd366a91035a25c7fe149220f9caf", "thread": {"social": {"gplus": {"shares": 0}, "pinterest": {"shares": 0}, "vk": {"shares": 0}, "linkedin": {"shares": 0}, "facebook": {"likes": 0, "shares": 0, "comments": 0}, "stumbledupon": {"shares": 0}}, "site_full": "www.news.com.au", "main_image": "http://cdn.newsapi.com.au/image/v1/11ae9953b157f81ad559dcc29089827b", "site_section": "http://feeds.news.com.au/public/rss/2.0/news_ent_3169.xml", "section_title": "NEWS.com.au | Entertainment", "url": "http://www.news.com.au/entertainment/celebrity-life/beyonce-scolds-her-fanatical-personal-assistant-on-the-red-carpet-saying-stop-it/story-fn907478-1227578351214?from=public_rss", "country": "IL", "title": "Beyonce scolds assistant on red carpet", "performance_score": 0, "site": "news.com.au", "participants_count": 0, "title_full": "Beyonce scolds assistant on red carpet", "spam_score": 0.0, "site_type": "news", "published": "2015-10-22T04:36:00.000+03:00", "replies_count": 0, "uuid": "e4939e4d0f3fd366a91035a25c7fe149220f9caf"}, "author": "", "url": "http://www.news.com.au/entertainment/celebrity-life/beyonce-scolds-her-fanatical-personal-assistant-on-the-red-carpet-saying-stop-it/story-fn907478-1227578351214?from=public_rss", "ord_in_thread": 0, "title": "Beyonce scolds assistant on red carpet", "locations": ["London"], "entities": {"persons": [], "locations": [], "organizations": []}, "highlightText": "", "language": "english", "persons": ["James Bond", "Richie", "Charlotte Willis", "Nathaniel", "Mikey Cahill", "Cameron Adams", "Sam Frost", "ALEX LUTTRELL", "Beyonce", "Charles Miranda", "Leigh Paatsch"], "text": "Beyonce scolds assistant on red carpet 12:32 PM Network Vision SHE was only trying to help. Beyonce’s assistant felt the pop queen’s wrath when she got between her and the cameras on the red carpet overnight. People’s Day a hit for Hobart Show 12:28 PM ALEX LUTTRELL UP to 15,000 people are expected to flock to People’s Day at the Royal Hobart Show. 12:17 PM Charlotte Willis A HEARTBROKEN Richie has revealed Bachelorette Sam Frost sent him packing without any real explanation. Cruel Intentions is coming to TV 12:13 PM Staff Writers IT LOOKS like Cruel Intentions is the latest film to be given a reboot, with a small screen adaptation reportedly in the works with NBC. Latest Album Reviews 11:55 AM Cameron Adams and Mikey Cahill - Hit Journalists Will 5 Seconds of Summer extend their 15 minutes? Are Art Vs. Science on the right trajectory? Is You Beauty’s second album a baaaah-you-tay? How have Nathaniel’s pipes developed? Is Kurt Vile going up or down? What to see at the movies right now 11:31 AM Leigh Paatsch National movie reviewer CAN’T decide what movie to see this week? National movie reviewer Leigh Paatsch has every current release covered to make your choice easier. Bond is back — with a bang 11:29 AM Charles Miranda London FIRST REVIEW: From its explosive opening scene, the latest James Bond film Spectre is an exhilarating ride that’s shaping up to be a classic. Beyonce scolds her fanatical personal assistant on the red carpet, saying “Stop it!” October 22, 2015 11:36am The Queen has spoken ... Beyonce scolds her personal assistant. Picture: Getty Network Vision News Corp Australia Network Share Email a friend \nBEYONCE’S assistant felt the wrath when she got between Queen Bey and the cameras at the Tidal X: 1020 event overnight. \nBeyonce lived up to her flawless fashion reputation, hitting the red carpet in a plunging, thigh-high maroon grown complete with ponytail perfection. \nPosing in a fur stole, the confident singer smiled to the cameras vying for her attention. “Right here, queen!” shouted one photographer. Music royalty ... Beyonce attends TIDAL X: 1020 in New York City. Picture: AFP Source: AFP \nWhile the singer seemed pleased with her appearance, her personal primper Sam Greenberg wouldn’t stop fussing over her dress. \nIn the clip that is now going viral, Queen Bey scolds “stop it” through a clenched smile before the distressed assistant scurries out of the limelight. Stop it \nAfter flaunting her killer curves on the red carpet, Beyonce slipped into a revealing pink jumpsuit, joining hubby Jay-Z on stage. \nThe singer went on to thrill the crowd with her first ever live performance with rapper Nicki Minaj to their single Feeling Myself . Beyonce & icki Minaj \nThe duo flaunted their famous booties in a raunchy performance, finishing their duet by playfully pretending to square off before giving each other a big hug. \nUsher, TI and Meek Mill were among the host of artists performing, with the event being the first of a series of charity shows put on by the power couple’s music streaming service Tidal. Beyonce and Jay-Z kiss on stage during TIDAL X: 1020. Picture: Getty Source: Supplied Jay-Z and Beyonce perform on stage during TIDAL X: 1020. Picture: Getty Source: Supplied Nicki Minaj and Beyonce perform their single Feeling Myself for the first time. Picture: Getty Source: Getty Images", "external_links": [], "published": "2015-10-22T04:36:00.000+03:00", "crawled": "2015-10-22T04:59:50.819+03:00", "highlightTitle": ""}