{"organizations": ["Huffington Post", "TLC"], "uuid": "338856077ba382a79b92b2ca65e975587e18d61c", "thread": {"social": {"gplus": {"shares": 0}, "pinterest": {"shares": 0}, "vk": {"shares": 0}, "linkedin": {"shares": 0}, "facebook": {"likes": 0, "shares": 0, "comments": 0}, "stumbledupon": {"shares": 0}}, "site_full": "www.onenewspage.com", "main_image": "http://cdn.newsserve.net/ONPglobe256.jpg", "site_section": "http://www.onenewspage.com/rss/latest/Entertainment.rss", "section_title": "Latest Entertainment News on One News Page", "url": "http://www.onenewspage.com/n/Entertainment/7559y0qrt/Watch-the-Tearful-Trailer-for-Jill-and-Jessa.htm", "country": "US", "title": "Watch the Tearful Trailer for Jill and Jessa Duggar's New TLC Special", "performance_score": 0, "site": "onenewspage.com", "participants_count": 0, "title_full": "Watch the Tearful Trailer for Jill and Jessa Duggar's New TLC Special", "spam_score": 0.0, "site_type": "news", "published": "2015-10-20T02:14:00.000+03:00", "replies_count": 0, "uuid": "338856077ba382a79b92b2ca65e975587e18d61c"}, "author": "", "url": "http://www.onenewspage.com/n/Entertainment/7559y0qrt/Watch-the-Tearful-Trailer-for-Jill-and-Jessa.htm", "ord_in_thread": 0, "title": "Watch the Tearful Trailer for Jill and Jessa Duggar's New TLC Special", "locations": ["US"], "entities": {"persons": [], "locations": [], "organizations": []}, "highlightText": "", "language": "english", "persons": ["Jill & Jessa", "Jessa", "Jill Duggar", "Jessa Seewald", "Jill Dillard", "Josh Duggar", "Michelle", "Josh", "Bill Murray", "Jessa Duggar", "Jill"], "text": "Watch the Tearful Trailer for Jill and Jessa Duggar's New TLC Special Monday, 19 October 2015 (10 minutes ago) The network has released a trailer for the upcoming special Jill and Jessa: In the trailer, the sisters reflect on how it felt when earlier this year, the news of their brother Josh molesting them and three other girls when he was a teenager broke. TLC canceled 19 Kids and Counting following the news of Josh's scandal, but Jill and Jessa, as well as their mother Michelle appeared in TLC's Breaking the Silence, a special about sexual abuse. In a new teaser for their upcoming TLC special 'Jill and Jessa: Counting On,' the sisters tearfully address their family's recent hardships. Recent related news Jill Duggar wipes away tears when speaking about her brother Josh Duggar in a new clip from her and her sister Jessa’s upcoming TLC special “Jill & Jessa:... The Wrap 8 hours ago - US Also reported by • Entertainment Tonight The Duggars are back! At least, Jill Dillard and Jessa Seewald are! On Sunday, TLC dropped a sneak peek for Jill & Jessa: Counting On, the upcoming special... Perez Hilton 11 hours ago - Celebrities PlayStation has unveiled a new live-action trailer for the upcoming Star Wars Battlefront on its YouTube channel. The video features a battle taking place on... GameSpot 21 hours ago - Entertainment It may only be October, but we're already thinking about the holiday season thanks to Bill Murray. The first trailer for \"A Very Murray Christmas,\" the... Huffington Post 5 days ago - Entertainment You Might Like Other recent news in Entertainment", "external_links": [], "published": "2015-10-20T02:14:00.000+03:00", "crawled": "2015-10-20T02:23:59.488+03:00", "highlightTitle": ""}