{"organizations": ["News Corp Australia Network Share", "Network", "JK Rowling", "Facebook", "Guitar Trek"], "uuid": "1cf90bfa28510af16caecd8cc5ef466df11bc5c8", "thread": {"social": {"gplus": {"shares": 0}, "pinterest": {"shares": 0}, "vk": {"shares": 0}, "linkedin": {"shares": 0}, "facebook": {"likes": 0, "shares": 0, "comments": 0}, "stumbledupon": {"shares": 0}}, "site_full": "www.news.com.au", "main_image": "http://cdn.newsapi.com.au/image/v1/cd1576abea09d5c3b4d772f3b615d1c0", "site_section": "http://feeds.news.com.au/public/rss/2.0/news_ent_3169.xml", "section_title": "NEWS.com.au | Entertainment", "url": "http://www.news.com.au/entertainment/celebrity-life/harry-potter-play-set-for-london-stage-debut/story-fn907478-1227580675111?from=public_rss", "country": "IL", "title": "Daddy Potter! Harry has son in new play", "performance_score": 0, "site": "news.com.au", "participants_count": 0, "title_full": "Daddy Potter! Harry has son in new play", "spam_score": 0.0, "site_type": "news", "published": "2015-10-23T17:38:00.000+03:00", "replies_count": 0, "uuid": "1cf90bfa28510af16caecd8cc5ef466df11bc5c8"}, "author": "", "url": "http://www.news.com.au/entertainment/celebrity-life/harry-potter-play-set-for-london-stage-debut/story-fn907478-1227580675111?from=public_rss", "ord_in_thread": 0, "title": "Daddy Potter! Harry has son in new play", "locations": ["London"], "entities": {"persons": [], "locations": [], "organizations": []}, "highlightText": "", "language": "english", "persons": ["Noel Mengel", "Burt", "Darren Hayes", "Carlos Greer", "Sam Armytage", "Beyonce", "Rihanna", "Patty", "Daddy Potter", "Patty Griffin", "Harry", "Burt Jenner", "Kathleen Skene", "Caligula", "Beyoncé", "Harry Potter", "Bey", "Siobhan Duck", "Suzanne Plunkett", "Colin Vickery", "Rose Byrne", "Cameron Adams", "Potter", "Jill Scott", "Bobby Cannavale", "Soilwork", "Jay Z"], "text": "Daddy Potter! Harry has son in new play 1:38 AM AP and Network writers THE first-ever Harry Potter play is set to hit the stage and will be a magical sequel, telling the story of a grown-up Harry and his young son. Patty’s latest may also be her greatest 1:00 AM Edited by Noel Mengel ALBUM REVIEWS: Patty Griffin does not do less than great, but her latest may be her greatest yet. PLUS: Boy & Bear, Jill Scott, Soilwork, Caligula’s Horse, The Necks and Guitar Trek Rose Byrne ‘expecting first child’ 0:53 AM Network Writers AUSTRALIAN Rose Byrne is reportedly pregnant with her first child to partner Bobby Cannavale. See her cute baby bump pictures. Sam Armytage takes a reality check 0:00 AM By Siobhan Duck and Colin Vickery AS Sunrise co-host Sam Armytage heads towards 40, she talks Botox, dating, paparazzi pain and that vicious rumour campaign by ‘the sisterhood’. ‘My depression is a poisonous dread’ 22:31 PM Victoria Craw FORMER Savage Garden singer Darren Hayes has opened up about his battle with depression in a lengthy Facebook post about his illness. Burt won’t keep up with Kardashians 18:44 PM Kathleen Skene HE’S a member of the world’s most famous family but Burt Jenner, who is on the Gold Coast for the GC600, is thankful he was sidelined from the reality television juggernaut. Adele’s new single: first review 18:05 PM Cameron Adams National music writer THREE years after her last hit, Adele is back with her new single, Hello, ahead of the worldwide launch of her third studio album, 25. Rihanna rumour caused Beyonce and Jay Z to split 17:21 PM Carlos Greer THE author of an unauthorised biography of Beyoncé says that despite rumours that Jay Z cheated, Bey would never tolerate it. Harry Potter play set for London stage debut October 24, 2015 1:02am New play ... British author JK Rowling’s creation has now spawned a play. Picture: Suzanne Plunkett AP and Network writers News Corp Australia Network Share", "external_links": [], "published": "2015-10-23T17:38:00.000+03:00", "crawled": "2015-10-23T22:37:49.248+03:00", "highlightTitle": ""}