{"organizations": ["Perry Cleaveland & Friends", "Abilene Bar & Lounge", "Seneca St.", "Dope D.O.D.", "Windsor St.", "Farmers Inn", "p.m. Jose & Willy", "Ende Brothers", "Nate & Kate", "p.m. Brew & Brats", "Clifton Springs Library", "Dog House", "Paul Killion & The Tandem Brothers", "N. Water St.", "Canandaigua", "Black-Eyed Susan Acoustic Cafe", "P.O.D.", "Boulder Coffee Co.", "Custom Taylor", "Belhurst Castle", "Allman Brothers", "a.m. Jose & Willy", "Meyer & McGuire"], "uuid": "a776436b1f0af336d575355c92fe52776a8da725", "thread": {"social": {"gplus": {"shares": 0}, "pinterest": {"shares": 0}, "vk": {"shares": 0}, "linkedin": {"shares": 0}, "facebook": {"likes": 0, "shares": 0, "comments": 0}, "stumbledupon": {"shares": 0}}, "site_full": "www.waynepost.com", "main_image": "http://www.waynepost.com/Global/images/head/nameplate/ny-wayne_logo.png", "site_section": "http://www.waynepost.com/entertainment?template=rss&mime=xml", "section_title": "Entertainment - Wayne Post", "url": "http://www.waynepost.com/article/20150930/NEWS/150939955/2052/ENTERTAINMENT?rssfeed=true", "country": "US", "title": "Live music in the Canandaigua/Rochester area", "performance_score": 0, "site": "waynepost.com", "participants_count": 0, "title_full": "Live music in the Canandaigua/Rochester area", "spam_score": 0.0, "site_type": "news", "published": "2015-10-01T06:42:00.000+03:00", "replies_count": 0, "uuid": "a776436b1f0af336d575355c92fe52776a8da725"}, "author": "", "url": "http://www.waynepost.com/article/20150930/NEWS/150939955/2052/ENTERTAINMENT?rssfeed=true", "ord_in_thread": 0, "title": "Live music in the Canandaigua/Rochester area", "locations": ["Rochester", "Nashvilles", "West Lake Road", "Flour City Station", "Monroe Ave.", "Fat City", "W. Ridge Road", "California Brew Haus", "Clifton Springs", "Jefferson Road", "Geneva", "Fairport", "Shortsville", "Farmington", "Culver Road", "Wakins", "Oasis East", "Naples", "New York", "Honeoye Falls", "Arbor Hill", "East Rochester", "West Henrietta Road", "South Ave.", "East Ave."], "entities": {"persons": [], "locations": [], "organizations": []}, "highlightText": "", "language": "english", "persons": ["Zin Vetro", "Connie Deming", "Sonny Vincent", "Hakeem", "Rich", "Tom Whitmore", "Peg Dolan", "Fred", "Weems", "Wayne Post", "Gena Decker", "PJ Elliott", "Matt", "Beale", "Johnny", "John Nyerges", "Hayley Dayis", "John Bolger Band", "Bob", "Sheridan", "Watkins", "John Bolger", "Troy Cusson", "Bromley", "Dej Loaf", "Steve West", "Rylie J", "Norma Jean", "Steve Grills", "Bat McGrath", "Webster", "Casey Bloom", "Casey", "Billy Petito", "Elephino", "Henrietta", "Harmonica Lewinski", "Bill Schmitt", "Tart Vandelay", "Matt Hermann", "Herb Heins", "Danielle Ponder", "Buffalo Bill", "Alexander St.", "Kate Kooser", "Angelica", "Joe Percy", "Evan Meulemans", "Katie Preston"], "text": "Live music in the Canandaigua/Rochester area Comment Posted Sep. 30, 2015 at 10:42 PM Posted Sep. 30, 2015 at 10:42 PM A sampling of live music in the greater Canandaigua/Rochester region: THURSDAY, OCT. 1 Black-Eyed Susan Acoustic Cafe , 22 W. Main St., Angelica, (585) 466-3399: Acoustic Open Mic hosted by Bob and Gena Decker, 7-10 p.m. Buffalo Bill's , 19 Main St., Shortsville, (585) 289-4104: Tom Whitmore (of Wakins and the Rapiers), 7-9 p.m. Bug Jar , 219 Monroe Ave., Rochester, (585) 454-2966: Cavalcade (album release), with Department and Wisdom Kids, 7:30 p.m. California Brew Haus , 402 W. Ridge Road, Rochester,, (585) 6221-1480: Norma Jean, 6 p.m. Flour City Station , 170 East Ave., Rochester, (585) 413-5745: Naughty Professor, 7 p.m. Geneva Farmers Market , Exchange Street parking lot, Geneva: Meyer & McGuire, 9:30 a.m. to 12:30 p.m. Little Theatre Cafe , 240 East Ave., Rochester, (585) 258-0400: The Djangoners, 7:30 p.m. Lovin' Cup , 300 Park Point Drive, Henrietta, (585) 292-9940: The Charlie Hunter Trio, 8 p.m. Lower Mill (Rabbit Room) , 61 N. Main St., Honeoye Falls, (585) 582-1830: Steve West, time TBA. Montage Music Hall , 50 Chestnut St., Rochester: Fit For An Autopsy, with Old Wounds, From the Skies, The Main Cries Panic, Beneath Hell's Sky, 6 p.m. Naples Hotel , 111 S. Main St., Naples, (585) 384-5630: Open Mic with Casey Bloom, 9 p.m. Oasis East , 4520 Route 364, Canandaigua, (585) 905-3268: Open Mic with Matt Hermann, 8-11 p.m. Sticky Lips , 830 Jefferson Road, Henrietta, (585) 292-5544: Uptown Groove, 6-8 p.m. Towpath Cafe , 6 N. Main St., Fairport, (585) 377-0410: Open mic, 7 p.m. FRIDAY, OCT. 2 Abilene Bar & Lounge , 153 Liberty Pole Way, Rochester, (585) 232-3230: Herb Heins and Friends (4:30 p.m., doors 3 p.m.), The Ruddy Well Band (9:30 p.m.) Black-Eyed Susan Acoustic Cafe , 22 W. Main St., Angelica, (585) 466-3399: Nate & Kate, 6:30 p.m. Brew & Brats at Arbor Hill , 6461 Route 64, Naples, (585) 374-2870: Open Mic with Troy Cusson, 6-9 p.m. Boulder Coffee Co. , 100 Alexander St., Rochester, (585) 454-7140: The Amy Hazard Band, 8-10 p.m. Bug Jar , 219 Monroe Ave., Rochester, (585) 454-2966: Harmonica Lewinski, Danger Troll and The Temptators, 8 p.m. Flour City Station , 170 East Ave., Rochester, (585) 413-5745: Live at the Fillmore (Allman Brothers tribute), 8 p.m. Hatter's Pub , 5 W. Main St., Webster, (585) 872-1505: Peg Dolan, 8 p.m. Johnny's , 1382 Culver Road, Rochester, (585) 224-0990: Evan Meulemans (5 p.m.), Dog House (9 p.m.) Lemoncello , 137 W. Commercial St., East Rochester, (585) 385-8565: Shades of Blue, 7-10 p.m. Little Theatre Cafe , 240 East Ave., Rochester, (585) 258-0400: Red, Fred and Weems, 8 p.m. Lovin' Cup , 300 Park Point Drive, Henrietta, (585) 292-9940: The Roc-City Ramblers (9 p.m.), Folkfaces (11 p.m.) Nashvilles , 4853 West Henrietta Road, Henrietta, (585) 334-3030: These Guys, 9 p.m. to 1 a.m. New York Wine and Culinary Center's Upstairs Bistro , 800 S. Main St., Canandaigua, (585) 394-7070: Paul Killion & The Tandem Brothers, 7-10 p.m. Prosecco , 1550 Route 332, Farmington, (585) 924-8000: Katie Preston, 5:30-8:30 p.m.. Remedy at Finger Lakes Gaming & Racetrack , 5857 Route 96, Farmington: Nightfall After Dark (6-8:30 p.m.), Jumbo Shrimp (9 p.m. to midnight). Rylie J's , 38 Seneca St., Geneva, (315) 759-6050: Meyer & McGuire, 6-9 p.m. Sticky Lips , 830 Jefferson Road, Henrietta, (585) 292-5544: Bill Schmitt & The Bluesmasters, 9:30-11:30 p.m. Water Street Music Hall , 204 N. Water St., Rochester, (585) 325-5600: Sirens and Sailors, 6:30 p.m. (doors 6 p.m.) Page 2 of 3 - SATURDAY, OCT. 3 Abilene Bar & Lounge , 153 Liberty Pole Way, Rochester, (585) 232-3230: Steve Grills and the Roadmasters, 9:30 p.m. Beale , 689 South Ave., Rochester, (585) 271-4650: The Infrared Radiation Orchestra, 9:30 p.m. to 12:30 a.m. Boulder Coffee Co. , 100 Alexander St., Rochester, (585) 454-7140: Haunted Gypsy, 8-10 p.m. Brew & Brats at Arbor Hill , 6461 Route 64, Naples, (585) 374-2870: Eva & The Dog Boys, 6-9 p.m. Bug Jar , 219 Monroe Ave., Rochester, (585) 454-2966: The Sun Parade, with Embers, Rustle and Bromley, 9 p.m. (doors 8 p.m.) Flour City Station , 170 East Ave., Rochester, (585) 413-5745: Danielle Ponder and the Tomorrow People, 7 p.m. Johnny's , 1382 Culver Road, Rochester, (585) 224-0990: Fat City, 8 p.m. Jose & Willy's , 20 Lakeshore Drive, Canandaigua, (585) 905-0017: Whiplash & Son, 6-9 p.m. Lemoncello , 137 W. Commercial St., East Rochester, (585) 385-8565: Vintage, 7:30-10:30 p.m. Little Theatre Cafe , 240 East Ave., Rochester, (585) 258-0400: Connie Deming, 8 p.m. Lovin' Cup , 300 Park Point Drive, Henrietta, (585) 292-9940: Bat McGrath, sets at 5 p.m. and 8:30 p.m. Marina Jeep Arena (Main Street Armory) , 900 E. Main St., Rochester, (585) 232-3221: Fall Feast 2015 featuring Dej Loaf, 7:30-11 p.m. Naples Hotel , 111 S. Main St., Naples, (585) 384-5630: PJ Elliott, 9 p.m. Nashvilles , 4853 West Henrietta Road, Henrietta, (585) 334-3030: Custom Taylor, 9 p.m. to 1 a.m. Oasis East , 4520 Route 364, Canandaigua, (585) 905-3268: John Bolger Band, 9 p.m. Prosecco , 1550 Route 332, Farmington, (585) 924-8000: Hannah PK (piano), time TBA. Remedy at Finger Lakes Gaming & Racetrack , 5857 Route 96, Farmington: Shine, 8 p.m. to midnight. Sheridan's Pub , 1551 Mt. Hope Ave., Rochester, (585) 271-7777: Meyer & McGuire, 7-10 p.m. Sticky Lips , 830 Jefferson Road, Henrietta, (585) 292-5544: Joe Percy, 10 p.m. to midnight. Stonecutters at Belhurst Castle , 4069 West Lake Road, Geneva, (315) 781-0201: The Flock, 7-11 p.m. SUNDAY, OCT. 4 Farmers Inn , 26 Coach St., Canandaigua, (585) 393-0129: Hakeem, Matt and Rich, 9 p.m. to 1 a.m. Jose & Willy's , 20 Lakeshore Drive, Canandaigua, (585) 905-0017: John Bolger, 3-6 p.m. Lemoncello , 137 W. Commercial St., East Rochester, (585) 385-8565: Thicker Than Water, 6-9 p.m. MONDAY, OCT. 5 Bug Jar , 219 Monroe Ave., Rochester, (585) 454-2966: Sonny Vincent (of Testors), with Zin Vetro, and Flips---, 9:15 p.m. (doors 9 p.m.) Little Theatre Cafe , 240 East Ave., Rochester, (585) 258-0400: Watkins and the Rapiers, 7 p.m. V-Pub at the Villager , 245 S. Main St., Canandaigua, (585) 394-2890: Open Mic with Hakeem, 9 p.m. Page 3 of 3 - Water Street Music Hall , 204 N. Water St., Rochester, (585) 325-5600: Insane Clown Posse, with P.O.D., Stitches, Young Wicked, Dope D.O.D., 7 p.m. (doors 6 p.m.) TUESDAY, OCT. 6 Bug Jar , 219 Monroe Ave., Rochester, (585) 454-2966: Rustic Radio, with Tart Vandelay and Elephino, 9 p.m. (doors 8 p.m.) Downstairs Cabaret , 20 Windsor St., Rochester, (585) 325-4370: Billy Petito (guitar) and more, 7 p.m. Johnny's , 1382 Culver Road, Rochester, (585) 224-0990: String Theory, 8 p.m. Little Theatre Cafe , 240 East Ave., Rochester, (585) 258-0400: Barrel House String Band, 7:30 p.m. WEDNESDAY, OCT. 7 Bug Jar , 219 Monroe Ave., Rochester, (585) 454-2966: Kate Kooser, with Hayley Dayis and Passives Aggressives Anonymous, 9 p.m. (doors 8 p.m.) Clifton Springs Library , 4 Railroad Ave., Clifton Springs: Perry Cleaveland & Friends, plus open mic, 7-9 p.m. (Tunes by the Tracks concert). Farmers Inn , 26 Coach St., Canandaigua, (585) 393-0129: Open jam with Casey and Hakeem, 9 p.m. to 1 a.m. Johnny's , 1382 Culver Road, Rochester, (585) 224-0990: Improv Plate, 7 p.m. Little Theatre Cafe , 240 East Ave., Rochester, (585) 258-0400: Margaret Explosion, 7 p.m. Sticky Lips , 830 Jefferson Road, Henrietta, (585) 292-5544: Ende Brothers, 6:30-8:30 p.m. Warfields , 7 W. Main St., Clifton Springs, (315) 462-7184: John Nyerges (Jazz Quartet), 5:30-8 p.m. Wayne Post", "external_links": [], "published": "2015-10-01T06:42:00.000+03:00", "crawled": "2015-10-01T08:13:50.505+03:00", "highlightTitle": ""}