{"organizations": ["Evi", "SeaWorld", "International Watch Company", "'N Sync Lance Bass"], "uuid": "792c0ada9f718ee78e83365b5889c576b0f52d20", "thread": {"social": {"gplus": {"shares": 0}, "pinterest": {"shares": 0}, "vk": {"shares": 0}, "linkedin": {"shares": 0}, "facebook": {"likes": 0, "shares": 0, "comments": 0}, "stumbledupon": {"shares": 0}}, "site_full": "www.wfsb.com", "main_image": "http://tvguide.images.worldnow.com/images/5188048_G.jpg", "site_section": "http://www.wfsb.com/category/73801/entertainment?clienttype=rss", "section_title": "WFSB - Entertainment", "url": "http://www.wfsb.com/story/30230983/shia-labeouf-arrested-for-public-drunkenness-in-texas", "country": "US", "title": "Shia LaBeouf arrested for public drunkenness in Texas", "performance_score": 0, "site": "wfsb.com", "participants_count": 0, "title_full": "Shia LaBeouf arrested for public drunkenness in Texas", "spam_score": 0.0, "site_type": "news", "published": "2015-10-13T17:41:00.000+03:00", "replies_count": 0, "uuid": "792c0ada9f718ee78e83365b5889c576b0f52d20"}, "author": "", "url": "http://www.wfsb.com/story/30230983/shia-labeouf-arrested-for-public-drunkenness-in-texas", "ord_in_thread": 0, "title": "Shia LaBeouf arrested for public drunkenness in Texas", "locations": ["Canada", "Austin", "Texas"], "entities": {"persons": [], "locations": [], "organizations": []}, "highlightText": "", "language": "english", "persons": ["James Bond", "Daniel Craig", "John Goodman", "Randy Quaid", "Selena Gomez", "Lance Bass", "Yolanda Foster", "Patricia Schlein"], "text": "Shia LaBeouf arrested for public drunkenness in Texas Updated: Â© PRNewsFoto / International Watch Company, Patricia Schlein / WENN.com TVGuide Photo Galleries More>> Shia LaBeouf has been arrested for public intoxication in Austin, Texas, People reports. More > Shia LaBeouf has been arrested for public intoxication in Austin, Texas, People reports. More > John Goodman showed of a significantly slimmed-down physique on Thursday. More > John Goodman showed of a significantly slimmed-down physique on Thursday. More > Yolanda Foster isn't the only one battling Lyme disease in her family. More > Yolanda Foster isn't the only one battling Lyme disease in her family. More > It was the pic seen 'round the world. More > It was the pic seen 'round the world. More > Selena Gomez is done letting the media tell her story. More > Selena Gomez is done letting the media tell her story. More > Randy Quaid and his wife Evi have been detained in Canada. More > Randy Quaid and his wife Evi have been detained in Canada. More > Daniel Craig would rather kill himself than play James Bond again Only a few weeks before Spectre hits theaters, Daniel Craig said he would prefer suicide to doing a fifth James Bond movie. More > Only a few weeks before Spectre hits theaters, Daniel Craig said he would prefer suicide to doing a fifth James Bond movie. More > Steve-O will go to jail for his SeaWorld protest stunt Steve-O will be spending some time behind bars, but he has no regrets for what he did. More > Steve-O will be spending some time behind bars, but he has no regrets for what he did. More > Lance Bass reveals he was \"inappropriately\" touched while in 'N Sync Lance Bass has revealed that as a teen in 'N Sync he was sexually harassed by someone who worked with the band. More > Lance Bass has revealed that as a teen in 'N Sync he was sexually harassed by someone who worked with the band. More > \nBy Shelli Weinstein, \nShia LaBeouf has been arrested for public intoxication in Austin, Texas, People reports. \nLaBeouf was drunk in the street on Friday evening, in the popular nightlife section around 6th Street. He was arrested without the use of force, though officials said that he was slightly belligerent and uncooperative. \nThis is not the first time has had issues with alcohol and the law. In June 2014 the actor was arrested during a performance of Broadway's Cabaret for being disorderly and verbally abusive. A week after, he sought out treatment for alcohol addiction and later plead guilty to the charges.", "external_links": [], "published": "2015-10-13T17:41:00.000+03:00", "crawled": "2015-10-13T18:21:01.150+03:00", "highlightTitle": ""}