{"organizations": [], "uuid": "8ae14846a17afd50f9f709a023e7de89ba9cf8b8", "thread": {"social": {"gplus": {"shares": 0}, "pinterest": {"shares": 0}, "vk": {"shares": 0}, "linkedin": {"shares": 0}, "facebook": {"likes": 0, "shares": 0, "comments": 0}, "stumbledupon": {"shares": 0}}, "site_full": "theadvocate.com", "main_image": "http://theadvocate.com/csp/mediapool/sites/dt.common.streams.StreamServer.cls?STREAMOID=PQ_twuSq1cMTMwFaZYfOoM$daE2N3K4ZzOUsqbU5sYtyB8zVK0BTFVV4A$5fRFVaWCsjLu883Ygn4B49Lvm9bPe2QeMKQdVeZmXF$9l$4uCZ8QDXhaHEp3rvzXRJFdy0KqPHLoMevcTLo3h8xh70Y6N_U_CryOsw6FTOdKL_jpQ-&CONTENTTYPE=image/jpeg", "site_section": "http://theadvocate.com/feed?feedName=Entertainment&feedURL=http://theadvocate.com/entertainment/&publication=Advocate&sections=/entertainment/&areas=AllEntertainment&counts=20&feedContentPage=/shared/templates/feeds/rss2.csp", "section_title": "The Advocate: Entertainment", "url": "http://theadvocate.com/entertainment/red/13641982-171/hunks-in-heels-returns-next", "country": "US", "title": "Hunks in Heels returns next week", "performance_score": 0, "site": "theadvocate.com", "participants_count": 0, "title_full": "Hunks in Heels returns next week", "spam_score": 0.0, "site_type": "news", "published": "2015-10-09T02:50:00.000+03:00", "replies_count": 0, "uuid": "8ae14846a17afd50f9f709a023e7de89ba9cf8b8"}, "author": "", "url": "http://theadvocate.com/entertainment/red/13641982-171/hunks-in-heels-returns-next", "ord_in_thread": 0, "title": "Hunks in Heels returns next week", "locations": [], "entities": {"persons": [], "locations": [], "organizations": []}, "highlightText": "", "language": "english", "persons": ["Ty Hingle", "Ryan Chenevert", "Racheal Hebert", "Barrinton Neil", "Tracy Donovan Smith", "Pam Bordelon", "Raina Wirta", "Kyle Peveto", "Don Stone"], "text": "Hunks in Heels returns next week Hunks in Heels returns next week File photo -- Ty Hingle at last year's Hunks in Heels. Photo provided by Racheal Hebert -- Artist Raina Wirta created flame-shooting heels with lights for Lieutenant Don Stone to wear in the Hunks in Heels show that benefits the Sexual Trauma Awareness and Response organization. Advocate file photo by Pam Bordelon -- Hunks Tracy Donovan Smith, left, and Ryan Chenevert pose with their artist-created heels at STAR's Hunks in Heels runway show. Advocate file photo by Pam Bordelon -- Barrinton Neil won the award for Hunkiest Heart at last year's STAR's Hunks in Heels runway show. Advocate file photo by Pam Bordelon -- Ryan Chenevert was proclaimed Easiest on the Eyes at last year's STAR's Hunks in Heels runway show. Kyle Peveto | kpeveto@theadvocate.com", "external_links": [], "published": "2015-10-09T02:50:00.000+03:00", "crawled": "2015-10-09T05:41:41.556+03:00", "highlightTitle": ""}