{"organizations": ["Starship Enterprise", "Shell", "BBC America"], "uuid": "57074a4140d97327708fe778858df5844e136037", "thread": {"social": {"gplus": {"shares": 0}, "pinterest": {"shares": 0}, "vk": {"shares": 0}, "linkedin": {"shares": 0}, "facebook": {"likes": 0, "shares": 0, "comments": 0}, "stumbledupon": {"shares": 0}}, "site_full": "edition.cnn.com", "main_image": "http://i2.cdn.turner.com/cnnnext/dam/assets/150306173745-02-supergirl-large-169.jpg", "site_section": "http://rss.cnn.com/rss/cnn_showbiz.rss\r", "section_title": "CNN.com - Entertainment", "url": "http://edition.cnn.com/2015/10/26/entertainment/supergirl-women-tv-feat/index.html?eref=rss_showbiz", "country": "US", "title": "'Supergirl' takes a leap for women on TV", "performance_score": 0, "site": "cnn.com", "participants_count": 0, "title_full": "'Supergirl' takes a leap for women on TV", "spam_score": 0.0, "site_type": "news", "published": "2015-10-26T13:19:00.000+02:00", "replies_count": 0, "uuid": "57074a4140d97327708fe778858df5844e136037"}, "author": "", "url": "http://edition.cnn.com/2015/10/26/entertainment/supergirl-women-tv-feat/index.html?eref=rss_showbiz", "ord_in_thread": 0, "title": "'Supergirl' takes a leap for women on TV", "locations": ["America", "San Diego Comic-Con"], "entities": {"persons": [], "locations": [], "organizations": []}, "highlightText": "", "language": "english", "persons": ["Scully", "Danai Gurira", "Scarlett Johansson", "Peggy Carter", "Sarah", "Zoe Saldana", "Gamora", "Christopher Reeve", "Farnsworth", "Margot Kidder", "Nyota Uhura", "Katey Sagal", "Gillian Anderson", "Sarah Manning", "Johansson", "Sarah Michelle Gellar", "Carrie Fisher", "Melissa Benoist", "Lee Meriwether", "Hermione Granger", "Tatiana Maslany", "Uhura", "Zoe", "Halle Berry", "Linda Hamilton", "Emma Watson", "Michelle Pfeiffer", "Steve Rogers", "Nichelle Nichols", "Margot Robbie", "Katee Sackhoff", "Fox Mulder", "Eartha Kitt", "Neytiri", "Harley Quinn", "Gina Torres", "Starbuck", "Lois", "Emilia Clarke", "Katniss Everdeen", "Jennifer Lawrence", "Anne Hathaway", "Carrie-Anne Moss", "Julie Newmar", "Lucy Lawless", "Michonne", "Leia", "Sigourney Weaver"], "text": "CNN Leadership <div class=\"banner\" id=\"cnn_300x250_sync_freewheel-rail_0_banner\"><span id=\"cnn_300x250_sync_freewheel-rail_0\" class=\"_fwph\"><form id=\"_fw_form_cnn_300x250_sync_freewheel-rail_0\" style=\"display:none\"><input type=\"hidden\" name=\"_fw_input_cnn_300x250_sync_freewheel-rail_0\" id=\"_fw_input_cnn_300x250_sync_freewheel-rail_0\" value=\"ptgt=s&envp=g_js&w=300&h=250&slau=300x250_sync&adUnit=300x250_sync\"></form><span id=\"_fw_container_cnn_300x250_sync_freewheel-rail_0\" class=\"cn-shingle__ad\"></span></span></div> 'Supergirl' takes a leap for women on TV Updated 1115 GMT (1915 HKT) October 26, 2015 25 photos: Badass women of sci-fi Former \"Glee\" star Melissa Benoist (recently seen in the Oscar-nominated \"Whiplash\") plays Supergirl in the CBS series of the same name. Here are a few more sci-fi female action heroines (with some fantasy thrown in). Hide Caption 1 of 25 25 photos: Badass women of sci-fi Gal Gadot's Wonder Woman from \"Batman v Superman: Dawn of Justice\" was unveiled at 2014's San Diego Comic-Con, and her first onscreen appearance in a trailer the following year. Her solo movie is due out in 2017. Hide Caption 2 of 25 25 photos: Badass women of sci-fi Jennifer Lawrence is back as archer and freedom fighter Katniss Everdeen in \"The Hunger Games: Mockingjay, Part 1\" and coming soon, the final film, \"Part 2.\" Hide Caption 3 of 25 25 photos: Badass women of sci-fi Zoe Saldana stars in not one but three major sci-fi movie franchises. She's Lt. Nyota Uhura in the rebooted \"Star Trek\" movies, stars as former assassin Gamora in the Marvel hit \"Guardians of the Galaxy\" and is Neytiri in \"Avatar\" and its planned sequels. Hide Caption 4 of 25 25 photos: Badass women of sci-fi Nichelle Nichols played Lt. Uhura, the communications officer on the Starship Enterprise, in the original \"Star Trek\" TV series and films. In the recent movie reboots her role was played by Zoe Saldana. Hide Caption 5 of 25 25 photos: Badass women of sci-fi Set in the post-World War II years, the new series \"Marvel's Agent Carter\" follows the continuing adventures of Peggy Carter, after the presumed death of her boyfriend Steve Rogers (a.k.a. Captain America). Hide Caption 6 of 25 25 photos: Badass women of sci-fi Scarlett Johansson stole the movie in her first scene in \"The Avengers\" -- not an easy thing to do. Black Widow was pretty kickass in the film. Hide Caption 7 of 25 25 photos: Badass women of sci-fi \"Lucy\" seems to have boosted Johansson's action movie cred. The actress is reportedly starring in the live-action remake of \"Ghost In The Shell.\" Hide Caption 8 of 25 25 photos: Badass women of sci-fi Buffy Summers, played by Sarah Michelle Gellar, was vampires' worst nightmare in the beloved TV series \"Buffy the Vampire Slayer.\" Hide Caption 9 of 25 25 photos: Badass women of sci-fi Margot Robbie will portray Batman villain (and the Joker's paramour) Harley Quinn in the eagerly awaited film \"Suicide Squad.\" Hide Caption 10 of 25 25 photos: Badass women of sci-fi Lucy Lawless found fame on TV as the force of nature that was \"Xena, Warrior Princess.\" Hide Caption 11 of 25 25 photos: Badass women of sci-fi Sigourney Weaver faced off with aliens not once, but four times in the \"Alien\" films and became the very model of the modern sci-fi heroine. Hide Caption 12 of 25 25 photos: Badass women of sci-fi Blasting her way out of the Death Star, we knew fairly quickly that Leia was not one to be trifled with in the \"Star Wars\" films. Carrie Fisher played the role. Hide Caption 13 of 25 25 photos: Badass women of sci-fi Linda Hamilton (pictured) was the best known Sarah, but we look forward to seeing how Emilia Clarke takes on the Terminator in the upcoming reboot. Hide Caption 14 of 25 25 photos: Badass women of sci-fi Carrie-Anne Moss' Trinity was the first main character we saw in the \"Matrix\" and immediately, we were hooked. Hide Caption 15 of 25 25 photos: Badass women of sci-fi Tatiana Maslany's \"clone club\" brings new meaning to the term \"girl power\" on the critically-acclaimed BBC America series \"Orphan Black.\" Maslany plays Sarah Manning on the show. Hide Caption 16 of 25 25 photos: Badass women of sci-fi She may not have \"wanted to believe\" like her partner Fox Mulder, but Gillian Anderson as Scully on \"The X-Files\" was one of the best sci-fi characters of the past 20 years. Hide Caption 17 of 25 25 photos: Badass women of sci-fi It's hard to choose a favorite Lois as there's been so many over the years, but we'll go with Margot Kidder's tough as nails reporter from the Christopher Reeve \"Superman\" movie series. Hide Caption 18 of 25 25 photos: Badass women of sci-fi They switched genders on us with this character in the 2000s reboot, and casting Katee Sackhoff as Starbuck in \"Battlestar Galactica\" was a stroke of genius. Hide Caption 19 of 25 25 photos: Badass women of sci-fi We didn't even see her face but when she used her katana to slice through zombies at the end of season two, we knew we really liked Michonne, actress Danai Gurira, from \"The Walking Dead\" right away. Hide Caption 20 of 25 25 photos: Badass women of sci-fi Emma Watson's Hermione Granger in the \"Harry Potter\" movies always knew just the right spell to get out of any situation. Hide Caption 21 of 25 25 photos: Badass women of sci-fi We'd rather not remember Halle Berry's take on the seductive thief, Catwoman, but Julie Newmar, Eartha Kitt, Lee Meriwether and Anne Hathaway were all splendid in the role. But for our money, Michelle Pfeiffer (pictured) in \"Batman Returns\" is the Catwoman to beat. Hide Caption 22 of 25 25 photos: Badass women of sci-fi Leela, the pilot of the Planet Express ship, often acts as the voice of reason between Fry, Professor Farnsworth and the others in her crew on \"Futurama.\" Katey Sagal is the voice of Leela. Hide Caption 23 of 25 25 photos: Badass women of sci-fi Emilia Clarke's Daenerys Targaryen from \"Game of Thrones\" is so tough that she will literally walk through fire. Hide Caption 24 of 25 25 photos: Badass women of sci-fi Mal trusts no one more than his right-hand woman Zoe, played by Gina Torres, in the beloved, short-lived series \"Firefly.\" Hide Caption", "external_links": [], "published": "2015-10-26T13:19:00.000+02:00", "crawled": "2015-10-26T13:36:53.628+02:00", "highlightTitle": ""}