{"organizations": ["GOTHAM"], "uuid": "1b4c90e088428ed6510d57773b3d98e791fb90a7", "thread": {"social": {"gplus": {"shares": 0}, "pinterest": {"shares": 0}, "vk": {"shares": 0}, "linkedin": {"shares": 0}, "facebook": {"likes": 0, "shares": 0, "comments": 0}, "stumbledupon": {"shares": 0}}, "site_full": "enewsi.com", "main_image": "", "site_section": "http://enewsi.com/xml-rss2.php", "section_title": "Entertainment News International", "url": "http://enewsi.com/news.php?itemid=29074", "country": "US", "title": "Gotham - Episode Images & Synopsis From 2.06 'By Fire'", "performance_score": 0, "site": "enewsi.com", "participants_count": 0, "title_full": "Gotham - Episode Images & Synopsis From 2.06 'By Fire'", "spam_score": 0.0, "site_type": "news", "published": "2015-10-21T02:33:00.000+03:00", "replies_count": 0, "uuid": "1b4c90e088428ed6510d57773b3d98e791fb90a7"}, "author": "", "url": "http://enewsi.com/news.php?itemid=29074", "ord_in_thread": 0, "title": "Gotham - Episode Images & Synopsis From 2.06 'By Fire'", "locations": ["Gotham City", "Gotham"], "entities": {"persons": [], "locations": [], "organizations": []}, "highlightText": "", "language": "english", "persons": ["Ian Quinlan", "Josie", "Leo Fitzpatrick", "Kringle", "Theo Galavan", "Penguin", "Nicholas D'Agosto", "Bridgit", "Chelsea Spack", "Barbara Kean", "Tabitha Galavan", "James Gordon", "Drew Powell", "Donal Logue", "David Mazouz", "Paulina Singer", "Cory Michael Smith", "Camren Bicondova", "Michelle Veintimilla", "Jessica Lucas", "Bruce Wayne", "Lucas Salvagno", "Chris Chalk", "Clare Foley", "Erin Richards", "Ben McKenzie", "Harvey Dent", "Sean Pertwee", "Oswald", "Robin Lord Taylor", "Selina Kyle/the", "Morena Baccarin", "Nygma", "Gertrud Kapelput", "Kristen Kringle", "Galavan", "Michael Chiklis", "Natalie Alyn Lind", "Pinkney", "Martinez", "Joe Pike", "Lucius Fox", "Leslie Thompkins", "Harvey Bullock", "Edward", "Alfred", "Bridgit Pike", "Carol Kane", "Nathaniel Barnes", "James Frain"], "text": "Gotham - Episode Images & Synopsis From 2.06 'By Fire' Reported by Outsiders - 2015.10.20 We have a full gallery of images to the October 26th episode of Gotham, entitled 'By Fire' along with the official synopsis. After Bridgit Pike (guest star Michelle Veintimilla) rejoins her brothers, a new spark of courage ignites within her, as she chooses to take control of her future. Meanwhile, Kringle and Nygmas relationship will take a new step and Penguin and Galavan continue to battle for control of Gotham Citys underworld in the all-new Rise of the Villains: By Fire episode of GOTHAM airing Monday, Oct. 26 (8:00-9:00 PM ET/PT) on FOX. (GTH-206) (TV-14 D, L, S, V) Cast: Ben McKenzie as Detective James Gordon, Donal Logue as Harvey Bullock, Morena Baccarin as Leslie Thompkins, Michael Chiklis as Detective Nathaniel Barnes, Sean Pertwee as Alfred, Robin Lord Taylor as Oswald Cobblepot/The Penguin, Erin Richards as Barbara Kean, David Mazouz as Bruce Wayne, Camren Bicondova as Selina Kyle/the future Catwoman, Cory Michael Smith as Edward Nygma/the future Riddler, James Frain as Theo Galavan, Jessica Lucas as Tabitha Galavan, Chris Chalk as Lucius Fox, Nicholas D'Agosto as Harvey Dent, Drew Powell as Butch Gilzean Guest Cast: Carol Kane as Gertrud Kapelput, Clare Foley as Ivy Pepper, Chelsea Spack as Kristen Kringle, Natalie Alyn Lind as Silver St. Cloud, Paulina Singer as Josie, Ian Quinlan as Pinkney, Lucas Salvagno as Martinez, Michelle Veintimilla as Bridgit, Leo Fitzpatrick as Joe Pike", "external_links": [], "published": "2015-10-21T02:33:00.000+03:00", "crawled": "2015-10-21T03:01:33.578+03:00", "highlightTitle": ""}