{"organizations": ["Associated Press"], "uuid": "263f9a2fbf076d62742f48b852bbb529451cf39c", "thread": {"social": {"gplus": {"shares": 0}, "pinterest": {"shares": 0}, "vk": {"shares": 0}, "linkedin": {"shares": 0}, "facebook": {"likes": 0, "shares": 0, "comments": 0}, "stumbledupon": {"shares": 0}}, "site_full": "www.wmbfnews.com", "main_image": "http://tvguide.images.worldnow.com/images/490372_G.JPG", "site_section": "http://www.wmbfnews.com/Global/category.asp?C=142349&clienttype=rss", "section_title": "WMBF - Entertainment", "url": "http://www.wmbfnews.com/story/30305766/son-of-storage-wars-miami-star-charged-with-murdering-a-family-friend-during-viewing-party", "country": "US", "title": "Son of Storage Wars: Miami star charged with murdering a family friend during viewing party", "performance_score": 0, "site": "wmbfnews.com", "participants_count": 0, "title_full": "Son of Storage Wars: Miami star charged with murdering a family friend during viewing party", "spam_score": 0.0, "site_type": "news", "published": "2015-10-21T21:30:00.000+03:00", "replies_count": 0, "uuid": "263f9a2fbf076d62742f48b852bbb529451cf39c"}, "author": "", "url": "http://www.wmbfnews.com/story/30305766/son-of-storage-wars-miami-star-charged-with-murdering-a-family-friend-during-viewing-party", "ord_in_thread": 0, "title": "Son of Storage Wars: Miami star charged with murdering a family friend during viewing party", "locations": ["Miami", "Calif.", "Fallbrook"], "entities": {"persons": [], "locations": [], "organizations": []}, "highlightText": "", "language": "english", "persons": ["Tracy Morgan", "Hashim Pew", "Khloe Kardashian", "Pat Woodell", "Bobbie Jo Bradley", "Lamar Odom", "Kevin Pew"], "text": "Son of Storage Wars: Miami star charged with murdering a family friend during viewing party - WMBFNews.com, Myrtle Beach/Florence SC, Weather Member Center: Son of Storage Wars: Miami star charged with murdering a family friend during viewing party Updated: Son of Storage Wars: Miami star charged with murdering a family friend during viewing party Hashim Pew, the son of Storage Wars: Miami star Kevin Pew, has been charged with first-degree murder after he allegedly shot and killed a family friend during a viewing party, the Sun Sentinel reports. More >> Hashim Pew, the son of Storage Wars: Miami star Kevin Pew, has been charged with first-degree murder after he allegedly shot and killed a family friend during a viewing party, the Sun Sentinel reports. More >> Petticoat Junction star Pat Woodell dies at 71 Pat Woodell, who played Bobbie Jo Bradley on the 1960s sitcom Petticoat Junction, died of cancer on Sept. 29 at her home in Fallbrook, Calif., The Associated Press reports. She was 71. More >> Pat Woodell, who played Bobbie Jo Bradley on the 1960s sitcom Petticoat Junction, died of cancer on Sept. 29 at her home in Fallbrook, Calif., The Associated Press reports. She was 71. More >> Khloe Kardashian has finally broken her silence about her estranged husband Lamar Odom's recent hospitalization. More >> Khloe Kardashian has finally broken her silence about her estranged husband Lamar Odom's recent hospitalization. More >> Tracy Morgan is continuing his comeback by launching a full-scale stand-up tour next year. More >> Tracy Morgan is continuing his comeback by launching a full-scale stand-up tour next year. More >> \nBy Liz Raftery, \nHashim Pew, the son of Storage Wars: Miami star Kevin Pew , has been charged with first-degree murder after he allegedly shot and killed a family friend during a viewing party, the Sun Sentinel reports. \nHashim and Kevin Pew were at a viewing party in Florida to watch the show on Oct. 13 when Hashim, 23, allegedly shot and killed Janel Hamilton, 19, according to the Sun Sentinel . Authorities are still trying to determine a motive for the shooting. The party was being held at the Pew family's townhouse, where Hashim and his mother were living. Hamilton, who is the goddaughter of Hashim's mother and had recently returned from attending high school in England, was staying at the house. \nPolice were called to the home around 10 p.m. and arrested Hashim, who is charged with premeditated murder. They recovered a .45-caliber handgun from the scene, which had been stolen during a 2008 burglary in central Florida, according to the Sun Sentinel . \nOther Links From TVGuide.com", "external_links": [], "published": "2015-10-21T21:30:00.000+03:00", "crawled": "2015-10-21T22:17:47.321+03:00", "highlightTitle": ""}