{"organizations": [], "uuid": "f1c0306e2e166215209ef2ad5955d22fdd8ccde5", "thread": {"social": {"gplus": {"shares": 0}, "pinterest": {"shares": 0}, "vk": {"shares": 0}, "linkedin": {"shares": 0}, "facebook": {"likes": 0, "shares": 0, "comments": 0}, "stumbledupon": {"shares": 0}}, "site_full": "www.newschannel10.com", "main_image": "http://tvguide.images.worldnow.com/images/9022619_G.jpg", "site_section": "http://www.newschannel10.com/category/73801/entertainment?clienttype=rss", "section_title": "KFDA - Entertainment", "url": "http://www.newschannel10.com/story/30265544/khloe-kardashian-is-making-medical-decisions-on-lamar-odoms-behalf", "country": "US", "title": "Khloe Kardashian is making medical decisions on Lamar Odom's behalf", "performance_score": 0, "site": "newschannel10.com", "participants_count": 0, "title_full": "Khloe Kardashian is making medical decisions on Lamar Odom's behalf", "spam_score": 0.0, "site_type": "news", "published": "2015-10-15T23:30:00.000+03:00", "replies_count": 0, "uuid": "f1c0306e2e166215209ef2ad5955d22fdd8ccde5"}, "author": "", "url": "http://www.newschannel10.com/story/30265544/khloe-kardashian-is-making-medical-decisions-on-lamar-odoms-behalf", "ord_in_thread": 0, "title": "Khloe Kardashian is making medical decisions on Lamar Odom's behalf", "locations": ["Las Vegas", "Austin", "Texas", "Nevada"], "entities": {"persons": [], "locations": [], "organizations": []}, "highlightText": "", "language": "english", "persons": ["Odom", "Bette Midler", "Victor Garber", "Khloe Kardashian", "Hugh Grant", "Kardashian", "Rainer Andreesen", "John Stamos", "Lamar Odom", "Amy Poehler"], "text": "Lamar Odom has been found unconscious and unable to breathe at a Nevada brothel, TMZ reports. Lamar Odom has been found unconscious and unable to breathe at a Nevada brothel, TMZ reports. Lamar Odom reportedly overdosed on drugs Drugs were found in Lamar Odom's system after he   at a Nevada brothel, E! News reports. Drugs were found in Lamar Odom's system after he   at a Nevada brothel, E! News reports. Khloe Kardashian is making medical decisions on Lamar Odom's behalf Things are not looking good for Lamar Odom and the Kardashian family. Odom is currently in a coma and remains unresponsive in a Las Vegas hospital. Things are not looking good for Lamar Odom and the Kardashian family. Odom is currently in a coma and remains unresponsive in a Las Vegas hospital. John Stamos charged with DUI John Stamos has been officially charged with one count of driving under the influence in relation to his arrest in June, TMZ reports. John Stamos has been officially charged with one count of driving under the influence in relation to his arrest in June, TMZ reports. Hugh Grant is expecting his fourth child, Entertainment Tonight reports. Hugh Grant is expecting his fourth child, Entertainment Tonight reports. Victor Garber married his boyfriend of 16 years, artist and model Rainer Andreesen, on Saturday. Victor Garber married his boyfriend of 16 years, artist and model Rainer Andreesen, on Saturday. Some say love... is Amy Poehler belting out Bette Midler. Some say love... is Amy Poehler belting out Bette Midler. Shia LaBeouf has been arrested for public intoxication in Austin, Texas, People reports. Shia LaBeouf has been arrested for public intoxication in Austin, Texas, People reports. \nBy Shelli Weinstein, \nThings are not looking good for Lamar Odom and the Kardashian family. Odom is currently in a coma and remains unresponsive in a Las Vegas hospital. \nSince Odom   in a Nevada brothel on Tuesday, his estranged wife Khloe Kardashian has been at his bedside, responsible for making decisions about his medical care because she is still technically his wife, People reports. Odom and Kardashian signed divorce papers in July after splitting in 2013, but since their case has not yet been entered into court, their marriage still stands legally. \nSources say that Khloe is \"lost,\" trying to make decisions for him. \nScott Disick checks into rehab for drug and alcohol addiction \nThe former Lakers player's condition is currently being treated as an overdose . He has also possibly suffered an ischemic stroke, which is caused by a blood clot cutting off blood flow to the brain. \nDespite an earlier People report that had claimed E! filmed Khloe as she rushed to Odom's side, E! denied this claim. The network told EW that \" Keeping Up With the Kardashians is not currently shooting in Las Vegas.\"", "external_links": [], "published": "2015-10-15T23:30:00.000+03:00", "crawled": "2015-10-16T06:45:26.166+03:00", "highlightTitle": ""}