{"organizations": ["Galen Center", "NBC", "Bridgestone Arena", "Microsoft"], "uuid": "3ee4cc876d320357d21f6a9799c137ad09b279ca", "thread": {"social": {"gplus": {"shares": 0}, "pinterest": {"shares": 0}, "vk": {"shares": 0}, "linkedin": {"shares": 0}, "facebook": {"likes": 0, "shares": 0, "comments": 0}, "stumbledupon": {"shares": 0}}, "site_full": "www.whio.com", "main_image": "http://media.cmgdigital.com/shared/img/photos/2015/10/21/71/c4/391603ab958040ccbfcca0887ed5435a-783a9de6108b4662998cc1088bf0c9cc-0.jpg", "site_section": "http://www.whio.com/feeds/categories/entertainment/", "section_title": "News | Entertainment", "url": "http://www.whio.com/ap/ap/entertainment/gomez-underwood-to-perform-at-american-music-award/nn63C/", "country": "US", "title": "Gomez, Underwood to perform at American Music Awards", "performance_score": 0, "site": "whio.com", "participants_count": 0, "title_full": "Gomez, Underwood to perform at American Music Awards", "spam_score": 0.0, "site_type": "news", "published": "2015-10-21T15:53:00.000+03:00", "replies_count": 0, "uuid": "3ee4cc876d320357d21f6a9799c137ad09b279ca"}, "author": "", "url": "http://www.whio.com/ap/ap/entertainment/gomez-underwood-to-perform-at-american-music-award/nn63C/", "ord_in_thread": 0, "title": "Gomez, Underwood to perform at American Music Awards", "locations": ["New York", "Nashville", "Tenn", "Los Angeles"], "entities": {"persons": [], "locations": [], "organizations": []}, "highlightText": "", "language": "english", "persons": ["Carrie Underwood", "Chris Pizzello/Invision/AP", "Wade", "Charles Sykes/Invision/AP", "Michael Clifford", "Luke Hemmings", "Ashton Irwin", "Selena Gomez", "Underwood", "Calum Hood", "Gomez"], "text": "Updated: 8:53 a.m. Wednesday, Oct. 21, 2015 | Posted: 8:53 a.m. Wednesday, Oct. 21, 2015 Gomez, Underwood to perform at American Music Awards Related View Larger FILE - In this Monday, Oct. 12, 2015, file photo, Selena Gomez performs on NBC's \"Today\" show at Rockefeller Plaza in New York. Gomez, Carrie Underwood and 5 Seconds of Summer will be performing at the American Music Awards, on Nov. 22, 2015, at the Microsoft Theater in Los Angeles. (Photo by Charles Sykes/Invision/AP, File) View Larger FILE - In this Aug. 16, 2015, file photo, Luke Hemmings, from left, Ashton Irwin, Michael Clifford and Calum Hood, of 5 Seconds of Summer, arrive at the Teen Choice Awards at the Galen Center, in Los Angeles. Selena Gomez, Carrie Underwood and 5 Seconds of Summer will be performing at the American Music Awards, on Nov. 22, 2015, at the Microsoft Theater in Los Angeles. (Photo by Chris Pizzello/Invision/AP, File) View Larger FILE - In this June 10, 2015, file photo, Carrie Underwood performs at the CMT Music Awards at Bridgestone Arena in Nashville, Tenn. Selena Gomez, Underwood and 5 Seconds of Summer will be performing at the American Music Awards, on Nov. 22, 2015, at the Microsoft Theater in Los Angeles. (Photo by Wade Payne/Invision/AP, File) Sponsored Links The Associated Press LOS ANGELES â€” \nSelena Gomez, Carrie Underwood and 5 Seconds of Summer will be performing at the American Music Awards. \nDick clark productions announced Wednesday that the pop acts will each take the stage at the Nov. 22 show at the Microsoft Theater in Los Angeles. All three have new albums out this month. \nShow host Jennifer Lopez is also set to perform at the ceremony, which will be broadcast live on ABC. \nTaylor Swift leads nominees with six bids, followed by Ed Sheeran and The Weeknd with five each. Nominations are based on sales, airplay and social media activity. Fans select the winners by voting online. Copyright The Associated Press Sign up for our WHIO-TV Daily Headlines Newsletter Sign Up", "external_links": [], "published": "2015-10-21T15:53:00.000+03:00", "crawled": "2015-10-21T17:00:01.598+03:00", "highlightTitle": ""}