{"organizations": ["FBI", "AP Photo/Ken Murray", "Lufthansa", "AP Photo/Elizabeth Williams"], "uuid": "b5770edd9825a68b8fe457a35cf1b2264781a765", "thread": {"social": {"gplus": {"shares": 0}, "pinterest": {"shares": 0}, "vk": {"shares": 0}, "linkedin": {"shares": 0}, "facebook": {"likes": 0, "shares": 0, "comments": 0}, "stumbledupon": {"shares": 0}}, "site_full": "www.wmcactionnews5.com", "main_image": "http://images.worldnow.com/AP/images/9048974_G.jpg", "site_section": "http://www.wmctv.com/category/13540/news?clienttype=rss", "section_title": "WMC Action News 5 - Entertainment - Headline", "url": "http://www.wmcactionnews5.com/story/30295273/aging-gangster-accused-of-goodfellas-heist-goes-on-trial", "country": "US", "title": "Aging gangster accused of 'Goodfellas' heist goes on trial", "performance_score": 0, "site": "wmcactionnews5.com", "participants_count": 0, "title_full": "Aging gangster accused of 'Goodfellas' heist goes on trial", "spam_score": 0.0, "site_type": "news", "published": "2015-10-19T21:19:00.000+03:00", "replies_count": 0, "uuid": "b5770edd9825a68b8fe457a35cf1b2264781a765"}, "author": "", "url": "http://www.wmcactionnews5.com/story/30295273/aging-gangster-accused-of-goodfellas-heist-goes-on-trial", "ord_in_thread": 0, "title": "Aging gangster accused of 'Goodfellas' heist goes on trial", "locations": ["New York", "U.S.", "Brooklyn"], "entities": {"persons": [], "locations": [], "organizations": []}, "highlightText": "", "language": "english", "persons": ["James", "Gerald McMahon", "Asaro", "Jerome", "Charles Eckert/Newsday", "Burke", "Vincent Asaro"], "text": "Employment and Internship Opportunities Aging gangster accused of 'Goodfellas' heist goes on trial (AP Photo/Elizabeth Williams, File). In this Jan. 23, 3014 courtroom drawing, Vincent Asaro, left, is joined by his attorney, Gerald McMahon, at federal court in New York. Asaro, 78, was named along with his son, Jerome, and three other defendants in w... (AP Photo/File). In this April, 1979 file photo, James \"Jimmy the Gent\" Burke is led handcuffed from a law enforcement vehicle in New York. Burke is believed to have masterminded and executed the 1978 Lufthansa heist. Vincent Asaro, a mob associate of ... (Charles Eckert/Newsday, via AP, File). In this Jan. 23, 2014 file photo, FBI agents flank Vincent Asaro as they escort the reputed mobster from FBI offices in New York. More than 30 years after one of the largest cash robberies in U.S. history, the no... (AP Photo/Ken Murray, File). In this Dec. 13, 1978 file photo, police cordon off an area around a stolen black van discovered in the Brooklyn borough of New York. Police suspect the van was used by thieves who escaped with more than $6 million in cash ... \nNEW YORK (AP) - An aging gangster is being tried on charges he was in on a legendary mob heist recounted in the hit film \"Goodfellas.\" \nIn opening statements Monday, a prosecutor told federal jurors in New York City that the $6 million Lufthansa holdup in 1978 was \"the score of all scores\" for Vincent Asaro and other mobsters. \nAsaro's lawyer countered by accusing the government of building its case on the testimony of shady turncoat gangsters. \nProsecutors say the 80-year-old Asaro was a member of the Bonanno crime family for decades. Along with the Lufthansa heist, they say he and the late mobster James Burke killed a truck driver in 1969 after becoming convinced he was an informant. \nRobert De Niro played a character based on Burke in the 1990 Martin Scorsese movie. Copyright 2015 The Associated Press. All rights reserved. This material may not be published, broadcast, rewritten or redistributed.", "external_links": [], "published": "2015-10-19T21:19:00.000+03:00", "crawled": "2015-10-19T21:40:19.309+03:00", "highlightTitle": ""}