{"organizations": ["Photo Bank NBC", "MTV EMA", "NBC", "Sony Pictures Studios", "Eminem", "Facebook Email Twitter Google", "Facebook Photos", "AMC Loews Lincoln Square", "MTV Eminem"], "uuid": "5dbb41f6754b310e25cb692a61e8289f85391ae5", "thread": {"social": {"gplus": {"shares": 0}, "pinterest": {"shares": 0}, "vk": {"shares": 0}, "linkedin": {"shares": 0}, "facebook": {"likes": 0, "shares": 0, "comments": 0}, "stumbledupon": {"shares": 0}}, "site_full": "www.thv11.com", "main_image": "http://cdn.tegna-tv.com/-mm-/3ec5745a389a93d40ddc2543324e6e75f26ecda2/c=0-30-594-366&amp;r=x1683&amp;c=3200x1680/local/-/media/2015/10/17/KTHV/KTHV/635806993221483656-eminem2.jpg", "site_section": "http://rssfeeds.thv11.com/_/20/107011144/kthv/entertainment", "section_title": "KTHV - Entertainment", "url": "http://www.thv11.com/picture-gallery/entertainment/2015/10/17/photos-eminem-through-the-years/74138274/", "country": "US", "title": "Photos: Eminem through the years", "performance_score": 0, "site": "thv11.com", "participants_count": 0, "title_full": "Photos: Eminem through the years", "spam_score": 0.0, "site_type": "news", "published": "2015-10-18T00:22:00.000+03:00", "replies_count": 0, "uuid": "5dbb41f6754b310e25cb692a61e8289f85391ae5"}, "author": "", "url": "http://www.thv11.com/picture-gallery/entertainment/2015/10/17/photos-eminem-through-the-years/74138274/", "ord_in_thread": 0, "title": "Photos: Eminem through the years", "locations": ["United States", "California", "New York City", "AMSTERDAM", "New York", "Culver City", "NEW YORK", "Louisiana", "Netherlands", "Amsterdam", "Los Angeles", "New Orleans"], "entities": {"persons": [], "locations": [], "organizations": []}, "highlightText": "", "language": "english", "persons": ["Kirk McKoy Fullscreen", "Dave J Hogan", "Ron Wolfson/WireImage", "Flanigan", "Kirsten Dunst", "Sean DeMarco", "Kirk McKoy", "John", "Kevin Mazur/WireImage", "Ron Wolfson", "Dana Edelson/NBCU", "Rihanna", "Jeff Kravitz/FilmMagic", "Kevin Kane/WireImage", "Jeff Kravitz", "Chris Parnell", "Kyle DeMarco", "Eminem", "Kevin Mazur", "Tamara DeMarco", "Kevin Kane", "Dave J", "Lindsay Lohan", "Chris Kattan"], "text": "Facebook Email Twitter Google+ LinkedIn Pinterest Photos: Eminem through the years Kirk McKoy x75462 –– – 024976.CA.0221.EminemJohn1.km –– Elton John and Eminem at the 43rd Grammy Award Show held at Staples Center Wednesday Feb. 21, 2001. Post to Facebook Photos: Eminem through the years Kirk McKoy x75462 –– – 024976.CA.0221.EminemJohn1.km –– Elton John and Eminem at the 43rd Grammy Award Show held at Staples Center Wednesday Feb. 21, 2001.  //on.kthv.com/1LAMuLV   Join the Conversation To   Photos: Eminem through the years Kirk McKoy x75462 –– – 024976.CA.0221.EminemJohn1.km –– Elton John and Eminem at the 43rd Grammy Award Show held at Staples Center Wednesday Feb. 21, 2001. Kirk McKoy Fullscreen AMSTERDAM, NETHERLANDS - NOVEMBER 10: (EXCLUSIVE COVERAGE) Eminem poses in his dressing room with the 'Best Hip Hop' and 'Global Icon' awards during the MTV EMA's 2013 at the Ziggo Dome on November 10, 2013 in Amsterdam, Netherlands. (Photo by Dave J Hogan/Getty Images for MTV) Dave J Hogan, Getty Images for MTV Eminem and Rihanna perform onstage during The 53rd Annual GRAMMY Awards held at Staples Center on February 13, 2011 in Los Angeles, California. Jeff Kravitz, FilmMagic NEW ORLEANS - OCTOBER 30: Hip-Hop Vocalist Eminem (aka. Marshall Mathers) performs during Day 1 of the 2009 Voodoo Experience at City Park on October 30, 2009 in New Orleans, Louisiana. (Photo by C Flanigan/FilmMagic) C Flanigan, FilmMagic (EXCLUSIVE, Premium Rates Apply) NEW YORK - OCTOBER 15: *Exclusive* 50 Cent, Eminem and LL Cool J attend \"Eminem: The Way I Am\" book release party at Nort/Recon on October 15, 2008 in New York. (Photo by Kevin Mazur/WireImage) Kevin Mazur, WireImage Lindsay Lohan and Eminem during 2005 MTV Movie Awards - Show at Shrine Auditorium in Los Angeles, California, United States. (Photo by Jeff Kravitz/FilmMagic) Jeff Kravitz, FilmMagic Eminem during MTV Movie Awards 2004 - Show at Sony Pictures Studios in Culver City, California, United States. (Photo by KMazur/WireImage) KMazur, WireImage 50 Cent and Eminem at the 2003 MTV Video Music Awards (Photo by Kevin Kane/WireImage) Kevin Kane, WireImage Fullscreen SATURDAY NIGHT LIVE -- Episode 19 -- Air Date 05/11/2002 -- Pictured: (l-r) Rapper Proof, Eminem, Chris Kattan as Kyle DeMarco, Chris Parnell as Sean DeMarco, Kirsten Dunst as Tamara DeMarco during the \"Audition for Eminem\" skit on May 11, 2002 -- Photo by: Dana Edelson/NBCU Photo Bank NBC, NBC via Getty Images (EXCLUSIVE, Premium Rates Apply) Eminem at The Source Hip Hop Awards at the Pasadena Civic Auditorium September 15, 2000. (Photo by Ron Wolfson/WireImage) Ron Wolfson, WireImage Eminem during The 2000 MTV Video Music Awards at Radio City Music Hall in New York City, New York, United States. (Photo by KMazur/WireImage) KMazur, WireImage attends the \"Southpaw\" New York premiere at AMC Loews Lincoln Square on July 20, 2015 in New York City. Kevin Mazur Like this topic? You may also like these photo galleries: Replay", "external_links": [], "published": "2015-10-18T00:22:00.000+03:00", "crawled": "2015-10-18T00:45:40.358+03:00", "highlightTitle": ""}