{"organizations": ["Nashville Symphony", "Nashville Zoo", "TENNESSEAN El Dia de los Muertos Cheekwood", "Tennessee State Museum", "The Tennessea Haunted Museum Hear"], "uuid": "e65b367b595d7fb618f3a6f1619bb50b2bab43a5", "thread": {"social": {"gplus": {"shares": 0}, "pinterest": {"shares": 0}, "vk": {"shares": 0}, "linkedin": {"shares": 0}, "facebook": {"likes": 0, "shares": 0, "comments": 0}, "stumbledupon": {"shares": 0}}, "site_full": "www.tennessean.com", "main_image": "http://www.gannett-cdn.com/-mm-/17fda462d0e9c3ed20590334f644090e501b4453/c=0-649-3000-2344&amp;r=x633&amp;c=1200x630/local/-/media/2015/09/24/Nashville/Nashville/635787097653648663-NASBrd-10-25-2013-Tennessean-1-E006--2013-10-23-IMG-Pumpkinfest-1-1-N95FAN8O-L305987286-IMG-Pumpkinfest-1-1-N95FAN8O.jpg", "site_section": "http://rssfeeds.tennessean.com/nashville/entertainment", "section_title": "Nashville - Entertainment", "url": "http://www.tennessean.com/story/life/family/2015/10/05/10-family-friendly-halloween-events-nashville/72702900/", "country": "US", "title": "10 family-friendly Halloween events in Nashville", "performance_score": 0, "site": "tennessean.com", "participants_count": 0, "title_full": "10 family-friendly Halloween events in Nashville", "spam_score": 0.0, "site_type": "news", "published": "2015-10-05T16:04:00.000+03:00", "replies_count": 0, "uuid": "e65b367b595d7fb618f3a6f1619bb50b2bab43a5"}, "author": "", "url": "http://www.tennessean.com/story/life/family/2015/10/05/10-family-friendly-halloween-events-nashville/72702900/", "ord_in_thread": 0, "title": "10 family-friendly Halloween events in Nashville", "locations": ["Grassmere", "Nashville", "Franklin", "Pumpkinfest", "Tennessee", "Nashville Boo"], "entities": {"persons": [], "locations": [], "organizations": []}, "highlightText": "", "language": "english", "persons": ["Larry McCormack", "Mary Doherty", "Booville", "Samuel M. Simpkins/The Tennessea Hauntings", "Harry Potter", "JAE S. LEE", "Mark Zaleski", "Mark Zaleski Hauntanel", "Larry McCormack/The Tennessean", "Igor Stravinsky", "Dipti Vaidya", "Shelley Mays", "Jen Todd", "Halloscream Addison Perry", "Meriwether Lewis", "Edward Grieg"], "text": "10 family-friendly Halloween events in Nashville Boo at the Zoo Formerly called Ghouls at Grassmere, the Nashville Zoo invites families to come after hours for trick-or-treating, games, bounce house, hay maze, corn pit, photos with a princess, Howl-O-Ween Hayride through the Bubble Tunnel, and Grave Matters: The Stories Behind the Stones. Dipti Vaidya, The Tennessean Pumpkinfest Franklin's annual festival returns with Church of the City's Kid Zone, costume contests for humans and pets, live performances, chili cook off, the giant Great Pumpkin and more. Mark Zaleski Hauntanel The Fontanel Mansion hosts a Haunted Hayride (for all ages), trick-or-treating, The Dead Among Us zombie walking trail (for ages 10 and up), and a scarecrow contest. Samuel M. Simpkins/The Tennessea Hauntings at The Hermitage Take a ghost tour of the mansion, Presidential Trick or Treat Trail, and a haunted hayride through The Hermitage woods. JAE S. LEE / THE TENNESSEAN El Dia de los Muertos Cheekwood celebrates the Hispanic Day of the Dead holiday with a tapete -or colorful \"carpet\" -contest created by local schools, ofrendas (altars) created by local organizations, live music and dances. Mark Zaleski, Mark Zaleski / For The Tennessea Haunted Museum Hear ghost stories during Haunted Museum at the Tennessee State Museum on Saturday. Local spirits will be on hand to tell ghost stories during Haunted Museum at the Tennessee State Museum on Saturday. Submitted Submitted Booville and Halloscream Addison Perry,2, dressed up as a pinata during a children costume contest at the 31st annual Pumpkinfest in downtown Franklin on Sat. Oct. 25, 2014. The 31st annual Pumpkinfest in downtown Franklin on Sat. Oct. 25, 2014. Shelley Mays Spooky Science and Chemistry Day Watch experiments with disappearing and reappearing dye and color-changing fire, a pumpkin powder keg and more at the Adventure Science Center. McIninch, Getty Images/iStockphoto Trick or Treat with the Nashville Symphony Halloween-themed concert by the Nashville Symphony, playing Hedwig's Theme from Harry Potter, Edward Grieg’s In the Hall of the Mountain King and music from Igor Stravinsky’s Firebird Suite. Pre-concert activities include crafts, story nook and instrument petting zoo. Larry McCormack/The Tennessean, The Tennessean Twisted Tennessee: Two Sides to Every Tale Tour the grounds of the historic home to hear two sides of true Tennessee stories, from child axe murderer Mary Doherty to the death of Meriwether Lewis. Larry McCormack / The Tennessean Like this topic? You may also like these photo galleries: Replay Last Slide Next Slide Boo at the Zoo Formerly called Ghouls at Grassmere, the Nashville Zoo invites families to come after hours for trick-or-treating, games, bounce house, hay maze, corn pit, photos with a princess, Howl-O-Ween Hayride through the Bubble Tunnel, and Grave Matters: The Stories Behind the Stones. Dipti Vaidya, The Tennessean Jen Todd , jtodd1@tennessean.com 8:04 a.m. CDT October 5, 2015 Costumes are welcome in these family-friendly, Nashville-area events, including Pumpkinfest in Franklin. (Photo: Mark Zaleski) 48 CONNECT TWEET LINKEDIN COMMENT EMAIL MORE \nFrom trick-or-treating to hayrides, costumed kids of all ages can enjoy these Nashville-area events. Boo at the Zoo, formerly Ghouls at Grassmere \nActivities: Trick-or-treating, games, bounce house, hay maze, corn pit, photos with a princess, Howl-O-Ween Hayride through the Bubble Tunnel, Grave Matters: The Stories Behind the Stones \nWhen: 5-9 p.m. Fridays-Sundays from Oct. 16-30, plus Oct. 29 \nWhere: Nashville Zoo, 9777 Nolensville Pike \nTickets: $15, $12 for members, free for babies under 2 years old \nDetails: www.nashvillezoo.org/boo , 615-833-1534 Pumpkinfest \nActivities: Church of the City's Kid Zone, costume contests for humans and pets, live performances, chili cook off, the Great Pumpkin \nWhen: 10 a.m.-6 p.m. Oct. 24 \nWhere: Main Street in Historic Downtown Franklin \nTickets: Free \nSeveral Nashville-area events offer family-friendly haunted hayrides for the Halloween season. (Photo: File / The Tennessean) Hauntanel \nActivities: Haunted Hayride (for all ages), trick-or-treating, The Dead Among Us zombie walking trail (for ages 10 and up), scarecrow contest \nWhen: 7-11 p.m. Oct. 23-24 \nWhere: Fontanel Mansion, 4225 Whites Creek Pike \nTickets: $15 \nDetails: www.hauntanel.com , 615-724-1600 Hauntings at the Hermitage \nActivities: Ghost tour of the mansion, Presidential Trick or Treat Trail, haunted hayride through The Hermitage woods \nWhen: 4-10 p.m. Oct. 24 \nWhere: The Hermitage, 4580 Rachel's Lane \nTickets: $14, $9 for ages 4-12 El Dia de los Muertos at Cheekwood \nCheekwood celebrates El Dia de los Muertos, or Day of the Dead, Oct. 24. (Photo: Mark Zaleski / For The Tennessea) \nActivities: See tapete — or colorful \"carpet\" — contest created by local schools, ofrendas (altars) created by local organizations, live music and dances \nWhen: 10 a.m.-5 p.m. Oct. 24 \nWhere: Cheekwood, 1200 Forrest Park Drive \nTickets: $14, free for children 17 and under and members \nDetails: www.cheekwood.org , 615-356-8000 Haunted Museum \nActivities: Ghost trail through the museum, Tennessee ghost stories, prizes, crafts, drinks, visit to see the 3,500-year-old mummy and mummified cat \nWhen: noon-4 p.m. Oct. 24 \nWhere: Tennessee State Museum, 505 Deaderick Street \nTickets: Free \nDetails: www.tnmuseum.org , 615-741-2692 Booville and Halloscream \nActivities: Booville: Hay bale maze, bounce houses, crafts, costume contest, storytelling, trick-or-treat trail, games, Tennessee's largest Frankenstein. Trail of Terror: Zombies, crazy clowns, insane scientists, and evil spirits. Haunted Hayride: Backwoods killers, freak show clowns and werewolves. \nWhen: Booville is noon-5 p.m. Saturdays and Sundays in October; Halloscream is 7-11 p.m. Fridays and Saturdays, 7-10 p.m. Sundays in October and Nov. 1 \nWhere: Nashville Shores, 4001 Bell Road \nTickets: $15 Trail of Terror, $25 Trail of Terror and Haunted Hayride, $5.99 Booville \nNote: Costumes are allowed in Booville, but not allowed in Halloscream \nCostumes are welcome in these family-friendly, Nashville-area Halloween events. (Photo: Shelley Mays) Spooky Science & Chemistry Day \nActivities: E xperiments with disappearing and reappearing dye and color-changing fire, a pumpkin powder keg and more. \nWhen: 10 a.m.-3 p.m. Oct. 31 \nWhere: Adventure Science Museum, 800 Fort Negley Blvd. \nTickets: $14, $11 for ages 2-12 \nDetails: www.adventuresci.org , 615-862-5160 Trick or Treat with the Nashville Symphony \nActivities: Halloween-themed concert by the Nashville Symphony, playing Hedwig's Theme from Harry Potter, Edward Grieg’s In the Hall of the Mountain King and music from Igor Stravinsky’s Firebird Suite. Pre-concert activities include crafts, story nook and instrument petting zoo. \nWhen: 11 a.m. Oct. 31 \nWhere: Schermerhorn Symphony Center, One Symphony Place \nTickets: $23-$28, $14-$19 for children 17 and under \nDetails: www.nashvillesymphony.org , 615-687-6400 Twisted Tennessee: Two Sides to Every Tale \nActivities: Tour of the historic home to hear two sides of true Tennessee stories, from child axe murderer Mary Doherty to the death of Meriwether Lewis. \nWhen: 6-10 p.m. Oct. 23 \nWhere: Travellers Rest, 636 Farrell Pkwy \nTickets: $10, $5 ages 5-9, free for children 4 and under 48 CONNECT TWEET LINKEDIN COMMENT EMAIL MORE Read or Share this story: http://tnne.ws/1LdGYi3 More Stories", "external_links": [], "published": "2015-10-05T16:04:00.000+03:00", "crawled": "2015-10-06T06:26:04.521+03:00", "highlightTitle": ""}