{"organizations": ["Olivier Rousteing & Beats Celebrate In Los Angeles", "Balmain", "Olivier Rousteing & Beats Celebrate In Los Angeles Corey Gamble"], "uuid": "6a90f9598da0b4fae8c5c80c1b606a5bd3f288c6", "thread": {"social": {"gplus": {"shares": 0}, "pinterest": {"shares": 0}, "vk": {"shares": 0}, "linkedin": {"shares": 0}, "facebook": {"likes": 0, "shares": 0, "comments": 0}, "stumbledupon": {"shares": 0}}, "site_full": "www.nydailynews.com", "main_image": "http://assets.nydailynews.com/polopoly_fs/1.2409920!/img/httpImage/image.jpg_gen/derivatives/landscape_1200/olivier-rousteing-beats-celebrate-los-angeles.jpg", "site_section": "http://www.nydailynews.com/entertainment/photos/index_rss.xml", "section_title": "Entertainment Galleries - NY Daily News", "url": "http://www.nydailynews.com/entertainment/stars-glam-balmain-designer-oliver-rousteing-birthday-bash-gallery-1.2409939?old=/gallery.html", "country": "US", "title": "Stars glam up for Balmain designer Oliver Rousteing's birthday bash", "performance_score": 0, "site": "nydailynews.com", "participants_count": 0, "title_full": "Stars glam up for Balmain designer Oliver Rousteing's birthday bash", "spam_score": 0.0, "site_type": "news", "published": "2015-10-24T22:10:00.000+03:00", "replies_count": 0, "uuid": "6a90f9598da0b4fae8c5c80c1b606a5bd3f288c6"}, "author": "", "url": "http://www.nydailynews.com/entertainment/stars-glam-balmain-designer-oliver-rousteing-birthday-bash-gallery-1.2409939?old=/gallery.html", "ord_in_thread": 0, "title": "Stars glam up for Balmain designer Oliver Rousteing's birthday bash", "locations": ["California", "Balmain", "Los Angeles"], "entities": {"persons": [], "locations": [], "organizations": []}, "highlightText": "", "language": "english", "persons": ["Jaden Smith", "Kim Kardashian West", "Jada Pinkett Smith", "Kourtney Kardashian", "Jennifer Lopez", "Willow Smith", "Kardashian", "Mary J. Blige", "Kris Jenner", "Oliver Rousteing", "Stefanie"], "text": "Blogs Stars glam up for Balmain designer Oliver Rousteing's birthday bash Balmain designer Oliver Rousteing has had a busy week with a widely covered fashion show and now a party packed with A-listers like the Kardashian clan and and Jennifer Lopez. Photo: Stefanie Keenan/Getty Images./ Published: 10/24/2015 3:10:57 Olivier Rousteing & Beats Celebrate In Los Angeles Corey Gamble, Kris Jenner, Kourtney Kardashian, Mary J. Blige, Jada Pinkett Smith, Jaden Smith, Kim Kardashian West and Willow Smith attend Olivier Rousteing & Beats Celebrate In Los Angeles at Private Residence on October 23, 2015 in Los Angeles, California. 1 of 18", "external_links": [], "published": "2015-10-24T22:10:00.000+03:00", "crawled": "2015-10-24T22:34:03.088+03:00", "highlightTitle": ""}