{"organizations": ["Corus", "Corus Entertainment", "CMT", "Historia", "CKNW", "Bento Box Entertainment Partner", "Cartoon Network", "Disney", "Kids Can Press", "ABC Spark", "FOX", "Disney Channel", "Nelvana", "YTV", "Corus Quay", "Corus Entertainment Inc", "Canada Corus Entertainment", "Corus Entertainment Inc.", "Toronto Stock Exchange", "Oprah Winfrey Network", "Bento Box Entertainment"], "uuid": "f1de22e6a7178f69feb7dd816e236ef788a89dd1", "thread": {"social": {"gplus": {"shares": 0}, "pinterest": {"shares": 0}, "vk": {"shares": 0}, "linkedin": {"shares": 0}, "facebook": {"likes": 0, "shares": 0, "comments": 0}, "stumbledupon": {"shares": 0}}, "site_full": "www.newswire.ca", "main_image": "", "site_section": "http://rss.newswire.ca/en/newswire/rls_ent_en.xml?0E4CAE8E599E11E2B9D5B34A46C71D46", "section_title": "CNW :  Entertainment", "url": "http://www.newswire.ca/news-releases/corus-entertainment-and-bento-box-entertainment-partner-to-launch-bento-box-canada-530661801.html", "country": "CA", "title": "Corus Entertainment and Bento Box Entertainment Partner to Launch Bento Box Canada", "performance_score": 0, "site": "newswire.ca", "participants_count": 0, "title_full": "Corus Entertainment and Bento Box Entertainment Partner to Launch Bento Box Canada", "spam_score": 0.0, "site_type": "news", "published": "2015-10-05T17:30:00.000+03:00", "replies_count": 0, "uuid": "f1de22e6a7178f69feb7dd816e236ef788a89dd1"}, "author": "", "url": "http://www.newswire.ca/news-releases/corus-entertainment-and-bento-box-entertainment-partner-to-launch-bento-box-canada-530661801.html", "ord_in_thread": 0, "title": "Corus Entertainment and Bento Box Entertainment Partner to Launch Bento Box Canada", "locations": ["Chamberlain Heights", "France", "HULU", "TELETOON", "Canada", "CANNES", "Atlanta", "Bento Box Canada", "HBO Canada", "Los Angeles", "Toronto"], "entities": {"persons": [], "locations": [], "organizations": []}, "highlightText": "", "language": "english", "persons": ["Scott Greenberg", "Hill", "Brickleberry", "Anders Morgenthaler", "Mark McJimsey", "Joel Kuwahara", "Allen Gregory", "Wulff", "Nickelodeon", "Scott Dyer", "Mikael Wulff", "Colin Bohm", "Brett Coker", "Bob", "TÉLÉTOON", "Morgenthaler"], "text": "Corus Entertainment and Bento Box Entertainment Partner to Launch Bento Box Canada New partnership to develop and produce animated series targeting 18-34 demographic Production begins on The Pandas , from internationally renowned comic strip creators CANNES, France , Oct. 5, 2015 /CNW/ - Corus Entertainment Inc. and Bento Box Entertainment, LLC today announced the creation of Bento Box Canada , an animation production company based in Toronto . The venture follows last year's announcement of the multi-year, co-development deal between the two companies. As part of the agreement, Bento Box Entertainment and Corus will work side-by-side to develop and produce a slate of original, primetime animated series for Corus networks, to be distributed internationally by Bento Box Entertainment. The partnership will draw on Bento Box Entertainment's award-winning experience and relationships with acclaimed primetime comedy writers, showrunners and animators as well as the expertise of Corus' animation studio, Nelvana, to produce animated series targeted to the 18 to 34 demographic. Bento Box Canada will operate from Corus Quay , the state-of-the-art technical facility that is home to Corus and Nelvana, and will utilize creative, technical, and back office services from both companies. \"Over the past year, our teams at Corus and Bento Box Entertainment have been collaborating on a creative pipeline that will see a raft of edgy new animated series come to light for 2016,\" said Scott Dyer , President, Nelvana. \"We're excited to be bringing two world-class teams together to produce fresh new content for the savvy, millennial demographic.\" This fall, production will begin on the first Bento Box Canada series, The Pandas . From creators Mikael Wulff and Anders Morgenthaler , The Pandas is an irreverent, animated family comedy full of hard jokes, whimsical wonder, biting satire and just the right amount of heart. \"Bento Box Entertainment is thrilled to be joining forces with Corus to develop a creative slate of primetime animated programming,\" said Scott Greenberg , CEO and Co-Founder, Bento Box Entertainment. \" The Pandas is an ideal first project to launch this collaboration as it brings together a team of strong creators in Wulff and Morgenthaler, as well as the production expertise of both Bento Box Entertainment and Corus.\" Bento Box Canada's board of directors will include Scott Greenberg , CEO of Bento Box Entertainment, Brett Coker , Chief Operating Officer, Bento Box Entertainment, Colin Bohm , Executive Vice President, Head of Corus Kids and Scott Dyer , President of Nelvana. Along with other executives from Corus, Nelvana and Bento Box Entertainment, the board will provide strategic leadership and assist in growing the production slate. Bento Box Entertainment is known for producing the Emmy ® award-winning series, Bob's Burgers , as well as Brickleberry, The Awesomes, Allen Gregory , and Out There . Founded by Scott Greenberg , Mark McJimsey and Joel Kuwahara , the company brings years of experience in producing and creating audience-favorite primetime animation hits on multiple platforms. Prior to Bento Box Entertainment, their collective production credits include The Simpsons and The Simpsons Movie, King of the Hill and The Goode Family among many others. About Bento Box Entertainment Bento Box Entertainment is an Emmy ® award-winning studio that develops and produces quality animated content for all distribution platforms worldwide. With studios in Los Angeles and Atlanta , the company is recognized as the leading producer of primetime animated comedy series for broadcast, cable and digital networks. Bento Box Entertainment is currently in production on: the Emmy ® award-winning series Bob's Burgers on FOX; Legends of Chamberlain Heights on Comedy Central; The Awesomes on HULU; Bordertown premiering on FOX in 2016; the puppet series Glove & Boots on YouTube; and multiple other pilots and presentations for the leading studios, networks and distribution platforms. Visit Bento Box Entertainment on the web at www.bentoboxent.com . About Corus Entertainment Inc. Corus Entertainment Inc. is a Canadian-based media and entertainment company that creates, broadcasts and licenses content across a variety of platforms for audiences around the world. The company's portfolio of multimedia offerings encompasses specialty television and radio with additional assets in pay television, television broadcasting, children's book publishing, children's animation and animation software. Corus' brands include ABC Spark, Cartoon Network (Canada), CMT (Canada), Disney Channel (Canada), HBO Canada, Nickelodeon (Canada), OWN: Oprah Winfrey Network (Canada), TELETOON, Treehouse, W Network, YTV, Historia, La chaîne Disney, Séries+, TÉLÉTOON as well as Nelvana, Kids Can Press, Toon Boom and 39 radio stations including CKNW AM 980, Rock 101, Country 105, 630 CHED, Fresh Radio, JUMP! 106.9, Q107 and 102.1 the Edge. A publicly traded company, Corus is listed on the Toronto Stock Exchange (CJR.B). Experience Corus on the web at www.corusent.com . Follow Corus PR on Twitter @CorusPR Follow Bento Box on Twitter @bentoboxent", "external_links": [], "published": "2015-10-05T17:30:00.000+03:00", "crawled": "2015-10-05T17:41:14.702+03:00", "highlightTitle": ""}