{"organizations": ["Food Network & Cooking... Just Jared", "HBO... Huffington Post", "Huffington Post", "US Bradley Cooper", "Reuters", "US Amy Schumer", "Bradley Cooper Applauds Sienna Miller For Fighting For Better Wage 00:46 Bradley Cooper", "Entertainment Bradley Cooper"], "uuid": "06a0f6588bec67b14e95d4cae6bfb0da0989eae7", "thread": {"social": {"gplus": {"shares": 0}, "pinterest": {"shares": 0}, "vk": {"shares": 0}, "linkedin": {"shares": 0}, "facebook": {"likes": 0, "shares": 0, "comments": 0}, "stumbledupon": {"shares": 0}}, "site_full": "www.onenewspage.com", "main_image": "http://cdn.newsserve.net/ONPglobe256.jpg", "site_section": "http://www.onenewspage.com/rss/latest/Entertainment.rss", "section_title": "Latest Entertainment News on One News Page", "url": "http://www.onenewspage.com/n/Entertainment/7559y3tr3/Bradley-Cooper-and-Sienna-Miller-talk-Hollywood-wage.htm", "country": "US", "title": "Bradley Cooper and Sienna Miller talk Hollywood wage gap, new film", "performance_score": 0, "site": "onenewspage.com", "participants_count": 0, "title_full": "Bradley Cooper and Sienna Miller talk Hollywood wage gap, new film", "spam_score": 0.0, "site_type": "news", "published": "2015-10-23T20:26:00.000+03:00", "replies_count": 0, "uuid": "06a0f6588bec67b14e95d4cae6bfb0da0989eae7"}, "author": "", "url": "http://www.onenewspage.com/n/Entertainment/7559y3tr3/Bradley-Cooper-and-Sienna-Miller-talk-Hollywood-wage.htm", "ord_in_thread": 0, "title": "Bradley Cooper and Sienna Miller talk Hollywood wage gap, new film", "locations": ["New York", "NEW YORK", "ABCNews.com"], "entities": {"persons": [], "locations": [], "organizations": []}, "highlightText": "", "language": "english", "persons": ["Bradley", "Bradley Cooper", "Jennifer Lawrence", "Sienna Miller"], "text": "Bradley Cooper and Sienna Miller talk Hollywood wage gap, new film Friday, 23 October 2015 (4 minutes ago) \"Burnt\" co-stars who are reuniting after \"American Sniper\" are vocalizing their take on the gender pay disparity Bradley Cooper Applauds Sienna Miller For Fighting For Better Wage 00:46 Bradley Cooper has stepped into the ongoing Hollywood debate over equal wages by saluting his “American Sniper” co-star Sienna Miller for standing firm and pulling out of a play over poor pay.The Brit was promoting the pair’s new movie, “Burnt,” when she revealed she quit a theatrical... Recent related news In their new movie, Bradley Cooper portrays a hotheaded chef who is looking to resurrect his career and earn his third Michelin star. He seeks help from a... CBS News 4 hours ago - US Amy Schumer doesn't need more reasons to celebrate, but she just got one. The \"Inside Amy Schumer\" star already won an Emmy, just starred in her own HBO... Huffington Post 2 days ago - Entertainment NEW YORK (Reuters) - \"American Sniper\" co-stars Bradley Cooper and Sienna Miller reunite to cook up a storm in \"Burnt\" as formidable chefs in the culinary... Reuters 2 days ago - Entertainment Also reported by • Just Jared The stars of the upcoming culinary comedy-drama “Burnt” proved that it was even hotter on the red carpet than it was in the kitchen on Tuesday. Bradley... The Wrap 3 days ago - US Bradley Cooper looks so handsome while walking the red carpet at the premiere of his movie Burnt on Tuesday (October 20) at the Museum of Modern Art in New York... Just Jared 3 days ago - Entertainment Also reported by • USATODAY.com The actresses weigh in on Bradley Cooper's plan to address pay gap. ABCNews.com 3 days ago - Entertainment Bradley Cooper flashes a smile alongside his co-star Sienna Miller at a private screening of their latest film Burnt held during the 2015 Food Network & Cooking... Just Jared 4 days ago - Entertainment In an interview with E!, Bradley Cooper and Sienna Miller -- who star in the upcoming \"Burnt\" together -- learned about Jennifer Lawrence's essay published in... Huffington Post 1 week ago - Entertainment You Might Like", "external_links": [], "published": "2015-10-23T20:26:00.000+03:00", "crawled": "2015-10-23T20:30:12.627+03:00", "highlightTitle": ""}