{"organizations": ["AM Network Vision DELTA Goodrem", "Maxim", "Delta Goodrem", "Tiffany Dunk National TV", "Getty Network Vision News Corp Australia Network Share Email"], "uuid": "f5d34b7b79f6e9f558d4c97a5a3896bed5f67c4c", "thread": {"social": {"gplus": {"shares": 0}, "pinterest": {"shares": 0}, "vk": {"shares": 0}, "linkedin": {"shares": 0}, "facebook": {"likes": 0, "shares": 0, "comments": 0}, "stumbledupon": {"shares": 0}}, "site_full": "www.news.com.au", "main_image": "http://cdn.newsapi.com.au/image/v1/3064f89ba6a7f32e1e155e628dcaf4ff", "site_section": "http://feeds.news.com.au/public/rss/2.0/news_ent_3169.xml", "section_title": "NEWS.com.au | Entertainment", "url": "http://www.news.com.au/entertainment/books-magazines/delta-goodrem-poses-topless-as-she-is-named-the-hottest-woman-in-australia-by-maxim/story-fnk84xng-1227578072624?from=public_rss", "country": "IL", "title": "Delta Goodrem’s sexiest shoot ever", "performance_score": 0, "site": "news.com.au", "participants_count": 0, "title_full": "Delta Goodrem’s sexiest shoot ever", "spam_score": 0.0, "site_type": "news", "published": "2015-10-22T01:44:00.000+03:00", "replies_count": 0, "uuid": "f5d34b7b79f6e9f558d4c97a5a3896bed5f67c4c"}, "author": "", "url": "http://www.news.com.au/entertainment/books-magazines/delta-goodrem-poses-topless-as-she-is-named-the-hottest-woman-in-australia-by-maxim/story-fnk84xng-1227578072624?from=public_rss", "ord_in_thread": 0, "title": "Delta Goodrem’s sexiest shoot ever", "locations": ["Australia", "China"], "entities": {"persons": [], "locations": [], "organizations": []}, "highlightText": "", "language": "english", "persons": ["Richie Strahan", "Lamar", "JERRY Seinfeld", "Richie", "Sam", "Kardashian", "Lamar Odom", "Sam Frost", "Michael"], "text": "First Lady suffers make-up fail 9:46 AM Network Vision IN another embarrassing make-up malfunction, the wife of China’s President is the latest victim of the white powder blunder that trips up so many celebs. Delta Goodrem’s sexiest shoot ever 9:44 AM Network Vision DELTA Goodrem has been named the hottest woman in Australia, posing topless in her sexiest photo shoot yet. Time to say goodbye to Mythbusters 9:21 AM Staff Writers IT’S officially the end of the road for Mythbusters, with the long-running unscripted show set to conclude with its upcoming 14th series. Khloe and Lamar ‘call off divorce’ 8:57 AM Network Writers KHLOE Kardashian has reportedly called off her divorce to former basketball star Lamar Odom, who has signed papers from his hospital bed. Seinfeld is the world’s highest paid comedian 8:46 AM Staff Writers JERRY Seinfeld is still raking it in more than 15 years after his sitcom wrapped up on TV. Bachelorette dumping no one saw coming 8:20 AM Charlotte Willis A HEARTBREAKING Bachelorette rose ceremony saw Sam Frost say goodbye to the man many fans thought would be her final choice. Richie: Sam should pick Michael 8:20 AM Tiffany Dunk National TV Editor TEARS were shed when Richie Strahan was eliminated on The Bachelorette. So how is he faring four months on? And would he sign on to become the next Bachelor? Delta Goodrem poses topless as she is named the hottest woman in Australia by Maxim October 22, 2015 8:45am Sexier than ever ... Delta Goodrem tops Maxim’s hot 100 list. Picture: Getty Network Vision News Corp Australia Network Share Email a friend \nDELTA Goodrem has been named the hottest woman in Australia, posing in her sexiest photo shoot yet. \nThe 30-year-old singer graces the cover of Maxim’s annual Hot 100 issue, beating Hollywod A-lister Margot Robbie for the top spot. \nWhile Goodrem has been gradually showing her sexier side with her ensembles on The Voice, she’s clearly shaken off any remaining inhibitions with the steamy cover shoot. \nSporting wet hair and a smouldering glare, the starlet is tastefully covered up by the edge of a glistening pool. \n“I feel most comfortable in my body now than I ever have. I feel sexier,” she told Who Magazine in July. Super excited to be Number #1 on Maxim's prestigious hot 100 thank you so much guys!  #honored #girlpower xo pic.twitter.com/h4O5RTGpQ9 — Delta Goodrem (@DeltaGoodrem) October 21, 2015 \nGoodrem has come a long way since her breakthrough on Neighbours, recently nabbing her ninth No. 1 single with Wings. She’sset to make her theatre debut in a revival of the Andrew Lloyd Webber classic Cats. Delta Goodrem \nBlonde bombshell Margot Robbie rang in the number two spot on this year’s list, followed by sportswoman Ellyse Perry in third. \nRecent Maxim cover-girl, Bachelorette Sam Frost, came in at fourth ahead of 2013 Maxim winner, Australia’s Next Top Model host Jennifer Hawkins. 2013 Winner ... Jennifer Hawkin earns Maxim Australia top spot. Picture: Maxim Magazine Source: Supplied \nWhile Goodrem’s sexy shoot was a collaborative effort, the annual edition has sparked controversy in the past. Last year’s title holder Iggy Azalea was less than impressed with her cover. \n“This morning I see you’ve allowed Maxim Australia to buy an image from a 2011 Complex mag shoot and put it on the cover” the rapper blasted the Australian division of her record label. \n“Maxim Australia, thanks for the love and I’m sorry no one asked me. I would have love to have given an interview & done a shoot with u guys.” Bachelorette Sam Frost poses topless. Picture: Maxim Magazine Source: Supplied 2014 winner ... Rapper Iggy Azalea. Picture: Maxim Magazine Source: Supplied", "external_links": [], "published": "2015-10-22T01:44:00.000+03:00", "crawled": "2015-10-22T02:59:45.795+03:00", "highlightTitle": ""}