{"organizations": ["NBA", "AP"], "uuid": "061d47a67709cf42b3f933d7fa790b4d749d6fa0", "thread": {"social": {"gplus": {"shares": 0}, "pinterest": {"shares": 0}, "vk": {"shares": 0}, "linkedin": {"shares": 0}, "facebook": {"likes": 0, "shares": 0, "comments": 0}, "stumbledupon": {"shares": 0}}, "site_full": "www.wmcactionnews5.com", "main_image": "", "site_section": "http://www.wmctv.com/category/13540/news?clienttype=rss", "section_title": "WMC Action News 5 - Entertainment - Headline", "url": "http://www.wmcactionnews5.com/story/30254666/former-nba-star-odom-found-unconscious-at-nevada-brothel", "country": "US", "title": "Former NBA star Odom found unconscious at Nevada brothel", "performance_score": 0, "site": "wmcactionnews5.com", "participants_count": 0, "title_full": "Former NBA star Odom found unconscious at Nevada brothel", "spam_score": 0.0, "site_type": "news", "published": "2015-10-14T05:47:00.000+03:00", "replies_count": 0, "uuid": "061d47a67709cf42b3f933d7fa790b4d749d6fa0"}, "author": "", "url": "http://www.wmcactionnews5.com/story/30254666/former-nba-star-odom-found-unconscious-at-nevada-brothel", "ord_in_thread": 0, "title": "Former NBA star Odom found unconscious at Nevada brothel", "locations": ["California", "Baltimore", "San Francisco", "Marin County", "Northern California", "Nevada"], "entities": {"persons": [], "locations": [], "organizations": []}, "highlightText": "", "language": "english", "persons": ["Clinton", "Agostini", "Hillary Rodham Clinton", "Odom", "Freddie Gray", "Lamar Odom", "Sanders"], "text": "Former NBA star Odom found unconscious at Nevada brothel (Source: AP Photo/Evan Agostini) Authorities say former NBA and reality TV star Lamar Odom has been hospitalized after he was found unconscious at a Nevada brothel. More >> Former NBA and reality TV star Lamar Odom was hospitalized after he was found unconscious Tuesday at a Nevada brothel, authorities said. More >> AP FACT CHECK: Clinton, Sanders revise history in Dem debate Hillary Rodham Clinton offered some revisionist history Tuesday night when insisting she's not a flip-flopper on a trade deal that she heartily promoted as secretary of state but turned against last week as a... More >> Hillary Rodham Clinton revised history in the Democratic debate when insisting she's not a flip-flopper on a trade deal she promoted as secretary of state but turned against as a presidential candidate. More >> Alleged triggerman identified in killing of tourist, hiker Three young transients charged in the shooting deaths of a Canadian backpacker in San Francisco and a yoga instructor in Marin County have been booked into a California jail and face arraignment later this week. More >> Prosecutors on Tuesday identified the alleged triggerman among the three transients charged with the shooting deaths of a Canadian backpacker and a yoga instructor in Northern California last week. More >> Freddie Gray hearing: Officer's 2 statements admissible The statements two Baltimore police officers made to investigators probing the death of Freddie Gray can be used at the officers' trials, a judge ruled Tuesday. More >> The statements two Baltimore police officers made to investigators probing the death of Freddie Gray can be used at the officers' trials, a judge ruled Tuesday. More >>", "external_links": [], "published": "2015-10-14T05:47:00.000+03:00", "crawled": "2015-10-14T05:55:23.908+03:00", "highlightTitle": ""}