{"organizations": ["AM Tiffany Dunk National TV", "ABC", "NBA", "AP Network Writers News Corp Australia Network Share", "Tiffany Dunk National TV"], "uuid": "8f210f65a07190d485ba504d84ccf881f8267205", "thread": {"social": {"gplus": {"shares": 0}, "pinterest": {"shares": 0}, "vk": {"shares": 0}, "linkedin": {"shares": 0}, "facebook": {"likes": 0, "shares": 0, "comments": 0}, "stumbledupon": {"shares": 0}}, "site_full": "www.news.com.au", "main_image": "http://cdn.newsapi.com.au/image/v1/d7bcba64ac0edf37bca90c822b32eac1", "site_section": "http://feeds.news.com.au/public/rss/2.0/news_ent_3169.xml", "section_title": "NEWS.com.au | Entertainment", "url": "http://www.news.com.au/entertainment/celebrity-life/justin-bieber-on-dad-jeremy-biebers-awkward-penis-post/story-fn907478-1227576367249?from=public_rss", "country": "IL", "title": "Bieber on dad’s awkward penis post", "performance_score": 0, "site": "news.com.au", "participants_count": 0, "title_full": "Bieber on dad’s awkward penis post", "spam_score": 0.0, "site_type": "news", "published": "2015-10-20T16:27:00.000+03:00", "replies_count": 0, "uuid": "8f210f65a07190d485ba504d84ccf881f8267205"}, "author": "", "url": "http://www.news.com.au/entertainment/celebrity-life/justin-bieber-on-dad-jeremy-biebers-awkward-penis-post/story-fn907478-1227576367249?from=public_rss", "ord_in_thread": 0, "title": "Bieber on dad’s awkward penis post", "locations": ["US"], "entities": {"persons": [], "locations": [], "organizations": []}, "highlightText": "", "language": "english", "persons": ["Bieber", "Angus Sampson", "Jeremy Bieber", "Justin Bieber", "Kardashian", "Lamar Odom", "Angus", "James Hetherington", "James Harden", "Shannon Molloy", "Tiffany Bakker CLIVE Owen", "NICKI Wendt", "Debbie Schipp", "Michael J. Fox", "Mary Elizabeth Mastrantonio", "Clive Owen", "JUSTIN Bieber"], "text": "Happy Back to the Future day, everyone! 0:30 AM James Hetherington IT’S October 21, 2015 — and that’s a pretty special day for any fans of Back To The Future, the much-loved trilogy of movies starring Michael J. Fox. Bieber on dad’s awkward penis post 0:27 AM Network Writers JUSTIN Bieber has responded to his dad’s awkward tweet boasting about the size of his son’s penis. Khloe ‘splits’ from boyfriend 0:21 AM Network Writers KHLOE Kardashian has reportedly split from NBA star James Harden to support her hospitalised estranged husband, Lamar Odom. The big US role Angus almost missed 0:00 AM Shannon Molloy National TV Writer HAD the Channel Ten drama Party Tricks not been axed, Angus Sampson would’ve missed out on a major US role that looks set to make his career overseas. Limitless actor can’t watch herself 0:00 AM Tiffany Dunk National TV Editor SHE’S been nominated for an Oscar, had a thirty plus year career yet Mary Elizabeth Mastrantonio says she still cringes watching herself on TV. Clive Owen’s bathroom promise to wife 0:00 AM Tiffany Bakker CLIVE Owen, the film star, reveals why he was lured to the brilliant TV drama The Knick and his apprehension about intimate scenes with an actor. Changes ahead for The Bachelorette 0:00 AM Tiffany Dunk National TV Editor NOBODY expected The Bachelorette to be such a huge rating smash and Channel Ten is to cash in with a special episode and longer series next year. ’I bed three men in six episodes’ 0:00 AM Debbie Schipp National TV writer NICKI Wendt is pleased with her strike rate as the riotous former first lady on ABC’s The Ex-PM and admits it’s the most fun she has had on TV. Justin Bieber on dad, Jeremy Bieber’s awkward penis post October 20, 2015 11:27pm Hilarious ... Justin Bieber has defended his dad’s tweet boasting about the size of his penis. Picture: AP Network Writers News Corp Australia Network Share", "external_links": [], "published": "2015-10-20T16:27:00.000+03:00", "crawled": "2015-10-20T17:31:09.551+03:00", "highlightTitle": ""}