{"organizations": ["ABC", "MTV", "Bell"], "uuid": "cc51b8796ccf658d2ccc05fc81372c00b92a3b86", "thread": {"social": {"gplus": {"shares": 0}, "pinterest": {"shares": 0}, "vk": {"shares": 0}, "linkedin": {"shares": 0}, "facebook": {"likes": 0, "shares": 0, "comments": 0}, "stumbledupon": {"shares": 0}}, "site_full": "www.kpho.com", "main_image": "http://tvguide.images.worldnow.com/images/8720337_G.jpg", "site_section": "http://kpho.com//category/73801/entertainment?clienttype=rss", "section_title": "KPHO Phoenix - Entertainment", "url": "http://www.kpho.com/story/30349373/justin-bieber-was-the-big-winner-at-the-mtv-emas", "country": "US", "title": "Justin Bieber was the big winner at the MTV EMAs", "performance_score": 0, "site": "kpho.com", "participants_count": 0, "title_full": "Justin Bieber was the big winner at the MTV EMAs", "spam_score": 0.0, "site_type": "news", "published": "2015-10-26T17:30:00.000+02:00", "replies_count": 0, "uuid": "cc51b8796ccf658d2ccc05fc81372c00b92a3b86"}, "author": "", "url": "http://www.kpho.com/story/30349373/justin-bieber-was-the-big-winner-at-the-mtv-emas", "ord_in_thread": 0, "title": "Justin Bieber was the big winner at the MTV EMAs", "locations": ["Las Vegas", "North America"], "entities": {"persons": [], "locations": [], "organizations": []}, "highlightText": "", "language": "english", "persons": ["Evangeline Lilly", "Chris Rock", "Shani James", "Jimmy Green", "Rock", "Green", "Lark Voorhies", "Norman Kali", "Jared Fogle", "Kim", "Justin Bieber", "Lamar Odom"], "text": "Cee Lo Green and his longtime girlfriend Shani James are engaged, People reports. More > Cee Lo Green and his longtime girlfriend Shani James are engaged, People reports. More > Justin Bieber was the big winner at the MTV EMAs Justin Bieber's comeback year continued at Sunday's MTV Europe Music Awards, where the singer took home five prizes, including Best Male Performer, Biggest Fans and Best Worldwide Act (North America). More > Justin Bieber's comeback year continued at Sunday's MTV Europe Music Awards, where the singer took home five prizes, including Best Male Performer, Biggest Fans and Best Worldwide Act (North America). More > Evangeline Lilly and her longtime boyfriend Norman Kali have welcomed their second child, People reports. More > Evangeline Lilly and her longtime boyfriend Norman Kali have welcomed their second child, People reports. More > Jared Fogle's victims are getting some justice. More > Jared Fogle's victims are getting some justice. More > Lamar Odom's medical drama isn't over. More > Lamar Odom's medical drama isn't over. More > Saved by the Bell's Lark Voorhies calls off six-month marriage Just six months after marrying in Las Vegas, Saved by the Bell's Lark Voorhies and her husband Jimmy Green are getting a divorce, TMZ reports. More > Just six months after marrying in Las Vegas, Saved by the Bell's Lark Voorhies and her husband Jimmy Green are getting a divorce, TMZ reports. More > We're guessing Kim's not going to be too happy about this. More > We're guessing Kim's not going to be too happy about this. More > Chris Rock is hosting the Oscars Chris Rock will host the 2016 Oscars, ABC announced Wednesday. This will be Rock's second time hosting the awards show, which he previously emceed in 2005. More > Chris Rock will host the 2016 Oscars, ABC announced Wednesday. This will be Rock's second time hosting the awards show, which he previously emceed in 2005. More > \nBy Liz Raftery, \nJustin Bieber 's comeback year continued at Sunday's MTV Europe Music Awards, where the singer took home five prizes, including Best Male Performer, Biggest Fans and Best Worldwide Act (North America). \nBieber also performed his song \"What Do You Mean?\" at the show, which was held at the Mediolanum Forum in Milan. \nEd Sheeran , who hosted the show along with Ruby Rose , won awards for Best Live Act and Best World Stage (at the U.K.'s V Festival last year). \nFall TV Popularity Contest: Which new shows won you over? Vote now! \nOther winners included Taylor Swift , who won Best Song for her version of \"Bad Blood\" featuring Kendrick Lamar ; One Direction , who took home the Best Pop prize; and Rihanna , who was named Best Female Performer. \nNicki Minaj received the Best Hip Hop award, while the Best Rock award went to Coldplay and Shawn Mendes was named Best New Artist. \nCheck out a complete list of winners here . \nOther Links From TVGuide.com", "external_links": [], "published": "2015-10-26T17:30:00.000+02:00", "crawled": "2015-10-26T17:46:58.862+02:00", "highlightTitle": ""}