{"organizations": ["Karl Stirner Arts Trail Tim Higgins There", "Easton Mike Hirsch", "Easton", "Ikea", "Lehigh", "National Canal Museum Kathy Lauer-Williams From"], "uuid": "86badcc1c339504e1bd8fbc28fdc9616e270f6d1", "thread": {"social": {"gplus": {"shares": 0}, "pinterest": {"shares": 0}, "vk": {"shares": 0}, "linkedin": {"shares": 0}, "facebook": {"likes": 0, "shares": 0, "comments": 0}, "stumbledupon": {"shares": 0}}, "site_full": "www.mcall.com", "main_image": "http://www.trbimg.com/img-562b1764/turbine/mc-easton-insiders-guide", "site_section": "http://www.mcall.com/entertainment/rss2.0.xml", "section_title": "Entertainment - The Morning Call", "url": "http://www.mcall.com/news/local/easton/centercity/mc-easton-insiders-guide-storygallery.html", "country": "US", "title": "Insider's Guide to Easton", "performance_score": 0, "site": "mcall.com", "participants_count": 0, "title_full": "Insider's Guide to Easton", "spam_score": 0.0, "site_type": "news", "published": "2015-10-24T08:14:00.000+03:00", "replies_count": 0, "uuid": "86badcc1c339504e1bd8fbc28fdc9616e270f6d1"}, "author": "", "url": "http://www.mcall.com/news/local/easton/centercity/mc-easton-insiders-guide-storygallery.html", "ord_in_thread": 0, "title": "Insider's Guide to Easton", "locations": ["New York", "Delaware", "Lehigh Valley", "Easton", "New Jersey", "Bushkill Creek", "Allentown", "Pennsylvania", "York County", "Bethlehem"], "entities": {"persons": [], "locations": [], "organizations": []}, "highlightText": "", "language": "english", "persons": ["Gary R. Blockus", "Bill Landauer", "Easton", "Ryan Kneller", "Thomas Penn", "Jennifer Marangos"], "text": "About our Insider's Guide to Easton Mike Hirsch The city of Easton is enjoying a renaissance. New restaurants and bars have created a vibrant scene near Centre Square. Developers have announced plans for apartments that will bring more people downtown. The Easton Farmers Market now lures foodies twice a week, and plans are moving forward for... Hopping through downtown Easton's thriving bar scene Ryan Kneller Because I live in Bethlehem and work in Allentown, I don't get to Easton nearly as much as I'd like. Still, I make it a point to head into the city occasionally for its quaint shops, historic farmers market and outstanding restaurants and bars â€” the latter being my favorite reason to visit. From... Easton biking, running trails offer good workouts Gary R. Blockus The Easton area offers beautiful trails for biking, running or walking. But one thing I learned: For the first time, it's a good idea to go with someone familiar with the trails. The trails provide some beautiful views of the Bushkill Creek and the Lehigh and Delaware rivers. Just don't get fooled... Shopping for antiques and collectibles in downtown Easton Ryan Kneller While some people prefer home furnishings from Ikea, Target and other retail chains, others opt for vintage, repurposed or one-of-a-kind items from antique and collectible stores. In the Lehigh Valley, a prime place to shop for old and out-of-the-ordinary pieces is downtown Easton. From favorites... Easton's family attractions run from Crayola Experience to National Canal Museum Kathy Lauer-Williams From crayons to canals, Easton drew on its manufacturing and transportation history to create terrific attractions and museums. Here are some of the places that will keep families entertained and fascinated. Crayola Experience Crayola Experience, formerly Crayola Factory, reopened in 2013 after... Four Easton buildings bursting with history Jennifer Marangos If walls could talk, the majority would have a story or two to tell. The walls in the following four buildings in Easton would have quite a bit to say about the history of the city, founded in 1752 by Thomas Penn. State Theatre of Easton In many ways, the history of the State Theatre of Easton... Discover art in Easton at galleries, Karl Stirner Arts Trail Tim Higgins There's something happening in Easton. Talk to anyone who lives in or has visited Pennsylvania's easternmost city and they'll tell you there's a vibe, an energy to the city's arts scene that attracts not only regional residents but people from New Jersey and New York as well. For 25 years Easton... Reporter Bill Landauer's 5 favorite places in Easton Bill Landauer Three years ago, a turnip truck rolled into a strange, mystical land called the Lehigh Valley, and a young(ish) hayseed from York County named Bill Landauer hopped off. \"Where should I live?\" he asked the locals. \"Bethlehem is nice,\" they said. \"I'd probably avoid Allentown.\"\"What about Easton?\"... Loading", "external_links": [], "published": "2015-10-24T08:14:00.000+03:00", "crawled": "2015-10-26T19:40:28.048+02:00", "highlightTitle": ""}