{"organizations": ["National Broadband Network", "PR Newswire", "Karan Johar", "NBA", "NFL", "NHL", "All India Radio", "Celebrities Union Minister for Food Processing Industries", "MLB"], "uuid": "cd2fc8d27b65bb008a854ceede45cf17ad72591c", "thread": {"social": {"gplus": {"shares": 0}, "pinterest": {"shares": 0}, "vk": {"shares": 0}, "linkedin": {"shares": 0}, "facebook": {"likes": 0, "shares": 0, "comments": 0}, "stumbledupon": {"shares": 0}}, "site_full": "www.onenewspage.com", "main_image": "http://cdn.newsserve.net/ONPglobe256.jpg", "site_section": "http://www.onenewspage.com/rss/latest/Entertainment.rss", "section_title": "Latest Entertainment News on One News Page", "url": "http://www.onenewspage.com/n/Entertainment/7559y07kv/Student-of-the-Year-completes-three-years.htm", "country": "US", "title": "'Student of the Year' completes three years", "performance_score": 0, "site": "onenewspage.com", "participants_count": 0, "title_full": "'Student of the Year' completes three years", "spam_score": 0.0, "site_type": "news", "published": "2015-10-19T13:03:00.000+03:00", "replies_count": 0, "uuid": "cd2fc8d27b65bb008a854ceede45cf17ad72591c"}, "author": "", "url": "http://www.onenewspage.com/n/Entertainment/7559y07kv/Student-of-the-Year-completes-three-years.htm", "ord_in_thread": 0, "title": "'Student of the Year' completes three years", "locations": ["Queensland", "Minnesota Lynx", "India"], "entities": {"persons": [], "locations": [], "organizations": []}, "highlightText": "", "language": "english", "persons": ["Karan Johar", "Sidharth Malhotra", "Alia Bhatt", "Varun Dhawan", "Pippa", "Harsimrat Kaur Badal", "Govini", "Kate", "Pippa Middleton"], "text": "'Student of the Year' completes three years Monday, 19 October 2015 (9 minutes ago) Karan Johar's 2012 hit 'Student of the Year' has clocked three years and its stars are proud to be a part of the venture. Lynx Defeat Fever to Clinch 3rd WNBA Title in Five Years 00:56 For the third time in five years the Minnesota Lynx took home the WNBA Championship, defeating the Indiana Fever, 69-52 in Game 5 on Wednesday. Even though she was just 1 for 8 shooting, she is the only athlete in the WNBA, NBA, NFL, NHL or MLB to have won three titles, an MVP award and the Rookie... Recent related news Student Of The Year launched the careers of Alia Bhatt, Varun Dhawan and Sidharth Malhotra… Filmmaker Karan Johar, whose film Student Of The Year completed... Bollywood Life 2 hours ago - India Filmmaker Karan Johar, whose film \"Student Of The Year\" completed three years on Monday, says he is \"proud\" of actors Alia Bhatt, Sidharth Malhotra and Varun... Indian Express 3 hours ago - Entertainment WASHINGTON, Oct. 16, 2015 /PRNewswire/ -- Govini, the leading business intelligence provider for companies selling to the public sector, released an analysis... PR Newswire 3 days ago - Press Releases The National Broadband Network is coming to another 1.5 Queensland homes in the next three years, but the size of the State means not everyone will have access... The Age 3 days ago - Front Page Also reported by • Mid-Day • ANI News Awww, poor Pippa! Pippa Middleton is apparently single again, according to reports. Related: Pippa Completes A Crazy 47-Mile Race! Princess Kate's sister has... Perez Hilton 1 week ago - Celebrities Union Minister for Food Processing Industries, Harsimrat Kaur Badal has said that all the 42-mega food parks sanctioned by the government will be fully... All India Radio 1 week ago - India You Might Like", "external_links": [], "published": "2015-10-19T13:03:00.000+03:00", "crawled": "2015-10-19T13:10:35.290+03:00", "highlightTitle": ""}