{"organizations": ["Dr. Frank-N-Furter People Magazine", "Time Warp", "Entertainment Fox", "FOX", "Celebrities Laverne Cox", "Laverne Cox", "New Black"], "uuid": "24dc66e862fafa88787cbb029a2697c9e0fa807d", "thread": {"social": {"gplus": {"shares": 0}, "pinterest": {"shares": 0}, "vk": {"shares": 0}, "linkedin": {"shares": 0}, "facebook": {"likes": 0, "shares": 0, "comments": 0}, "stumbledupon": {"shares": 0}}, "site_full": "www.onenewspage.com", "main_image": "http://cdn.newsserve.net/ONPglobe256.jpg", "site_section": "http://www.onenewspage.com/rss/latest/Entertainment.rss", "section_title": "Latest Entertainment News on One News Page", "url": "http://www.onenewspage.com/n/Entertainment/7559y2gqg/Do-The-Time-Warp-%E2%80%94-Laverne-Cox-Will.htm", "country": "US", "title": "Do The Time Warp — Laverne Cox Will Star In ‘Rocky Horror Picture Show’ TV Reboot", "performance_score": 0, "site": "onenewspage.com", "participants_count": 0, "title_full": "Do The Time Warp — Laverne Cox Will Star In ‘Rocky Horror Picture Show’ TV Reboot", "spam_score": 0.0, "site_type": "news", "published": "2015-10-22T03:52:00.000+03:00", "replies_count": 0, "uuid": "24dc66e862fafa88787cbb029a2697c9e0fa807d"}, "author": "", "url": "http://www.onenewspage.com/n/Entertainment/7559y2gqg/Do-The-Time-Warp-%E2%80%94-Laverne-Cox-Will.htm", "ord_in_thread": 0, "title": "Do The Time Warp — Laverne Cox Will Star In ‘Rocky Horror Picture Show’ TV Reboot", "locations": ["US", "Billboard.com"], "entities": {"persons": [], "locations": [], "organizations": []}, "highlightText": "", "language": "english", "persons": ["Patricia Quinn", "Laverne Cox Will", "Nell Campbell", "Lee Daniels", "Laverne Cox", "Fox", "Frank N. Furter"], "text": "Do The Time Warp — Laverne Cox Will Star In ‘Rocky Horror Picture Show’ TV Reboot Thursday, 22 October 2015 (8 minutes ago) Lee Daniels May Have Another New Show Coming to FOX 00:48 Fox is looking for the next big idea from the man who brought them and television viewers the blessing that is Cookie Lyon. The network has officially given a pilot order to STAR, a new show from Lee Daniels that he first dropped hints about over the summer. The show — which the 'Empire' creator... Recent related news Laverne Cox has landed a major role in the upcoming Fox television remake of The Rocky Horror Picture Show! According to EW, the 31-year-old Orange is the New... Just Jared 1 hour ago - Entertainment The Orange Is the New Black actress will play Dr. Frank-N-Furter People Magazine 2 hours ago - Celebrities Laverne Cox already made history as the first transgender actor to receive an Emmy nomination. Now the Orange Is The New Black standout is breaking new ground... Deadline Hollywood 2 hours ago - US Following a lengthy casting process, Fox has found the star of its upcoming Rocky Horror Picture Show. Orange Is the New Black star Laverne Cox will... Billboard.com 2 hours ago - Entertainment Fox’s “Rocky Horror Picture Show” is a go as “Orange Is the New Black” star Laverne Cox joins the cast, lifting the cast contingency on the project... The Wrap 2 hours ago - US Dr. Frank N. Furter has been found! Earlier this year, Fox announced plans to celebrate the 40th anniversary of The Rocky Horror Picture Show with a 2-hour TV... Perez Hilton 5 hours ago - Celebrities Patricia Quinn and Nell Campbell also do the Time Warp again. Digital Spy 1 week ago - Celebrities You Might Like", "external_links": [], "published": "2015-10-22T03:52:00.000+03:00", "crawled": "2015-10-22T03:54:47.956+03:00", "highlightTitle": ""}