{"organizations": ["AM New York Post", "Afp New York Post", "Foxtel", "SBS", "Network Writers News Corp Australia Network Share", "Princes Wharf", "Labor"], "uuid": "01f2731be57c5de5c86886b52fb892533e69505f", "thread": {"social": {"gplus": {"shares": 0}, "pinterest": {"shares": 0}, "vk": {"shares": 0}, "linkedin": {"shares": 0}, "facebook": {"likes": 0, "shares": 0, "comments": 0}, "stumbledupon": {"shares": 0}}, "site_full": "www.news.com.au", "main_image": "http://cdn.newsapi.com.au/image/v1/6466764fc8fcedcd276201193905962b", "site_section": "http://feeds.news.com.au/public/rss/2.0/news_ent_3169.xml", "section_title": "NEWS.com.au | Entertainment", "url": "http://www.news.com.au/entertainment/celebrity-life/frank-sinatra-was-impotent-at-the-time-of-ronans-conception/story-fn907478-1227565401591?from=public_rss", "country": "IL", "title": "Shocking reason Sinatra isn’t Farrow’s dad", "performance_score": 0, "site": "news.com.au", "participants_count": 0, "title_full": "Shocking reason Sinatra isn’t Farrow’s dad", "spam_score": 0.0, "site_type": "news", "published": "2015-10-11T16:57:00.000+03:00", "replies_count": 0, "uuid": "01f2731be57c5de5c86886b52fb892533e69505f"}, "author": "", "url": "http://www.news.com.au/entertainment/celebrity-life/frank-sinatra-was-impotent-at-the-time-of-ronans-conception/story-fn907478-1227565401591?from=public_rss", "ord_in_thread": 0, "title": "Shocking reason Sinatra isn’t Farrow’s dad", "locations": [], "entities": {"persons": [], "locations": [], "organizations": []}, "highlightText": "", "language": "english", "persons": ["CHLOE Baker", "Sophie Aubrey", "Farrow", "Rudd", "George Takei", "Barack Obama", "Mia Farrow", "Sinatra", "Kanye", "MIA Farrow", "ANNA VLACH", "Shatner", "Obama", "Ronan Farrow", "Frank Sinatra", "Hugh Sheridan", "Peter Garrett", "Jonathon Moran", "Ronan", "ALEX Dimitriades", "Kevin Rudd", "Takei", "Hugh", "William Shatner"], "text": "Shocking reason Sinatra isn’t Farrow’s dad 0:57 AM New York Post and Network Writers MIA Farrow sensationally hinted Frank Sinatra was the father of her son, Ronan Farrow. But a new book claims that’s impossible. Obama mocks Kanye’s presidential bid 0:15 AM Network Writers and wires KANYE West shocked the world by declaring his run for president in 2020. Now Barack Obama has weighed in on the rapper’s ‘cray’ ambitions. Shatner: Takei is a ‘disturbed individual’ 0:00 AM Jonathon Moran STAR Trek legend William Shatner proves there is still no love lost with ex-castmate George Takei, as he discusses his new role as the face of Foxtel’s latest ad campaign. Princes Wharf 1 stoush deepens 0:00 AM EMMA HOPE THE manager of Princes Wharf 1 has hit back at claims costs to hire the venue are prohibitive, saying a permit restricting the number of events staged there should be lifted. X Factor star dragged into car, brutally beaten 23:20 PM Staff writers CHLOE Baker was attacked by a “monster” on a night out. She posted pictures from her hospital bed to prove it. ‘Rudd was a megalomaniac’ 22:22 PM Sophie Aubrey IN a blistering interview, former Labor minister Peter Garrett has slammed Kevin Rudd as a stubborn, power-hungry ex-PM who left a ‘trail of destruction’. Hugh’s new show to make world debut at Fringe 22:05 PM ANNA VLACH ADELAIDE CONFIDENTIAL WHAT a swell party it will be when Packed to the Rafters star Hugh Sheridan’s latest music gig makes its world debut at next year’s Adelaide Fringe. The next generation heartbreak high 22:00 PM Anna Brain National TV writer ALEX Dimitriades’s young co-stars had never heard of his Heartbreak Kid past — but you’ll want to get to know them. Meet the crew behind SBS’s The Principal. Frank Sinatra was impotent at the time of Ronan’s conception October 11, 2015 11:57pm Ex lovers ... A young Mia Farrow in love with Frank Sinatra. Picture: Afp New York Post and Network Writers News Corp Australia Network Share", "external_links": [], "published": "2015-10-11T16:57:00.000+03:00", "crawled": "2015-10-11T18:07:44.189+03:00", "highlightTitle": ""}