{"organizations": ["Associated Press"], "uuid": "0ae87e7a2ee0a1c41742be6aa9c96e0406e9b4c6", "thread": {"social": {"gplus": {"shares": 0}, "pinterest": {"shares": 0}, "vk": {"shares": 0}, "linkedin": {"shares": 0}, "facebook": {"likes": 0, "shares": 0, "comments": 0}, "stumbledupon": {"shares": 0}}, "site_full": "www.cbs46.com", "main_image": "http://tvguide.images.worldnow.com/images/9022619_G.jpg", "site_section": "http://www.cbs46.com/category/73801/entertainment?clienttype=rss", "section_title": "CBS46 News Atlanta - Entertainment", "url": "http://www.cbs46.com/story/30308735/khloe-kardashian-breaks-silence-about-lamar-odoms-hospitalization", "country": "US", "title": "Khloe Kardashian breaks silence about Lamar Odom's hospitalization", "performance_score": 0, "site": "cbs46.com", "participants_count": 0, "title_full": "Khloe Kardashian breaks silence about Lamar Odom's hospitalization", "spam_score": 0.0, "site_type": "news", "published": "2015-10-21T17:36:00.000+03:00", "replies_count": 0, "uuid": "0ae87e7a2ee0a1c41742be6aa9c96e0406e9b4c6"}, "author": "", "url": "http://www.cbs46.com/story/30308735/khloe-kardashian-breaks-silence-about-lamar-odoms-hospitalization", "ord_in_thread": 0, "title": "Khloe Kardashian breaks silence about Lamar Odom's hospitalization", "locations": ["Miami", "Calif.", "Fallbrook", "Hollywood Hills"], "entities": {"persons": [], "locations": [], "organizations": []}, "highlightText": "", "language": "english", "persons": ["Tracy Morgan", "Hashim Pew", "Roger Mathews", "Jenni", "Bobbie Jo Bradley", "Kardashian", "Lamar Odom", "Bob Barker", "Rosie O'Donnell", "Khloe Kardashian", "Pat Woodell", "Peter Billingsley", "Ralphie", "Kevin Pew", "Farley"], "text": "Khloe Kardashian breaks silence about Lamar Odom's hospitalizati - CBS46 News Member Center: Khloe Kardashian breaks silence about Lamar Odom's hospitalization Updated: Bob Barker taken to hospital after falling near his home Bob Barker was hospitalized Tuesday after he tripped and fell while taking a walk near his home in the Hollywood Hills, TMZ reports. More > Bob Barker was hospitalized Tuesday after he tripped and fell while taking a walk near his home in the Hollywood Hills, TMZ reports. More > Tracy Morgan is continuing his comeback by launching a full-scale stand-up tour next year. More > Tracy Morgan is continuing his comeback by launching a full-scale stand-up tour next year. More > Khloe Kardashian has finally broken her silence about her estranged husband Lamar Odom's recent hospitalization. More > Khloe Kardashian has finally broken her silence about her estranged husband Lamar Odom's recent hospitalization. More > Lamar Odom is taking his first steps on the road to recovery. More > Lamar Odom is taking his first steps on the road to recovery. More > A Christmas Story star Peter Billingsley is engaged Peter Billingsley, who played Ralphie in the 1983 holiday classic A Christmas Story, is engaged, Us Weekly reports. More > Peter Billingsley, who played Ralphie in the 1983 holiday classic A Christmas Story, is engaged, Us Weekly reports. More > Son of Storage Wars: Miami star charged with murdering a family friend during viewing party Hashim Pew, the son of Storage Wars: Miami star Kevin Pew, has been charged with first-degree murder after he allegedly shot and killed a family friend during a viewing party, the Sun Sentinel reports. More > Hashim Pew, the son of Storage Wars: Miami star Kevin Pew, has been charged with first-degree murder after he allegedly shot and killed a family friend during a viewing party, the Sun Sentinel reports. More > Petticoat Junction star Pat Woodell dies at 71 Pat Woodell, who played Bobbie Jo Bradley on the 1960s sitcom Petticoat Junction, died of cancer on Sept. 29 at her home in Fallbrook, Calif., The Associated Press reports. She was 71. More > Pat Woodell, who played Bobbie Jo Bradley on the 1960s sitcom Petticoat Junction, died of cancer on Sept. 29 at her home in Fallbrook, Calif., The Associated Press reports. She was 71. More > Jenni \"JWoww\" Farley marries Roger Mathews, baby No. 2 on the way Jenni \"JWoww\" Farley married her longtime boyfriend, Roger Mathews, over the weekend, and that wasn't the only thing the couple had to celebrate. More > Jenni \"JWoww\" Farley married her longtime boyfriend, Roger Mathews, over the weekend, and that wasn't the only thing the couple had to celebrate. More > Rosie O'Donnell sued by former View producer for slander and firing A former senior producer of The View is suing Rosie O'Donnell for slander and getting her fired. More > A former senior producer of The View is suing Rosie O'Donnell for slander and getting her fired. More > \nBy Liz Raftery, \nKhloe Kardashian has finally broken her silence about her estranged husband Lamar Odom 's recent hospitalization. \n\"The past week has been incredibly difficult,\" Kardashian wrote on her website Tuesday. \"I am so thankful to family, friends and fans, who have sent nothing but prayers and well wishes to Lamar.\" \nKardashian, who married Odom in 2009 before separating in 2013, also thanked the staff at Sunrise Hospital in Las Vegas. \nOdom, 35, was rushed to a hospital last Tuesday after he was found unconscious at a brothel in Nevada. He was in a coma for three days before regaining consciousness . On Monday, he was moved to Cedars-Sinai Medical Center in Los Angeles to continue treatment. The incident is under investigation . \n\"You can never be prepared for an experience like this, but without the outpouring of love and endless prayers that Lamar has received and the strength I was given from my loved ones, it would have been difficult to endure,\" Kardashian wrote. \"Thank you for your continued support. God is great!!!\" \nKardashian and Odom are not yet officially divorced. During his hospitalization, she was responsible for making decisions regarding his medical care. \nOther Links From TVGuide.com", "external_links": [], "published": "2015-10-21T17:36:00.000+03:00", "crawled": "2015-10-21T17:58:54.350+03:00", "highlightTitle": ""}