{"organizations": ["Softpedia", "Huffington Post"], "uuid": "a7a330f804cc412ec8f85c21c3da3803da24e420", "thread": {"social": {"gplus": {"shares": 0}, "pinterest": {"shares": 0}, "vk": {"shares": 0}, "linkedin": {"shares": 0}, "facebook": {"likes": 0, "shares": 0, "comments": 0}, "stumbledupon": {"shares": 0}}, "site_full": "www.onenewspage.com", "main_image": "http://cdn.newsserve.net/ONPglobe256.jpg", "site_section": "http://www.onenewspage.com/rss/latest/Entertainment.rss", "section_title": "Latest Entertainment News on One News Page", "url": "http://www.onenewspage.com/n/Entertainment/7559xlwvr/Khloe-bestie-arrested-for-DUI-post.htm", "country": "US", "title": "Khloe K's bestie arrested for DUI post car crash", "performance_score": 0, "site": "onenewspage.com", "participants_count": 0, "title_full": "Khloe K's bestie arrested for DUI post car crash", "spam_score": 0.0, "site_type": "news", "published": "2015-10-09T10:15:00.000+03:00", "replies_count": 0, "uuid": "a7a330f804cc412ec8f85c21c3da3803da24e420"}, "author": "", "url": "http://www.onenewspage.com/n/Entertainment/7559xlwvr/Khloe-bestie-arrested-for-DUI-post.htm", "ord_in_thread": 0, "title": "Khloe K's bestie arrested for DUI post car crash", "locations": ["L.A.", "Washington", "Paris", "Los Angeles"], "entities": {"persons": [], "locations": [], "organizations": []}, "highlightText": "", "language": "english", "persons": ["Malika Haqq", "Brandon Davis", "Khloe Kardashian", "Brandon", "Haqq", "Lindsay Lohan", "Khloé Kardashian", "Marvin Davis"], "text": "Khloe K's bestie arrested for DUI post car crash Friday, 9 October 2015 (3 minutes ago) *Washington, Oct. 9(ANI): Khloe Kardashian's best friend Malika Haqq was recently arrested for DUI after crashing her car on an L.A. freeway.* Washington, Oct. 9(ANI): Khloe Kardashian's best friend Malika Haqq was recently arrested for DUI after crashing her car on an L.A. freeway. Law enforcement sources revealed that the crash took place around 3 a.m. and Haqq showed symptoms of intoxication, reports TMZ.com Sources further revealed that she even failed a field sobriety test and was under the influence of alcohol at the time of crash. (ANI) Khloé Kardashian's BFF Released From Jail After DUI Arrest Following Car Crash 00:40 Khloé Kardashian's BFF Malika Haqq was arrested under the suspicion that she was driving under the influence of alcohol. Haqq, the star of the E! reality show DASH Dolls, was arrested after a car crash and spent several hours behind bars. According to E! News, the 32-year-old was booked in jail at... Recent related news Khloe Kardashian‘s best friend Malika Haqq, who has frequently been featured on Keeping Up with the Kardashians, was arrested early Thursday morning for a DUI.... Just Jared 11 hours ago - Entertainment Oh wow. Khloe Kardashian's BFF, Malika Haqq, was arrested for a DUI after crashing her car on El Lay's 101 freeway! According to law enforcement sources, the... Perez Hilton 11 hours ago - Celebrities TMZ reports that Khloe Kardashian's best friend Malika Haqq was arrested for DUI after crashing her car on the 101 freeway in Los Angeles early Thursday... Huffington Post 12 hours ago - Entertainment Dash Dolls star put in jail on DUI charge OK! 1 day ago - Celebrities Brandon Davis, the grandson and heir of oil tycoon Marvin Davis, and the guy who famously coined the phrase “Firecrotch” for Lindsay Lohan in 2006, was... Softpedia 6 days ago - Technology Brandon Davis is still very much stuck in the early 2000s. Despite the fact that Brandon's BFFs have moved on from mugshots and cliche Hollywood arrests (Paris... Perez Hilton 1 week ago - Celebrities You Might Like Other recent news in Entertainment", "external_links": [], "published": "2015-10-09T10:15:00.000+03:00", "crawled": "2015-10-09T10:23:14.942+03:00", "highlightTitle": ""}