{"organizations": ["Circuit des Yeux"], "uuid": "294e361fe451300ffef374260298abdf8fc2ee7e", "thread": {"social": {"gplus": {"shares": 0}, "pinterest": {"shares": 0}, "vk": {"shares": 0}, "linkedin": {"shares": 0}, "facebook": {"likes": 0, "shares": 0, "comments": 0}, "stumbledupon": {"shares": 0}}, "site_full": "www.onenewspage.com", "main_image": "http://cdn.newsserve.net/i/20151021/3173-Laurie-Anderson-Philip-Glass-Nicolas-Jaar-Lambchop-Set.jpg", "site_section": "http://www.onenewspage.com/rss/latest/Entertainment.rss", "section_title": "Latest Entertainment News on One News Page", "url": "http://www.onenewspage.com/n/Entertainment/7559y1ohd/Laurie-Anderson-Philip-Glass-Nicolas-Jaar-Lambchop-Set.htm", "country": "US", "title": "Laurie Anderson, Philip Glass, Nicolas Jaar, Lambchop Set for Big Ears Festival", "performance_score": 0, "site": "onenewspage.com", "participants_count": 0, "title_full": "Laurie Anderson, Philip Glass, Nicolas Jaar, Lambchop Set for Big Ears Festival", "spam_score": 0.0, "site_type": "news", "published": "2015-10-21T06:17:00.000+03:00", "replies_count": 0, "uuid": "294e361fe451300ffef374260298abdf8fc2ee7e"}, "author": "", "url": "http://www.onenewspage.com/n/Entertainment/7559y1ohd/Laurie-Anderson-Philip-Glass-Nicolas-Jaar-Lambchop-Set.htm", "ord_in_thread": 0, "title": "Laurie Anderson, Philip Glass, Nicolas Jaar, Lambchop Set for Big Ears Festival", "locations": ["Wolf Eyes", "Yo La Tengo", "Knoxville", "Tennessee", "Kamasi Washington"], "entities": {"persons": [], "locations": [], "organizations": []}, "highlightText": "", "language": "english", "persons": ["Ben Frost", "Andy Stott", "Angel Olsen", "Nicolas Jaar", "Anthony Braxton", "Andrew Bird", "John Luther Adams", "Faust", "Shabazz", "Joe Henry", "Laurie Anderson", "Lambchop", "Marc Ribot", "Bonnie", "Sunn", "Billy", "Nico Muhly", "Philip Glass"], "text": "Laurie Anderson, Philip Glass, Nicolas Jaar, Lambchop Set for Big Ears Festival Wednesday, 21 October 2015 (15 minutes ago) The avant-garde festival Big Ears returns to Knoxville, Tennessee from March 31 to April 2. The lineup, headed up by composer-in-residence John Luther Adams, has been announced. Laurie Anderson and Philip Glass will present the North American debut of their collaboration. The lineup also features Nicolas Jaar, Lambchop, Yo La Tengo, Shabazz Palaces, Bonnie \"Prince\" Billy, Sunn O))), Andrew Bird, Angel Olsen, Ben Frost, Kamasi Washington , Wolf Eyes, Andy Stott, Faust, Circuit des Yeux, Nico Muhly, Bombino, Marc Ribot and Joe Henry, Anthony Braxton, and many more. Find the full lineup here.", "external_links": [], "published": "2015-10-21T06:17:00.000+03:00", "crawled": "2015-10-21T06:19:11.557+03:00", "highlightTitle": ""}