{"organizations": ["SAP Center", "Bengal Tiger", "San Francisco Conservatory of Music.... SFGate", "San Jose.... SFGate", "Entertainment San Francisco"], "uuid": "2a85db9dd67abc11faf451167820005339624e58", "thread": {"social": {"gplus": {"shares": 0}, "pinterest": {"shares": 0}, "vk": {"shares": 0}, "linkedin": {"shares": 0}, "facebook": {"likes": 0, "shares": 0, "comments": 0}, "stumbledupon": {"shares": 0}}, "site_full": "www.onenewspage.com", "main_image": "http://cdn.newsserve.net/ONPglobe256.jpg", "site_section": "http://www.onenewspage.com/rss/latest/Entertainment.rss", "section_title": "Latest Entertainment News on One News Page", "url": "http://www.onenewspage.com/n/Entertainment/7559y0lys/Today-Bay-Area-arts-and-entertainment-picks.htm", "country": "US", "title": "Today’s Bay Area arts and entertainment picks, Oct. 20", "performance_score": 0, "site": "onenewspage.com", "participants_count": 0, "title_full": "Today’s Bay Area arts and entertainment picks, Oct. 20", "spam_score": 0.0, "site_type": "news", "published": "2015-10-19T22:18:00.000+03:00", "replies_count": 0, "uuid": "2a85db9dd67abc11faf451167820005339624e58"}, "author": "", "url": "http://www.onenewspage.com/n/Entertainment/7559y0lys/Today-Bay-Area-arts-and-entertainment-picks.htm", "ord_in_thread": 0, "title": "Today’s Bay Area arts and entertainment picks, Oct. 20", "locations": ["North America", "Berkeley", "Bay Area"], "entities": {"persons": [], "locations": [], "organizations": []}, "highlightText": "", "language": "english", "persons": ["Stuart Bousel", "Ravi Teja", "Verdi", "Wolf", "Malipiero", "Madonna", "Marga Gomez"], "text": "Today’s Bay Area arts and entertainment picks, Oct. 20 Monday, 19 October 2015 (10 minutes ago) Today’s Bay Area arts and entertainment picks, Oct. 20 The British metal titans are on tour in support of last year’s “Redeemer of Souls.” San Francisco Contemporary Music Players: The ever-irreverent SF Theater Pub takes on a Shakespeare classic with Stuart Bousel’s slasher-comedy adaptation of the similarly named play about a murderous king. 8 p.m. Through Oct. 27. Tollywood Mass actor Ravi Teja and Tamannaah starring Bengal Tiger sound teaser releases today by the Telugu movie makers at 10:30 AM today, listen the sounds for the first time. Recent related news Madonna: The tireless pop star returns to the Bay Area with her “Rebel Heart” tour, promoting the album of the same name. 8 p.m. SAP Center, San Jose.... SFGate 2 days ago - Entertainment The band is on tour in support of its seventh full-length album, “The Waterfall.” “Pound”: In her latest solo show, Marga Gomez turns her satirical eye... SFGate 4 days ago - Entertainment Currently touring North America performing music from her new release, “Blood,” as well as her debut album, “Is Your Love Big Enough?” On tour in support... SFGate 6 days ago - Entertainment San Francisco’s newest chamber ensemble presents a program of string quartets by Wolf, Malipiero and Verdi. 8 p.m. San Francisco Conservatory of Music.... SFGate 1 week ago - Entertainment PlayGround: The monthly program of staged readings of new short plays continues with a one-night-only “Planet Earth New Play Festival.” 8 p.m. Berkeley... SFGate 1 week ago - Entertainment You Might Like", "external_links": [], "published": "2015-10-19T22:18:00.000+03:00", "crawled": "2015-10-19T22:27:31.193+03:00", "highlightTitle": ""}