{"organizations": ["Coast   South Carolina", "Volkswagen", "Associated Press", "VW", "AP", "Eau Claire"], "uuid": "85fec73d9d5bc516dc03e24d8c4a6f8ad074d9d6", "thread": {"social": {"gplus": {"shares": 0}, "pinterest": {"shares": 0}, "vk": {"shares": 0}, "linkedin": {"shares": 0}, "facebook": {"likes": 0, "shares": 0, "comments": 0}, "stumbledupon": {"shares": 0}}, "site_full": "www.wqow.com", "main_image": "http://images.worldnow.com/AP/images/8968588_G.jpg", "site_section": "http://www.WQOW.com/Global/category.asp?C=13566&clienttype=rss", "section_title": "WQOW TV News 18 - National Sports - Headline", "url": "http://www.wqow.com/story/30211481/james-blake-police-watchdog-substantiates-force-complaint", "country": "US", "title": "James Blake: Police watchdog substantiates force complaint", "performance_score": 0, "site": "wqow.com", "participants_count": 0, "title_full": "James Blake: Police watchdog substantiates force complaint", "spam_score": 0.0, "site_type": "news", "published": "2015-10-08T06:56:00.000+03:00", "replies_count": 0, "uuid": "85fec73d9d5bc516dc03e24d8c4a6f8ad074d9d6"}, "author": "", "url": "http://www.wqow.com/story/30211481/james-blake-police-watchdog-substantiates-force-complaint", "ord_in_thread": 0, "title": "James Blake: Police watchdog substantiates force complaint", "locations": ["California", "Idaho", "Oregon", "South Carolina", "Northern California", "Switzerland"], "entities": {"persons": [], "locations": [], "organizations": []}, "highlightText": "", "language": "english", "persons": ["Roger Federer", "James Blake", "Jerry Brown", "Stan Wawrinka"], "text": "James Blake: Police watchdog substantiates force complaint - WQOW TV: Eau Claire, WI NEWS18 News, Weather, and Sports Member Center: WQOW - Your Official Packers Station James Blake: Police watchdog substantiates force complaint (AP Photo/David Goldman, File). FILE - In this Sept. 11, 2015, file photo, former tennis pro James Blake, right, acknowledges applause during a semifinal match between Roger Federer, of Switzerland, and Stan Wawrinka, of Switzerland, at the U.S. Open t... James Blake: Police watchdog substantiates force complaint Two police officers involved in the mistaken arrest of James Blake, including one who allegedly tackled the former professional tennis player, will face an administrative trial after the city's police watchdog... More >> Two police officers involved in the mistaken arrest of James Blake, including one who allegedly tackled the former professional tennis player, will face an administrative trial after the city's police watchdog... More >> California wants renewable energy for half its power by 2030 Gov. Jerry Brown has signed an ambitious measure to combat climate change by increasing California's renewable electricity use to 50 percent and doubling energy efficiency in existing buildings by 2030. More >> Gov. Jerry Brown dramatically increased California's climate-change goals on Wednesday, committing the state to use renewable energy for half its electricity and make existing buildings twice as energy-efficient in... More >> Drug inmates with long rap sheets among those freed early An Associated Press review shows drug criminals once described by prosecutors as unrepentant repeat offenders are among those benefiting from new sentencing guidelines that are easing punishments for thousands of... More >> A push to overhaul criminal sentencing is prompting the early release of thousands of federal drug prisoners, including some whom prosecutors once described as threats to society, according to an Associated Press review of... More >> Auto experts: Top managers probably knew of VW cheating Volkswagen's new chief executive says that a recall of cars with software at the center of the emissions-rigging scandal should start in January and the automaker aims to fix them all by the end of next year. More >> Auto industry insiders strongly suspect the emissions cheating scandal at Volkswagen is much wider and reaches higher up the corporate ladder than the company is letting on. More >> Coast   South Carolina still on edge from floods; 2 die in truck Rivers rose and dams bulged Wednesday as South Carolina faced another anxious day of waiting for the floodwaters to recede, and search teams found the bodies of two people who died after they drove around a... More >> It could take until the weekend for the threat of flooding to ease in storm-tattered South Carolina, where a senator warned of a potential billion-dollar cleanup bill, two more people died in the floodwaters and the...   3 arrested in killing of California tantra yoga teacher A tantra teacher who made DVDs on yoga for lovers and taught classes at a clothing-optional retreat was found shot to death on a hiking trail in Northern California, still holding onto the leash of his wounded dog,... More >> Three drifters were arrested Wednesday in Oregon in the killing of a beloved California teacher of tantra yoga who was shot dead while walking his dog along a scenic hiking trail, authorities said. More >> South Carolina still on edge from floods; 2 die in truck It could take until the weekend for the threat of flooding to ease in storm-tattered South Carolina, where a senator warned of a potential billion-dollar cleanup bill, two more people died in the floodwaters and... More >> It could take until the weekend for the threat of flooding to ease in storm-tattered South Carolina, where a senator warned of a potential billion-dollar cleanup bill, two more people died in the floodwaters and the... More >> Sleeping Idaho hunter wakes up to black bear biting his head A hunter camping in central Idaho woke up when a black bear started biting his head, and he couldn't get medical care for three days because he was in such a remote wilderness area. More >> A hunter asleep in the remote Idaho wilderness woke up when he felt something tugging on his hair. Then he heard the black bear breathing. More >>", "external_links": [], "published": "2015-10-08T06:56:00.000+03:00", "crawled": "2015-10-08T07:21:12.456+03:00", "highlightTitle": ""}