{"organizations": ["NCAA college football", "Boise State", "Kelsey Young", "WFSB", "NCAA", "Utah State"], "uuid": "a2c866134e13e591716c6e55aa799d033351e8e7", "thread": {"social": {"gplus": {"shares": 0}, "pinterest": {"shares": 0}, "vk": {"shares": 0}, "linkedin": {"shares": 0}, "facebook": {"likes": 0, "shares": 0, "comments": 0}, "stumbledupon": {"shares": 0}}, "site_full": "www.wfsb.com", "main_image": "http://images.worldnow.com/AP/images/9039405_G.jpg", "site_section": "http://wfsb.com//category/208502/sports?clienttype=rss", "section_title": "WFSB - Sports", "url": "http://www.wfsb.com/story/30284519/led-by-defense-utah-states-beats-no-21-boise-state-52-26", "country": "US", "title": "Led by defense, Utah States beats No. 21 Boise State 52-26", "performance_score": 0, "site": "wfsb.com", "participants_count": 0, "title_full": "Led by defense, Utah States beats No. 21 Boise State 52-26", "spam_score": 0.0, "site_type": "news", "published": "2015-10-17T08:02:00.000+03:00", "replies_count": 0, "uuid": "a2c866134e13e591716c6e55aa799d033351e8e7"}, "author": "", "url": "http://www.wfsb.com/story/30284519/led-by-defense-utah-states-beats-no-21-boise-state-52-26", "ord_in_thread": 0, "title": "Led by defense, Utah States beats No. 21 Boise State 52-26", "locations": ["Utah", "Logan", "Utah States"], "entities": {"persons": [], "locations": [], "organizations": []}, "highlightText": "", "language": "english", "persons": ["Drew Nash", "KAREEM", "Kent Myers", "Nick Vigil", "Bowmer", "Brett Rypien", "Tanner Vallejo", "Nash", "Bryan Harsin", "LaJuan Hunt"], "text": "Led by defense, Utah States beats No. 21 Boise State 52-26 - WFSB 3 Connecticut Member Center: In the Know Led by defense, Utah States beats No. 21 Boise State 52-26 (/The Times-News via AP). Boise State quarterback Brett Rypien fumbles the ball as he's hit by Utah State linebacker Nick Vigil during the first half of an NCAA college football game Friday, Oct. 16, 2015, in Logan, Utah. (Drew Nash MANDATORY CREDIT (/The Times-News via AP). Boise State running back Kelsey Young scores a touchdown against Utah State during the first half of an NCAA college football game Friday, Oct. 16, 2015, in Logan, Utah. (Drew Nash MANDATORY CREDIT (AP Photo/Rick Bowmer). Utah State quarterback Kent Myers (2) passes the ball in the first half during an NCAA college football game against Boise State Friday, Oct. 16, 2015, in Logan, Utah. (AP Photo/Rick Bowmer). Boise State head coach Bryan Harsin shouts to his team in the first half during an NCAA college football game against Utah State Friday, Oct. 16, 2015, in Logan, Utah. (AP Photo/Rick Bowmer). Boise State linebacker Tanner Vallejo (20) tackles Utah State running back LaJuan Hunt (21) in the first half during an NCAA college football game Friday, Oct. 16, 2015, in Logan, Utah. By KAREEM COPELANDAP Sports Writer \nLOGAN, Utah (AP) - Marwin Evans returned an interception 90 yards for a touchdown as time expired before halftime, and Utah State turned Boise State's seven first-half turnovers into 35 points in the Aggies' 52-26 victory over the No. 21 Broncos on Friday night. \nThe Aggies (4-2, 3-0 Mountain West) snapped a 12-game losing streak against Boise State that dated 18 years. The 52 points are the most Boise State has ever allowed as a ranked team. \nThe Broncos (5-2, 2-1) served up four fumbles and three interceptions in the first half, including a 90-yard interception return for a touchdown by Marwin Evans as time expired in the first half. \nUtah State's Kent Meyers threw for 157 yards and a career-high three touchdowns and added 63 yards rushing and a touchdown. Hunter Sharp caught two touchdown passes. \nNick Vigil had a game-high 14 tackles for the Aggies, and Kyler Fackrell added 11. Fackrell forced one fumble and recovered two, while Vigil had one of each. \nBoise State's Brett Rypien threw for 299 yards with three interceptions. Copyright 2015 The Associated Press. All rights reserved. This material may not be published, broadcast, rewritten or redistributed.", "external_links": [], "published": "2015-10-17T08:02:00.000+03:00", "crawled": "2015-10-17T08:17:02.663+03:00", "highlightTitle": ""}