{"organizations": ["Sports Jacksonville Jaguars", "AP Fullscreen Buffalo Bills", "AP The Buffalo Bills", "AP Buffalo Bills", "NFL", "AP Jacksonville Jaguars", "Buffalo Bills", "AP Photo/Matt Dunham", "Sports Fullscreen Buffalo Bills", "Buffalo Bills vs. Jacksonville Jaguars Buffalo Bills", "Jacksonville Jaguars", "Buffalo Bills vs. Jacksonville Jaguars"], "uuid": "4a953894ef68ca6a83df39c85722b610c2f02088", "thread": {"social": {"gplus": {"shares": 0}, "pinterest": {"shares": 0}, "vk": {"shares": 0}, "linkedin": {"shares": 0}, "facebook": {"likes": 0, "shares": 0, "comments": 0}, "stumbledupon": {"shares": 0}}, "site_full": "www.democratandchronicle.com", "main_image": "http://www.gannett-cdn.com/-mm-/a77a3d73bb9d10f4990db6ade7e7030b2f663965/c=0-215-3636-2269&amp;r=x1683&amp;c=3200x1680/local/-/media/2015/10/25/Rochester/Rochester/635813728271569109-AP-712497229481.jpg", "site_section": "http://rssfeeds.wgrz.com/_/20/108023706/WGRZ/sports", "section_title": "WGRZ - Sports", "url": "http://www.democratandchronicle.com/picture-gallery/sports/football/nfl/bills/2015/10/25/buffalo-bills-vs-jacksonville-jaguars/74582524/", "country": "US", "title": "Buffalo Bills vs. Jacksonville Jaguars", "performance_score": 0, "site": "democratandchronicle.com", "participants_count": 0, "title_full": "Buffalo Bills vs. Jacksonville Jaguars", "spam_score": 0.0, "site_type": "news", "published": "2015-10-25T18:54:00.000+02:00", "replies_count": 0, "uuid": "4a953894ef68ca6a83df39c85722b610c2f02088"}, "author": "", "url": "http://www.democratandchronicle.com/picture-gallery/sports/football/nfl/bills/2015/10/25/buffalo-bills-vs-jacksonville-jaguars/74582524/", "ord_in_thread": 0, "title": "Buffalo Bills vs. Jacksonville Jaguars", "locations": ["Wembley Stadium", "Photo/Tim Ireland", "Tim Ireland", "London"], "entities": {"persons": [], "locations": [], "organizations": []}, "highlightText": "", "language": "english", "persons": ["Dwayne Gratz", "Robert Woods", "EJ Manuel", "Tyson Alualu", "Nigel Bradham", "Bryan Walters", "Mario Williams", "LeSean McCoy", "Allen Robinson", "Chris Gragg", "Josh Evans", "Johnathan Cyprien", "Stephon Gilmore", "Telvin Smith", "Aaron Colvin", "Dan Skuta", "Corey Graham", "Marcedes Lewis", "T.J. Yeldon", "Blake Bortles", "Doug Marrone", "Kirby", "Chris Clemons", "Julius Thomas", "Matt Dunham"], "text": "Activate your digital access. Buffalo Bills vs. Jacksonville Jaguars Buffalo Bills quarterback EJ Manuel (3), third left, is sacked during the NFL game between Buffalo Bills and Jacksonville Jaguars at Wembley Stadium in London, Sunday, Oct. 25, 2015. (AP Photo/Tim Ireland) Tim Ireland, AP Jacksonville Jaguars offensive coach Doug Marrone walks on the touchline during the NFL game between Buffalo Bills and Jacksonville Jaguars at Wembley Stadium in London, Sunday, Oct. 25, 2015. (AP Photo/Tim Ireland) Tim Ireland, AP Fullscreen Buffalo Bills running back LeSean McCoy (25), left, breaks through the challenge of Jacksonville Jaguars strong safety Josh Evans (26) during the NFL game between Buffalo Bills and Jacksonville Jaguars at Wembley Stadium in London, Sunday, Oct. 25, 2015. (AP Photo/Tim Ireland) Tim Ireland, AP Jacksonville Jaguars outside linebacker Telvin Smith (50) reacts after scoring a touchdown during the first half of the game against the Buffalo Bills at Wembley Stadium. Steve Flynn-USA TODAY Sports Jacksonville Jaguars cornerback Aaron Colvin (22) hits Buffalo Bills quarterback EJ Manuel (3) to force a fumble during the first half of the game at Wembley Stadium. Mandatory Credit: Steve Flynn-USA TODAY Sports Steve Flynn-USA TODAY Sports Buffalo Bills running back LeSean McCoy (25) lays on the field after a challenge in which he dropped the ball during the NFL game between Buffalo Bills and Jacksonville Jaguars at Wembley Stadium in London, Sunday, Oct. 25, 2015. Matt Dunham, AP Jacksonville Jaguars linebacker Telvin Smith (50) celebrates with safety Johnathan Cyprien (37) after scoring a touchdown on a 26-yard interception return in the second quarter against the Buffalo Bills during NFL International Series game at Wembley Stadium. Kirby Lee-USA TODAY Sports Jacksonville Jaguars running back T.J. Yeldon (24) runs away from Buffalo Bills outside linebacker Nigel Bradham (53) during the first half of the game at Wembley Stadium. Steve Flynn-USA TODAY Sports Fullscreen Buffalo Bills wide receiver Robert Woods (10) catches the ball despite the challenge of Jacksonville Jaguars cornerback Dwayne Gratz (27) to score a touchdown during the NFL game between Buffalo Bills and Jacksonville Jaguars at Wembley Stadium in London, Sunday, Oct. 25, 2015. Tim Ireland, AP Buffalo Bills defensive end Mario Williams (94) sacks Jacksonville Jaguars quarterback Blake Bortles (5) during the NFL game between Buffalo Bills and Jacksonville Jaguars at Wembley Stadium in London, Sunday, Oct. 25, 2015. Matt Dunham, AP Jacksonville Jaguars running back T.J. Yeldon (24), right, celebrates with wide receiver Bryan Walters (81) after scoring a touchdown during the NFL game between Buffalo Bills and Jacksonville Jaguars at Wembley Stadium in London, Sunday, Oct. 25, 2015. Matt Dunham, AP Jacksonville Jaguars outside linebacker Telvin Smith (50) hits Buffalo Bills running back LeSean McCoy (25) during the first half of the game at Wembley Stadium. Steve Flynn-USA TODAY Sports Jacksonville Jaguars tight end Marcedes Lewis (89), centre, is tackled during the NFL game between Buffalo Bills and Jacksonville Jaguars at Wembley Stadium in London, Sunday, Oct. 25, 2015. Tim Ireland, AP Buffalo Bills wide receiver Robert Woods (10), left, celebrates with Buffalo Bills tight end Chris Gragg (89) after scoring a touchdown during the NFL game between Buffalo Bills and Jacksonville Jaguars at Wembley Stadium in London, Sunday, Oct. 25, 2015. Matt Dunham, AP Buffalo Bills defensive end Mario Williams (94), centre, reacts after sacking Jacksonville Jaguars quarterback Blake Bortles (5) during the NFL game between Buffalo Bills and Jacksonville Jaguars at Wembley Stadium in London, Sunday, Oct. 25, 2015. Matt Dunham, AP Jacksonville Jaguars tight end Julius Thomas (80) attempts to catch a pass against the Buffalo Bills during NFL International Series game at Wembley Stadium. Kirby Lee-USA TODAY Sports, Kirby Lee-USA TODAY Sports Jacksonville Jaguars defensive tackle Tyson Alualu (93) sacks Buffalo Bills quarterback EJ Manuel (3) during the NFL game between Buffalo Bills and Jacksonville Jaguars at Wembley Stadium in London, Sunday, Oct. 25, 2015. (AP Photo/Matt Dunham) Matt Dunham, AP Jacksonville Jaguars running back T.J. Yeldon (24) celebrates after scoring a touchdown during the NFL game between Buffalo Bills and Jacksonville Jaguars at Wembley Stadium in London, Sunday, Oct. 25, 2015. (AP Photo/Matt Dunham) Matt Dunham, AP The Buffalo Bills defensive line looks down as they sit on the bench during the NFL game between Buffalo Bills and Jacksonville Jaguars at Wembley Stadium in London, Sunday, Oct. 25, 2015. Matt Dunham, AP Jacksonville Jaguars wide receiver Allen Robinson (15) reaches out to score a touchdown during the NFL game between Buffalo Bills and Jacksonville Jaguars at Wembley Stadium in London, Sunday, Oct. 25, 2015. (AP Photo/Tim Ireland) Tim Ireland, AP Jacksonville Jaguars outside linebacker Telvin Smith (50), left, races through to score a touchdown during the NFL game between Buffalo Bills and Jacksonville Jaguars at Wembley Stadium in London, Sunday, Oct. 25, 2015. (AP Photo/Tim Ireland) Tim Ireland, AP Jacksonville Jaguars wide receiver Allen Robinson (15) reaches out to score a touchdown during the NFL game between Buffalo Bills and Jacksonville Jaguars at Wembley Stadium in London, Sunday, Oct. 25, 2015. Matt Dunham, AP Jacksonville Jaguars wide receiver Allen Robinson (15) catches the ball despite the challenge of Buffalo Bills cornerback Stephon Gilmore (24) during the NFL game between Buffalo Bills and Jacksonville Jaguars at Wembley Stadium in London, Sunday, Oct. 25, 2015. Matt Dunham, AP Jacksonville Jaguars defensive tackle Tyson Alualu (93) sacks Buffalo Bills quarterback EJ Manuel (3) during the NFL game between Buffalo Bills and Jacksonville Jaguars at Wembley Stadium in London, Sunday, Oct. 25, 2015. Matt Dunham, AP Buffalo Bills free safety Corey Graham (20), left, tackles Jacksonville Jaguars wide receiver Allen Robinson (15) during the NFL game between Buffalo Bills and Jacksonville Jaguars at Wembley Stadium in London, Sunday, Oct. 25, 2015. Matt Dunham, AP Jacksonville Jaguars quarterback Blake Bortles (5) alludes the challenge of Buffalo Bills defensive end Mario Williams (94)during the NFL game between Buffalo Bills and Jacksonville Jaguars at Wembley Stadium in London, Sunday, Oct. 25, 2015. AP Jacksonville Jaguars outside linebacker Dan Skuta (55), right, tackles Buffalo Bills tight end Chris Gragg (89) during the NFL game between Buffalo Bills and Jacksonville Jaguars at Wembley Stadium in London, Sunday, Oct. 25, 2015. Matt Dunham, AP Buffalo Bills tight end Chris Gragg (89) tries to catch the ball in the end zone during the NFL game between Buffalo Bills and Jacksonville Jaguars at Wembley Stadium in London, Sunday, Oct. 25, 2015. Tim Ireland, AP Fullscreen Buffalo Bills running back LeSean McCoy (25) is tackled by Jacksonville Jaguars defensive end Chris Clemons (91) and cornerback Dwayne Gratz (27) during the NFL game between Buffalo Bills and Jacksonville Jaguars at Wembley Stadium in London, Sunday, Oct. 25, 2015. AP Buffalo Bills running back LeSean McCoy (25) runs with the ball during the NFL game between Buffalo Bills and Jacksonville Jaguars at Wembley Stadium in London, Sunday, Oct. 25, 2015. Tim Ireland, AP Jacksonville Jaguars quarterback Blake Bortles (5) passes the ball during the NFL game between Buffalo Bills and Jacksonville Jaguars at Wembley Stadium in London, Sunday, Oct. 25, 2015. AP Like this topic? You may also like these photo galleries: Replay", "external_links": [], "published": "2015-10-25T18:54:00.000+02:00", "crawled": "2015-10-25T19:31:23.648+02:00", "highlightTitle": ""}