{"organizations": ["Raptors", "Tennessean Midstate Top", "Lions", "Davidson Academy", "Columbia", "Cougars", "Carlton Flatt Field", "Oakland", "Baylor", "Blue Devils", "Siegel", "Brentwood Academy"], "uuid": "818d06ba2b1dae61aab68417af8ed276cb9e168b", "thread": {"social": {"gplus": {"shares": 0}, "pinterest": {"shares": 0}, "vk": {"shares": 0}, "linkedin": {"shares": 0}, "facebook": {"likes": 0, "shares": 0, "comments": 0}, "stumbledupon": {"shares": 0}}, "site_full": "www.dnj.com", "main_image": "http://www.gannett-cdn.com/-mm-/a30d7f1516a917803162582c9cc253ae180ca3cf/c=0-79-1301-814&amp;r=x633&amp;c=1200x630/local/-/media/2015/10/10/Nashville/Nashville/635800406573003352-Sam-Harvin-1-.jpg", "site_section": "http://rssfeeds.dnj.com/murfreesboro/sports", "section_title": "Murfreesboro - Sports", "url": "http://www.dnj.com/story/sports/college/mtsu/2015/10/10/notebook-wku-snaps-26-year-streak/73665892/", "country": "US", "title": "The Tennessean Midstate Top 10", "performance_score": 0, "site": "dnj.com", "participants_count": 0, "title_full": "The Tennessean Midstate Top 10", "spam_score": 0.0, "site_type": "news", "published": "2015-10-12T20:47:00.000+03:00", "replies_count": 0, "uuid": "818d06ba2b1dae61aab68417af8ed276cb9e168b"}, "author": "", "url": "http://www.dnj.com/story/sports/college/mtsu/2015/10/10/notebook-wku-snaps-26-year-streak/73665892/", "ord_in_thread": 0, "title": "The Tennessean Midstate Top 10", "locations": ["Brentwood", "East Nashville", "Riverdale", "Brownsville", "Hendersonville", "Lebanon", "Greenbrier", "Shelbyville", "Middle Tennessee", "Gallatin"], "entities": {"persons": [], "locations": [], "organizations": []}, "highlightText": "", "language": "english", "persons": ["Joseph Richard", "Spence Jones", "Andrew Bunch", "Jeremiah", "Ty Chandler", "Lipscomb", "Overton", "Ryan", "Michael Murphy", "Jack Towe", "Zack Weatherly", "Junior Mondu Sawyers"], "text": "The Tennessean Midstate Top 10 The Tennessean Midstate Top 10 A look at the top high school football teams in Middle Tennessee, as ranked by The Tennessean, through Week 8 regular season: Sponsored by No. 10 FRA (8-0) Senior quarterback Spence Jones tallied 183 total yards and a pair of touchdowns Friday against Lipscomb as Panthers reeled off 24 unanswered second-half points to claim their eighth win of the season. Last week: No. 10 This week: Friday at Davidson Academy (6-1) No. 9 Hendersonville (7-1) The Commandos captured their third consecutive double-digit win Friday, blasting rival Gallatin 42-14 behind Jack Towe's three-touchdown effort, which included a 66-yard, first-quarter kickoff return for a score. Last week: No. 9 This week: Friday at Glencliff (2-5) No. 8 CPA (6-1) Lions quarterback Zack Weatherly accounted for 187 total yards, a four-yard rushing score and a 28-yard touchdown pass to Joseph Richard in Friday's 35-6 win over East Nashville. Last week: No. 8. This week: Friday at Greenbrier (4-4). No. 7 Ravenwood (6-1) The Raptors encountered little resistance from two-win Lebanon on Friday, rolling to a 45-point rout of the Blue Devils to claim their third consecutive Region 3-6A victory. Last week: No. 7 This week: Thursday vs. Overton (4-3) No. 6 Centennial (6-1) Junior Mondu Sawyers eclipsed the 100-yard mark for the fourth straight week, and the Cougars defense limited Brentwood to just 13 yards rushing in Friday's 24-10 triumph - the team's sixth in a row. Last week: No. 6 No. 5 Blackman (5-2) Senior running back Taeler Dowdy has rushed for 461 yards and six touchdowns in the last two games for the Blaze, who enjoyed a Week 8 bye. Last week: No. 5. This week: Friday at Siegel (0-7) No. 4 Independence (7-0) Andrew Bunch finally returned from his Week 2 elbow injury Friday, firing 21 completions for 252 yards and three touchdowns in a 46-15 win over Region 5-5A foe Shelbyville. Last week: No. 4 This week: Friday at Columbia (3-4) No. 3 MBA (7-1) Junior standout Ty Chandler got his yards - 189 to be exact - but the Big Red endured struggles on both sides of the ball in Friday's 48-14 defeat at Brentwood Academy. Last week: No. 1 This week: Friday at Baylor (6-1) No. 2 Oakland (6-1) The Patriots amassed five rushing touchdowns and nearly 300 yards on the ground Friday, and they surrendered a total of just 64 in their 49-6 thumping of Class 4A Brownsville. Last week: No. 3 This week: Friday vs. Riverdale (5-2) No. 1 Brentwood Academy (6-1) The Jeremiah Oatsvall-led Eagles delivered a big statement Friday at Carlton Flatt Field, piling up 48 points, 25 first downs and more than 550 yards in a decisive 34-point win over MBA. Last week: No. 2. This week: Friday at Father Ryan (4-3). Michael Murphy , mfmurphy@tennessean.com 12:47 p.m. CDT October 12, 2015 Buy Photo 131 CONNECT 21 TWEET LINKEDIN 1 COMMENT EMAIL MORE \nA look at the top high school football teams in Middle Tennessee, as ranked by The Tennessean, through Week 8 regular season: Buy Photo \nFRA's Sam Harvin (Photo: George Walker IV / The Tennessean) \n10. Franklin Road Academy (8-0) — Senior quarterback Spence Jones tallied 183 total yards and a pair of touchdowns Friday against Lipscomb as Panthers reeled off 24 unanswered second-half points to claim their eighth win of the season. Last week: No. 10. This week: Friday at Davidson Academy (6-1). \nHendersonville's Jack Towe. (Photo: Craig Harris / Gannett Tennessee) \n9. Hendersonville (7-1) — The Commandos captured their third consecutive double-digit win Friday, blasting rival Gallatin 42-14 behind Jack Towe’s three-touchdown effort, which included a 66-yard, first-quarter kickoff return for a score. Last week: No. 9. This week: Friday at Glencliff (2-5). Buy Photo \nCPA's Andrew Howard (10). (Photo: Larry McCormack / File / The Tennessean) \n8. CPA (6-1) — Lions quarterback Zack Weatherly accounted for 187 total yards, a four-yard rushing score and a 28-yard touchdown pass to Joseph Richard in Friday’s 35-6 win over East Nashville. Last week: No. 8. This week: Friday at Greenbrier (4-4). Buy Photo \nRavenwood head coach Will Hester. (Photo: Jae S. Lee / File / The Tennessean) \n7. Ravenwood (6-1) — The Raptors encountered little resistance from two-win Lebanon on Friday, rolling to a 45-point rout of the Blue Devils to claim their third consecutive Region 3-6A victory. Last week: No. 7. This week: Thursday vs. Overton (4-3). Buy Photo \nCentennial running back Mondu Sawyers (8). (Photo: Shelley Mays / The Tennessean) \n6. Centennial (7-1) — Junior Mondu Sawyers eclipsed the 100-yard mark for the fourth straight week, and the Cougars defense limited Brentwood to just 13 yards rushing in Friday’s 24-10 triumph — the team’s sixth in a row. Last week: No. 6. This week: Bye. \nBlackman head coach David Watson. (Photo: Helen Comer / File / Gannett Tennessee) \n5. Blackman (5-2) — Senior running back Taeler Dowdy has rushed for 461 yards and six touchdowns in the last two games for the Blaze, who enjoyed a Week 8 bye. Last week : No. 5. This week: Friday at Siegel (0-7). Buy Photo \nIndependence quarterback Andrew Bunch (10). (Photo: George Walker IV / File / The Tennessean) \n4. Independence (7-0) — Andrew Bunch finally returned from his Week 2 elbow injury Friday, firing 21 completions for 252 yards and three touchdowns in a 46-15 win over Region 5-5A foe Shelbyville. Last week: No. 4. This week: Friday at Columbia (3-4). \nMBA running back Ty Chandler fights for extra yardage Friday against Brentwood Academy. (Photo: Michael Murphy / The Tennssean.) \n3. MBA (7-1) — Junior standout Ty Chandler got his yards — 189 to be exact — but the Big Red endured struggles on both sides of the ball in Friday’s 48-14 defeat at Brentwood Academy. Last week: No. 1. This week: Bye. \nLazarius Patterson and the Patriots piled up close to 300 yards rushing in Friday's win. (Photo: Tom Beckwith / Gannett Tennessee) \n2. Oakland (6-1) — The Patriots amassed five rushing touchdowns and nearly 300 yards on the ground Friday, and they surrendered a total of just 64 in their 49-6 thumping of Class 4A Brownsville. Last week: No. 3. This week: Friday vs. Riverdale (5-2). Buy Photo \nBrentwood Academy quarterback Jeremiah Oatsvall. (Photo: Michael Murphy / The Tennessean) \n1. Brentwood Academy (6-1) — The Jeremiah Oatsvall-led Eagles delivered a big statement Friday at Carlton Flatt Field, piling up 48 points, 25 first downs and more than 550 yards in a decisive 34-point win over MBA. Last week: No. 2. This week: Friday at Father Ryan. 131 CONNECT 21 TWEET LINKEDIN 1 COMMENT EMAIL MORE Read or Share this story: http://tnne.ws/1LqyXX7 TOP VIDEOS", "external_links": [], "published": "2015-10-12T20:47:00.000+03:00", "crawled": "2015-10-13T09:32:44.488+03:00", "highlightTitle": ""}