{"organizations": ["The Supreme Court", "MARI YAMAGUCHI Associated Press", "Supreme Court"], "uuid": "b54b34845a8af21b1a8a6ddbb0871660034e57bf", "thread": {"social": {"gplus": {"shares": 0}, "pinterest": {"shares": 0}, "vk": {"shares": 0}, "linkedin": {"shares": 0}, "facebook": {"likes": 0, "shares": 0, "comments": 0}, "stumbledupon": {"shares": 0}}, "site_full": "www.katv.com", "main_image": "", "site_section": "http://www.katv.com/category/13566/national-sports?clienttype=rss", "section_title": "KATV - National Sports - Headline", "url": "http://www.katv.com/story/30186314/justices-reject-appeal-from-jim-thorpes-sons-over-reburial", "country": "US", "title": "Justices reject appeal from Jim Thorpe's sons over reburial", "performance_score": 0, "site": "katv.com", "participants_count": 0, "title_full": "Justices reject appeal from Jim Thorpe's sons over reburial", "spam_score": 0.0, "site_type": "news", "published": "2015-10-05T16:55:00.000+03:00", "replies_count": 0, "uuid": "b54b34845a8af21b1a8a6ddbb0871660034e57bf"}, "author": "", "url": "http://www.katv.com/story/30186314/justices-reject-appeal-from-jim-thorpes-sons-over-reburial", "ord_in_thread": 0, "title": "Justices reject appeal from Jim Thorpe's sons over reburial", "locations": ["Pacific Rim", "United States", "San Francisco", "Oregon", "US", "Oklahoma", "Lake Michigan", "U.S.", "Pacific Ocean", "Maryland", "Chile", "Wisconsin", "Pennsylvania"], "entities": {"persons": [], "locations": [], "organizations": []}, "highlightText": "", "language": "english", "persons": ["Jim Thorpe", "Barack Obama", "PAUL WISEMAN", "Lacey Scroggins"], "text": "The Latest: Coast Guard: Missing US-based cargo ship sank The latest on the search for a U.S. cargo ship carrying 33 people that has been missing since it encountered high winds and heavy seas from Hurricane Joaquin. All times local: More >> The latest on the search for a U.S. cargo ship carrying 33 people that has been missing since it encountered high winds and heavy seas from Hurricane Joaquin. All times local:   Oregon shooter showed little sympathy in calculated killings The gunman had already shot several students at close range when he stood inches from Lacey Scroggins and demanded she stand up. More >> The gunman had already shot several students at close range when he stood inches from Lacey Scroggins and demanded she stand up. More >> Pastor's sermon: 'Violence will not have the last word' People in this southern Oregon timber town sought solace in church services following last week's deadly shooting rampage - including one congregation where the pastor's daughter survived because the gunman... More >> People in this southern Oregon timber town sought solace in church services following last week's deadly shooting rampage - including one congregation where the pastor's daughter survived because the gunman... More >> United   By PAUL WISEMAN and MARI YAMAGUCHI Associated Press The United States and 11 other Pacific Rim countries have agreed to an ambitious and controversial trade pact that cuts trade barriers, sets labor and... More >> AP: Federal inmates escape while traveling to halfway houses More than 240 inmates have slipped away from federal custody in the past three years while traveling to halfway houses, including several who committed bank robberies and a carjacking while on the lam, according to... More >> More than 240 inmates have slipped away from federal custody in the past three years while traveling to halfway houses, including several who committed bank robberies and a carjacking while on the lam, according to... More >> Justices reject appeal from Jim Thorpe's sons over reburial The Supreme Court has rejected an appeal from Indian tribes and Jim Thorpe's sons to move the remains of the athletic great from Pennsylvania to Oklahoma. More >> The Supreme Court has rejected an appeal from Indian tribes and Jim Thorpe's sons to move the remains of the athletic great from Pennsylvania to Oklahoma. More >> San Francisco's last gun store closing doors for good The only gun store in San Francisco is shuttering for good, saying it can no longer operate in the city's political climate of increased gun control regulations and vocal opposition to its business. More >> The only gun store in San Francisco is shuttering for good, saying it can no longer operate in the city's political climate of increased gun control regulations and vocal opposition to its business. More >> US, Chile declare new marine reserves, fight overfishing President Barack Obama will declare new marine sanctuaries in the tidal waters of Maryland and Wisconsin's Lake Michigan Monday, while Chile is expected to block off a more than 200,000 square miles of sea from... More >> President Barack Obama declared new marine sanctuaries in Lake Michigan and the tidal waters of Maryland on Monday, while Chile blocked off more than 200,000 square miles of the Pacific Ocean near the world-famous Easter... More >> South   early   weekend... More >> Days   early  ", "external_links": [], "published": "2015-10-05T16:55:00.000+03:00", "crawled": "2015-10-05T17:09:16.807+03:00", "highlightTitle": ""}