{"organizations": ["Oshkosh", "Stevens Point Journal Media", "Oshkosh Northwestern Media", "J.J. Keller Field"], "uuid": "56be104b0a0de5cdd8a737b033cd665f8f8d76ef", "thread": {"social": {"gplus": {"shares": 0}, "pinterest": {"shares": 0}, "vk": {"shares": 0}, "linkedin": {"shares": 0}, "facebook": {"likes": 0, "shares": 0, "comments": 0}, "stumbledupon": {"shares": 0}}, "site_full": "www.marshfieldnewsherald.com", "main_image": "http://www.gannett-cdn.com/-mm-/cab3d0bc0fe43134b43eee73c15917879882a9f0/c=0-224-1024-800&amp;r=x633&amp;c=1200x630/local/-/media/2015/10/17/StevensPoint/B9319320334Z.1_20151017214518_000_GO1C9936D.1-0.jpg", "site_section": "http://rssfeeds.marshfieldnewsherald.com/marshfield/sports", "section_title": "Marshfield - Sports", "url": "http://www.marshfieldnewsherald.com/videos/sports/high-school/football/2015/10/17/74161200/", "country": "US", "title": "Upset of No. 5 Oshkosh eludes Pointers", "performance_score": 0, "site": "marshfieldnewsherald.com", "participants_count": 0, "title_full": "Upset of No. 5 Oshkosh eludes Pointers", "spam_score": 0.0, "site_type": "news", "published": "2015-10-18T06:09:00.000+03:00", "replies_count": 0, "uuid": "56be104b0a0de5cdd8a737b033cd665f8f8d76ef"}, "author": "", "url": "http://www.marshfieldnewsherald.com/videos/sports/high-school/football/2015/10/17/74161200/", "ord_in_thread": 0, "title": "Upset of No. 5 Oshkosh eludes Pointers", "locations": ["Logan Taylor"], "entities": {"persons": [], "locations": [], "organizations": []}, "highlightText": "", "language": "english", "persons": ["Jake Dinkel", "Kyle Larson", "Dylan Hecker", "Jayden Essman", "Scott A. Williams", "Zach Kasuboski", "Joe Sienkiewicz", "Jamonte Robinson", "Christian Almonte", "Pat Cerroni", "Devon Linzenmeyer", "DeJuan Wright", "Kevin MacCudden"], "text": "Upset of No. 5 Oshkosh eludes Pointers Scott A. Williams , Stevens Point Journal Media 10:09 p.m. CDT October 17, 2015 Buy Photo UW-Oshkosh's Zach Kasuboski makes a touchdown run putting the Titans up 14 - 10 during their game against UW-Stevens Point. UW-Oshkosh beat UW-Stevens Point 21 - 10 at J.J. Keller Field at Titan Stadium October 17, 2015. Oshkosh Northwestern, Joe Sienkiewicz / Oshkosh Northwestern Media Buy Photo Fullscreen Buy Photo UW-Oshkosh defense stops Point's DeJuan Wright during a run. UW-Oshkosh beat UW-Stevens Point 21 - 10 at J.J. Keller Field at Titan Stadium October 17, 2015. Oshkosh Northwestern, Joe Sienkiewicz / Oshkosh Northw Buy Photo Fullscreen Buy Photo UW-Oshkosh's Dylan Hecker scores on a short run during their game against UW-Stevens Point. UW-Oshkosh beat UW-Stevens Point 21 - 10 at J.J. Keller Field at Titan Stadium October 17, 2015. Oshkosh Northwestern, Joe Sienkiewicz / Oshkosh Northw Buy Photo Fullscreen Buy Photo UW-Oshkosh Devon Linzenmeyer is brought down by Point's Jake Dinkel. UW-Oshkosh beat UW-Stevens Point 21 - 10 at J.J. Keller Field at Titan Stadium October 17, 2015. Oshkosh Northwestern, Joe Sienkiewicz / Oshkosh Northw Buy Photo Fullscreen Buy Photo UW-Oshkosh's Jayden Essman runs the ball against UW-Stevens Point. UW-Oshkosh beat UW-Stevens Point 21 - 10 at J.J. Keller Field at Titan Stadium October 17, 2015. Oshkosh Northwestern, Joe Sienkiewicz / Oshkosh Northw Buy Photo Fullscreen Buy Photo UW-Oshkosh's Zach Kasuboski makes a touchdown run putting the Titans up 14 - 10 during their game against UW-Stevens Point. UW-Oshkosh beat UW-Stevens Point 21 - 10 at J.J. Keller Field at Titan Stadium October 17, 2015. Oshkosh Northwestern, Joe Sienkiewicz / Oshkosh Northwestern Media Buy Photo Fullscreen Buy Photo UW-Stevens Point fumbles the ball on the exchange between Kyle Larson and DeJuan Wright during the game. Point recovered the fumble. UW-Oshkosh beat UW-Stevens Point 21 - 10 at J.J. Keller Field at Titan Stadium October 17, 2015. Oshkosh Northwestern, Joe Sienkiewicz / Oshkosh Northw Buy Photo Fullscreen Buy Photo UW-Oshkosh fans celebrate a touchdown during the game. UW-Oshkosh beat UW-Stevens Point 21 - 10 at J.J. Keller Field at Titan Stadium October 17, 2015. Oshkosh Northwestern, Joe Sienkiewicz / Oshkosh Northwestern Media Buy Photo Fullscreen Buy Photo UW-Oshkosh's Dylan Hecker finds funning room against UW-Stevens Point. UW-Oshkosh beat UW-Stevens Point 21 - 10 at J.J. Keller Field at Titan Stadium October 17, 2015. Oshkosh Northwestern, Joe Sienkiewicz / Oshkosh Northw Buy Photo Fullscreen Buy Photo UW-Oshkosh's Dylan Hecker is being chased down by UW-Stevens Point's Jamonte Robinson during the game. UW-Oshkosh beat UW-Stevens Point 21 - 10 at J.J. Keller Field at Titan Stadium October 17, 2015. Oshkosh Northwestern, Joe Sienkiewicz / Oshkosh Northw Buy Photo Fullscreen Buy Photo UW-Oshkosh coach Pat Cerroni gives signals to his players. UW-Oshkosh beat UW-Stevens Point 21 - 10 at J.J. Keller Field at Titan Stadium October 17, 2015. Oshkosh Northwestern, Joe Sienkiewicz / Oshkosh Northw Buy Photo Fullscreen Buy Photo UW-Oshkosh's Kevin MacCudden brings down UW-Stevens Point's Logan Taylor. UW-Oshkosh beat UW-Stevens Point 21 - 10 at J.J. Keller Field at Titan Stadium October 17, 2015. Oshkosh Northwestern, Joe Sienkiewicz / Oshkosh Northw Buy Photo Fullscreen Buy Photo UW-Oshkosh's Kevin MacCudden chases down UW-Stevens Point's Christian Almonte. UW-Oshkosh beat UW-Stevens Point 21 - 10 at J.J. Keller Field at Titan Stadium October 17, 2015. Oshkosh Northwestern, Joe Sienkiewicz / Oshkosh Northw Buy Photo Fullscreen Buy Photo UW-Oshkosh's Zach Kasuboski makes a touchdown run putting the Titans up 14 - 10 during their game against UW-Stevens Point. UW-Oshkosh beat UW-Stevens Point 21 - 10 at J.J. Keller Field at Titan Stadium October 17, 2015. Oshkosh Northwestern, Joe Sienkiewicz / Oshkosh Northwestern Media Buy Photo Fullscreen Buy Photo UW-Oshkosh's Zach Kasuboski makes a touchdown run putting the Titans up 14 - 10 during their game against UW-Stevens Point. UW-Oshkosh beat UW-Stevens Point 21 - 10 at J.J. Keller Field at Titan Stadium October 17, 2015. Oshkosh Northwestern, Joe Sienkiewicz / Oshkosh Northw Buy Photo Fullscreen Buy Photo UW-Oshkosh's Zach Kasuboski makes a touchdown run putting the Titans up 14 - 10 during their game against UW-Stevens Point. UW-Oshkosh beat UW-Stevens Point 21 - 10 at J.J. Keller Field at Titan Stadium October 17, 2015. Oshkosh Northwestern, Joe Sienkiewicz / Oshkosh Northwestern Media Buy Photo Like this topic? You may also like these photo galleries: Replay", "external_links": [], "published": "2015-10-18T06:09:00.000+03:00", "crawled": "2015-10-23T13:57:23.255+03:00", "highlightTitle": ""}