{"organizations": ["Del E. Webb Wellness Center", "Kingman Academy", "Lady Tigers", "Bulldogs", "Tigers", "Kingman Academy Tigers", "Kingman High"], "uuid": "2a9a0643296f09b61e1a953af85f46da0c37ead5", "thread": {"social": {"gplus": {"shares": 0}, "pinterest": {"shares": 0}, "vk": {"shares": 0}, "linkedin": {"shares": 0}, "facebook": {"likes": 0, "shares": 0, "comments": 0}, "stumbledupon": {"shares": 0}}, "site_full": "kdminer.com", "main_image": "http://kdminer.com/SiteImages/Article/67725a.jpg", "site_section": "http://kdminer.com/2_rss.xml", "section_title": "Kingman Daily Miner RSS Feeds: Sports", "url": "http://kdminer.com/Main.asp?SectionID=2&SubSectionID=2&ArticleID=67725", "country": "US", "title": "Final Splashdown: Last home meet of season is today", "performance_score": 0, "site": "kdminer.com", "participants_count": 0, "title_full": "Final Splashdown: Last home meet of season is today", "spam_score": 0.0, "site_type": "news", "published": "2015-10-22T16:00:00.000+03:00", "replies_count": 0, "uuid": "2a9a0643296f09b61e1a953af85f46da0c37ead5"}, "author": "", "url": "http://kdminer.com/Main.asp?SectionID=2&SubSectionID=2&ArticleID=67725", "ord_in_thread": 0, "title": "Final Splashdown: Last home meet of season is today", "locations": ["Yuma", "Kingman", "Lake Havasu City.Both Kingman", "Bullhead City", "San Luis", "San Luis.Kingman", "Lake Havasu"], "entities": {"persons": [], "locations": [], "organizations": []}, "highlightText": "", "language": "english", "persons": ["Kingman", "Conner Mahlmeister", "Shawn Byrne", "Mahlmeister"], "text": "10/22/2015 6:00:00 AM Final Splashdown: Last home meet of season is today The final high school swim meet in Kingman takes off at 4 p.m. today in the Del E. Webb Wellness Center featuring Kingman, Kingman Academy, Bullhead City MALC and San Luis. Above, swimmers embarked in the girls 50-yard freestyle Sept. 19 at Centennial Park. (RYAN ABELLA/Miner) Shawn Byrne   The Kingman High swim team hosts the final prep meet of the season in Kingman at the Del E. Webb Wellness Center at 4 p.m. today. The Bulldogs take on the Kingman Academy Tigers, Bullhead City MALC and San Luis.Kingman and the Academy enter today's meet after getting a week off competition wise. Both teams took on Lake Havasu Oct. 15 in Lake Havasu City.Both Kingman area squads fell to Lake Havasu, and the Tigers and Bulldogs split their dual meets. Kingman won the boys meet by forfeit over the Academy, and it was the Lady Tigers handling the Lady Bulldogs, 54-6.It was a meet clearly dominated by Lake Havasu. Only Kingman's Conner Mahlmeister earned a win that kept the Knights from sweeping the boys and girls events. Mahlmeister won the 50-meter freestyle in 32.19 seconds.After today's meet, both Kingman and the Academy begin preparations for the regional championships next weekend in Yuma.", "external_links": [], "published": "2015-10-22T16:00:00.000+03:00", "crawled": "2015-10-23T03:34:29.624+03:00", "highlightTitle": ""}