{"organizations": ["American Athletic", "Houston Cougars", "Tulane Green Wave", "Houston", "Associated Press", "Cougars", "Facebook Email Twitter Google", "Facebook Greg Ward Jr.", "Tulane"], "uuid": "9f5faaa2d285299766ffc47d2f4f2a1cccb20353", "thread": {"social": {"gplus": {"shares": 0}, "pinterest": {"shares": 0}, "vk": {"shares": 0}, "linkedin": {"shares": 0}, "facebook": {"likes": 0, "shares": 0, "comments": 0}, "stumbledupon": {"shares": 0}}, "site_full": "www.khou.com", "main_image": "http://cdn.tegna-tv.com/-mm-/4c23db9073823b2df9f8bcc2765dc0f1fc63ce80/c=0-179-3512-2163&amp;r=x1683&amp;c=3200x1680/local/-/media/2015/10/17/KHOU/KHOU/635806686998982872-USATSI-8864731.jpg", "site_section": "http://rssfeeds.khou.com/_/20/109890484/khou/sports", "section_title": "KHOU - Sports", "url": "http://www.khou.com/story/sports/college/2015/10/17/greg-ward-jr-leads-no-24-houston-past-tulane-42-7/74118772/", "country": "US", "title": "Greg Ward Jr. leads No. 24 Houston past Tulane, 42-7", "performance_score": 0, "site": "khou.com", "participants_count": 0, "title_full": "Greg Ward Jr. leads No. 24 Houston past Tulane, 42-7", "spam_score": 0.0, "site_type": "news", "published": "2015-10-17T15:54:00.000+03:00", "replies_count": 0, "uuid": "9f5faaa2d285299766ffc47d2f4f2a1cccb20353"}, "author": "", "url": "http://www.khou.com/story/sports/college/2015/10/17/greg-ward-jr-leads-no-24-houston-past-tulane-42-7/74118772/", "ord_in_thread": 0, "title": "Greg Ward Jr. leads No. 24 Houston past Tulane, 42-7", "locations": ["LA", "USA", "Houston", "New Orleans"], "entities": {"persons": [], "locations": [], "organizations": []}, "highlightText": "", "language": "english", "persons": ["Derick E. Hingle", "Demarcus Ayers", "Derick E. Hingle-USA", "Greg Ward Jr."], "text": "Facebook Email Twitter Google+ LinkedIn Pinterest Greg Ward Jr. leads No. 24 Houston past Tulane, 42-7 Playing as a ranked team for the first time since 2011, the Cougars (6-0, 3-0 American Athletic) won by at least 21 points for the fourth time this season Post to Facebook Greg Ward Jr. leads No. 24 Houston past Tulane, 42-7 Playing as a ranked team for the first time since 2011, the Cougars (6-0, 3-0 American Athletic) won by at least 21 points for the fourth time this season   KHOU.com: http://on.khou.com/1LzLdon   Join the Conversation To   Greg Ward Jr. leads No. 24 Houston past Tulane, 42-7 Associated Press 7:54 a.m. CDT October 17, 2015 Greg Ward Jr. ran for three touchdowns and threw a scoring pass to help No. 24 Houston beat Tulane 42-7 on Friday night Oct 16, 2015; New Orleans, LA, USA; Houston Cougars quarterback Greg Ward Jr. (1) tosses the ball to wide receiver Demarcus Ayers (10) who scored a touchdown on the reverse play against the Tulane Green Wave during the second quarter of a game at Yulman Stadium. Mandatory Credit: Derick E. Hingle-USA TODAY Sports (Photo: Derick E. Hingle, Derick E. Hingle-USA TODAY Sports) CONNECT TWEET LINKEDIN COMMENT EMAIL MORE \nNEW ORLEANS (AP) - Greg Ward Jr. ran for three touchdowns and threw a scoring pass to help No. 24 Houston beat Tulane 42-7 on Friday night. \nPlaying as a ranked team for the first time since 2011, the Cougars (6-0, 3-0 American Athletic) won by at least 21 points for the fourth time this season. \nDespite three starting offensive linemen sitting out with injuries, Houston piled up 461 total yards, including 239 on the ground, and went 7 of 15 on third down. Ward passed for 222 yards and ran for 77. \nHouston held Tulane (2-4, 1-2) to 262 total yards and forced 11 punts. Devin Powell started for the Green Wave with Tanner Lee out after sustaining a concussion a week ago against Temple, and completed just 11 passes for 88 yards. \nCopyright 2015 The Associated Press. All rights reserved. This material may not be published, broadcast, rewritten or redistributed. Oct 16, 2015; New Orleans, LA, USA; The Houston Cougars players huddle prior to their game against Tulane Green Wave at Yulman Stadium. Mandatory Credit: Derick E. Hingle-USA TODAY Sports Derick E. Hingle, Derick E. Hingle-USA TODAY Sports Oct 16, 2015; New Orleans, LA, USA; The Houston Cougars line up against the Tulane Green Wave during the first quarter at Yulman Stadium. Mandatory Credit: Derick E. Hingle-USA TODAY Sports Derick E. Hingle, Derick E. Hingle-USA TODAY Sports Fullscreen Oct 16, 2015; New Orleans, LA, USA; Houston Cougars wide receiver Chance Allen (21) celebrates with quarterback Greg Ward Jr. (1) and offensive lineman Damien Parris (56) after score a touchdown during the first quarter against the Tulane Green Wave at Yulman Stadium. Mandatory Credit: Derick E. Hingle-USA TODAY Sports Derick E. Hingle, Derick E. Hingle-USA TODAY Sports Oct 16, 2015; New Orleans, LA, USA; Houston Cougars quarterback Greg Ward Jr. (1) throws the ball to score a touchdown against the Tulane Green Wave during the first quarter at Yulman Stadium. Mandatory Credit: Derick E. Hingle-USA TODAY Sports Derick E. Hingle, Derick E. Hingle-USA TODAY Sports Oct 16, 2015; New Orleans, LA, USA; Houston Cougars wide receiver Demarcus Ayers (10) returns a punt against the Tulane Green Wave during the first quarter at Yulman Stadium. Mandatory Credit: Derick E. Hingle-USA TODAY Sports Derick E. Hingle, Derick E. Hingle-USA TODAY Sports Fullscreen Oct 16, 2015; New Orleans, LA, USA; Houston Cougars quarterback Greg Ward Jr. (1) carries the ball as Tulane Green Wave cornerback Parry Nickerson (17) defends during the second quarter of a game at Yulman Stadium. Mandatory Credit: Derick E. Hingle-USA TODAY Sports Derick E. Hingle, Derick E. Hingle-USA TODAY Sports Fullscreen Oct 16, 2015; New Orleans, LA, USA; Houston Cougars quarterback Greg Ward Jr. (1) carries the ball to score a touchdown against the Tulane Green Wave during the second quarter of a game at Yulman Stadium. Mandatory Credit: Derick E. Hingle-USA TODAY Sports Derick E. Hingle, Derick E. Hingle-USA TODAY Sports Oct 16, 2015; New Orleans, LA, USA; Houston Cougars quarterback Greg Ward Jr. (1) throws the ball against the Tulane Green Wave during the second quarter at Yulman Stadium. Mandatory Credit: Derick E. Hingle-USA TODAY Sports Derick E. Hingle, Derick E. Hingle-USA TODAY Sports Oct 16, 2015; New Orleans, LA, USA; Houston Cougars wide receiver Demarcus Ayers (10) carries the ball against the Tulane Green Wave during the second quarter at Yulman Stadium. Mandatory Credit: Derick E. Hingle-USA TODAY Sports Derick E. Hingle, Derick E. Hingle-USA TODAY Sports Fullscreen Oct 16, 2015; New Orleans, LA, USA; Houston Cougars quarterback Greg Ward Jr. (1) tosses the ball to wide receiver Demarcus Ayers (10) who scored a touchdown on the reverse play against the Tulane Green Wave during the second quarter of a game at Yulman Stadium. Mandatory Credit: Derick E. Hingle-USA TODAY Sports Derick E. Hingle, Derick E. Hingle-USA TODAY Sports Oct 16, 2015; New Orleans, LA, USA; Houston Cougars punt returner Demarcus Ayers (10) carries the ball past Tulane Green Wave place kicker Zachary Block (49) during the second quarter at Yulman Stadium. Mandatory Credit: Derick E. Hingle-USA TODAY Sports Derick E. Hingle, Derick E. Hingle-USA TODAY Sports Fullscreen Oct 16, 2015; New Orleans, LA, USA; Houston Cougars punt returner Demarcus Ayers (10) returns a punt for a touchdown against the Tulane Green Wave during the second half of a game at Yulman Stadium. Mandatory Credit: Derick E. Hingle-USA TODAY Sports Derick E. Hingle, Derick E. Hingle-USA TODAY Sports Oct 16, 2015; New Orleans, LA, USA; Houston Cougars quarterback Greg Ward Jr. (1) carries the ball past Tulane Green Wave cornerback Parry Nickerson (17) during the second half at Yulman Stadium. Mandatory Credit: Derick E. Hingle-USA TODAY Sports Derick E. Hingle, Derick E. Hingle-USA TODAY Sports Oct 16, 2015; New Orleans, LA, USA; Houston Cougars quarterback Greg Ward Jr. (1) scores a touchdown against the Tulane Green Wave during the second half at Yulman Stadium. Mandatory Credit: Derick E. Hingle-USA TODAY Sports Derick E. Hingle, Derick E. Hingle-USA TODAY Sports Oct 16, 2015; New Orleans, LA, USA; Houston Cougars safety Trevon Stewart (23) sacks Tulane Green Wave quarterback Jordy Joseph (16) during the second half at Yulman Stadium. Mandatory Credit: Derick E. Hingle-USA TODAY Sports Derick E. Hingle, Derick E. Hingle-USA TODAY Sports Oct 16, 2015; New Orleans, LA, USA; Houston Cougars head coach Tom Herman against the Tulane Green Wave during the second half at Yulman Stadium. Mandatory Credit: Derick E. Hingle-USA TODAY Sports Derick E. Hingle, Derick E. Hingle-USA TODAY Sports Oct 16, 2015; New Orleans, LA, USA; Houston Cougars head coach Tom Herman (L) talks to Tulane Green Wave head coach Curtis Johnson (R) after their game at Yulman Stadium. Mandatory Credit: Derick E. Hingle-USA TODAY Sports Derick E. Hingle, Derick E. Hingle-USA TODAY Sports Oct 16, 2015; New Orleans, LA, USA; The Houston Cougars players celebrate after defeatin the Tulane Green Wave at Yulman Stadium. Mandatory Credit: Derick E. Hingle-USA TODAY Sports Derick E. Hingle, Derick E. Hingle-USA TODAY Sports Like this topic? You may also like these photo galleries: Replay", "external_links": [], "published": "2015-10-17T15:54:00.000+03:00", "crawled": "2015-10-17T16:04:33.991+03:00", "highlightTitle": ""}