{"organizations": ["Nathan Tyson", "Doncaster", "Rovers"], "uuid": "ae8e9bf0003552eb5ee7ca44c0b08911716c1f46", "thread": {"social": {"gplus": {"shares": 0}, "pinterest": {"shares": 0}, "vk": {"shares": 0}, "linkedin": {"shares": 0}, "facebook": {"likes": 0, "shares": 0, "comments": 0}, "stumbledupon": {"shares": 0}}, "site_full": "www.sport.co.uk", "main_image": "http://images.sport.co.uk/150x150/div2.jpg", "site_section": "http://feeds.feedburner.com/SportcoukNewsRssFeed", "section_title": "General Sports News from Sports.co.uk", "url": "http://www.sport.co.uk/football/peterborough-40-doncaster-match-report/6984608/", "country": "JE", "title": "Peterborough 4-0 Doncaster: Match Report", "performance_score": 0, "site": "sport.co.uk", "participants_count": 0, "title_full": "Peterborough 4-0 Doncaster: Match Report", "spam_score": 0.0, "site_type": "news", "published": "2015-10-24T20:01:00.000+03:00", "replies_count": 0, "uuid": "ae8e9bf0003552eb5ee7ca44c0b08911716c1f46"}, "author": "", "url": "http://www.sport.co.uk/football/peterborough-40-doncaster-match-report/6984608/", "ord_in_thread": 0, "title": "Peterborough 4-0 Doncaster: Match Report", "locations": ["Washington", "Peterborough"], "entities": {"persons": [], "locations": [], "organizations": []}, "highlightText": "", "language": "english", "persons": ["Callum Elder", "Johnstone", "Darren Ferguson", "Graham Westley", "Ferguson", "Souleymane Coulibaly.Ferguson", "Erhun Oztumer", "Oztumer", "Bostwick", "Gaby Zakuani"], "text": "Peterborough 4-0 Doncaster: Match Report 24 Oct 2015 17:01:00 Peterborough run riot against Doncaster to wreck Darren Ferguson's returnThe most successful manager in Peterborough's history suffered a miserable return as Doncaster were demolished 4-0.Darren Ferguson, who guided Posh to three promotions and a Johnstone's Paint Trophy across two spells as boss, saw his new Rovers charges torn apart by Graham Westley's hosts.Two players signed by Ferguson combined for the opening goal as Erhun Oztumer's corner was headed in by Gaby Zakuani on nine minutes.And Turkish ace Oztumer went from provider to scorer when doubling Posh's advantage nine minutes before the break with a cushioned finish from the edge of the box after being picked out by Souleymane Coulibaly.Ferguson's hopes of a Rovers comeback were dashed two minutes into the second period as on-loan left-back Callum Elder fired the first goal of his career to increase Posh's lead and they were put out of their misery by a fine 25-yard strike from Conor Washington - another Ferguson recruit - with 17 minutes to go.Michael Bostwick hacked a Butler header off the line and the post kept out a Nathan Tyson effort as Rovers drew a blank. Related Sport News", "external_links": [], "published": "2015-10-24T20:01:00.000+03:00", "crawled": "2015-10-25T20:23:25.176+02:00", "highlightTitle": ""}