{"organizations": ["Browns", "Ravens", "Raiders", "Broncos", "NFL", "Cleveland", "Press Denver Broncos", "AFL"], "uuid": "364546e48855d9a9ed2f5e589d6ab91bbc710c88", "thread": {"social": {"gplus": {"shares": 0}, "pinterest": {"shares": 0}, "vk": {"shares": 0}, "linkedin": {"shares": 0}, "facebook": {"likes": 0, "shares": 0, "comments": 0}, "stumbledupon": {"shares": 0}}, "site_full": "www.durangoherald.com", "main_image": "http://durangoherald.com/storyimage/DU/20151017/SPORTS01/151019664/AR/0/AR-151019664.jpg", "site_section": "http://www.durangoherald.com/section/sports?template=RSS&mime=xml", "section_title": "Sports", "url": "http://www.durangoherald.com/article/20151017/SPORTS01/151019664/-1/sports&source=RSS", "country": "US", "title": "DENVER (5-0) at CLEVELAND (2-3)", "performance_score": 0, "site": "durangoherald.com", "participants_count": 0, "title_full": "DENVER (5-0) at CLEVELAND (2-3)", "spam_score": 0.0, "site_type": "news", "published": "2015-10-18T06:45:00.000+03:00", "replies_count": 0, "uuid": "364546e48855d9a9ed2f5e589d6ab91bbc710c88"}, "author": "", "url": "http://www.durangoherald.com/article/20151017/SPORTS01/151019664/-1/sports&source=RSS", "ord_in_thread": 0, "title": "DENVER (5-0) at CLEVELAND (2-3)", "locations": ["Cleveland", "New England", "Denver", "CLEVELAND"], "entities": {"persons": [], "locations": [], "organizations": []}, "highlightText": "", "language": "english", "persons": ["Andy Lee", "Barnidge", "Brett Favre", "Travis Coons", "T.J. Ward", "Peyton Manning", "Demarcus Ware", "McCown", "Ozzie Newsome", "Josh McCown", "Ben Margot/Associated", "Gary Barnidge", "Emmanuel Sanders"], "text": "DENVER (5-0) at CLEVELAND (2-3) DENVER (5-0) at CLEVELAND (2-3) Tweet Ben Margot/Associated Press Denver Broncos wide receiver Emmanuel Sanders (10) could see more passes his way in this week’s game at Cleveland with Demaryius Thomas banged up. Ben Margot/Associated Press Denver Broncos wide receiver Emmanuel Sanders (10) could see more passes his way in this week’s game at Cleveland with Demaryius Thomas banged up. A look at the game between Denver and Cleveland scheduled for 11 a.m. Sunday. TV: CBS OPENING LINE: Broncos by 5 1-2 RECORD VS. SPREAD: Broncos 4-1, Browns 3-2 SERIES RECORD: Broncos lead 22-5 LAST MEETING: Broncos beat Browns 34-12, Dec. 23, 2012 LAST WEEK: Broncos beat Raiders 16-10; Browns beat Ravens 33-30, OT AP PRO32 RANKING: Broncos No. 4, Browns No. 22. BRONCOS OFFENSE: OVERALL (30), RUSH (30), PASS (23). BRONCOS DEFENSE: OVERALL (1), RUSH (5), PASS (5). BROWNS OFFENSE: OVERALL (8), RUSH (28), PASS (6). BROWNS DEFENSE: OVERALL (30), RUSH (31), PASS (18). STREAKS, STATS AND NOTES: Broncos have won last 10 meetings against Browns, who haven’t beaten Denver since 1990. ... Broncos are 5-0 for seventh time in franchise history. ... Broncos lead NFL in total defense and are first team in 17 years to post at least 14 takeaways and 22 sacks through five games. ... QB Peyton Manning is 6-0 vs. Browns. ... Five-time NFL MVP Manning has not been himself, throwing just six TD passes and seven interceptions this season. ... Manning and Brett Favre are only QBs to beat each of 32 current franchises. ... Former Browns S T.J. Ward leads league with 18 tackles for loss since 2013. ... Broncos are one win from joining New England as only original AFL franchises to reach 450 regular-season wins. ... Broncos LB Demarcus Ware (back) was limited in practice this week. ... Browns QB Josh McCown passed for franchise record 457 yards last week vs. Ravens. ... McCown is first QB in NFL history with more than 450 yards passing, two TDs, rushing TD and no interceptions in same game. ... McCown has thrown for 1,154 yards in past three games. ... TE Gary Barnidge set career highs with eight catches for 139 yards last week. He’s first Browns TE with TD catch in three straight games since Hall of Famer Ozzie Newsome in 1983. Barnidge has 24 catches already this season, just 20 fewer than career total in seven seasons. ... K Travis Coons made 32-yard winning field goal in OT last week and is 11 for 11 this season. ... P Andy Lee is second in the league in average (50.5 yards) and net average (45.0). ... Fantasy Tip: Browns rushing defense remains a mess, allowing 149.4 yards per game, so Broncos RBs could have big day. Associated Press", "external_links": [], "published": "2015-10-18T06:45:00.000+03:00", "crawled": "2015-10-18T13:06:59.581+03:00", "highlightTitle": ""}