{"organizations": ["Heights", "Panthers", "Onaga", "Valley Heights"], "uuid": "737d13ebbdd21263852759bcde4812673d688752", "thread": {"social": {"gplus": {"shares": 0}, "pinterest": {"shares": 0}, "vk": {"shares": 0}, "linkedin": {"shares": 0}, "facebook": {"likes": 0, "shares": 0, "comments": 0}, "stumbledupon": {"shares": 0}}, "site_full": "marysvilleonline.net", "main_image": "", "site_section": "http://marysvilleonline.net//?rss=sports", "section_title": "Sports from marysvilleonline.net", "url": "http://marysvilleonline.net/articles/2015/10/14/sports/doc561dccf9c88ae150641409.txt", "country": "US", "title": "Heights eyes 3-0; Panthers start district", "performance_score": 0, "site": "marysvilleonline.net", "participants_count": 0, "title_full": "Heights eyes 3-0; Panthers start district", "spam_score": 0.0, "site_type": "news", "published": "2015-10-15T01:15:00.000+03:00", "replies_count": 0, "uuid": "737d13ebbdd21263852759bcde4812673d688752"}, "author": "", "url": "http://marysvilleonline.net/articles/2015/10/14/sports/doc561dccf9c88ae150641409.txt", "ord_in_thread": 0, "title": "Heights eyes 3-0; Panthers start district", "locations": ["Rossville", "Nemaha Central", "Riley County", "Onaga", "Washington County", "Valley Heights", "Centralia"], "entities": {"persons": [], "locations": [], "organizations": []}, "highlightText": "", "language": "english", "persons": ["Jordan Yungeberg", "Alma-Wabaunsee", "Hunter Stevenson", "Bjerg", "Frederik Bjerg"], "text": "Heights eyes 3-0; Panthers start district Published: Wednesday, October 14, 2015 5:15 PM CDT Valley Heights, 2-4, has a chance to take a 3-0 lead in 2-1A district play in a 7 p.m. kickoff Friday against visiting Alma-Wabaunsee, 1-5, while both Centralia and Washington County kickoff 3A district.Centralia, 3-3 after a 59-13 loss to No. 1 and undefeated Rossville in 3A, has a 7 p.m. start against visiting Nemaha Central, 6-0. Twin Valley League champion Washington County, 6-0, kicks off against guest Riley County, 4-2. Valley Heights 19, Onaga 6 Valley Heights built a 16-0 lead in the first half on junior Hunter Stevenson’s 56-yard run, sophomore Jordan Yungeberg’s 30-yard run and junior Frederik Bjerg’s 20-yard field goal. Bjerg kicked a 31-yarder in the fourth quarter. Onaga’s score was a Garrett Ames 2-yard run. VH 13 3 0 3 — 19OHS 0 0 6 0 — 6 V O", "external_links": [], "published": "2015-10-15T01:15:00.000+03:00", "crawled": "2015-10-15T20:54:25.310+03:00", "highlightTitle": ""}