{"organizations": ["Connor Cook", "LJ Scott", "DFP Michigan State Spartans", "Connor Cook MSU", "Macgarrett Kings", "Michigan State Spartans", "NFL", "Indiana Hoosiers", "Indiana", "MSU", "Detroit Free Press"], "uuid": "71e6701efbe00946d1cc52a95c203b0b8b985b5c", "thread": {"social": {"gplus": {"shares": 0}, "pinterest": {"shares": 0}, "vk": {"shares": 0}, "linkedin": {"shares": 0}, "facebook": {"likes": 0, "shares": 0, "comments": 0}, "stumbledupon": {"shares": 0}}, "site_full": "www.freep.com", "main_image": "http://www.gannett-cdn.com/-mm-/baf8cea3f1658040f0e62b2903203d70b66a3a9d/c=0-25-2097-1210&amp;r=x633&amp;c=1200x630/local/-/media/2015/10/24/DetroitFreePress/B9319411972Z.1_20151024215436_000_GEBCBJA0C.2-0.jpg", "site_section": "http://rssfeeds.freep.com/freep/sports", "section_title": "Detroit Free Press - Sports", "url": "http://www.freep.com/story/sports/columnists/drew-sharp/2015/10/24/michigan-state-spartans-connor-cook/74568120/", "country": "US", "title": "Tired, hurt, MSU relies on resolve, Connor Cook", "performance_score": 0, "site": "freep.com", "participants_count": 0, "title_full": "Tired, hurt, MSU relies on resolve, Connor Cook", "spam_score": 0.0, "site_type": "news", "published": "2015-10-25T04:27:00.000+02:00", "replies_count": 0, "uuid": "71e6701efbe00946d1cc52a95c203b0b8b985b5c"}, "author": "", "url": "http://www.freep.com/story/sports/columnists/drew-sharp/2015/10/24/michigan-state-spartans-connor-cook/74568120/", "ord_in_thread": 0, "title": "Tired, hurt, MSU relies on resolve, Connor Cook", "locations": ["Indiana", "Spartan Stadium", "Michigan"], "entities": {"persons": [], "locations": [], "organizations": []}, "highlightText": "", "language": "english", "persons": ["Connor Cook", "Connor Cook Drew Sharp", "Dawson Mills", "Joel Heath", "Chris Dutra", "Connor Cook Sharp", "Paul Lang", "Aaron Burbridge", "Nate Sudfeld", "Jameel Cook", "Lawrence Thomas", "Andre Brown", "Damon Graham", "R.J. Shelton", "Scott", "Kirthmon F. Dozier", "Mark Dantonio", "Malik McDowell", "Shane Jones", "Tyler Green", "Jermaine Edmondson", "Gerald Holmes", "Chris Frey", "Kahri Willis", "Cook", "Demetrious Cox", "Mark Dantoniom", "Delton Williams"], "text": "Sharp: Tired, hurt, MSU relies on resolve, Connor Cook MSU's QB certainly looks like a sure-fire first-round NFL draft pick Post to Facebook Sharp: Tired, hurt, MSU relies on resolve, Connor Cook MSU's QB certainly looks like a sure-fire first-round NFL draft pick Check out this story on Freep.com: http://on.freep.com/1S3xCXE Cancel Send A link has been sent to your friend's email address. Posted! A link has been posted to your Facebook feed. Join the Conversation To find out more about Facebook commenting please read the Conversation Guidelines and FAQs Sharp: Tired, hurt, MSU relies on resolve, Connor Cook Drew Sharp, Detroit Free Press Columnist 10:27 p.m. EDT October 24, 2015 (From left) Michigan State's Shane Jones, Chris Frey and Jermaine Edmondson celebrate after recovering a fumble by Indiana during the second half MSU's 52-26 win Saturday in East Lansing. Kirthmon F. Dozier DFP Michigan State's R.J. Shelton makes a touchdown catch against Indiana's Jameel Cook during the second half MSU's 52-26 win Saturday in East Lansing. Kirthmon F. Dozier DFP Michigan State's Joel Heath and Malik McDowell celebrate after sacking Indiana QB Nate Sudfeld during the second half MSU's 52-26 win Saturday in East Lansing. Kirthmon F. Dozier DFP Michigan State's Joel Heath celebrates after sacking Indiana QB Nate Sudfeld during the second half MSU's 52-26 win Saturday in East Lansing. Kirthmon F. Dozier DFP Michigan State's Aaron Burbridge makes a catch against Indiana's Tyler Green during the second half MSU's 52-26 win Saturday in East Lansing. Kirthmon F. Dozier DFP Michigan State's Macgarrett Kings makes a catch against Indiana's Dawson Mills and Chris Dutra during the second half MSU's 52-26 win Saturday in East Lansing. Kirthmon F. Dozier DFP Michigan State's LJ Scott scores a touchdown against Indiana during the second half MSU's 52-26 win Saturday in East Lansing. Kirthmon F. Dozier DFP Michigan State's LJ Scott celebrates with Paul Lang after scoring a touchdown against Indiana during the second half MSU's 52-26 win Saturday in East Lansing. Kirthmon F. Dozier DFP Michigan State's LJ Scott celebrates Connor Cook after scoring a touchdown against Indiana during the second half MSU's 52-26 win Saturday in East Lansing. Kirthmon F. Dozier DFP Michigan State's Gerald Holmes scores a touchdown against Indiana during the second half MSU's 52-26 win Saturday in East Lansing. Kirthmon F. Dozier DFP Michigan State's Chris Frey forces a fumble by Indiana's Damon Graham during the second half MSU's 52-26 win Saturday in East Lansing. Kirthmon F. Dozier DFP Michigan State's Demetrious Cox and Kahri Willis celebrate after stopping Indiana during the second half MSU's 52-26 win Saturday in East Lansing. Kirthmon F. Dozier DFP Michigan State's LJ Scott runs the ball against Indiana during the second half MSU's 52-26 win Saturday in East Lansing. Kirthmon F. Dozier DFP Michigan State coach Mark Dantonio argues a call during the second half MSU's 52-26 win Saturday in East Lansing. Kirthmon F. Dozier DFP Michigan State coach Mark Dantoniom looks on during the second half MSU's 52-26 win Saturday in East Lansing. Kirthmon F. Dozier DFP Michigan State's Macgarrett Kings makes a catch against Indiana during the second half MSU's 52-26 win Saturday in East Lansing. Kirthmon F. Dozier DFP Michigan State coach Mark Dantonio on the sidelines during the second half MSU's 52-26 win Saturday in East Lansing. Kirthmon F. Dozier DFP Michigan State Spartans' Lawrence Thomas rushes against the Indiana Hoosiers' Dimitric Camiel on October 24, 2015 at Spartan Stadium in East Lansing. Kirthmon F. Dozier, DFP Michigan State Spartans' Joel Heath sacks the Indiana Hoosiers' Nate Sudfeld during first half action on October 24, 2015 at Spartan Stadium in East Lansing. Kirthmon F. Dozier, DFP Michigan State Spartans' Joel Heath celebrates his sack on the Indiana Hoosiers' Nate Sudfeld on October 24, 2015 at Spartan Stadium in East Lansing. Kirthmon F. Dozier, DFP Michigan State Spartans' R.J. Shelton runs for a first down against the Indiana Hoosiers on October 24, 2015 at Spartan Stadium in East Lansing. Kirthmon F. Dozier, DFP Michigan State Spartans' Aaron Burbridge makes a catch against the Indiana Hoosiers' Andre Brown on October 24, 2015 at Spartan Stadium in East Lansing. Kirthmon F. Dozier, DFP Michigan State Spartans' Macgarrett Kings is defended by the Indiana Hoosiers' Andre Brown on October 24, 2015 at Spartan Stadium in East Lansing. Kirthmon F. Dozier, DFP Michigan State Spartans' Connor Cook runs for a first down against the Indiana Hoosiers on October 24, 2015 at Spartan Stadium in East Lansing. Kirthmon F. Dozier, DFP Michigan State Spartans' Delton Williams takes the field for the game vs. the Indiana Hoosiers on October 24, 2015 at Spartan Stadium in East Lansing. Kirthmon F. Dozier, DFP Michigan State Spartans' Connor Cook warms up before the game against the Indiana Hoosiers on October 24, 2015 at Spartan Stadium in East Lansing. Kirthmon F. Dozier, DFP Michigan State Spartans head coach Mark Dantonio on October 24, 2015 at Spartan Stadium in East Lansing. Kirthmon F. Dozier, DFP Like this topic? You may also like these photo galleries: Replay", "external_links": [], "published": "2015-10-25T04:27:00.000+02:00", "crawled": "2015-10-25T05:07:47.003+02:00", "highlightTitle": ""}