{"organizations": ["Associated Press", "AP"], "uuid": "20dccd6142fc75d1f012de5b00e2fabb3ea3885d", "thread": {"social": {"gplus": {"shares": 0}, "pinterest": {"shares": 0}, "vk": {"shares": 0}, "linkedin": {"shares": 0}, "facebook": {"likes": 0, "shares": 0, "comments": 0}, "stumbledupon": {"shares": 0}}, "site_full": "www.sltrib.com", "main_image": "http://www.sltrib.com/csp/mediapool/sites/dt.common.streams.StreamServer.cls?STREAMOID=KnEV_Ito4oUwTWW8VX7Kec$daE2N3K4ZzOUsqbU5sYvZa6Fa6bugxGvx2E9r_oNLWCsjLu883Ygn4B49Lvm9bPe2QeMKQdVeZmXF$9l$4uCZ8QDXhaHEp3rvzXRJFdy0KqPHLoMevcTLo3h8xh70Y6N_U_CryOsw6FTOdKL_jpQ-&CONTENTTYPE=image/jpeg", "site_section": "http://www.sltrib.com/csp/cms/sites/sltrib/RSS/rss.csp?cat=Sports", "section_title": "Sports - The Salt Lake Tribune", "url": "http://www.sltrib.com/sports/3066857-155/speedskating-bowe-richardson-davis-headline-long", "country": "US", "title": "Speedskating: Bowe, Richardson, Davis headline long track World Cup qualifiers", "performance_score": 0, "site": "sltrib.com", "participants_count": 0, "title_full": "Speedskating: Bowe, Richardson, Davis headline long track World Cup qualifiers", "spam_score": 0.0, "site_type": "news", "published": "2015-10-15T23:09:00.000+03:00", "replies_count": 0, "uuid": "20dccd6142fc75d1f012de5b00e2fabb3ea3885d"}, "author": "", "url": "http://www.sltrib.com/sports/3066857-155/speedskating-bowe-richardson-davis-headline-long", "ord_in_thread": 0, "title": "Speedskating: Bowe, Richardson, Davis headline long track World Cup qualifiers", "locations": ["Utah Olympic Oval", "Wash.", "Kearns", "Ocala", "Chicago", "Tacoma", "Heerenveen", "Fla.", "Nao Kodaira", "U.S.", "Kazakhstan", "Netherlands", "Japan"], "entities": {"persons": [], "locations": [], "organizations": []}, "highlightText": "", "language": "english", "persons": ["KC Boutiette", "CHRISTOPHER KAMRANI", "Davis", "Shani Davis", "Brittany Bowe", "Dejong", "Kelly Gunther", "Bowe", "Richardson", "Heather Richardson"], "text": "Speedskating: Bowe, Richardson, Davis headline long track World Cup qualifiers By CHRISTOPHER KAMRANI | The Salt Lake Tribune First Published 5 minutes ago • Updated 5 minutes ago New world champion Heather Richardson of the U.S., center and gold medal, Brittany Bowe of the U.S., left and silver medal, and Nao Kodaira of Japan, right and bronze medal, pose on the podium of the women's 500 meter race of the speedskating single distance world championships at Thialf ice rink in Heerenveen, Netherlands, Saturday, Feb. 14, 2015. (AP Photo/Peter Dejong) New world champion Heather Richardson of the U.S., center and gold medal, Brittany Bowe of the U.S., left and silver medal, and Nao Kodaira of Japan, right and bronze medal, pose on the podium of the women's 500 meter race of the speedskating single distance world championships at Thialf ice rink in Heerenveen, Netherlands, Saturday, Feb. 14, 2015. (AP Photo/Peter Dejong) Speedskating » Three-day event takes place at Olympic Oval in Kearns. Share This Article ARTICLE PHOTO GALLERY (11) Eleven Olympians return to the ice at the Utah Olympic Oval in Kearns on Friday for the upcoming U.S. long track speedskating World Cup qualifiers. Skaters will participate in the 500-, 1,000- ,1,500- and 5,000-meter events during the next three days to determine placement on the U.S. long track team for the upcoming 2015-16 ISU World Cup calendar, starting this fall. Headliners include three-time World Champion Brittany Bowe, Heather Richardson and two-time gold medalist Shani Davis. Bowe is coming off a stellar season a year ago in which the Ocala, Fla., native won the gold medal at the World Sprint Speedskating Championships in Kazakhstan in March. VIDEOS Check out all the Trib TopJobs A month prior, Richardson and Bowe went 1-2 in the 500-meter event at the long track World Championships in Heerenveen, Netherlands. Bowe also won the 1,000-meter event. At 33, Davis continues to lace up his skates. A gold medalist from both the 2006 and 2010 Olympic Winter Games, Davis had an impressive ending to his season a year ago. The Chicago native won his first major title in nearly four years in Heerenveen in the 1,000-meter men's event at the World Championships. It was his fourth 1,000-meter title of his storied career. \"I needed something to show me I still have what it takes,\" Davis told the Associated Press. \"I was crying, I was so happy.\" Also set to compete this weekend are 2014 Olympians Sugar Todd and Kelly Gunther. Four-time Olympian KC Boutiette, at age 45, is pushing for a fifth appearance at an Olympiad as well. The Tacoma, Wash., native will be competing against athletes half his age for a spot on the U.S. long track squad.", "external_links": [], "published": "2015-10-15T23:09:00.000+03:00", "crawled": "2015-10-15T22:21:19.644+03:00", "highlightTitle": ""}