{"organizations": ["Milan", "Macon", "North Shelby", "Putnam Co.", "Military Academy", "HIGHSCHOOLFOOTBALL Knox Co.", "Comment Kirksville Daily Express", "Schuyler Co.", "Scotland Co.", "Lindbergh", "Monroe City", "Knox Co.", "Centralia"], "uuid": "ceea6fdce8005b9f5b259bbe1ac653d0c989d255", "thread": {"social": {"gplus": {"shares": 0}, "pinterest": {"shares": 0}, "vk": {"shares": 0}, "linkedin": {"shares": 0}, "facebook": {"likes": 0, "shares": 0, "comments": 0}, "stumbledupon": {"shares": 0}}, "site_full": "www.kirksvilledailyexpress.com", "main_image": "http://www.kirksvilledailyexpress.com/Global/images/head/nameplate/mo-kirksville_logo.png", "site_section": "http://www.kirksvilledailyexpress.com/sports?template=rss&mime=xml", "section_title": "Sports - Kirksville Daily Express - Kirksville, MO", "url": "http://www.kirksvilledailyexpress.com/article/20151009/SPORTS/151008775/2000/NEWS?rssfeed=true", "country": "US", "title": "Knox County, Scotland County and Milan football earn victories; Atlanta softball wins Class 1, District 11 title", "performance_score": 0, "site": "kirksvilledailyexpress.com", "participants_count": 0, "title_full": "Knox County, Scotland County and Milan football earn victories; Atlanta softball wins Class 1, District 11 title", "spam_score": 0.0, "site_type": "news", "published": "2015-10-10T07:42:00.000+03:00", "replies_count": 0, "uuid": "ceea6fdce8005b9f5b259bbe1ac653d0c989d255"}, "author": "", "url": "http://www.kirksvilledailyexpress.com/article/20151009/SPORTS/151008775/2000/NEWS?rssfeed=true", "ord_in_thread": 0, "title": "Knox County, Scotland County and Milan football earn victories; Atlanta softball wins Class 1, District 11 title", "locations": ["Scotland County", "Kirksville", "Macon", "Atlanta", "Louisiana", "Knox County", "Mo"], "entities": {"persons": [], "locations": [], "organizations": []}, "highlightText": "", "language": "english", "persons": ["Jaidyn Watts", "Michael Anders", "Trevor Guffey", "Carson Quint", "Brock Emanuel", "Eric Moreno", "Ravoli McCarty", "Riley Veatch", "Sabastian Grant", "Aaron Buford", "Wyatt Bohle", "Jade Holt", "Austin Harrison", "Hayden Miller", "Nick Edwards", "Andrew Hodge", "Ian See", "Tanner Bondy", "Austin Fordyce", "Calvin Heidenwith"], "text": "Knox County, Scotland County and Milan football earn victories; Atlanta softball wins Class 1, District 11 title Comment Kirksville Daily Express - Kirksville, MO Writer Posted Oct. 9, 2015 at 12:01 AM Updated at 11:42 PM Posted Oct. 9, 2015 at 12:01 AM Updated at 11:42 PM HIGHSCHOOLFOOTBALL Knox Co. 34, Schuyler Co. 12 Knox Co. - Andrew Hodge, 19 carries, 94 yards, 1 TD; Hayden Miller, 14 carries, 79 yards, 1 rushing TD, 5 receptions, 102 yards, 2 receiving TDs; Nick Edwards, 9-of-17 passing, 148 yards, 3 TDs; Ravoli McCarty, 1 reception, 11 yards, 1 TD; Knox County clinches at least a share of the Tri-Rivers Conference championship Schuyler Co. - Sabastian Grant, 112 yards rushing, 1 TD, 12 tackles; Riley Veatch, 1 rushing TD; Michael Anders, 8 tackles Scotland Co. 56, Putnam Co. 42 Scotland Co. - Aaron Buford, 200 yards passing, passing TD, 2 rushing TDs; Jade Holt, 75 yards rushing; Ryan Slaughter, 1 receiving TD, 1 punt return TD, 1 interception; Ian See, 1 interception Putnam Co. - Calvin Heidenwith, 1 passing TD, 155 yards rushing, 1 rushing TD; Tanner Bondy, 1 receiving TD, 9 tackles; Carson Quint, 130 yards rushing, 2 TDs; Trevor Guffey, 9 tackles, 1 sack Milan 22, Highland 8 Milan - Jaidyn Watts, 19 carries, 173 yards, 2 TDs; Austin Fordyce, 23 carries, 100 yards rushing; Eric Moreno, 36-yard field goal; Wyatt Bohle, 32-yard interception return Macon 49, Louisiana 28 Macon - Austin Harrison, 13 carries, 206 yards, 3 TDs; Brock Emanuel, 16 tackles North Shelby 34, Mo. Military Academy 33 North Shelby - Win snapped programâ€™s 63-game losing streak Centralia 56, Monroe City 14 Eureka 41, Lindbergh 0", "external_links": [], "published": "2015-10-10T07:42:00.000+03:00", "crawled": "2015-10-10T10:35:16.013+03:00", "highlightTitle": ""}