{"organizations": ["Trump Ocean Club", "UConn", "EEO Public File Report Torre", "Los Angeles Dodgers", "New York Mets", "AP"], "uuid": "0934d64d16ac4449dcef698b7be197c27e49cbae", "thread": {"social": {"gplus": {"shares": 0}, "pinterest": {"shares": 0}, "vk": {"shares": 0}, "linkedin": {"shares": 0}, "facebook": {"likes": 0, "shares": 0, "comments": 0}, "stumbledupon": {"shares": 0}}, "site_full": "www.katv.com", "main_image": "http://images.worldnow.com/AP/images/8991867_G.jpg", "site_section": "http://www.katv.com/category/13566/national-sports?clienttype=rss", "section_title": "KATV - National Sports - Headline", "url": "http://www.katv.com/story/30233743/torre-to-review-utleys-slide-for-possible-discipline", "country": "US", "title": "Torre to review Utley's slide for possible discipline", "performance_score": 0, "site": "katv.com", "participants_count": 0, "title_full": "Torre to review Utley's slide for possible discipline", "spam_score": 0.0, "site_type": "news", "published": "2015-10-11T23:56:00.000+03:00", "replies_count": 0, "uuid": "0934d64d16ac4449dcef698b7be197c27e49cbae"}, "author": "", "url": "http://www.katv.com/story/30233743/torre-to-review-utleys-slide-for-possible-discipline", "ord_in_thread": 0, "title": "Torre to review Utley's slide for possible discipline", "locations": ["Panama", "Idaho", "Beyonce", "Los Angeles"], "entities": {"persons": [], "locations": [], "organizations": []}, "highlightText": "", "language": "english", "persons": ["Ruben Tejada", "Adrian Gonzalez", "Donald Trump", "Torre", "John McCoy/Los", "Utley", "Demi Lovato", "Chase Utley", "Howie Kendrick", "Esperanza Spalding", "Michelle Obama"], "text": "EEO Public File Report Torre to review Utley's slide for possible discipline (AP Photo/Gregory Bull). Los Angeles Dodgers' Chase Utley, left, and Howie Kendrick celebrates after scoring on a hit by Adrian Gonzalez during the seventh inning in Game 2 of baseball's National League Division Series against the New York Mets, Saturd... (John McCoy/Los Angeles Daily News via AP). New York Mets shortstop Ruben Tejada falls after a slide by Los Angeles Dodgers' Chase Utley during the seventh inning of an NL Division Series baseball game Saturday, Oct. 10, 2015, in Los Angeles. UConn mac and cheese incident spawns fundraisers Members of the UConn community have begun a couple of fundraisers hoping to offset the negative image generated by a video of a student berating food service workers who refused to sell him jalapeno-bacon macaroni... More >> UConn students are trying to use an embarrassing video about macaroni and cheese to raise a little cheddar. More >> Michelle Obama celebrates International Day of the Girl Michelle Obama is grooving to the tunes of Beyonce, Demi Lovato and Esperanza Spalding as she celebrates the International Day of the Girl. More >> Michelle Obama is grooving to the tunes of Beyonce, Demi Lovato and Esperanza Spalding as she celebrates the International Day of the Girl. More >> NYC   As   More   Gun   Condo owners in Panama tell Trump: You're fired! The directors of the Trump Ocean Club met July 28 on urgent business. They needed to fire Donald Trump. More >> The directors of the Trump Ocean Club met July 28 on urgent business. They needed to fire Donald Trump. More >> Prosecutor,     Sleeping Idaho hunter wakes up to black bear biting his head A hunter camping in central Idaho woke up when a black bear started biting his head, and he couldn't get medical care for three days because he was in such a remote wilderness area. More >> A hunter asleep in the remote Idaho wilderness woke up when he felt something tugging on his hair. Then he heard the black bear breathing. More >>", "external_links": [], "published": "2015-10-11T23:56:00.000+03:00", "crawled": "2015-10-12T00:11:08.024+03:00", "highlightTitle": ""}