{"organizations": ["United Center", "SeaWorld SeaWorld", "KATV", "SeaWorld", "NHL", "Blackhawks Rangers", "EEO Public File Report Rangers", "New York Rangers", "AP", "Chicago Blackhawks", "Blackhawks"], "uuid": "0469b0c32402bb02058ea1b728057f0e245dee6f", "thread": {"social": {"gplus": {"shares": 0}, "pinterest": {"shares": 0}, "vk": {"shares": 0}, "linkedin": {"shares": 0}, "facebook": {"likes": 0, "shares": 0, "comments": 0}, "stumbledupon": {"shares": 0}}, "site_full": "www.katv.com", "main_image": "http://images.worldnow.com/AP/images/8970292_G.jpg", "site_section": "http://www.katv.com/category/13566/national-sports?clienttype=rss", "section_title": "KATV - National Sports - Headline", "url": "http://www.katv.com/story/30212492/rangers-hold-on-for-3-2-victory-over-blackhawks", "country": "US", "title": "Rangers hold on for 3-2 victory over Blackhawks", "performance_score": 0, "site": "katv.com", "participants_count": 0, "title_full": "Rangers hold on for 3-2 victory over Blackhawks", "spam_score": 0.0, "site_type": "news", "published": "2015-10-08T09:56:00.000+03:00", "replies_count": 0, "uuid": "0469b0c32402bb02058ea1b728057f0e245dee6f"}, "author": "", "url": "http://www.katv.com/story/30212492/rangers-hold-on-for-3-2-victory-over-blackhawks", "ord_in_thread": 0, "title": "Rangers hold on for 3-2 victory over Blackhawks", "locations": ["Oregon", "San Diego", "South   California", "Chicago"], "entities": {"persons": [], "locations": [], "organizations": []}, "highlightText": "", "language": "english", "persons": ["Oscar Lindberg", "Corey Crawford", "Brent Seabrook", "Dominic Moore", "Rex Arbogast", "Jonathan Toews", "Kyle Baun"], "text": "Rangers hold on for 3-2 victory over Blackhawks - KATV - Breaking News, Weather and Razorback Sports Member Center: EEO Public File Report Rangers hold on for 3-2 victory over Blackhawks (AP Photo/Nam Y. Huh). New York Rangers center Oscar Lindberg, left, chases the puck past Chicago Blackhawks right wing Kyle Baun during the first period of an NHL hockey game Wednesday, Oct. 7, 2015, in Chicago. (AP Photo/Nam Y. Huh). Chicago Blackhawks goalie Corey Crawford, center, saves against New York Rangers right wing Jesper Fast, left, and center Dominic Moore during the first period of an NHL hockey game Wednesday, Oct. 7, 2015, in Chicago. (AP Photo/Nam Y. Huh). Chicago Blackhawks' Jonathan Toews, left, talks with Brent Seabrook during the first period of an NHL hockey game against the New York Rangers, Wednesday, Oct. 7, 2015, in Chicago. (AP Photo/Nam Y. Huh). The Chicago Blackhawks' Stanley Cup championship banner is raised to the United Center ceiling during a ceremony before an NHL hockey game between the Blackhawks and the New York Rangers, Wednesday, Oct. 7, 2015, in Chicago. (AP Photo/Charles Rex Arbogast). The Chicago Blackhawks' Stanley Cup championship banner is raised to the United Center ceiling during a ceremony before an NHL hockey game between the Blackhawks and the New York Rangers Wednesday, Oct. 7, 2015, in Chic...   Oregon gunman killed himself after police shot him The gunman in last week's rampage at an Oregon community college was wounded in a shootout with police officers before he killed himself in the classroom where his victims lay dead and wounded, authorities said. More >> The gunman in last week's rampage at an Oregon community college was wounded in a shootout with police officers before he killed himself in the classroom where his victims lay dead and wounded, authorities said. More >> Auto experts:   South   California agency to eye bigger whale tanks at SeaWorld SeaWorld wants to greatly expand the tanks its uses to hold killer whales in San Diego, but animal rights activists fear the plan would pave the way for breeding the animals in captivity - something they say is... More >> SeaWorld wants to greatly expand the tanks its uses to hold killer whales in San Diego, but animal rights activists fear the plan would pave the way for breeding the animals in captivity - something they say is cruel no...      ", "external_links": [], "published": "2015-10-08T09:56:00.000+03:00", "crawled": "2015-10-08T10:07:57.296+03:00", "highlightTitle": ""}