{"organizations": ["Sonora Police Department", "Columbia", "Arnold", "Parrotts Ferry Road"], "uuid": "572684a99466bae02facae3e5420580c5800b630", "thread": {"social": {"gplus": {"shares": 0}, "pinterest": {"shares": 0}, "vk": {"shares": 0}, "linkedin": {"shares": 0}, "facebook": {"likes": 0, "shares": 0, "comments": 0}, "stumbledupon": {"shares": 0}}, "site_full": "www.uniondemocrat.com", "main_image": "", "site_section": "http://feeds.feedburner.com/UnionDemocrat", "section_title": "The Union Democrat, Sonora, CA News, Sports, & Weather", "url": "http://www.uniondemocrat.com/index.php?option=com_content&task=view&id=117665&Itemid=190", "country": "US", "title": "News of Record for Oct. 1, 2015", "performance_score": 0, "site": "uniondemocrat.com", "participants_count": 0, "title_full": "News of Record for Oct. 1, 2015", "spam_score": 0.0, "site_type": "news", "published": "2015-10-01T04:00:00.000+03:00", "replies_count": 0, "uuid": "572684a99466bae02facae3e5420580c5800b630"}, "author": "", "url": "http://www.uniondemocrat.com/index.php?option=com_content&task=view&id=117665&Itemid=190", "ord_in_thread": 0, "title": "News of Record for Oct. 1, 2015", "locations": ["Via Redonda Road", "Mokelumne Hill", "Coulterville Road", "Valley Springs", "San Andreas", "Sonora", "Buckhorn Mountain Road", "West Saint Charles Street", "Mountain Ranch Road", "Old Sonora Columbia Road", "Snell Street", "Sanguinetti Road", "South Washington Street", "South Washington", "Cavalieri Road", "Tuolumne Road North", "Yerba Santa Drive", "Springfield Road", "West Stockton Street", "Jamestown", "Mountain Ranch", "Modesto", "Milano Road"], "entities": {"persons": [], "locations": [], "organizations": []}, "highlightText": "", "language": "english", "persons": ["Twain Harte", "Justin William Ewing", "Roy Dee Staggs", "Paul Wayne Janssen", "Kayce Holste Thompson"], "text": "News of Record for Oct. 1, 2015 News of Record for Oct. 1, 2015 By Union Democrat staff October 01, 2015 01:00 am TUOLUMNE COUNTY The Sonora Police Department reported the following: TUESDAY 7:18 a.m., public peace — A McCormick Drive woman could hear a man yelling obscenities in the area. 8:42 a.m., controlled substances — A man wearing baggy jeans and a woman wearing a hat with tassels offered a man drugs on Snell Street. 10:12 a.m., suspicious circumstance — A man with a shaved head wearing a polo shirt, who was possibly under the influence, knocked on a Banner Drive woman’s door. 1 p.m., public intoxication — A woman wearing a dress was seen stumbling and falling into “things” on South Washington Street. An arrest was made. 2:44 p.m., suspicious circumstances — Two people sat in a brown vehicle on South Washington Street “for a while” watching customers. 3:15 p.m., theft — A man with a scratch on his face wearing a plaid hat and pink camouflage socks who took an ice chest and two soft rifle cases from a Sanguinetti Road business fled toward Old Wards Ferry Road in a silver Toyota. 8:19 p.m., unclassified — Someone waiting to turn left from West Stockton Street reported that the light signal was not registering the vehicle. The Sheriff’s Office reported the following: TUESDAY 1:23 a.m., Tuolumne — A phone was stolen from the buffet section of a Tuolumne Road North business. 3:04 a.m., Sonora area — A vehicle was parked in the middle of a Mono Way parking lot. 5:45 a.m., Columbia — A person wearing dark-colored clothes with reflectors was lying on Italian Bar Road. 8:12 a.m., Sonora area — The seat to a motorcycle was stolen out of a Cavalieri Road garage. 8:39 a.m., Tuolumne — Tools were stolen from the bed of a truck parked on Stardust Way. 9:10 a.m., Sonora area — A pickup traveling up and down Buckhorn Mountain Road was possibly “casing” homes. 11:32 a.m., Sonora area — After a woman served another woman legal documents, she smiled and said, “You’re going to pay for this.” 11:35 a.m., Big Oak Flat — A Priest Coulterville Road man never received his prescription medication in the mail. 11:53 a.m., Jamestown — In retaliation to a neighbor calling in a complaint to animal control, a Placer Street person left a loud compressor going. 12:53 p.m., Sonora area — A Yerba Santa Drive person’s landlord entered the caller’s residence unlawfully and stole receipts and a bottle of vegetable oil. 1:20 p.m., Sonora area — A pair of shoes was stolen from a Mono Way shoe store. 3:02 p.m., Columbia — Several employees of a Parrotts Ferry Road restaurant were upset about not being paid. 3:58 p.m., Sonora area — The door of a Via Redonda Road residence was kicked down. 5:33 p.m., Jamestown — Two dogs were left in two separate vehicles parked on Chicken Ranch Road. 7:12 p.m., Sonora area — The landlady of a Highway 49 residence believed her tenants were storing stolen rifles inside a storage shed. 8:35 p.m., Sonora area — A man sitting near a Corte Primero woman’s vehicle was suspected of siphoning gas. 11:56 p.m., Columbia — A man walked down the middle of Springfield Road. Felony bookings TUESDAY 7:54 p.m., Sonora area — Roy Dee Staggs, 50, of the 21000 block of Old Sonora Columbia Road, was booked on suspicion of willful infliction of corporal injury after an arrest on Old Sonora Columbia Road. 9:54 p.m., Twain Harte — Kayce Holste Thompson, 37, of the 22000 block of Twain Harte Drive, was booked on suspicion of willful infliction of corporal injury and misdemeanor violating a court order to prevent domestic violence after an arrest at her home. CALAVERAS COUNTY The Sheriff’s Office reported the following: TUESDAY 4:54 a.m., Mokelumne Hill — A Highway 49 residence was possibly broken into. 7:53 a.m., Arnold — Someone tampered with vehicles on Fairway Drive. 9:16 a.m., San Andreas — A Mountain Ranch Road man stated he was assaulted by “some guys in Modesto.” 9:50 a.m., Copperopolis — A woman persistently asked the tenant of a Copper Meadows Drive residence if she could come inside and see the property, that is for rent. 1:08 p.m., Mountain Ranch — A Sheep Ranch Road residence was possibly broken into with suspicious people at the residence. A cleaning crew was found doing smoke-damage repairs to the house. 1:37 p.m., Murphys — The door of a Sheep Ranch Road residence was kicked in. 4:02 p.m., San Andreas — Several students were harassed as they left school on West Saint Charles Street. 4:25 p.m., Valley Springs — A drunk person “caused problems” and acted aggressively on Sequoia Avenue. Felony bookings TUESDAY 6 a.m., Mokelumne Hill — Justin William Ewing, 29, of the 8000 block of Milano Road, was booked on suspicion of vehicle theft and receiving known stolen property worth over $950 after an arrest on Highway 49. Arrests Cited on suspicion of driving under the influence of alcohol or drugs: TUESDAY 5:15 p.m., San Andreas — Paul Wayne Janssen, 29, of the 200 block of Pope Street, was booked after an arrest on Pope Street. Follow UnionDemocrat.com", "external_links": [], "published": "2015-10-01T04:00:00.000+03:00", "crawled": "2015-10-02T07:18:01.960+03:00", "highlightTitle": ""}