{"organizations": ["Daily News", "Sutton", "PM Boys Soccer Dover Sherborn", "Valley Tech", "St Mark", "Gatehouse Media, Inc", "Hopedale", "Wellesley", "Boys Cross", "North Middlesex", "Nipmuc", "Milford", "Norton", "Privacy Policy | Terms of Service | Gatehouse Media Publications", "Oliver Ames", "Girls Soccer Dover Sherborn", "Blackstone-Millville", "Ashland", "Brooks School", "Girls Volleyball Tri-County", "St. Clement"], "uuid": "d59232a46bf12cfee9a5cf2ca67692b6b913e25a", "thread": {"social": {"gplus": {"shares": 0}, "pinterest": {"shares": 0}, "vk": {"shares": 0}, "linkedin": {"shares": 0}, "facebook": {"likes": 0, "shares": 0, "comments": 0}, "stumbledupon": {"shares": 0}}, "site_full": "www.wickedlocal.com", "main_image": "http://www.wickedlocal.com/Global/images/head/nameplate/portal-newengland_logo.png", "site_section": "http://www.wickedlocal.com/sports?template=rss&mime=xml", "section_title": "Sports - Wicked Local", "url": "http://www.wickedlocal.com/article/20150930/SPORTS/150939399/2000/NEWS?rssfeed=true", "country": "US", "title": "Wednesday's Local Scores", "performance_score": 0, "site": "wickedlocal.com", "participants_count": 0, "title_full": "Wednesday's Local Scores", "spam_score": 0.0, "site_type": "news", "published": "2015-10-01T06:08:00.000+03:00", "replies_count": 0, "uuid": "d59232a46bf12cfee9a5cf2ca67692b6b913e25a"}, "author": "", "url": "http://www.wickedlocal.com/article/20150930/SPORTS/150939399/2000/NEWS?rssfeed=true", "ord_in_thread": 0, "title": "Wednesday's Local Scores", "locations": ["Newton North"], "entities": {"persons": [], "locations": [], "organizations": []}, "highlightText": "", "language": "english", "persons": ["Millis"], "text": "Wednesday's Local Scores A list of scores from all the action that took place in the Daily News area on Wednesday. Comment Posted Sep. 30, 2015 at 10:08 PM Posted Sep. 30, 2015 at 10:08 PM Boys Soccer Dover Sherborn 1, Ashland 1 Girls Soccer Dover Sherborn 4, Ashland 0 St Mark’s 0, Brooks School 0 Girls Volleyball Tri-County 3, Valley Tech 0 Sutton 3, Hopedale 1 Marian 3, St. Clement’s 0 Norton 3, Millis 2 Oliver Ames 3, Milford 0 Nipmuc 3, Blackstone-Millville 1 Algonquin 175, North Middlesex 228 Newton North 101, Wellesley 88 Boys Cross Country Sign Up Today Sign up for our newsletter and have the top headlines from your community delivered right to your inbox. Sign Up Today Sign up for our newsletter and have the top headlines from your community delivered right to your inbox. Your privacy is important, read our privacy policy. © Copyright 2006-2015 Gatehouse Media, Inc. Some rights reserved Privacy Policy | Terms of Service | Gatehouse Media Publications Original content available for non-commercial use under a Creative Commons license, except where noted. Wicked Local | 1752", "external_links": [], "published": "2015-10-01T06:08:00.000+03:00", "crawled": "2015-10-01T05:55:07.509+03:00", "highlightTitle": ""}