{"organizations": ["ES South", "ESS", "Cavs", "East Stroudsburg South High School"], "uuid": "541c92ccaa53f0b4758c95f703712686e828db09", "thread": {"social": {"gplus": {"shares": 0}, "pinterest": {"shares": 0}, "vk": {"shares": 0}, "linkedin": {"shares": 0}, "facebook": {"likes": 0, "shares": 0, "comments": 0}, "stumbledupon": {"shares": 0}}, "site_full": "www.poconorecord.com", "main_image": "http://www.poconorecord.com/storyimage/PR/20151023/SPORTS/151029755/AR/0/AR-151029755.jpg", "site_section": "http://www.poconorecord.com/sports?template=rss&mime=xml", "section_title": "Sports - poconorecord.com", "url": "http://www.poconorecord.com/article/20151023/SPORTS/151029755/101011/NEWS?rssfeed=true", "country": "US", "title": "Allen wins first game since 2012", "performance_score": 0, "site": "poconorecord.com", "participants_count": 0, "title_full": "Allen wins first game since 2012", "spam_score": 0.0, "site_type": "news", "published": "2015-10-24T07:08:00.000+03:00", "replies_count": 0, "uuid": "541c92ccaa53f0b4758c95f703712686e828db09"}, "author": "", "url": "http://www.poconorecord.com/article/20151023/SPORTS/151029755/101011/NEWS?rssfeed=true", "ord_in_thread": 0, "title": "Allen wins first game since 2012", "locations": ["ES South", "Gage Scott"], "entities": {"persons": [], "locations": [], "organizations": []}, "highlightText": "", "language": "english", "persons": ["Jared Alphonso", "Romeo Wright", "Jake Cirillo", "Christian Suarez", "Ryan Laroco", "Felix Alvarez", "Allen", "Dieruff", "Cirillo", "William Allen", "Changa Hodge"], "text": "Allen wins first game since 2012 Comment Posted Oct. 23, 2015 at 10:34 PM Updated at 11:08 PM Posted Oct. 23, 2015 at 10:34 PM Updated at 11:08 PM William Allen 28, ES South 27 Game played at East Stroudsburg South High School Leading rushers: ES South, Jared Alphonso - 7 carries for 33 yards. Allen, Christian Suarez - 18 carries for 100 yards. Leading passers: ESS, Jake Cirillo - 14-18, 247 yards and 2 TDs, 1 INT. Allen, Romeo Wright 8-12, 98 yards and 1 TD. Leading receivers: ESS, Gage Scott - 5 catches for 113 yards. Allen, Felix Alvarez - 3-58, 1 TD. Play of the game: Cirillo was intercepted with 2 minutes left in the fourth quarter to seal a victory for Allen. Key stat: ES South turned the ball over twice. Notes: 79-yard kickoff return for a touchdown by Changa Hodge brought the Cavs back into the game. Allen broke a 28-game losing streak. Last win came in 2012 against PM East. Next week: Friday, Oct. 30 - Dieruff at ES South, 7 p.m. - Ryan Laroco", "external_links": [], "published": "2015-10-24T07:08:00.000+03:00", "crawled": "2015-10-24T12:03:31.503+03:00", "highlightTitle": ""}