{"organizations": ["L.A. Times", "UCLA", "Oregon State", "Arizona Colorado", "USC", "Arizona State", "Arizona", "Cardinals", "Wildcats", "AP", "FOX Sports"], "uuid": "fe33bd087cb509c2ffb1f40aac6c7632a724bb90", "thread": {"social": {"gplus": {"shares": 0}, "pinterest": {"shares": 0}, "vk": {"shares": 0}, "linkedin": {"shares": 0}, "facebook": {"likes": 0, "shares": 0, "comments": 0}, "stumbledupon": {"shares": 0}}, "site_full": "www.onenewspage.com", "main_image": "http://cdn.newsserve.net/i/20151017/1604-Colorado-coach-guarantees-win-over-Arizona.jpg", "site_section": "http://www.onenewspage.com/rss/latest/Sports.rss", "section_title": "Latest Sports News on One News Page", "url": "http://www.onenewspage.com/n/Sports/7559xz8j1/Colorado-coach-guarantees-win-over-Arizona.htm", "country": "US", "title": "Colorado coach guarantees win over Arizona", "performance_score": 0, "site": "onenewspage.com", "participants_count": 0, "title_full": "Colorado coach guarantees win over Arizona", "spam_score": 0.0, "site_type": "news", "published": "2015-10-17T07:11:00.000+03:00", "replies_count": 0, "uuid": "fe33bd087cb509c2ffb1f40aac6c7632a724bb90"}, "author": "", "url": "http://www.onenewspage.com/n/Sports/7559xz8j1/Colorado-coach-guarantees-win-over-Arizona.htm", "ord_in_thread": 0, "title": "Colorado coach guarantees win over Arizona", "locations": ["Sports TEMPE", "Ariz.", "Arizona", "Africa", "Colorado"], "entities": {"persons": [], "locations": [], "organizations": []}, "highlightText": "", "language": "english", "persons": ["Tim White", "Andre Ellington", "Bruce Arians", "David Johnson", "Keyshawn Johnson", "Mike Bercovici", "Mike MacIntyre", "Steve Sarkisian", "Chris Johnson", "Rich Rodriguez"], "text": "Colorado coach guarantees win over Arizona Saturday, 17 October 2015 (3 minutes ago) Colorado coach Mike MacIntyre is 1-19 against in Pac-12 games since he took over the program. Arians: David Johnson Odd Man Out in RB Corps 00:42 Coach Bruce Arians indicated David Johnson will be the odd man out in the Cardinals' running back corps moving forward. Chris Johnson has been anointed Arizona's lead back, while a now-healthy Andre Ellington is likely to take over David Johnson's old \"nickel back\" role. \"Itâ€™s not hard, because the... Recent related news Despite a dominating victory over Oregon State, Arizona coach Rich Rodriguez said the Wildcats need to correct some self-inflicted errors before they take on an... FOX Sports 4 days ago - Sports Mike Bercovici threw five touchdown passes, tying a career high, and Tim White caught two scores to lead Arizona State to a 48-23 win over Colorado Saturday... MyNorthwest.com 6 days ago - Sports TEMPE, Ariz. (AP) Arizona State got its season back on track with last weekend's road win over UCLA. FOX Sports 1 week ago - Sports Former USC All-American Keyshawn Johnson has been critical of Trojans Coach Steve Sarkisian since he was hired in 2013. It seemed fitting that one of the last... L.A. Times 1 week ago - Africa You Might Like", "external_links": [], "published": "2015-10-17T07:11:00.000+03:00", "crawled": "2015-10-17T07:15:48.770+03:00", "highlightTitle": ""}