{"organizations": ["UCF", "AP Top", "FOX Carolina", "Penn State", "NCAA", "AP", "Temple"], "uuid": "516ecb1857aa84802fa0ba2df212c9f14032a704", "thread": {"social": {"gplus": {"shares": 0}, "pinterest": {"shares": 0}, "vk": {"shares": 0}, "linkedin": {"shares": 0}, "facebook": {"likes": 0, "shares": 0, "comments": 0}, "stumbledupon": {"shares": 0}}, "site_full": "www.foxcarolina.com", "main_image": "http://images.worldnow.com/AP/images/9044321_G.jpg", "site_section": "http://foxcarolina.com/category/208670/sports?clienttype=rss", "section_title": "WHNS Greenville - Sports", "url": "http://www.foxcarolina.com/story/30289610/american-uprising-memphis-temple-join-houston-in-ap-top-25", "country": "US", "title": "American uprising: Memphis, Temple join Houston in AP Top 25", "performance_score": 0, "site": "foxcarolina.com", "participants_count": 0, "title_full": "American uprising: Memphis, Temple join Houston in AP Top 25", "spam_score": 0.0, "site_type": "news", "published": "2015-10-18T21:12:00.000+03:00", "replies_count": 0, "uuid": "516ecb1857aa84802fa0ba2df212c9f14032a704"}, "author": "", "url": "http://www.foxcarolina.com/story/30289610/american-uprising-memphis-temple-join-houston-in-ap-top-25", "ord_in_thread": 0, "title": "American uprising: Memphis, Temple join Houston in AP Top 25", "locations": ["Tenn.", "Houston", "Columbus", "Philadelphia", "Mississippi", "NEWARK", "Memphis", "Ohio"], "entities": {"persons": [], "locations": [], "organizations": []}, "highlightText": "", "language": "english", "persons": ["Jamiyus Pittman", "RALPH D. RUSSOAP", "Thomas", "MANDATOR", "Humphrey", "Chase Farris", "Paxton Lynch", "Jahad Thomas", "Ezekiel Elliott", "Jason Stewart"], "text": "American uprising: Memphis, Temple join Houston in AP Top 25 - FOX Carolina 21 Member Center: FCC Public File American uprising: Memphis, Temple join Houston in AP Top 25 (AP Photo/Mark Humphrey). Memphis quarterback Paxton Lynch (12) celebrates with quarterback Jason Stewart, left, after they upset No. 13 Mississippi 37-24 in an NCAA college football game Saturday, Oct. 17, 2015, in Memphis, Tenn. (Yong Kim/The Philadelphia Inquirer via AP). Temple's Jahad Thomas runs past UCF's Jamiyus Pittman during the fourth-quarter on Saturday, Oct. 17, 2015 in Philadelphia. Thomas scored on a 21 yard run. PHIX OUT; TV OUT; MAGS OUT; NEWARK OUT; MANDATOR... (AP Photo/Paul Vernon). Ohio State running back Ezekiel Elliott, left, celebrates his touchdown against Penn State with teammate offensive lineman Chase Farris during the first half of an NCAA college football game Saturday, Oct. 17, 2015, in Columbus,... By RALPH D. RUSSOAP College Football Writer \nMemphis and Temple jumped into The Associated Press college football poll for the first time this season, joining Houston to give the American Athletic Conference three ranked teams for the first time in the history of the three-year old league. \nOhio State remained No. 1 in the AP Top 25 released Sunday. For the second straight week, six teams received first-place votes in the media poll, led by the Buckeyes with 28. No. 2 Baylor has 12, No. 3 Utah received 16, No. 4 TCU got three and No. 5 LSU and No. 6 Clemson each have one. \nThe Utes and LSU Tigers each edged ahead one spot after home victories on Saturday. \nMichigan State stayed at No. 7 after its miracle against Michigan and Alabama is No. 8 after handing Texas A&M its first loss. \nMemphis (6-0) had the big upset of the weekend against Mississippi. The Tigers 37-24 victory vaulted them into the rankings at No 18. Unbeaten Temple moved to 6-0 and was ranked No. 22. No. 21 Houston is also 6-0. \n___ \nAP college football site: http://collegefootball.ap.org Copyright 2015 The Associated Press.   This material may not be published, broadcast, rewritten or redistributed.", "external_links": [], "published": "2015-10-18T21:12:00.000+03:00", "crawled": "2015-10-18T21:14:40.834+03:00", "highlightTitle": ""}