{"organizations": ["Asheville High School", "Reynolds", "Asheville High School's Reggie Battle", "Reynolds High School", "Reynolds at Reynolds High School", "Facebook Dowdle"], "uuid": "f48a03b9ed980c48ba4da51721944cf4829440ed", "thread": {"social": {"gplus": {"shares": 0}, "pinterest": {"shares": 0}, "vk": {"shares": 0}, "linkedin": {"shares": 0}, "facebook": {"likes": 0, "shares": 0, "comments": 0}, "stumbledupon": {"shares": 0}}, "site_full": "www.citizen-times.com", "main_image": "http://www.gannett-cdn.com/-mm-/2fb2044c01ed99212178b26465c37e1d51c7f4ae/c=0-183-3600-2217&amp;r=x633&amp;c=1600x630/local/-/media/2015/10/03/CarolinaGroup/Asheville/635794287901155507-Dowdle.jpg", "site_section": "http://rssfeeds.citizen-times.com/asheville/sports", "section_title": "Asheville - Sports", "url": "http://www.citizen-times.com/story/sports/high-school/football/2015/10/02/fridays-wnc-high-school-football-roundup/73250988/", "country": "US", "title": "Dowdle puts on a show in Asheville-Reynolds", "performance_score": 0, "site": "citizen-times.com", "participants_count": 0, "title_full": "Dowdle puts on a show in Asheville-Reynolds", "spam_score": 0.0, "site_type": "news", "published": "2015-10-03T07:53:00.000+03:00", "replies_count": 0, "uuid": "f48a03b9ed980c48ba4da51721944cf4829440ed"}, "author": "", "url": "http://www.citizen-times.com/story/sports/high-school/football/2015/10/02/fridays-wnc-high-school-football-roundup/73250988/", "ord_in_thread": 0, "title": "Dowdle puts on a show in Asheville-Reynolds", "locations": ["Asheville", "Western North Carolina"], "entities": {"persons": [], "locations": [], "organizations": []}, "highlightText": "", "language": "english", "persons": ["Dowdle", "Reggie Battle", "Noah Eberhardt", "Reynolds", "Andrew Pearson", "William Woody", "Isaiah Drummond", "Najae Buchanan", "Peter Leota", "Rico Dowdle", "Devon Davidson"], "text": "Dowdle puts on a show in Asheville-Reynolds REYNOLDS – No one in Western North Carolina football can make something out of nothing like Rico Dowdle. Post to Facebook Dowdle puts on a show in Asheville-Reynolds REYNOLDS – No one in Western North Carolina football can make something out of nothing like Rico Dowdle. Check out this story on citizen-times.com: http://avlne.ws/1L9HCgK Cancel Send A link has been sent to your friend's email address. Posted! A link has been posted to your Facebook feed. Join the Conversation To find out more about Facebook commenting please read the Conversation Guidelines and FAQs Dowdle puts on a show in Asheville-Reynolds High School Sports Huddle Andrew Pearson , apearson@citizen-times.com 12:53 a.m. EDT October 3, 2015 Reynolds High School's Rico Dowdle runs for a first down in the first quarter against Asheville High School Friday at Reynolds. William Woody / wwoody@citizen-times.com, William Woody / wwoody@citizen-times.com Reynolds High School's Rico Dowdle scrambles for a first down in the first quarter against Asheville High School Friday at Reynolds. William Woody / wwoody@citizen-times.com, William Woody / wwoody@citizen-times.com Asheville High School's Peter Leota watches action from the sideline in the second quarter against Reynolds at Reynolds High School Friday night. William Woody / wwoody@citizen-times.com, William Woody / wwoody@citizen-times.com Asheville High School's Reggie Battle slowly get up from a tackle in a run for a loss in the first quarter against Reynolds at Reynolds High School Friday night. William Woody / wwoody@citizen-times.com, William Woody / wwoody@citizen-times.com Reynolds high school's Noah Eberhardt, 7, dives for an interception from Asheville high school's Devon Davidson in the first quarter at Reynolds High School. William Woody / wwoody@citizen-times.com, William Woody / wwoody@citizen-times.com Reynolds High School's Rico Dowdle runs for a touchdown in the first quarter against Asheville High School Friday at Reynolds. William Woody / wwoody@citizen-times.com, William Woody / wwoody@citizen-times.com Asheville High School's Isaiah Drummond hauls in a pass from quarterback Devon Davidson in the second quarter against Reynolds at Reynolds High School Friday night. William Woody / wwoody@citizen-times.com, William Woody / wwoody@citizen-times.com Asheville High School quarterback Devon Davidson is tackled by Najae Buchanan in the second quarter against Reynolds at Reynolds High School Friday night. William Woody / wwoody@citizen-times.com, William Woody / wwoody@citizen-times.com Asheville High School quarterback Devon Davidson looks for an open receiver in the second quarter against Reynolds at Reynolds High School Friday night. William Woody / wwoody@citizen-times.com, William Woody / wwoody@citizen-times.com Reynolds High School's Rico Dowdle runs for a first down in the second quarter against Asheville High School Friday at Reynolds. William Woody / wwoody@citizen-times.com, William Woody / wwoody@citizen-times.com Members of the Reynolds defense chase after a loose ball while a punter for Asheville High School punches it out of the end zone for a safety in in the second quarter at Reynolds High School Friday night. William Woody / wwoody@citizen-times.com, William Woody / wwoody@citizen-times.com Reynolds High School's Rico Dowdle runs for a touch down in the second quarter against Asheville High School Friday at Reynolds. William Woody / wwoody@citizen-times.com, William Woody / wwoody@citizen-times.com Reynolds High School's Rico Dowdle runs for a touch down in the second quarter against Asheville High School Friday at Reynolds. William Woody / wwoody@citizen-times.com, William Woody / wwoody@citizen-times.com Asheville High School's Reggie Battle runs for a first down in the second quarter against Reynolds at Reynolds High School Friday night. William Woody / wwoody@citizen-times.com, William Woody / wwoody@citizen-times.com Reynolds high school defeated Asheville high school 54-21 in Friday night the rivalry game played at Reynolds high school. William Woody / wwoody@citizen-times.com, William Woody / wwoody@citizen-times.com Reynolds high school defeated Asheville high school 54-21 in Friday night the rivalry game played at Reynolds high school. William Woody / wwoody@citizen-times.com, William Woody / wwoody@citizen-times.com Reynolds high school defeated Asheville high school 54-21 in Friday night the rivalry game played at Reynolds high school. William Woody / wwoody@citizen-times.com, William Woody / wwoody@citizen-times.com Reynolds high school defeated Asheville high school 54-21 in Friday night the rivalry game played at Reynolds high school. William Woody / wwoody@citizen-times.com, William Woody / wwoody@citizen-times.com Reynolds high school defeated Asheville high school 54-21 in Friday night the rivalry game played at Reynolds high school. William Woody / wwoody@citizen-times.com, William Woody / wwoody@citizen-times.com Reynolds high school defeated Asheville high school 54-21 in Friday night the rivalry game played at Reynolds high school. William Woody / wwoody@citizen-times.com, William Woody / wwoody@citizen-times.com Reynolds high school defeated Asheville high school 54-21 in Friday night the rivalry game played at Reynolds high school. William Woody / wwoody@citizen-times.com, William Woody / wwoody@citizen-times.com Reynolds high school defeated Asheville high school 54-21 in Friday night the rivalry game played at Reynolds high school. William Woody / wwoody@citizen-times.com, William Woody / wwoody@citizen-times.com Reynolds high school defeated Asheville high school 54-21 in Friday night the rivalry game played at Reynolds high school. William Woody / wwoody@citizen-times.com, William Woody / wwoody@citizen-times.com Reynolds high school defeated Asheville high school 54-21 in Friday night the rivalry game played at Reynolds high school. William Woody / wwoody@citizen-times.com, William Woody / wwoody@citizen-times.com Reynolds high school defeated Asheville high school 54-21 in Friday night the rivalry game played at Reynolds high school. William Woody / wwoody@citizen-times.com, William Woody / wwoody@citizen-times.com Reynolds high school defeated Asheville high school 54-21 in Friday night the rivalry game played at Reynolds high school. William Woody / wwoody@citizen-times.com, William Woody / wwoody@citizen-times.com Reynolds high school defeated Asheville high school 54-21 in Friday night the rivalry game played at Reynolds high school. William Woody / wwoody@citizen-times.com, William Woody / wwoody@citizen-times.com Reynolds high school defeated Asheville high school 54-21 in Friday night the rivalry game played at Reynolds high school. William Woody / wwoody@citizen-times.com, William Woody / wwoody@citizen-times.com Reynolds high school defeated Asheville high school 54-21 in Friday night the rivalry game played at Reynolds high school. William Woody / wwoody@citizen-times.com, William Woody / wwoody@citizen-times.com Reynolds high school defeated Asheville high school 54-21 in Friday night the rivalry game played at Reynolds high school. William Woody / wwoody@citizen-times.com, William Woody / wwoody@citizen-times.com Reynolds high school defeated Asheville high school 54-21 in Friday night the rivalry game played at Reynolds high school. William Woody / wwoody@citizen-times.com, William Woody / wwoody@citizen-times.com Reynolds high school defeated Asheville high school 54-21 in Friday night the rivalry game played at Reynolds high school. William Woody / wwoody@citizen-times.com, William Woody / wwoody@citizen-times.com Reynolds high school defeated Asheville high school 54-21 in Friday night the rivalry game played at Reynolds high school. William Woody / wwoody@citizen-times.com, William Woody / wwoody@citizen-times.com Reynolds high school defeated Asheville high school 54-21 in Friday night the rivalry game played at Reynolds high school. William Woody / wwoody@citizen-times.com, William Woody / wwoody@citizen-times.com Reynolds high school defeated Asheville high school 54-21 in Friday night the rivalry game played at Reynolds high school. William Woody / wwoody@citizen-times.com, William Woody / wwoody@citizen-times.com Reynolds high school defeated Asheville high school 54-21 in Friday night the rivalry game played at Reynolds high school. William Woody / wwoody@citizen-times.com, William Woody / wwoody@citizen-times.com Reynolds high school defeated Asheville high school 54-21 in Friday night the rivalry game played at Reynolds high school. William Woody / wwoody@citizen-times.com, William Woody / wwoody@citizen-times.com Reynolds high school defeated Asheville high school 54-21 in Friday night the rivalry game played at Reynolds high school. William Woody / wwoody@citizen-times.com, William Woody / wwoody@citizen-times.com Reynolds high school defeated Asheville high school 54-21 in Friday night the rivalry game played at Reynolds high school. William Woody / wwoody@citizen-times.com, William Woody / wwoody@citizen-times.com Reynolds high school defeated Asheville high school 54-21 in Friday night the rivalry game played at Reynolds high school. William Woody / wwoody@citizen-times.com, William Woody / wwoody@citizen-times.com Reynolds high school defeated Asheville high school 54-21 in Friday night the rivalry game played at Reynolds high school. William Woody / wwoody@citizen-times.com, William Woody / wwoody@citizen-times.com Reynolds high school defeated Asheville high school 54-21 in Friday night the rivalry game played at Reynolds high school. William Woody / wwoody@citizen-times.com, William Woody / wwoody@citizen-times.com Reynolds high school defeated Asheville high school 54-21 in Friday night the rivalry game played at Reynolds high school. William Woody / wwoody@citizen-times.com, William Woody / wwoody@citizen-times.com Reynolds high school defeated Asheville high school 54-21 in Friday night the rivalry game played at Reynolds high school. William Woody / wwoody@citizen-times.com, William Woody / wwoody@citizen-times.com Reynolds high school defeated Asheville high school 54-21 in Friday night the rivalry game played at Reynolds high school. William Woody / wwoody@citizen-times.com, William Woody / wwoody@citizen-times.com Reynolds high school defeated Asheville high school 54-21 in Friday night the rivalry game played at Reynolds high school. William Woody / wwoody@citizen-times.com, William Woody / wwoody@citizen-times.com Reynolds high school defeated Asheville high school 54-21 in Friday night the rivalry game played at Reynolds high school. William Woody / wwoody@citizen-times.com, William Woody / wwoody@citizen-times.com Reynolds high school defeated Asheville high school 54-21 in Friday night the rivalry game played at Reynolds high school. William Woody / wwoody@citizen-times.com, William Woody / wwoody@citizen-times.com Reynolds high school defeated Asheville high school 54-21 in Friday night the rivalry game played at Reynolds high school. William Woody / wwoody@citizen-times.com, William Woody / wwoody@citizen-times.com Reynolds high school defeated Asheville high school 54-21 in Friday night the rivalry game played at Reynolds high school. William Woody / wwoody@citizen-times.com, William Woody / wwoody@citizen-times.com Reynolds high school defeated Asheville high school 54-21 in Friday night the rivalry game played at Reynolds high school. William Woody / wwoody@citizen-times.com, William Woody / wwoody@citizen-times.com Reynolds high school defeated Asheville high school 54-21 in Friday night the rivalry game played at Reynolds high school. William Woody / wwoody@citizen-times.com, William Woody / wwoody@citizen-times.com Reynolds high school defeated Asheville high school 54-21 in Friday night the rivalry game played at Reynolds high school. William Woody / wwoody@citizen-times.com, William Woody / wwoody@citizen-times.com Reynolds high school defeated Asheville high school 54-21 in Friday night the rivalry game played at Reynolds high school. William Woody / wwoody@citizen-times.com, William Woody / wwoody@citizen-times.com Reynolds high school defeated Asheville high school 54-21 in Friday night the rivalry game played at Reynolds high school. William Woody / wwoody@citizen-times.com, William Woody / wwoody@citizen-times.com Reynolds high school defeated Asheville high school 54-21 in Friday night the rivalry game played at Reynolds high school. William Woody / wwoody@citizen-times.com, William Woody / wwoody@citizen-times.com Reynolds high school defeated Asheville high school 54-21 in Friday night the rivalry game played at Reynolds high school. William Woody / wwoody@citizen-times.com, William Woody / wwoody@citizen-times.com Reynolds high school defeated Asheville high school 54-21 in Friday night the rivalry game played at Reynolds high school. William Woody / wwoody@citizen-times.com, William Woody / wwoody@citizen-times.com Reynolds high school defeated Asheville high school 54-21 in Friday night the rivalry game played at Reynolds high school. William Woody / wwoody@citizen-times.com, William Woody / wwoody@citizen-times.com Reynolds high school defeated Asheville high school 54-21 in Friday night the rivalry game played at Reynolds high school. William Woody / wwoody@citizen-times.com, William Woody / wwoody@citizen-times.com Reynolds high school defeated Asheville high school 54-21 in Friday night the rivalry game played at Reynolds high school. William Woody / wwoody@citizen-times.com, William Woody / wwoody@citizen-times.com Reynolds high school defeated Asheville high school 54-21 in Friday night the rivalry game played at Reynolds high school. William Woody / wwoody@citizen-times.com, William Woody / wwoody@citizen-times.com Reynolds high school defeated Asheville high school 54-21 in Friday night the rivalry game played at Reynolds high school. William Woody / wwoody@citizen-times.com, William Woody / wwoody@citizen-times.com Reynolds high school defeated Asheville high school 54-21 in Friday night the rivalry game played at Reynolds high school. William Woody / wwoody@citizen-times.com, William Woody / wwoody@citizen-times.com Reynolds high school defeated Asheville high school 54-21 in Friday night the rivalry game played at Reynolds high school. William Woody / wwoody@citizen-times.com, William Woody / wwoody@citizen-times.com Reynolds high school defeated Asheville high school 54-21 in Friday night the rivalry game played at Reynolds high school. William Woody / wwoody@citizen-times.com, William Woody / wwoody@citizen-times.com Reynolds high school defeated Asheville high school 54-21 in Friday night the rivalry game played at Reynolds high school. William Woody / wwoody@citizen-times.com, William Woody / wwoody@citizen-times.com Reynolds high school defeated Asheville high school 54-21 in Friday night the rivalry game played at Reynolds high school. William Woody / wwoody@citizen-times.com, William Woody / wwoody@citizen-times.com Reynolds high school defeated Asheville high school 54-21 in Friday night the rivalry game played at Reynolds high school. William Woody / wwoody@citizen-times.com, William Woody / wwoody@citizen-times.com Reynolds high school defeated Asheville high school 54-21 in Friday night the rivalry game played at Reynolds high school. William Woody / wwoody@citizen-times.com, William Woody / wwoody@citizen-times.com Reynolds high school defeated Asheville high school 54-21 in Friday night the rivalry game played at Reynolds high school. William Woody / wwoody@citizen-times.com, William Woody / wwoody@citizen-times.com Reynolds high school defeated Asheville high school 54-21 in Friday night the rivalry game played at Reynolds high school. William Woody / wwoody@citizen-times.com, William Woody / wwoody@citizen-times.com Reynolds high school defeated Asheville high school 54-21 in Friday night the rivalry game played at Reynolds high school. William Woody / wwoody@citizen-times.com, William Woody / wwoody@citizen-times.com Reynolds high school defeated Asheville high school 54-21 in Friday night the rivalry game played at Reynolds high school. William Woody / wwoody@citizen-times.com, William Woody / wwoody@citizen-times.com Reynolds high school defeated Asheville high school 54-21 in Friday night the rivalry game played at Reynolds high school. William Woody / wwoody@citizen-times.com, William Woody / wwoody@citizen-times.com Reynolds high school defeated Asheville high school 54-21 in Friday night the rivalry game played at Reynolds high school. William Woody / wwoody@citizen-times.com, William Woody / wwoody@citizen-times.com Reynolds high school defeated Asheville high school 54-21 in Friday night the rivalry game played at Reynolds high school. William Woody / wwoody@citizen-times.com, William Woody / wwoody@citizen-times.com Reynolds high school defeated Asheville high school 54-21 in Friday night the rivalry game played at Reynolds high school. William Woody / wwoody@citizen-times.com, William Woody / wwoody@citizen-times.com Reynolds high school defeated Asheville high school 54-21 in Friday night the rivalry game played at Reynolds high school. William Woody / wwoody@citizen-times.com, William Woody / wwoody@citizen-times.com Reynolds high school defeated Asheville high school 54-21 in Friday night the rivalry game played at Reynolds high school. William Woody / wwoody@citizen-times.com, William Woody / wwoody@citizen-times.com Reynolds high school defeated Asheville high school 54-21 in Friday night the rivalry game played at Reynolds high school. William Woody / wwoody@citizen-times.com, William Woody / wwoody@citizen-times.com Like this topic? You may also like these photo galleries: Replay", "external_links": [], "published": "2015-10-03T07:53:00.000+03:00", "crawled": "2015-10-03T13:15:42.126+03:00", "highlightTitle": ""}