{"organizations": ["Mono Village Center", "Sierra Saints", "Sierra Waldorf School", "Angels Camp Branch Library", "Christian Motorcyclist Association", "N. Washington St.", "TUOLUMNE COUNTY TODAY Don Pedro Recreation Agency Board of Control", "Sierra Railroad"], "uuid": "3e13f5172615a2c33773031f0e0b9e3e63377e57", "thread": {"social": {"gplus": {"shares": 0}, "pinterest": {"shares": 0}, "vk": {"shares": 0}, "linkedin": {"shares": 0}, "facebook": {"likes": 0, "shares": 0, "comments": 0}, "stumbledupon": {"shares": 0}}, "site_full": "www.uniondemocrat.com", "main_image": "", "site_section": "http://feeds.feedburner.com/UnionDemocrat", "section_title": "The Union Democrat, Sonora, CA News, Sports, & Weather", "url": "http://www.uniondemocrat.com/index.php?option=com_content&task=view&id=117789&Itemid=199", "country": "US", "title": "Calendar for Oct. 9, 2015", "performance_score": 0, "site": "uniondemocrat.com", "participants_count": 0, "title_full": "Calendar for Oct. 9, 2015", "spam_score": 0.0, "site_type": "news", "published": "2015-10-09T04:00:00.000+03:00", "replies_count": 0, "uuid": "3e13f5172615a2c33773031f0e0b9e3e63377e57"}, "author": "", "url": "http://www.uniondemocrat.com/index.php?option=com_content&task=view&id=117789&Itemid=199", "ord_in_thread": 0, "title": "Calendar for Oct. 9, 2015", "locations": ["East Sonora", "Tuolumne", "Bay Avenue", "Sonora", "Mono Way", "Rawhide Road", "Jamestown", "Bonds Flat Road", "Washington Street"], "entities": {"persons": [], "locations": [], "organizations": []}, "highlightText": "", "language": "english", "persons": ["Twain Harte", "Grandma", "Stewart", "La Grange"], "text": "Calendar for Oct. 9, 2015 Calendar for Oct. 9, 2015 By Union Democrat staff October 09, 2015 01:00 am TUOLUMNE COUNTY TODAY Don Pedro Recreation Agency Board of Control, 10 a.m., agency headquarters, 31 Bonds Flat Road, La Grange. Preschool Story Hour, “Stories with Grandma,” 11 a.m., Tuolumne branch library, 18636 Main St., Tuolumne, 928-3612. Sing Along, 11 to 11:30 a.m., Sierra Waldorf School, 19234 Rawhide Road, Jamestown, 984-0454. SATURDAY Sonora Farmers Market, 7:30 to 11:30 a.m., corner of Theall and Stewart streets, 532-7725. Kiwanis Club Open Air Market, 8 a.m. to 4 p.m., Mono Village Center, Mono Way, East Sonora, 532-0140. Christian Motorcyclist Association, Sierra Saints Chapter, 8 a.m. breakfast, 9 a.m. ride, My Garden Cafe, 14270 Mono Way, East Sonora, 288-2477. Operation: MOM, a Military Family Support Group, 10 a.m. to 1 p.m., Sonora Veterans Memorial Hall, 9 N. Washington St., 532-8051, 510-329-9397. Family Fire Fest, 11 a.m. to 3 p.m., Mi-Wuk and Sugar Pine Fire Station, 24247 Highway 108, Twain Harte, 588-3319. Friends of the Sierra Railroad, 1 p.m., Bay Avenue and Pine Street, Tuolumne. 2nd Saturday Art Night, 5 to 8 p.m., downtown Sonora, Washington Street. CALAVERAS COUNTY TODAY Angels Camp Library Story Time, 10 a.m., Angels Camp Branch Library, 426 N. Main St., Angels Camp, 736-2198. SATURDAY Murphys Historical Walking Tour, 10 a.m., tours start at Old Timers Museum across from Murphys Hotel.  ", "external_links": [], "published": "2015-10-09T04:00:00.000+03:00", "crawled": "2015-10-10T08:02:00.217+03:00", "highlightTitle": ""}