{"organizations": ["Fife Trojans", "Fife High School Facebook Email Twitter Google", "Fife High School KING", "Washington Patriots", "Facebook", "KING"], "uuid": "0cf00ab9f60a106d4c4c54fe2c4b5dc4d5c525b5", "thread": {"social": {"gplus": {"shares": 0}, "pinterest": {"shares": 0}, "vk": {"shares": 0}, "linkedin": {"shares": 0}, "facebook": {"likes": 0, "shares": 0, "comments": 0}, "stumbledupon": {"shares": 0}}, "site_full": "www.king5.com", "main_image": "", "site_section": "http://rssfeeds.king5.com/_/20/109219364/king5/highschoolsports", "section_title": "KING 5 - High School Sports", "url": "http://www.king5.com/story/sports/high-school/football/2015/10/02/friday-football-pep-rally-fife-high-school/73204572/", "country": "US", "title": "Friday football pep rally at Fife High School", "performance_score": 0, "site": "king5.com", "participants_count": 0, "title_full": "Friday football pep rally at Fife High School", "spam_score": 0.0, "site_type": "news", "published": "2015-10-02T18:35:00.000+03:00", "replies_count": 0, "uuid": "0cf00ab9f60a106d4c4c54fe2c4b5dc4d5c525b5"}, "author": "", "url": "http://www.king5.com/story/sports/high-school/football/2015/10/02/friday-football-pep-rally-fife-high-school/73204572/", "ord_in_thread": 0, "title": "Friday football pep rally at Fife High School", "locations": [], "entities": {"persons": [], "locations": [], "organizations": []}, "highlightText": "", "language": "english", "persons": ["Natasha Ryan"], "text": "Facebook Email Twitter Google+ LinkedIn Pinterest Friday football pep rally at Fife High School KING 5's Natasha Ryan reports as the Fife Trojans prepare to host the Washington Patriots in the KING 5 Big Game of the Week. Post to Facebook Friday football pep rally at Fife High School KING 5's Natasha Ryan reports as the Fife Trojans prepare to host the Washington Patriots in the KING 5 Big Game of the Week.   KING5.com: http://www.king5.com/story/sports/high-school/football/2015/10/02/friday-football-pep-rally-fife-high-school/73204572/   Join the Conversation To   Friday football pep rally at Fife High School KING 5's Natasha Ryan reports as the Fife Trojans prepare to host the Washington Patriots in the KING 5 Big Game of the Week. KING 5 News, KING5.com 8:35 a.m. PDT October 2, 2015 Read or Share this story: http://www.king5.com/story/sports/high-school/football/2015/10/02/friday-football-pep-rally-fife-high-school/73204572/ TOP VIDEOS", "external_links": [], "published": "2015-10-02T18:35:00.000+03:00", "crawled": "2015-10-02T18:51:03.257+03:00", "highlightTitle": ""}