{"organizations": ["Red Hook", "Wallkill's Jeffrey Arenas", "Mid-Hudson Athletic League", "MHAL", "Poughkeepsie Journal"], "uuid": "acb508669d72ab9b75e92f22c9024d709d74acc7", "thread": {"social": {"gplus": {"shares": 0}, "pinterest": {"shares": 0}, "vk": {"shares": 0}, "linkedin": {"shares": 0}, "facebook": {"likes": 0, "shares": 0, "comments": 0}, "stumbledupon": {"shares": 0}}, "site_full": "www.poughkeepsiejournal.com", "main_image": "http://www.gannett-cdn.com/-mm-/4f08de6c312e93c10e6ef4745bb588e63682fdac/c=0-205-2278-1492&amp;r=x633&amp;c=1200x630/local/-/media/2015/10/20/Poughkeepsie/Poughkeepsie/635809669696474320-1021MHALBsocSemi-1025.jpg", "site_section": "http://rssfeeds.poughkeepsiejournal.com/poughkeepsie/sports", "section_title": "Poughkeepsie - Sports", "url": "http://www.poughkeepsiejournal.com/story/sports/high-school/2015/10/20/hare-red-hook-set-stage-showdown-spackenkill-mhal-final/74192896/", "country": "US", "title": "PHOTOS: Hare, Red Hook set stage for showdown with Spackenkill in MHAL final", "performance_score": 0, "site": "poughkeepsiejournal.com", "participants_count": 0, "title_full": "PHOTOS: Hare, Red Hook set stage for showdown with Spackenkill in MHAL final", "spam_score": 0.0, "site_type": "news", "published": "2015-10-21T04:53:00.000+03:00", "replies_count": 0, "uuid": "acb508669d72ab9b75e92f22c9024d709d74acc7"}, "author": "", "url": "http://www.poughkeepsiejournal.com/story/sports/high-school/2015/10/20/hare-red-hook-set-stage-showdown-spackenkill-mhal-final/74192896/", "ord_in_thread": 0, "title": "PHOTOS: Hare, Red Hook set stage for showdown with Spackenkill in MHAL final", "locations": ["Staatsburg", "Wallkill"], "entities": {"persons": [], "locations": [], "organizations": []}, "highlightText": "", "language": "english", "persons": ["Zach Sivulich", "Hare", "Corey Scheibling", "Stephen Haynes", "Patrick Oehler/Poughkeepsie Journal Red Hook", "Colin Sullivan", "Ryan Castle", "Dennis Hare", "Spackenkill"], "text": "PHOTOS: Hare, Red Hook set stage for showdown with Spackenkill in MHAL final Stephen Haynes, Poughkeepsie Journal 9:53 p.m. EDT October 20, 2015 Red Hook's Colin Sullivan gains control of the ball as Wallkill's Ryan Castle closes in on him during Tuesdays Mid-Hudson Athletic League semi-final held in Staatsburg. Patrick Oehler/Poughkeepsie Journal Red Hook's Dennis Hare headers the ball into the goal past Wallkill's Jeffrey Arenas during Tuesdays Mid-Hudson Athletic League semi-final held in Staatsburg. Patrick Oehler/Poughkeepsie Journal Red Hook's Zach Sivulich headers the ball past a line of Wallkill's players during Tuesdays Mid-Hudson Athletic League semi-final held in Staatsburg. Patrick Oehler/Poughkeepsie Journal Red Hook's Dennis Hare drives the ball past Wallkill's Corey Scheibling to score Red Hook's fourth goal during Tuesdays Mid-Hudson Athletic League Semi-Final held in Staatsburg. Patrick Oehler/Poughkeepsie Journal Action from Tuesday's Mid-Hudson Athletic League boys soccer semi-final between Red Hook and Wallkill. Patrick Oehler/Poughkeepsie Journal Action from Tuesday's Mid-Hudson Athletic League boys soccer semi-final between Red Hook and Wallkill. Patrick Oehler/Poughkeepsie Journal Action from Tuesday's Mid-Hudson Athletic League boys soccer semi-final between Red Hook and Wallkill. Patrick Oehler/Poughkeepsie Journal Action from Tuesday's Mid-Hudson Athletic League boys soccer semi-final between Red Hook and Wallkill. Patrick Oehler/Poughkeepsie Journal Action from Tuesday's Mid-Hudson Athletic League boys soccer semi-final between Red Hook and Wallkill. Patrick Oehler/Poughkeepsie Journal Action from Tuesday's Mid-Hudson Athletic League boys soccer semi-final between Red Hook and Wallkill. Patrick Oehler/Poughkeepsie Journal Action from Tuesday's Mid-Hudson Athletic League boys soccer semi-final between Red Hook and Wallkill. Patrick Oehler/Poughkeepsie Journal Action from Tuesday's Mid-Hudson Athletic League boys soccer semi-final between Red Hook and Wallkill. Patrick Oehler/Poughkeepsie Journal Action from Tuesday's Mid-Hudson Athletic League boys soccer semi-final between Red Hook and Wallkill. Patrick Oehler/Poughkeepsie Journal Action from Tuesday's Mid-Hudson Athletic League boys soccer semi-final between Red Hook and Wallkill. Patrick Oehler/Poughkeepsie Journal Action from Tuesday's Mid-Hudson Athletic League boys soccer semi-final between Red Hook and Wallkill. Patrick Oehler/Poughkeepsie Journal Action from Tuesday's Mid-Hudson Athletic League boys soccer semi-final between Red Hook and Wallkill. Patrick Oehler/Poughkeepsie Journal Action from Tuesday's Mid-Hudson Athletic League boys soccer semi-final between Red Hook and Wallkill. Patrick Oehler/Poughkeepsie Journal Action from Tuesday's Mid-Hudson Athletic League boys soccer semi-final between Red Hook and Wallkill. Patrick Oehler/Poughkeepsie Journal Action from Tuesday's Mid-Hudson Athletic League boys soccer semi-final between Red Hook and Wallkill. Patrick Oehler/Poughkeepsie Journal Action from Tuesday's Mid-Hudson Athletic League boys soccer semi-final between Red Hook and Wallkill. Patrick Oehler/Poughkeepsie Journal Action from Tuesday's Mid-Hudson Athletic League boys soccer semi-final between Red Hook and Wallkill. Patrick Oehler/Poughkeepsie Journal Action from Tuesday's Mid-Hudson Athletic League boys soccer semi-final between Red Hook and Wallkill. Patrick Oehler/Poughkeepsie Journal Action from Tuesday's Mid-Hudson Athletic League boys soccer semi-final between Red Hook and Wallkill. Patrick Oehler/Poughkeepsie Journal Like this topic? You may also like these photo galleries: Replay", "external_links": [], "published": "2015-10-21T04:53:00.000+03:00", "crawled": "2015-10-21T20:30:31.730+03:00", "highlightTitle": ""}