{"organizations": ["St. Charles North"], "uuid": "b14650c7814034a050dbda1c30c2dfb8ac6a2a95", "thread": {"social": {"gplus": {"shares": 0}, "pinterest": {"shares": 0}, "vk": {"shares": 0}, "linkedin": {"shares": 0}, "facebook": {"likes": 0, "shares": 0, "comments": 0}, "stumbledupon": {"shares": 0}}, "site_full": "football.dailyherald.com", "main_image": "http://www.dailyherald.com/storyimage/DA/20151016/sports/151018982/AR/0/AR-151018982.jpg&amp;updated=201510162245&amp;imageversion=Facebook&amp;exactH=630&amp;exactW=1200&amp;exactfit=crop&amp;noborder", "site_section": "http://www.dailyherald.com/rss/rss.asp?section=sports_prep_bswimming", "section_title": "DailyHerald.com  > sports_prep_bswimming", "url": "http://football.dailyherald.com/article/20151016/sports/151018982/", "country": "US", "title": "Images: St. Charles East falls to St. Charles North, 31-10 in football", "performance_score": 0, "site": "dailyherald.com", "participants_count": 0, "title_full": "Images: St. Charles East falls to St. Charles North, 31-10 in football", "spam_score": 0.0, "site_type": "news", "published": "2015-10-17T05:45:00.000+03:00", "replies_count": 0, "uuid": "b14650c7814034a050dbda1c30c2dfb8ac6a2a95"}, "author": "", "url": "http://football.dailyherald.com/article/20151016/sports/151018982/", "ord_in_thread": 0, "title": "Images: St. Charles East falls to St. Charles North, 31-10 in football", "locations": ["Kane County Chronicle St. Charles East", "St. Charles", "St. Charles North", "St. Charles East", "Kane County Chronicle St. Charles North"], "entities": {"persons": [], "locations": [], "organizations": []}, "highlightText": "", "language": "english", "persons": ["Justin Jett", "Cameron Canales", "Zach Mettetal", "William Duhownik", "Griffin Hammer", "Jake Chantos", "Nicholas Candre", "Aiden Wright", "Eric Lins", "Jake Spaniel", "Peyton Brown", "Charles North", "Karen Naess", "Zach Mitchell"], "text": "Success - Article sent! Click to close Images: St. Charles East falls to St. Charles North, 31-10 in football St. Charles North’s Eric Lins carries the ball as St. Charles East’s Peyton Brown makes the tackle on Friday in St. Charles. Karen Naess For The Kane County Chronicle St. Charles East’s Justin Jett gets sacked by St. Charles North’s Eric Lins on Friday in St. Charles. Karen Naess For The Kane County Chronicle St. Charles East’s Cameron Canales carries the ball as St. Charles North’s Jake Spaniel goes for the stop on Friday in St. Charles. Karen Naess For The Kane County Chronicle St. Charles North’s Zach Mettetal looks for the opening against St. Charles East on Friday in St. Charles. Karen Naess For The Kane County Chronicle St. Charles East’s Nicholas Candre kicks the ball for the extra point as St. Charles North’s Jake Chantos blocks the kick on Friday in St. Charles. Karen Naess For The Kane County Chronicle St. Charles East’s Aiden Wright carries the ball as St. Charles North’s defense goes for the stop on Friday in St. Charles. Karen Naess For The Kane County Chronicle St. Charles North’s Griffin Hammer runs the ball against St. Charles East on Friday in St. Charles. Karen Naess For The Kane County Chronicle St. Charles North’s William Duhownik looks to stopl St. Charles East’s Zach Mitchell from advancing the ball on Friday in St. Charles. Karen Naess For The Kane County Chronicle St. Charles North’s Zach Mettetal runs the ball against St. Charles East on Friday in St. Charles. Karen Naess For The Kane County Chronicle \nSt. Charles East High School hosted and lost 31-10 to rival St. Charles North for football action on Friday, Oct. 16 in St. Charles. Get great articles like this sent to your inbox!", "external_links": [], "published": "2015-10-17T05:45:00.000+03:00", "crawled": "2015-10-17T07:07:00.437+03:00", "highlightTitle": ""}