{"organizations": ["Arizona State Sun Devils", "Colorado Buffaloes", "ASU", "Facebook Colorado", "Sun Devils", "UCLA Bruins", "The Colorado Buffaloes"], "uuid": "3710fcdc1dd1b3a1fa3549a9435e699d4f8d72ea", "thread": {"social": {"gplus": {"shares": 0}, "pinterest": {"shares": 0}, "vk": {"shares": 0}, "linkedin": {"shares": 0}, "facebook": {"likes": 0, "shares": 0, "comments": 0}, "stumbledupon": {"shares": 0}}, "site_full": "www.12news.com", "main_image": "http://www.gannett-cdn.com/-mm-/489efad1142179deef9ce5ef3cf126cd99e1a3f1/r=x633&amp;c=1200x630/http/cdn.tegna-tv.com/-mm-/593148a3e3e415b11ae62396f1176c1ca7133f03/c=0-253-2216-1505/local/-/media/2015/10/08/KPNX/KPNX/635799248007740684-USATSI-8840744.jpg", "site_section": "http://rssfeeds.12news.com/kpnx/sports", "section_title": "KPNX - Sports", "url": "http://www.12news.com/story/sports/college/asu/2015/10/08/colorado-vs-asu-what-to-watch-for/73612764/", "country": "US", "title": "Colorado vs. ASU: What to watch for", "performance_score": 0, "site": "12news.com", "participants_count": 0, "title_full": "Colorado vs. ASU: What to watch for", "spam_score": 0.0, "site_type": "news", "published": "2015-10-09T01:52:00.000+03:00", "replies_count": 0, "uuid": "3710fcdc1dd1b3a1fa3549a9435e699d4f8d72ea"}, "author": "", "url": "http://www.12news.com/story/sports/college/asu/2015/10/08/colorado-vs-asu-what-to-watch-for/73612764/", "ord_in_thread": 0, "title": "Colorado vs. ASU: What to watch for", "locations": ["USA", "CA", "Pasadena", "Colorado"], "entities": {"persons": [], "locations": [], "organizations": []}, "highlightText": "", "language": "english", "persons": ["Tim White", "Robby Baker", "Richard Mackson-USA", "Richard"], "text": "Colorado vs. ASU: What to watch for The Colorado Buffaloes will look to halt the Sun Devils recent momentum this Saturday. Post to Facebook Colorado vs. ASU: What to watch for The Colorado Buffaloes will look to halt the Sun Devils recent momentum this Saturday.   12news.com: http://12ne.ws/1LkMQpX   Join the Conversation To   Colorado vs. ASU: What to watch for Robby Baker , 12 Sports 3:52 p.m. MST October 8, 2015 The Colorado Buffaloes will look to halt the Sun Devils recent momentum this Saturday. Oct 3, 2015; Pasadena, CA, USA; Arizona State Sun Devils wide receiver Tim White (12) celebrates after scoring a touchdown against the UCLA Bruins during the game at Rose Bowl. Mandatory Credit: Richard Mackson-USA TODAY Sports (Photo: Richard Mackson-USA TODAY Sports) \nIt ' s a trap! \nAs Admiral Ackbar said, \" It ' s a trap! \" \nThe Colorado Buffaloes are a sneaky 3-2 team, and were one crazy finish against Hawaii from being 4-1. \nThis is the definition of a trap game. \nMore College Football: College football coaches piling up more cash through bonuses \nSun Devil fans remember a trip to Corvallis last season when ASU was the sixth ranked team in the country, but the Beavers played spoiler and bested the Devils. \nThe good news for ASU is this is a home game, so they should have some extra energy come kick off. \nThese are tough games for college teams though. \nComing off a huge, upset victory, taking on a team you ' re widely expected to beat handily, it could be hard to get up for this game. \nHead coach Todd Graham will have to make sure his team doesn ' t overlook Colorado, as ASU ' s matchup against the upstart Utah Utes is just around the corner. \n' Blackout the Buffs ' \nSaturday will be ASU ' s annual ' blackout ' game. There's been a lot of questions about the uniform this week. here it is! #blackoutbuffs @adidasFballUS @FootballASU pic.twitter.com/nFyl1j7U56", "external_links": [], "published": "2015-10-09T01:52:00.000+03:00", "crawled": "2015-10-09T11:27:04.324+03:00", "highlightTitle": ""}