{"organizations": ["New Hampshire", "AP College Football", "New York Liberty", "NCAA", "U.S. Supreme Court"], "uuid": "25de99063057c1e2642af4eb1bf3e6240b72b4d3", "thread": {"social": {"gplus": {"shares": 0}, "pinterest": {"shares": 0}, "vk": {"shares": 0}, "linkedin": {"shares": 0}, "facebook": {"likes": 0, "shares": 0, "comments": 0}, "stumbledupon": {"shares": 0}}, "site_full": "www.newschannel10.com", "main_image": "http://images.worldnow.com/AP/images/8909888_G.jpg", "site_section": "http://www.newschannel10.com/category/72490/sports?clienttype=rss", "section_title": "KFDA - Sports", "url": "http://www.newschannel10.com/story/30147910/fever-and-lynx-to-meet-in-wnba-finals-in-rematch-of-2012", "country": "US", "title": "Fever and Lynx to meet in WNBA Finals in rematch of 2012", "performance_score": 0, "site": "newschannel10.com", "participants_count": 0, "title_full": "Fever and Lynx to meet in WNBA Finals in rematch of 2012", "spam_score": 0.0, "site_type": "news", "published": "2015-09-30T21:43:00.000+03:00", "replies_count": 0, "uuid": "25de99063057c1e2642af4eb1bf3e6240b72b4d3"}, "author": "", "url": "http://www.newschannel10.com/story/30147910/fever-and-lynx-to-meet-in-wnba-finals-in-rematch-of-2012", "ord_in_thread": 0, "title": "Fever and Lynx to meet in WNBA Finals in rematch of 2012", "locations": ["New Hampshire", "California", "United States", "Oklahoma", "New York", "East Coast", "U.S.", "Appalachia", "Arizona", "Kentucky", "East Coast Steady", "Phoenix"], "entities": {"persons": [], "locations": [], "organizations": []}, "highlightText": "", "language": "english", "persons": ["Mary Fallin", "Hillary Rodham Clinton", "Caitlyn Jenner", "Francis", "RALPH D. RUSSO", "Clinton", "Carson", "Marissa Coleman", "Don Blankenship", "Ben Carson", "Tamika Catchings", "Kim Davis", "pope"], "text": "KFDA Programming Schedule Fever and Lynx to meet in WNBA Finals in rematch of 2012 (AP Photo/Adam Hunger). Indiana Fever forward Tamika Catchings (24) reacts against the New York Liberty during the second half in Game 3 of the WNBA basketball Eastern Conference finals at Madison Square Garden in New York, Tuesday, Sept. 29, 2015. The... (AP Photo/Adam Hunger). Indiana Fever forward Tamika Catchings (24) reacts against the New York Liberty during the second half in Game 3 of the WNBA basketball Eastern Conference finals at Madison Square Garden in New York, Tuesday, Sept. 29, 2015. The... (AP Photo/Adam Hunger). The Indiana Fever pose with the trophy after defeating the New York Liberty in Game 3 of the WNBA basketball Eastern Conference finals at Madison Square Garden in New York, Tuesday, Sept. 29, 2015. The Fever defeated the Liberty... (AP Photo/Adam Hunger). Indiana Fever guard Marissa Coleman (25) celebrates with a teammate during the second half in Game 3 of the WNBA basketball Eastern Conference finals at Madison Square Garden in New York, Tuesday, Sept. 29, 2015. The Fever defea... Vatican observers raise questions over clerk's pope visit A Kentucky clerk who went to jail for defying a federal court's orders to issue same-sex marriage licenses says she met briefly with the pope during his historic visit to the United States and he told her to... The private meeting Pope Francis held with defiant Kentucky clerk Kim Davis is a strong papal endorsement of religious resistance to gay marriage, but it doesn't necessarily mean he approves of how she's waged her... Emails: Russia-linked hackers tried to access Clinton server About 6,000 additional pages of Hillary Rodham Clinton's emails are being published Wednesday. Russia-linked hackers tried at least five times to pry into Hillary Rodham Clinton's private email account while she was secretary of state, emails released Wednesday show. It is unclear if she clicked on any... APNewsBreak: Carson raises $20M for '16 bid in past 3 months Political newcomer Ben Carson raised more than $20 million in the past three months to fuel his bid for the Republican presidential nomination, his campaign said Wednesday, a haul of campaign cash that shatters... Political newcomer Ben Carson raised more than $20 million in the past three months to fuel his bid for the Republican presidential nomination, his campaign said Wednesday, a haul of campaign cash that shatters records and... Prosecutors decline to charge Caitlyn Jenner in fatal crash Prosecutors declined to charge Caitlyn Jenner on Wednesday in a California car crash that led to the death of another driver, saying there was not enough evidence for a conviction. Prosecutors declined to charge Caitlyn Jenner on Wednesday in a California car crash that killed another driver, citing insufficient evidence to support a case. Ex-coal baron readies for trial in deadly mine explosion Ex-Massey Energy CEO Don Blankenship has never shied from a fight and his toughest one is just beginning, as he goes on trial in the worst U.S. mine disaster in 45 years. Don Blankenship ascended from a modest, single-mother upbringing in Appalachia to personally make almost $20 million off coal in one year. He battled unions, spent millions as lead puppeteer behind Republican state... Court strikes down possible payments to college athletes A federal appeals court ruled Wednesday that the NCAA's use of college athletes' names, images and likenesses in video games and TV broadcasts violated antitrust laws but struck down a plan allowing schools... By RALPH D. RUSSO AP College Football Writer A federal appeals court struck down a plan to pay college football and basketball players in a ruling that NCAA leaders believe supports their contention that... Oklahoma delays execution; drug didn't match protocols An Oklahoma death row inmate has asked the U.S. Supreme Court to halt his Wednesday execution after the state's highest criminal court decided not to give him a new hearing, despite delaying his execution two... Oklahoma Gov. Mary Fallin postponed at the last minute Wednesday the execution of an inmate who claims he's innocent, after prison officials said one of the three drugs they had received to carry out the lethal... Police: New Hampshire woman was slaying victim found in 1981 A New Hampshire woman has been identified as the victim in a 34-year-old cold case in Arizona. A slaying victim discovered more than three decades ago in Arizona has been identified as a New Hampshire woman and police are investigating her connection to a man convicted of killing his estranged wife. Hurricane may bring 10 inches of rain to parts of East Coast Steady rain drenched much of the East Coast on Wednesday, flooding roads, closing schools and forcing some people from their homes. And forecasters say the worst is yet to come. Steady rain drenched much of the East Coast on Wednesday, flooding roads, closing schools and forcing some people from their homes. And forecasters say the worst is yet to come. Sheriff starts testimony at his contempt-of-court hearing An Arizona sheriff is scheduled to testify Wednesday about his acknowledged disobedience of court orders in a racial profiling lawsuit as well as an alleged investigation involving the case's judge. The sheriff for metro Phoenix briefly took to the witness stand late Wednesday afternoon at contempt-of-court hearings over his acknowledged disobedience of a judge's orders in a racial profiling case.", "external_links": [], "published": "2015-09-30T21:43:00.000+03:00", "crawled": "2015-10-01T07:53:29.026+03:00", "highlightTitle": ""}