{"organizations": ["Pittsburgh Steelers", "NFL", "Facebook McVea"], "uuid": "cc4f055886749bd0c97a4f3fb3f237308a03498a", "thread": {"social": {"gplus": {"shares": 0}, "pinterest": {"shares": 0}, "vk": {"shares": 0}, "linkedin": {"shares": 0}, "facebook": {"likes": 0, "shares": 0, "comments": 0}, "stumbledupon": {"shares": 0}}, "site_full": "www.kens5.com", "main_image": "http://cdn.tegna-tv.com/-mm-/84123b3216e6b9b887d38c3192b6a913a09b5927/c=0-426-4608-3029&amp;r=x1683&amp;c=3200x1680/local/-/media/2015/10/20/KENS/KENS/635809465001125418-FBH-SAISD-All-Americans-Gary-Green-and-Gabe-Rivera.jpg", "site_section": "http://rssfeeds.kens5.com/_/20/107003250/kens5/highschoolsports", "section_title": "Kens5 - HIgh School Sports", "url": "http://www.kens5.com/story/opinion/contributors/david-flores/2015/10/20/mcvea-rivera-among-seven-picked-saisd-hall-fame/74275748/", "country": "US", "title": "McVea, Rivera among seven picked for SAISD Hall of Fame", "performance_score": 0, "site": "kens5.com", "participants_count": 0, "title_full": "McVea, Rivera among seven picked for SAISD Hall of Fame", "spam_score": 0.0, "site_type": "news", "published": "2015-10-20T21:26:00.000+03:00", "replies_count": 0, "uuid": "cc4f055886749bd0c97a4f3fb3f237308a03498a"}, "author": "", "url": "http://www.kens5.com/story/opinion/contributors/david-flores/2015/10/20/mcvea-rivera-among-seven-picked-saisd-hall-fame/74275748/", "ord_in_thread": 0, "title": "McVea, Rivera among seven picked for SAISD Hall of Fame", "locations": ["Texas"], "entities": {"persons": [], "locations": [], "organizations": []}, "highlightText": "", "language": "english", "persons": ["David Flores", "Dorothy Williams", "William", "Rivera", "McVea", "Sam Houston", "Kathleen Lovejoy", "Gabe Rivera", "Wayne Dickey", "Gary Green", "Herrera"], "text": "McVea, Rivera among seven picked for SAISD Hall of Fame Christi Cano, Wayne Dickey, William \"Nemo\" Herrera, Kathleen Lovejoy and Dorothy Williams round out Class of 2016. Post to Facebook McVea, Rivera among seven picked for SAISD Hall of Fame Christi Cano, Wayne Dickey, William \"Nemo\" Herrera, Kathleen Lovejoy and Dorothy Williams round out Class of 2016.  //on.kens5.com/1LIPmq0   McVea, Rivera among seven picked for SAISD Hall of Fame   1:26 p.m. CDT October 20, 2015 Jefferson graduate Gabe Rivera, right, pictured with Sam Houston alum Gary Green, was an All-America defensive lineman at Texas Tech before being picked in the first round of the NFL draft by the Pittsburgh Steelers in 1983. (Photo: David Flores / Kens5.com) CONNECT TWEET LINKEDIN COMMENT EMAIL MORE \nLegendary Brackenridge running back Warren McVea, who helped lead the Eagles to the 1962 Class 4A state title, and former Texas Tech All-America defensive lineman Gabe Rivera, a 1979 Jefferson graduate, headline the SAISD Athletic Hall of Fame Class of 2016, the district announced Tuesday. \nMcVea went on to star at the University of Houston, where he was the first African American to play for Cougars, and continued his career in the AFL and NFL. \nRivera was the Pittsburgh Steelers’ No. 1 draft pick in 1983 and played in six games before a car accident during his rookie season left him a paraplegic. \nPro golfer Christi Cano (Edison), former Sam Houston boys basketball coach Wayne Dickey legendary Lanier boys basketball William Carson “Nemo” Herrera, longtime SAISD Athletic Department secretary Kathleen Lovejoy and former SAISD assistant athletic director Dorothy “Dottye” Williams round out the seven-person Class of 2016. \nThe group will be inducted at a ceremony on Feb. 13 at the Sunset Station Depot 1. The event is hosted by the San Antonio Independent School District Foundation. \nPlaques of each inductee will be displayed permanently on the Hall of Fame Wall, located on the visitor’s side of Alamo Stadium. \nThe SAISD Athletic Hall of Fame was established last year. Clyde Glosson, Gary Green, R.A. Johnson, Claud Kellam, Paul Martin, Tommy Nobis, Victor Rodriguez and Kyle Rote comprised the charter class. Johnson, Kellam and Rote were inducted posthumously. Read or Share this story: http://on.kens5.com/1LIPmq0 TOP VIDEOS", "external_links": [], "published": "2015-10-20T21:26:00.000+03:00", "crawled": "2015-10-20T21:54:11.862+03:00", "highlightTitle": ""}