{"organizations": ["Redskins", "Morgan St. Pierre", "Sonora Wildcats", "Dunlavy Field", "Luke Fulkerson Bears", "Mountain Springs Golf Club", "Argonaut", "Amador", "Haylie Santos", "Bret Harte Calaveras"], "uuid": "ee45da8bf3a38fe50dc16161fcd946b8e704f564", "thread": {"social": {"gplus": {"shares": 0}, "pinterest": {"shares": 0}, "vk": {"shares": 0}, "linkedin": {"shares": 0}, "facebook": {"likes": 0, "shares": 0, "comments": 0}, "stumbledupon": {"shares": 0}}, "site_full": "www.uniondemocrat.com", "main_image": "", "site_section": "http://feeds.feedburner.com/UnionDemocrat", "section_title": "The Union Democrat, Sonora, CA News, Sports, & Weather", "url": "http://www.uniondemocrat.com/index.php?option=com_content&task=view&id=117649&Itemid=73", "country": "US", "title": "Preps roundup: Sonora volleyball keeps on winning", "performance_score": 0, "site": "uniondemocrat.com", "participants_count": 0, "title_full": "Preps roundup: Sonora volleyball keeps on winning", "spam_score": 0.0, "site_type": "news", "published": "2015-09-30T01:40:00.000+03:00", "replies_count": 0, "uuid": "ee45da8bf3a38fe50dc16161fcd946b8e704f564"}, "author": "", "url": "http://www.uniondemocrat.com/index.php?option=com_content&task=view&id=117649&Itemid=73", "ord_in_thread": 0, "title": "Preps roundup: Sonora volleyball keeps on winning", "locations": ["Summerville", "Sonora", "Thorsted Field", "Sutter Creek", "Ripon"], "entities": {"persons": [], "locations": [], "organizations": []}, "highlightText": "", "language": "english", "persons": ["Kiana Pisula", "Stafford", "Carley Herndon", "Alyssa Carlin", "Christine Lora", "Jackson", "Jordynn Peterson", "Riley Henington", "Paige Houck", "Megan Popovich", "Allie Eveleth", "Julian Craddock", "Gabe Walker", "Carlin", "Garrett", "Sinclair", "Kelsie Evans", "Addison Stafford", "Lora", "Cameron Walker", "Kim Evans", "Jennifer Osterhout", "Braden Anderson", "Amanda Mena", "Riley Patterson", "Valeria Galvez", "Amador", "Bret Harte", "Walker", "Tanner Pemberton", "Ben Richardson", "Grace Fulkerson", "Katie Juarez", "Laney Evans", "Sha", "Pemberton", "Maddie Hammerbeck", "Trey PetersonWood", "Elise Sanzeri", "Claire McDonald", "Sarah Boyer", "Linden", "Claire Caldera", "Summerville", "Grace Hernandez", "Emma Peller", "Dave Reel", "Karen Sinclair", "Caitlin Baker", "Lloyd Longeway"], "text": "Preps roundup: Sonora volleyball keeps on winning Preps roundup: Sonora volleyball keeps on winning By The Union Democrat Sports Department September 29, 2015 10:40 pm The Sonora Wildcats continued its perfect Mother Lode League season with a 3-0 sweep over Linden Tuesday night at Bud Castle Gym. The ’Cats took the three sets 25-11, 25-10, and 25-21. Sonora has yet to lose a set in MLL play. Riley Patterson led Sonora with 12 kills, six aces and nine digs. Kelsie Evans had 10 kills, two aces, once block and one block assist. Makenna Pool finished with six kills, two assists and two aces. Kiana Pisula had a team-high 29 assists and had eight digs. Riley Henington had seven digs while Grace Hernandez had one solo block. “Our first two sets we played well, so in the third set I decided to use a different line-up that put a few people in positions that they typically don’t play,” said Sonora head coach Kim Evans. “It was a good challenge for them to stay focused and to remember where they had to go both offensively and defensively. It took them a little while to figure it out and in the end they finished strong. They are smart players and I like to give them challenges to have them rise to the occasion.” Sonora (16-4, 4-0 MLL) will face Argonaut on Thursday in Jackson. JV The Sonora High JV volleyball team beat Linden in two games, 25-19 and 25-21 to advance to a perfect 4-0 in MLL play. Maddie Hammerbeck had seven aces, while Haylie Santos had nine digs. Sha’nece Garrett had four kills and eight digs. Paige Houck and Caitlin Baker finished with five and three kills respectively. Valeria Galvez led Sonora with 13 assists. Calaveras knocks off Bret Harte Calaveras handed Bret Harte its first MLL loss of the season Monday night, with a clean 3-0 sweep. The Redskins won in three sets 25-19, 26-24 and 25-16 in front of a home crowd inside Mike Flock Gym. Calaveras (6-3, 2-1 MLL) got eight kills From Laney Evans. Tanner Pemberton had seven kills and Alyssa Carlin finished with six. Carlin had 12 digs, only three behind Pemberton and Jordynn Peterson’s 15. Pookie Deckman led the Redskins with 24 assists. Bret Harte got 11 kills and 15 digs from sophomore sensation Katie Juarez. Christine Lora had 11 digs and Addison Stafford finished with 12 digs and a team-high 22 assists. One Tuesday night, Bret Harte got back into the win column with a 3-0 sweep of Argonaut. The Bullfrogs won 25-6, 25-16, and 25-13. Juarez had 10 kills and 17 digs. Lora also had 17 digs to go along with her three aces. Carley Herndon had seven kills and five aces. Stafford had 11 digs and a team-high 29 assists. Elise Sanzeri had two blocks. Calaveras will face Summerville on Thursday evening in Tuolumne,while Bret Harte (15-5, 5-1 MLL) is off until Oct. 6 when it hosts Sonora. Sonora girls’ golf wins 216-216 via card-off Sonora girls’ golf got a 216-216 card-off win over Escalon Tuesday afternoon at Mountain Springs Golf Club. The teams finished with a tie, so a card-off decided the winner. All scores were added up for hole No. 9, and Sonora had a better score and was awarded the win. “That was a little scary,” said Sonora head coach Karen Sinclair. “I added it up ahead of time, so I knew we had it.” Megan Popovich earned medalist honors for shooting 43. Amanda Mena shot a 57 and Morgan St. Pierre and Emma Peller both finished with a 59. First-time golfer Claire McDonald shot a 73 in her first outing. “She did a good job for her first time,” Sinclair said of McDonald. “I think her score was very respectable.” Sonora will face Ripon on the road on Thursday. Sonora soccer loses to Linden 7-1 The Sonora boys’ soccer team fell to Linden 7-1 Tuesday evening at Dunlavy Field. The Sonora goal came off the foot of Cameron Walker, for his first career goal. Walker beat an outside defender, took a shot from the right side of the field, and the ball went under the arms of the diving Linden goalkeeper. “It was just a rough night for us,” said Sonora head coach Lloyd Longeway. “I don’t think we played up to our potential. It was a rough night at the office. We had some moments where we could move the ball. But we just couldn’t get any great opportunities.” Sonora will play on Thursday in Jackson against Argonaut. Summerville defeated Amador in three sets Tuesday night on the road in Sutter Creek. The Bears won 25-19, 25-23 and 25-19. Grace Fulkerson led the Bears with 12 kills and 13 digs, followed by Claire Caldera with seven kills. Julian Craddock had a team-high 22 assists. Sarah Boyer had fives aces, while Allie Eveleth had four and 10 digs. “We did great tonight,” said Bears head coach Jennifer Osterhout. “We played at our level, and kept a lead most of the match. It was awesome to see the teamwork, communication, and solid volleyball on the court tonight.” Summerville will host Calaveras on Thursday in Tuolumne. JV football Bears improve to 5-0 The Summerville Bears JV football team kept its perfect season intact with a 42-6 homecoming win over Amador last Friday night at Thorsted Field. The Bears (5-0, 1-0 MLL) have yet to lose, even with four would-be starters being moved up to the varsity. The Bears are led by quarterback Gabe Walker and running back Luke Fulkerson Bears soccer wins in final minute The Summerville Bears boys’ soccer team defeated Amador with a last-minute goal from Trey PetersonWood. The Bears got two goals from PetersonWood, and also got two goals from Braden Anderson. Ben Richardson scored the other goal for Summerville. The Bears trailed 2-1 at the half, but battled back to tie the game at 4. “It was a crazy game,” said Summerville head coach Dave Reel. “We didn’t have the lead until the very end. It was a tough game and Amador really made us work hard. We didn’t play our best, but we played good enough to win.” Summerville will host Calaveras on Thursday at Thursted field at 7 p.m. Follow UnionDemocrat.com", "external_links": [], "published": "2015-09-30T01:40:00.000+03:00", "crawled": "2015-10-01T07:12:30.497+03:00", "highlightTitle": ""}