{"organizations": ["USAToday.com", "Washingon Redskins", "Duke University", "NFL", "Associated Press", "North Carolina", "Georgia", "Miami Hurricanes", "USA Today", "Washington Redskins"], "uuid": "7510683c98d65ebe614999d57964749900b7a897", "thread": {"social": {"gplus": {"shares": 0}, "pinterest": {"shares": 0}, "vk": {"shares": 0}, "linkedin": {"shares": 0}, "facebook": {"likes": 0, "shares": 0, "comments": 0}, "stumbledupon": {"shares": 0}}, "site_full": "www.wtsp.com", "main_image": "http://www.gannett-cdn.com/-mm-/489efad1142179deef9ce5ef3cf126cd99e1a3f1/r=x633&amp;c=1200x630/http/cdn.tegna-tv.com/-mm-/766f43e9514e4ef4204d39cc8ee892ba1aeed70d/c=0-0-1399-791/local/-/media/2015/10/12/WTSP/WTSP/635802832982341546-USATSI-8825634.jpg", "site_section": "http://rssfeeds.wtsp.com/_/20/109664436/wtsp/sportsnews", "section_title": "WTSP - Sports", "url": "http://www.wtsp.com/story/sports/2015/10/13/people-absolutely-distraught-steve-spurrier-retiring/73860200/", "country": "US", "title": "People are absolutely distraught that Steve Spurrier is retiring", "performance_score": 0, "site": "wtsp.com", "participants_count": 0, "title_full": "People are absolutely distraught that Steve Spurrier is retiring", "spam_score": 0.0, "site_type": "news", "published": "2015-10-13T17:01:00.000+03:00", "replies_count": 0, "uuid": "7510683c98d65ebe614999d57964749900b7a897"}, "author": "", "url": "http://www.wtsp.com/story/sports/2015/10/13/people-absolutely-distraught-steve-spurrier-retiring/73860200/", "ord_in_thread": 0, "title": "People are absolutely distraught that Steve Spurrier is retiring", "locations": ["USA", "South Carolina", "Texas", "USA TODAY Sports South Carolina", "Florida"], "entities": {"persons": [], "locations": [], "organizations": []}, "highlightText": "", "language": "english", "persons": ["Derick E. Hingle", "Jadeveon Clowney", "Gannett Steve Spurrier", "David Manning", "Vince Dooley", "Spurrier", "Craig Bailey", "Nelson Chenault", "Joshua S. Kelly-USA", "JOHN RAOUX", "Phil Coale", "Joshua S. Kelly", "Steve Spurrier", "Jeremy Brevard", "Shanna Lockwood"], "text": "People are absolutely distraught that Steve Spurrier is retiring USA Today, USAToday.com 10:02 a.m. EDT October 13, 2015 Steve Spurrier compiled a record of 228-89-2 as a college football coach. Jeremy Brevard, USA TODAY Sports Steve Spurrier led Florida to the 1996 championship, the Gators' first. JOHN RAOUX, Associated Press Steve Spurrier was 122-27-1 in 12 seasons at Florida. Craig Bailey, Gannett Steve Spurrier gets a Gatorade bath from future No. 1 NFL draft pick Jadeveon Clowney after South Carolina defeatedWisconsin 34-24in the Capital One Bowl onJan 1, 2014. David Manning, USA TODAY Sports Steve Spurrier was South Carolina's winningest coach, at 89-49. Joshua S. Kelly, USA TODAY Sports Steve Spurrier on the sidelines as South Carolina takes on Texas A&M on Aug. 28, 2014. Jeremy Brevard, USA TODAY Sports Steve Spurrier was known as much for his offensive acumen and he was for his way with words. And the media. Shanna Lockwood, USA TODAY Sports In addition to successful runs at Florida and South Carolina, Steve Spurrier won the 1966 Heisman Trophy with the Gators and also coached Duke University and the Washington Redskins. Joshua S. Kelly,USA TODAY Sports South Carolina head coach Steve Spurrier talks to his team during the first half against the Miami Hurricanes in the 2014 Independence Bowl. Nelson Chenault, USA TODAY Sports Steve Spurrier and South Carolina opened the 2015season with a victory against North Carolina. The Gamecocks are 1-4 since. Joshua S. Kelly, Joshua S. Kelly-USA TODAY Sports \"(Steve Spurrier) will go down as one of the great coaches in the game,\" Hall of Fame former Georgia coach Vince Dooley says. Derick E. Hingle, USA TODAY Sports Steve Spurrier was an unsuccessful 12-20 in two years with the NFL's Washingon Redskins. Losing records were very unfamiliar to him and Spurrier observers. But the scrunched-up face and visor toss certainly looked familiar. Phil Coale, AP Like this topic? You may also like these photo galleries: Replay", "external_links": [], "published": "2015-10-13T17:01:00.000+03:00", "crawled": "2015-10-13T17:06:37.116+03:00", "highlightTitle": ""}