{"organizations": ["Baylor The Associated Press", "Baylor Iowa State", "Baylor", "Sports Iowa State Cyclones", "Baylor Bears Ishmael Zamora", "Iowa State Cyclones", "Iowa State", "Baylor Bears", "Nigel Tribune"], "uuid": "0e68f53844ecd64ada7b9348c806180e05680ab6", "thread": {"social": {"gplus": {"shares": 0}, "pinterest": {"shares": 0}, "vk": {"shares": 0}, "linkedin": {"shares": 0}, "facebook": {"likes": 0, "shares": 0, "comments": 0}, "stumbledupon": {"shares": 0}}, "site_full": "www.desmoinesregister.com", "main_image": "http://www.gannett-cdn.com/-mm-/ecebc1a5f73b0c83b56fbfe3d3c1c7be0e6f77ba/c=0-0-2997-1693&amp;r=x633&amp;c=1200x630/local/-/media/2015/10/24/IAGroup/DesMoines/635812966712064612-USATSI-8880414.jpg", "site_section": "http://rssfeeds.desmoinesregister.com/desmoines/sports", "section_title": "Des Moines - Sports", "url": "http://www.desmoinesregister.com/story/sports/college/iowa-state/football/2015/10/24/iowa-state-cyclones-baylor-bears-game-recap/74538780/", "country": "US", "title": "Iowa State can't muster second-half rally at No. 2 Baylor", "performance_score": 0, "site": "desmoinesregister.com", "participants_count": 0, "title_full": "Iowa State can't muster second-half rally at No. 2 Baylor", "spam_score": 0.0, "site_type": "news", "published": "2015-10-24T22:57:00.000+03:00", "replies_count": 0, "uuid": "0e68f53844ecd64ada7b9348c806180e05680ab6"}, "author": "", "url": "http://www.desmoinesregister.com/story/sports/college/iowa-state/football/2015/10/24/iowa-state-cyclones-baylor-bears-game-recap/74538780/", "ord_in_thread": 0, "title": "Iowa State can't muster second-half rally at No. 2 Baylor", "locations": ["Brazos River", "McLane Stadium", "Texas", "Waco"], "entities": {"persons": [], "locations": [], "organizations": []}, "highlightText": "", "language": "english", "persons": ["Joshua Thomas", "K.J. Smith", "Joel Lanning", "Art Briles", "Raymond Carlin/USA", "Corey Coleman", "Sam B. Richardson", "Ray Carlin/USA", "Jarnor Jones", "Seth Russell", "Jason Ledet", "Paul Rhoads", "Jomal Wiltz", "Ray Carlin-USA", "Tony", "Ron", "Willie Harvey", "Ruth"], "text": "Iowa State can't muster second-half rally at No. 2 Baylor The Associated Press 2:57 p.m. CDT October 24, 2015 Baylor Bears Ishmael Zamora (8) forces the fumble on the kick return by Iowa State Cyclones defensive back Jomal Wiltz (17) on during the first quarter at McLane Stadium. Ray Carlin/USA TODAY Sports Baylor Bears wide receiver KD Cannon (9) is tackled by Iowa State Cyclones linebacker Jarnor Jones (12) during the first half at McLane Stadium. Ray Carlin/USA TODAY Sports Baylor Bears quarterback Seth Russell (17) scrambles for positive yards during the first half against the Iowa State Cyclones at McLane Stadium. Raymond Carlin/USA TODAY Sports Baylor Bears wide receiver Corey Coleman (1) is pushed out of bounds by Iowa State Cyclones defensive back Nigel Tribune (34) during the first half at McLane Stadium. Ray Carlin/USA TODAY Sports Baylor Bears wide receiver KD Cannon (9) jumps over Iowa State Cyclones defensive back De'Monte Ruth (6) during the first half at McLane Stadium. Ray Carlin/USA TODAY Sports Iowa State Cyclones running back Joshua Thomas (1) carries the ball during the first half against the Baylor Bears at McLane Stadium. Ray Carlin/USA TODAY Sports Baylor Bears defensive end K.J. Smith (56) tackles Iowa State Cyclones running back Joshua Thomas (1) during the first half at McLane Stadium. Ray Carlin/USA TODAY Sports Baylor Bears running back Shock Linwood (32) carries the ball during the first half against the Iowa State Cyclones at McLane Stadium. Ray Carlin/USA TODAY Sports Iowa State defensive back Jomal Wiltz (17) reaches out but is unable to reach a pass intended for Baylor's KD Cannon during the first half Oct. 24 in Waco, Texas. Tony Gutierrez/AP Iowa State quarterback Joel Lanning (7) hands the ball off to running back Joshua Thomas (1) during the first half against Baylor Oct. 24 in Waco, Texas. Tony Gutierrez/AP Baylor quarterback Seth Russell (17) scrambles out of the pocket as Iowa State linebacker Jarnor Jones (12) pursues during the first half Oct. 24 in Waco, Texas. Tony Gutierrez/AP Iowa State quarterback Sam B. Richardson (12) scrambles out of the pocket during the first half against Baylor Oct. 24 in Waco, Texas. Tony Gutierrez/AP Fans protected against a heavy rain watch as Iowa State and Baylor line up against each other Oct. 24 in Waco, Texas. Tony Gutierrez/AP Iowa State's Joshua Thomas (1) takes the ball across the goal line to score a touchdown against the Baylor Bears Oct. 24 in Waco, Texas. Ron Jenkins/Getty Images Baylor Bears wide receiver Corey Coleman (1) is pushed out of bounds by Iowa State Cyclones defensive back Nigel Tribune (34) Oct. 24 in Waco, Texas. Ray Carlin-USA TODAY Sports Iowa State Cyclones running back Joshua Thomas (1) carries the ball against the Oct. 24 in Waco, Texas. Ray Carlin-USA TODAY Sports Iowa State Cyclones head coach Paul Rhoads has words with field judge Jason Ledet Oct. 24 in Waco, Texas. Ray Carlin-USA TODAY Sports Iowa State Cyclones quarterback Sam B. Richardson passes during the first quarter against the Baylor Bears Oct. 24 in Waco, Texas. Ray Carlin-USA TODAY Sports Iowa State running back Joshua Thomas scores a touchdown on a running play against Baylor in the first half Oct. 24 in Waco, Texas. Tony Gutierrez/AP Iowa State head coach Paul Rhoads instructs his team on the sideline in the first half against Baylor Oct. 24 in Waco, Texas. Tony Gutierrez/AP A nearly empty McLane Stadium is seen minutes before kickoff between Iowa State and Baylor Oct. 24 in Waco, Texas. Tony Gutierrez/AP Baylor Bears head coach Art Briles and Iowa State Cyclones head coach Paul Rhoads talk at midfield prior to a game Oct. 24 in Waco, Texas. Ray Carlin-USA TODAY Sports Baylor Bears quarterback Seth Russell (17) breaks the tackle of Iowa State Cyclones linebacker Willie Harvey (16) during the first quarter Oct. 24 in Waco, Texas. Ray Carlin-USA TODAY Sports The swollen Brazos River runs just behind the playing field before the Iowa State Cyclones take on the Baylor Bears Oct. 24 at McLane Stadium in Waco, Texas. Ron Jenkins/Getty Images Like this topic? You may also like these photo galleries: Replay", "external_links": [], "published": "2015-10-24T22:57:00.000+03:00", "crawled": "2015-10-24T23:31:42.161+03:00", "highlightTitle": ""}