{"organizations": ["Colchester", "Port Vale"], "uuid": "bef807f63c20c8882e97a4f47ad9736dd0d0c809", "thread": {"social": {"gplus": {"shares": 0}, "pinterest": {"shares": 0}, "vk": {"shares": 0}, "linkedin": {"shares": 0}, "facebook": {"likes": 0, "shares": 0, "comments": 0}, "stumbledupon": {"shares": 0}}, "site_full": "www.sport.co.uk", "main_image": "http://images.sport.co.uk/150x150/div2.jpg", "site_section": "http://feeds.feedburner.com/SportcoukNewsRssFeed", "section_title": "General Sports News from Sports.co.uk", "url": "http://www.sport.co.uk/football/colchester-21-port-vale-match-report/6968100/", "country": "JE", "title": "Colchester 2-1 Port Vale: Match Report", "performance_score": 0, "site": "sport.co.uk", "participants_count": 0, "title_full": "Colchester 2-1 Port Vale: Match Report", "spam_score": 0.0, "site_type": "news", "published": "2015-10-21T00:31:00.000+03:00", "replies_count": 0, "uuid": "bef807f63c20c8882e97a4f47ad9736dd0d0c809"}, "author": "", "url": "http://www.sport.co.uk/football/colchester-21-port-vale-match-report/6968100/", "ord_in_thread": 0, "title": "Colchester 2-1 Port Vale: Match Report", "locations": [], "entities": {"persons": [], "locations": [], "organizations": []}, "highlightText": "", "language": "english", "persons": ["Anthony Grant.Vale", "Callum Harriott", "Tom Eastman", "Sordell", "Ryan Lloyd", "Jamie Jones", "George Elokobi", "Jak Alnwick", "Carl Dickinson", "Darren Ambrose", "Olufemi", "Sam Foley", "George Moncur", "Marvin Sordell", "Daniel"], "text": "Colchester 2-1 Port Vale: Match Report 20 Oct 2015 21:31:00 Colchester end winless run against Port ValeColchester ended a run of three straight defeats with a hard-fought 2-1 win over Port Vale.Colin Daniel was foiled by Colchester goalkeeper Jamie Jones in the opening stages while at the other end, Tom Eastman's effort was cleared off the line by Anthony Grant.Vale defender Carl Dickinson's attempted clearance came back off his crossbar before Colchester took a 25th-minute lead through George Elokobi, who finished emphatically after Darren Ambrose's corner had not been cleared.Jones made a superb save to deny Daniel and also foiled Sam Foley, before Port Vale equalised just before half-time when Daniel rose to head home substitute Ryan Lloyd's precise cross.Tosin Olufemi curled a shot just wide for Colchester before the hosts regained their lead with 17 minutes remaining through Marvin Sordell, who finished clinically after George Moncur had progressed in the area.Vale keeper Jak Alnwick denied Sordell a second after he had been sent through on goal by Callum Harriott who hit a post late on, as Colchester edged it. Related Sport News", "external_links": [], "published": "2015-10-21T00:31:00.000+03:00", "crawled": "2015-10-21T20:16:44.667+03:00", "highlightTitle": ""}