{"organizations": ["Merritt Island", "Merritt Island Mustang", "Palm Bay Pirates", "Merritt Island Mustangs", "Fullscreen Buy Photo Palm Bay High", "Palm Bay High", "Chase Harris", "Fullscreen Buy Photo Merritt Island", "Merritt Island High", "Fullscreen Buy Photo Merritt Island Mustangs", "Deben Peterson", "Jared Morris", "Amari Raines", "Merritt Islnd High"], "uuid": "7bd806c90745b70d4a779d4713d5180d0ed05af1", "thread": {"social": {"gplus": {"shares": 0}, "pinterest": {"shares": 0}, "vk": {"shares": 0}, "linkedin": {"shares": 0}, "facebook": {"likes": 0, "shares": 0, "comments": 0}, "stumbledupon": {"shares": 0}}, "site_full": "www.floridatoday.com", "main_image": "http://www.gannett-cdn.com/-mm-/6a2cc5ee0f696afe16e4f1d23db6876cce343a53/c=0-224-3484-2192&amp;r=x1683&amp;c=3200x1680/local/-/media/2015/10/23/Brevard/Brevard/635812355530615750-1-MERRITT-ISLAND-VS-PALM-BAY-FOOTBALL-CR-39836.jpg", "site_section": "http://rssfeeds.floridatoday.com/brevard/sports", "section_title": "Brevard - Sports", "url": "http://www.floridatoday.com/picture-gallery/sports/high-school/football/2015/10/23/photos-space-coast-vs-satellite-beach-prep-football/74504700/", "country": "US", "title": "Photos: Merritt Island vs. Palm Bay prep football", "performance_score": 0, "site": "floridatoday.com", "participants_count": 0, "title_full": "Photos: Merritt Island vs. Palm Bay prep football", "spam_score": 0.0, "site_type": "news", "published": "2015-10-24T05:40:00.000+03:00", "replies_count": 0, "uuid": "7bd806c90745b70d4a779d4713d5180d0ed05af1"}, "author": "", "url": "http://www.floridatoday.com/picture-gallery/sports/high-school/football/2015/10/23/photos-space-coast-vs-satellite-beach-prep-football/74504700/", "ord_in_thread": 0, "title": "Photos: Merritt Island vs. Palm Bay prep football", "locations": ["Merritt Island", "Palm Bay High", "Palm Bay"], "entities": {"persons": [], "locations": [], "organizations": []}, "highlightText": "", "language": "english", "persons": ["Brandon Montanez", "Quentin Ashley", "Jared Morris", "Deben Peterson", "James Batch", "Ozzie Samuel", "Brian Lankford-Johnson", "Craig Rubadoux/FLORIDA"], "text": "Photos: Merritt Island vs. Palm Bay prep football Buy Photo Merritt Island Highs QB #3 James Batch is up ended by Palm Bay High defenders during Friday nights game held at Merritt Island High's Mustang stadium. Craig Rubadoux/FLORIDA TODAY Fullscreen Buy Photo Palm Bay High's #5 Jared Morris dive for extra yards over Merritt Island defenders during Friday nights game held at Merritt Island High's Mustang stadium. Craig Rubadoux/FLORIDA TODAY Fullscreen Buy Photo Merritt Island Mustangs senior cheerleaders fire up the crowd during Friday nights game against Palm Bay High held at Merritt Island High's Mustang stadium. Craig Rubadoux/FLORIDA TODAY Fullscreen Buy Photo Merritt Island Mustangs and the Palm Bay Pirates call the coin flip before Friday nights game held at Merritt Island High's Mustang stadium. Craig Rubadoux/FLORIDA TODAY Fullscreen Buy Photo Merritt Island Mustangs cheerleaders enjoy Friday nights game against Palm Bay High held at Merritt Island High's Mustang stadium. Craig Rubadoux/FLORIDA TODAY Fullscreen Buy Photo Palm Bay players take the field for Friday nights game against Merritt Island during Friday nights game held at Merritt Island High's Mustang stadium. Craig Rubadoux/FLORIDA TODAY Fullscreen Buy Photo Merritt Island Mustangs take the field for Friday nights game against Palm Bay High held at Merritt Island High's Mustang stadium. Craig Rubadoux/FLORIDA TODAY Fullscreen Buy Photo Merritt Island Mustangs take the field for Friday nights game against Palm Bay High held at Merritt Island High's Mustang stadium. Craig Rubadoux/FLORIDA TODAY Fullscreen Buy Photo Merritt Island Mustangs members of the band enjoy Friday nights game against Palm Bay High held at Merritt Island High's Mustang stadium. Craig Rubadoux/FLORIDA TODAY Fullscreen Buy Photo Merritt Island's #1 Deben Peterson picks up some nice yards during Friday nights game against Palm Bay High held at Merritt Island High's Mustang stadium. Craig Rubadoux/FLORIDA TODAY Fullscreen Buy Photo Merritt Island Highs #1 Deben Peterson is tackled by Palm Bay High's #4 Chase Harris during Friday nights game against Palm Bay High held at Merritt Island High's Mustang stadium. Craig Rubadoux/FLORIDA TODAY Fullscreen Buy Photo Merritt Island Mustang fans pack the stands during Friday nights game against Palm Bay High held at Merritt Island High's Mustang stadium. Craig Rubadoux/FLORIDA TODAY Fullscreen Buy Photo Palm Bay High's #14 Brian Lankford-Johnson picks up some nice yards past a host of Merritt Island defenders during Friday nights game held at Merritt Island High's Mustang stadium. Craig Rubadoux/FLORIDA TODAY Fullscreen Buy Photo Palm Bay High's #14 Brian Lankford-Johnson picks up some nice yards past a host of Merritt Island defenders including during Friday nights game held at Merritt Island High's Mustang stadium. Craig Rubadoux/FLORIDA TODAY Fullscreen Buy Photo Palm Bay High's #21 Amari Raines kicks the extra point during Friday nights game held at Merritt Island High's Mustang stadium. Craig Rubadoux/FLORIDA TODAY Fullscreen Buy Photo Palm Bay High's #5 Jared Morris finds some running room past a host of Merritt Island defenders during Friday nights game held at Merritt Island High's Mustang stadium. Craig Rubadoux/FLORIDA TODAY Fullscreen Buy Photo Palm Bay High's #5 Jared Morris finds some running room past a host of Merritt Island defenders during Friday nights game held at Merritt Island High's Mustang stadium. Craig Rubadoux/FLORIDA TODAY Fullscreen Buy Photo Merritt Island Highs #57 Brandon Montanez rips the ball from Palm Bay High's #5 Jared Morris during Friday nights game against Palm Bay High held at Merritt Island High's Mustang stadium. Craig Rubadoux/FLORIDA TODAY Fullscreen Buy Photo Merritt Island Highs #8 Quentin Ashley runs back a fumble for a touchdown during Friday nights game against Palm Bay High held at Merritt Island High's Mustang stadium. Craig Rubadoux/FLORIDA TODAY Fullscreen Buy Photo Merritt Island Mustangs cheerleaders fire up the crowd during Friday nights game against Palm Bay High held at Merritt Island High's Mustang stadium. Craig Rubadoux/FLORIDA TODAY Fullscreen Buy Photo Merritt Island Mustangs cheerleaders fire up the crowd during Friday nights game against Palm Bay High held at Merritt Island High's Mustang stadium. Craig Rubadoux/FLORIDA TODAY Fullscreen Buy Photo Palm Bay High's #14 Brian Lankford-Johnson picks up some nice yards over Merritt Island High's #57 Brandon Montanez during Friday nights game held at Merritt Island High's Mustang stadium. Craig Rubadoux/FLORIDA TODAY Fullscreen Buy Photo Palm Bay High's #14 Brian Lankford-Johnson picks up some nice yards over host of Merritt Island defenders including during Friday nights game held at Merritt Island High's Mustang stadium. Craig Rubadoux/FLORIDA TODAY Fullscreen Buy Photo Palm Bay High's #14 Brian Lankford-Johnson picks up some nice yards past a host of Merritt Island defenders during Friday nights game held at Merritt Island High's Mustang stadium. Craig Rubadoux/FLORIDA TODAY Fullscreen Buy Photo Merritt Island high runner fumbles during Friday nights game against Palm Bay High held at Merritt Island High's Mustang stadium. Craig Rubadoux/FLORIDA TODAY Fullscreen Buy Photo Palm Bay High's #23 Ozzie Samuel runs back a fumble recovery past Merritt Island's #1 Deben Peterson during Friday nights game held at Merritt Island High's Mustang stadium. Craig Rubadoux/FLORIDA TODAY Fullscreen Buy Photo Palm Bay High's #5 Jared Morris dives in for a touchdown past Merritt Islnd High defenders during Friday nights game held at Merritt Island High's Mustang stadium. Craig Rubadoux/FLORIDA TODAY Fullscreen Buy Photo Merritt Island Highs QB #3 James Batch is sacked by Palm Bay High's #23 Ozzie Samuel during Friday nights game held at Merritt Island High's Mustang stadium. Craig Rubadoux/FLORIDA TODAY", "external_links": [], "published": "2015-10-24T05:40:00.000+03:00", "crawled": "2015-10-24T08:46:01.765+03:00", "highlightTitle": ""}