{"organizations": ["AP LSU", "Western Kentucky Hilltoppers", "Sports Western Kentucky Hilltoppers", "NCAA", "LSU", "LSU Tigers", "Jontavious Morris", "Jalen Mills", "Kentucky LSU Tigers", "Les Miles and Western Kentucky Hilltoppers", "Western Kentucky"], "uuid": "421ac12933873107a1ea236c1e2b0a5ce6444523", "thread": {"social": {"gplus": {"shares": 0}, "pinterest": {"shares": 0}, "vk": {"shares": 0}, "linkedin": {"shares": 0}, "facebook": {"likes": 0, "shares": 0, "comments": 0}, "stumbledupon": {"shares": 0}}, "site_full": "www.thenewsstar.com", "main_image": "http://www.gannett-cdn.com/-mm-/3c1d5b60e1e53090dc671d3f11fd9f618647c61b/c=0-126-2475-1524&amp;r=x1683&amp;c=3200x1680/local/-/media/2015/10/25/LAGroup/Shreveport/635813939565905693-LSUWK1.jpg", "site_section": "http://rssfeeds.thenewsstar.com/monroe/sports", "section_title": "Monroe - Sports", "url": "http://www.thenewsstar.com/story/sports/2015/10/22/cam-lewis-wins-hs-hero-vote/74412520/", "country": "US", "title": "LSU-Western Kentucky", "performance_score": 0, "site": "thenewsstar.com", "participants_count": 0, "title_full": "LSU-Western Kentucky", "spam_score": 0.0, "site_type": "news", "published": "2015-10-26T00:57:00.000+02:00", "replies_count": 0, "uuid": "421ac12933873107a1ea236c1e2b0a5ce6444523"}, "author": "", "url": "http://www.thenewsstar.com/story/sports/2015/10/22/cam-lewis-wins-hs-hero-vote/74412520/", "ord_in_thread": 0, "title": "LSU-Western Kentucky", "locations": ["Anthony Wales", "Baton Rouge"], "entities": {"persons": [], "locations": [], "organizations": []}, "highlightText": "", "language": "english", "persons": ["Jonathan Bachman", "Les Miles", "Frank Herron", "Malachi Dupre", "Derick E. Hingle-USA", "Nick Holt", "Branden Leston", "Travin Dural", "Brandon Doughty", "Marcus Ward", "Michael", "Gavin Rocker", "Leonard Fournette", "Derrius Guice", "Jeff Brohm", "Deion Jones", "Greg Gilmore", "Jared Dangerfield", "Tyron Johnson", "Brandon Harris"], "text": "Activate your digital access. LSU-Western Kentucky LSU Tigers running back Leonard Fournette (7) runs against the Western Kentucky Hilltoppers during the first quarter at Tiger Stadium. Derick E. Hingle-USA TODAY Sports LSU Tigers wide receiver Malachi Dupre (15) runs after a catch for a touchdown against the Western Kentucky Hilltoppers during the first quarter at Tiger Stadium. Derick E. Hingle-USA TODAY Sports LSU Tigers linebacker Deion Jones (45) sacks Western Kentucky Hilltoppers quarterback Brandon Doughty (12) during the first quarter at Tiger Stadium. Derick E. Hingle-USA TODAY Sports LSU Tigers running back Leonard Fournette (7) runs as Western Kentucky Hilltoppers defensive lineman Gavin Rocker (88) pursues during the first quarter at Tiger Stadium. Derick E. Hingle-USA TODAY Sports LSU Tigers head coach Les Miles against the Western Kentucky Hilltoppers during the second quarter of a game at Tiger Stadium. Derick E. Hingle-USA TODAY Sports LSU Tigers defensive tackle Greg Gilmore (99) celebrates with defensive tackle Frank Herron (97) after a defensive stop against the Western Kentucky Hilltoppers during the second quarter of a game at Tiger Stadium. Derick E. Hingle-USA TODAY Sports LSU Tigers quarterback Brandon Harris (6) passes as Western Kentucky Hilltoppers defensive lineman Jontavious Morris (3) defends during the second quarter of a game at Tiger Stadium. Derick E. Hingle-USA TODAY Sports Western Kentucky Hilltoppers wide receiver Jared Dangerfield (21) is tackled by LSU Tigers safety Jalen Mills (28) during the second quarter of a game at Tiger Stadium. Derick E. Hingle-USA TODAY Sports LSU Tigers wide receiver Travin Dural (83) runs away from Western Kentucky Hilltoppers defensive back Marcus Ward (8) and defensive back Branden Leston (31) during the second quarter of a game at Tiger Stadium. Derick E. Hingle-USA TODAY Sports LSU Tigers wide receiver Tyron Johnson (3) runs a catch in for a touchdown against the Western Kentucky Hilltoppers during the third quarter of a game at Tiger Stadium. Derick E. Hingle-USA TODAY Sports LSU Tigers defensive tackle Greg Gilmore (99) tackles Western Kentucky Hilltoppers running back Anthony Wales (20) during the third quarter of a game at Tiger Stadium. Derick E. Hingle-USA TODAY Sports LSU Tigers running back Leonard Fournette (7) runs from Western Kentucky Hilltoppers linebacker Nick Holt (10) during the fourth quarter of a game at Tiger Stadium. LSU defeated Western Kentucky 48-21. Derick E. Hingle-USA TODAY Sports LSU Tigers quarterback Brandon Harris (6) and wide receiver Travin Dural (83) celebrate after a touchdown against the Western Kentucky Hilltoppers during the fourth quarter of a game at Tiger Stadium. LSU defeated Western Kentucky 48-21. Derick E. Hingle-USA TODAY Sports LSU Tigers head coach Les Miles against the Western Kentucky Hilltoppers during the fourth quarter of a game at Tiger Stadium. LSU defeated Western Kentucky 48-21. Derick E. Hingle-USA TODAY Sports LSU Tigers running back Derrius Guice (5) runs for a touchdown against the Western Kentucky Hilltoppers during the fourth quarter of a game at Tiger Stadium. LSU defeated Western Kentucky 48-21. Derick E. Hingle-USA TODAY Sports LSU Tigers head coach Les Miles and Western Kentucky Hilltoppers head coach Jeff Brohm meet following a game at Tiger Stadium. LSU defeated Western Kentucky 48-21. Derick E. Hingle-USA TODAY Sports LSU Tigers head coach Les Miles and his players sing following a win against the Western Kentucky Hilltoppers in a game at Tiger Stadium. LSU defeated Western Kentucky 48-21. Derick E. Hingle-USA TODAY Sports In the rain, LSU quarterback Brandon Harris (6) throws the ball during the first half an NCAA college football game against Western Kentucky in Baton Rouge. Jonathan Bachman, AP LSU quarterback Brandon Harris throws a pass against Western Kentucky. Michael Chang/Getty Images LSU Tigers quarterback Brandon Harris (6) leaves the field following a win against the Western Kentucky Hilltoppers in a game at Tiger Stadium. LSU defeated Western Kentucky 48-21. Derick E. Hingle-USA TODAY Sports Like this topic? You may also like these photo galleries: Replay", "external_links": [], "published": "2015-10-26T00:57:00.000+02:00", "crawled": "2015-10-26T12:35:26.309+02:00", "highlightTitle": ""}