{"organizations": ["McDowell Mountain Regional Park", "Daily Courier Prescott High", "Arizona High School Cycling League", "Tucson Buena", "Arizona H.S. Cycling League", "AZ H.S. Cycling League", "Hammes Prescott High"], "uuid": "d36adcfba33b7a7fdff280d03259525955ca5acc", "thread": {"social": {"gplus": {"shares": 0}, "pinterest": {"shares": 0}, "vk": {"shares": 0}, "linkedin": {"shares": 0}, "facebook": {"likes": 0, "shares": 0, "comments": 0}, "stumbledupon": {"shares": 0}}, "site_full": "dcourier.com", "main_image": "http://dcourier.com/SiteImages/Article/150802a.jpg", "site_section": "http://www.dcourier.com/2_rss.xml", "section_title": "The Daily Courier RSS Feeds: Sports", "url": "http://dcourier.com/Main.asp?SectionID=2&SubSectionID=2&ArticleID=150802", "country": "US", "title": "Prescott High mountain bike team runner-up at big AZ H.S. Cycling League race Sunday", "performance_score": 0, "site": "dcourier.com", "participants_count": 0, "title_full": "Prescott High mountain bike team runner-up at big AZ H.S. Cycling League race Sunday", "spam_score": 0.0, "site_type": "news", "published": "2015-10-14T16:01:00.000+03:00", "replies_count": 0, "uuid": "d36adcfba33b7a7fdff280d03259525955ca5acc"}, "author": "", "url": "http://dcourier.com/Main.asp?SectionID=2&SubSectionID=2&ArticleID=150802", "ord_in_thread": 0, "title": "Prescott High mountain bike team runner-up at big AZ H.S. Cycling League race Sunday", "locations": ["Waddell", "Fountain Hills", "Lake Havasu City", "Chino Valley"], "entities": {"persons": [], "locations": [], "organizations": []}, "highlightText": "", "language": "english", "persons": ["Wayne Fernandez", "Drew Shumaker", "Lexi Hammes", "Alexandra Hammes", "Alex Shumaker", "Prescott", "Andrew Mull", "Bradshaw", "Doug Cook", "Fernandez"], "text": "Prescott High mountain bike team runner-up at big AZ H.S. Cycling League race Sunday Courtesy/Mitzi Hammes Prescott High�s mountain biking team placed second overall in the third race of the Arizona High School Cycling League�s 2015 season series on Sunday, Oct. 11, in Fountain Hills. The Badgers were paced in part by three JV girls� riders, from left on the podium, Lexi Hammes, Alex Shumaker and Drew Shumaker. Doug Cook The Daily Courier Prescott High's mountain biking team overcame blistering heat to place second out of 40 squads in the Arizona H.S. Cycling League season series' third race at McDowell Mountain Regional Park Sunday, Oct. 11, in Fountain Hills.Traversing the 5.1-mile course on a 95-degree day, PHS was boosted by its Nos. 2, 3 and 4 junior varsity girls' cyclists, each of whom finished strong, coach Wayne Fernandez said.\"The race was brutal,\" Fernandez added. \"It really took a toll on some of our top riders, but we pulled it out. Our JV girls pushed us.\"Prescott compiled 2,079 points to first-place Cave Creek Cactus Shadows High's 2,107. Prescott JV riders Alex Shumaker (530 points), Drew Shumaker (521) and Alexandra Hammes (512) sparkled.PHS varsity boys' rider Andrew Mull played a huge role, too, however, finishing eighth individually (516 points) to make the difference in the team's runner-up mark, the coach said. Tucson Buena claimed third with 2,074 points, just five fewer points than Prescott.Other local teams that placed included Chino Valley in sixth, Bradshaw in ninth, Canyon View in 24th and Tri-City Prep in 29th.In the 2015 series' overall team rankings, Prescott (6,304 points) is currently ranked second only to leader Buena (6,327).The 2015 season has two more races, including series race No. 4 at the SARA Park Rodeo Grounds Oct. 25 in Lake Havasu City, and Race No. 5 - the state championships at White Tank Regional Park Nov. 8 in Waddell.\"We're within striking distance of the top spot,\" Fernandez said of the state's overall team rankings. \"If we can pull off a varsity win as a team (in one of the final two races), we have a chance (at a state title).\"", "external_links": [], "published": "2015-10-14T16:01:00.000+03:00", "crawled": "2015-10-15T01:08:42.094+03:00", "highlightTitle": ""}