{"organizations": ["NBA", "Chicago Bulls", "Los Angeles Lakers", "Lakers", "Los Angeles Clippers", "MCI Center", "AP", "Khloe Kardashian and Los Angeles Lakers"], "uuid": "7afbb5a0eb491b8013932843a24ca17d92be112f", "thread": {"social": {"gplus": {"shares": 0}, "pinterest": {"shares": 0}, "vk": {"shares": 0}, "linkedin": {"shares": 0}, "facebook": {"likes": 0, "shares": 0, "comments": 0}, "stumbledupon": {"shares": 0}}, "site_full": "www.jsonline.com", "main_image": "http://media.jrn.com/images/f0babd26-14d9-469a-805d-ed706f3a15a8.jpg", "site_section": "http://www.jsonline.com/rss?c=y&path=%2Fsports%2Fnational", "section_title": "JSOnline.com Sports - National Top Stpries", "url": "http://www.jsonline.com/sports/national/ex-nba-star-lamar-odom-is-alert-and-improving-his-aunt-says-mjsurnpublicidaporg42f7f0e1807e427eb50d5.html", "country": "US", "title": "Ex-NBA star Lamar Odom is alert and improving, his aunt says", "performance_score": 0, "site": "jsonline.com", "participants_count": 0, "title_full": "Ex-NBA star Lamar Odom is alert and improving, his aunt says", "spam_score": 0.0, "site_type": "news", "published": "2015-10-19T19:09:00.000+03:00", "replies_count": 0, "uuid": "7afbb5a0eb491b8013932843a24ca17d92be112f"}, "author": "", "url": "http://www.jsonline.com/sports/national/ex-nba-star-lamar-odom-is-alert-and-improving-his-aunt-says-mjsurnpublicidaporg42f7f0e1807e427eb50d5.html", "ord_in_thread": 0, "title": "Ex-NBA star Lamar Odom is alert and improving, his aunt says", "locations": ["Las Vegas", "Washington", "Nevada", "Los Angeles"], "entities": {"persons": [], "locations": [], "organizations": []}, "highlightText": "", "language": "english", "persons": ["Sally Ho", "Odom", "Kobe Bryant", "Khloe Kardashian", "Lamar Odom", "Carlson"], "text": "Ex-NBA star Lamar Odom is alert and improving, his aunt says       FILE - In this Nov. 18, 2008, file photo, Los Angeles Lakers guard Kobe Bryant, right, talks with forward Lamar Odom after Odom fouled out against the Chicago Bulls during the second half of their NBA basketball game in Los Angeles. Odom, who was embraced by teammates and television fans alike for his Everyman approach to fame, was found face-down and alone Tuesday, Oct. 13, 2015, after spending four days at the Love Ranch, a legal Nevada brothel. Kobe Bryant joined Khloe Kardashian and some of Odom's childhood friends at his bedside after a Tuesday night Lakers game in Las Vegas. (AP Photo/Chris Carlson) FILE - In this June 30, 1999, file photo, Lamar Odom smiles after being selected fourth by the Los Angeles Clippers in the first round of the NBA Draft at the MCI Center in Washington. Odom spent most of his 14-year NBA career in Los Angeles with the Lakers and Clippers, becoming a fan favorite before he sought even more fame with the Kardashians. Odom, who was embraced by teammates and television fans alike for his Everyman approach to fame, was found face-down and alone Tuesday, Oct. 13, 2015, after spending four days at the Love Ranch, a legal Nevada brothel. (AP Photo/Khue Bui, File) FILE - In this Sept. 9, 2009 file photo, Khloe Kardashian and Los Angeles Lakers basketball player Lamar Odom pose together at the premiere of the film \"Whiteout\" in Los Angeles. Odom, the former NBA star and reality TV personality embraced by teammates and fans alike for his humble approach to fame, was hospitalized and his estranged wife Khloe Kardashian is by his side, after being found unresponsive in a Nevada brothel where he had been staying for days. (AP Photo/Chris Pizzello, file) By Sally Ho,   Oct. 19, 2015 11:08 a.m.", "external_links": [], "published": "2015-10-19T19:09:00.000+03:00", "crawled": "2015-10-19T20:33:57.109+03:00", "highlightTitle": ""}