{"organizations": ["AP South Carolina Gamecocks", "AP Vanderbilt", "SEC", "Vanderbilt", "AP South Carolina", "Vandy", "Gamecocks"], "uuid": "1cf1ee40e0f54ccb37579e6dd121c7c9fbbe9d26", "thread": {"social": {"gplus": {"shares": 0}, "pinterest": {"shares": 0}, "vk": {"shares": 0}, "linkedin": {"shares": 0}, "facebook": {"likes": 0, "shares": 0, "comments": 0}, "stumbledupon": {"shares": 0}}, "site_full": "www.tennessean.com", "main_image": "http://www.gannett-cdn.com/-mm-/fb0da5dd04ab4eaad5ae314168026246416ddf86/c=0-214-4203-2589&amp;r=x1683&amp;c=3200x1680/local/-/media/2015/10/17/Nashville/Nashville/635807115826501461-USATSI-8866994.jpg", "site_section": "http://rssfeeds.tennessean.com/nashville/sports", "section_title": "Nashville - Sports", "url": "http://www.tennessean.com/story/sports/columnist/dave-ammenheuser/2015/10/17/vandys-chance-give-mason-first-sec-win-slips-away/73879012/", "country": "US", "title": "Vandy's chance to give Mason first SEC win slips away", "performance_score": 0, "site": "tennessean.com", "participants_count": 0, "title_full": "Vandy's chance to give Mason first SEC win slips away", "spam_score": 0.0, "site_type": "news", "published": "2015-10-18T05:51:00.000+03:00", "replies_count": 0, "uuid": "1cf1ee40e0f54ccb37579e6dd121c7c9fbbe9d26"}, "author": "", "url": "http://www.tennessean.com/story/sports/columnist/dave-ammenheuser/2015/10/17/vandys-chance-give-mason-first-sec-win-slips-away/73879012/", "ord_in_thread": 0, "title": "Vandy's chance to give Mason first SEC win slips away", "locations": ["South Carolina", "Vanderbilt", "AP South Carolina"], "entities": {"persons": [], "locations": [], "organizations": []}, "highlightText": "", "language": "english", "persons": ["Marquavius Lewis", "Jake Bernstein", "Chris Lammons", "David Williams", "Bryson Allen-Williams", "Derek Mason", "Trey Ellis", "Shawn Elliott", "David Ammenheuser", "Jim Dedmon-USA", "Taylor Stallworth", "Skai Moore", "Richard Shiro", "Tre Herndon", "Johnny McCrary", "T.J. Gurley", "Darrius Sims", "Jim Dedmon", "Perry Orth", "D.J. Neal", "Mason", "Terry Googer", "Ryan White", "Trent Sherfield", "Holloman", "Al Harris Jr.", "Jay Woods", "T.J. Holloman", "Caleb Scott", "Nathan Marcus"], "text": "Vandy's chance to give Mason first SEC win slips away David Ammenheuser , dammenheus@tennessean.com 9:51 p.m. CDT October 17, 2015 South Carolina interim head coach Shawn Elliott is doused after the Gamecocks beat Vanderbilt 19-10 on Oct. 17, 2015. Richard Shiro, AP Vanderbilt center Jake Bernstein (53) tries to stop South Carolina linebacker Skai Moore (10) after his interception return during the second half. Jim Dedmon-USA TODAY Sports South Carolina wide receiver D.J. Neal (3) is brought down by Vanderbilt cornerback Torren McGaster (5) on Oct. 17, 2015. Jim Dedmon-USA TODAY Sports Vanderbilt wide receiver Trent Sherfield (10) loses the ball as South Carolina cornerback Al Harris Jr. (7) breaks up the pass during the second half on Oct. 17, 2015. Jim Dedmon-USA TODAY Sports South Carolina linebacker Bryson Allen-Williams (4) intercepts a pass and is tackled by Vanderbilt receiver Darrius Sims (6) during the second half on Oct. 17, 2015. Jim Dedmon-USA TODAY Sports South Carolina's Terry Googer is tackled by Vanderbilt's Tre Herndon after making a catch for a first down during the second half on Oct. 17, 2015. Richard Shiro, AP South Carolina's D.J. Neal, right, has a pass in the end zone broken up by Vanderbilt's Ryan White during the second half on Oct. 17, 2015. Richard Shiro, AP South Carolina's Chris Lammons (3) intercepts a pass intended for Vanderbilt's Trey Ellis during the second half on Oct. 17, 2015. Richard Shiro, AP Vanderbilt's Caleb Scott pulls in a reception for a touchdown during the second quarter against South Carolina on Oct. 17, 2015. Richard Shiro, AP South Carolina interim coach Shawn Elliott cheers during the second quarter against Vanderbilt on Oct. 17, 2015. Jim Dedmon-USA TODAY Sports South Carolina running back David Williams (33) goes around the end during the second quarter on Oct. 17, 2015. Jim Dedmon-USA TODAY Sports South Carolina linebacker T.J. Holloman (11) hits Vanderbilt tight end Nathan Marcus (83) during the second quarter on Oct. 17, 2015. Holloman was ejected for targeting. Jim Dedmon, Jim Dedmon-USA TODAY Sports Vanderbilt quarterback Johnny McCrary (2) runs out of the pocket chased by South Carolina defensive end Boosie Whitlow (49) during the second quarter on Oct. 17, 2015. Jim Dedmon-USA TODAY Sports Vanderbilt tight end Nathan Marcus (83) makes a catch just as South Carolina linebacker Skai Moore (10) comes in for the stop during the second quarter on Oct. 17, 2015. Jim Dedmon-USA TODAY Sports South Carolina defensive end Marquavius Lewis (8) pressures Vanderbilt quarterback Johnny McCrary (2) during the second quarter on Oct. 17, 2015. Jim Dedmon-USA TODAY Sports South Carolina safety T.J. Gurley (20) chases down Vanderbilt wide receiver Trent Sherfield (10) on Oct. 17, 2015. Jim Dedmon-USA TODAY Sports Vanderbilt quarterback Johnny McCrary is sacked by South Carolina's Taylor Stallworth (90) and Skai Moore during the first half on Oct. 17, 2015. Richard Shiro, AP South Carolina's T.J. Holloman (11) recovers a fumble during the first half against Vanderbilt on Oct. 17, 2015. Richard Shiro, AP Vanderbilt defensive tackle Jay Woods (74) reaches for South Carolina running back Brandon Wilds (22) on Oct. 17, 2015. Jim Dedmon-USA TODAY Sports Vanderbilt quarterback Johnny McCrary (2) makes a throw during the first quarter at South Carolina on Oct. 17, 2015. Jim Dedmon-USA TODAY Sports A Vanderbilt cheerleader performs during the first half on Oct. 17, 2015. Richard Shiro, AP Vanderbilt wide receiver Darrius Sims (6) runs the ball during the first quarter at South Carolina on Oct. 17, 2015. Jim Dedmon-USA TODAY Sports South Carolina quarterback Perry Orth (10) throws during the first quarter against Vanderbilt on Oct. 17, 2015. Jim Dedmon-USA TODAY Sports South Carolina interim head coach Shawn Elliott gets his team fired up before the game with Vanderbilt on Oct. 17, 2015. Richard Shiro, AP South Carolina Gamecocks interim head coach Shawn Elliott before the game against Vanderbilt on Oct. 17, 2015. Jim Dedmon-USA TODAY Sports South Carolina interim head coach Shawn Elliott, left, talks with Vanderbilt coach Derek Mason before the start of the game on Oct. 17, 2015. Richard Shiro, AP Vanderbilt fans cheer their team as the buses pass by before the game with South Carolina on Oct. 17, 2015. Jim Dedmon-USA TODAY Sports South Carolina interim head coach Shawn Elliott high fives fans during the Gamecock Walk before the game with Vanderbilt on Oct. 17, 2015. Jim Dedmon-USA TODAY Sports South Carolina interim head coach Shawn Elliott high fives fans during the Gamecock Walk before the game with Vanderbilt on Oct. 17, 2015. Jim Dedmon-USA TODAY Sports Like this topic? You may also like these photo galleries: Replay", "external_links": [], "published": "2015-10-18T05:51:00.000+03:00", "crawled": "2015-10-18T09:41:59.269+03:00", "highlightTitle": ""}