{"organizations": ["Cubs", "Slumping Cubs", "Toronto Blue Jays", "Royals", "Blue Jays", "Chicago Cubs", "Mets", "New York Mets", "Kansas Royals", "Toronto", "Kansas City Royals"], "uuid": "333c22b275505e1e7a017f318815519b25833a2f", "thread": {"social": {"gplus": {"shares": 0}, "pinterest": {"shares": 0}, "vk": {"shares": 0}, "linkedin": {"shares": 0}, "facebook": {"likes": 0, "shares": 0, "comments": 0}, "stumbledupon": {"shares": 0}}, "site_full": "www.fox8live.com", "main_image": "http://APMOBILE.images.worldnow.com/images/9062269_G.jpg", "site_section": "http://www.fox8live.com/category/230839/sports?clienttype=rss", "section_title": "FOX 8 News WVUE-TV - Sports", "url": "http://www.fox8live.com/story/30311269/mets-2b-murphy-homers-in-5th-straight-postseason-game", "country": "US", "title": "Mets 2B Murphy homers in 5th straight postseason game", "performance_score": 0, "site": "fox8live.com", "participants_count": 0, "title_full": "Mets 2B Murphy homers in 5th straight postseason game", "spam_score": 0.0, "site_type": "news", "published": "2015-10-21T18:37:00.000+03:00", "replies_count": 0, "uuid": "333c22b275505e1e7a017f318815519b25833a2f"}, "author": "", "url": "http://www.fox8live.com/story/30311269/mets-2b-murphy-homers-in-5th-straight-postseason-game", "ord_in_thread": 0, "title": "Mets 2B Murphy homers in 5th straight postseason game", "locations": ["Chicago", "Wrigley Field", "Toronto"], "entities": {"persons": [], "locations": [], "organizations": []}, "highlightText": "", "language": "english", "persons": ["Steve Bartman Steve Bartman", "Alcides Escobar", "Josh Donaldson", "Troy Tulowitzki", "Ben Zobrist", "Steve Bartman", "Lorenzo Cain", "Daniel Murphy", "O'Leary", "Murphy", "Johnny Cueto", "Jacob deGrom", "Edinson Volquez", "Will Byington"], "text": "Mets 2B Murphy homers in 5th straight postseason game Mets second baseman Daniel Murphy has homered for the fifth consecutive postseason game, matching the major league record. more>> Mets second baseman Daniel Murphy has homered for the fifth consecutive postseason game, matching the major league record. more>> Royals' Cueto accuses Blue Jays of stealing signs in Game 3 Kansas Royals pitcher Edinson Volquez says teammate Johnny Cueto believes the Toronto Blue Jays were stealing signs in their Game 3 victory Monday night in the American League Championship Series. more>> Kansas Royals pitcher Edinson Volquez says teammate Johnny Cueto believes the Toronto Blue Jays were stealing signs in their Game 3 victory Monday night in the American League Championship Series. more>> Playoffs return to Wrigley Field, no sign of Steve Bartman Steve Bartman is the most infamous Chicago Cubs fan the city has ever known, blamed by many for destroying dreams the same way Mrs. O'Leary's cow is blamed for destroying the city more than a century earlier. more>> Steve Bartman is the most infamous Chicago Cubs fan the city has ever known, blamed by many for destroying dreams the same way Mrs. O'Leary's cow is blamed for destroying the city more than a century earlier. more>> Updated: Wednesday, October 21 2015 10:24 AM EDT 2015-10-21 14:24:58 GMT Daniel Murphy homered for a record-tying fifth straight game in the postseason, sending Jacob deGrom and the New York Mets over the Chicago Cubs 5-2 on Tuesday night for a 3-0 lead in the National League Championship Series. more>> Daniel Murphy is a contact hitter known for shaky fielding and occasionally getting lost on the bases. more>> Updated: Wednesday, October 21 2015 10:24 AM EDT 2015-10-21 14:24:46 GMT Whether it's a long ball by Ben Zobrist, a slashing single from Lorenzo Cain or another exhilarating trip around the bases for Alcides Escobar, these Kansas City Royals are relentless. more>> Whether it's a long ball by Ben Zobrist, a slashing single from Lorenzo Cain or another exhilarating trip around the bases for Alcides Escobar, these Kansas City Royals are relentless - and one win from a return trip... more>> The Latest: Mets, Royals 1 game away from World Series By The Associated Press The latest on the League Championship Series. The Royals and Blue Jays are set for Game 4 of the ALCS in Toronto, first pitch is 4:07 p.m. The Mets and Cubs play Game 3 of... more>> By The Associated Press The latest on the League Championship Series. The Royals routed Toronto 14-2 to take a 3-1 lead in the ALCS. The Mets and Cubs play Game 3 of the NLCS in Chicago with a scheduled... more>> Slumping Cubs lose 5-2 to Mets, trail 3-0 in NLCS The tiebreaking run scored on a wild pitch on a strikeout. The rookie left fielder had an RBI single go off his glove. more>> The tiebreaking run scored on a wild pitch on a strikeout. The rookie left fielder had an RBI single go off his glove. more>> Back home, Blue Jays break out to beat Royals 11-8 in Game 3 Troy Tulowitzki and Josh Donaldson each homered in a six-run third inning, and Toronto's bats broke out at home for an 11-8 victory over the Kansas City Royals on Monday night that trimmed the Blue Jays'... more>> Back in the homer dome with their rowdy fans, Troy Tulowitzki, Josh Donaldson and the Toronto Blue Jays quickly got into the swing of the AL Championship Series. more>> With Cubs advancing, spotlight shines on Wrigley Will Byington sat at the counter in the Starbucks across Addison Street from Wrigley Field editing pictures on a laptop. more>> Will Byington sat at the counter in the Starbucks across Addison Street from Wrigley Field editing pictures on a laptop. more>>", "external_links": [], "published": "2015-10-21T18:37:00.000+03:00", "crawled": "2015-10-21T18:45:01.838+03:00", "highlightTitle": ""}