{"organizations": ["AP LSU Tigers", "LSU-South Carolina LSU", "AP LSU", "South Carolina", "LSU", "NCAA", "South Carolina Gamecocks", "AP South Carolina"], "uuid": "7d82a824f787607b6b26abf22e2db5734e3f1199", "thread": {"social": {"gplus": {"shares": 0}, "pinterest": {"shares": 0}, "vk": {"shares": 0}, "linkedin": {"shares": 0}, "facebook": {"likes": 0, "shares": 0, "comments": 0}, "stumbledupon": {"shares": 0}}, "site_full": "www.thenewsstar.com", "main_image": "http://www.gannett-cdn.com/-mm-/eef105ce71c301d2d7f23182f74aea06f457fd90/c=0-3-512-292&amp;r=x1683&amp;c=3200x1680/local/-/media/2015/10/11/LAGroup/Shreveport/635801808879167398-LSUSC1.jpg", "site_section": "http://rssfeeds.thenewsstar.com/monroe/sports", "section_title": "Monroe - Sports", "url": "http://www.thenewsstar.com/videos/sports/college/louisiana-tech/2015/10/11/73792360/", "country": "US", "title": "LSU-South Carolina", "performance_score": 0, "site": "thenewsstar.com", "participants_count": 0, "title_full": "LSU-South Carolina", "spam_score": 0.0, "site_type": "news", "published": "2015-10-12T00:41:00.000+03:00", "replies_count": 0, "uuid": "7d82a824f787607b6b26abf22e2db5734e3f1199"}, "author": "", "url": "http://www.thenewsstar.com/videos/sports/college/louisiana-tech/2015/10/11/73792360/", "ord_in_thread": 0, "title": "LSU-South Carolina", "locations": ["S.C.", "South Carolina", "Columbia", "Baton Rouge"], "entities": {"persons": [], "locations": [], "organizations": []}, "highlightText": "", "language": "english", "persons": ["Derick E. Hingle", "Jonathan Bachman", "D.J. Smith", "Chris Lammons", "Malachi Dupre", "Derick E. Hingle-USA", "Travin Dural", "Dwayne Thomas", "Gerald Dixon Jr.", "Darrel Williams", "Skai Moore", "Jamal Adams", "Pharoh Cooper", "Leonard Fournette", "Derrius Guice", "John David Moore", "T.J. Holloman", "Jordan Diggs", "Steve Spurrier", "Isaiah Johnson", "Brandon Harris"], "text": "Activate your digital access. LSU-South Carolina LSU running back Leonard Fournette (7) runs against South Carolina safety D.J. Smith (24) during the first half of an NCAA college football game in Baton Rouge. Jonathan Bachman, AP LSU fullback John David Moore, top, is tackled by South Carolina cornerback Chris Lammons during the first half of an NCAA college football game in Baton Rouge. Jonathan Bachman, AP LSU Tigers fans hold up a sign in support of South Carolina Gamecocks during pregame of a game at Tiger Stadium. Derick E. Hingle-USA TODAY Sports LSU quarterback Brandon Harris (6) throws the ball past South Carolina defensive tackle Gerald Dixon Jr. (92) during the first half of an NCAA college football game in Baton Rouge. Jonathan Bachman, AP LSU wide receiver Malachi Dupre (15) runs past South Carolina safety Isaiah Johnson (21) after a catch during the second half of an NCAA college football game in Baton Rouge. Jonathan Bachman, AP LSU running back Darrel Williams (34) scores a touchdown during the second half of an NCAA college football game against South Carolina in Baton Rouge. Jonathan Bachman, AP LSU running back Darrel Williams (34) celebrates his touchdown during the second half of an NCAA college football game against South Carolina in Baton Rouge. Jonathan Bachman, AP South Carolina linebacker T.J. Holloman (11) attempts to tackle LSU running back Leonard Fournette (7) during the first half of an NCAA college football game in Baton Rouge. Jonathan Bachman, AP LSU huddles up before an NCAA college football game against South Carolina in Baton Rouge. Jonathan Bachman, AP South Carolina wide receiver Pharoh Cooper (11) is tackled by LSU defensive back Dwayne Thomas (13) and safety Jamal Adams (33) during the first half of an NCAA college football game in Baton Rouge. Jonathan Bachman, AP LSU Tigers running back Derrius Guice (5) breaks a tackle against the South Carolina Gamecocks during the fourth quarter of a game at Tiger Stadium. LSU defeated South Carolina 45-24. Derick E. Hingle, Derick E. Hingle-USA TODAY Sports LSU running back Leonard Fournette (7) stiff arms South Carolina linebacker Skai Moore (10) during the first half of an NCAA college football game in Baton Rouge. Jonathan Bachman, AP Fans hold a signs in support of South Carolina during the first half of an NCAA college football game between LSU and South Carolina in Baton Rouge. Jonathan Bachman, AP LSU running back Derrius Guice (5) scores a touchdown during the second half of an NCAA college football game against South Carolina in Baton Rouge. Jonathan Bachman, AP South Carolina head coach Steve Spurrier reacts during the second half of an NCAA college football game against LSU in Baton Rouge. Jonathan Bachman, AP A general view of Tiger Stadium during the second half of an NCAA college football game between LSU and South Carolina in Baton Rouge. LSU won 45-24. The game was moved from Columbia, S.C. to Baton Rouge because of flooding. Jonathan Bachman, AP LSU running back Leonard Fournette reacts on the bench during the second half of an NCAA college football game against South Carolina in Baton Rouge. Jonathan Bachman, AP An LSU cheerleader is seen before an NCAA college football game in Baton Rouge. Jonathan Bachman, AP LSU quarterback Brandon Harris (6) reacts on the bench during the second half of an NCAA college football game against South Carolina in Baton Rouge. Jonathan Bachman, AP LSU wide receiver Travin Dural (83) catches the ball as South Carolina safety Jordan Diggs (42) defends during the first half of an NCAA college football game in Baton Rouge. Jonathan Bachman, AP Like this topic? You may also like these photo galleries: Replay", "external_links": [], "published": "2015-10-12T00:41:00.000+03:00", "crawled": "2015-10-12T06:13:00.549+03:00", "highlightTitle": ""}