{"organizations": ["Texas Rangers", "Yankees", "GOP", "Toronto Blue Jays", "Baltimore Orioles", "Boston Red Sox", "New York Yankees", "AP", "MLB", "Houston Astros"], "uuid": "69fe421f3f0def0ae5525143c2d1cf187d9063be", "thread": {"social": {"gplus": {"shares": 0}, "pinterest": {"shares": 0}, "vk": {"shares": 0}, "linkedin": {"shares": 0}, "facebook": {"likes": 0, "shares": 0, "comments": 0}, "stumbledupon": {"shares": 0}}, "site_full": "www.wandtv.com", "main_image": "http://images.worldnow.com/AP/images/8927618_G.jpg", "site_section": "http://www.wandtv.com/Global/category.asp?C=13566&clienttype=rss", "section_title": "WAND - National Sports - Headline", "url": "http://www.wandtv.com/story/30169659/hurricane-joaquin-could-cause-havoc-with-mlb-playoff-picture", "country": "US", "title": "Hurricane Joaquin could cause havoc with MLB playoff picture", "performance_score": 0, "site": "wandtv.com", "participants_count": 0, "title_full": "Hurricane Joaquin could cause havoc with MLB playoff picture", "spam_score": 0.0, "site_type": "news", "published": "2015-10-02T20:23:00.000+03:00", "replies_count": 0, "uuid": "69fe421f3f0def0ae5525143c2d1cf187d9063be"}, "author": "", "url": "http://www.wandtv.com/story/30169659/hurricane-joaquin-could-cause-havoc-with-mlb-playoff-picture", "ord_in_thread": 0, "title": "Hurricane Joaquin could cause havoc with MLB playoff picture", "locations": ["Oregon", "North America", "Baltimore", "Oklahoma", "America", "US", "U.S.", "Houston", "Syria", "Europe", "Utah"], "entities": {"persons": [], "locations": [], "organizations": []}, "highlightText": "", "language": "english", "persons": ["Alex Rodriguez", "Carson", "Zane Gray", "Dallas Keuchel", "Willens", "Ben Carson", "Carlos Beltran"], "text": "Press Releases Hurricane Joaquin could cause havoc with MLB playoff picture (AP Photo/Patrick Semansky). A handful of fans sit in the stands as rain falls during the first inning of a baseball game between the Baltimore Orioles and the Toronto Blue Jays, Thursday, Oct. 1, 2015, in Baltimore. (AP Photo/Kathy Willens). New York Yankees designated hitter Alex Rodriguez, left, pours champagne on New York Yankees Carlos Beltran after the Yankees clinched a wild card berth in the playoffs after defeating the Boston Red Sox 4-1 in a baseball game... (AP Photo/Pat Sullivan). Houston Astros' Dallas Keuchel delivers a pitch against the Texas Rangers in the first inning of a baseball game, Sunday, Sept. 27, 2015, in Houston. 1 month in prison for companion of ex-treasure hunter The long-time female companion of an ex-fugitive deep-sea treasure hunter faces three years on probation but not prison time at her sentencing. More >> The long-time female companion of an ex-fugitive deep-sea treasure hunter has been sentenced to a month behind bars. More >> Fire   Fire officials say a gas leak caused an explosion in the boiler room of a penthouse at a Miami-area high-rise,   people. More >> Scholars predicting historical Mormon leadership decision The Mormon church could name as many as three new high-ranking leaders at a Utah conference this weekend, and scholars predict that for the first time ever, at least one could be from outside North America and Europe. More >> The Mormon church could name as many as three new high-ranking leaders at a Utah conference this weekend, and scholars predict that for the first time ever, at least one could be from outside North America and Europe. More >> 'We began to run': Students describe horror of shooting Armed with multiple guns, a 26-year-old man walked into a morning writing class at the community college in this rural Oregon town and opened fire, hitting some students with multiple gunshots. A witness said a... More >> Armed with multiple guns, a 26-year-old man walked into a morning writing class   this rural Oregon town and opened fire, hitting some students with multiple gunshots. One witness said the attacker... More >> Sheriff maintains support for gun rights after mass shooting Hunting deer, elk and bear in the surrounding hills and fishing for salmon and steelhead have strong followings in southern Oregon's timber country, made famous by Western writer Zane Gray, who counted the... More >> This small town in southern Oregon's timber country strongly supports gun rights, and that hasn't changed for the county's top law enforcement officer since a gunman killed nine people at a local community... More >> GOP's Carson says 'no' to Syrian refugees inside US Republican presidential candidate Ben Carson said the U.S. should bar refugees from war-torn Syria because they are \"infiltrated with Jihadists,\" who seek to harm America. More >> Republican presidential candidate Ben Carson said the U.S. should bar refugees from war-torn Syria because they are \"infiltrated with Jihadists,\" who seek to harm America. More >> Oklahoma court stops 3 pending executions after drug glitch Oklahoma's highest criminal court unanimously agreed Friday to halt all of the state's scheduled executions after the state's prison system received the wrong drug for a lethal injection this week. More >> Oklahoma's highest criminal court unanimously agreed Friday to halt all of the state's scheduled executions after the state's prison system received the wrong drug for a lethal injection this week. More >>", "external_links": [], "published": "2015-10-02T20:23:00.000+03:00", "crawled": "2015-10-02T21:23:26.564+03:00", "highlightTitle": ""}