{"organizations": ["TPC Sawgrass", "Chez Reavie", "AP"], "uuid": "e9b4e562378723fe128d968dc9f49308765d8e74", "thread": {"social": {"gplus": {"shares": 0}, "pinterest": {"shares": 0}, "vk": {"shares": 0}, "linkedin": {"shares": 0}, "facebook": {"likes": 0, "shares": 0, "comments": 0}, "stumbledupon": {"shares": 0}}, "site_full": "www.beaumontenterprise.com", "main_image": "http://www.beaumontenterprise.com/img/pages/article/opengraph_default.jpg", "site_section": "http://www.beaumontenterprise.com/sports/golf/collectionRss/Sports-Golf-Heds-7413.php", "section_title": "Sports Golf Heds", "url": "http://www.beaumontenterprise.com/sports/article/Argentina-s-Emiliano-Grillo-wins-Web-com-Tour-6549935.php", "country": "US", "title": "Argentina's Emiliano Grillo wins Web.com Tour Finals finale", "performance_score": 0, "site": "beaumontenterprise.com", "participants_count": 0, "title_full": "Argentina's Emiliano Grillo wins Web.com Tour Finals finale", "spam_score": 0.0, "site_type": "news", "published": "2015-10-05T03:11:00.000+03:00", "replies_count": 0, "uuid": "e9b4e562378723fe128d968dc9f49308765d8e74"}, "author": "", "url": "http://www.beaumontenterprise.com/sports/article/Argentina-s-Emiliano-Grillo-wins-Web-com-Tour-6549935.php", "ord_in_thread": 0, "title": "Argentina's Emiliano Grillo wins Web.com Tour Finals finale", "locations": ["Fla.", "Southeast Texas", "Argentina", "Australia", "PONTE VEDRA BEACH"], "entities": {"persons": [], "locations": [], "organizations": []}, "highlightText": "", "language": "english", "persons": ["Derek Fathauer", "Arnold Palmer", "Sam Saunders", "Rhein Gibson", "Van Aswegen", "Emiliano Grillo", "Axley", "Lucas Glover", "Brett Stegmaier", "Kyle Stanley", "Robert Garrigus", "Reavie", "Michael Thompson", "Luke List", "Henrik Norlander", "Rob Oppenheim", "Aiken", "Anirban Lahiri", "Mark Hubbard", "Patton Kizzire", "Eric Axley", "Oppenheim", "Grillo", "Roberto Castro", "Hiroshi Iwata", "Tyrone Van Aswegen", "Andrew Loupe", "Ricky Barnes", "Tim Wilkinson Derek Ernst", "Brian Davis", "Thomas Aiken", "Tom Hoge"], "text": "Argentina's Emiliano Grillo wins Web.com Tour Finals finale Updated 7:14 pm, Sunday, October 4, 2015 PONTE VEDRA BEACH, Fla. (AP) â€” Argentina's Emiliano Grillo made a 25-foot birdie putt on the final hole Sunday to win the Web.com Tour Finals-ending Web.Com Tour Championship. The 23-year-old Grillo beat Chez Reavie by a stroke in the last of the four events that replaced PGA Tour qualifying school, finishing with a 1-under 69 for a 14-under 266 total on TPC Sawgrass' Dye's Valley Course. Reavie had a chance to force a playoff, but missed a 15-foot birdie putt. He shot a 68. The series featured the top 75 players from the Web.com Tour money list, Nos. 126-200 in the PGA Tour's FedEx Cup standings and non-members such as Grillo who earned enough money to have placed in the top 200 had they been eligible. The top 25 players on the Web.com Tour regular-season money list earned PGA Tour cards. They were competing against each other for tour priority, with regular-season earnings counting in their totals. The other players were competing for 25 cards based on series earnings. Grillo earned $180,000 for the victory to finish second on the series money list with $283,667. He lost a playoff in March in the PGA Tour's Puerto Rico Open. Reavie, the winner of the second event in the series, made $108,000 to top the list with $323,067. The 2008 Canadian Open winner finished 166th in the FedEx Cup. Reavie and Patton Kizzire, the Web.com Tour's combined money leader with $518,241, earned full tour exemptions and spots in the Players Championship. Kizzire closed with a 67 to tie for fifth at 10 under. Sam Saunders was third at 12 under after a 67. Saunders, Arnold Palmer's grandson, was sixth on the series list with $114,950 after finishing 137th in the FedEx Cup. Australia's Rhein Gibson was another stroke back after a 65. He was 10th on the series list with $81,943 after finishing 33rd on the Web.com Tour regular-season money list. South Africans Thomas Aiken (65) and Tyrone Van Aswegen (68) also tied for fifth to earn PGA Tour cards. Van Aswegen finished 17th on the money list with $49,637, and Aiken was 23rd at $35,125. Rob Oppenheim took the 25th and final card with $32,206, edging Eric Axley by $101. Oppenheim finished with a 67 to tie for seventh at 7 under and earn $19,000. Axley, 25th last year, missed the cut. Henrik Norlander was third on the money list with $215,743, followed by Andrew Loupe at $195,405. The each won events in the series. Roberto Castro also earned a card along with Michael Thompson, Tom Hoge, Brett Stegmaier, Kyle Stanley, Hiroshi Iwata, Ricky Barnes, Lucas Glover, Derek Fathauer, Anirban Lahiri, Mark Hubbard, Robert Garrigus, Tim Wilkinson Derek Ernst, Luke List and Brian Davis. Southeast Texas sports news", "external_links": [], "published": "2015-10-05T03:11:00.000+03:00", "crawled": "2015-10-05T04:19:46.648+03:00", "highlightTitle": ""}