{"organizations": ["National Anthem", "Point Journal Media", "Stevens Point Journal Media", "Point Journal Media Buy Photo Fullscreen Buy Photo Amherst", "Iola-Scandinavia Thunderbirds", "Central Wisconsin Conference", "AP", "Amherst", "Amherst Falcons", "Amherst High School"], "uuid": "a2188c24a1fafa8a398f13aea27a35b0a418079a", "thread": {"social": {"gplus": {"shares": 0}, "pinterest": {"shares": 0}, "vk": {"shares": 0}, "linkedin": {"shares": 0}, "facebook": {"likes": 0, "shares": 0, "comments": 0}, "stumbledupon": {"shares": 0}}, "site_full": "www.stevenspointjournal.com", "main_image": "", "site_section": "http://rssfeeds.stevenspointjournal.com/stevenspoint/sports", "section_title": "Stevens Point - Sports", "url": "http://www.stevenspointjournal.com/story/sports/high-school/2015/10/12/prep-roundup-pacelli-fit-tied-newman/73851838/", "country": "US", "title": "Amherst stays on top of AP poll", "performance_score": 0, "site": "stevenspointjournal.com", "participants_count": 0, "title_full": "Amherst stays on top of AP poll", "spam_score": 0.0, "site_type": "news", "published": "2015-10-13T05:08:00.000+03:00", "replies_count": 0, "uuid": "a2188c24a1fafa8a398f13aea27a35b0a418079a"}, "author": "", "url": "http://www.stevenspointjournal.com/story/sports/high-school/2015/10/12/prep-roundup-pacelli-fit-tied-newman/73851838/", "ord_in_thread": 0, "title": "Amherst stays on top of AP poll", "locations": ["Amherst"], "entities": {"persons": [], "locations": [], "organizations": []}, "highlightText": "", "language": "english", "persons": ["Brandon Piotrowski", "Joshua Cisewski", "Chris Thomas", "Megan", "Giovani Fredheim", "Kristian Welch", "Bryce Holderman", "Ben Gutschow", "Garrett Groshek", "Cameron Gruenwald", "Brady Snyder", "Megan McCormick/Stevens", "Scott A. Williams", "Iola-Scandinavia", "Amaziah McCall", "Dalton Nemzoff", "Caleb Loken", "Michael Singer"], "text": "Amherst stays on top of AP poll Scott A. Williams , Stevens Point Journal Media 9:08 p.m. CDT October 12, 2015 CONNECT TWEET LINKEDIN COMMENT EMAIL MORE Buy Photo Amherst's Dalton Nemzoff, right, attempts to evade Iola-Scandinavia's Jalen Block, left, during the Central Wisconsin Conference football game at Amherst High School, Friday, Sept. 4, 2015. Megan McCormick/Stevens Point Journal Media, Megan McCormick/Stevens Point Journal Media Buy Photo Fullscreen Buy Photo Amherst's Ben Gutschow holds up the ball after scoring a touchdown during the Central Wisconsin Conference football game against Iola-Scandinavia at Amherst High School, Friday, Sept. 4, 2015. Megan McCormick/Stevens Point Journal Media, Megan McCormick/Stevens Point Journal Media Fullscreen Buy Photo The Amherst Falcons huddle up before the Central Wisconsin Conference football game against Iola-Scandinavia Thunderbirds at Amherst High School, Friday, Sept. 4, 2015. Megan McCormick/Stevens Point Journal Media, Megan McCormick/Stevens Point Journal Media Buy Photo Fullscreen Buy Photo Amherst quarterback Garrett Groshek, left, stiff arms Iola-Scandinavia's Caleb Loken, right, during the Central Wisconsin Conference football game at Amherst High School, Friday, Sept. 4, 2015. Megan McCormick/Stevens Point Journal Media, Megan McCormick/Stevens Point Journal Media Buy Photo Fullscreen Buy Photo Amherst's Garrett Groshek, right, against Iola-Scandinavia's Giovani Fredheim, left, during the Central Wisconsin Conference football game at Amherst High School, Friday, Sept. 4, 2015. Megan McCormick/Stevens Point Journal Media, Megan McCormick/Stevens Point Journal Media Buy Photo Fullscreen Buy Photo Amherst's Amaziah McCall slaps hands with the other starters before the Central Wisconsin Conference football game Iola-Scandinavia at Amherst High School, Friday, Sept. 4, 2015. Megan McCormick/Stevens Point Journal Media, Megan McCormick/Stevens Point Journal Media Buy Photo Fullscreen Buy Photo Iola-Scandinavia huddles up before taking on Amherst in a Central Wisconsin Conference football game at Amherst High School, Friday, Sept. 4, 2015. Megan McCormick/Stevens Point Journal Media, Megan McCormick/Stevens Point Journal Media Buy Photo Fullscreen Buy Photo Amherst fans fill up the bleachers before the Central Wisconsin Conference football game against Iola-Scandinavia at Amherst High School, Friday, Sept. 4, 2015. Megan McCormick/Stevens Point Journal Media, Megan McCormick/Stevens Point Journal Media Buy Photo Fullscreen Buy Photo Team captains for Iola-Scandinavia and Amherst meet at the 50-yard line for the coin toss before the Central Wisconsin Conference football game at Amherst High School, Friday, Sept. 4, 2015. Megan McCormick/Stevens Point Journal Media, Megan McCormick/Stevens Point Journal Media Buy Photo Fullscreen Buy Photo Iola-Scandinavia's Brady Snyder runs through the tunnel before the Central Wisconsin Conference football game at Amherst High School, Friday, Sept. 4, 2015. Megan McCormick/Stevens Point Journal Media, Megan McCormick/Stevens Point Journal Media Buy Photo Fullscreen Buy Photo The Amherst Falcons huddle up before the Central Wisconsin Conference football game against Iola-Scandinavia Thunderbirds at Amherst High School, Friday, Sept. 4, 2015. Megan McCormick/Stevens Point Journal Media, Megan McCormick/Stevens Point Journal Media Buy Photo Fullscreen Buy Photo Iola-Scandinavia football players line up before running through the tunnel during the Central Wisconsin Conference football game at Amherst High School, Friday, Sept. 4, 2015. Megan McCormick/Stevens Point Journal Media, Megan McCormick/Stevens Point Journal Media Buy Photo Fullscreen Buy Photo Amherst's Michael Singer runs through the tunnel during the Central Wisconsin Conference football game at Amherst High School, Friday, Sept. 4, 2015. Megan McCormick/Stevens Point Journal Media, Megan McCormick/Stevens Point Journal Media Buy Photo Fullscreen Buy Photo Amherst's Chris Thomas runs through the tunnel during the Central Wisconsin Conference football game at Amherst High School, Friday, Sept. 4, 2015. Megan McCormick/Stevens Point Journal Media, Megan McCormick/Stevens Point Journal Media Buy Photo Buy Photo Iola-Scandinavia fans watch the Central Wisconsin Conference football game at Amherst High School, Friday, Sept. 4, 2015. Megan McCormick/Stevens Point Journal Media, Megan McCormick/Stevens Point Journal Media Buy Photo Fullscreen Buy Photo Iola-Scandinavia players line up for the National Anthem during the Central Wisconsin Conference football game at Amherst High School, Friday, Sept. 4, 2015. Megan McCormick/Stevens Point Journal Media, Megan McCormick/Stevens Point Journal Media Buy Photo Fullscreen Buy Photo Amherst's Amaziah McCall during the Central Wisconsin Conference football game at Amherst High School, Friday, Sept. 4, 2015. Megan McCormick/Stevens Point Journal Media, Megan McCormick/Stevens Point Journal Media Buy Photo Fullscreen Buy Photo Iola-Scandinavia's Caleb Loken, left, against Amherst's Joshua Cisewski during the Central Wisconsin Conference football game at Amherst High School, Friday, Sept. 4, 2015. Megan McCormick/Stevens Point Journal Media, Megan McCormick/Stevens Point Journal Media Buy Photo Fullscreen Buy Photo Amherst's Garrett Groshek, left, against Iola-Scandinavia's Kristian Welch during the Central Wisconsin Conference football game at Amherst High School, Friday, Sept. 4, 2015. Megan McCormick/Stevens Point Journal Media, Megan McCormick/Stevens Point Journal Media Fullscreen Buy Photo Iola-Scandinavia's Cameron Gruenwald, left, scrambles with the ball while Amherst's Bryce Holderman, right, chases him down during the Central Wisconsin Conference football game at Amherst High School, Friday, Sept. 4, 2015. Megan McCormick/Stevens Point Journal Media, Megan McCormick/Stevens Point Journal Media Buy Photo Fullscreen Buy Photo Amherst's Dalton Nemzoff during the Central Wisconsin Conference football game at Amherst High School, Friday, Sept. 4, 2015. Megan McCormick/Stevens Point Journal Media, Megan McCormick/Stevens Point Journal Media Buy Photo Fullscreen Buy Photo Amherst's Amaziah McCall during the Central Wisconsin Conference football game at Amherst High School, Friday, Sept. 4, 2015. Megan McCormick/Stevens Point Journal Media, Megan McCormick/Stevens Point Journal Media Buy Photo Fullscreen Buy Photo Amherst football players celebrate Ben Gutschow's (8) touchdown during the Central Wisconsin Conference football game at Amherst High School, Friday, Sept. 4, 2015. Megan McCormick/Stevens Point Journal Media, Megan McCormick/Stevens Point Journal Media Buy Photo Fullscreen Buy Photo Iola-Scandinavia's Cameron Gruenwald, center, tackles Amherst quarterback Garrett Groshek, left, while Iola-Scandinavia's Kristian Welch looks on during the Central Wisconsin Conference football game at Amherst High School, Friday, Sept. 4, 2015. Megan McCormick/Stevens Point Journal Media, Megan McCormick/Stevens Point Journal Media Buy Photo Fullscreen Buy Photo Iola-Scandinavia's Caleb Loken, left, and Amherst's Amaziah McCall, right, during the Central Wisconsin Conference football game at Amherst High School, Friday, Sept. 4, 2015. Megan McCormick/Stevens Point Journal Media, Megan McCormick/Stevens Point Journal Media Buy Photo Fullscreen Buy Photo Amherst Brandon Piotrowski makes his way into the end zone during the Central Wisconsin Conference football game against Iola-Scandinavia at Amherst High School, Friday, Sept. 4, 2015. Megan McCormick/Stevens Point Journal Media, Megan McCormick/Stevens Point Journal Media Like this topic? You may also like these photo galleries: Replay", "external_links": [], "published": "2015-10-13T05:08:00.000+03:00", "crawled": "2015-10-13T06:35:39.379+03:00", "highlightTitle": ""}