{"organizations": ["Cystic Fibrosis Foundation", "Tami’s Pine Valley Funeral Home & Cremation Services", "Gray’s West & Co", "Baker County Circuit Court", "Coles Tribute Center", "West & Co", "Baker City Herald", "Baker City Veterans Memorial Club", "Eagle Valley Ambulance", "Baker City Police Arrests", "Baker County Sheriff’s Office Accident", "Oregon State Police", "Estes St.", "Baker City Christian Church", "Pine Valley Funeral Home & Cremation Services", "Valley Ave. Tami’s Pine Valley Funeral Home & Cremation Services"], "uuid": "dbdd63902d17dcb0362a8860547904e10027b9b1", "thread": {"social": {"gplus": {"shares": 0}, "pinterest": {"shares": 0}, "vk": {"shares": 0}, "linkedin": {"shares": 0}, "facebook": {"likes": 0, "shares": 0, "comments": 0}, "stumbledupon": {"shares": 0}}, "site_full": "www.bakercityherald.com", "main_image": "", "site_section": "http://feeds.feedburner.com/bakercityherald/LeEi", "section_title": "Baker City Herald, Baker County, OR News, Sports, &amp; Weather", "url": "http://www.bakercityherald.com/News-of-Record/News-of-Record-for-Oct-12-2015", "country": "US", "title": "News of Record for Oct. 12, 2015", "performance_score": 0, "site": "bakercityherald.com", "participants_count": 0, "title_full": "News of Record for Oct. 12, 2015", "spam_score": 0.0, "site_type": "news", "published": "2015-10-12T14:17:00.000+03:00", "replies_count": 0, "uuid": "dbdd63902d17dcb0362a8860547904e10027b9b1"}, "author": "", "url": "http://www.bakercityherald.com/News-of-Record/News-of-Record-for-Oct-12-2015", "ord_in_thread": 0, "title": "News of Record for Oct. 12, 2015", "locations": ["Dewey Ave.", "Campbell Street", "Beaverton", "Washington", "Ashley Care Manor", "Bennett Peak", "La Grande", "Kennewick", "Baker Street", "Pocahontas Road", "Baker City", "New Hope Church", "Pioneer Chapel", "St. Alphonsus Medical Center-Baker City", "Meadowbrook Place"], "entities": {"persons": [], "locations": [], "organizations": []}, "highlightText": "", "language": "english", "persons": ["Joe Bush", "Sumpter", "Russell George Paddock", "Wanda Virginia Cole", "Thiesfeld", "Donald DeRoest", "Alicia Marie Vowell", "Jamie Thiesfeld", "Angela Dawn Morigeau", "Eldon St.", "B. Leroy Merrick", "Sharon Myers", "Jesse Whitford", "Ash", "Michael Hendriks", "Peggy Perkins", "Marlene Frost", "Claudeen Nantz", "Tami", "Gray", "Linda Diane Peterson", "Travis Ash", "Peggy", "Angela Dawn Nixon", "Michael David Richmond", "Christopher David Huckstep", "Derek Allen Benadum"], "text": "News of Record for Oct. 12, 2015 News of Record for Oct. 12, 2015 By Baker City Herald October 12, 2015 12:17 pm DEATHS Marlene Frost: 80, of Baker City, died Oct. 11, 2015, at Ashley Care Manor in Baker City. Arrangements are under the direction of Tami’s Pine Valley Funeral Home & Cremation Services. Online condolences may be made at www.tamispinevalley funeralhome.com Sharon Myers: 63, of Baker City, died Oct. 11, 2015, at La Grande Post Acute Care Center. Tami’s Pine Valley Funeral Home & Cremation Services is in charge of arrangements. Online condolences may be made at www.tamispinevalleyfuneral home.com Claudeen Nantz, 85, of the North Powder and La Grande areas, died Oct. 11, 2015, at a La Grande care home. Tami’s Pine Valley Funeral Home & Cremation Services is in charge of arrangements. Online condolences may be shared at www.tamispinevalleyfuneralhome.com B. Leroy Merrick: 90, of Baker City, died Oct. 11, 2015, at Meadowbrook Place. Coles Tribute Center is in charge of arrangements. Donald DeRoest: 82, of Baker City, died Oct. 10, 2015, at his home. Gray’s West & Co. Pioneer Chapel is in charge of arrangements. FUNERALS PENDING Michael Hendriks: Memorial service, 2 p.m., Tuesday, Oct. 13, at New Hope Church, 2007 First St. Pastor Joe Bush will officiate. There will be a reception afterward. Memorial contributions may be made to Gray’s West & Co. Pioneer Chapel, 1500 Dewey Ave., Baker City, OR 97814. Wanda Virginia Cole: Celebration of her life, 1 p.m., Friday, Oct. 16, at Baker City Christian Church, 650 Highway 7. Pastor Jesse Whitford will officiate. Memorial contributions may be made to the Cystic Fibrosis Foundation through Gray’s West & Co. Pioneer Chapel, 1500 Dewey Ave., Baker City, OR 97814. Peggy Perkins: 78, a longtime resident of Baker City and Sumpter, died Oct. 8, 2015, at her home. There will be a celebration of Peggy’s life at 2 p.m. Sunday, Oct. 25, at the Baker City Veterans Memorial Club, 2005 Valley Ave. Tami’s Pine Valley Funeral Home & Cremation Services is in charge of arrangements. Online condolences may be made at www.tamispinevalleyfuneralhome.com POLICE LOG Baker City Police Arrests, citations PROBATION VIOLATION (Baker County Circuit Court warrant): Russell George Paddock, 56, of 1600 Eldon St., No. 13, 7:37 p.m. Sunday, at his home; cited and released. POSSESSION OF METHAMPHETAMINE: Angela Dawn Morigeau, 32, of Kennewick, Washington, 8:32 p.m. Sunday, at Main and Myrtle streets; cited and released. FAILURE TO PAY FINES (Warrant): Christopher David Huckstep, 27, of 2350 C St., Apartment E, 9:58 p.m. Sunday, in the 3200 block of 14th Street; cited and released. CRIMINAL TRESPASSING II and UNLAWFUL POSSESSION OF METHAMPHETAMINE: Angela Dawn Nixon, 28, of 3425 Estes St., 4 a.m. Sunday, in the 1400 block of Baker Street; jailed. DISORDERLY CONDUCT: Linda Diane Peterson, 48, no fixed address, 6:38 p.m. Saturday, in the 2900 block of Elm Street; jailed. DISORDERLY CONDUCT and HARASSMENT: Derek Allen Benadum, 35, of Beaverton, 1:55 a.m. Sunday, in the 500 block of Campbell Street; jailed. PROBATION VIOLATION (Baker County Circuit Court warrant): Alicia Marie Vowell, 26, of 910 Resort St., 8 p.m. Friday, at 15th and H streets; jailed. Baker County Sheriff’s Office Accident reports The sheriff’s office received a report of an ATV crash in the Bennett Peak area at 12:49 p.m. Saturday. Sheriff Travis Ash said Jamie Thiesfeld, 53, of La Grande was riding in the area when her vehicle crashed. Thiesfeld, who sustained a broken leg in the incident, was brought by private party to Tamarack Campground. She was transported by Eagle Valley Ambulance to St. Alphonsus Medical Center-Baker City, Ash said. Oregon State Police FAILURE TO REGISTER AS A SEX OFFENDER (out of compliance for failure to register address change): Michael David Richmond, 41, of Baker City, 11:11 a.m. Wednesday, at 39155 Pocahontas Road; cited and released.", "external_links": [], "published": "2015-10-12T14:17:00.000+03:00", "crawled": "2015-10-13T22:14:18.011+03:00", "highlightTitle": ""}