{"organizations": ["Brevard College", "Colorado Mesa University", "University of Colorado-Boulder", "Fort Lewis Skyhawks", "Skyhawks", "University of North Carolina", "USA Cycling Collegiate Mountain Bike National Championships in Snowshoe", "Marian University", "Angelina Palermo of Marian University"], "uuid": "a87360c7cd40a71c5c2324f3de90ab51813ffbf2", "thread": {"social": {"gplus": {"shares": 0}, "pinterest": {"shares": 0}, "vk": {"shares": 0}, "linkedin": {"shares": 0}, "facebook": {"likes": 0, "shares": 0, "comments": 0}, "stumbledupon": {"shares": 0}}, "site_full": "www.durangoherald.com", "main_image": "http://www.durangoherald.com/img/dh_200.png", "site_section": "http://www.durangoherald.com/section/sports?template=RSS&mime=xml", "section_title": "Sports", "url": "http://www.durangoherald.com/article/20151025/SPORTS02/151029702/-1/sports&source=RSS", "country": "US", "title": "FLC cranks out another national title", "performance_score": 0, "site": "durangoherald.com", "participants_count": 0, "title_full": "FLC cranks out another national title", "spam_score": 0.0, "site_type": "news", "published": "2015-10-26T00:40:00.000+02:00", "replies_count": 0, "uuid": "a87360c7cd40a71c5c2324f3de90ab51813ffbf2"}, "author": "", "url": "http://www.durangoherald.com/article/20151025/SPORTS02/151029702/-1/sports&source=RSS", "ord_in_thread": 0, "title": "FLC cranks out another national title", "locations": ["Durango", "Fort Lewis", "Sofia", "West Virginia"], "entities": {"persons": [], "locations": [], "organizations": []}, "highlightText": "", "language": "english", "persons": ["Leila Carrillo", "Gomez Villafañe", "Michael Sampson", "Brian White", "Derrik Blackmore", "Fort Lewis", "Zach Graveson", "Sarah Hill", "Luke Vrounwnvelder", "Endersbe", "Joseph Crosby", "Sampson", "Rebecca Gardner", "Marian University", "Libbey Endersbe", "Devoust", "Jon Mentzer Herald", "Stephan Devoust"], "text": "FLC cranks out another national title FLC cranks out another national title Skyhawks win 22nd title in school history By Jon Mentzer Herald staff writer Article Last Updated: Sunday, October 25, 2015 5:40pm Share A s the mud settled and the muscles eased, the Fort Lewis Skyhawks stood alone at the podium in the Team Omnium and Team Relay to capture its 22nd national title over the weekend at the USA Cycling Collegiate Mountain Bike National Championships in Snowshoe, West Virginia. The Skyhawks scored 741 points to take the Team Omnium with Brevard College taking second place with 711 points. Marian University took third with 696 points. Fort Lewis also took the Team Relay with a time of 15 minutes, 52.9 seconds. Marian University took second place with 16:02.4 while Brevard College took third with 16:04.1. Along with the 22nd national title in school history, this marks the 10th mountain bike title in the last 11 years for Fort Lewis after losing in 2014 to the University of Colorado-Boulder. In the Women’s Individual Omnium, Durango local Sofia Gomez Villafañe bested the field and took her second consecutive championship in the discipline by taking first with 367 points. Sarah Hill of Brevard College took second with 278 points and Angelina Palermo of Marian University took third with 242 points. Libbey Endersbe of Fort Lewis took sixth with 212 points. On the men’s side of the Individual Omnium, Luke Vrounwnvelder of the University of North Carolina took first with 339 points. Fort Lewis rider Stephan Devoust was the top rider for the Skyhawks by taking third with 284 points while teammate Michael Sampson took 10th with 100 points. In the Men’s Dual Slalom, Zach Graveson took the top spot for Fort Lewis with 372.24 points. Teammate Brian White, of Durango, came in ninth for Fort Lewis with 402.63 while Devoust took 15th with 425.73 points. Durango local Derrik Blackmore who rides for Colorado Mesa University came in 16th with 429.55 points. Fort Lewis rider Joseph Crosby took 29th with 479.21. Sampson who finished with in 37th with 509.77 points. On the women’s side of the Dual Slalom, Fort Lewis rider Leila Carrillo took 10th overall with 463.96 points. Endersbe took 16th with 503.77 points, and Rebecca Gardner took 20th with 530.30. Gomez Villafañe took 21st with 536.93 points.", "external_links": [], "published": "2015-10-26T00:40:00.000+02:00", "crawled": "2015-10-26T13:33:58.870+02:00", "highlightTitle": ""}