{"organizations": ["Gray’s West & Co", "St. Alphonsus Medical Center-Boise", "Baker City Christian Church", "Baker County Sheriff’s Office Arrests", "Baker City Herald", "Baker City Veterans Memorial Club", "Pine Valley Funeral Home & Cremation Services"], "uuid": "0ac79b738670e3b246f0a6a39b3a0499f63e9398", "thread": {"social": {"gplus": {"shares": 0}, "pinterest": {"shares": 0}, "vk": {"shares": 0}, "linkedin": {"shares": 0}, "facebook": {"likes": 0, "shares": 0, "comments": 0}, "stumbledupon": {"shares": 0}}, "site_full": "www.bakercityherald.com", "main_image": "", "site_section": "http://feeds.feedburner.com/bakercityherald/LeEi", "section_title": "Baker City Herald, Baker County, OR News, Sports, &amp; Weather", "url": "http://www.bakercityherald.com/News-of-Record/News-of-Record-for-Oct-16-2015", "country": "US", "title": "News of Record for Oct. 16, 2015", "performance_score": 0, "site": "bakercityherald.com", "participants_count": 0, "title_full": "News of Record for Oct. 16, 2015", "spam_score": 0.0, "site_type": "news", "published": "2015-10-16T13:50:00.000+03:00", "replies_count": 0, "uuid": "0ac79b738670e3b246f0a6a39b3a0499f63e9398"}, "author": "", "url": "http://www.bakercityherald.com/News-of-Record/News-of-Record-for-Oct-16-2015", "ord_in_thread": 0, "title": "News of Record for Oct. 16, 2015", "locations": ["Dewey Ave.", "Klamath Falls", "Baker City", "Baker Street", "Pocahontas Road", "Pioneer Chapel"], "entities": {"persons": [], "locations": [], "organizations": []}, "highlightText": "", "language": "english", "persons": ["Mary Ellen Prevo", "Jesse Whitford", "Peggy", "Donald R. A. DeRoest", "Cassandra Lee Ann Lopez", "Peggy Perkins", "Edward Olan Truitt Sr.", "Tami", "Ann Marie Bolanos"], "text": "News of Record for Oct. 16, 2015 News of Record for Oct. 16, 2015 By Baker City Herald October 16, 2015 11:50 am FUNERALS PENDING Donald R. A. DeRoest: Saturday, Oct. 17, 11 a.m. at Gray’s West & Co. Pioneer Chapel, 1500 Dewey Ave., with Pastor Jesse Whitford of the Baker City Christian Church officiating. Peggy Perkins: A celebration of Peggy’s life at 2 p.m. Sunday, Oct. 25, at the Baker City Veterans Memorial Club. Tami’s Pine Valley Funeral Home & Cremation Services is in charge of arrangements. Online condolences may be made at www.tamispinevalleyfuneralhome.com DEATHS Kathleen Friend: 95, of Baker City, died Oct. 15, 2015, at St. Alphonsus Medical Center-Boise. Her graveside service will be at Eternal Hills Cemetery in Klamath Falls. The time and date will be announced. The time and date of a viewing at Gray’s West & Co. Pioneer Chapel in Baker City is pending. POLICE LOG Baker County Sheriff’s Office Arrests, citations THEFT II: Mary Ellen Prevo, 44, of 3025 Resort St., 10:51 a.m. Thursday, in the 2200 block of Resort Street; jailed. CRIMINAL TRESPASSING II: Edward Olan Truitt Sr., 58, of 2185 14th St., 10:53 a.m. Thursday, in the 3300 block of Pocahontas Road, jailed and later released on bail. PROBATION VIOLATION: Ann Marie Bolanos, 35, of 3305½ 14th St., 5:50 p.m. Thursday, on Baker Street near Seventh Street; jailed. PROBATION VIOLATION (Parole and Probation detainer): Cassandra Lee Ann Lopez, 33, of 3325 14th St., 8:05 p.m. Thursday, at his home; jailed.", "external_links": [], "published": "2015-10-16T13:50:00.000+03:00", "crawled": "2015-10-16T22:29:16.682+03:00", "highlightTitle": ""}