{"organizations": [], "uuid": "cc34436d64ed354cf002d8d84798cc2920181467", "thread": {"social": {"gplus": {"shares": 0}, "pinterest": {"shares": 0}, "vk": {"shares": 0}, "linkedin": {"shares": 0}, "facebook": {"likes": 0, "shares": 0, "comments": 0}, "stumbledupon": {"shares": 0}}, "site_full": "www.beaumontenterprise.com", "main_image": "http://ww2.hdnux.com/photos/41/47/00/8810505/3/rawImage.jpg", "site_section": "http://www.beaumontenterprise.com/sports/other/collectionRss/Sports-Other-Sports-Heds-7427.php", "section_title": "Sports Other Sports Heds", "url": "http://www.beaumontenterprise.com/sports/article/Ibrahimovic-s-Sweden-faces-Denmark-in-Euros-6576224.php", "country": "US", "title": "Ibrahimovic's Sweden faces Denmark in Euros playoff derby", "performance_score": 0, "site": "beaumontenterprise.com", "participants_count": 0, "title_full": "Ibrahimovic's Sweden faces Denmark in Euros playoff derby", "spam_score": 0.0, "site_type": "news", "published": "2015-10-18T13:16:00.000+03:00", "replies_count": 0, "uuid": "cc34436d64ed354cf002d8d84798cc2920181467"}, "author": "", "url": "http://www.beaumontenterprise.com/sports/article/Ibrahimovic-s-Sweden-faces-Denmark-in-Euros-6576224.php", "ord_in_thread": 0, "title": "Ibrahimovic's Sweden faces Denmark in Euros playoff derby", "locations": ["Portugal", "Southeast Texas", "Slovakia", "Stockholm", "Spain", "Ukraine", "Ireland", "England", "Northern Ireland", "Gallery NYON", "Switzerland", "Italy", "Moldova", "France", "Denmark", "Albania", "Bosnia-Herzegovina", "Slovenia", "Turkey", "Austria", "Wales", "Hungary", "Czech Republic", "SWEDEN", "Poland", "Belgium", "Romania", "Croatia", "Russia", "Norway", "Germany", "Iceland", "Sweden"], "entities": {"persons": [], "locations": [], "organizations": []}, "highlightText": "", "language": "english", "persons": ["FREDRIK SANDBERG/TT", "AP Ibrahimovic", "Ibrahimovic", "Zlatan Ibrahimovic", "Fredrik Sandberg"], "text": "Close Image 1 of 1 Sweden's Zlatan Ibrahimovic celebrates scoring the opening goal during the UEFA Euro 2016 group G qualifying soccer match between Sweden and Moldova at Friends Arena in Stockholm, Sweden, on Monday Oct. 12, 2015. (Fredrik Sandberg / TT via AP) SWEDEN OUT Sweden's Zlatan Ibrahimovic celebrates scoring the opening goal during the UEFA Euro 2016 group G qualifying soccer match between Sweden and Moldova at Friends Arena in Stockholm, Sweden, on Monday Oct. 12, ... more Photo: FREDRIK SANDBERG/TT, AP Ibrahimovic's Sweden faces Denmark in Euros playoff derby 1 / 1 Back to Gallery NYON, Switzerland (AP) â€” Zlatan Ibrahimovic 's Sweden will face Denmark in a Nordic derby in the Euro 2016 playoffs. Norway, another Nordic nation chasing one of the remaining four spots at the expanded 24-team tournament, was drawn Sunday to play Hungary in the two-legged playoffs next month. Ireland, which qualified for Euro 2012 through the playoffs, faces Bosnia-Herzegovina this time. In a repeat of a Euro 2000 playoff, Ukraine and Slovenia were paired together again. Slovenia won back in 1999. Alongside host nation France, the other finalists so far are: Albania, Austria, Belgium, Croatia, the Czech Republic, England, Germany, Iceland, Italy, Northern Ireland, Poland, Portugal, Romania, Russia, Slovakia, Spain, Switzerland, Turkey and Wales. Southeast Texas sports news", "external_links": [], "published": "2015-10-18T13:16:00.000+03:00", "crawled": "2015-10-18T15:56:40.613+03:00", "highlightTitle": ""}