{"organizations": ["Jazz", "NBA", "AP Lillard", "AP Image", "Utah Jazz", "Portland Trail Blazers", "AP"], "uuid": "3f6a9532956b2d03451bb5dc3573699522a87b6b", "thread": {"social": {"gplus": {"shares": 0}, "pinterest": {"shares": 0}, "vk": {"shares": 0}, "linkedin": {"shares": 0}, "facebook": {"likes": 0, "shares": 0, "comments": 0}, "stumbledupon": {"shares": 0}}, "site_full": "www.beaumontenterprise.com", "main_image": "http://ww1.hdnux.com/photos/41/47/61/8813664/3/rawImage.jpg", "site_section": "http://www.beaumontenterprise.com/sports/basketball/collectionRss/Sports-Basketball-Heds-7404.php", "section_title": "Sports Basketball Heds", "url": "http://www.beaumontenterprise.com/sports/article/Lillard-McCollum-lead-Blazers-big-rally-to-beat-6576874.php", "country": "US", "title": "Lillard, McCollum lead Blazers' big rally to beat Jazz in OT", "performance_score": 0, "site": "beaumontenterprise.com", "participants_count": 0, "title_full": "Lillard, McCollum lead Blazers' big rally to beat Jazz in OT", "spam_score": 0.0, "site_type": "news", "published": "2015-10-19T06:53:00.000+03:00", "replies_count": 0, "uuid": "3f6a9532956b2d03451bb5dc3573699522a87b6b"}, "author": "", "url": "http://www.beaumontenterprise.com/sports/article/Lillard-McCollum-lead-Blazers-big-rally-to-beat-6576874.php", "ord_in_thread": 0, "title": "Lillard, McCollum lead Blazers' big rally to beat Jazz in OT", "locations": ["Southeast Texas", "Gallery PORTLAND", "Utah", "Utah Jazz", "Ore.", "Portland"], "entities": {"persons": [], "locations": [], "organizations": []}, "highlightText": "", "language": "english", "persons": ["Al Farouq Aminu", "Tibor Pleiss", "Craig Mitchelldyer", "Trey Burke", "Pat Connaughton", "Joe Ingles", "Pleiss", "Rudy Gobert", "Damian Lillard", "Gordon Hayward", "Hayward", "Lillard", "C.J. McCollum", "Derrick Favors", "Mason Plumlee", "Rodney Hood", "McCollum", "Maurice Harkless"], "text": "Close Image 1 of 3 Portland Trail Blazers forward Mason Plumlee, center, dunks over Utah Jazz center Tibor Pleiss during the first half of an NBA preseason basketball game in Portland, Ore., Sunday, Oct. 18, 2015. Portland Trail Blazers forward Mason Plumlee, center, dunks over Utah Jazz center Tibor Pleiss during the first half of an NBA preseason basketball game in Portland, Ore., Sunday, Oct. 18, 2015. Photo: Craig Mitchelldyer, AP Image 2 of 3 Utah Jazz guard Rodney Hood, right, posts up against Portland Trail Blazers guard Pat Connaughton during the first half of an NBA preseason basketball game in Portland, Ore., Sunday, Oct. 18, 2015. Utah Jazz guard Rodney Hood, right, posts up against Portland Trail Blazers guard Pat Connaughton during the first half of an NBA preseason basketball game in Portland, Ore., Sunday, Oct. 18, 2015. Photo: Craig Mitchelldyer, AP Image 3 of 3 Utah Jazz guard Rodney Hood, right, shoots over Portland Trail Blazers guard Pat Connaughton during the first half of an NBA preseason basketball game in Portland, Ore., Sunday, Oct. 18, 2015. Utah Jazz guard Rodney Hood, right, shoots over Portland Trail Blazers guard Pat Connaughton during the first half of an NBA preseason basketball game in Portland, Ore., Sunday, Oct. 18, 2015. Photo: Craig Mitchelldyer, AP Lillard, McCollum lead Blazers' big rally to beat Jazz in OT 1 / 3 Back to Gallery PORTLAND, Ore. (AP) â€” Damian Lillard scored 32 points, C.J. McCollum had 26 and the Portland Trail Blazers rallied from a 21-point, second-half deficit to beat the Utah Jazz 116-111 in overtime Sunday night in a preseason game. Lillard, who hit two free throws with 2.8 seconds left to tie the game at 101 and force overtime, made six 3-pointers. McCollum hit 11 of 23 shots and scored 18 points during the fourth quarter and overtime for Portland (3-2). Trey Burke scored 22 points and Joe Ingles came off the bench to hit five 3-pointers scored 16 points for Utah (2-3). JAZZ: With Gordon Hayward (back contusion), Derrick Favors (back) and Rudy Gobert (rest) on the sidelines, Utah gave 7-foot-3 German rookie Tibor Pleiss and Rodney Hood their first starts of the preseason. Pleiss had two points and five rebounds in 19 minutes. Hayward took a hard fall in an Oct. 12 game against Portland, is considered day-to-day. BLAZERS: Maurice Harkless made his first preseason start, replacing Al Farouq Aminu (rest). The 6-9 forward, who had played just 44 minutes in two previous preseason games, had eight points and nine rebounds. Southeast Texas sports news", "external_links": [], "published": "2015-10-19T06:53:00.000+03:00", "crawled": "2015-10-19T10:40:38.691+03:00", "highlightTitle": ""}