{"organizations": ["AP LSU Tigers", "AP LSU", "Eastern Michigan Eagles", "Sports Eastern Michigan Eagles", "LSU", "LSU Tigers", "NCAA", "Travin Dural", "Eastern Michigan", "AP Travin Dural"], "uuid": "3b8f6caeaa2bbb7359c64aa248642e3f4f00f126", "thread": {"social": {"gplus": {"shares": 0}, "pinterest": {"shares": 0}, "vk": {"shares": 0}, "linkedin": {"shares": 0}, "facebook": {"likes": 0, "shares": 0, "comments": 0}, "stumbledupon": {"shares": 0}}, "site_full": "www.thenewsstar.com", "main_image": "http://www.gannett-cdn.com/-mm-/1237f125d06bca99c7ecf49b8e8e567da86d7efc/c=0-33-512-322&amp;r=x1683&amp;c=3200x1680/local/-/media/2015/10/04/LAGroup/Shreveport/635795788760810164-LSUEMU1.jpg", "site_section": "http://rssfeeds.thenewsstar.com/monroe/sports", "section_title": "Monroe - Sports", "url": "http://www.thenewsstar.com/story/sports/on-the-sidelines/2015/10/05/techs-dixon-apologizes-ejection/73369600/", "country": "US", "title": "LSU-Eastern Michigan", "performance_score": 0, "site": "thenewsstar.com", "participants_count": 0, "title_full": "LSU-Eastern Michigan", "spam_score": 0.0, "site_type": "news", "published": "2015-10-05T01:35:00.000+03:00", "replies_count": 0, "uuid": "3b8f6caeaa2bbb7359c64aa248642e3f4f00f126"}, "author": "", "url": "http://www.thenewsstar.com/story/sports/on-the-sidelines/2015/10/05/techs-dixon-apologizes-ejection/73369600/", "ord_in_thread": 0, "title": "LSU-Eastern Michigan", "locations": ["Eastern Michigan", "Michigan", "Baton Rouge"], "entities": {"persons": [], "locations": [], "organizations": []}, "highlightText": "", "language": "english", "persons": ["Derick E. Hingle", "Les Miles", "Nathan Adams", "Dustin Creel", "Trent Domingue", "Derick E. Hingle-USA", "Ed Paris", "Ray Tillman", "Darrel Williams", "Gerald Herbert", "Anthony Brown", "Leonard Fournette", "Derrius Guice", "Deion Jones", "John Diarse", "Kevin Toliver", "Nick Brossette", "Brandon Harris"], "text": "Activate your digital access. LSU-Eastern Michigan LSU cornerback Kevin Toliver II (2) intercepts a pass intended for Eastern Michigan wide receiver Dustin Creel (3) in the second half Saturday. Gerald Herbert, AP LSU cornerback Kevin Toliver II (2) celebrates his interception with cornerback Tre'Davious White (18) and cornerback Ed Paris (24) in the second half of Saturday's game. Gerald Herbert, AP LSU running back Darrel Williams (34) carries for 40 yards in the second half Saturday. Gerald Herbert, AP Travin Dural tries to catch a pass during Saturday's game. Gerald Herbert, AP The LSU marching band and Golden Girl cheerleaders perform in the first half of an NCAA college football game against Eastern Michigan on Saturday. Gerald Herbert, AP LSU running back Nick Brossette (4) is tackled on a rushing play in the second half of an NCAA college football game against Eastern Michigan in Baton Rouge. Gerald Herbert, AP LSU wide receiver John Diarse (9) can't hold onto a pass in the first half of an NCAA college football game against Eastern Michigan in Baton Rouge. Gerald Herbert, AP LSU place kicker Trent Domingue (14) kicks a field goal in the first half of an NCAA college football game in Baton Rouge. Gerald Herbert, AP LSU running back Leonard Fournette is stopped by Eastern Michigan defensive back Anthony Brown (22) in the first half of an NCAA college football game in Baton Rouge. Gerald Herbert, AP LSU running back Leonard Fournette (7) carries against Eastern Michigan linebacker Nathan Adams (36) in the first half of an NCAA college football game in Baton Rouge. Gerald Herbert, AP LSU Tigers quarterback Brandon Harris (6) runs against the Eastern Michigan Eagles during the first quarter of a game at Tiger Stadium. Derick E. Hingle-USA TODAY Sports LSU Tigers running back Leonard Fournette (7) runs against the Eastern Michigan Eagles during the second quarter of a game at Tiger Stadium. Derick E. Hingle, Derick E. Hingle-USA TODAY Sports Eastern Michigan Eagles defensive back DaQuan Pace (1) is called for pass interference against LSU Tigers wide receiver Travin Dural (83) during the first quarter of a game at Tiger Stadium. Derick E. Hingle-USA TODAY Sports The LSU Tigers golden girls perform with the LSU Tigers golden band from Tigerland before a game against the Eastern Michigan Eagles at Tiger Stadium. Derick E. Hingle-USA TODAY Sports LSU Tigers running back Leonard Fournette (7) before a game against the Eastern Michigan Eagles at Tiger Stadium. Derick E. Hingle-USA TODAY Sports LSU Tigers running back Leonard Fournette (7) scores a touchdown against the Eastern Michigan Eagles during the first quarter of a game at Tiger Stadium. Derick E. Hingle-USA TODAY Sports LSU Tigers head coach Les Miles runs onto the field with his team prior to kickoff of a a game against the Eastern Michigan Eagles at Tiger Stadium. Derick E. Hingle-USA TODAY Sports LSU Tigers running back Darrel Williams (34) runs against the Eastern Michigan Eagles during the second half of a game at Tiger Stadium. LSU defeated Eastern Michigan 44-22. Derick E. Hingle-USA TODAY Sports LSU Tigers running back Derrius Guice (5) hurdles over Eastern Michigan Eagles defensive back Ray Tillman (31) during the second half of a game at Tiger Stadium. LSU defeated Eastern Michigan 44-22. Derick E. Hingle, Derick E. Hingle-USA TODAY Sports LSU Tigers linebacker Deion Jones (45) celebrates with teammates following an interception against the Eastern Michigan Eagles during the second half of a game at Tiger Stadium. LSU defeated Eastern Michigan 44-22. Derick E. Hingle-USA TODAY Sports Like this topic? You may also like these photo galleries: Replay", "external_links": [], "published": "2015-10-05T01:35:00.000+03:00", "crawled": "2015-10-05T21:20:34.886+03:00", "highlightTitle": ""}