{"organizations": ["Twins Associated Press", "Minnesota Twins", "Associated Press", "Cleveland Indians", "LinkedIn Pinterest Indians", "Twins Facebook Email Twitter Google", "Facebook Indians"], "uuid": "681fa1074ba6191ba1458d27dc046b2458a68465", "thread": {"social": {"gplus": {"shares": 0}, "pinterest": {"shares": 0}, "vk": {"shares": 0}, "linkedin": {"shares": 0}, "facebook": {"likes": 0, "shares": 0, "comments": 0}, "stumbledupon": {"shares": 0}}, "site_full": "www.kare11.com", "main_image": "http://www.gannett-cdn.com/-mm-/489efad1142179deef9ce5ef3cf126cd99e1a3f1/r=x633&amp;c=1200x630/http/cdn.tegna-tv.com/-mm-/7a64a57fc3f600fc4960ec80994b46809a1c9b6b/c=0-72-1875-1131/local/-/media/2015/09/30/KARE/KARE/635792513162365166-USATSI-8834325-114815493-lowres.jpg", "site_section": "http://rssfeeds.kare11.com/_/20/108593174/KARE/sports", "section_title": "KARE - Sports", "url": "http://www.kare11.com/story/sports/mlb/twins/2015/09/30/indians-take-game-2-10-2-split-doubleheader-with-twins/73129440/", "country": "US", "title": "Indians take Game 2 10-2, split doubleheader with Twins", "performance_score": 0, "site": "kare11.com", "participants_count": 0, "title_full": "Indians take Game 2 10-2, split doubleheader with Twins", "spam_score": 0.0, "site_type": "news", "published": "2015-10-01T06:09:00.000+03:00", "replies_count": 0, "uuid": "681fa1074ba6191ba1458d27dc046b2458a68465"}, "author": "", "url": "http://www.kare11.com/story/sports/mlb/twins/2015/09/30/indians-take-game-2-10-2-split-doubleheader-with-twins/73129440/", "ord_in_thread": 0, "title": "Indians take Game 2 10-2, split doubleheader with Twins", "locations": [], "entities": {"persons": [], "locations": [], "organizations": []}, "highlightText": "", "language": "english", "persons": ["Lonnie Chisenhall", "Jose Ramirez", "David Richard-USA", "Cody Anderson", "Chris Herrmann"], "text": "Facebook Email Twitter Google+ LinkedIn Pinterest Indians take Game 2 10-2, split doubleheader with Twins Cody Anderson pitched seven shutout innings and Jose Ramirez hit a three-run homer, leading the Cleveland Indians to a 10-2 victory over the Minnesota Twins Wednesday night. Post to Facebook Indians take Game 2 10-2, split doubleheader with Twins Cody Anderson pitched seven shutout innings and Jose Ramirez hit a three-run homer, leading the Cleveland Indians to a 10-2 victory over the Minnesota Twins Wednesday night. Check out this story on kare11.com: http://www.kare11.com/story/sports/mlb/twins/2015/09/30/indians-take-game-2-10-2-split-doubleheader-with-twins/73129440/ Cancel Send A link has been sent to your friend's email address. Posted! A link has been posted to your Facebook feed. Join the Conversation To find out more about Facebook commenting please read the Conversation Guidelines and FAQs Indians take Game 2 10-2, split doubleheader with Twins Associated Press, Associated Press 11:09 p.m. EDT September 30, 2015 Cleveland Indians right fielder Lonnie Chisenhall (8) scores a run before a tag by Minnesota Twins catcher Chris Herrmann (12) in the third inning at Progressive Field. (Photo: David Richard-USA TODAY Sports) CONNECT 3 TWEET LINKEDIN COMMENT EMAIL MORE \nCLEVELAND (AP) - Cody Anderson pitched seven shutout innings and Jose Ramirez hit a three-run homer, leading the Cleveland Indians to a 10-2 victory over the Minnesota Twins Wednesday night to split a doubleheader and stay alive in the AL wild-card race. \nMinnesota won the first game 7-1 and pulled to one game behind the Angels for the second wild-card spot - Los Angeles lost to Oakland Wednesday night. \nCleveland is five games behind L.A. and still faced potential elimination Wednesday if the Astros beat the Mariners later. \nAnderson (7-3) held the Twins to two hits and won his fifth straight start. \nCleveland scored four runs in the second off Mike Pelfrey (6-11), who lasted 1 2-3 innings, and Francisco Lindor, continuing his case for rookie of the year, belted a two-run homer in the fourth. Read or Share this story: http://www.kare11.com/story/sports/mlb/twins/2015/09/30/indians-take-game-2-10-2-split-doubleheader-with-twins/73129440/ TOP VIDEOS", "external_links": [], "published": "2015-10-01T06:09:00.000+03:00", "crawled": "2015-10-01T06:54:46.335+03:00", "highlightTitle": ""}