{"organizations": ["Brian Jordan Foundation", "Atlanta Falcons", "Atlanta Braves", "Facebook Email Twitter Google", "Astros", "Turner Field", "Houston Astros", "Braves", "WXIA"], "uuid": "f63252adf6154c8bf908d0b3b7152a6f9d486238", "thread": {"social": {"gplus": {"shares": 0}, "pinterest": {"shares": 0}, "vk": {"shares": 0}, "linkedin": {"shares": 0}, "facebook": {"likes": 0, "shares": 0, "comments": 0}, "stumbledupon": {"shares": 0}}, "site_full": "www.11alive.com", "main_image": "http://cdn.tegna-tv.com/-mm-/e90fd9e5804b10c74e6ed3d689a75da636d85cb5/c=0-229-3000-1924&amp;r=x633&amp;c=1200x630/local/-/media/2015/10/23/WXIA/WXIA/635812010256666338-GettyImages-55860871.jpg", "site_section": "http://rssfeeds.11alive.com/_/20/109773082/wxia-sports", "section_title": "WXIA - Sports", "url": "http://www.11alive.com/story/sports/2015/10/23/9th-annual-brian-jordan-celebrity-golf-weekend-on-oct-24-26/74462014/", "country": "US", "title": "Ninth annual Brian Jordan Celebrity Golf Weekend on Oct. 24-26.", "performance_score": 0, "site": "11alive.com", "participants_count": 0, "title_full": "Ninth annual Brian Jordan Celebrity Golf Weekend on Oct. 24-26.", "spam_score": 0.0, "site_type": "news", "published": "2015-10-23T19:44:00.000+03:00", "replies_count": 0, "uuid": "f63252adf6154c8bf908d0b3b7152a6f9d486238"}, "author": "", "url": "http://www.11alive.com/story/sports/2015/10/23/9th-annual-brian-jordan-celebrity-golf-weekend-on-oct-24-26/74462014/", "ord_in_thread": 0, "title": "Ninth annual Brian Jordan Celebrity Golf Weekend on Oct. 24-26.", "locations": ["Atlanta", "Georgia"], "entities": {"persons": [], "locations": [], "organizations": []}, "highlightText": "", "language": "english", "persons": ["Brian Bahr", "Brian", "Brian Jordan"], "text": "Facebook Email Twitter Google+ LinkedIn Pinterest Ninth annual Brian Jordan Celebrity Golf Weekend on Oct. 24-26. Former Atlanta Braves and Atlanta Falcons player Brian Jordan is hosting multiple events around Atlanta to raise funds and awareness for the Brian Jordan Foundation. Post to Facebook Ninth annual Brian Jordan Celebrity Golf Weekend on Oct. 24-26. Former Atlanta Braves and Atlanta Falcons player Brian Jordan is hosting multiple events around Atlanta to raise funds and awareness for the Brian Jordan Foundation.  //on.11alive.com/1LSbA99   Join the Conversation To   Ninth annual Brian Jordan Celebrity Golf Weekend on Oct. 24-26. Ninth annual Brian Jordan Celebrity Golf Weekend on Oct. 24-26. 11Alive Staff, WXIA 12:44 p.m. EDT October 23, 2015 ATLANTA - OCTOBER 05: Outfielder Brian Jordan #33 of the Atlanta Braves runs out on the field prior to taking on the Houston Astros in Game One of the 2005 National League Divison Series on October 5, 2005 at Turner Field in Atlanta, Georgia. The Astros defeated the Braves 10-5 to take a 1-0 series lead. (Photo by Brian Bahr/Getty Images) (Photo: Brian Bahr, Getty Images) CONNECT TWEET LINKEDIN COMMENT EMAIL MORE \nATLANTA -- Former Atlanta Brave and Atlanta Falcons player Brian Jordan is hosting multiple events around Atlanta to raise funds and awareness for the Brian Jordan Foundation. \nThe mission of the 501c3 non-profit organization is to discover the excellence in every child by creating and supporting programs for children and their families that will directly improve their quality of life. \nFor more info on Foundation or tournament, please visit www.BrianJordanFoundation.com . \nThe foundation is dedicated to building healthy minds, strong bodies and supporting places to grow. The goal of this year's weekend is to fully fund 16 college scholarships for deserving students. \nParticipants include Hall of Fame athletes such as Julius \"Dr. J\" Erving, Ozzie Smith, Tony Dorsett and Phil Niekro, as well as entertainers such as Stephen Bishop and musicians such as Matt Stillwell. \nSchedule of Events Saturday at 6:30 p.m. – Bowling 4 Literacy, Ping-Pong & Billiards Tournament (Dave & Busters) Sunday at 11 a.m. – Shotgun Start & Gourmet Lunch (Chateau Elan) Sunday at 7 p.m. – Dinner & Entertainment Monday at 11 a.m. – Shotgun Start & Gourmet Lunch and Dinner Read or Share this story: http://on.11alive.com/1LSbA99 TOP VIDEOS", "external_links": [], "published": "2015-10-23T19:44:00.000+03:00", "crawled": "2015-10-23T20:07:22.823+03:00", "highlightTitle": ""}