{"organizations": ["Rangers Outlast Blue Jays", "Texas Rangers", "Toronto Star Gripped", "Texas Ranger", "Toronto Blue Jays", "American League", "Blue Jays", "Rangers"], "uuid": "815f8e8965134f12d9f48085160160a3459cd9a5", "thread": {"social": {"gplus": {"shares": 0}, "pinterest": {"shares": 0}, "vk": {"shares": 0}, "linkedin": {"shares": 0}, "facebook": {"likes": 0, "shares": 0, "comments": 0}, "stumbledupon": {"shares": 0}}, "site_full": "www.onenewspage.com", "main_image": "http://cdn.newsserve.net/ONPglobe256.jpg", "site_section": "http://www.onenewspage.com/rss/latest/Sports.rss", "section_title": "Latest Sports News on One News Page", "url": "http://www.onenewspage.com/n/Sports/7559xw83q/Blue-Jays-advance-to-American-League-Championship-Series.htm", "country": "US", "title": "Blue Jays advance to American League Championship Series", "performance_score": 0, "site": "onenewspage.com", "participants_count": 0, "title_full": "Blue Jays advance to American League Championship Series", "spam_score": 0.0, "site_type": "news", "published": "2015-10-15T02:51:00.000+03:00", "replies_count": 0, "uuid": "815f8e8965134f12d9f48085160160a3459cd9a5"}, "author": "", "url": "http://www.onenewspage.com/n/Sports/7559xw83q/Blue-Jays-advance-to-American-League-Championship-Series.htm", "ord_in_thread": 0, "title": "Blue Jays advance to American League Championship Series", "locations": ["TORONTO", "Texas", "ARLINGTON", "Toronto"], "entities": {"persons": [], "locations": [], "organizations": []}, "highlightText": "", "language": "english", "persons": ["Hanser Alberto", "Martin Perez"], "text": "Blue Jays advance to American League Championship Series Wednesday, 14 October 2015 (8 minutes ago) The Toronto Blue Jays advanced Wednesday to the American League baseball championship series with a wild 6-3 victory over the Texas Rangers. Rangers Outlast Blue Jays Over 14 Innings to Move Within One Win of ALCS 00:56 Backup infielder Hanser Alberto singled home the go-ahead run in the 14th inning and the Texas Rangers beat the Toronto Blue Jays 6-4 Friday for a 2-0 lead in the best-of-five American League Division Series.The underdog Rangers will try to sweep the Blue Jays at home in Game 3 Sunday. Martin Perez... Recent related news Follow LIVE: Blue Jays take on Texas Rangers in Game 5 of the ALDS Follow live as the Toronto Blue Jays face the Texas Ranger in the series-deciding Game 5 of the ALDS. The winner will move on to the American League Championship... *By The Canadian Press* TORONTO — The Blue Jays keep breaking ratings records. Game 4 of Toronto's American League Division Series against the Texas... CJME 6 hours ago - World *By The Canadian Press* TORONTO — The Toronto Blue Jays' success on the field is helping them online. Toronto's surge into Major League Baseball's... CJME 13 hours ago - World *By The Canadian Press* ARLINGTON, Texas — After twice being on the brink of playoff extinction, the Blue Jays are now one win away from the American League... CJME 2 days ago - World Also reported by • Toronto Star Gripped by the Blue Jays' success, people huddled around TVs for an American League Championship Series nail-biter – but then we spoiled everything Globe and Mail 5 days ago - Lifestyle You Might Like Other recent news in Sports", "external_links": [], "published": "2015-10-15T02:51:00.000+03:00", "crawled": "2015-10-15T02:55:36.339+03:00", "highlightTitle": ""}