{"organizations": ["Sharks", "New York Islanders", "San Jose Sharks", "NHL", "AP", "Islanders"], "uuid": "d42ae29f19e35c4715d237b97b4da7842044ddfa", "thread": {"social": {"gplus": {"shares": 0}, "pinterest": {"shares": 0}, "vk": {"shares": 0}, "linkedin": {"shares": 0}, "facebook": {"likes": 0, "shares": 0, "comments": 0}, "stumbledupon": {"shares": 0}}, "site_full": "www.wftv.com", "main_image": "http://media.cmgdigital.com/shared/img/photos/2015/10/17/8d/0c/dccd27f252434c3f81111a57d5261634-46c5c07fb79147a5900bb66d8a4ca999-0.jpg", "site_section": "http://www.wftv.com/feeds/categories/sports/", "section_title": "News | Sports", "url": "http://www.wftv.com/ap/ap/sports/okposo-helps-islanders-hand-sharks-their-1st-loss-/nn5JX/", "country": "US", "title": "Okposo helps Islanders hand Sharks their 1st loss, 6-3", "performance_score": 0, "site": "wftv.com", "participants_count": 0, "title_full": "Okposo helps Islanders hand Sharks their 1st loss, 6-3", "spam_score": 0.0, "site_type": "news", "published": "2015-10-18T05:38:00.000+03:00", "replies_count": 0, "uuid": "d42ae29f19e35c4715d237b97b4da7842044ddfa"}, "author": "", "url": "http://www.wftv.com/ap/ap/sports/okposo-helps-islanders-hand-sharks-their-1st-loss-/nn5JX/", "ord_in_thread": 0, "title": "Okposo helps Islanders hand Sharks their 1st loss, 6-3", "locations": ["New York"], "entities": {"persons": [], "locations": [], "organizations": []}, "highlightText": "", "language": "english", "persons": ["Alex Stalock", "Joe Thornton", "Jaroslav Halak", "Mikhail Grabovski", "Joel Ward", "Nick Leddy", "Okposo", "Joe Pavelski"], "text": "Updated: 10:38 p.m. Saturday, Oct. 17, 2015 | Posted: 10:38 p.m. Saturday, Oct. 17, 2015 Okposo helps Islanders hand Sharks their 1st loss, 6-3 Related View Larger San Jose Sharks goalie Alex Stalock (32) defends the net against a penalty shot by New York Islanders center Mikhail Grabovski (84) during the first period of an NHL hockey game Saturday, Oct. 17, 2015 in New York. (AP Photo/Mary Altaffer) View Larger New York Islanders goalie Jaroslav Halak (41) and defenseman Nick Leddy (2) defend the net against a shot by San Jose Sharks center Joe Thornton (19) during the first period of an NHL hockey game Saturday, Oct. 17, 2015 in New York. (AP Photo/Mary Altaffer) View Larger New York Islanders goalie Jaroslav Halak (41) reacts as San Jose Sharks right wing Joel Ward (42) celebrates with his teammates after scoring a goal during the second period of an NHL hockey game, Saturday, Oct. 17, 2015 in New York. (AP Photo/Mary Altaffer) View Larger San Jose Sharks center Joe Pavelski (8) scores a goal past New York Islanders goalie Jaroslav Halak (41) and defenseman Nick Leddy (2) during the first period of an NHL hockey game Saturday, Oct. 17, 2015 in New York. (AP Photo/Mary Altaffer) Sponsored Links The Associated Press NEW YORK — \nKyle Okposo scored the tiebreaking goal early in the third period and added two assists as the New York Islanders beat San Jose 6-3 Saturday night, handing the Sharks their first loss of the season. \nJohnny Boychuk, Anders Lee, Josh Bailey, Brock Nelson and Frans Nielsen also scored to help the Islanders win their third straight — all at their new Brooklyn home. Jaroslav Halak made his season debut after missing the first four games due to an undisclosed upper body injury and finished with 22 saves. \nJoe Pavelski, Nikolay Goldobin and Joel Ward scored for San Jose, which opened the season 4-0-0. Alex Stalock stopped 28 shots. \nOn the go-ahead goal, Okposo got the the rebound of his own shot behind the net, skated around Sharks defender Brenden Dillon and beat Stalock to put the Islanders up for good. Copyright The Associated Press Sign up for our WFTV Morning News Headlines Newsletter Sign Up", "external_links": [], "published": "2015-10-18T05:38:00.000+03:00", "crawled": "2015-10-18T05:51:50.874+03:00", "highlightTitle": ""}