{"organizations": ["Toronto Star", "Sports Wallabies", "Front Page Bryan Habana", "Sports Bryan Habana", "Leicester Mercury Romania", "AP", "New Zealand Herald"], "uuid": "3ff8da3a2577fc582bd4b53dd9fc4e78bc7102e3", "thread": {"social": {"gplus": {"shares": 0}, "pinterest": {"shares": 0}, "vk": {"shares": 0}, "linkedin": {"shares": 0}, "facebook": {"likes": 0, "shares": 0, "comments": 0}, "stumbledupon": {"shares": 0}}, "site_full": "www.onenewspage.com", "main_image": "http://cdn.newsserve.net/ONPglobe256.jpg", "site_section": "http://www.onenewspage.com/rss/latest/Sports.rss", "section_title": "Latest Sports News on One News Page", "url": "http://www.onenewspage.com/n/Sports/7559xnc3g/Rugby-World-Cup-Scoring-Leaders.htm", "country": "US", "title": "Rugby World Cup Scoring Leaders", "performance_score": 0, "site": "onenewspage.com", "participants_count": 0, "title_full": "Rugby World Cup Scoring Leaders", "spam_score": 0.0, "site_type": "news", "published": "2015-10-10T02:46:00.000+03:00", "replies_count": 0, "uuid": "3ff8da3a2577fc582bd4b53dd9fc4e78bc7102e3"}, "author": "", "url": "http://www.onenewspage.com/n/Sports/7559xnc3g/Rugby-World-Cup-Scoring-Leaders.htm", "ord_in_thread": 0, "title": "Rugby World Cup Scoring Leaders", "locations": ["United States", "Uruguay", "England", "Wales", "Newcastle", "Tonga", "London", "Argentina", "LONDON", "Australia", "South Africa", "Japan", "New Zealand"], "entities": {"persons": [], "locations": [], "organizations": []}, "highlightText": "", "language": "english", "persons": ["Biggar", "Sanchez", "Bernard Foley", "Brian Habana", "Jonah Lomu", "Carter", "Drew Mitchell"], "text": "Rugby World Cup Scoring Leaders Friday, 9 October 2015 (3 minutes ago) 51_Nicolas Sanchez, Argentina (3 matches)46_Handre Pollard, South Africa (3)45_Ayumu Goromaru, Japan (3)41_Bernard Foley, Australia (2)36_Dan Biggar, Wales (2)36_Dan Carter, New Zealand (3)35_Owen Farrell, England (3)34_Greig... LIVE scoring and interactive commentary on the Rugby World Cup match between New Zealand and Tonga in Newcastle. News24 11 hours ago - Sports Wallabies winger Drew Mitchell is \"lethal\" with the ball and deserves to be mentioned alongside World Cup try-scoring freaks Jonah Lomu and Brian Habana. The Age 18 hours ago - Front Page Also reported by • Leicester Mercury Romania winning a game and Uruguay scoring a try prove that there is much more to the tournament than England’s catastrophic failure to progress from their... guardian.co.uk 2 days ago - Sports Bryan Habana equalled Jonah Lomu's World Cup try-scoring record as he led South Africa into the quarter-finals with a crushing victory over the United States at... The Age 2 days ago - Front Page Bryan Habana equalled Jonah Lomu's World Cup try-scoring record as he led South Africa into the quarter-finals with a crushing victory over the United States at... MailOnline 2 days ago - Sports Rugby World Cup-Winning Coach and Long-Time Player Will Address Business Leaders at Event Jan. 19-20 in London Marketwired 3 days ago - Press Releases Bernard Foley orchestrated England’s demise, scoring all but five of Australia’s points in a 33-13 win on Saturday. Toronto Star 6 days ago - Sports LONDON (AP) \" Bernard Foley orchestrated England's demise at the Rugby World Cup, scoring all but five of Australia's points in a 33-13 win on Saturday that... New Zealand Herald 6 days ago - Sports You Might Like", "external_links": [], "published": "2015-10-10T02:46:00.000+03:00", "crawled": "2015-10-10T02:48:31.454+03:00", "highlightTitle": ""}