{"organizations": ["Bisons", "Dolphins", "NJIT", "UNF", "Preseason Honors North Florida Athletics Full Preseason All-Conference Team", "KSU", "Eagles", "Highlanders", "FGCU", "Atlantic Sun Men"], "uuid": "42439531dc5fe429e2f0eab552500e9603a3d7df", "thread": {"social": {"gplus": {"shares": 0}, "pinterest": {"shares": 0}, "vk": {"shares": 0}, "linkedin": {"shares": 0}, "facebook": {"likes": 0, "shares": 0, "comments": 0}, "stumbledupon": {"shares": 0}}, "site_full": "www.unfospreys.com", "main_image": "", "site_section": "http://www.firstcoastnews.com/rss/rss_sportsunf.aspx", "section_title": "UNF Ospreys Sports", "url": "http://www.unfospreys.com/news/2015/10/8/MBB_1008153050.aspx", "country": "US", "title": "Ospreys Swoop Up @ASunMBB Preseason Honors", "performance_score": 0, "site": "unfospreys.com", "participants_count": 0, "title_full": "Ospreys Swoop Up @ASunMBB Preseason Honors", "spam_score": 0.0, "site_type": "news", "published": "2015-10-08T17:07:00.000+03:00", "replies_count": 0, "uuid": "42439531dc5fe429e2f0eab552500e9603a3d7df"}, "author": "", "url": "http://www.unfospreys.com/news/2015/10/8/MBB_1008153050.aspx", "ord_in_thread": 0, "title": "Ospreys Swoop Up @ASunMBB Preseason Honors", "locations": ["Fla.", "Jacksonville", "North Florida", "Kennesaw", "Kennesaw State", "MACON", "Atlantic Sun Preseason", "St. Petersburg", "Ga."], "entities": {"persons": [], "locations": [], "organizations": []}, "highlightText": "", "language": "english", "persons": ["Yonel Brown", "Dallas Moore", "Lipscomb", "Driscoll", "Chris Davenport", "Demarcus Daniels", "Stetson"], "text": "Ospreys Swoop Up @ASunMBB Preseason Honors North Florida Athletics Full Preseason All-Conference Team and Polls | Preseason All-Conference Video MACON, Ga. - North Florida enters the 2015-16 Atlantic Sun Men's Basketball season as the favorites to capture the league crown after garnering first place in both preseason coaches' and media polls, announced Thursday by the league office.\"We are very humbled and honored to receive this vote of confidence from our peers and media,\" said seventh-year head coach . \"We completely understand the selection but also know from doing this for a long time that reality occurs in March.\" The Ospreys also collected both individual preseason honors as Chris Davenport . \"To have four guys on the all-league team plus the Player of the Year and Defensive Player of the Year, shows our work and efforts have come to fruition,\" added Driscoll. \"It is amazing to see the progress the program has made in a relatively short amount of time. Program development is critical to sustained success and our having three players 6'7\" or taller named to the all-conference team is a reflection of that. We believe that their probably isn't another team from any conference that can make that same claim.\" The regular season and tournament champions from 2014-15, UNF secured seven of the eight first place votes in the coaches' poll, while picking up 24 of the 31 first place votes in the media poll. FGCU came in second in both polls, as the Eagles collected the final first place vote in the coaches' poll and six first place nods in the media poll. League newcomer NJIT earned the final first place vote in the media poll.NJIT and Lipscomb split third and fourth place in each poll, with the Highlanders picked third in the coaches poll and the Bisons picked third in the media poll. Jacksonville and USC Upstate followed in fifth and sixth in the coaches' poll. Kennesaw State and Stetson were tied for seventh to round out the selections by the league's head coaches. In the media poll, the Spartans and Dolphins flipped positions, with KSU coming in seventh and Stetson eighth. 2015-16 Atlantic Sun Preseason All-Conference Team (* - Denotes unanimous selection) - Beau Beech , North Florida*: The Preseason Player of the Year returns after being first team All-Conference last season. Beech was North Florida's leading scorer in A-Sun play at 15.9 PPG and ranked second in the A-Sun with 89 made three-pointers. He reached double-figures in 23 games, including five games with 20 or more points to help the Ospreys win their first-ever conference regular season and tournament titles and an NCAA appearance. - Dallas Moore , North Florida*: The junior guard from St. Petersburg, Fla. is a 2014-15 first team All-Conference returning starter for the Ospreys. Finished last season as UNF's leading scorer at 15.8 PPG, third most in the A-Sun. Averaged 3.7 assists per game during the season, including 4.4 in league play. Finished season with 28 double-figure scoring games, while scoring 20 or more points in 13 games. - Demarcus Daniels , North Florida: The 2014-15 A-Sun Defensive Player of the Year returns as the Preseason pick by the coaches to repeatthat honor. Was named the A-Sun Tournament MVP last season. Grabbed 5.9 rebounds per game, which ranked in the top-10 in the A-Sun. Shot 51.1 percent from the field in conference play. Swatted a UNF single-season record 55 shots last season to surpass 100 career blocks. - Chris Davenport , North Florida: Led the Ospreys in rebounding and scoring last year on their way to an NCAA Tournament appearance. Averaged 11.3 PPG and 6.5 RPG last season. Made 54.7 percent of field goals in conference play, which ranked second in the league. Posted double-figures in 20 games for the Ospreys. - Yonel Brown, Kennesaw State", "external_links": [], "published": "2015-10-08T17:07:00.000+03:00", "crawled": "2015-10-09T01:55:06.371+03:00", "highlightTitle": ""}