{"organizations": ["Huntingdon College", "Methodist Huntingdon"], "uuid": "7c60ca3cfc50730c40db7e7c07a71e884e756ba2", "thread": {"social": {"gplus": {"shares": 0}, "pinterest": {"shares": 0}, "vk": {"shares": 0}, "linkedin": {"shares": 0}, "facebook": {"likes": 0, "shares": 0, "comments": 0}, "stumbledupon": {"shares": 0}}, "site_full": "www.montgomeryadvertiser.com", "main_image": "http://www.gannett-cdn.com/-mm-/70730952a949cbb12658e3be044be55cc631e222/c=0-100-2400-1456&amp;r=x1683&amp;c=3200x1680/local/-/media/2015/10/24/Montgomery/Montgomery/635813125685195664-102415HuntingdonVsMethodist01.jpg", "site_section": "http://rssfeeds.montgomeryadvertiser.com/montgomery/huntingdonsports", "section_title": "Montgomery - Huntingdon Sports", "url": "http://www.montgomeryadvertiser.com/picture-gallery/sports/college/huntingdon-college/2015/10/24/huntingdon-vs-methodist/74558906/", "country": "US", "title": "Huntingdon vs. Methodist", "performance_score": 0, "site": "montgomeryadvertiser.com", "participants_count": 0, "title_full": "Huntingdon vs. Methodist", "spam_score": 0.0, "site_type": "news", "published": "2015-10-25T01:44:00.000+02:00", "replies_count": 0, "uuid": "7c60ca3cfc50730c40db7e7c07a71e884e756ba2"}, "author": "", "url": "http://www.montgomeryadvertiser.com/picture-gallery/sports/college/huntingdon-college/2015/10/24/huntingdon-vs-methodist/74558906/", "ord_in_thread": 0, "title": "Huntingdon vs. Methodist", "locations": ["Ala", "Montgomery", "Huntingdon"], "entities": {"persons": [], "locations": [], "organizations": []}, "highlightText": "", "language": "english", "persons": ["Trey Collins", "Damarco Smith", "Anthony Radke", "Zayd Stivender", "Anthony White", "Kris Cannon", "James Clyde", "Jake Green", "Dylan DeGroot", "Demetrius Brown", "Luke Bailey", "Nick Haas", "Albert Cesare", "Trey Hayes", "Chael Pridgen", "Jordan Smith", "Jarren Jones", "Dylan Cummings"], "text": "Huntingdon vs. Methodist Buy Photo Huntingdon defensive back Anthony White returns an interception for a touchdown during the game between Huntingdon and Methodist on Saturday, Oct. 24, 2015 at Huntingdon College in Montgomery, Ala. Albert Cesare / Advertiser Fullscreen Buy Photo Methodist's Malike Freeman (81) runs downfield during the game between Huntingdon and Methodist on Saturday, Oct. 24, 2015 at Huntingdon College in Montgomery, Ala. Albert Cesare / Advertiser Fullscreen Buy Photo Huntingdon kicker Trey Collins (19) and defensive back Jordan Smith tackle Methodist linebacker Zayd Stivender during the game between Huntingdon and Methodist on Saturday, Oct. 24, 2015 at Huntingdon College in Montgomery, Ala. Albert Cesare / Advertiser Fullscreen Buy Photo Huntingdon quarterback Luke Bailey breaks a tackle attempt by Methodist's defensive back James Clyde during the game between Huntingdon and Methodist on Saturday, Oct. 24, 2015 at Huntingdon College in Montgomery, Ala. Albert Cesare / Advertiser Fullscreen Buy Photo Huntingdon wide receiver Nick Haas (13) celebrates with offensive lineman Chael Pridgen during the game between Huntingdon and Methodist on Saturday, Oct. 24, 2015 at Huntingdon College in Montgomery, Ala. Albert Cesare / Advertiser Fullscreen Buy Photo Huntingdon linebacker Jake Green (20) tackles Methodist wide receiver Damarco Smith during the game between Huntingdon and Methodist on Saturday, Oct. 24, 2015 at Huntingdon College in Montgomery, Ala. Albert Cesare / Advertiser Fullscreen Buy Photo Huntingdon defensive back Anthony White returns an interception for a touchdown during the game between Huntingdon and Methodist on Saturday, Oct. 24, 2015 at Huntingdon College in Montgomery, Ala. Albert Cesare / Advertiser Fullscreen Buy Photo Huntingdon defensive back Demetrius Brown (17) tackles Methodist quarterback Dylan Cummings during the game between Huntingdon and Methodist on Saturday, Oct. 24, 2015 at Huntingdon College in Montgomery, Ala. Albert Cesare / Advertiser Fullscreen Buy Photo Methodist quarterback Dylan DeGroot throws a pass as Huntingdon linebacker Trey Hayes pressures him during the game between Huntingdon and Methodist on Saturday, Oct. 24, 2015 at Huntingdon College in Montgomery, Ala. Albert Cesare / Advertiser Fullscreen Buy Photo Methodist wide receiver Anthony Radke juggles a pass during the game between Huntingdon and Methodist on Saturday, Oct. 24, 2015 at Huntingdon College in Montgomery, Ala. Albert Cesare / Advertiser Fullscreen Buy Photo Huntingdon defensive lineman Kris Cannon tackles Methodist running back Emontie Dears during the game between Huntingdon and Methodist on Saturday, Oct. 24, 2015 at Huntingdon College in Montgomery, Ala. Albert Cesare / Advertiser Fullscreen Buy Photo Huntingdon defensive lineman Jarren Jones tackles Methodist wide receiver Damarco Smith during the game between Huntingdon and Methodist on Saturday, Oct. 24, 2015 at Huntingdon College in Montgomery, Ala. Albert Cesare / Advertiser Fullscreen Buy Photo Huntingdon defensive back Anthony White returns an interception for a touchdown during the game between Huntingdon and Methodist on Saturday, Oct. 24, 2015 at Huntingdon College in Montgomery, Ala. Albert Cesare / Advertiser Like this topic? You may also like these photo galleries: Replay", "external_links": [], "published": "2015-10-25T01:44:00.000+02:00", "crawled": "2015-10-25T12:31:42.748+02:00", "highlightTitle": ""}