{"organizations": ["Reds", "Cubs", "U.S. Border Patrol", "Senate", "Reds Jackson", "Eau Claire", "State Police"], "uuid": "1bc19a178c71d0126046f66af17321f2c09191a0", "thread": {"social": {"gplus": {"shares": 0}, "pinterest": {"shares": 0}, "vk": {"shares": 0}, "linkedin": {"shares": 0}, "facebook": {"likes": 0, "shares": 0, "comments": 0}, "stumbledupon": {"shares": 0}}, "site_full": "www.wqow.com", "main_image": "", "site_section": "http://www.WQOW.com/Global/category.asp?C=13566&clienttype=rss", "section_title": "WQOW TV News 18 - National Sports - Headline", "url": "http://www.wqow.com/story/30165501/jackson-homer-leads-cubs-to-5-3-win-over-reds", "country": "US", "title": "Jackson homer leads Cubs to 5-3 win over Reds", "performance_score": 0, "site": "wqow.com", "participants_count": 0, "title_full": "Jackson homer leads Cubs to 5-3 win over Reds", "spam_score": 0.0, "site_type": "news", "published": "2015-10-01T23:09:00.000+03:00", "replies_count": 0, "uuid": "1bc19a178c71d0126046f66af17321f2c09191a0"}, "author": "", "url": "http://www.wqow.com/story/30165501/jackson-homer-leads-cubs-to-5-3-win-over-reds", "ord_in_thread": 0, "title": "Jackson homer leads Cubs to 5-3 win over Reds", "locations": ["Oregon", "Oklahoma", "Napa Valley"], "entities": {"persons": [], "locations": [], "organizations": []}, "highlightText": "", "language": "english", "persons": ["Mary Fallin", "Richard Glossip", "Bill Fugate", "Jackson"], "text": "Jackson homer leads Cubs to 5-3 win over Reds - WQOW TV: Eau Claire, WI NEWS18 News, Weather, and Sports Member Center:   Senators reach deal to reduce prison time for some offenders Some non-violent drug offenders could get reduced prison sentences under a bipartisan Senate package that would overhaul the criminal justice system and encourage rehabilitation. More >> Senate conservatives and liberals on Thursday united behind an overhaul of the criminal justice system, a rare bipartisan agreement that would allow some nonviolent drug offenders to get reduced prison sentences and give... More >> Oklahoma asks to delay executions after getting wrong drug Oklahoma death row inmate Richard Glossip was just minutes away from his scheduled lethal injection, stripped of all his belongings in a holding cell just a few feet from the state's death chamber, when he... More >> Oklahoma's attorney general on Thursday asked a court to delay all scheduled executions while the state reviews how it received the wrong drug as it prepared to lethally inject an inmate. More >> The Latest: Women thrown off train say they were humiliated The latest on a group of black women filing a lawsuit over their ejection from a Napa Valley Wine Train (All times local): More >> The latest on a group of black women filing a lawsuit over their ejection from a Napa Valley Wine Train (All times local): More >> Gunman opens fire at Oregon community college, killing 7 At least seven people were killed and 20 injured Thursday in a shooting at a southwestern Oregon community college, State Police Lt. Bill Fugate said. More >> A gunman opened fire at an Oregon community college Thursday, killing at least seven people and wounding 20, authorities said. More >> The Latest: Men convicted of murder in Fast and Furious case The latest developments in the murder trial of two men charged in the death of a U.S. Border Patrol agent whose death exposed the botched Fast and Furious gun-tracking operation (all times local): More >> The latest developments in the murder trial of two men charged in the death of a U.S. Border Patrol agent whose death exposed the botched Fast and Furious gun-tracking operation (all times local): More >> Black women booted from Napa Valley wine train file lawsuit A group of mostly black women filed a racial discrimination lawsuit Thursday after they were removed from a train that tours Napa Valley wineries, saying it was humiliating to be thrown off a rail car when loud and... More >> A group of mostly black women filed a racial discrimination lawsuit Thursday after they were removed from a train that tours Napa Valley wineries, saying it was humiliating to be thrown off a rail car when loud and... More >> The Latest: Oklahoma seeks to delay 3 executions amid probe The latest on the confusion over Oklahoma's supply of lethal injection drugs, which prompted Gov. Mary Fallin to issue a last-minute execution stay for Richard Glossip (all times local): More >> The latest on the confusion over Oklahoma's supply of lethal injection drugs, which prompted Gov. Mary Fallin to issue a last-minute execution stay for Richard Glossip (all times local): More >>", "external_links": [], "published": "2015-10-01T23:09:00.000+03:00", "crawled": "2015-10-01T23:34:26.337+03:00", "highlightTitle": ""}