{"organizations": ["Camden Catholic", "Red Bank", "South Jersey Group", "West Morris", "Minutemen", "Jaguars", "DePaul"], "uuid": "042bdcec5934c61ded238b6137e40ccaff13cceb", "thread": {"social": {"gplus": {"shares": 0}, "pinterest": {"shares": 0}, "vk": {"shares": 0}, "linkedin": {"shares": 0}, "facebook": {"likes": 0, "shares": 0, "comments": 0}, "stumbledupon": {"shares": 0}}, "site_full": "njvarsity.rivals.com", "main_image": "", "site_section": "http://www.rivals.com/rss2feed.asp?type=HS&state=NJ", "section_title": "New Jersey High School Sports Headlines", "url": "https://njvarsity.rivals.com/content.asp?CID=1812056", "country": "US", "title": "Games Of The Week In New Jersey", "performance_score": 0, "site": "rivals.com", "participants_count": 0, "title_full": "Games Of The Week In New Jersey", "spam_score": 0.0, "site_type": "news", "published": "2015-10-09T07:00:00.000+03:00", "replies_count": 0, "uuid": "042bdcec5934c61ded238b6137e40ccaff13cceb"}, "author": "", "url": "https://njvarsity.rivals.com/content.asp?CID=1812056", "ord_in_thread": 0, "title": "Games Of The Week In New Jersey", "locations": ["Pascack Valley", "Raritan", "Matawan", "Middletown North", "Salem", "Ridge", "Toms River North", "Florence", "Hopatcong", "Voorhees", "Ridgefield Park", "North Warren", "Manasquan", "Old Tappan", "Williamstown", "Milford", "Glen Rock", "Lenape", "Ramapo", "New Brunswick", "Haddonfield", "Woodstown", "Freehold Boro", "Wayne Hills", "New Jersey", "Lenape Valley", "Hawthorne"], "entities": {"persons": [], "locations": [], "organizations": []}, "highlightText": "", "language": "english", "persons": ["Mike Husni", "Eric Smith", "Mike Celli", "Rich Fritzky", "Bo Bentley", "Raritan", "Joe O'Hagan", "Wakeem Brooks", "Austin Ostrander", "Jackson", "Eric Nickel", "Evan Powell", "Don Bosco", "Donato Casolaro", "Jon Lovatt", "Darrion Carrington", "Rory DeLuca", "Jahmin Muse", "Steve Leyden", "Sadiq Palmer", "Matt Alesandro", "Ramapo", "Joe Kenny", "Danny Barker", "Jaquill Burch", "Tyrick Glenn", "Ricky Wild", "Brandon DeVera", "Derek Ernst", "Wayne Hills", "Elizabeth", "Keith Woetzel"], "text": "Games Of The Week In New Jersey Pat PJR Rice Talk about it in the njvarsity Message Boards Williamstown (4-0) at Cherokee (2-1), Friday night. One of the top public school matchups in New Jersey, with Cherokee winning South Jersey Group 5 the last two years and Williamstown in 2012. Williamstown has posted shutouts in their last two games and OLB Tyrick Glenn and DE Eric Smith are among those making plays. Cherokee has QB/OLB Evan Powell and RB/DB Jon Lovatt leading them and are coming off a bye. Jackson (3-1) at Toms River North (3-1), Friday night. Jackson is coming off a tough, 2-0 loss to Brick. The Jaguars have allowed 12 points in their four games, including last week's losing safety. They have received good quarterback play from Danny Barker, while Austin Ostrander supplies good two way play on the line. Toms River North can put up points and feature QB Mike Husni and WR Darrion Carrington. Ramapo (3-1) at Wayne Hills (4-1), Friday night. This is a big rivalry game and the winner is in good shape for the playoffs. Ramapo's only loss was a heartbreaker to Old Tappan. They're led by QB Keith Woetzel and RB/DB Joe O'Hagan. Wayne Hills lost their first last week to Pascack Valley in a close one. LB/TE Joe Kenny is a man among boys, while the passing of Brandon DeVera has opened a new dimension to the offense. Bridgewater-Raritan (4-0) at Elizabeth (4-0), Friday night. Two undefeated teams in the Mid-State 38 square off. Elizabeth features WR Jahmin Muse, who has been filling in at quarterback for the injured Jaquill Burch. One player to watch is two way lineman Wakeem Brooks. The Minutemen have been in some close games, keeping things close to the vest. Bridgewater-Raritan features QB Eric Nickel, who can run and pass. They also have a good defense, getting good play from LB Mike Celli and DL Matt Alesandro. Red Bank (4-0) at Raritan (3-0), Friday night. Red Bank has an experienced team and a defense that's allowed 20 points. Their offense features WR Sadiq Palmer and OL Ricky Wild leads is part of an experienced line. Raritan outscored three quality programs in Manasquan, Matawan, and Freehold Boro, 100-17. Their offense revolves around RB Derek Ernst and Bo Bentley is one of the guys blocking up front. Hanover Park (4-0) at Lenape Valley (4-0), Friday night. Hanover Park has outscored the opposition, 160-22 and had three touchdowns each from RB Rory DeLuca and QB Donato Casolaro. Hanover Park has not been challenged yet, while Lenape Valley has been in competitive games. Lenape Valley has outscored opponents, 100-49, and feature the running of Steve Leyden and the two way line play of Rich Fritzky. Other Games To See: Camden (3-1) at Camden Catholic (4-0), Friday nightPennsville (4-0) at Salem (4-0), Saturday 12PMWoodbury (3-0) at Haddonfield (3-1). Friday nightGlassboro (2-2) at Woodstown (2-2), Friday nightPalmyra (2-1) at Florence (2-2), Friday nightPoint Pleasant Boro (4-0) at Central Regional (3-2), Friday nightAllentown (2-2) at Lenape (3-0), Friday nightOld Bridge (3-1) at Brick Memorial (3-1), Friday nightOcean (3-1) at Middletown North (3-1), Friday nightWoodbridge (4-0) at New Brunswick (4-0), Friday nightWestfield (3-0) at Ridge (3-1), Friday nightCranford (4-0) at Voorhees (3-0), Friday nightBergen Catholic (3-2) at DePaul (1-3), Friday nightParamus Catholic (1-3) at Don Bosco (3-1), Friday nightRoxbury (4-0) at West Morris (3-1), Friday nightBoonton (4-0) at North Warren (4-0), Friday nightPequannock (3-1) at Hopatcong (2-2), Friday nightIndian Hills (5-0) at Old Tappan (4-0), Friday 6PMPompton Lakes (3-1) at Hawthorne (3-1), Friday nightNew Milford (2-2) at Glen Rock (3-1), Friday nightPascack Hills (3-1) at Ridgefield Park (4-1), Friday nightBecton (3-1) at Cresskill (3-1), Friday night FEATURED PRODUCT", "external_links": [], "published": "2015-10-09T07:00:00.000+03:00", "crawled": "2015-10-09T09:29:27.374+03:00", "highlightTitle": ""}