{"organizations": ["Colts Boston.com Staff", "New York Daily News", "HBO Elizabeth Banks", "Colts", "Disney"], "uuid": "582aa41b2c796dad8eb858a4c54d40b34c3ac168", "thread": {"social": {"gplus": {"shares": 0}, "pinterest": {"shares": 0}, "vk": {"shares": 0}, "linkedin": {"shares": 0}, "facebook": {"likes": 0, "shares": 0, "comments": 0}, "stumbledupon": {"shares": 0}}, "site_full": "www.boston.com", "main_image": "http://p.o0bc.com/rf/image_1200x628/Boston/2011-2020/2015/09/04/Boston.com/Sports/Images/brady-senior[1].jpg", "site_section": "http://syndication.boston.com/sports/other_sports?mode=rss_10", "section_title": "Other Sports - Boston.com", "url": "http://www.boston.com/sports/football/patriots/2015/10/18/tom-brady-hopes-patriots-score-points-agains-colts/j2oDOWltminFIdeZ486CXL/story.html", "country": "US", "title": "Tom Brady Sr. hopes Patriots score 60 points against Colts", "performance_score": 0, "site": "boston.com", "participants_count": 0, "title_full": "Tom Brady Sr. hopes Patriots score 60 points against Colts", "spam_score": 0.0, "site_type": "news", "published": "2015-10-19T01:56:00.000+03:00", "replies_count": 0, "uuid": "582aa41b2c796dad8eb858a4c54d40b34c3ac168"}, "author": "", "url": "http://www.boston.com/sports/football/patriots/2015/10/18/tom-brady-hopes-patriots-score-points-agains-colts/j2oDOWltminFIdeZ486CXL/story.html", "ord_in_thread": 0, "title": "Tom Brady Sr. hopes Patriots score 60 points against Colts", "locations": ["Pittsfield"], "entities": {"persons": [], "locations": [], "organizations": []}, "highlightText": "", "language": "english", "persons": ["Robin Marchant", "Charles Krupa", "Brady Sr.", "Casey Affleck", "Tom", "Jamie Trueblood", "Scott Eisen", "Rob Gronkowski", "Gisele Bundchen", "Brady", "Ben Affleck", "Batman", "Ben", "Chris Pizzello", "Fernanda Calfat", "Vinnie Papale", "Jane Rosenberg", "Tom Brady", "Steve Buscemi", "Buscemi", "Affleck", "David Lee", "Julian Edelman", "Gary Myers"], "text": "Boston.com Staff | 10.18.15 | 4:33 PM Tom Brady Sr. hopes his son can just keep the points coming. Like many Patriots fans, the father of the team’s quarterback hopes the team can run up the score against the Colts on Sunday. The highly anticpated clash is a rematch of the most recent AFC Championship Game, the contest that sparked the months-long Deflategate scandal. “The main thing I want is to see them win. As long as they have one point more than the Colts, I’m fine,” Brady Sr. told Gary Myers of the New York Daily News . “That being said, I’d like to see them put 60 points on the board, and love to see Tom throw for 500 yards and eight touchdowns. That’s me dreaming. That kind of comes from me.” Advertisement - Continue Reading Below In 2012, the Patriots put up 59 points against the Colts. Brady threw for 331 yards and three touchdowns in that game. While the Patriots may have some extra motivation on Sunday, Brady Sr. says he always wants them to score that many points . “I want to put 60 points on the board every game,” Brady Sr. added . Casting Deflategate: The Movie Ben Affleck as Tom Brady: If Ben can don Batman's cape and cowl, the \"Good Will Hunting\" co-conspiritor has as good a shot as anyone at filling the No. 12 jersey. and Chris Pizzello / AP Steve Buscemi as Tom Brady Sketch: If Buscemi is the first actor to audition for the role of Brady Sketch 1, then all others would be sent home immediately. Sketch by Jane Rosenberg (left) / Photo courtesy HBO Elizabeth Banks as Gisele Bundchen: The Pittsfield native's role as Vinnie Papale's love interest in Disney's \"Invincible\"certainly gives Banks the leg up for the highly coveted role as Tom Brady's supermodel wife. Fernanda Calfat / Getty (left) and Jamie Trueblood / AP Rob Gronkowski as Rob Gronkowski: There is only one Gronk. Accept no immitations. Robin Marchant / Getty (left) and Charles Krupa / AP Casey Affleck as Julian Edelman: The younger Affleck makes perfect sense to take on the role as Tom Brady's favorite receiver and superpal Julian Edelman. Scott Eisen / Getty (left) amd David Lee / Universal Pictures", "external_links": [], "published": "2015-10-19T01:56:00.000+03:00", "crawled": "2015-10-19T02:50:31.967+03:00", "highlightTitle": ""}