{"organizations": ["Colorado Christian", "Ridge Golf Club", "Skyhawks", "Fort Lewis College", "Rocky Mountain Athletic Conference South Invitational"], "uuid": "f9efa58de92bdad371edc73f164d08139d4c7dd7", "thread": {"social": {"gplus": {"shares": 0}, "pinterest": {"shares": 0}, "vk": {"shares": 0}, "linkedin": {"shares": 0}, "facebook": {"likes": 0, "shares": 0, "comments": 0}, "stumbledupon": {"shares": 0}}, "site_full": "www.durangoherald.com", "main_image": "http://durangoherald.com/storyimage/DU/20151013/SPORTS02/151019854/AR/0/AR-151019854.jpg", "site_section": "http://www.durangoherald.com/section/sports?template=RSS&mime=xml", "section_title": "Sports", "url": "http://www.durangoherald.com/article/20151013/SPORTS02/151019854/-1/sports&source=RSS", "country": "US", "title": "Strong trip for Fort Lewis College golfers", "performance_score": 0, "site": "durangoherald.com", "participants_count": 0, "title_full": "Strong trip for Fort Lewis College golfers", "spam_score": 0.0, "site_type": "news", "published": "2015-10-14T05:59:00.000+03:00", "replies_count": 0, "uuid": "f9efa58de92bdad371edc73f164d08139d4c7dd7"}, "author": "", "url": "http://www.durangoherald.com/article/20151013/SPORTS02/151019854/-1/sports&source=RSS", "ord_in_thread": 0, "title": "Strong trip for Fort Lewis College golfers", "locations": ["New Mexico"], "entities": {"persons": [], "locations": [], "organizations": []}, "highlightText": "", "language": "english", "persons": ["Isabella Martinez", "Matt Huntley", "Judith Camacho", "Dillon Washburn", "Michael Thomas", "Lindsey Blythe", "Lauren Trujillo", "Mitch Donley", "Jessica Thulson", "Colin Prater", "Huntley", "Thulson", "Brooke Schultz", "Ryan Tanner", "Nathaniel Goddard"], "text": "Strong trip for Fort Lewis College golfers Strong trip for Fort Lewis College golfers FLC men finish in middle of pack Herald Staff Report Tweet I t was a strong trip to New Mexico for the Fort Lewis College golf programs. The men’s team finished in the middle of the 15-team pack at the Rocky Mountain Athletic Conference South Invitational at Paa-ko Ridge Golf Club with a total score of 74-over 938 after three rounds. That was good for seventh, 33 strokes behind champion UC-Colorado Springs, who was led by co-individual champion Colin Prater, who shot a 1-under 71 Tuesday to finish at 1 over. He tied Nathaniel Goddard of Colorado Christian. The FLC men’s team was led by Matt Huntley, who shot 11 over through three rounds. After shooting even par in the first round, Huntley fired an 8-over 80 in the second round and 3-over 75 in the final round Tuesday. He finished in a tie for seventh overall. FLC’s Dillon Washburn, played well enough Monday to overcome an 81 in the final round and still tie for 14th at 16 over. Michael Thomas finished in a tie for 21st for the FLC men. Her shot 75 Tuesday to get to 18 over. FLC’s Mitch Donley finished alone in 52nd at 29 over, and Ryan Tanner rounded out the squad at 44 over, good for a tie for 72nd. The Skyhawks’ women played a strong tournament, led by Jessica Thulson. Thulson finished alone in ninth place after shooting 76 Tuesday. That put her at 11 over after two rounds. She helped the Skyhawks finish 13th out of 15 teams with a scored of 721, 145-over-par. Midwestern State won the women’s tournament at 30-over 606. FLC’s Isabella Martinez finished in a tie for 50th at 31 over, Brooke Schultz finished in a three-way tie for 69th at 48 over; Lindsey Blythe was alone in 74th at 56 over; Lauren Trujillo took 75th and 58 over; and Judith Camacho finished 77th out of 79 golfers at 63 over.", "external_links": [], "published": "2015-10-14T05:59:00.000+03:00", "crawled": "2015-10-14T13:08:25.909+03:00", "highlightTitle": ""}