{"organizations": ["TCF Bank Stadium", "San Diego Chargers", "Associated Press", "Minnesota Vikings", "LinkedIn Pinterest Vikings", "Facebook Email Twitter Google", "Vikings", "Facebook Vikings", "AP"], "uuid": "17ca16b7093ddcefc2b0ff741866a3df7c85d651", "thread": {"social": {"gplus": {"shares": 0}, "pinterest": {"shares": 0}, "vk": {"shares": 0}, "linkedin": {"shares": 0}, "facebook": {"likes": 0, "shares": 0, "comments": 0}, "stumbledupon": {"shares": 0}}, "site_full": "www.kare11.com", "main_image": "http://www.gannett-cdn.com/-mm-/489efad1142179deef9ce5ef3cf126cd99e1a3f1/r=x633&amp;c=1200x630/http/cdn.tegna-tv.com/-mm-/6e6c617af3fb535666968e22e3f6f875d6db0cd8/c=0-172-1164-830/local/-/media/2015/10/12/KARE/KARE/635802707571160488-USATSI-8837174-114815493-lowres.jpg", "site_section": "http://rssfeeds.kare11.com/_/20/109037342/KARE/sports", "section_title": "KARE - Sports", "url": "http://www.kare11.com/story/sports/nfl/vikings/2015/10/12/vikings-rookie-lb-kendricks-earns-starting-job/73840936/", "country": "US", "title": "Vikings rookie LB Kendricks earns starting job", "performance_score": 0, "site": "kare11.com", "participants_count": 0, "title_full": "Vikings rookie LB Kendricks earns starting job", "spam_score": 0.0, "site_type": "news", "published": "2015-10-13T01:20:00.000+03:00", "replies_count": 0, "uuid": "17ca16b7093ddcefc2b0ff741866a3df7c85d651"}, "author": "", "url": "http://www.kare11.com/story/sports/nfl/vikings/2015/10/12/vikings-rookie-lb-kendricks-earns-starting-job/73840936/", "ord_in_thread": 0, "title": "Vikings rookie LB Kendricks earns starting job", "locations": ["USA", "Minn.", "Minneapolis", "EDEN PRAIRIE"], "entities": {"persons": [], "locations": [], "organizations": []}, "highlightText": "", "language": "english", "persons": ["Eric", "Eric Kendricks", "Kendricks", "Eric Post"], "text": "Facebook Email Twitter Google+ LinkedIn Pinterest Vikings rookie LB Kendricks earns starting job EDEN PRAIRIE, Minn. (AP) - While most of his Minnesota Vikings teammates got a nice long break during their bye week, rookie linebacker Eric Post to Facebook Vikings rookie LB Kendricks earns starting job EDEN PRAIRIE, Minn. (AP) - While most of his Minnesota Vikings teammates got a nice long break during their bye week, rookie linebacker Eric   kare11.com: http://www.kare11.com/story/sports/nfl/vikings/2015/10/12/vikings-rookie-lb-kendricks-earns-starting-job/73840936/   Join the Conversation To   Vikings rookie LB Kendricks earns starting job Associated Press, Associated Press 6:20 p.m. EDT October 12, 2015 Sep 27, 2015; Minneapolis, MN, USA; Minnesota Vikings linebacker Eric Kendricks (54) against the San Diego Chargers at TCF Bank Stadium. The Vikings defeated the Chargers 31-14. (Photo: Brace Hemmelgarn-USA TODAY Sports) CONNECT TWEET LINKEDIN COMMENT EMAIL MORE \nEDEN PRAIRIE, Minn. (AP) - While most of his Minnesota Vikings teammates got a nice long break during their bye week, rookie linebacker Eric Kendricks got a promotion. \nThe Vikings decided to trade starting middle linebacker Gerald Hodges to San Francisco last week for a backup offensive lineman and a late-round draft pick. The move opened a spot for Kendricks, a second-round draft pick out of UCLA. \nCoach Mike Zimmer says Kendricks has been playing like a starter for several weeks. \nKendricks says he doesn't see the move as a vote of confidence. He spent extra time over the bye week making sure he was prepared for the increased responsibility. \nThe Vikings host the Kansas City Chiefs on Sunday \n. Read or Share this story: http://www.kare11.com/story/sports/nfl/vikings/2015/10/12/vikings-rookie-lb-kendricks-earns-starting-job/73840936/ TOP VIDEOS", "external_links": [], "published": "2015-10-13T01:20:00.000+03:00", "crawled": "2015-10-13T02:17:46.790+03:00", "highlightTitle": ""}