{"organizations": ["Facebook Adam & Sal", "LinkedIn Pinterest Adam & Sal", "Giants", "Facebook Email Twitter Google", "New York Giants"], "uuid": "d934176c30174c8625761545f1eed956827b6920", "thread": {"social": {"gplus": {"shares": 0}, "pinterest": {"shares": 0}, "vk": {"shares": 0}, "linkedin": {"shares": 0}, "facebook": {"likes": 0, "shares": 0, "comments": 0}, "stumbledupon": {"shares": 0}}, "site_full": "www.wgrz.com", "main_image": "http://www.gannett-cdn.com/-mm-/489efad1142179deef9ce5ef3cf126cd99e1a3f1/r=x633&amp;c=1200x630/http/cdn.tegna-tv.com/-mm-/ace68c1bef90db92e23667048503bf5a8c6d9661/c=0-188-2596-1655/local/-/media/2015/10/04/WGRZ/WGRZ/635795815326236948-USATSI-8842373.jpg", "site_section": "http://rssfeeds.wgrz.com/_/20/110034968/WGRZ/sports", "section_title": "WGRZ - Sports", "url": "http://www.wgrz.com/story/sports/nfl/bills/2015/10/04/adam--sal-on-bills-vs-giants-discipline-discipline-discipline/73351410/", "country": "US", "title": "Adam & Sal on Bills vs. Giants: Discipline, discipline, discipline", "performance_score": 0, "site": "wgrz.com", "participants_count": 0, "title_full": "Adam & Sal on Bills vs. Giants: Discipline, discipline, discipline", "spam_score": 0.0, "site_type": "news", "published": "2015-10-05T05:23:00.000+03:00", "replies_count": 0, "uuid": "d934176c30174c8625761545f1eed956827b6920"}, "author": "", "url": "http://www.wgrz.com/story/sports/nfl/bills/2015/10/04/adam--sal-on-bills-vs-giants-discipline-discipline-discipline/73351410/", "ord_in_thread": 0, "title": "Adam & Sal on Bills vs. Giants: Discipline, discipline, discipline", "locations": ["Orchard Park", "USA", "NY"], "entities": {"persons": [], "locations": [], "organizations": []}, "highlightText": "", "language": "english", "persons": ["Eli Manning", "Kyle Williams", "Adam", "Kevin Hoffman", "Kevin Hoffman-USA"], "text": "Facebook Email Twitter Google+ LinkedIn Pinterest Adam & Sal on Bills vs. Giants: Discipline, discipline, discipline The Bills' seasons so far has been a record of ups and downs. Week 4 was one of the downs. Post to Facebook Adam & Sal on Bills vs. Giants: Discipline, discipline, discipline The Bills' seasons so far has been a record of ups and downs. Week 4 was one of the downs. Check out this story on WGRZ.com: http://on.wgrz.com/1LcEHUl Cancel Send A link has been sent to your friend's email address. Posted! A link has been posted to your Facebook feed. Join the Conversation To find out more about Facebook commenting please read the Conversation Guidelines and FAQs Adam & Sal on Bills vs. Giants: Discipline, discipline, discipline Adam and Sal Discuss Bills loss to Giants. WGRZ 10:23 p.m. EDT October 4, 2015 Oct 4, 2015; Orchard Park, NY, USA; New York Giants quarterback Eli Manning (10) throws a pass under pressure by Buffalo Bills defensive tackle Kyle Williams (95) during the first quarter at Ralph Wilson Stadium. Mandatory Credit: Kevin Hoffman-USA TODAY Sports (Photo: Kevin Hoffman, Kevin Hoffman-USA TODAY Sports) CONNECT TWEET LINKEDIN COMMENT EMAIL MORE \nORCHARD PARK, NY â€“ The Bills' season so far has been a record of ups and downs. Week 4 was one of the downs. \nRashad Jennings broke three tackles to score on a 51-yard touchdown catch midway through the fourth quarter in helping the New York Giants seal a 24-10 victory over the Bills. \nEli Manning went 20 of 35 for 212 yards and three touchdowns in the win as the Giants improved to 2-2. The Giants limited Buffalo to a combined 77 yards and two first downs on its first nine possessions. \nThe Bills, who were flagged 17 times for 135 yards, are also 2-2. \nTwo On Your Side's Sports Director Adam Benigni and Sal Maiorana of the Democrat & Chronicle analyze what went wrong. Read or Share this story: http://on.wgrz.com/1LcEHUl More Stories", "external_links": [], "published": "2015-10-05T05:23:00.000+03:00", "crawled": "2015-10-05T11:19:12.804+03:00", "highlightTitle": ""}