{"organizations": ["Army", "BU", "UHS", "New York Medical College", "Southern Tier Ob-Gyn Group", "University", "BU Athletics", "Binghamton University", "United Health Services", "Binghamton University Foundation Board of Directors", "Athletics Department", "Lee Health Care", "Department of Athletics", "Perinatal Center"], "uuid": "db109430d7b2325f1812823af4da4a98fa699ffd", "thread": {"social": {"gplus": {"shares": 0}, "pinterest": {"shares": 0}, "vk": {"shares": 0}, "linkedin": {"shares": 0}, "facebook": {"likes": 0, "shares": 0, "comments": 0}, "stumbledupon": {"shares": 0}}, "site_full": "www.wicz.com", "main_image": "http://www.wicz.com/library/article-numbered-thumbs/40553.jpg", "site_section": "http://www.wicz.com/localsportsrss.asp", "section_title": "FOX 40 WICZ TV - Local Sports", "url": "http://www.wicz.com/news2005/viewarticle.asp?a=40553", "country": "US", "title": "BU receives historic gift from local doctor", "performance_score": 0, "site": "wicz.com", "participants_count": 0, "title_full": "BU receives historic gift from local doctor", "spam_score": 0.0, "site_type": "news", "published": "2015-10-15T05:35:00.000+03:00", "replies_count": 0, "uuid": "db109430d7b2325f1812823af4da4a98fa699ffd"}, "author": "", "url": "http://www.wicz.com/news2005/viewarticle.asp?a=40553", "ord_in_thread": 0, "title": "BU receives historic gift from local doctor", "locations": ["N.Y.", "Binghamton", "Lourdes Memorial Hospital"], "entities": {"persons": [], "locations": [], "organizations": []}, "highlightText": "", "language": "english", "persons": ["Lee", "Jim Broschart", "Bai Lee Court", "Harvey Stenger", "Bai Lee", "Patrick Elliott"], "text": "Thursday, October 15, 2015 - 2:33:58 PM Local Sports BU receives historic gift from local doctor 10/14/2015 (Updated 10:35:03 PM) VESTAL, N.Y. - Binghamton University announced Wednesday a gift of $1 million from prominent local physician and Binghamton University Foundation Board of Directors member Dr. Bai Lee to benefit the Athletics Department. The announcement was made during a packed press conference in the Events Center TAU Bearcat Room. This gift will support facility enhancements that will positively impact student-athletes and coaches, including benefits to the academic Student Success Center, strength and conditioning program, sports medicine and more. It is the largest gift athletics has received to date. \"We are grateful to Dr. Lee for this gift, which will make certain that our student athletes have the resources needed to be successful. Moreover, it helps ensure that the Department of Athletics continues to flourish as a significant aspect of a Binghamton University education, \" University President Harvey Stenger said. \"This remarkable gift helps put our Division I athletics program on par with other successful programs in our conference,\" Director of Athletics Patrick Elliott said. \"This generous gift will benefit the Athletics Department for years to come.\" In honor of his generosity, the University will name the basketball court in the Events Center the Dr. Bai Lee Court. The official unveiling will take place prior to the men's basketball game vs. Army, starting at 2 p.m. Sunday, Nov. 15. \"Thank you to Dr. Lee for his longstanding support of the University,\" said Jim Broschart, vice president for advancement. \"Dr. Lee's friendship to Binghamton University has been remarkable. We're proud to see Binghamton University's alumni, parents and community friends really take notice of the University's overall impact and step forward with their support.\" \"I owe so much of my success to the local community, and I see Binghamton University as a positive force in the Binghamton area today,\" said Lee. \"I hope this gift inspires others who are appreciative of this wonderful community to show their support and give back.\" Lee is the president of Lee Health Care, and senior attending gynecologist at UHS and Our Lady of Lourdes Memorial Hospital. He completed his post-graduate training and fellowship at New York Medical College. He served as director of the Perinatal Center at United Health Services in 1972, and became a partner at the Southern Tier Ob-Gyn Group in 1975. In 2000, he established the Lee and Yum Foundation for charity and education. (Courtesy: BU Athletics)", "external_links": [], "published": "2015-10-15T05:35:00.000+03:00", "crawled": "2015-10-15T21:35:16.583+03:00", "highlightTitle": ""}