{"organizations": ["OldhamRochdale", "Cornell", "Rochdale"], "uuid": "cee788be003c7c21595e7f7339c7c7f8d3d15467", "thread": {"social": {"gplus": {"shares": 0}, "pinterest": {"shares": 0}, "vk": {"shares": 0}, "linkedin": {"shares": 0}, "facebook": {"likes": 0, "shares": 0, "comments": 0}, "stumbledupon": {"shares": 0}}, "site_full": "www.sport.co.uk", "main_image": "http://images.sport.co.uk/150x150/div2.jpg", "site_section": "http://feeds.feedburner.com/SportcoukNewsRssFeed", "section_title": "General Sports News from Sports.co.uk", "url": "http://www.sport.co.uk/football/rochdale-00-oldham-match-report/6984610/", "country": "JE", "title": "Rochdale 0-0 Oldham: Match Report", "performance_score": 0, "site": "sport.co.uk", "participants_count": 0, "title_full": "Rochdale 0-0 Oldham: Match Report", "spam_score": 0.0, "site_type": "news", "published": "2015-10-24T20:01:00.000+03:00", "replies_count": 0, "uuid": "cee788be003c7c21595e7f7339c7c7f8d3d15467"}, "author": "", "url": "http://www.sport.co.uk/football/rochdale-00-oldham-match-report/6984610/", "ord_in_thread": 0, "title": "Rochdale 0-0 Oldham: Match Report", "locations": [], "entities": {"persons": [], "locations": [], "organizations": []}, "highlightText": "", "language": "english", "persons": ["Ian Henderson", "Lewis Alessandra.Oldham", "Carl Winchester", "Oldham", "James Wilson", "Matt Lund", "Nathaniel Mendez-Laing", "Andy Cannon", "Jamie Allen", "Mike Jones", "David Cornell"], "text": "Rochdale 0-0 Oldham: Match Report 24 Oct 2015 17:01:00 Honours even in bore draw derby between Rochdale and OldhamRochdale and Oldham shared the spoils as the derby ended goalless at Spotland.It was the third successive 0-0 draw for the home side, who had the better of the few openings available.There were few chances of note in an uneventful first half, with the best opportunity created - and wasted - by the home side in the 16th minute when Matt Lund's pass inside full-back Carl Winchester set Andy Cannon free down the right and his square pass across the face of goal was side-footed over the crossbar from five yards by Lewis Alessandra.Oldham's best effort came from James Wilson, who headed Mike Jones' free-kick wide in the 34th minute.Eight minutes from the interval Ian Henderson headed Jamie Allen's corner goalward but Latics goalkeeper David Cornell diverted the attempt onto the post.If the first half saw precious little goalmouth action, the second period featured even less. The only time either goalkeeper was seriously worked after the break came in the 71st minute when Cornell kept out Nathaniel Mendez-Laing's attempt. Related Sport News", "external_links": [], "published": "2015-10-24T20:01:00.000+03:00", "crawled": "2015-10-25T20:21:40.110+02:00", "highlightTitle": ""}