{"organizations": ["TPC San Antonio", "AT&T Canyons Course", "AP"], "uuid": "def3582d1680ed20102434aee765434da817dacc", "thread": {"social": {"gplus": {"shares": 0}, "pinterest": {"shares": 0}, "vk": {"shares": 0}, "linkedin": {"shares": 0}, "facebook": {"likes": 0, "shares": 0, "comments": 0}, "stumbledupon": {"shares": 0}}, "site_full": "www.beaumontenterprise.com", "main_image": "http://www.beaumontenterprise.com/img/pages/article/opengraph_default.jpg", "site_section": "http://www.beaumontenterprise.com/sports/golf/collectionRss/Sports-Golf-Heds-7413.php", "section_title": "Sports Golf Heds", "url": "http://www.beaumontenterprise.com/sports/article/Michael-Allen-Scott-McCarron-share-lead-in-San-6575767.php", "country": "US", "title": "Michael Allen, Scott McCarron share lead in San Antonio", "performance_score": 0, "site": "beaumontenterprise.com", "participants_count": 0, "title_full": "Michael Allen, Scott McCarron share lead in San Antonio", "spam_score": 0.0, "site_type": "news", "published": "2015-10-18T00:10:00.000+03:00", "replies_count": 0, "uuid": "def3582d1680ed20102434aee765434da817dacc"}, "author": "", "url": "http://www.beaumontenterprise.com/sports/article/Michael-Allen-Scott-McCarron-share-lead-in-San-6575767.php", "ord_in_thread": 0, "title": "Michael Allen, Scott McCarron share lead in San Antonio", "locations": ["SAN ANTONIO", "San Antonio"], "entities": {"persons": [], "locations": [], "organizations": []}, "highlightText": "", "language": "english", "persons": ["Jeff Maggert", "Colin Montgomerie", "Scott McCarron", "Maggert", "Short", "Fred Couples", "Charles Schwab", "Scott Dunlap", "McCarron", "Michael Allen", "Langer", "Brandt Jobe", "Wes Short Jr", "Bernhard Langer", "Dunlap", "Allen"], "text": "Michael Allen, Scott McCarron share lead in San Antonio Updated 4:11 pm, Saturday, October 17, 2015 SAN ANTONIO (AP) â€” Defending champion Michael Allen shot a 3-under 69 on Saturday for a share of the lead with Scott McCarron in the Champions Tour's San Antonio Championship. McCarron also had a 69 to reach 6-under 138 on TPC San Antonio's AT&T Canyons Course. The 56-year-old Allen has seven victories on the 50-and-over tour after failing to win on the PGA Tour. The 50-year-old McCarron is making his seventh start in his first season on the Champions Tour. He won three times on the PGA Tour. Fred Couples was a stroke back along with Bernhard Langer , Scott Dunlap and first-round leader Wes Short Jr. Couples shot 69, Langer 68, Dunlap 71 and Short 72. Couples won the 2011 event, shooting 62-62-66 for a seven-stroke victory. Charles Schwab Cup leader Colin Montgomerie was tied for 11th at 3 under after a 70. He has a 39-point lead over Jeff Maggert with three events left in the season-long competition. Maggert withdrew because of a lingering calf injury after an opening 72. Brandt Jobe was tied for 27th at 1 over in his Champions Tour debut. He shot 72.  ", "external_links": [], "published": "2015-10-18T00:10:00.000+03:00", "crawled": "2015-10-18T01:51:27.424+03:00", "highlightTitle": ""}