{"organizations": ["L.A. Times", "NBA", "Honda Center", "Lakers", "Los Angeles Clippers", "Europe The Lakers", "Clippers", "FOX Sports", "Golden State Warriors"], "uuid": "0f23788abf2985ab690f7bcfce949dc945c4f89d", "thread": {"social": {"gplus": {"shares": 0}, "pinterest": {"shares": 0}, "vk": {"shares": 0}, "linkedin": {"shares": 0}, "facebook": {"likes": 0, "shares": 0, "comments": 0}, "stumbledupon": {"shares": 0}}, "site_full": "www.onenewspage.com", "main_image": "http://cdn.newsserve.net/ONPglobe256.jpg", "site_section": "http://www.onenewspage.com/rss/latest/Sports.rss", "section_title": "Latest Sports News on One News Page", "url": "http://www.onenewspage.com/n/Sports/7559y3rgh/Five-takeaways-from-the-Lakers-loss-to-Golden.htm", "country": "US", "title": "Five takeaways from the Lakers' loss to Golden State", "performance_score": 0, "site": "onenewspage.com", "participants_count": 0, "title_full": "Five takeaways from the Lakers' loss to Golden State", "spam_score": 0.0, "site_type": "news", "published": "2015-10-23T18:56:00.000+03:00", "replies_count": 0, "uuid": "0f23788abf2985ab690f7bcfce949dc945c4f89d"}, "author": "", "url": "http://www.onenewspage.com/n/Sports/7559y3rgh/Five-takeaways-from-the-Lakers-loss-to-Golden.htm", "ord_in_thread": 0, "title": "Five takeaways from the Lakers' loss to Golden State", "locations": ["San Diego", "Europe", "Anaheim", "Middle East"], "entities": {"persons": [], "locations": [], "organizations": []}, "highlightText": "", "language": "english", "persons": ["Williams", "Lou Williams"], "text": "Five takeaways from the Lakers' loss to Golden State Friday, 23 October 2015 (2 minutes ago) Five things we learned from the Lakers' 136-97 loss to the Golden State Warriors on Thursday night at Honda Center in Anaheim: 1. Lou Williams didn’t look rusty after missing the previous two games with a groin injury. Williams came off the bench for the Lakers and scored 19 points on six-for-12... 1.Lou Williams didn’t look rusty after missing the previous two games with a groin injury. Williams came off the bench for the Lakers and scored 19 points... L.A. Times 10 hours ago - Middle East For all of the pomp and circumstance over the course of an NBA season, there's really only one thing that matters: Figuring out which team will take home the... FOX Sports 1 day ago - Sports The Los Angeles Clippers crushed the Golden State Warriors 130-95 in their penultimate preseason game on Tuesday night. Here are five takeaways from the game: FOX Sports 2 days ago - Sports The Clippers played the Golden State Warriors, so of course there was going to be fallout. Eight technical fouls between the teams — including five on the... L.A. Times 2 days ago - Europe The Lakers beat the Golden State Warriors 85-70 in a game Saturday that was abbreviated because of a slippery court in San Diego. Here are five things we... L.A. Times 5 days ago - Europe You Might Like Other recent news in Sports", "external_links": [], "published": "2015-10-23T18:56:00.000+03:00", "crawled": "2015-10-23T18:59:49.713+03:00", "highlightTitle": ""}