{"organizations": ["Mitchell Cook", "Fullscreen Buy Photo Palm Bay High", "Javonn Roberson", "Palm Bay High", "Chase Harris", "Titusville High", "Tyshaun Rolle", "Desmond Arthur", "Titusville High School", "Titusville High Terriers"], "uuid": "05544af90d5f7d3b0dc731133efb6f808e016dca", "thread": {"social": {"gplus": {"shares": 0}, "pinterest": {"shares": 0}, "vk": {"shares": 0}, "linkedin": {"shares": 0}, "facebook": {"likes": 0, "shares": 0, "comments": 0}, "stumbledupon": {"shares": 0}}, "site_full": "www.floridatoday.com", "main_image": "http://www.gannett-cdn.com/-mm-/5e4b0b5561ab732c18b8eadfd5a284bbe14a07a9/c=0-56-2612-1532&amp;r=x1683&amp;c=3200x1680/local/-/media/2015/10/02/Brevard/Brevard/635794196657925737-nice-TITUSVILLE-VS-PALM-BAY-FOOTBALL-CR-34004.jpg", "site_section": "http://rssfeeds.floridatoday.com/brevard/sports", "section_title": "Brevard - Sports", "url": "http://www.floridatoday.com/picture-gallery/sports/high-school/2015/10/02/photos-titusville-vs-palm-bay-football/73250620/", "country": "US", "title": "Photos: Titusville vs. Palm Bay football", "performance_score": 0, "site": "floridatoday.com", "participants_count": 0, "title_full": "Photos: Titusville vs. Palm Bay football", "spam_score": 0.0, "site_type": "news", "published": "2015-10-03T05:01:00.000+03:00", "replies_count": 0, "uuid": "05544af90d5f7d3b0dc731133efb6f808e016dca"}, "author": "", "url": "http://www.floridatoday.com/picture-gallery/sports/high-school/2015/10/02/photos-titusville-vs-palm-bay-football/73250620/", "ord_in_thread": 0, "title": "Photos: Titusville vs. Palm Bay football", "locations": ["Palm Bay High", "Palm Bay", "Titusville"], "entities": {"persons": [], "locations": [], "organizations": []}, "highlightText": "", "language": "english", "persons": ["Marcus", "Jacob Farris", "Jaleel Davis", "Harris", "Anthony Deibendetto", "Rashid Leftridge", "Bay High", "Shinholster", "Ozzie Samuel", "Brian Lankford-Johnson", "Craig Rubadoux/FLORIDA", "Stewart Brown", "Tommy Mack"], "text": "Photos: Titusville vs. Palm Bay football Buy Photo Titusville High's #6 Jaleel Davis is hammered by Palm Bay High's #4 Chase Harris and #51 Mitchell Cook during Friday nights game held at the Titusville High School football stadium. Craig Rubadoux/FLORIDA TODAY Fullscreen Buy Photo Titusville High #24 Jacob Farris is hammered in the back field by Palm Bay High's #3 Desmond Arthur and #23 Ozzie Samuel during Friday nights game against Palm Bay High held at the Titusville High School football stadium. Craig Rubadoux/FLORIDA TODAY Fullscreen Buy Photo Titusville High #24 Jacob Farris is hammered in the back field by Palm Bay High's #3 Desmond Arthur and #23 Ozzie Samuel during Friday nights game against Palm Bay High held at the Titusville High School football stadium. Craig Rubadoux/FLORIDA TODAY Fullscreen Buy Photo Palm Bay High players take the field for Friday nights game against Titusville High Terriers held at the Titusville High School football stadium. Craig Rubadoux/FLORIDA TODAY Fullscreen Buy Photo Titusville High players take the field during Friday nights game against Palm Bay High held at the Titusville High School football stadium. Craig Rubadoux/FLORIDA TODAY Fullscreen Buy Photo Palm Bay High's #14 Brian Lankford-Johnson runs past Titusville High defenders for a first quarter touchdown during Friday nights game held at the Titusville High School football stadium. Craig Rubadoux/FLORIDA TODAY Fullscreen Buy Photo Palm Bay High cheerleaders fire up the team during Friday nights game against Titusville High Terriers held at the Titusville High School football stadium. Craig Rubadoux/FLORIDA TODAY Fullscreen Buy Photo Palm Bay High #16 Anthony Deibendetto kicks the extra point during Friday nights game against Titusville High Terriers held at the Titusville High School football stadium. Craig Rubadoux/FLORIDA TODAY Fullscreen Buy Photo Titusville High #24 Jacob Farris is hammered by a host of Palm Bay High defenders during Friday nights game against Palm Bay High held at the Titusville High School football stadium. Craig Rubadoux/FLORIDA TODAY Fullscreen Buy Photo Titusville High #3 Dontavious Marcus follows his blocking past Palm Bay high defenders during Friday nights game held at the Titusville High School football stadium. Craig Rubadoux/FLORIDA TODAY Fullscreen Buy Photo Titusville High #3 Dontavious Marcus is tackled by two Palm Bay high defenders including #25 Rashid Leftridge and #17 Javonn Roberson during Friday nights game held at the Titusville High School football stadium. Craig Rubadoux/FLORIDA TODAY Fullscreen Buy Photo Titusville Highs #12 Tommy Mack picks up some nice yards after a catch during Friday nights game against Palm Bay High held at the Titusville High School football stadium. Craig Rubadoux/FLORIDA TODAY Fullscreen Buy Photo Titusville High #3 Dontavious Marcus trys to Avoid a host of Palm Bay high defenders during Friday nights game held at the Titusville High School football stadium. Craig Rubadoux/FLORIDA TODAY Fullscreen Buy Photo Palm Bay High's #23 Ozzie Samuel runs back a blocked field goal for a touchdown during Friday nights game against Titusville High Terriers held at the Titusville High School football stadium. Craig Rubadoux/FLORIDA TODAY Fullscreen Buy Photo Palm Bay High cheerleaders fire up the team during Friday nights game against Titusville High Terriers held at the Titusville High School football stadium. Craig Rubadoux/FLORIDA TODAY Fullscreen Buy Photo Titusville High #18 Christian Shinholster kicks a extra point during Friday nights game against Palm Bay High held at the Titusville High School football stadium. Craig Rubadoux/FLORIDA TODAY Fullscreen Buy Photo Palm Bay High's #28 Tyshaun Rolle is hammered by two Titusville High defenders during Friday nights game held at the Titusville High School football stadium. Craig Rubadoux/FLORIDA TODAY Fullscreen Buy Photo Palm Bay High's #28 Tyshaun Rolle finds some nice running room past Titusville High defenders i during Friday nights game held at the Titusville High School football stadium. Craig Rubadoux/FLORIDA TODAY Fullscreen Buy Photo Palm Bay High's #28 Tyshaun Rolle drags a Titusville High defenders into the endzone for a second quarter touchdown during Friday nights game held at the Titusville High School football stadium. Craig Rubadoux/FLORIDA TODAY Fullscreen Buy Photo Palm Bay High's #28 Tyshaun Rolle drags a Titusville High defenders into the endzone for a second quarter touchdown during Friday nights game held at the Titusville High School football stadium. Craig Rubadoux/FLORIDA TODAY Fullscreen Buy Photo Titusville Highs #12 Tommy Mack picks up some nice yards after a catch during Friday nights game against Palm Bay High held at the Titusville High School football stadium. Craig Rubadoux/FLORIDA TODAY Fullscreen Buy Photo Titusville High cheerleaders fire up the team during Friday nights game against Palm Bay High held at the Titusville High School football stadium. Craig Rubadoux/FLORIDA TODAY Fullscreen Buy Photo Titusville High fans pack the stands during Friday nights game against Palm Bay High held at the Titusville High School football stadium. Craig Rubadoux/FLORIDA TODAY Fullscreen Buy Photo Palm Bay High's QB #8 Stewart Brown looks for an open man down field during Friday nights game against Titusville High Terriers held at the Titusville High School football stadium. Craig Rubadoux/FLORIDA TODAY Fullscreen Buy Photo Titusville High's #22 Christian Harris breaks up a passintended for Palm Bay High receiver during Friday nights game held at the Titusville High School football stadium. Craig Rubadoux/FLORIDA TODAY Fullscreen Buy Photo Palm Bay High's #14 Brian Lankford-Johnson drags a Titusville High defender for a first down during Friday nights game held at the Titusville High School football stadium. Craig Rubadoux/FLORIDA TODAY Fullscreen Buy Photo Palm Bay High's #14 Brian Lankford-Johnson drags a Titusville High defender for a first down during Friday nights game held at the Titusville High School football stadium. Craig Rubadoux/FLORIDA TODAY", "external_links": [], "published": "2015-10-03T05:01:00.000+03:00", "crawled": "2015-10-03T05:45:22.801+03:00", "highlightTitle": ""}