{"organizations": ["Sonora Police Department", "Martin Terrace Court", "Columbia", "Sharon Betel Santos", "Chamberlain Court", "Reynolds Ferry Road", "Arnold", "McAtee Street"], "uuid": "b5040c594d9ef938bc3dc7394b452f6d21c9e70e", "thread": {"social": {"gplus": {"shares": 0}, "pinterest": {"shares": 0}, "vk": {"shares": 0}, "linkedin": {"shares": 0}, "facebook": {"likes": 0, "shares": 0, "comments": 0}, "stumbledupon": {"shares": 0}}, "site_full": "www.uniondemocrat.com", "main_image": "", "site_section": "http://feeds.feedburner.com/UnionDemocrat", "section_title": "The Union Democrat, Sonora, CA News, Sports, & Weather", "url": "http://www.uniondemocrat.com/index.php?option=com_content&task=view&id=117936&Itemid=190", "country": "US", "title": "News of Record for Oct. 21, 2015", "performance_score": 0, "site": "uniondemocrat.com", "participants_count": 0, "title_full": "News of Record for Oct. 21, 2015", "spam_score": 0.0, "site_type": "news", "published": "2015-10-21T04:00:00.000+03:00", "replies_count": 0, "uuid": "b5040c594d9ef938bc3dc7394b452f6d21c9e70e"}, "author": "", "url": "http://www.uniondemocrat.com/index.php?option=com_content&task=view&id=117936&Itemid=190", "ord_in_thread": 0, "title": "News of Record for Oct. 21, 2015", "locations": ["Pinewood Lane", "Valley Springs", "San Andreas", "Hospital Road", "Sonora", "Texas", "West Saint Charles Street", "North Norlin Street", "Mi-Wuk Village", "South Barretta Street", "Groveland", "Sanguinetti Road", "Ferretti Road", "Yankee Hill Road", "Jenness Road", "Fresno", "Jamestown", "Marzia Avenue", "Sutter Creek", "Long Barn", "Kome Road"], "entities": {"persons": [], "locations": [], "organizations": []}, "highlightText": "", "language": "english", "persons": ["James Paul Joshua Clark", "Raul Antonio Perez", "Rene S. Ventura", "Milton", "Jealena Lee Lebugle", "Heather Roseanna Bruehl", "Jenny Lind", "Opal Lane", "Jenny Lind Road", "Bret Harte", "Patrick Alexander Fair", "McAtee Street"], "text": "News of Record for Oct. 21, 2015 News of Record for Oct. 21, 2015 By Union Democrat staff October 21, 2015 01:00 am TUOLUMNE COUNTY The Sonora Police Department reported the following: MONDAY 5:22 a.m., suspicious circumstance — A woman looked inside vehicles in a Sanguinetti Road parking lot. 7:19 a.m., theft — A North Norlin Street woman reported a ring, “half of a peacock charm” and medication were stolen. 7:33 a.m., suspicious circumstance — A man parked in front of a Sanguinetti Road business threatened another man. 12:45 p.m., pedestrian/vehicle check — Two people panhandled on Sanguinetti Road. 1:56 p.m., traffic accident — A dog was stuck in the back of a truck parked in a Pesce Way ditch. 2:29 p.m., controlled substance — A man found drugs in a Highway 49 parking lot. 4:51 p.m., pedestrian checks — Three people trespassed on Hospital Road railroad tracks. 6:10 p.m., civil problem — People argued over a casserole dish on South Barretta Street. The Sheriff’s Office reported the following: MONDAY 12:47 a.m., Jamestown — A truck continuously drove onto private property on Fallen Leaf Drive. 1:29 a.m., Sonora area — A cellphone was stolen at a Mono Way gas station. 4:12 a.m., Columbia — An older man stood in the middle of Yankee Hill Road and said he didn’t know where he belonged. 8:40 a.m., Groveland — A “street sweeper guy” threatened to punch a 14-year-old boy in the face on Ferretti Road. 9:14 a.m., Sonora area — A Striker Court person received a message on their answering machine from two women who threatened to “knife people and kill them.” 9:17 a.m., Mi-Wuk Village — A man on Highway 108 threw a rock at a woman’s vehicle as she drove by. When the woman pulled over to confront the man he screamed and yelled at her. The woman left when she saw a knife. 9:32 a.m., Groveland — People trespassed at a vacation home on Chamberlain Court. 9:58 a.m., Mi-Wuk Village — Kids were shooting BBs or pellets at a Kome Road stop sign which bounced back onto a person’s house. 10:14 a.m., Long Barn — A rifle was found on the side of Highway 108. 11:13 a.m., Mi-Wuk Village — People working for a Lama Teumete Road woman blocked her from leaving by parking their vehicle behind hers. 12:04 p.m., Jamestown — A bike was found vandalized in a Main Street park. 12:53 p.m., Sonora area — A man attempted to steal another man’s white canvas bag containing a wallet and important papers on Hess Avenue. 1:23 p.m., Sonora area — A suspicious motorhome was parked near Jenness Road for several days. 2:24 p.m., Groveland — A Pleasant View Drive person was harassed by their neighbor. 5:10 p.m., Sonora area — A “card swiper” was thrown over a Wards Ferry Road fence. 6:42 p.m., Sonora area — About seven or eight cows were seen in the middle of Reynolds Ferry Road. 7:39 p.m., Columbia — A man dressed in camo had a large flashlight on Yankee Hill Road. 8:16 p.m., Sonora area — A vehicle parked on Wards Ferry Road was “shot up” and burglarized. Felony bookings MONDAY 10:10 p.m., Jamestown — Heather Roseanna Bruehl, 34, transient, was booked on suspicion of bringing alcohol or drugs into prison or jail after an arrest on Main Street. Arrests Cited on suspicion of driving under the influence of alcohol or drugs: MONDAY 8:11 p.m., Jamestown — Raul Antonio Perez, 60, of the 10000 block of Martin Terrace Court, Sonora, was booked after an arrest on Main Street. CALAVERAS COUNTY The Sheriff’s Office reported the following: MONDAY 8:32 a.m., Milton — Someone jumped a fence on Hunt Road and stole a load of batteries. 1:06 p.m., Arnold — An unknown vehicle was parked in front of a Meadow Drive residence that should be vacant. 2:48 p.m., Valley Springs — A man threw things at a vehicle parked on Jenny Lind Road. 3:02 p.m., Copperopolis — A woman on Main Street said a driver attempted to “run her off the road.” 3:36 p.m., San Andreas — A man in a West Saint Charles Street parking lot threw things at a truck. 10:36 p.m., Jenny Lind — An Opal Lane woman heard the door to her trailer close. Felony bookings MONDAY 4 p.m., San Andreas — Patrick Alexander Fair, 19, of San Andreas, was booked on suspicion of attempted murder, conspiracy to commit a crime, robbery, battery with serious bodily injury, vehicle theft and misdemeanor possession of controlled substance, possession of controlled substance paraphernalia, destroying or concealing evidence, threatening with intent to terrorize and unreasonable noise after an arrest on Treat Avenue. 5 p.m., Valley Springs — Jealena Lee Lebugle, 50, of the 8000 block of McAtee Street, was booked on suspicion of threatening with intent to terrorize, assault with a firearm on a person and misdemeanor exhibiting a firearm after an arrest on McAtee Street. 4:16 p.m., San Andreas — Sharon Betel Santos, 22, of the 1000 block of Bret Harte, Angels Camp, was booked on suspicion of forging a prescription and conspiracy to commit a crime after an arrest in the Calaveras County Jail lobby. Arrests Cited on suspicion of driving under the influence of alcohol or drugs: MONDAY 1:15 a.m., Angels Camp — James Paul Joshua Clark, 29, of the first block of Pinewood Lane, Sutter Creek, was booked after an arrest on North Main Street. 9 p.m., Angels Camp — Rene S. Ventura, 27, of the 3000 block of Marzia Avenue, Fresno, Texas, was booked after an arrest on South Main Street. Follow UnionDemocrat.com", "external_links": [], "published": "2015-10-21T04:00:00.000+03:00", "crawled": "2015-10-22T08:29:48.840+03:00", "highlightTitle": ""}