{"organizations": ["Sporting... New Zealand Herald", "Toronto FC", "Reuters", "Sporting Kansas City... L.A. Times", "Real Salt Lake 0Orlando City", "CJME Sounders", "Major League Soccer Playoff Glance Major League Soccer", "Real Salt Lake", "D.C. United", "New York 1FC Dallas", "Sporting Kansas City", "Major League Soccer", "LA Galaxy", "Red Bulls", "MLS", "Columbus Crew", "Seattle Times", "Western Conference Portland"], "uuid": "6b844e821387c92ee277ab600177a1a6d676c5b3", "thread": {"social": {"gplus": {"shares": 0}, "pinterest": {"shares": 0}, "vk": {"shares": 0}, "linkedin": {"shares": 0}, "facebook": {"likes": 0, "shares": 0, "comments": 0}, "stumbledupon": {"shares": 0}}, "site_full": "www.onenewspage.com", "main_image": "http://cdn.newsserve.net/ONPglobe256.jpg", "site_section": "http://www.onenewspage.com/rss/latest/Sports.rss", "section_title": "Latest Sports News on One News Page", "url": "http://www.onenewspage.com/n/Sports/7559y4xba/Major-League-Soccer-Playoff-Glance.htm", "country": "US", "title": "Major League Soccer Playoff Glance", "performance_score": 0, "site": "onenewspage.com", "participants_count": 0, "title_full": "Major League Soccer Playoff Glance", "spam_score": 0.0, "site_type": "news", "published": "2015-10-26T05:31:00.000+02:00", "replies_count": 0, "uuid": "6b844e821387c92ee277ab600177a1a6d676c5b3"}, "author": "", "url": "http://www.onenewspage.com/n/Sports/7559y4xba/Major-League-Soccer-Playoff-Glance.htm", "ord_in_thread": 0, "title": "Major League Soccer Playoff Glance", "locations": ["New York City", "Montreal", "U.S.", "Seattle", "West", "Vancouver", "New England", "Africa", "New York Dallas", "Portland", "Toronto"], "entities": {"persons": [], "locations": [], "organizations": []}, "highlightText": "", "language": "english", "persons": ["Sigi Schmid"], "text": "Major League Soccer Playoff Glance Monday, 26 October 2015 (13 minutes ago) Wednesday, Oct. 28: New England (5) at D.C. United (4)Thursday, Oct. 29: Toronto (6) at Montreal (3)Wednesday, Oct 28: LA Galaxy (5) at Seattle (4)Thursday, Oct. 29: Sporting Kansas City (6) at Portland (3)Leg 1 \" Sunday,... Toronto Clinches Playoff Spot With Victory Over Red Bulls 00:43 Toronto earns first ever MLS playoff bid with win over New York Dallas inches closer toward earning top seed in Western Conference Portland wins 1-0 over Real Salt Lake to move toward playoff spot Toronto sealed its first playoff berth in Major League Soccer and kept alive its hopes of overtaking New... Other recent news in U.S. Sports: MLS The Galaxy enters the final day of Major League Soccer's regular season second in the Western Conference. But it needs a victory Sunday at Sporting Kansas City... L.A. Times 1 day ago - Africa Also reported by • CJME Sounders coach Sigi Schmid spoke to the media on Friday morning following practice at Starfire Sports Complex, discussing his team’s possible playoff... Seattle Times 2 days ago - Front Page It’s almost done and dusted in the East, but there are three clubs gunning for the final playoff place in the West – and the race for the Supporters’... guardian.co.uk 3 days ago - Sports It took 33 weeks of games, but the Major League Soccer standings are finally breaking off into chewable bits as the season reaches its Decision-Day-branded... Seattle Times 6 days ago - Sports x- clinched playoff berth___Toronto FC 2, New York 1FC Dallas 2, Vancouver 0Portland 1, Real Salt Lake 0Orlando City 2, New York City FC 1San Jose 1, Sporting... New Zealand Herald 1 week ago - Sports (Reuters) - Columbus Crew locked up a spot in the Major League Soccer playoffs, and vaulted into contention for a first-round bye, with a 2-0 away victory over... Reuters 1 week ago - Sports You Might Like Other recent news in Sports", "external_links": [], "published": "2015-10-26T05:31:00.000+02:00", "crawled": "2015-10-26T05:45:48.687+02:00", "highlightTitle": ""}