{"organizations": ["NBA", "Honda Center", "Los Angeles Lakers", "Los Angeles Clippers", "Golden State", "AP Image", "AP", "Clippers", "Golden State Warriors"], "uuid": "89671dc5be86507348826e516952a931e27b8d29", "thread": {"social": {"gplus": {"shares": 0}, "pinterest": {"shares": 0}, "vk": {"shares": 0}, "linkedin": {"shares": 0}, "facebook": {"likes": 0, "shares": 0, "comments": 0}, "stumbledupon": {"shares": 0}}, "site_full": "www.timesunion.com", "main_image": "http://ww3.hdnux.com/photos/41/52/35/8824678/3/rawImage.jpg", "site_section": "http://www.timesunion.com/sports/collectionRss/Story-Slideshow-Promo-Wide-Sports-6699.php", "section_title": "Sports stories", "url": "http://www.timesunion.com/sports/article/Griffin-leads-Clippers-to-130-95-rout-of-Warriors-6580670.php", "country": "US", "title": "Griffin leads Clippers to 130-95 rout of Warriors", "performance_score": 0, "site": "timesunion.com", "participants_count": 0, "title_full": "Griffin leads Clippers to 130-95 rout of Warriors", "spam_score": 0.0, "site_type": "news", "published": "2015-10-21T08:20:00.000+03:00", "replies_count": 0, "uuid": "89671dc5be86507348826e516952a931e27b8d29"}, "author": "", "url": "http://www.timesunion.com/sports/article/Griffin-leads-Clippers-to-130-95-rout-of-Warriors-6580670.php", "ord_in_thread": 0, "title": "Griffin leads Clippers to 130-95 rout of Warriors", "locations": ["Gallery LOS ANGELES", "Portland", "Los Angeles"], "entities": {"persons": [], "locations": [], "organizations": []}, "highlightText": "", "language": "english", "persons": ["Chris Paul", "Blake Griffin", "J.J. Redick", "Ian Clark", "Klay Thompson", "DeAndre Jordan", "Lance Stephenson", "Wesley Johnson", "Austin Rivers", "Stephen Curry", "Eric Lewis", "Jae C. Hong", "Josh Smith", "Festus Ezeli", "Chris Babb", "Harrison Barnes", "Shaun Livingston", "James Michael McAdoo", "Griffin", "Andre Iguodala", "Redick"], "text": "Griffin leads Clippers to 130-95 rout of Warriors Updated 1:22 am, Wednesday, October 21, 2015 Photo: Jae C. Hong, AP Image 1 of / 8 Close Image 1 of 8 Los Angeles Clippers' Wesley Johnson intercepts a pass in front of Golden State Warriors' Harrison Barnes during the first half of an NBA preseason basketball game, Tuesday, Oct. 20, 2015, in Los Angeles. Los Angeles Clippers' Wesley Johnson intercepts a pass in front of Golden State Warriors' Harrison Barnes during the first half of an NBA preseason basketball game, Tuesday, Oct. 20, 2015, in Los Angeles. Photo: Jae C. Hong, AP Image 2 of 8 Golden State Warriors' Festus Ezeli, left, is defended by Los Angeles Clippers' Chris Paul during the first half of an NBA preseason basketball game Tuesday, Oct. 20, 2015, in Los Angeles. Golden State Warriors' Festus Ezeli, left, is defended by Los Angeles Clippers' Chris Paul during the first half of an NBA preseason basketball game Tuesday, Oct. 20, 2015, in Los Angeles. Photo: Jae C. Hong, AP Image 3 of 8 Los Angeles Clippers' Blake Griffin, center, is defended by Golden State Warriors' James Michael McAdoo, left, and Ian Clark during the first half of an NBA preseason basketball game Tuesday, Oct. 20, 2015, in Los Angeles. Los Angeles Clippers' Blake Griffin, center, is defended by Golden State Warriors' James Michael McAdoo, left, and Ian Clark during the first half of an NBA preseason basketball game Tuesday, Oct. 20, 2015, ... more Photo: Jae C. Hong, AP Image 4 of 8 Los Angeles Clippers' Lance Stephenson puts up a shot under pressure from Golden State Warriors' Festus Ezeli during the first half of an NBA preseason basketball game, Tuesday, Oct. 20, 2015, in Los Angeles. Los Angeles Clippers' Lance Stephenson puts up a shot under pressure from Golden State Warriors' Festus Ezeli during the first half of an NBA preseason basketball game, Tuesday, Oct. 20, 2015, in Los Angeles. Photo: Jae C. Hong, AP Image 5 of 8 Los Angeles Clippers' Josh Smith, top, is defended by Golden State Warriors' Chris Babb during the first half of an NBA preseason basketball game Tuesday, Oct. 20, 2015, in Los Angeles. Los Angeles Clippers' Josh Smith, top, is defended by Golden State Warriors' Chris Babb during the first half of an NBA preseason basketball game Tuesday, Oct. 20, 2015, in Los Angeles. Photo: Jae C. Hong, AP Image 6 of 8 Los Angeles Clippers' DeAndre Jordan makes a dunk during the first half of an NBA preseason basketball game against the Golden State Warriors, Tuesday, Oct. 20, 2015, in Los Angeles. Los Angeles Clippers' DeAndre Jordan makes a dunk during the first half of an NBA preseason basketball game against the Golden State Warriors, Tuesday, Oct. 20, 2015, in Los Angeles. Photo: Jae C. Hong, AP Image 7 of 8 Los Angeles Clippers' DeAndre Jordan, top, dunks as Golden State Warriors' Festus Ezeli, left, and Harrison Barnes look on during the first half of an NBA preseason basketball game Tuesday, Oct. 20, 2015, in Los Angeles. Los Angeles Clippers' DeAndre Jordan, top, dunks as Golden State Warriors' Festus Ezeli, left, and Harrison Barnes look on during the first half of an NBA preseason basketball game Tuesday, Oct. 20, 2015, in ... more Photo: Jae C. Hong, AP Image 8 of 8 Griffin leads Clippers to 130-95 rout of Warriors 1 / 8 Back to Gallery LOS ANGELES (AP) â€” Blake Griffin scored 23 of his 29 points in the first half to lead the Los Angeles Clippers to a 130-95 win against the Golden State Warriors in a preseason game Tuesday night. Chris Paul added seven points and 10 assists before he was ejected in the third quarter with his second technical foul, for arguing with official Eric Lewis . Golden State rested Stephen Curry and Andre Iguodala . WARRIORS: Klay Thompson scored a team-high 21 points after he missed the previous game for family reasons . former Clipper Shaun Livingston scored 10 points his first preseason start. CLIPPERS: Griffin scored 23 points on 8-for-10 shooting from the field in the first half . Austin Rivers scored 16 points . Lance Stephenson scored four points in 18 minutes in his first preseason start. STAR WATCH: DeAndre Jordan had 10 points and 10 rebounds. One of his highlights was a two-handed dunk off J.J. Redick 's assist in the first quarter. MIDSEASON FORM: Redick completed a four-point play after he made 3-pointer while being fouled in the third quarter. UP NEXT: The Clippers will host Portland on Thursday. Golden State will play the Los Angeles Lakers on Thursday at Honda Center . Most Popular", "external_links": [], "published": "2015-10-21T08:20:00.000+03:00", "crawled": "2015-10-21T09:27:06.062+03:00", "highlightTitle": ""}