{"organizations": ["Episode Three of Press Pass Pullman", "Eastern Washington University", "Big Sky Polls Eastern Washington University", "WSU", "Sacramento State", "Eagles", "EWU", "Sun Belt Conference", "Chapman University", "Whitworth University", "Pirates", "AP", "Georgia Southern"], "uuid": "126cd3bec2acdf1f371d64b5b2ad8d8a6926694d", "thread": {"social": {"gplus": {"shares": 0}, "pinterest": {"shares": 0}, "vk": {"shares": 0}, "linkedin": {"shares": 0}, "facebook": {"likes": 0, "shares": 0, "comments": 0}, "stumbledupon": {"shares": 0}}, "site_full": "www.swxrightnow.com", "main_image": "http://SWXRN.images.worldnow.com/images/8926399_G.jpg", "site_section": "http://www.swxrightnow.com/category/208735/z-local-sports-headlines?clienttype=rss", "section_title": "Sports and Weather Right Now - RSS - College Sports Headlines", "url": "http://www.swxrightnow.com/story/30168479/ewu-mens-hoops-picked-3rd-in-both-big-sky-polls", "country": "US", "title": "EWU Men's Hoops Picked 3rd in Both Big Sky Polls", "performance_score": 0, "site": "swxrightnow.com", "participants_count": 0, "title_full": "EWU Men's Hoops Picked 3rd in Both Big Sky Polls", "spam_score": 0.0, "site_type": "news", "published": "2015-10-02T06:11:00.000+03:00", "replies_count": 0, "uuid": "126cd3bec2acdf1f371d64b5b2ad8d8a6926694d"}, "author": "", "url": "http://www.swxrightnow.com/story/30168479/ewu-mens-hoops-picked-3rd-in-both-big-sky-polls", "ord_in_thread": 0, "title": "EWU Men's Hoops Picked 3rd in Both Big Sky Polls", "locations": ["Idaho", "Record SACRAMENTO", "Washington", "MOSCOW", "Sacramento State", "Idaho Falls", "Idaho AthleticsOGDEN", "Jordan West", "SACRAMENTO", "Portland", "Montana", "California", "North Dakota", "Calif.", "Washington State", "Utah"], "entities": {"persons": [], "locations": [], "organizations": []}, "highlightText": "", "language": "english", "persons": ["Mike Leach", "Kendrick Bourne", "Matt Breida", "Dalin McDonnell", "Kevin Ellison", "Alex Hanks", "Duke DeGaetano", "Breida", "Chapman"], "text": "EWU Men's Hoops Picked 3rd in Both Big Sky Polls Eastern Washington University men's basketball team has been picked to finish third by both the coaches and media in preseason polls released Thursday (Oct. 1) by the league. They weren't picked to win it last year, and look what happened to the Eagles.In what could again be a tightly-contested race in the Big Sky Conference, the defending champion Eastern Washington University men's basketball team has been picked to finish third by both the coaches and media in preseason polls released Thursday (Oct. 1) by the league. More >> They weren't picked to win it last year, and look what happened to the Eagles.In what could again be a tightly-contested race in the Big Sky Conference, the defending champion Eastern Washington University men's basketball team has been picked to finish third by both the coaches and media in preseason polls released Thursday (Oct. 1) by the league. More >> Idaho Men's Basketball Picked 7th/8th in Big Sky The Idaho men’s basketball team has been picked to finish eighth, according to the preseason coaches’ poll announced by the Big Sky Conference on Thursday. The Vandals were picked to finish seventh in the media poll. Idaho AthleticsOGDEN, Utah – The Idaho men’s basketball team has been picked to finish eighth, according to the preseason coaches’ poll announced by the Big Sky Conference on Thursday. The Vandals were picked to finish seventh in the media poll.Weber State was the top pick among coaches, while Montana took the edge in the media poll. The Vandals tied with North Dakota for eighth in the coaches’ poll with 52 points and tied for seventh with Portland S... More >> Idaho AthleticsOGDEN, Utah – The Idaho men’s basketball team has been picked to finish eighth, according to the preseason coaches’ poll announced by the Big Sky Conference on Thursday. The Vandals were picked to finish seventh in the media poll.Weber State was the top pick among coaches, while Montana took the edge in the media poll. The Vandals tied with North Dakota for eighth in the coaches’ poll with 52 points and tied for seventh with Portland S... More >> Press Pass Pullman: Episode Three It's Episode Three of Press Pass Pullman. Fresh off Washington State's lone bye week of the season, hear from WSU Head Coach Mike Leach and the rest of the team as they prepare for Saturday's game at California. More >> Fresh off Washington State's lone bye week of the season, hear from WSU Head Coach Mike Leach and the rest of the team as they prepare for Saturday's game at California. More >> Whitworth Dominates in 37-7 Win Over Chapman Duke DeGaetano and the Pirates rolled to a 37-7 win over Chapman on Saturday. Whitworth University dominated a full four quarters of football at Chapman University in a 37-7 non-conference victory on Saturday night at Ernie Chapman Stadium. Duke DeGaetano ran for 159 yards and three touchdowns and Dalin McDonnell intercepted two passes with one returned for a touchdown for the Pirates, who improved to 3-0. The Panthers fell to 0-2. More >> Whitworth University dominated a full four quarters of football at Chapman University in a 37-7 non-conference victory on Saturday night at Ernie Chapman Stadium. Duke DeGaetano ran for 159 yards and three touchdowns and Dalin McDonnell intercepted two passes with one returned for a touchdown for the Pirates, who improved to 3-0. The Panthers fell to 0-2. More >> Idaho Falls to Georgia Southern in Sun Belt Opener The Idaho Vandals fell to Georgia Southern 44-20 in their conference opener. MOSCOW, Idaho (AP) - Matt Breida ran for 179 yards and two touchdowns as Georgia Southern beat Idaho 44-20 in Sun Belt Conference play on Saturday night. Breida had touchdown runs of 83 and 66 yards for the Eagles (3-1, 1-0). Kevin Ellison threw for 105 yards and rushed for 134 yards and two touchdowns. Alex Hanks kicked three field goals. More >> MOSCOW, Idaho (AP) - Matt Breida ran for 179 yards and two touchdowns as Georgia Southern beat Idaho 44-20 in Sun Belt Conference play on Saturday night. Breida had touchdown runs of 83 and 66 yards for the Eagles (3-1, 1-0). Kevin Ellison threw for 105 yards and rushed for 134 yards and two touchdowns. Alex Hanks kicked three field goals. More >> EWU Rallies For Win at Sacramento State, Kupp Breaks Big Sky TD Record SACRAMENTO, Calif. (AP) - Jordan West passed for an Eastern Washington school-record 491 yards and three touchdowns, and Kendrick Bourne caught seven passes for a career-high 204 yards and a score to help the Eagles overcome a 20-7 halftime deficit and beat Sacramento State 28-20 on Saturday night. It was the West's second-consecutive game with at least 400 yards passing. More >> SACRAMENTO, Calif. (AP) - Jordan West passed for an Eastern Washington school-record 491 yards and three touchdowns, and Kendrick Bourne caught seven passes for a career-high 204 yards and a score to help the Eagles overcome a 20-7 halftime deficit and beat Sacramento State 28-20 on Saturday night. It was the West's second-consecutive game with at least 400 yards passing. More >>", "external_links": [], "published": "2015-10-02T06:11:00.000+03:00", "crawled": "2015-10-02T06:48:32.356+03:00", "highlightTitle": ""}