{"organizations": ["Union City Daily Messenger", "BGA", "Knoxville News Sentinel", "Chattanooga Free Press", "Johnson City Press", "Daily News Journal", "Marshall County Tribune", "Citizen Tribune", "Cleveland Daily Banner", "Dyersburg", "All Associated Press", "Associated Press", "State Gazette", "Jackson Sun"], "uuid": "419e728791545aae932740f39ebc996e8d890fd6", "thread": {"social": {"gplus": {"shares": 0}, "pinterest": {"shares": 0}, "vk": {"shares": 0}, "linkedin": {"shares": 0}, "facebook": {"likes": 0, "shares": 0, "comments": 0}, "stumbledupon": {"shares": 0}}, "site_full": "www.wdef.com", "main_image": "http://www.wdef.com/media/lib/170/4/a/8/4a88dc62-8202-4435-a472-0d9669d57c6b/Original.jpg", "site_section": "http://www.wdef.com/rss/3479.rss", "section_title": "WDEF News 12 - Local Sports News", "url": "http://www.wdef.com/content/sports/localsports/story/High-School-Football-Poll/cLfdGLlbzEuUXjyGYdPWUw.cspx?rss=3479", "country": "US", "title": "High School Football Poll", "performance_score": 0, "site": "wdef.com", "participants_count": 0, "title_full": "High School Football Poll", "spam_score": 0.0, "site_type": "news", "published": "2015-10-12T21:33:00.000+03:00", "replies_count": 0, "uuid": "419e728791545aae932740f39ebc996e8d890fd6"}, "author": "", "url": "http://www.wdef.com/content/sports/localsports/story/High-School-Football-Poll/cLfdGLlbzEuUXjyGYdPWUw.cspx?rss=3479", "ord_in_thread": 0, "title": "High School Football Poll", "locations": ["Lewisburg", "Union City", "Athens", "Cleveland", "Cookeville", "Cookeville Herald-Citizen", "Murfreesboro", "Paris", "Nashville", "Knoxville", "Tennessee", "Chattanooga", "Mountain City", "Johnson City", "Morristown", "Memphis"], "entities": {"persons": [], "locations": [], "organizations": []}, "highlightText": "", "language": "english", "persons": ["Martin", "Jackson"], "text": "Others receiving 12 or more points: 11, BGA 13. --- All Associated Press members in Tennessee are eligible to participate in the high school football poll. Those who voted for this week's poll are: The Daily Post-Athenian, Athens; Chattanooga Free Press, Chattanooga; Cleveland Daily Banner, Cleveland; Cookeville Herald-Citizen, Cookeville; State Gazette, Dyersburg; The Jackson Sun, Jackson; Johnson City Press, Johnson City; The Knoxville News Sentinel, Knoxville; Marshall County Tribune (Lewisburg); The Tomahawk (Mountain City); The Commercial Appeal, Memphis; Citizen Tribune, Morristown; The Daily News Journal, Murfreesboro; The Tennessean (Nashville); The Paris Post-Intelligencer; Union City Daily Messenger, Union City; WCMT, Martin. (Copyright 2015 The Associated Press. All rights reserved. This material may not be published, broadcast, rewritten or redistributed.) 10/12/2015 2:23:53 PM (GMT -4:00)", "external_links": [], "published": "2015-10-12T21:33:00.000+03:00", "crawled": "2015-10-13T02:02:29.919+03:00", "highlightTitle": ""}