{"organizations": ["New Seabury", "Cape Cod Academy", "Bristol Aggie", "Dennis-Yarmouth", "WGAM", "Sturgis West"], "uuid": "d0451a9305958fb1504ea0d007c93c85ca2602ad", "thread": {"social": {"gplus": {"shares": 0}, "pinterest": {"shares": 0}, "vk": {"shares": 0}, "linkedin": {"shares": 0}, "facebook": {"likes": 0, "shares": 0, "comments": 0}, "stumbledupon": {"shares": 0}}, "site_full": "www.capecodtimes.com", "main_image": "http://www.capecodtimes.com/Global/images/head/nameplate/fb/capecodtimes_200x200.png", "site_section": "http://www.capecodtimes.com/sports/high-school?template=rss&mime=xml", "section_title": "Local Sports - capecodtimes.com", "url": "http://www.capecodtimes.com/article/20151004/SPORTS/151009715/101036?rssfeed=true", "country": "US", "title": "(No heading)", "performance_score": 0, "site": "capecodtimes.com", "participants_count": 0, "title_full": "(No heading)", "spam_score": 0.0, "site_type": "news", "published": "2015-10-05T05:49:00.000+03:00", "replies_count": 0, "uuid": "d0451a9305958fb1504ea0d007c93c85ca2602ad"}, "author": "", "url": "http://www.capecodtimes.com/article/20151004/SPORTS/151009715/101036?rssfeed=true", "ord_in_thread": 0, "title": "(No heading)", "locations": ["Falmouth", "Bourne", "New Seabury", "Simpkins Field", "Bristol Aggie", "Barnstable", "Sturgis East", "Marshfield", "Mashpee", "Old Rochester", "Bayberry Hills", "Pembroke", "Whitman-Hanson", "Upper Cape", "Monomoy", "Nauset", "Yarmouth", "Wianno", "Duxbury", "Nantucket"], "entities": {"persons": [], "locations": [], "organizations": []}, "highlightText": "", "language": "english", "persons": ["Monomoy", "Bourne", "St. John Paul II", "Abington", "Sturgis West", "Martha"], "text": "Posted Oct. 4, 2015 at 9:49 PM Posted Oct. 4, 2015 at 9:49 PM » Social News MONDAY HIGH SCHOOL FOOTBALL: Sacred Heart at Nantucket, 5 p.m. BOYS HIGH SCHOOL SOCCER: Old Rochester at Bourne, 3:30 p.m., Upper Cape at Bristol Aggie, 3:30 p.m., Monomoy at Mashpee, 4 p.m., Falmouth at Dennis-Yarmouth, 4 p.m., Sacred Heart at Sturgis East, 4 p.m., Nauset at Marshfield, 5:30 p.m., Barnstable at Sandwich, 7 p.m. GIRLS HIGH SCHOOL SOCCER: Bristol Aggie at Upper Cape, 3:30 p.m., Mashpee at Monomoy, 4 p.m., Dennis-Yarmouth at Falmouth, 4 p.m., Sacred Heart at Sturgis East, 4 p.m., Marshfield at Nauset, 4:15 p.m., Bourne at Old Rochester, 6:30 p.m., Sandwich at Barnstable, 7 p.m. HIGH SCHOOL FIELD HOCKEY: East Bridgewater at Mashpee, 4 p.m., Bourne vs. Sturgis West at Simpkins Field, Yarmouth, 4 p.m., Dennis-Yarmouth at Pembroke, 4 p.m., Martha’s Vineyard at Falmouth, 4:15 p.m. GIRLS HIGH SCHOOL VOLLEYBALL: Blue Hills at Upper Cape, 5 p.m., Bourne at Old Rochester, 6 p.m. BOYS HIGH SCHOOL GOLF: Barnstable at Duxbury, 3:15 p.m., Bourne at Dighton-Rehoboth, 3:30 p.m, Martha’s Vineyard at Whitman-Hanson, 3:30 p.m., Carver at Mashpee, 4 p.m., Abington vs. Monomoy at Eastward Ho!, 4 p.m., Falmouth vs. St. John Paul II at Wianno, 4 p.m., Sandwich at Nantucket, 4 p.m., Cape Cod Academy vs. Sturgis West at Bayberry Hills, 4 p.m., Upper Cape vs. Cape Tech at New Seabury, 4 p.m. LOCAL GOLF: WGAM - Endicott Cup and Tri-State matches at CC of New Seabury capecodtimes.com", "external_links": [], "published": "2015-10-05T05:49:00.000+03:00", "crawled": "2015-10-05T07:22:53.822+03:00", "highlightTitle": ""}