{"organizations": ["Fort Lewis College Skyhawks", "Skyhawks", "Herald", "Western New Mexico Mustangs", "Dell", "Matisse Monty", "RMAC", "Adams State"], "uuid": "3dfe110a9dd75b2e757b52b69914e8b942c0b8af", "thread": {"social": {"gplus": {"shares": 0}, "pinterest": {"shares": 0}, "vk": {"shares": 0}, "linkedin": {"shares": 0}, "facebook": {"likes": 0, "shares": 0, "comments": 0}, "stumbledupon": {"shares": 0}}, "site_full": "www.durangoherald.com", "main_image": "http://www.durangoherald.com/img/dh_200.png", "site_section": "http://www.durangoherald.com/section/sports?template=RSS&mime=xml", "section_title": "Sports", "url": "http://www.durangoherald.com/article/20151010/SPORTS02/151019946/-1/sports&source=RSS", "country": "US", "title": "Fort Lewis volleyball goes 1-1 in New Mexico", "performance_score": 0, "site": "durangoherald.com", "participants_count": 0, "title_full": "Fort Lewis volleyball goes 1-1 in New Mexico", "spam_score": 0.0, "site_type": "news", "published": "2015-10-11T05:45:00.000+03:00", "replies_count": 0, "uuid": "3dfe110a9dd75b2e757b52b69914e8b942c0b8af"}, "author": "", "url": "http://www.durangoherald.com/article/20151010/SPORTS02/151019946/-1/sports&source=RSS", "ord_in_thread": 0, "title": "Fort Lewis volleyball goes 1-1 in New Mexico", "locations": ["New Mexico Fort Lewis", "Silver City", "New Mexico"], "entities": {"persons": [], "locations": [], "organizations": []}, "highlightText": "", "language": "english", "persons": ["Scanlan", "Amico", "Maddie LeBlanc", "Clara Salopek", "Fort Lewis", "Hannah Hargrove", "Delaney Scanlan", "Shelby Lehman"], "text": "Fort Lewis volleyball goes 1-1 in New Mexico Fort Lewis volleyball goes 1-1 in New Mexico Loss comes day after first RMAC win Herald staff report Share I t took the Western New Mexico Mustangs five sets to take down the visiting Fort Lewis College Skyhawks, 3-2, on Saturday in Silver City, New Mexico, in a Rocky Mountain Athletic Conference matchup. The Skyhawks won the first set 25-22; however, lost the next two sets 25-14 and 25-20. The Skyhawks bounced back to win the fourth set, 25-20, but lost the fifth and final set, 15-7. Fort Lewis freshman Matisse Monty led the Skyhawks with 15 kills and 13 digs, and freshman Maddie LeBlanc added eight kills. Junior libero Ally Dell’Amico had 22 digs, and junior Delaney Scanlan led the Skyhawks with 38 assists. On Friday, Fort Lewis beat the New Mexico Highlands Cowgirls 3-1 behind Monty’s 15 kills. The Skyhawks lost the first set 25-23 but went on to win the next three sets to take the match, 25-23, 25-18 and 25-21. The win was the Skyhawks first RMAC victory of the year as it also snapped a 10-game losing streak. Senior Shelby Lehman added 12 kills and hit for a .455 percentage offensively. As a team, the Skyhawks hit .225 in the match with 55 kills. Scanlan recorded 41 of the Skyhawks 53 set assists. Dell’Amico had 28 dig, and freshman Clara Salopek added 14. Sophomore Hannah Hargrove had two solo blocks and five kills. Fort Lewis (4-12, 1-7 RMAC) will be at home against Adams State at 7 p.m. Tuesday at Whalen Gymnasium.", "external_links": [], "published": "2015-10-11T05:45:00.000+03:00", "crawled": "2015-10-11T11:52:22.363+03:00", "highlightTitle": ""}