{"organizations": ["Associated Press", "Facebook Sabres", "First Niagara Center", "Montreal Canadiens", "Buffalo Sabres", "Sabres"], "uuid": "4f1b956ececcbec2ed5f1d1e031a436c70f36292", "thread": {"social": {"gplus": {"shares": 0}, "pinterest": {"shares": 0}, "vk": {"shares": 0}, "linkedin": {"shares": 0}, "facebook": {"likes": 0, "shares": 0, "comments": 0}, "stumbledupon": {"shares": 0}}, "site_full": "www.wgrz.com", "main_image": "http://cdn.tegna-tv.com/-mm-/62e8526419c3beaf9d8eb7e4305f32f625ddbf03/c=0-248-2898-1885&amp;r=x633&amp;c=1200x630/local/-/media/2015/10/23/WGRZ/WGRZ/635812385949214627-USATSI-8879179.jpg", "site_section": "http://rssfeeds.wgrz.com/_/20/109717640/WGRZ/sports", "section_title": "WGRZ - Sports", "url": "http://www.wgrz.com/story/sports/nhl/sabres/2015/10/23/sabres/74506370/", "country": "US", "title": "Sabres Lose to Undefeated Canadiens 7-2", "performance_score": 0, "site": "wgrz.com", "participants_count": 0, "title_full": "Sabres Lose to Undefeated Canadiens 7-2", "spam_score": 0.0, "site_type": "news", "published": "2015-10-24T06:10:00.000+03:00", "replies_count": 0, "uuid": "4f1b956ececcbec2ed5f1d1e031a436c70f36292"}, "author": "", "url": "http://www.wgrz.com/story/sports/nhl/sabres/2015/10/23/sabres/74506370/", "ord_in_thread": 0, "title": "Sabres Lose to Undefeated Canadiens 7-2", "locations": ["USA", "NY", "Buffalo"], "entities": {"persons": [], "locations": [], "organizations": []}, "highlightText": "", "language": "english", "persons": ["Nick Mendola", "Max Pacioretty", "Timothy T. Ludwig-USA", "Jack Eichel", "Timothy T. Ludwig"], "text": "Sabres Lose to Undefeated Canadiens 7-2 The Sabres fall to the Montreal Canadiens 7-2 at home. Post to Facebook Sabres Lose to Undefeated Canadiens 7-2 The Sabres fall to the Montreal Canadiens 7-2 at home. Check out this story on WGRZ.com: http://on.wgrz.com/1S1NbyM Cancel Send A link has been sent to your friend's email address. Posted! A link has been posted to your Facebook feed. Join the Conversation To find out more about Facebook commenting please read the Conversation Guidelines and FAQs Sabres Lose to Undefeated Canadiens 7-2 Nick Mendola, Associated Press 11:10 p.m. EDT October 23, 2015 Oct 23, 2015; Buffalo, NY, USA; Montreal Canadiens left wing Max Pacioretty (67) in front of Buffalo Sabres center Jack Eichel (15) during the first period at First Niagara Center. Mandatory Credit: Timothy T. Ludwig-USA TODAY Sports (Photo: Timothy T. Ludwig, Timothy T. Ludwig-USA TODAY Sports) CONNECT TWEET LINKEDIN COMMENT EMAIL MORE \nBUFFALO, N.Y. (AP) - Andrei Markov had a goal and four assists and the Montreal Canadiens beat the Buffalo Sabres 7-2 on Friday night to run their season-opening winning streak to eight games. \nThe Canadiens are two victories away from matching the NHL record set by the Toronto Maple Leafs in 1993-94 and matched by the Sabres in 2006-07. \nBrendan Gallagher and Dale Weise each scored twice, and Max Pacioretty and Torrey Mitchell also scored. Mike Condon made 34 saves, and P.K. Subban and Tomas Plekanec each had three assists. Read or Share this story: http://on.wgrz.com/1S1NbyM More Stories", "external_links": [], "published": "2015-10-24T06:10:00.000+03:00", "crawled": "2015-10-24T06:27:32.382+03:00", "highlightTitle": ""}