{"organizations": ["BBC Sport", "Fifa", "FIFA", "Bangkok Post", "Bangkok Post FIFA", "Zee News", "Sky News", "Sports ZURICH"], "uuid": "73eb1bf0ba4e701878edc08e0da57276bbbe3c0e", "thread": {"social": {"gplus": {"shares": 0}, "pinterest": {"shares": 0}, "vk": {"shares": 0}, "linkedin": {"shares": 0}, "facebook": {"likes": 0, "shares": 0, "comments": 0}, "stumbledupon": {"shares": 0}}, "site_full": "www.onenewspage.com", "main_image": "http://cdn.newsserve.net/i/20151023/3027-Champagne-to-stand-for-Fifa-top-job.jpg", "site_section": "http://www.onenewspage.com/rss/latest/Sports.rss", "section_title": "Latest Sports News on One News Page", "url": "http://www.onenewspage.com/n/Sports/7559y3i27/Champagne-to-stand-for-Fifa-top-job.htm", "country": "US", "title": "Champagne to stand for Fifa top job", "performance_score": 0, "site": "onenewspage.com", "participants_count": 0, "title_full": "Champagne to stand for Fifa top job", "spam_score": 0.0, "site_type": "news", "published": "2015-10-23T12:28:00.000+03:00", "replies_count": 0, "uuid": "73eb1bf0ba4e701878edc08e0da57276bbbe3c0e"}, "author": "", "url": "http://www.onenewspage.com/n/Sports/7559y3i27/Champagne-to-stand-for-Fifa-top-job.htm", "ord_in_thread": 0, "title": "Champagne to stand for Fifa top job", "locations": ["French", "Europe"], "entities": {"persons": [], "locations": [], "organizations": []}, "highlightText": "", "language": "english", "persons": ["Platini", "Michel Platini", "Jerome Champagne", "Michael Platini", "Salman al-Khalifa", "Shaikh Salman", "Sepp Blatter"], "text": "Champagne to stand for Fifa top job Friday, 23 October 2015 (15 minutes ago) Former adviser to Sepp Blatter, Jerome Champagne, says he intends to run for the Fifa presidency in time for Monday's deadline. Europe's soccer governing body UEFA stand by the organisation's president Michel Platini despite his suspension by the ethics committee at FIFA. Recent related news After previously withdrawing his candidacy through lack of support last time around, the former French diplomat is ready to stand again Goal.com 38 minutes ago - Sports • Former ExCo member submits official paperwork ahead of next year’s election • ‘We need to save Fifa and its role of governance and... guardian.co.uk 2 hours ago - Sports A senior FIFA official called into question Michel Platini's bid for football's top job, saying the failure to disclose a multi-million dollar payment could be... Zee News 2 days ago - Sports Also reported by • DNA • Bangkok Post FIFA’s executive committee ruled on Tuesday, without mentioning Platini by name, that candidates for the top job who are suspended were not eligible to run. NYTimes.com 3 days ago - Sports ZURICH - FIFA's executive committee gathered for Tuesday's crisis meeting as potential candidates consider standing for the presidency next February to claim the... Bangkok Post 3 days ago - World Asian Football Confederation chief Shaikh Salman says \"senior\" figures have asked him to run for the Fifa presidency. BBC Sport 3 days ago - Sports Sheikh Salman al-Khalifa's push for the presidency - revealed by Sky sources - may spell the end for Michael Platini's chances. Sky News 1 week ago - Front Page You Might Like Other recent news in Sports", "external_links": [], "published": "2015-10-23T12:28:00.000+03:00", "crawled": "2015-10-23T12:31:44.332+03:00", "highlightTitle": ""}