{"organizations": ["AP Mack", "Mavericks", "Al Horford", "NBA", "Atlanta Hawks", "LM Otero", "Dallas Mavericks", "AP Image", "AP", "Hawks"], "uuid": "b679f7287403fe9d01ed89e4dc1b302683584b8b", "thread": {"social": {"gplus": {"shares": 0}, "pinterest": {"shares": 0}, "vk": {"shares": 0}, "linkedin": {"shares": 0}, "facebook": {"likes": 0, "shares": 0, "comments": 0}, "stumbledupon": {"shares": 0}}, "site_full": "www.beaumontenterprise.com", "main_image": "http://ww1.hdnux.com/photos/41/45/55/8805208/3/rawImage.jpg", "site_section": "http://www.beaumontenterprise.com/sports/basketball/collectionRss/Sports-Basketball-Heds-7404.php", "section_title": "Sports Basketball Heds", "url": "http://www.beaumontenterprise.com/sports/article/Mack-s-big-2nd-half-helps-Hawks-beat-Mavericks-6575231.php", "country": "US", "title": "Mack's big 2nd half helps Hawks beat Mavericks 91-84", "performance_score": 0, "site": "beaumontenterprise.com", "participants_count": 0, "title_full": "Mack's big 2nd half helps Hawks beat Mavericks 91-84", "spam_score": 0.0, "site_type": "news", "published": "2015-10-17T06:22:00.000+03:00", "replies_count": 0, "uuid": "b679f7287403fe9d01ed89e4dc1b302683584b8b"}, "author": "", "url": "http://www.beaumontenterprise.com/sports/article/Mack-s-big-2nd-half-helps-Hawks-beat-Mavericks-6575231.php", "ord_in_thread": 0, "title": "Mack's big 2nd half helps Hawks beat Mavericks 91-84", "locations": ["Southeast Texas", "Miami", "Cleveland", "Dallas", "Atlanta", "Germany"], "entities": {"persons": [], "locations": [], "organizations": []}, "highlightText": "", "language": "english", "persons": ["Deron Williams", "Shelvin Mack", "Mike Muscala", "Zaza Pachulia", "Thabo Sefolosha", "Jeremy Evans", "Justin Holiday", "Chandler Parsons", "Walter Tavares", "J.J. Barea", "Al Horford", "LM Otero", "Mack", "Devin Harris", "Justin Anderson", "Dirk Nowitzki", "John Jenkins"], "text": "Close Image 1 of 8 Atlanta Hawks guard Justin Holiday (7) looks to pass against Dallas Mavericks defenders Zaza Pachulia (27) and Jeremy Evans during the first half of an NBA preseason basketball game Friday, Oct. 16, 2015, in Dallas. Atlanta Hawks guard Justin Holiday (7) looks to pass against Dallas Mavericks defenders Zaza Pachulia (27) and Jeremy Evans during the first half of an NBA preseason basketball game Friday, Oct. 16, 2015, in ... more Photo: LM Otero, AP Image 2 of 8 Atlanta Hawks forward Al Horford (15) dribbles against Dallas Mavericks forward Dirk Nowitzki of Germany during the first half of an NBA preseason basketball game Friday, Oct. 16, 2015, in Dallas. Atlanta Hawks forward Al Horford (15) dribbles against Dallas Mavericks forward Dirk Nowitzki of Germany during the first half of an NBA preseason basketball game Friday, Oct. 16, 2015, in Dallas. Photo: LM Otero, AP Image 3 of 8 Atlanta Hawks guard Thabo Sefolosha shoots against Dallas Mavericks guard Devin Harris (34) as guard John Jenkins (12) looks on during the first half of an NBA preseason basketball game Friday, Oct. 16, 2015, in Dallas. Atlanta Hawks guard Thabo Sefolosha shoots against Dallas Mavericks guard Devin Harris (34) as guard John Jenkins (12) looks on during the first half of an NBA preseason basketball game Friday, Oct. 16, ... more Photo: LM Otero, AP Image 4 of 8 Dallas Mavericks guard John Jenkins (12) passes off against Atlanta Hawks defenders Tiago Splitter (11) and Thabo Sefolosha (25) during the first half of an NBA preseason basketball game Friday, Oct. 16, 2015, in Dallas. Dallas Mavericks guard John Jenkins (12) passes off against Atlanta Hawks defenders Tiago Splitter (11) and Thabo Sefolosha (25) during the first half of an NBA preseason basketball game Friday, Oct. 16, ... more Photo: LM Otero, AP Image 5 of 8 Dallas Mavericks guard Justin Anderson (1) drives against Atlanta Hawks forward Mike Muscala (31) during the first half of an NBA preseason basketball game Friday, Oct. 16, 2015, in Dallas. Dallas Mavericks guard Justin Anderson (1) drives against Atlanta Hawks forward Mike Muscala (31) during the first half of an NBA preseason basketball game Friday, Oct. 16, 2015, in Dallas. Photo: LM Otero, AP Image 6 of 8 Dallas Mavericks guard J.J. Barea (5) takes the turnover against Atlanta Hawks forward Al Horford (15) as guard Justin Holiday (7) looks on during the first half of an NBA preseason basketball game Friday, Oct. 16, 2015, in Dallas. Dallas Mavericks guard J.J. Barea (5) takes the turnover against Atlanta Hawks forward Al Horford (15) as guard Justin Holiday (7) looks on during the first half of an NBA preseason basketball game Friday, ... more Photo: LM Otero, AP Image 7 of 8 Atlanta Hawks center Walter Tavares (22) defends the basket against Dallas Mavericks forward Jeremy Evans (21) during the first half of an NBA preseason basketball game Friday, Oct. 16, 2015, in Dallas. Atlanta Hawks center Walter Tavares (22) defends the basket against Dallas Mavericks forward Jeremy Evans (21) during the first half of an NBA preseason basketball game Friday, Oct. 16, 2015, in Dallas. Photo: LM Otero, AP Mack's big 2nd half helps Hawks beat Mavericks 91-84 1 / 8 Back to Gallery DALLAS (AP) â€” Shelvin Mack scored 11 of his 13 points in the second half, and the Atlanta Hawks beat the Dallas Mavericks 91-84 on Friday night. The game was tied 68-68 before Mack hit a 3-pointer with 38 seconds left in the third quarter to put Atlanta (4-0) ahead to stay. Each team shot 37 percent from the field. HAWKS: Al Horford had 16 points, adding five rebounds and two steals. MAVERICKS: John Jenkins had 16 points. He leads Dallas (0-4) this preseason with 19.3 points per game. STAR WATCH: Dirk Nowitzki made his preseason debut for Dallas, with six points and seven assists in 18 minutes. Deron Williams (strained left calf) and Chandler Parsons (right knee surgery) still haven't played. MIDSEASON FORM: Dallas point guard J.J. Barea had seven assists playing in the first half only. UP NEXT: Hawks host Miami on Sunday night. Mavericks visit Cleveland on Monday. Southeast Texas sports news", "external_links": [], "published": "2015-10-17T06:22:00.000+03:00", "crawled": "2015-10-17T06:34:55.811+03:00", "highlightTitle": ""}