{"organizations": ["Gabe Hughes of Florida Tech", "Brandon Keel", "Brandon Keel of West Alabama", "Montell Dent of West Alabama", "Florida Tech"], "uuid": "5bdfc365a71942db91ecd5f2bd17f896367182f5", "thread": {"social": {"gplus": {"shares": 0}, "pinterest": {"shares": 0}, "vk": {"shares": 0}, "linkedin": {"shares": 0}, "facebook": {"likes": 0, "shares": 0, "comments": 0}, "stumbledupon": {"shares": 0}}, "site_full": "www.floridatoday.com", "main_image": "http://www.gannett-cdn.com/-mm-/0ad6376b528376d57365dafef1f163e7d342f949/c=0-147-3114-1906&amp;r=x1683&amp;c=3200x1680/local/-/media/2015/10/10/Brevard/Brevard/635801116384496055-crb101915-fball-4-.jpg", "site_section": "http://rssfeeds.floridatoday.com/brevard/sports", "section_title": "Brevard - Sports", "url": "http://www.floridatoday.com/story/sports/college/florida-state-university/2015/10/10/fsu-takes-halftime-lead-miami/73757968/", "country": "US", "title": "Photos: Florida Tech vs. West Alabama football", "performance_score": 0, "site": "floridatoday.com", "participants_count": 0, "title_full": "Photos: Florida Tech vs. West Alabama football", "spam_score": 0.0, "site_type": "news", "published": "2015-10-11T06:06:00.000+03:00", "replies_count": 0, "uuid": "5bdfc365a71942db91ecd5f2bd17f896367182f5"}, "author": "", "url": "http://www.floridatoday.com/story/sports/college/florida-state-university/2015/10/10/fsu-takes-halftime-lead-miami/73757968/", "ord_in_thread": 0, "title": "Photos: Florida Tech vs. West Alabama football", "locations": ["West Alabama", "West Alabaman", "Florida Tech"], "entities": {"persons": [], "locations": [], "organizations": []}, "highlightText": "", "language": "english", "persons": ["Brandon Keel", "Randy Satterfield", "Tevin Kirkland", "Dezmon Huntley", "Taderion Myhand", "Mark Cato", "Greg Thomas", "Martez Reaves", "Leo Alba", "Craig Bailey/FLORIDA", "Manny Abad", "Gary Holmes", "Antwuan Haynes", "Daryl Collins", "TJ Lowder", "Duke Leland"], "text": "Photos: Florida Tech vs. West Alabama football Buy Photo TJ Lowder of Florida Tech is brought down by Brandon Keel of West Alabama during Saturday's game. Craig Bailey/FLORIDA TODAY Buy Photo Gary Holmes of Florida Tech is brought down by Brandon Keel of West Alabama during Saturday's game. Craig Bailey/FLORIDA TODAY Buy Photo Trevor Sand of Florida Tech is taken down by Montell Dent of West Alabama during Saturday's game. Craig Bailey/FLORIDA TODAY Fullscreen Buy Photo Trevor Sand of Florida Tech runs between West Alabama players Brandon Keel (33) and Duke Leland (2) during Saturday's game. Craig Bailey/FLORIDA TODAY Fullscreen Buy Photo Florida Tech's Mark Cato recovers a fumble before West Alabama's Martez Reaves (40) can recover it during Saturday's game. Craig Bailey/FLORIDA TODAY Fullscreen Buy Photo Florida Tech's Leo Alba II intercepts a ball intended for West Alabama's Daryl Collins but lands out of bounds during Saturday's game. Craig Bailey/FLORIDA TODAY Fullscreen Buy Photo Skylar Sheffield (55) and Tevin Kirkland (25) of Florida Tech tackle West Alabama QB Dezmon Huntley during Saturday's game. Craig Bailey/FLORIDA TODAY Fullscreen Buy Photo Taderion Myhand of West Alabaman intercepts a ball intended for Gabe Hughes of Florida Tech during Saturday's game. Craig Bailey/FLORIDA TODAY Fullscreen Buy Photo Manny Abad of Florida Tech rips the gal away from West Alabama player Randy Satterfield during Saturday's game. Craig Bailey/FLORIDA TODAY Fullscreen Buy Photo Florida Tech's Antwuan Haynes catches a pass in front of West Alabama player Brandon Keel during Saturday's game. Craig Bailey/FLORIDA TODAY Fullscreen Buy Photo Florida Tech's Antwuan Haynes is sandwiched by Brandon Keel and Greg Thomas of West Alabama during Saturday's game. Craig Bailey/FLORIDA TODAY", "external_links": [], "published": "2015-10-11T06:06:00.000+03:00", "crawled": "2015-10-11T08:56:15.504+03:00", "highlightTitle": ""}