{"organizations": ["Lansing Eastern", "Lansing State Journal", "Lansing State Journal Fullscreen"], "uuid": "a7ae9a9bedbba9d7bc84d95cc52d74bcaba0ef80", "thread": {"social": {"gplus": {"shares": 0}, "pinterest": {"shares": 0}, "vk": {"shares": 0}, "linkedin": {"shares": 0}, "facebook": {"likes": 0, "shares": 0, "comments": 0}, "stumbledupon": {"shares": 0}}, "site_full": "www.lansingstatejournal.com", "main_image": "http://www.gannett-cdn.com/-mm-/3f7287d1024e58cf9b8b5bdf982d2aa6de40400a/c=0-28-599-366&amp;r=x633&amp;c=1200x630/local/-/media/2015/10/20/MIGroup/Lansing/635809715094360859-aHaslettsoccer.jpg", "site_section": "https://feeds.feedblitz.com/lansing/sports", "section_title": "Lansing - Sports", "url": "http://www.lansingstatejournal.com/story/sports/high-school/2015/10/20/late-goals-help-haslett-boys-soccer-top-lansing-eastern-district-opener/74261142/", "country": "US", "title": "Late goals help Haslett advance to district semis", "performance_score": 0, "site": "lansingstatejournal.com", "participants_count": 0, "title_full": "Late goals help Haslett advance to district semis", "spam_score": 0.0, "site_type": "news", "published": "2015-10-21T07:35:00.000+03:00", "replies_count": 0, "uuid": "a7ae9a9bedbba9d7bc84d95cc52d74bcaba0ef80"}, "author": "", "url": "http://www.lansingstatejournal.com/story/sports/high-school/2015/10/20/late-goals-help-haslett-boys-soccer-top-lansing-eastern-district-opener/74261142/", "ord_in_thread": 0, "title": "Late goals help Haslett advance to district semis", "locations": ["Mich", "East Lansing"], "entities": {"persons": [], "locations": [], "organizations": []}, "highlightText": "", "language": "english", "persons": ["Matthew Clark", "Brian Coscarelli", "Connor Ashwood", "Panasshe Kahari", "Jesus Arroyo", "Haslett", "Paul Fiorillo", "Johnson Irmuva", "Harry DeHaven", "Fiorillo", "Nuru Abeli", "Ciza Gideon", "Andrew Schmidt", "Torsten Holland", "Bhupendra Ghalley", "Al Goldis", "Javier Gallego", "Uwimana Gasito", "Gideon", "Brian Calloway", "Hunter Nash", "Gabriel Millian"], "text": "Late goals help Haslett advance to district semis Brian Calloway , Lansing State Journal 12:35 a.m. EDT October 21, 2015 Buy Photo Haslett's Hunter Nash, right, makes a pass against Lansing Eastern's Johnson Irmuva in a Division 2 District soccer game Tuesday in East Lansing. (Photo: Al Goldis | For the Lansing State Journal) Buy Photo 35 CONNECT 8 TWEET LINKEDIN COMMENT EMAIL MORE Buy Photo Haslett's Hunter Nash, right, makes a pass against Lansing Eastern's Johnson Irmuva in a Division 2 District soccer game Tuesday, Oct. 20, 2015, in East Lansing, Mich. Haslett won 3-1. Al Goldis, Al Goldis | For the Lansing State Journal Buy Photo Fullscreen Buy Photo Haslett's Harry DeHaven (23) controls the ball in front of Lansing Eastern's Nuru Abeli in a Division 2 District soccer game Tuesday, Oct. 20, 2015, in East Lansing, Mich. Al Goldis, Al Goldis | For the Lansing State Journal Buy Photo Fullscreen Buy Photo Haslett's Connor Ashwood, right, heads the ball against Lansing Eastern as Paul Fiorillo watches in a Division 2 District soccer game Tuesday, Oct. 20, 2015, in East Lansing, Mich. Al Goldis, Al Goldis | For the Lansing State Journal Fullscreen Buy Photo Lansing Eastern's Ciza Gideon, left, Bhupendra Ghalley, center, and Johnson Irmuva celebrate Gideon's goal against Haslett in a Division 2 District soccer game Tuesday, Oct. 20, 2015, in East Lansing, Mich. Al Goldis, Al Goldis | For the Lansing State Journal Fullscreen Buy Photo Haslett players celebrate a goal by Harry DeHaven, center, against Lansing Eastern in a Division 2 District soccer game Tuesday, Oct. 20, 2015, in East Lansing, Mich. Al Goldis, Al Goldis | For the Lansing State Journal Buy Photo Fullscreen Buy Photo Lansing Eastern's Panasshe Kahari, left, reacts as his goalkeeper can't reach a Haslett shot by Harry DeHaven (not seen) in a Division 2 District soccer game Tuesday, Oct. 20, 2015, in East Lansing, Mich. Al Goldis, Al Goldis | For the Lansing State Journal Buy Photo Fullscreen Buy Photo Haslett's Brian Coscarelli, left, heads the ball over Lansing Eastern's Jesus Arroyo (19) in a Division 2 District soccer game Tuesday, Oct. 20, 2015, in East Lansing, Mich. Al Goldis, Al Goldis | For the Lansing State Journal Fullscreen Buy Photo Haslett's Paul Fiorillo, left, and Lansing Eastern's Ciza Gideon battle for the ball in a Division 2 District soccer game Tuesday, Oct. 20, 2015, in East Lansing, Mich. Al Goldis, Al Goldis | For the Lansing State Journal Buy Photo Fullscreen Buy Photo Lansing Eastern's Uwimana Gasito, left, kicks the ball into Haslett's Hunter Nash in a Division 2 District soccer game Tuesday, Oct. 20, 2015, in East Lansing, Mich. Al Goldis, Al Goldis | For the Lansing State Journal Buy Photo Fullscreen Buy Photo Lansing Eastern's Uwimana Gasito (4) heads the ball between Haslett's Matthew Clark, left, and Brian Coscarelli in a Division 2 District soccer game Tuesday, Oct. 20, 2015, in East Lansing, Mich. Al Goldis, Al Goldis | For the Lansing State Journal Fullscreen Buy Photo Lansing Eastern's Uwimana Gasito, center, loses his balance after heading the ball between Haslett's Matthew Clark, left, and Brian Coscarelli in a Division 2 District soccer game Tuesday, Oct. 20, 2015, in East Lansing, Mich. Al Goldis, Al Goldis | For the Lansing State Journal Fullscreen Buy Photo Haslett's Paul Fiorillo (5) scores against the Lansing Eastern goalkeeper in a Division 2 District soccer game Tuesday, Oct. 20, 2015, in East Lansing, Mich. Al Goldis, Al Goldis | For the Lansing State Journal Buy Photo Fullscreen Buy Photo Haslett's Gabriel Millian (24) kicks against Lansing Eastern in a Division 2 District soccer game Tuesday, Oct. 20, 2015, in East Lansing, Mich. Al Goldis, Al Goldis | For the Lansing State Journal Fullscreen Buy Photo Haslett's Paul Fiorillo, left, and Lansing Eastern's Ciza Gideon battle for the ball in a Division 2 District soccer game Tuesday, Oct. 20, 2015, in East Lansing, Mich. Al Goldis, Al Goldis | For the Lansing State Journal Buy Photo Fullscreen Buy Photo Lansing Eastern's Jesus Arroyo heads the ball against Haslett in a Division 2 District soccer game Tuesday, Oct. 20, 2015, in East Lansing, Mich. Al Goldis, Al Goldis | For the Lansing State Journal Buy Photo Fullscreen Buy Photo Haslett's Paul Fiorillo, left, and Lansing Eastern's Panasshe Kahari battle for a header in a Division 2 District soccer game Tuesday, Oct. 20, 2015, in East Lansing, Mich. Al Goldis, Al Goldis | For the Lansing State Journal Fullscreen Buy Photo Lansing Eastern's Panasshe Kahari, right, and Haslett's Andrew Schmidt, left, battle for the ball in a Division 2 District soccer game Tuesday, Oct. 20, 2015, in East Lansing, Mich. Al Goldis, Al Goldis | For the Lansing State Journal Buy Photo Fullscreen Buy Photo Haslett's Harry DeHaven, left, Gabriel Millian, center, and Paul Fiorillo celebrate Fiorillo's goal against Lansing Eastern in a Division 2 District soccer game Tuesday, Oct. 20, 2015, in East Lansing, Mich. Al Goldis, Al Goldis | For the Lansing State Journal Buy Photo Fullscreen Buy Photo Haslett's Torsten Holland, rear, and Lansing Eastern's Bhupendra Ghalley battle for the ball in a Division 2 District soccer game Tuesday, Oct. 20, 2015, in East Lansing, Mich. Al Goldis, Al Goldis | For the Lansing State Journal Buy Photo Fullscreen Buy Photo Haslett's Gabriel Millian, left, and Lansing Eastern's Javier Gallego battle for the ball in a Division 2 District soccer game Tuesday, Oct. 20, 2015, in East Lansing, Mich. Al Goldis, Al Goldis | For the Lansing State Journal Fullscreen Buy Photo Haslett players celebrate a goal by Torsten Holland (10) against Lansing Eastern in a Division 2 District soccer game Tuesday, Oct. 20, 2015, in East Lansing, Mich. Al Goldis, Al Goldis | For the Lansing State Journal Buy Photo Like this topic? You may also like these photo galleries: Replay", "external_links": [], "published": "2015-10-21T07:35:00.000+03:00", "crawled": "2015-10-21T13:05:40.722+03:00", "highlightTitle": ""}