{"organizations": ["First Coast News", "Flagler Palm Coast", "Middleburg", "Ridgeview", "Englewood", "Ribault", "Facebook Email Twitter Google", "Facebook", "Bartram Trail High School", "St. Augustine"], "uuid": "8a9e09860cf8e785bb99fac11303a3f0cf042aad", "thread": {"social": {"gplus": {"shares": 0}, "pinterest": {"shares": 0}, "vk": {"shares": 0}, "linkedin": {"shares": 0}, "facebook": {"likes": 0, "shares": 0, "comments": 0}, "stumbledupon": {"shares": 0}}, "site_full": "www.firstcoastnews.com", "main_image": "http://www.gannett-cdn.com/-mm-/489efad1142179deef9ce5ef3cf126cd99e1a3f1/r=x633&amp;c=1200x630/http/cdn.tegna-tv.com/-mm-/1788b39242764813a7700c292d0876bf99abef63/c=0-0-600-339/local/-/media/2015/10/03/WTLV/WTLV/635794311621338946-CQWo3g3UAAEvuF8.jpg", "site_section": "http://rssfeeds.firstcoastnews.com/_/20/109554014/firstcoastnews-sports", "section_title": "WTLV - Sports", "url": "http://www.firstcoastnews.com/story/sports/2015/10/03/sideline-2015-october-2nd/73266574/", "country": "US", "title": "Sideline 2015 highlights and scores from October 2nd", "performance_score": 0, "site": "firstcoastnews.com", "participants_count": 0, "title_full": "Sideline 2015 highlights and scores from October 2nd", "spam_score": 0.0, "site_type": "news", "published": "2015-10-03T09:29:00.000+03:00", "replies_count": 0, "uuid": "8a9e09860cf8e785bb99fac11303a3f0cf042aad"}, "author": "", "url": "http://www.firstcoastnews.com/story/sports/2015/10/03/sideline-2015-october-2nd/73266574/", "ord_in_thread": 0, "title": "Sideline 2015 highlights and scores from October 2nd", "locations": ["Englewood"], "entities": {"persons": [], "locations": [], "organizations": []}, "highlightText": "", "language": "english", "persons": ["Ed White", "Chad Cushnir", "Stanton"], "text": "Facebook Email Twitter Google+ LinkedIn Pinterest Sideline 2015 highlights and scores from October 2nd Ed White 35, Middleburg 14 Sandalwood 21, Flagler Palm Coast 7 Orange Park 25, Ridgeview 20 Ribault 47, Stanton 0 St. Augustine 45, Englewood 6 Post to Facebook Sideline 2015 highlights and scores from October 2nd Ed White 35, Middleburg 14 Sandalwood 21, Flagler Palm Coast 7 Orange Park 25, Ridgeview 20 Ribault 47, Stanton 0 St. Augustine 45, Englewood 6  //fcnews.tv/1L9MUZu   Join the Conversation To   Sideline 2015 highlights and scores from October 2nd Chad Cushnir, First Coast News 2:29 a.m. EDT October 3, 2015 \"Bear Stadium\" at Bartram Trail High School (Photo: Chad Cushnir) \nScores from Friday, October 2, 2015 \nEd White 35, Middleburg 14 \nSandalwood 21, Flagler Palm Coast 7 \nOrange Park 25, Ridgeview 20 \nRibault 47, Stanton 0 \nSt. Augustine 45, Englewood 6 10/02/15 video First Coast News \nCharlton County 28, Irwin County 14 \nInterlachen 7, Bishop Snyder 6 \nLake Mary Prep 22, Christ's Church Academy 14 \nBaker County 17, Palatka 7", "external_links": [], "published": "2015-10-03T09:29:00.000+03:00", "crawled": "2015-10-03T10:22:46.683+03:00", "highlightTitle": ""}