{"organizations": ["Puyallup Girls", "KING Curtis' Morgan Weaver and Puyallup", "Facebook Girls", "KING Puyallup's Leah Nisco", "KING Curtis' Maddy Parry", "Puyallup Puyalup", "KING Curtis"], "uuid": "3531eb05d1d381089b2dc146cd883d5ec8b81f4a", "thread": {"social": {"gplus": {"shares": 0}, "pinterest": {"shares": 0}, "vk": {"shares": 0}, "linkedin": {"shares": 0}, "facebook": {"likes": 0, "shares": 0, "comments": 0}, "stumbledupon": {"shares": 0}}, "site_full": "www.king5.com", "main_image": "http://cdn.tegna-tv.com/-mm-/fbb7555c82dc180c12827003b17ffbcd5f9d1dd9/c=416-216-4608-2585&amp;r=x1683&amp;c=3200x1680/local/-/media/2015/10/21/NWGroup/KING/635809904140237155-P2530512.JPG", "site_section": "http://rssfeeds.king5.com/_/20/109023742/king5/highschoolsports", "section_title": "KING 5 - High School Sports", "url": "http://www.king5.com/picture-gallery/sports/high-school/2015/10/21/girls-soccer-curtis-vs-puyallup/74314574/", "country": "US", "title": "Girls soccer: Curtis vs. Puyallup", "performance_score": 0, "site": "king5.com", "participants_count": 0, "title_full": "Girls soccer: Curtis vs. Puyallup", "spam_score": 0.0, "site_type": "news", "published": "2015-10-21T09:31:00.000+03:00", "replies_count": 0, "uuid": "3531eb05d1d381089b2dc146cd883d5ec8b81f4a"}, "author": "", "url": "http://www.king5.com/picture-gallery/sports/high-school/2015/10/21/girls-soccer-curtis-vs-puyallup/74314574/", "ord_in_thread": 0, "title": "Girls soccer: Curtis vs. Puyallup", "locations": ["KING Puyallup", "Sariah Keister"], "entities": {"persons": [], "locations": [], "organizations": []}, "highlightText": "", "language": "english", "persons": ["Jamie Steckler", "Curtis' Torrey Tompkins", "Curtis", "Curtis' Morgan Weaver", "Saige Lyons", "Olivia Engle", "Jordyn Bartelson", "Allison Thomasseau", "Hallie Johnson", "Cammie Wolter"], "text": "Girls soccer: Curtis vs. Puyallup Puyalup's Cammie Wolter dribbles during the Oct. 20 Curtis vs. Puyallup girls soccer game. Post to Facebook Girls soccer: Curtis vs. Puyallup Puyalup's Cammie Wolter dribbles during the Oct. 20 Curtis vs. Puyallup girls soccer game.   KING5.com: http://www.king5.com/picture-gallery/sports/high-school/2015/10/21/girls-soccer-curtis-vs-puyallup/74314574/   Join the Conversation To   Girls soccer: Curtis vs. Puyallup Puyalup's Cammie Wolter dribbles during the Oct. 20 Curtis vs. Puyallup girls soccer game. Allison Thomasseau / KING Puyallup's Hallie Johnson passes during the Oct. 20 Curtis vs. Puyallup girls soccer game. Allison Thomasseau / KING Curtis' Torrey Tompkins during the Oct. 20 Curtis vs. Puyallup girls soccer game. Allison Thomasseau / KING Puyallup's Jordyn Bartelson looks for her next pass during the Oct. 20 Curtis vs. Puyallup girls soccer game. Allison Thomasseau / KING Curtis' Jamie Steckler dribbles during the Oct. 20 Curtis vs. Puyallup girls soccer game. Allison Thomasseau / KING Puyallup's Leah Nisco dribbles during the Oct. 20 Curtis vs. Puyallup girls soccer game. Allison Thomasseau / KING Curtis' Morgan Weaver looks for her next pass during the Oct. 20 Curtis vs. Puyallup girls soccer game. Allison Thomasseau / KING Puyallup's Hallie Johnson takes a free kick during the Oct. 20 Curtis vs. Puyallup girls soccer game. Allison Thomasseau / KING Curtis' Sariah Keister during the Oct. 20 Curtis vs. Puyallup girls soccer game. Allison Thomasseau / KING Curtis' Morgan Weaver and Puyallup's Saige Lyons fight for the ball during the Oct. 20 Curtis vs. Puyallup girls soccer game. Allison Thomasseau / KING Curtis goalkeeper Olivia Engle punts during the Oct. 20 Curtis vs. Puyallup girls soccer game. Allison Thomasseau / KING Curtis' Maddy Parry traps the ball during the Oct. 20 Curtis vs. Puyallup girls soccer game. Allison Thomasseau / KING Like this topic? You may also like these photo galleries: Replay", "external_links": [], "published": "2015-10-21T09:31:00.000+03:00", "crawled": "2015-10-21T09:37:02.110+03:00", "highlightTitle": ""}