{"organizations": ["ICC", "Deccan Herald"], "uuid": "33ec2440775005e27a2378a88f7da09294ec5f66", "thread": {"social": {"gplus": {"shares": 0}, "pinterest": {"shares": 0}, "vk": {"shares": 0}, "linkedin": {"shares": 0}, "facebook": {"likes": 0, "shares": 0, "comments": 0}, "stumbledupon": {"shares": 0}}, "site_full": "www.onenewspage.com", "main_image": "http://cdn.newsserve.net/ONPglobe256.jpg", "site_section": "http://www.onenewspage.com/rss/latest/Sports.rss", "section_title": "Latest Sports News on One News Page", "url": "http://www.onenewspage.com/n/Sports/7559y0xbb/Now-Akram-and-Akhtar-pull-out-of-fifth.htm", "country": "US", "title": "Now, Akram and Akhtar pull out of fifth ODI in Mumbai", "performance_score": 0, "site": "onenewspage.com", "participants_count": 0, "title_full": "Now, Akram and Akhtar pull out of fifth ODI in Mumbai", "spam_score": 0.0, "site_type": "news", "published": "2015-10-20T09:51:00.000+03:00", "replies_count": 0, "uuid": "33ec2440775005e27a2378a88f7da09294ec5f66"}, "author": "", "url": "http://www.onenewspage.com/n/Sports/7559y0xbb/Now-Akram-and-Akhtar-pull-out-of-fifth.htm", "ord_in_thread": 0, "title": "Now, Akram and Akhtar pull out of fifth ODI in Mumbai", "locations": ["Mumbai", "Pakistan", "New Delhi", "South Africa", "India"], "entities": {"persons": [], "locations": [], "organizations": []}, "highlightText": "", "language": "english", "persons": ["Shoiab Akhtar", "Wasim Akram", "Aleem Dar", "Akhtar", "Shoaib Akhtar", "Akram"], "text": "Now, Akram and Akhtar pull out of fifth ODI in Mumbai Tuesday, 20 October 2015 (5 minutes ago) \" Pakistani dashing duo of Wasim Akram and Shoiab Akhtar away from cricket was seen partying along with the bigwigs of B-Town. \" Other recent news in Cricket: New Delhi, Oct.20 : Former Pakistan cricketers Wasim Akram and Shoaib Akhtar have pulled out of their broadcasting duties for the fifth and last ODI match... newKerala.com 24 minutes ago - Sports Former Pakistan pacers Wasim Akram and Shoaib Akhtar have pulled out from the commentary team for the fifth and final ODI between India and South Africa in... DNA 47 minutes ago - Front Page The ICC on Monday withdrew Pakistan umpire Aleem Dar from officiating in the remaining two matches of the ongoing one-day series between India and South Africa... DNA 12 hours ago - Front Page *The ICC on Monday withdrew Pakistan umpire Aleem Dar from officiating in the remaining two matches of the ongoing one-day series between India and South Africa... Deccan Herald 16 hours ago - Sports You Might Like", "external_links": [], "published": "2015-10-20T09:51:00.000+03:00", "crawled": "2015-10-20T09:55:27.462+03:00", "highlightTitle": ""}