{"organizations": ["Doctors Medical Center", "Sonora Regional Medical Center", "Freeport", "San Francisco Giants", "National Service Medal", "KMart", "NEILL", "Church of Christ", "Summerville Union High"], "uuid": "b2dd4c0a18e9c264d500e602cccd675076074ab5", "thread": {"social": {"gplus": {"shares": 0}, "pinterest": {"shares": 0}, "vk": {"shares": 0}, "linkedin": {"shares": 0}, "facebook": {"likes": 0, "shares": 0, "comments": 0}, "stumbledupon": {"shares": 0}}, "site_full": "www.uniondemocrat.com", "main_image": "", "site_section": "http://feeds.feedburner.com/UnionDemocrat", "section_title": "The Union Democrat, Sonora, CA News, Sports, & Weather", "url": "http://www.uniondemocrat.com/index.php?option=com_content&task=view&id=117687&Itemid=34", "country": "US", "title": "Obituaries for October 2, 2015", "performance_score": 0, "site": "uniondemocrat.com", "participants_count": 0, "title_full": "Obituaries for October 2, 2015", "spam_score": 0.0, "site_type": "news", "published": "2015-10-02T01:25:00.000+03:00", "replies_count": 0, "uuid": "b2dd4c0a18e9c264d500e602cccd675076074ab5"}, "author": "", "url": "http://www.uniondemocrat.com/index.php?option=com_content&task=view&id=117687&Itemid=34", "ord_in_thread": 0, "title": "Obituaries for October 2, 2015", "locations": ["Idaho", "Sonora", "Texas", "Boise", "San Francisco", "Terzich", "Sacramento", "Tuolumne County", "Durango", "Tuolumne Road", "Modesto", "Pasadena", "Colorado", "Kenyon", "Arkansas"], "entities": {"persons": [], "locations": [], "organizations": []}, "highlightText": "", "language": "english", "persons": ["Corina Noddin", "Wanda", "Megan", "Reba Jean", "Cheree", "Robert", "Rick", "Robert Glenn Oliver", "John Winston", "Nixon", "Michael Railton", "Mia Noddin", "Barbara Persson", "George Railton", "Neola Jacobson", "Corina", "David Noddin", "JACOBSON", "Tom Oliver", "Margaret Railton", "Wanda Oliver", "Reba", "Eric Noddin", "Lauren Paul", "Robert Glenn Oliver April", "Rosemarie Lashkoff", "Jerry", "Ellen Paul", "Steve", "Owsiewski", "Tom", "Eugenia Stits", "Eileen Noddin", "Paul Kellie", "Margaret Paul", "Portia", "John Kellie", "Edward", "Maureen Maldnado", "Penny Noddin", "Sue Neill", "Joan Railton", "Letitia Railton", "Ed Winston", "David Winston", "Thomas Railton", "Steve Huntoon", "Ron Oliver"], "text": "Obituaries for October 2, 2015 Obituaries for October 2, 2015 By Union Democrat staff October 01, 2015 10:25 pm Obituary policy Obituaries, including photos, are published at a pre-paid fee based on size. The deadline is 5 p.m. two business days prior to publication. Call 532-7151, fax 532-5139 or send to This e-mail address is being protected from spam bots, you need JavaScript enabled to view it Memorial ads are published at a pre-paid fee based on size. The deadline is noon two business days prior to publication. Please call 588-4555 for complete information. Thomas Railton Sept. 24, 1941 — Sept. 28, 2015 Thomas Railton was born on Sept. 24, 1941, in San Francisco to George Railton and Letitia Railton (Corcoran). He passed away on Sept. 28, 2015, at Sonora Regional Medical Center. Tom is survived by his wife of 51 years, Joan Railton (Owsiewski); his children, Margaret Paul and husband Rick, Edward and Michael Railton; his grandchildren, Michael Railton, Ellen Paul and Lauren Paul; his sisters in-law, Rosemarie Lashkoff and Margaret Railton; and nieces and nephews. Tom retired after working for Lucent/Western Electric for 37 years. His retirement years were spent traveling, spending time with his family and pursuing his interest in sport cars. The family will hold a celebration of life at a later date. Robert Glenn Oliver April 21, 1949 — Sept. 16, 2015 Robert Glenn Oliver passed away on Sept. 16 at Sonora Regional Medical Center. Robert was born on April 21, 1949, in Pasadena to Wanda and John Kellie. He was the youngest of three children growing up in Pasadena and later moving to Standard and then Tuolumne. Robert graduated from Summerville Union High in June 1967. He served in the Army from May 1969 to May 1971. Robert received the National Service Medal and an honorable discharge. He was extremely proud of his work as a roofer. After many years he could still identify each home he worked on. He loved fishing the streams of the Sierra foothills and knew the areas like the back of his hand. Robert enjoyed all types of music. He was an avid San Francisco Giants fan and looked forward to watching every game. Robert was preceded in death by his parents, John Kellie, Wanda Oliver and stepfather Tom Oliver; his sister, Eugenia Stits; and special girlfriend and companion, Maureen Maldnado. Robert is survived by his brother, Paul Kellie, of Freeport, Texas; his step-brother, Ron Oliver, of Sonora; and many friends and classmates. Longtime neighbors Barbara Persson and Steve Huntoon were a great support to him during his illness and will miss him greatly. There will be no funeral as he requested. A celebration of life gathering will be held on Saturday, Oct. 17, at the Old Fish Hatchery Basin Creek campground from 1 to 4 p.m. For any questions, please call 209-222-0657. Corina Noddin Dec. 12, 1939 — Sept. 26, 2015 Corina Noddin was born on Dec. 12, 1939, in Durango, Colorado. She was 75 years old. Corina passed away on Sept. 26, 2015, at Sonora Assisted Living, Unit 6. She worked as a medical assistant and was a resident of Tuolumne for 40 years. Corina was survived by her two children, Penny Noddin and Eileen Noddin, and her two grandchildren, Eric Noddin and Mia Noddin. Corina was preceded in death by her husband of 41 years, David Noddin. Memorial services will be held on Wednesday, Oct. 7, at 2 p.m. at the Terzich and Wilson Funeral Home. Corina was known by many and loved by all of them. She will be greatly missed. Reba Jean (Buchanan) Winston Feb. 25, 1936 — Sept. 10, 2015 Reba Jean (Buchanan) Winston was born on Feb. 25, 1936, in Kenyon, Arkansas. She passed away peacefully at her home on Sept. 10, 2015. She was 79 years old. Reba had spent the last 20 years living in Tuolumne County. She spent 16 years working for KMart, from which she retired. Reba was an avid member of the Church of Christ. She enjoyed being a full-time mom, cooking, sewing, studying the Bible and being a Bible teacher. Reba was survived by her husband of 61 years, John Winston; her three sons, Jerry, Steve and David Winston; her three grandchildren, Megan, of Boise, Idaho, Portia and Cheree, of Sacramento; and her one great-grandchild, Nixon. Reba was preceded in death by her son, Ed Winston, who passed in 1990 at the age of 35. Reba touched the hearts of everyone she met. It was not uncommon for many people to refer to her as mom. Reba will be greatly missed by all who knew her. Family will have a celebration of life at the Church of Christ on Oct. 3, 2015 at 14054 Tuolumne Road, Sonora, CA 95370. Services will be at 11 a.m. with a lunch to follow at noon. Death notices Death Notices in The Union Democrat are published free of charge. They include the name, age and hometown of the deceased, the date of death; service information; and memorial contribution information. The deadline is 2 p.m. the day before publication. Notices JACOBSON — Neola Jacobson, 75, former resident of Tuolumne County, died Wednesday at Sonora Regional Medical Center. Heuton Memorial Chapel is handling arrangements. NEILL — Sue Neill, 71, of Sonora, died Tuesday at Doctors Medical Center in Modesto. Heuton Memorial Chapel is handling arrangements. A memorial service is being held 11 a.m. today at Heuton Memorial Chapel. Follow UnionDemocrat.com", "external_links": [], "published": "2015-10-02T01:25:00.000+03:00", "crawled": "2015-10-03T07:24:24.573+03:00", "highlightTitle": ""}