{"organizations": ["Las Vegas", "EPA", "Senate", "Congress", "Arizona", "U.S. Environmental Protection Agency", "Interstate 95", "NBC Right Now Hearn", "Tennessee State University"], "uuid": "a6051ace3828dbde502421ff8545cda4ace7d9b1", "thread": {"social": {"gplus": {"shares": 0}, "pinterest": {"shares": 0}, "vk": {"shares": 0}, "linkedin": {"shares": 0}, "facebook": {"likes": 0, "shares": 0, "comments": 0}, "stumbledupon": {"shares": 0}}, "site_full": "www.swxrightnow.com", "main_image": "http://images.worldnow.com/AP/images/9079160_G.jpg", "site_section": "http://www.swxrightnow.com/category/13566/national-sports?clienttype=rss&redirected=true", "section_title": "Sports and Weather Right Now - National Sports - Headline", "url": "http://www.swxrightnow.com/story/30331026/hearn-hubbard-thompson-share-las-vegas-lead", "country": "US", "title": "Hearn, Hubbard, Thompson share Las Vegas lead", "performance_score": 0, "site": "swxrightnow.com", "participants_count": 0, "title_full": "Hearn, Hubbard, Thompson share Las Vegas lead", "spam_score": 0.0, "site_type": "news", "published": "2015-10-23T08:56:00.000+03:00", "replies_count": 0, "uuid": "a6051ace3828dbde502421ff8545cda4ace7d9b1"}, "author": "", "url": "http://www.swxrightnow.com/story/30331026/hearn-hubbard-thompson-share-las-vegas-lead", "ord_in_thread": 0, "title": "Hearn, Hubbard, Thompson share Las Vegas lead", "locations": ["Las Vegas", "New York City", "U.S.", "Seattle", "Charleston", "Albuquerque", "Arizona", "Nashville", "Denver", "Colorado"], "entities": {"persons": [], "locations": [], "organizations": []}, "highlightText": "", "language": "english", "persons": ["David Hearn", "Tyrone Howard", "Hearn", "Alan Garcia", "Tyler Aldridge", "Patrick Rodgers", "Aishwarya Mandyam", "Mark Hubbard", "Thompson", "Hubbard", "Corey Jones", "Jimmy Walker"], "text": "NBC Right Now Hearn, Hubbard, Thompson share Las Vegas lead (AP Photo/Isaac Brekken). David Hearn hits a tee shot on the ninth hole during the first round of the Shriners Hospitals for Children Open golf tournament Thursday, Oct. 22, 2015, in Las Vegas. (AP Photo/Isaac Brekken). Tyler Aldridge hits a tee shot on the sixth hole during the first round of the Shriners Hospitals for Children Open golf tournament Thursday, Oct. 22, 2015, in Las Vegas. (AP Photo/Isaac Brekken). Jimmy Walker hits a tee shot on the 17th hole during the first round of the Shriners Hospitals for Children Open golf tournament Thursday, Oct. 22, 2015, in Las Vegas. (AP Photo/Isaac Brekken). Patrick Rodgers waves to the crowd on the 18th green during the first round of the Shriners Hospitals for Children Open golf tournament Thursday, Oct. 22, 2015, in Las Vegas. (AP Photo/Isaac Brekken). Mark Hubbard hits a tee shot on the 18th hole during the first round of the Shriners Hospitals for Children Open golf tournament Thursday, Oct. 22, 2015, in Las Vegas. Authorities say three people have been shot at Tennessee State University in Nashville. More >> Authorities say three people have been shot at Tennessee State University in Nashville. More >> Senate bill could cut nonviolent drug offenders' sentences Nonviolent drug offenders could be eligible for shorter prison sentences under legislation a Senate committee is considering. More >> Nonviolent drug offenders could be eligible for shorter prison sentences under legislation approved by a Senate panel Thursday, as Congress took initial steps to change the nation's criminal justice system. More >> Bond lowered for friend of suspect in black church massacre A federal magistrate on Thursday lowered bond for a man accused of failing to tell authorities all he knew about the suspect in the massacre of nine black people at a Charleston church last June. More >> A federal magistrate on Thursday lowered bond for a man accused of failing to tell authorities all he knew about the suspect in the massacre of nine black people at a Charleston church last June. More >> Police officer's slaying puts 'drug courts' under scrutiny Authorities say the case against a man accused of gunning down a New York City police officer will be presented to a grand jury this week. More >> Arrested in a 19-person drug sweep, Tyrone Howard was one of only three who got sent to drug court, which offered him treatment instead of prison. More >> Free housing, other efforts try to attract women to tech Free rent and groceries were selling points, but college freshman Aishwarya Mandyam was more excited about the chance to connect with like-minded women when she moved into the eight-bedroom house offered up by a... More >> Free rent and groceries were selling points, but college freshman Aishwarya Mandyam was more excited about the chance to connect with like-minded women when she moved into the eight-bedroom house offered up by a Seattle... More >> Attorneys: Black drummer shot 3 times, never fired his gun Corey Jones grew up in church, watching his grandfather preach, acting in plays directed by his aunt and watching his uncles play drums. By age 4, he was already banging on the drum set and eventually took over for... More >> A black man who was a public housing inspector and part-time drummer was shot three times by a plainclothes police officer near his broken down vehicle on Interstate 95 and never fired his own gun, attorneys for his family... More >> Probe finds EPA error caused mine spill it hoped to avoid Government investigators squarely blame the U.S. Environmental Protection Agency for a 3 million gallon wastewater spill from a Colorado gold mine, saying a cleanup crew rushed its work and failed to consider the... More >> Government investigators squarely blamed the U.S. Environmental Protection Agency on Thursday for a 3 million-gallon wastewater spill from a Colorado gold mine, saying an EPA cleanup crew rushed its work and failed to... More >> Documents: Arizona tried to illegally import execution drug Arizona tried to illegally import a lethal injection drug that's not approved in the U.S. but never obtained it after federal agents stopped the shipment at the Phoenix airport, according to documents obtained... More >> Arizona tried to illegally import a lethal injection drug that's not approved in the U.S. but never obtained it after federal agents stopped the shipment at the Phoenix airport, according to documents obtained by The... More >> AP PHOTOS: Warehouse exposes cost of illegal wildlife trade Elephant tusks, leopard heads, crocodile skin purses and tiger skins - more than 1.5 million items in all - fill the shelves of a warehouse on a wildlife refuge near Denver. More >> Elephant tusks, leopard heads, crocodile skin purses and tiger skins - more than 1.5 million items in all - fill the shelves of a warehouse on a wildlife refuge near Denver. More >> Fatal shooting of 4-year-old began with traffic lane dispute A 32-year-old man is facing murder charges in the road-rage killing of a 4-year-old Albuquerque girl, who was shot in the backseat of her father's truck - a death that horrified the public. More >> Alan Garcia had just picked up his two children from school when it happened. He was trying to get off a freeway, and another car forced him out of his lane. More >>", "external_links": [], "published": "2015-10-23T08:56:00.000+03:00", "crawled": "2015-10-23T10:00:37.642+03:00", "highlightTitle": ""}