{"organizations": ["Lamar   Development", "UCF", "AP Top", "Penn State", "NCAA", "AP", "Eau Claire", "Temple", "Umpqua Community College"], "uuid": "632ad5fadb31a5d753829417ab68630da109caca", "thread": {"social": {"gplus": {"shares": 0}, "pinterest": {"shares": 0}, "vk": {"shares": 0}, "linkedin": {"shares": 0}, "facebook": {"likes": 0, "shares": 0, "comments": 0}, "stumbledupon": {"shares": 0}}, "site_full": "www.wqow.com", "main_image": "http://images.worldnow.com/AP/images/9044321_G.jpg", "site_section": "http://www.WQOW.com/Global/category.asp?C=13566&clienttype=rss", "section_title": "WQOW TV News 18 - National Sports - Headline", "url": "http://www.wqow.com/story/30289610/american-uprising-memphis-temple-join-houston-in-ap-top-25", "country": "US", "title": "American uprising: Memphis, Temple join Houston in AP Top 25", "performance_score": 0, "site": "wqow.com", "participants_count": 0, "title_full": "American uprising: Memphis, Temple join Houston in AP Top 25", "spam_score": 0.0, "site_type": "news", "published": "2015-10-18T21:02:00.000+03:00", "replies_count": 0, "uuid": "632ad5fadb31a5d753829417ab68630da109caca"}, "author": "", "url": "http://www.wqow.com/story/30289610/american-uprising-memphis-temple-join-houston-in-ap-top-25", "ord_in_thread": 0, "title": "American uprising: Memphis, Temple join Houston in AP Top 25", "locations": ["United States", "Tenn.", "US", "Houston", "Syria", "Philadelphia", "Mississippi", "Florida", "Oregon", "New York City", "Manhattan", "Columbus", "NEWARK", "Michigan", "Memphis", "Ohio"], "entities": {"persons": [], "locations": [], "organizations": []}, "highlightText": "", "language": "english", "persons": ["Mahmoud Karaz", "Jamiyus Pittman", "Thomas", "Humphrey", "Chase Farris", "Paxton Lynch", "Mintz", "Eddie Murphy", "Jahad Thomas", "Chris Mintz", "Mark Twain", "Ezekiel Elliott", "Jason Stewart"], "text": "American uprising: Memphis, Temple join Houston in AP Top 25 - WQOW TV: Eau Claire, WI NEWS18 News, Weather, and Sports Member Center: The CW American uprising: Memphis, Temple join Houston in AP Top 25 (AP Photo/Mark Humphrey). Memphis quarterback Paxton Lynch (12) celebrates with quarterback Jason Stewart, left, after they upset No. 13 Mississippi 37-24 in an NCAA college football game Saturday, Oct. 17, 2015, in Memphis, Tenn. (Yong Kim/The Philadelphia Inquirer via AP). Temple's Jahad Thomas runs past UCF's Jamiyus Pittman during the fourth-quarter on Saturday, Oct. 17, 2015 in Philadelphia. Thomas scored on a 21 yard run. PHIX OUT; TV OUT; MAGS OUT; NEWARK OUT; MANDATOR... (AP Photo/Paul Vernon). Ohio State running back Ezekiel Elliott, left, celebrates his touchdown against Penn State with teammate offensive lineman Chase Farris during the first half of an NCAA college football game Saturday, Oct. 17, 2015, in Columbus,...   Police say 1 killed, 4 injured in shooting at ZombiCon Police say at least two people have been shot at the ZombiCon gathering in Florida. More >> Police say a shooting at the annual ZombiCon gathering in Florida has left one person dead and five more injured, causing a chaotic scene that sent throngs of zombie-dressed revelers running through the streets. More >> Bill   Schools across US find alternatives to suspending students The recent arrest of a 14-year-old Muslim boy whose teacher mistook his homemade clock for a bomb led to widespread ridicule of school officials and accusations that Islamophobia may have played a part. More >> The recent arrest of a 14-year-old Muslim boy whose teacher mistook his homemade clock for a bomb led to widespread ridicule of school officials and accusations that Islamophobia may have played a part. More >> Eddie Murphy is trading places with Mark Twain. More >> Eddie Murphy is trading places with Mark Twain. More >> To many in New York City, the rats are winning. More >> To many in New York City, the rats are winning. More >> Lamar   Development plans for Mormon cattle ranch stirs controversy A section of one of the nation's largest ranches could be transformed into new housing developments for half a million Floridians in the coming decades. More >> Under one of the biggest land development plans ever proposed in Florida, a tract more than six times the size of Manhattan could be transformed from a home for cows and alligators into new housing developments for half a... More >> Oregon college shooting victim describes gunman's rampage Chris Mintz, an Oregon college student celebrated as a hero for running toward danger while a gunman opened fire at Umpqua Community College, says the shooter showed no emotion as he shot Mintz five times. More >> Chris Mintz, a college student celebrated as a hero for running toward danger when a gunman opened fire at Umpqua Community College, says the shooter showed no emotion as he shot Mintz five times. More >> As some Syrian refugees arrive, Michigan makes case for more For Mahmoud Karaz, there is no going back to Syria. But he feels welcome in the United States, surrounded by familiar food and culture while he learns English and trains for a job. More >> For Mahmoud Karaz, there is no going back to Syria. But he feels welcome in the United States, surrounded by familiar food and culture while he learns English and trains for a job. More >>", "external_links": [], "published": "2015-10-18T21:02:00.000+03:00", "crawled": "2015-10-18T22:11:37.624+03:00", "highlightTitle": ""}