{"organizations": ["Merritt Island", "Taylor Miles"], "uuid": "5e82c7008ed23e9f2d21aaccb2843af848258fbf", "thread": {"social": {"gplus": {"shares": 0}, "pinterest": {"shares": 0}, "vk": {"shares": 0}, "linkedin": {"shares": 0}, "facebook": {"likes": 0, "shares": 0, "comments": 0}, "stumbledupon": {"shares": 0}}, "site_full": "www.floridatoday.com", "main_image": "http://www.gannett-cdn.com/-mm-/77adb62b7b9cbe7f1e789c8492d2f0ab03aab0b0/c=0-63-3791-2205&amp;r=x1683&amp;c=3200x1680/local/-/media/2015/10/22/Brevard/Brevard/635811494171523061-crb102215-vball-12-.jpg", "site_section": "http://rssfeeds.floridatoday.com/brevard/sports", "section_title": "Brevard - Sports", "url": "http://www.floridatoday.com/story/sports/high-school/2015/10/22/mustangs-tigers-win-district-volleyball/74437400/", "country": "US", "title": "Photos: Rockledge vs. Merritt Island Class 5A District 14 championship", "performance_score": 0, "site": "floridatoday.com", "participants_count": 0, "title_full": "Photos: Rockledge vs. Merritt Island Class 5A District 14 championship", "spam_score": 0.0, "site_type": "news", "published": "2015-10-23T05:40:00.000+03:00", "replies_count": 0, "uuid": "5e82c7008ed23e9f2d21aaccb2843af848258fbf"}, "author": "", "url": "http://www.floridatoday.com/story/sports/high-school/2015/10/22/mustangs-tigers-win-district-volleyball/74437400/", "ord_in_thread": 0, "title": "Photos: Rockledge vs. Merritt Island Class 5A District 14 championship", "locations": ["Rockledge"], "entities": {"persons": [], "locations": [], "organizations": []}, "highlightText": "", "language": "english", "persons": ["Craig Bailey/FLORIDA", "Ashley Kube", "Alyssa Zwolensky", "Merritt", "Anna Garrett", "Loren Farrow", "Katy Seymour", "Desouza", "Baker", "Lexy Denaburg", "Heather Miller"], "text": "Photos: Rockledge vs. Merritt Island Class 5A District 14 championship Buy Photo Merritt Island's Lexy Denaburg spikes the ball during Thursday's Class 5A District 14 championship match. Craig Bailey/FLORIDA TODAY Fullscreen Buy Photo Rockledge's Aurea Desouza digs a ball off the floor during Thursday's Class 5A District 14 championship match against Merritt Island. Craig Bailey/FLORIDA TODAY Buy Photo Merritt Island's Ashley Kube spikes the ball during Thursday's Class 5A District 14 championship match against Rockledge. Craig Bailey/FLORIDA TODAY Fullscreen Buy Photo Rockledge players (15) and (11) go for a ball during Thursday's Class 5A District 14 championship match against Merritt Island. Craig Bailey/FLORIDA TODAY Fullscreen Buy Photo Merritt Island's Anna Garrett (10) and Loren Farrow block the spike of Rockledge's J'ena Baker (15) during Thursday's Class 5A District 14 championship match. Craig Bailey/FLORIDA TODAY Fullscreen Buy Photo Merritt Island's Alyssa Zwolensky spikes over the block of Taylor Miles (1) and Katy Seymour of Rockledge during Thursday's Class 5A District 14 championship match. Craig Bailey/FLORIDA TODAY Fullscreen Buy Photo Merritt Island's Heather Miller (1) and Anna Garrett (10) go to the floor for a ball during Thursday's Class 5A District 14 championship match against Rockledge. Craig Bailey/FLORIDA TODAY", "external_links": [], "published": "2015-10-23T05:40:00.000+03:00", "crawled": "2015-10-23T19:09:10.943+03:00", "highlightTitle": ""}