{"organizations": ["Gentlemen's Club", "Tuolumne County Superior Court", "Tuolumne County Sheriff’s Office"], "uuid": "1ada185eba9ad3e5c3263aa27f60b0d9de7bc09e", "thread": {"social": {"gplus": {"shares": 0}, "pinterest": {"shares": 0}, "vk": {"shares": 0}, "linkedin": {"shares": 0}, "facebook": {"likes": 0, "shares": 0, "comments": 0}, "stumbledupon": {"shares": 0}}, "site_full": "www.uniondemocrat.com", "main_image": "", "site_section": "http://feeds.feedburner.com/UnionDemocrat", "section_title": "The Union Democrat, Sonora, CA News, Sports, & Weather", "url": "http://www.uniondemocrat.com/index.php?option=com_content&task=view&id=117906&Itemid=199", "country": "US", "title": "Sonora woman trial set in co-worker stabbing", "performance_score": 0, "site": "uniondemocrat.com", "participants_count": 0, "title_full": "Sonora woman trial set in co-worker stabbing", "spam_score": 0.0, "site_type": "news", "published": "2015-10-17T12:48:00.000+03:00", "replies_count": 0, "uuid": "1ada185eba9ad3e5c3263aa27f60b0d9de7bc09e"}, "author": "", "url": "http://www.uniondemocrat.com/index.php?option=com_content&task=view&id=117906&Itemid=199", "ord_in_thread": 0, "title": "Sonora woman trial set in co-worker stabbing", "locations": ["Sonora", "Mono Way", "Jamestown", "Standard Road"], "entities": {"persons": [], "locations": [], "organizations": []}, "highlightText": "", "language": "english", "persons": ["Meghan Myra Hardin", "Tori Thomas", "Hardin", "A. Boscoe", "James", "Eleanor Provost", "Rosalinda"], "text": "Sonora woman trial set in co-worker stabbing Sonora woman trial set in co-worker stabbing By Tori Thomas, The Union Democrat October 17, 2015 09:48 am A Nov. 18 trial date has been set for a Sonora woman accused of stabbing her coworker in May. Judge James. A. Boscoe set the date Friday in Tuolumne County Superior Court. Meghan Myra Hardin, 21, of Sonora, was arrested May 6 and charged with felony assault with a deadly weapon. According to the Tuolumne County Sheriff’s Office, deputies responded to a report of a stabbing about 1 a.m. May 6 at a gas station on Mono Way near Standard Road. When deputies arrived, they found a 22-year-old woman with a stab wound to her leg. The woman, an employee at Rosalinda’s Gentlemen's Club west of Jamestown, said she and her co-worker got into an argument that turned physical. Hardin pleaded not guilty May 22 before Tuolumne County Superior Court Judge Eleanor Provost. A trial readiness conference is scheduled for Nov. 9. Follow UnionDemocrat.com", "external_links": [], "published": "2015-10-17T12:48:00.000+03:00", "crawled": "2015-10-18T08:23:02.063+03:00", "highlightTitle": ""}