{"organizations": ["CNN", "Royal Dutch Shell", "Eau Claire", "Interior Department"], "uuid": "09c8819fa4f6cbc79b211861c12e519b398f8900", "thread": {"social": {"gplus": {"shares": 0}, "pinterest": {"shares": 0}, "vk": {"shares": 0}, "linkedin": {"shares": 0}, "facebook": {"likes": 0, "shares": 0, "comments": 0}, "stumbledupon": {"shares": 0}}, "site_full": "www.wqow.com", "main_image": "", "site_section": "http://www.WQOW.com/Global/category.asp?C=13566&clienttype=rss", "section_title": "WQOW TV News 18 - National Sports - Headline", "url": "http://www.wqow.com/story/30278303/the-latest-former-coach-says-odom-is-in-improved-condition", "country": "US", "title": "The Latest: Former coach says Odom is in improved condition", "performance_score": 0, "site": "wqow.com", "participants_count": 0, "title_full": "The Latest: Former coach says Odom is in improved condition", "spam_score": 0.0, "site_type": "news", "published": "2015-10-17T04:31:00.000+03:00", "replies_count": 0, "uuid": "09c8819fa4f6cbc79b211861c12e519b398f8900"}, "author": "", "url": "http://www.wqow.com/story/30278303/the-latest-former-coach-says-odom-is-in-improved-condition", "ord_in_thread": 0, "title": "The Latest: Former coach says Odom is in improved condition", "locations": ["Oklahoma", "Albuquerque", "Alaska", "Nevada", "Ohio"], "entities": {"persons": [], "locations": [], "organizations": []}, "highlightText": "", "language": "english", "persons": ["JILL", "Odom", "Khloe Kardashian", "Lamar Odom"], "text": "The Latest: Former coach says Odom is in improved condition - WQOW TV: Eau Claire, WI NEWS18 News, Weather, and Sports Member Center: Lamar Odom regains consciousness, family and friends say Khloe Kardashian and Lamar Odom's aunt are speaking out to thank fans as he remains hospitalized after being found unconscious Tuesday at the Love Ranch brothel in Nevada. More >> Lamar Odom has regained consciousness, and is communicating - speaking and even giving a thumbs up from his hospital bed - just days after being found in extremely critical condition at a Nevada brothel, loved ones said. More >> The Latest: Former coach says Odom is in improved condition The latest on the hospitalization of Lamar Odom, who was found unconscious Tuesday in a Nevada brothel (all times local): More >> The latest on the hospitalization of Lamar Odom, who was found unconscious Tuesday in a Nevada brothel (all times local): More >> Nevada memo: DraftKings described self as gambling Daily   Nevada says   sites like   gambling and are using the company's own words as evidence. More >> Oklahoma agrees to hold off executions until at least 2016 Oklahoma's attorney general has agreed to not request execution dates until 2016, as his office investigates why the state used the wrong drug to execute an inmate in January, according to court documents filed... More >> By JILL BLEED Associated Press No executions will be scheduled in Oklahoma until at least next year as the attorney general's office investigates why the state used the wrong drug during a lethal... More >> Police: Mom, daughter charged in love triangle slaying Police say a woman and her husband became romantically involved with another woman, but tensions grew once the other woman moved in and the wife plotted with teenagers to kill the other two. More >> A woman who shared a female lover with her husband decided to kill them both after she fell out of the love triangle, and she recruited her teenage daughter and the daughter's boyfriend to help her do it, police and a... More >> Army   Police:   Family of boy shot by Ohio officer seeks special prosecutor Lawyers for the family of a 12-year-old black boy who was carrying a pellet gun when he was fatally shot by a white police officer have made an emphatic call for a special prosecutor to take over an investigation... More >> Lawyers for the family of a 12-year-old black boy who was carrying a pellet gun when he was fatally shot by a white police officer have made an emphatic call for a special prosecutor to take over an investigation they say... More >> Interior Department curbs future Arctic offshore drilling The Interior Department says it will not extend Arctic offshore leases held by Royal Dutch Shell and other companies in Arctic waters off Alaska's northern coast. More >> The Interior Department announced Friday it is canceling future lease sales and will not extend current leases in Arctic waters off Alaska's northern coast, a decision that significantly reduces the chances for future... More >> Ex-CNN couple sue Motel 6 after shooting in Albuquerque A pair of former CNN journalists are suing Motel 6 after a man tried to rob the couple at gunpoint and the encounter led to an exchange of gunfire that wounded one of the former reporters. More >> Two former CNN journalists are suing Motel 6, saying one of the budget chain's Albuquerque inns didn't do enough to ensure their safety the night a man tried to rob them and an exchange of gunfire ensued. More >>", "external_links": [], "published": "2015-10-17T04:31:00.000+03:00", "crawled": "2015-10-17T04:39:24.683+03:00", "highlightTitle": ""}