{"organizations": ["Connor Cook", "Michigan State", "Wolverines", "State Journal MSU", "Spartans", "U-M", "Lansing State Journal", "Facebook Email Twitter Google", "Michigan Wolverines", "State Journal Fullscreen Buy Photo Michigan State", "MSU", "Detroit Free Press"], "uuid": "2fa7efec772dde8dd52aa5609c448dceb032b915", "thread": {"social": {"gplus": {"shares": 0}, "pinterest": {"shares": 0}, "vk": {"shares": 0}, "linkedin": {"shares": 0}, "facebook": {"likes": 0, "shares": 0, "comments": 0}, "stumbledupon": {"shares": 0}}, "site_full": "www.lansingstatejournal.com", "main_image": "http://www.gannett-cdn.com/-mm-/22a4d95fdf0338ff4f3b64e5616365f13abbe402/c=0-0-3087-1744&amp;r=x633&amp;c=1200x630/local/-/media/2015/10/17/MIGroup/Lansing/635807135993971813-msu-michigan-football-rod-12.jpg", "site_section": "https://feeds.feedblitz.com/lansing/sports", "section_title": "Lansing - Sports", "url": "http://www.lansingstatejournal.com/story/sports/college/msu/football/2015/10/17/spartan-stunner-msu-27-u-m-23/73821500/", "country": "US", "title": "Spartan stunner: MSU 27, U-M 23", "performance_score": 0, "site": "lansingstatejournal.com", "participants_count": 0, "title_full": "Spartan stunner: MSU 27, U-M 23", "spam_score": 0.0, "site_type": "news", "published": "2015-10-18T06:51:00.000+03:00", "replies_count": 0, "uuid": "2fa7efec772dde8dd52aa5609c448dceb032b915"}, "author": "", "url": "http://www.lansingstatejournal.com/story/sports/college/msu/football/2015/10/17/spartan-stunner-msu-27-u-m-23/73821500/", "ord_in_thread": 0, "title": "Spartan stunner: MSU 27, U-M 23", "locations": ["Michigan Stadium", "Michigan", "Houma"], "entities": {"persons": [], "locations": [], "organizations": []}, "highlightText": "", "language": "english", "persons": ["Connor Cook", "Smith", "Trevon Pendleton", "A.J. Williams", "Jake Rudock", "Burbridge", "Watts-Jackson", "Aaron Burbridge", "Jim Harbaugh", "Dave Wasinger/Lansing", "Pendelton", "Lawrence Thomas", "Riley Bullough", "Sione Houma", "R.J. Shelton", "Macgarrett Kings Jr.", "Grayson Miller", "Dave Wasinger", "Brad Salem", "Dave", "Jalen Watts-Jackson", "Jake Butt", "Ann Arbor", "Joe Rexrode", "LJ Scott", "Rod Sanford", "Josiah Price", "Chris Frey", "Paul Bunyan", "Khari Willis", "Arjen Colquhoun", "Darien Harris"], "text": "Facebook Email Twitter Google+ LinkedIn Pinterest Spartan stunner: MSU 27, U-M 23 The craziest finish in the history of the in-state rivalry saw the Spartans score a game-winning TD on U-M botched punt Post to Facebook Spartan stunner: MSU 27, U-M 23 The craziest finish in the history of the in-state rivalry saw the Spartans score a game-winning TD on U-M botched punt Check out this story on lansingstatejournal.com: http://on.lsj.com/1ROQV6T Cancel Send A link has been sent to your friend's email address. Posted! A link has been posted to your Facebook feed. 9 To find out more about Facebook commenting please read the Conversation Guidelines and FAQs Spartan stunner: MSU 27, U-M 23 Joe Rexrode, Detroit Free Press 11:51 p.m. EDT October 17, 2015 Buy Photo Jalen Watts-Jackson (20) crosses the goal line to score the winning touchdown after time expired to claim the win and the Paul Bunyan trophy for Michigan State in a 27-23 over Michigan Saturday, October 17, 2015, at Michigan Stadium in Ann Arbor. Watts-Jackson recovered a muffed punt for a touchdown. Dave Wasinger/Lansing State Journal Fullscreen Buy Photo Michigan State tight end Josiah Price screams as he celebrates with teammates after a thrilling, last-second 27-23 victory over Michigan Saturday, October 17, 2015, in Ann Arbor. Dave Wasinger/Lansing State Journal MSU's Arjen Colquhoun, left, and Connor Cook, right, carry the winning Paul Bunyan trophy in Michigan Stadium after teammate Jalen Watts-Jackson ran back a Michigan fumbled or muffed punt for a touchdown and a 27-23 win Saturday 10/17/2015. Rod Sanford | Lansing State JJournal Fullscreen Buy Photo Michigan State players celebrate in the endzone after a last-second 27-23 victory over Michigan Saturday, October 17, 2015 in Ann Arbor. Dave Wasinger/Lansing State Journal Fullscreen Buy Photo Michigan State quarterback Connor Cook smiles as he hugs Quarterbacks Coach Brad Salem after the Spartans 27-23 victory over Michigan Saturday, October 17, 2015, in Michigan Stadium. Dave Wasinger/Lansing State Journal Fullscreen Buy Photo Spartans Khari Willis (27), Monty Madaris (88) and others celebrate in the endzone as Michigan players look on after Jalen Watts-Jackson scored the winning touchdown after time expired to beat the Wolverines 27-23 Saturday, October 17, 2015, at Michigan Stadium in Ann Arbor. Dave Wasinger/Lansing State Journal Fullscreen Buy Photo Jalen Watts-Jackson (20) is lifted onto a stretcher before being carted off the field after Michigan State's 27-23 win over Michigan Saturday, October 17, 2015, at Michigan Stadium in Ann Arbor. Watts-Jackson recovered a fumble for a touchdown after time expired. He was hurt in the ensuing celebration. Preliminary reports are that he broke or dislocated his hip. Dave Wasinger/Lansing State Journal Fullscreen Buy Photo Jalen Watts-Jackson (20) holds up his arm after being lifted on a stretcher to be carted off the field after Michigan State's 27-23 win over Michigan Saturday, October 17, 2015, at Michigan Stadium in Ann Arbor. Watts-Jackson recovered a fumble for a touchdown after time expired. He was hurt in the ensuing celebration. Preliminary reports are that he broke or dislocated his hip. Dave Wasinger/Lansing State Journal Fullscreen Buy Photo Michigan State players sing the fight song up in the stand with fans after a last-second 27-23 victory over Michigan Saturday, October 17, 2015 in Ann Arbor. Dave Wasinger/Lansing State Journal Fullscreen Buy Photo Michigan State tight end Josiah Price celebrates with quarterback Connor Cook after a thrilling, last-second 27-23 victory over Michigan Saturday, October 17, 2015, in Ann Arbor. Dave Wasinger/Lansing State Journal Fullscreen Buy Photo MSU players jump up into the stands to celebrate with the Paul Bunyan trophy with fans after a last-second 27-23 victory over Michigan in Ann Arbor. Dave Wasinger/Lansing State Journal Fullscreen Buy Photo Michigan State receiver Macgarrett Kings Jr., looks up and reaches for the ball as he tries to make a catch in the fourth quarter of the Spartans 27-23 victory over Michigan Saturday, October 17, 2015 in Ann Arbor. The pass was incomplete. Dave Wasinger/Lansing State Journal Fullscreen Buy Photo Michigan State receiver R.J. Shelton catches a Connor Cook pass on the sidelines during the third quarter of the Spartans' 27-23 victory over Michigan Saturday, October 17, 2015, in Michigan Stadium. The play was originally rule incomplete because he foot was close to being out of bounds, but that ruling was overturned after a review. Dave Wasinger/Lansing State Journal Fullscreen Buy Photo Michigan State's Lawrence Thomas (8) upends Michigan's De'Veon Smith (4) near the line of scrimmage in the third quarter of the Spartans 27-23 victory Saturday, October 17, 2015, at Michigan Stadium in Ann Arbor. Dave Wasinger/Lansing State Journal Fullscreen Buy Photo Michigan quarterback Jake Rudock throws a pass on the run in the third quarter of a 27-23 loss to Michigan State Saturday, October 17, 2015 in Ann Arbor. Dave Wasinger/Lansing State Journal Fullscreen Buy Photo Michigan State quarterback Connor Cook runs the ball in the second quarter against Michigan at Michigan Stadium, October 17, 2015 in Ann Arbor, Michigan. Dave Wasinger/Lansing State Journal Fullscreen Buy Photo Michigan coach Jim Harbaugh and an assistant coach react to a targeting call in the second quarter at Michigan Stadium, October 17, 2015 in Ann Arbor, Michigan. Dave Wasinger/Lansing State Journal Fullscreen Buy Photo Spartans tight end Josiah Price makes a catch in the second quarter at Michigan Stadium, October 17, 2015 in Ann Arbor, Michigan. The catch was nullified because of a penalty. Dave Wasinger/Lansing State Journal Fullscreen Buy Photo Michigan State wide receiver Aaron Burbridge (16) stretches for more yards in the first quarter at Michigan Stadium, October 17, 2015 in Ann Arbor, Michigan. Dave Wasinger/Lansing State Journal Fullscreen Buy Photo Spartans Chris Frey (23) takes down Michigan's Jabrill Peppers (5) on a punt return in the second quarter at Michigan Stadium, October 17, 2015 in Ann Arbor, Michigan. Dave Wasinger/Lansing State Journal Fullscreen Buy Photo Michigan State defender Darien Harris (45) and Arjen Colquhoun (36) tackle Michigan's De'Veon Smith (4) in the second quarter of the game at Michigan Stadium, October 17, 2015 in Ann Arbor, Michigan. Dave Wasinger/Lansing State Journal Fullscreen Buy Photo Spartans quarterback Connor Cook gets off a pass in the first quarter at Michigan Stadium, October 17, 2015 in Ann Arbor, Michigan. Dave Wasinger/Lansing State Journal Fullscreen Buy Photo Spartans running back LJ Scott high-steps it into the end zone to get past a Michigan defender in the second quarter at Michigan Stadium, October 17, 2015 in Ann Arbor, Michigan. Dave Wasinger/Lansing State Journal Fullscreen Buy Photo Michigan State wide receiver Aaron Burbridge leaps to make a catch in the first quarter at Michigan Stadium, October 17, 2015 in Ann Arbor, Michigan. Dave Wasinger/Lansing State Journal Fullscreen Buy Photo Michigan players Sione Houma (39) and Mason Cole (52) celebrate Houma's touchdown in the second quarter of the game at Michigan Stadium, October 17, 2015 in Ann Arbor, Michigan. Dave Wasinger/Lansing State Journal Fullscreen Buy Photo Michigan quarterback Jake Rudock (15) gets a pass off under pressure from MSU's Chris Frey (23) in the second quarter at Michigan Stadium, October 17, 2015 in Ann Arbor, Michigan. Dave Wasinger, Lansing State Journal Fullscreen Buy Photo MSU receiver Aaron Burbridge jumps to make a catch in the fourth quarter of the Spartans' 27-23 victory over the Michigan Wolverines, Saturday, October 17, 2015, at Michigan Stadium in Ann Arbor. Burbridge ended the game with nine receptions for 132 yards. Dave Wasinger/Lansing State Journal Fullscreen Buy Photo Michigan State fullback Trevon Pendleton (37) runs toward the endzone on a 74-yard reception in the third quarter of the Spartans' 27-23 victory over Michigan Saturday, October 17, 2015 in Ann Arbor. Pendelton made it down to the goalline before being tackled. The play was originally ruled a touchdown, but after a review he was ruled down just before the goal line. Dave Wasinger/Lansing State Journal Fullscreen Buy Photo Michigan State fullback Trevon Pendleton (37) runs down the sideline on a 74-yard reception in the third quarter of the Spartans' 27-23 victory over Michigan Saturday, October 17, 2015 in Ann Arbor. Pendelton made it down to the goalline before being tackled. The play was originally ruled a touchdown, but after a review he was ruled down just before the goal line. Dave Wasinger/Lansing State Journal Fullscreen Buy Photo Michigan State receiver Macgarrett Kings Jr., looks back for the ball after it bounced off of his helmet in the fourth quarter of the Spartans 27-23 victory over Michigan Saturday, October 17, 2015 in Ann Arbor. The pass was incomplete. Dave Wasinger/Lansing State Journal Fullscreen Buy Photo Michigan State safety Grayson Miller (44) tackles Michigan tight end A.J. Williams (84) in the third quarter of the Spartans' last-second 27-23 victory over Michigan Saturday, October 17, 2015 in Ann Arbor. Dave Wasinger/Lansing State Journal Fullscreen Buy Photo Michigan State linebacker Riley Bullough (30) tackles Michigan tight end Jake Butt (88) in the fourth quarter of MSU's 27-23 victory over Michigan Saturday, October 17, 2015 in Ann Arbor. Dave Wasinger/Lansing State Journal", "external_links": [], "published": "2015-10-18T06:51:00.000+03:00", "crawled": "2015-10-18T07:09:49.288+03:00", "highlightTitle": ""}