{"organizations": ["Cooper Frantz-Geddes", "GVC", "Greater Valley Conference District Cross Country"], "uuid": "cbf9ce611fad3cd577ba96e6179b86de5656ee8f", "thread": {"social": {"gplus": {"shares": 0}, "pinterest": {"shares": 0}, "vk": {"shares": 0}, "linkedin": {"shares": 0}, "facebook": {"likes": 0, "shares": 0, "comments": 0}, "stumbledupon": {"shares": 0}}, "site_full": "www.statesmanjournal.com", "main_image": "http://www.gannett-cdn.com/-mm-/7c831f69ade803132e1ef723c4b165c6cf009d92/c=0-992-2375-2328&amp;r=x633&amp;c=1200x630/local/-/media/2015/10/21/Salem/B9319292200Z.1_20151021221422_000_GCACAND1L.1-0.jpg", "site_section": "http://rssfeeds.statesmanjournal.com/salem/sports", "section_title": "Salem - Sports", "url": "http://www.statesmanjournal.com/story/sports/high-school/2015/10/21/ahmed-muhumed-leads-west-salem-gvc-team-championship/74367876/", "country": "US", "title": "Ahmed Muhumed leads West Salem to GVC team championship", "performance_score": 0, "site": "statesmanjournal.com", "participants_count": 0, "title_full": "Ahmed Muhumed leads West Salem to GVC team championship", "spam_score": 0.0, "site_type": "news", "published": "2015-10-22T06:21:00.000+03:00", "replies_count": 0, "uuid": "cbf9ce611fad3cd577ba96e6179b86de5656ee8f"}, "author": "", "url": "http://www.statesmanjournal.com/story/sports/high-school/2015/10/21/ahmed-muhumed-leads-west-salem-gvc-team-championship/74367876/", "ord_in_thread": 0, "title": "Ahmed Muhumed leads West Salem to GVC team championship", "locations": ["Logan Divelbiss", "Salem", "West Salem"], "entities": {"persons": [], "locations": [], "organizations": []}, "highlightText": "", "language": "english", "persons": ["Madison Willhoft", "Bill Poehler", "Bush", "Chau", "Ben Johnson", "Brooke Chuhlantseff", "McKay", "Brennen Lebel", "Hunter Mosman", "Fabian Elizondo", "Anna Chau", "Sprague", "Ahmed Muhumed", "DANIELLE PETERSON"], "text": "Ahmed Muhumed leads West Salem to GVC team championship Bill Poehler , Statesman Journal 8:21 p.m. PDT October 21, 2015 Buy Photo West Salem's Ahmed Muhumed wins the boys varsity race with a time of 15:17 during the Greater Valley Conference District Cross Country meet Wednesday, Oct. 21, 2015, at Bush's Pasture Park in Salem. DANIELLE PETERSON / Statesman Journal Fullscreen Buy Photo Runners prepare for the boys varsity race during the Greater Valley Conference District Cross Country meet Wednesday, Oct. 21, 2015, at Bush's Pasture Park in Salem. DANIELLE PETERSON / Statesman Journal Fullscreen Buy Photo Runners begin the boys varsity race during the Greater Valley Conference District Cross Country meet Wednesday, Oct. 21, 2015, at Bush's Pasture Park in Salem. DANIELLE PETERSON / Statesman Journal Fullscreen Buy Photo North Salem's Madison Willhoft competes in the girls varsity race during the Greater Valley Conference District Cross Country meet Wednesday, Oct. 21, 2015, at Bush's Pasture Park in Salem. DANIELLE PETERSON / Statesman Journal Fullscreen Buy Photo Runners warm up for the girls varsity race during the Greater Valley Conference District Cross Country meet Wednesday, Oct. 21, 2015, at Bush's Pasture Park in Salem. DANIELLE PETERSON / Statesman Journal Fullscreen Buy Photo South Salem's Anna Chau and Sprague's Ginger Murnieks race in the Greater Valley Conference District Cross Country meet Wednesday, Oct. 21, 2015, at Bush's Pasture Park in Salem. Chau won the meet with a time of 17:52. DANIELLE PETERSON / Statesman Journal Fullscreen Buy Photo Runners compete in the varsity girls race during the Greater Valley Conference District Cross Country meet Wednesday, Oct. 21, 2015, at Bush's Pasture Park in Salem. DANIELLE PETERSON / Statesman Journal Fullscreen Buy Photo North Salem's Madison Willhoft competes in the girls varsity race during the Greater Valley Conference District Cross Country meet Wednesday, Oct. 21, 2015, at Bush's Pasture Park in Salem. DANIELLE PETERSON / Statesman Journal Fullscreen Buy Photo South Salem runners prepare for the girls varsity race during the Greater Valley Conference District Cross Country meet Wednesday, Oct. 21, 2015, at Bush's Pasture Park in Salem. DANIELLE PETERSON / Statesman Journal Fullscreen Buy Photo Runners from McKay cross the finish line in the girls varsity race during the Greater Valley Conference District Cross Country meet Wednesday, Oct. 21, 2015, at Bush's Pasture Park in Salem. DANIELLE PETERSON / Statesman Journal Fullscreen Buy Photo West Salem's Brooke Chuhlantseff competes in the girls varsity race during the Greater Valley Conference District Cross Country meet Wednesday, Oct. 21, 2015, at Bush's Pasture Park in Salem. DANIELLE PETERSON / Statesman Journal Fullscreen Buy Photo Runners finish the girls varsity race during the Greater Valley Conference District Cross Country meet Wednesday, Oct. 21, 2015, at Bush's Pasture Park in Salem. DANIELLE PETERSON / Statesman Journal Fullscreen Buy Photo West Salem's Ahmed Muhumed wins the boys varsity race with a time of 15:17 during the Greater Valley Conference District Cross Country meet Wednesday, Oct. 21, 2015, at Bush's Pasture Park in Salem. DANIELLE PETERSON / Statesman Journal Fullscreen Buy Photo Runners begin the boys varsity race during the Greater Valley Conference District Cross Country meet Wednesday, Oct. 21, 2015, at Bush's Pasture Park in Salem. DANIELLE PETERSON / Statesman Journal Fullscreen Buy Photo Runners compete in the boys varsity race during the Greater Valley Conference District Cross Country meet Wednesday, Oct. 21, 2015, at Bush's Pasture Park in Salem. DANIELLE PETERSON / Statesman Journal Fullscreen Buy Photo Runners compete in the boys varsity race during the Greater Valley Conference District Cross Country meet Wednesday, Oct. 21, 2015, at Bush's Pasture Park in Salem. DANIELLE PETERSON / Statesman Journal Fullscreen Buy Photo West Salem's Cooper Frantz-Geddes competes in the boys varsity race during the Greater Valley Conference District Cross Country meet Wednesday, Oct. 21, 2015, at Bush's Pasture Park in Salem. DANIELLE PETERSON / Statesman Journal Fullscreen Buy Photo West Salem's Fabian Elizondo competes in the boys varsity race during the Greater Valley Conference District Cross Country meet Wednesday, Oct. 21, 2015, at Bush's Pasture Park in Salem. DANIELLE PETERSON / Statesman Journal Fullscreen Buy Photo West Salem's Logan Divelbiss and Hunter Mosman compete in the boys varsity race during the Greater Valley Conference District Cross Country meet Wednesday, Oct. 21, 2015, at Bush's Pasture Park in Salem. DANIELLE PETERSON / Statesman Journal Fullscreen Buy Photo West Salem's Fabian Elizondo competes in the boys varsity race during the Greater Valley Conference District Cross Country meet Wednesday, Oct. 21, 2015, at Bush's Pasture Park in Salem. DANIELLE PETERSON / Statesman Journal Fullscreen Buy Photo West Salem's Brennen Lebel and Ben Johnson finish the boys varsity race during the Greater Valley Conference District Cross Country meet Wednesday, Oct. 21, 2015, at Bush's Pasture Park in Salem. DANIELLE PETERSON / Statesman Journal Fullscreen Buy Photo Runners finish the boys varsity race during the Greater Valley Conference District Cross Country meet Wednesday, Oct. 21, 2015, at Bush's Pasture Park in Salem. DANIELLE PETERSON / Statesman Journal", "external_links": [], "published": "2015-10-22T06:21:00.000+03:00", "crawled": "2015-10-22T16:36:07.040+03:00", "highlightTitle": ""}