{"organizations": ["American Cancer Society", "NHL", "AP Photo/The Canadian Press", "Canucks", "CW Blue Jackets", "Pittsburgh Penguins", "Columbus Blue Jackets"], "uuid": "d88514b444ac225594d47a4ae43bbb6a22b7e93c", "thread": {"social": {"gplus": {"shares": 0}, "pinterest": {"shares": 0}, "vk": {"shares": 0}, "linkedin": {"shares": 0}, "facebook": {"likes": 0, "shares": 0, "comments": 0}, "stumbledupon": {"shares": 0}}, "site_full": "www.wqow.com", "main_image": "http://images.worldnow.com/AP/images/9065724_G.jpg", "site_section": "http://www.WQOW.com/Global/category.asp?C=13566&clienttype=rss", "section_title": "WQOW TV News 18 - National Sports - Headline", "url": "http://www.wqow.com/story/30316399/blue-jackets-fire-todd-richards-hire-john-tortorella", "country": "US", "title": "Blue Jackets fire Todd Richards, hire John Tortorella", "performance_score": 0, "site": "wqow.com", "participants_count": 0, "title_full": "Blue Jackets fire Todd Richards, hire John Tortorella", "spam_score": 0.0, "site_type": "news", "published": "2015-10-21T18:13:00.000+03:00", "replies_count": 0, "uuid": "d88514b444ac225594d47a4ae43bbb6a22b7e93c"}, "author": "", "url": "http://www.wqow.com/story/30316399/blue-jackets-fire-todd-richards-hire-john-tortorella", "ord_in_thread": 0, "title": "Blue Jackets fire Todd Richards, hire John Tortorella", "locations": ["Delaware", "U.S.", "Columbus", "Vancouver", "Alaska", "Pittsburgh", "Bri", "Ohio"], "entities": {"persons": [], "locations": [], "organizations": []}, "highlightText": "", "language": "english", "persons": ["John Tortorella", "Darryl Dyck", "J. Puskar", "Todd Richards", "Mike", "Obama"], "text": "The CW Blue Jackets fire Todd Richards, hire John Tortorella (AP Photo/Gene J. Puskar, File). FILE - In this Dec. 13, 2014, file photo, Columbus Blue Jackets head coach Todd Richards gives instructions during the third period of an NHL hockey game against the Pittsburgh Penguins in Columbus, Ohio Saturday, Dec. ... (AP Photo/The Canadian Press, Darryl Dyck, File). FILE - In this April 14, 2014, file photo, then-Vancouver Canucks' head coach John Tortorella laughs after a reporter mistakenly called him Mike during an end of season news conference in Vancouver, Bri... (AP Photo/Gene J. Puskar, File). FILE - In this April 26, 2014, file photo, Columbus Blue Jackets head coach Todd Richards talks with an official during a first-round NHL playoff hockey game against the Pittsburgh Penguins in Pittsburgh. After an 0-7 s... (AP Photo/Gene J. Puskar). FILE - In this Dec. 13, 2014, file photo, Columbus Blue Jackets head coach Todd Richards talks with an official during the third period of an NHL hockey game against the Pittsburgh Penguins in Columbus, Ohio. After an 0-7 sta... (AP Photo/The Canadian Press, Darryl Dyck). FILE - In this March 19, 2014, file photo, then-Vancouver Canucks head coach John Tortorella gestures on the bench during third period of an NHL hockey action against the Nashville Predators in Vancouver, Bri... Frenchman makes daring leap from sailboat to ship off Alaska A Frenchman with his cat tucked inside his clothing made a daring leap of faith Tuesday when he jumped to a waiting rescue ship from his sailboat, which was being battered by high seas south of Alaska. More >> A Frenchman with his cat tucked inside his clothing made a daring leap of faith when he jumped to a waiting rescue ship from his sailboat, which was being battered by high seas south of Alaska.   A health law fine on the uninsured will more than double The math is harsh: The federal penalty for having no health insurance is set to jump to $695, and the Obama administration is being urged to highlight that cold fact to help drive its new pitch for health law... More >> The math is harsh: The federal penalty for having no health insurance is set to jump to $695, and the Obama administration is being urged to highlight that cold fact in its new pitch for health law sign-ups. More >> Cancer group's mammogram advice: Start later and get fewer The American Cancer Society is revising its advice on when women should start getting mammograms and how often. More >> The American Cancer Society now says women should start mammograms later in life and get fewer of them, a stance that puts the trusted group closer to an influential government task force's advice. More >> Breast cancer screening advice from 2 major groups compared Advice varies on when women should start getting screened for breast cancer and how often. The American Cancer Society revised its guidelines Tuesday, bringing them more in line with those of the U.S. Preventive... More >> Advice varies on when women should start getting screened for breast cancer and how often. The American Cancer Society revised its guidelines Tuesday, bringing them more in line with those of the U.S. Preventive Services... More >> NYC   Suit settled over car used in 'Back to the Future' films In time for \"Back to the Future\" day, the widow of the automaker whose famous car traveled through time in the 1985 movie and its sequels has settled a lawsuit over the use of his name. More >> In time for \"Back to the Future\" day, the widow of the automaker whose famous car traveled through time in the 1985 movie and its sequels has settled a lawsuit over the use of his name. More >> The Latest:   More >> Delaware  ", "external_links": [], "published": "2015-10-21T18:13:00.000+03:00", "crawled": "2015-10-21T18:35:17.008+03:00", "highlightTitle": ""}