{"organizations": ["BCCI", "Board", "Shiv Sena", "PCB", "West Bengal"], "uuid": "0b027f992ba87d01f10d5cd1abb482cbe0289a22", "thread": {"social": {"gplus": {"shares": 0}, "pinterest": {"shares": 0}, "vk": {"shares": 0}, "linkedin": {"shares": 0}, "facebook": {"likes": 0, "shares": 0, "comments": 0}, "stumbledupon": {"shares": 0}}, "site_full": "www.onenewspage.com", "main_image": "http://cdn.newsserve.net/ONPglobe256.jpg", "site_section": "http://www.onenewspage.com/rss/latest/Sports.rss", "section_title": "Latest Sports News on One News Page", "url": "http://www.onenewspage.com/n/Sports/7559y097f/Mamata-Banerjee-welcomes-BCCI-PCB-to-meet-in.htm", "country": "US", "title": "Mamata Banerjee welcomes BCCI, PCB to meet in Kolkata", "performance_score": 0, "site": "onenewspage.com", "participants_count": 0, "title_full": "Mamata Banerjee welcomes BCCI, PCB to meet in Kolkata", "spam_score": 0.0, "site_type": "news", "published": "2015-10-19T14:23:00.000+03:00", "replies_count": 0, "uuid": "0b027f992ba87d01f10d5cd1abb482cbe0289a22"}, "author": "", "url": "http://www.onenewspage.com/n/Sports/7559y097f/Mamata-Banerjee-welcomes-BCCI-PCB-to-meet-in.htm", "ord_in_thread": 0, "title": "Mamata Banerjee welcomes BCCI, PCB to meet in Kolkata", "locations": ["Pakistan", "India Kolkata", "Kolkata", "Shiv Sena", "India"], "entities": {"persons": [], "locations": [], "organizations": []}, "highlightText": "", "language": "english", "persons": ["Mamta Banerjee", "Shashank Manohar", "Mamata Banerjee", "Pele", "Rahman"], "text": "Mamata Banerjee welcomes BCCI, PCB to meet in Kolkata Monday, 19 October 2015 (2 minutes ago) Shiv Sena workers today barged into the BCCI headquarters in protest against Board president Shashank Manohar's planned talks with PCB chief. Football legend Pele arrives in Kolkata 00:47 Kolkata, Oct 11 (ANI): After 38 years, Brazilian football legend Pele arrived in Kolkata on Sunday amidst cheering from enthusiastic fans. Pele is on a 3-day tour and has a series of programmes lined up ahead. Pele is scheduled to meet students of NSHM Knowledge Campus on Monday, followed by a visit... Recent related news West Bengal Chief Minister Mamata Banerjee today \"welcomed\" the officials of India and Pakistan Cricket Boards to meet here in the wake of Shiv Sena workers... Firstpost 34 minutes ago - India Kolkata, Oct 19: West Bengal Chief Minister Mamta Banerjee on Monday, oct 19 \"welcomed\" the officials of India and Pakistan Cricket Boards to meet here in the... Oneindia 2 hours ago - Sports *West Bengal Chief Minister Mamta Banerjee today \"welcomed\" the officials of India and Pakistan Cricket Boards to meet here in the wake of Shiv Sena workers... Deccan Herald 7 hours ago - Front Page Oscar-winning composer A R Rahman says meeting Brazilian football legend Pele for his biopic was like a surreal moment for him. Rahman, who is composing music... DNA 5 days ago - Front Page Also reported by â€¢ Mid-Day You Might Like Other recent news in Sports", "external_links": [], "published": "2015-10-19T14:23:00.000+03:00", "crawled": "2015-10-19T14:26:18.688+03:00", "highlightTitle": ""}