{"organizations": ["Robert Trent Jones Golf Course", "Cornell University Buy Photo Ryan Johnson of Norwich", "Southern Tier Athletic Conference", "Chenango Forks", "STAC", "Seton Catholic Central", "Cornell University"], "uuid": "a41f5c9b5f8841e1d71fa9bcd4511f70cb25aed9", "thread": {"social": {"gplus": {"shares": 0}, "pinterest": {"shares": 0}, "vk": {"shares": 0}, "linkedin": {"shares": 0}, "facebook": {"likes": 0, "shares": 0, "comments": 0}, "stumbledupon": {"shares": 0}}, "site_full": "www.pressconnects.com", "main_image": "http://www.gannett-cdn.com/-mm-/8dbcef8513e02f5713f9ee8ad6c5c0d382740e38/c=0-105-1498-951&amp;r=x1683&amp;c=3200x1680/local/-/media/2015/10/13/CNYGroup/Ithaca/635803519576692828-ITH-1013-STAC-Golf02.jpg", "site_section": "http://rssfeeds.pressconnects.com/binghamton/sports", "section_title": "Binghamton - Sports", "url": "http://www.pressconnects.com/story/sports/college/2015/10/17/bu-volleyball-players-set-highs/74108556/", "country": "US", "title": "Gallery: STAC golf championship at Cornell University", "performance_score": 0, "site": "pressconnects.com", "participants_count": 0, "title_full": "Gallery: STAC golf championship at Cornell University", "spam_score": 0.0, "site_type": "news", "published": "2015-10-14T00:04:00.000+03:00", "replies_count": 0, "uuid": "a41f5c9b5f8841e1d71fa9bcd4511f70cb25aed9"}, "author": "", "url": "http://www.pressconnects.com/story/sports/college/2015/10/17/bu-volleyball-players-set-highs/74108556/", "ord_in_thread": 0, "title": "Gallery: STAC golf championship at Cornell University", "locations": ["Chenango Forks", "Horseheads", "Susquehanna Valley", "Maine-Endwell", "Horsheads", "Griffiths Susquehanna Valley", "Ithaca"], "entities": {"persons": [], "locations": [], "organizations": []}, "highlightText": "", "language": "english", "persons": ["Hepburn", "Alex Hepburn", "Hogan Bendert", "Jake Orban", "Tim Buchek", "Corning", "Johnson", "Karl Hauptmann", "Davis", "Kyle Norton", "Vestal", "Tommy Davis", "Jake Marris", "A.J. Baykal", "Josh Goetz", "Nick Barney", "Griffiths", "Derran Smith"], "text": "Gallery: STAC golf championship at Cornell University Buy Photo Ryan Johnson of Norwich watches his tee shot fly on number 10 Tuesday during the STAC golf championship at Cornell University's Robert Trent Jones Golf Course. Johnson finished tied for second with a 73. SIMON WHEELER / Staff Photo Fullscreen Buy Photo Tommy Davis of Seton Catholic Central watches his tee shot fly on number 10 Tuesday during the STAC golf championship at Cornell University's Robert Trent Jones Golf Course. Davis finished tied for second with a 73. SIMON WHEELER / Staff Photo Fullscreen Buy Photo D.J Griffiths of Susquehanna Valley watches his tee shot fly on number 10 Tuesday during the STAC golf championship at Cornell University's Robert Trent Jones Golf Course. Griffiths finished tied for second with a 73. SIMON WHEELER / Staff Photo Fullscreen Buy Photo Alex Hepburn, of Corning, watches his tee shot fly on the 10th hole Tuesday on his way to winning the Southern Tier Athletic Conference golf championship at Cornell University's Robert Trent Jones Golf Course. Hepburn shot an even-par 71 and won by two shots. SIMON WHEELER / Staff Photo Fullscreen Buy Photo Derran Smith, of Ithaca, watches his tee shot fly on number 10 Tuesday during the STAC golf championship at Cornell University's Robert Trent Jones Golf Course. SIMON WHEELER / Staff Photo Karl Hauptmann of Horseheads walks up the 6th fairway. SIMON WHEELER / Staff Photo DJ Griffiths Susquehanna Valley onto 6 green group 1a SIMON WHEELER / Staff Photo Fullscreen Buy Photo Kyle Norton of Chenango Forks misses a putt on the sixth green during the STAC golf championship Tuesday at Cornell University's Robert Trent Jones Golf Course. SIMON WHEELER / Staff Photo Fullscreen Buy Photo Kyle Norton of Chenango Forks watches his tee shot from the 7th tee during the STAC golf championship Tuesday at Cornell University's Robert Trent Jones Golf Course. SIMON WHEELER / Staff Photo Fullscreen Buy Photo Josh Goetz of Windsor watches his shot from the 10th tee during the STAC golf championship Tuesday at Cornell University's Robert Trent Jones Golf Course. SIMON WHEELER / Staff Photo Fullscreen Buy Photo Jake Marris of Maine-Endwell watches his shot from the 10th tee during the STAC golf championship Tuesday at Cornell University's Robert Trent Jones Golf Course. SIMON WHEELER / Staff Photo Fullscreen Buy Photo Tim Buchek of Windsor watches his tee shot fly on number 10 Tuesday during the STAC golf championship at Cornell University's Robert Trent Jones Golf Course. SIMON WHEELER / Staff Photo Fullscreen Buy Photo Hogan Bendert of Union-Endicott watches his tee shot fly on number 10 Tuesday during the STAC golf championship at Cornell University's Robert Trent Jones Golf Course. SIMON WHEELER / Staff Photo Fullscreen Buy Photo A.J. Baykal of Seton Catholic Central watches his tee shot fly on number 10 Tuesday during the STAC golf championship at Cornell University's Robert Trent Jones Golf Course. SIMON WHEELER / Staff Photo Fullscreen Buy Photo Nick Barney, of Vestal, watches his tee shot at No. 10 Tuesday during the STAC golf championship at Cornell University's Robert Trent Jones Golf Course. Barney shot a 4-over 75 and led the Golden Bears to the team championship. SIMON WHEELER / Staff Photo Fullscreen Buy Photo Jake Orban of Horsheads watches his tee shot fly on number 10 Tuesday during the STAC golf championship at Cornell University's Robert Trent Jones Golf Course. SIMON WHEELER / Staff Photo", "external_links": [], "published": "2015-10-14T00:04:00.000+03:00", "crawled": "2015-10-17T09:24:17.384+03:00", "highlightTitle": ""}