{"organizations": ["Pittsburgh Steelers", "NFL", "LinkedIn Pinterest Vols", "Facebook Email Twitter Google", "Kansas City Chiefs", "Facebook Vols"], "uuid": "b83fc9db490904776827df83cdb992112cdf2eaf", "thread": {"social": {"gplus": {"shares": 0}, "pinterest": {"shares": 0}, "vk": {"shares": 0}, "linkedin": {"shares": 0}, "facebook": {"likes": 0, "shares": 0, "comments": 0}, "stumbledupon": {"shares": 0}}, "site_full": "www.wbir.com", "main_image": "http://cdn.tegna-tv.com/-mm-/98742c9c0e86d8dd3750296d6787bf740e1e3e69/c=0-105-3573-2124&amp;r=x1683&amp;c=3200x1680/local/-/media/2015/10/26/WBIR/WBIR/635814444657019425-USATSI-8884003.jpg", "site_section": "http://rssfeeds.wbir.com/_/20/109727564/wbir/sports-news", "section_title": "WBIR - Sports Headlines", "url": "http://www.wbir.com/story/sports/nfl/2015/10/26/vols-nfl-week-7-2015/74614182/", "country": "US", "title": "Vols in the NFL: Week 7", "performance_score": 0, "site": "wbir.com", "participants_count": 0, "title_full": "Vols in the NFL: Week 7", "spam_score": 0.0, "site_type": "news", "published": "2015-10-26T14:25:00.000+02:00", "replies_count": 0, "uuid": "b83fc9db490904776827df83cdb992112cdf2eaf"}, "author": "", "url": "http://www.wbir.com/story/sports/nfl/2015/10/26/vols-nfl-week-7-2015/74614182/", "ord_in_thread": 0, "title": "Vols in the NFL: Week 7", "locations": ["Kansas City", "USA", "Arrowhead Stadium", "Tennessee"], "entities": {"persons": [], "locations": [], "organizations": []}, "highlightText": "", "language": "english", "persons": ["Denny Medley", "MO", "Mark Bergin", "Eric Berry"], "text": "Facebook Email Twitter Google+ LinkedIn Pinterest Vols in the NFL: Week 7 Here's a look at how former Tennessee Volunteers played in Week 7 of NFL action this past weekend. Post to Facebook Vols in the NFL: Week 7 Here's a look at how former Tennessee Volunteers played in Week 7 of NFL action this past weekend.  //on.wbir.com/1S5WcqE   Join the Conversation To   Vols in the NFL: Week 7 Mark Bergin, WBIR 8:25 a.m. EDT October 26, 2015 Oct 25, 2015; Kansas City, MO, USA; Kansas City Chiefs free safety Eric Berry (29) intercepts a pass and runs for short yardage during the second half against the Pittsburgh Steelers at Arrowhead Stadium. (Photo: Denny Medley, USA TODAY Sports) 2 CONNECT 8 TWEET LINKEDIN COMMENT EMAIL MORE \n(WBIR - KNOXVILLE) Another week of NFL play wraps up Monday night. Here's a look at how former Tennessee Volunteers played in Week 7 of NFL action this past weekend. \nEric Berry: The Kansas City Chiefs safety got his first interception since beating cancer. \nBerry intercepted a pass deflected off of Pittsburgh Steelers wide receiver Antonio Brown in the third quarter of the Chiefs’ 23-13 win. \nBerry also had a season-high six tackles in the game. \nJason Witten: Witten had six receptions for 73 yards in the Dallas Cowboys 27-20 loss to the New York Giants. \nSince starting quarterback Tony Romo sustained a collarbone injury in Week 2, Witten has not scored a touchdown. \nArian Foster: Multiple media outlets report the Houston Texans running back suffered a torn Achilles tendon during Sunday’s 44-26 loss to the Miami Dolphins. \nFoster said he will undergo an MRI exam Monday. \nHouston Texans running back Arian Foster (23) lays on the ground after being injured in the fourth quarter against the Miami Dolphins at Sun Life Stadium. (Photo: Andrew Innerarity, USA TODAY Sports) \nHe missed the first three games of the season due to a groin injury he suffered during training camp. \nSince 2011, Foster has missed at least one game due to injury in all but one season. 50 things we learned in Week 7 of the NFL season \nPeyton Manning: The Denver Broncos had their bye week. The Broncos have a 6-0 record this season. \nRobert Ayers: The New York Giants defensive lineman returned to action after missing four games with a hamstring injury. He had one tackle in the Giants win. \nJustin Hunter: Hunter had two catches for 17 yards in the Tennessee Titans 10-7 loss to the Atlanta Falcons . \nMychal Rivera: The Oakland Raiders tight end had two catches for 11 yards in the 37-29 win against the San Diego Chargers. \nDan Williams: The Raiders defensive lineman had four tackles against the Chargers. 2 CONNECT 8 TWEET LINKEDIN COMMENT EMAIL MORE Read or Share this story: http://on.wbir.com/1S5WcqE TOP VIDEOS", "external_links": [], "published": "2015-10-26T14:25:00.000+02:00", "crawled": "2015-10-26T15:06:19.701+02:00", "highlightTitle": ""}