{"organizations": ["Facebook Email Twitter Google", "Facebook"], "uuid": "baf1c07321698fd00151d9c9994c92511c4d36bc", "thread": {"social": {"gplus": {"shares": 0}, "pinterest": {"shares": 0}, "vk": {"shares": 0}, "linkedin": {"shares": 0}, "facebook": {"likes": 0, "shares": 0, "comments": 0}, "stumbledupon": {"shares": 0}}, "site_full": "www.desmoinesregister.com", "main_image": "http://www.gannett-cdn.com/-mm-/97376ab136f57bce9efa0e75e0a95b0f921ea1bb/c=0-0-1997-1128&amp;r=x1683&amp;c=3200x1680/local/-/media/2015/10/07/IAGroup/DesMoines/635798466908625188-20151007-bp-playmakers-01.JPG", "site_section": "http://rssfeeds.press-citizen.com/iowacity/sports", "section_title": "Iowa City - Sports", "url": "http://www.desmoinesregister.com/picture-gallery/sports/college/iowa/hawkcentral/2015/10/07/35-photos-iowa-basketball-playmakers/73552978/", "country": "US", "title": "35 photos: Iowa basketball playmakers", "performance_score": 0, "site": "desmoinesregister.com", "participants_count": 0, "title_full": "35 photos: Iowa basketball playmakers", "spam_score": 0.0, "site_type": "news", "published": "2015-10-08T04:10:00.000+03:00", "replies_count": 0, "uuid": "baf1c07321698fd00151d9c9994c92511c4d36bc"}, "author": "", "url": "http://www.desmoinesregister.com/picture-gallery/sports/college/iowa/hawkcentral/2015/10/07/35-photos-iowa-basketball-playmakers/73552978/", "ord_in_thread": 0, "title": "35 photos: Iowa basketball playmakers", "locations": ["Iowa", "Iowa City"], "entities": {"persons": [], "locations": [], "organizations": []}, "highlightText": "", "language": "english", "persons": ["Jarrod Uthoff", "Christian Williams", "Steven", "Fran McCaffery", "Brian", "Adam Woodbury", "Andrew Flemming", "Ahmad Wagner", "Michael Soukup", "Isaiah Moss", "Dale Jones", "Okey Ukah", "Dom Uhl"], "text": "Facebook Email Twitter Google+ LinkedIn Pinterest 35 photos: Iowa basketball playmakers Iowa head coach Fran McCaffery poses for a portrait during the men's basketball media day in Iowa City on Wednesday, October 7, 2015. Post to Facebook 35 photos: Iowa basketball playmakers Iowa head coach Fran McCaffery poses for a portrait during the men's basketball media day in Iowa City on Wednesday, October 7, 2015. Check out this story on desmoinesregister.com: http://dmreg.co/1LiUml7 Cancel Send A link has been sent to your friend's email address. Posted! A link has been posted to your Facebook feed. Join the Conversation To find out more about Facebook commenting please read the Conversation Guidelines and FAQs 35 photos: Iowa basketball playmakers Buy Photo Iowa head coach Fran McCaffery poses for a portrait during the men's basketball media day in Iowa City on Wednesday, October 7, 2015. Brian Powers/The Register Fullscreen Buy Photo Iowa head coach Fran McCaffery poses for a portrait during the men's basketball media day in Iowa City on Wednesday, October 7, 2015. Brian Powers/The Register Fullscreen Buy Photo Iowa senior center Adam Woodbury, right, and senior forward Jarrod Uthoff, left, pose for a portrait during the men's basketball media day in Iowa City on Wednesday, October 7, 2015. Brian Powers/The Register Fullscreen Buy Photo Iowa senior center Adam Woodbury, right, and senior forward Jarrod Uthoff, left, pose for a portrait during the men's basketball media day in Iowa City on Wednesday, October 7, 2015. Brian Powers/The Register Fullscreen Buy Photo Iowa senior center Adam Woodbury poses for a portrait during the men's basketball media day in Iowa City on Wednesday, October 7, 2015. Brian Powers/The Register Fullscreen Buy Photo Iowa senior center Adam Woodbury poses for a portrait during the men's basketball media day in Iowa City on Wednesday, October 7, 2015. Brian Powers/The Register Fullscreen Buy Photo Iowa senior center Adam Woodbury poses for a portrait during the men's basketball media day in Iowa City on Wednesday, October 7, 2015. Brian Powers/The Register Fullscreen Buy Photo Iowa senior center Adam Woodbury poses for a portrait during the men's basketball media day in Iowa City on Wednesday, October 7, 2015. Brian Powers/The Register Fullscreen Buy Photo Iowa freshman guard Andrew Flemming poses for a portrait during the men's basketball media day in Iowa City on Wednesday, October 7, 2015. Brian Powers/The Register Fullscreen Buy Photo Iowa freshman guard Andrew Flemming poses for a portrait during the men's basketball media day in Iowa City on Wednesday, October 7, 2015. Brian Powers/The Register Fullscreen Buy Photo Iowa senior forward Jarrod Uthoff poses for a portrait during the men's basketball media day in Iowa City on Wednesday, October 7, 2015. Brian Powers/The Register Fullscreen Buy Photo Iowa freshman guard Andrew Flemming poses for a portrait during the men's basketball media day in Iowa City on Wednesday, October 7, 2015. Brian Powers/The Register Fullscreen Buy Photo Iowa senior forward Jarrod Uthoff poses for a portrait during the men's basketball media day in Iowa City on Wednesday, October 7, 2015. Brian Powers/The Register Fullscreen Buy Photo Iowa freshman guard Isaiah Moss poses for a portrait during the men's basketball media day in Iowa City on Wednesday, October 7, 2015. Brian Powers/The Register Fullscreen Buy Photo Iowa senior forward Jarrod Uthoff poses for a portrait during the men's basketball media day in Iowa City on Wednesday, October 7, 2015. Brian Powers/The Register Fullscreen Buy Photo Iowa senior forward Jarrod Uthoff poses for a portrait during the men's basketball media day in Iowa City on Wednesday, October 7, 2015. Brian Powers/The Register Fullscreen Buy Photo Iowa senior forward Jarrod Uthoff poses for a portrait during the men's basketball media day in Iowa City on Wednesday, October 7, 2015. Brian Powers/The Register Fullscreen Buy Photo Iowa sophomore forward Dom Uhl poses for a portrait during the men's basketball media day in Iowa City on Wednesday, October 7, 2015. Brian Powers/The Register Fullscreen Buy Photo Iowa sophomore forward Dom Uhl poses for a portrait during the men's basketball media day in Iowa City on Wednesday, October 7, 2015. Brian Powers/The Register Fullscreen Buy Photo Iowa freshman forward Ahmad Wagner poses for a portrait during the men's basketball media day in Iowa City on Wednesday, October 7, 2015. Brian Powers/The Register Fullscreen Buy Photo Iowa freshman forward Ahmad Wagner poses for a portrait during the men's basketball media day in Iowa City on Wednesday, October 7, 2015. Brian Powers/The Register Fullscreen Buy Photo Iowa freshman forward Ahmad Wagner poses for a portrait during the men's basketball media day in Iowa City on Wednesday, October 7, 2015. Brian Powers/The Register Fullscreen Buy Photo Iowa freshman forward Ahmad Wagner poses for a portrait during the men's basketball media day in Iowa City on Wednesday, October 7, 2015. Brian Powers/The Register Fullscreen Buy Photo Iowa senior forward Okey Ukah poses for a portrait during the men's basketball media day in Iowa City on Wednesday, October 7, 2015. Brian Powers/The Register Fullscreen Buy Photo Iowa senior forward Okey Ukah poses for a portrait during the men's basketball media day in Iowa City on Wednesday, October 7, 2015. Brian Powers/The Register Fullscreen Buy Photo Iowa senior forward Okey Ukah poses for a portrait during the men's basketball media day in Iowa City on Wednesday, October 7, 2015. Brian Powers/The Register Fullscreen Buy Photo Iowa juniors Steven, left, and Michael Soukup, right, pose for a portrait during the men's basketball media day in Iowa City on Wednesday, October 7, 2015. Brian Powers/The Register Fullscreen Buy Photo Iowa juniors Steven, left, and Michael Soukup, right, pose for a portrait during the men's basketball media day in Iowa City on Wednesday, October 7, 2015. Brian Powers/The Register Fullscreen Buy Photo Iowa freshman guard Christian Williams poses for a portrait during the men's basketball media day in Iowa City on Wednesday, October 7, 2015. Brian Powers/The Register Fullscreen Buy Photo Iowa juniors Steven, left, and Michael Soukup, right, pose for a portrait during the men's basketball media day in Iowa City on Wednesday, October 7, 2015. Brian Powers/The Register Fullscreen Buy Photo Iowa freshman guard Christian Williams poses for a portrait during the men's basketball media day in Iowa City on Wednesday, October 7, 2015. Brian Powers/The Register Fullscreen Buy Photo Iowa junior forward Dale Jones poses for a portrait during the men's basketball media day in Iowa City on Wednesday, October 7, 2015. Brian Powers/The Register Fullscreen Buy Photo Iowa junior forward Dale Jones poses for a portrait during the men's basketball media day in Iowa City on Wednesday, October 7, 2015. Brian Powers/The Register Fullscreen Buy Photo Iowa junior forward Dale Jones poses for a portrait during the men's basketball media day in Iowa City on Wednesday, October 7, 2015. Brian Powers/The Register", "external_links": [], "published": "2015-10-08T04:10:00.000+03:00", "crawled": "2015-10-08T05:07:07.734+03:00", "highlightTitle": ""}