{"organizations": ["Winnipeg Jets", "Associated Press", "Jets", "Facebook Email Twitter Google", "Facebook Wild"], "uuid": "bae335993e3ed5430ce1628f8a2a62e24b816515", "thread": {"social": {"gplus": {"shares": 0}, "pinterest": {"shares": 0}, "vk": {"shares": 0}, "linkedin": {"shares": 0}, "facebook": {"likes": 0, "shares": 0, "comments": 0}, "stumbledupon": {"shares": 0}}, "site_full": "www.kare11.com", "main_image": "http://cdn.tegna-tv.com/-mm-/1e575791be71d855945678bddd39b901d7bacae3/c=0-412-1953-1516&amp;r=x633&amp;c=1200x630/local/-/media/2015/10/25/KARE/KARE/635814071480195292-USATSI-8885217-114815493-lowres.jpg", "site_section": "http://rssfeeds.kare11.com/_/20/109745618/KARE/sports", "section_title": "KARE - Sports", "url": "http://www.kare11.com/story/sports/nhl/wild/2015/10/25/wild-rally-falls-short-jets-win-5-4/74607806/", "country": "US", "title": "Wild rally falls short, Jets win 5-4", "performance_score": 0, "site": "kare11.com", "participants_count": 0, "title_full": "Wild rally falls short, Jets win 5-4", "spam_score": 0.0, "site_type": "news", "published": "2015-10-26T04:00:00.000+02:00", "replies_count": 0, "uuid": "bae335993e3ed5430ce1628f8a2a62e24b816515"}, "author": "", "url": "http://www.kare11.com/story/sports/nhl/wild/2015/10/25/wild-rally-falls-short-jets-win-5-4/74607806/", "ord_in_thread": 0, "title": "Wild rally falls short, Jets win 5-4", "locations": ["Minnesota", "Winnipeg", "Manitoba"], "entities": {"persons": [], "locations": [], "organizations": []}, "highlightText": "", "language": "english", "persons": ["Zach Parise", "Andrew Ladd", "Blake Wheeler", "Drew Stafford"], "text": "Facebook Email Twitter Google+ LinkedIn Pinterest Wild rally falls short, Jets win 5-4 Drew Stafford scored twice, Blake Wheeler had two assists and the Jets held off the Minnesota Wild 5-4 on Sunday. Post to Facebook Wild rally falls short, Jets win 5-4 Drew Stafford scored twice, Blake Wheeler had two assists and the Jets held off the Minnesota Wild 5-4 on Sunday.   kare11.com: http://www.kare11.com/story/sports/nhl/wild/2015/10/25/wild-rally-falls-short-jets-win-5-4/74607806/   Join the Conversation To   Wild rally falls short, Jets win 5-4 Associated Press, Associated Press 10 p.m. EDT October 25, 2015 Oct 25, 2015; Winnipeg, Manitoba, CAN; Minnesota Wild left wing Zach Parise (11) battles Winnipeg Jets left wing Andrew Ladd (16) during the third period at MTS Centre. Winnipeg Jets win 5-4. (Photo: Bruce Fedyck-USA TODAY Sports) \nWINNIPEG, Manitoba (AP) - Drew Stafford scored twice, Blake Wheeler had two assists and the Jets held off the Minnesota Wild 5-4 on Sunday. \nMinnesota's Jason Zucker scored 10 seconds into the game, but then Winnipeg got five consecutive goals. \nBryan Little tied it 1:22 into the first, Andrew Ladd scored about 2 minutes later and Nikolaj Ehlers made it 3-1 Jets (5-2-1) midway through the period. \nStafford scored 51 seconds into the second, chasing Minnesota goalie Darcy Kuemper. Stafford scored again on Devan Dubnyk just under 4 minutes later for his team-leading fifth goal this season. \nWheeler extended his season-opening point streak to a franchise-record eight games. Michael Hutchinson made 26 saves for Winnipeg. \nMikko Koivu, Justin Fontaine and Zach Parise also scored for Minnesota (5-2-1) Read or Share this story: http://www.kare11.com/story/sports/nhl/wild/2015/10/25/wild-rally-falls-short-jets-win-5-4/74607806/ TOP VIDEOS", "external_links": [], "published": "2015-10-26T04:00:00.000+02:00", "crawled": "2015-10-26T16:37:03.879+02:00", "highlightTitle": ""}