{"organizations": ["Sumner High School", "Sumner High School Sumner High School", "Sumner High School Facebook Email Twitter Google", "Facebook", "KING"], "uuid": "d8b74bd710e5d00bbe74d6b37d89537f6d045b10", "thread": {"social": {"gplus": {"shares": 0}, "pinterest": {"shares": 0}, "vk": {"shares": 0}, "linkedin": {"shares": 0}, "facebook": {"likes": 0, "shares": 0, "comments": 0}, "stumbledupon": {"shares": 0}}, "site_full": "www.king5.com", "main_image": "", "site_section": "http://rssfeeds.king5.com/_/20/109442106/king5/highschoolsports", "section_title": "KING 5 - High School Sports", "url": "http://www.king5.com/story/sports/high-school/2015/10/16/friday-pep-rally-sumner-high-school/74055656/", "country": "US", "title": "Friday pep rally: Sumner High School", "performance_score": 0, "site": "king5.com", "participants_count": 0, "title_full": "Friday pep rally: Sumner High School", "spam_score": 0.0, "site_type": "news", "published": "2015-10-16T19:57:00.000+03:00", "replies_count": 0, "uuid": "d8b74bd710e5d00bbe74d6b37d89537f6d045b10"}, "author": "", "url": "http://www.king5.com/story/sports/high-school/2015/10/16/friday-pep-rally-sumner-high-school/74055656/", "ord_in_thread": 0, "title": "Friday pep rally: Sumner High School", "locations": [], "entities": {"persons": [], "locations": [], "organizations": []}, "highlightText": "", "language": "english", "persons": ["Alex Rozier", "Sumner"], "text": "Facebook Email Twitter Google+ LinkedIn Pinterest Friday pep rally: Sumner High School Sumner High School is preparing to take on Lakes in this week's Big Game of the Week. Alex Rozier visited Sumner Friday morning, where the football team, cheerleaders, and the student joined the early morning festivities. Post to Facebook Friday pep rally: Sumner High School Sumner High School is preparing to take on Lakes in this week's Big Game of the Week. Alex Rozier visited Sumner Friday morning, where the football team, cheerleaders, and the student joined the early morning festivities.   KING5.com: http://www.king5.com/story/sports/high-school/2015/10/16/friday-pep-rally-sumner-high-school/74055656/   Join the Conversation To   Friday pep rally: Sumner High School Alex Rozier reports from Sumner. KING 5 News, KING5.com 9:57 a.m. PDT October 16, 2015 CONNECT TWEET LINKEDIN COMMENT EMAIL MORE \nSumner High School is preparing to take on Lakes in this week's Big Game of the Week. Alex Rozier visited Sumner Friday morning, where the football team, cheerleaders, and the student joined the early morning festivities. Read or Share this story: http://www.king5.com/story/sports/high-school/2015/10/16/friday-pep-rally-sumner-high-school/74055656/ TOP VIDEOS", "external_links": [], "published": "2015-10-16T19:57:00.000+03:00", "crawled": "2015-10-16T20:22:15.331+03:00", "highlightTitle": ""}