{"organizations": ["California Highway Patrol", "Mark Twain Medical Center"], "uuid": "101f7acd18f255e94ea80b7e1551c42fdbe90822", "thread": {"social": {"gplus": {"shares": 0}, "pinterest": {"shares": 0}, "vk": {"shares": 0}, "linkedin": {"shares": 0}, "facebook": {"likes": 0, "shares": 0, "comments": 0}, "stumbledupon": {"shares": 0}}, "site_full": "www.uniondemocrat.com", "main_image": "", "site_section": "http://feeds.feedburner.com/UnionDemocrat", "section_title": "The Union Democrat, Sonora, CA News, Sports, & Weather", "url": "http://www.uniondemocrat.com/index.php?option=com_content&task=view&id=117713&Itemid=199", "country": "US", "title": "Two people injured in Valley Springs accident", "performance_score": 0, "site": "uniondemocrat.com", "participants_count": 0, "title_full": "Two people injured in Valley Springs accident", "spam_score": 0.0, "site_type": "news", "published": "2015-10-03T04:00:00.000+03:00", "replies_count": 0, "uuid": "101f7acd18f255e94ea80b7e1551c42fdbe90822"}, "author": "", "url": "http://www.uniondemocrat.com/index.php?option=com_content&task=view&id=117713&Itemid=199", "ord_in_thread": 0, "title": "Two people injured in Valley Springs accident", "locations": ["Saint Andrews Road", "Valley Springs", "San Andreas", "Two Valley Springs"], "entities": {"persons": [], "locations": [], "organizations": []}, "highlightText": "", "language": "english", "persons": ["Jen Giangregorio", "Giangregorio", "McWilliams", "Kaylee Holler", "Ray McWilliams", "McWilliam"], "text": "Two people injured in Valley Springs accident Two people injured in Valley Springs accident By Union Democrat staff October 03, 2015 01:00 am Two Valley Springs residents sustained minor injuries in an accident Thursday on Highway 26. About 7 p.m., Jen Giangregorio, 38, of Valley Springs, was driving a 2014 Ford Explorer along Highway 26 and came to a complete stop preparing to turn left onto Saint Andrews Road, according to a California Highway Patrol report. Ray McWilliams, 54, of Valley Springs, was driving a 1998 Dodge Caravan behind Giangregorio and did not notice the Explorer was stopped, the report said. After McWilliam’s Caravan hit the back of Giangregorio’s Explorer, the Explorer was forced into a tree, the report said. Giangregorio was uninjured. McWilliams and his passenger, Kaylee Holler, 9, also of Valley Springs, both sustained minor injuries and were transported to Mark Twain Medical Center in San Andreas. Follow UnionDemocrat.com", "external_links": [], "published": "2015-10-03T04:00:00.000+03:00", "crawled": "2015-10-04T07:33:44.039+03:00", "highlightTitle": ""}