{"organizations": ["Calvary Lutheran Church", "Stockton Opera", "Sonora Bach Festival", "Columbia"], "uuid": "469b05c267ec62d9f0c7edc094367f5d0df8600b", "thread": {"social": {"gplus": {"shares": 0}, "pinterest": {"shares": 0}, "vk": {"shares": 0}, "linkedin": {"shares": 0}, "facebook": {"likes": 0, "shares": 0, "comments": 0}, "stumbledupon": {"shares": 0}}, "site_full": "www.uniondemocrat.com", "main_image": "", "site_section": "http://feeds.feedburner.com/UnionDemocrat", "section_title": "The Union Democrat, Sonora, CA News, Sports, & Weather", "url": "http://www.uniondemocrat.com/index.php?option=com_content&task=view&id=117681&Itemid=265", "country": "US", "title": "Bach Festival spans month of October", "performance_score": 0, "site": "uniondemocrat.com", "participants_count": 0, "title_full": "Bach Festival spans month of October", "spam_score": 0.0, "site_type": "news", "published": "2015-10-01T17:02:00.000+03:00", "replies_count": 0, "uuid": "469b05c267ec62d9f0c7edc094367f5d0df8600b"}, "author": "", "url": "http://www.uniondemocrat.com/index.php?option=com_content&task=view&id=117681&Itemid=265", "ord_in_thread": 0, "title": "Bach Festival spans month of October", "locations": ["East Sonora", "Sonora", "Tuolumne County", "Brook Moes"], "entities": {"persons": [], "locations": [], "organizations": []}, "highlightText": "", "language": "english", "persons": ["Ric Campero", "Hannah Husher", "Lillian Fox", "Stephanie St. Clair", "Gordon Rowland", "Stockton", "Dave Cooks", "Bach", "John Kraus", "Vivian Fox", "Daniel Kook", "Alexandria Dowie", "Trudy Kraus", "Carolyn Silva", "Jade Coard", "Maggie Wilcox", "Louise McPeeters", "Samantha Smith", "Laura Kramer", "Sabrina Jensen", "Chloe Johnson", "Gail Johnson", "Joy Willow", "Vivian Byrnes"], "text": "Bach Festival spans month of October Bach Festival spans month of October By Union Democrat staff October 01, 2015 02:02 pm Now in its 39th year, the Sonora Bach Festival presents weekend concerts this month. This year’s lineup features: • Bach Singalong — 3 p.m Saturday, Church of the 49ers, Columbia: Sonora Bach Festival’s opportunity for skilled and novice singers to experience Bach’s music as participants, starting with the motet, “Jesu meine freude” and including “Dona nobis pacem.” Singers will share their mutual love of Bach’s music, while appreciating the vocal nuances of casually singing together, all in a relaxed atmosphere. Sight-reading experience helpful but not required. Free, with donations accepted. • Youth Concert — 3 p.m. Sunday, Church of the 49ers, Columbia: A concert highlighting the talents of the musical youth of Tuolumne County. This concert will feature vocal and instrumental students chosen by audition as well as the special guest artists. Winners were vocal and instrumental students of Tuolumne County music teachers John Kraus, Louise McPeeters, Carolyn Silva, Joy Willow, Gail Johnson, Vivian Byrnes and Trudy Kraus. The elementary through high school students were required to perform a memorized musical selection of their choice for the audition. Eleven recitalists were chosen. They are vocalists Alexandria Dowie, Sabrina Jensen, Chloe Johnson, Samantha Smith and Stephanie St. Clair. Instrumental artists chosen were Jade Coard, Lillian Fox, Vivian Fox, Hannah Husher, Daniel Kook, and Laura Kramer. The invited guest artist, violinist Maggie Wilcox, is a student of Brook Moes. Her program will include two movements from one of Bach’s unaccompanied works for the violin. Admission is $5 for adults, with children free. • Salon Concert — 7 p.m. Saturday, Oct. 10, at a private home in Sonora (directions with ticket purchase): Guest artist is Ric Campero, internationally-acclaimed tenor and past regional winner of the Metropolitan Opera Competition. Campero has appeared with the Stockton Opera, Merced and Stockton Symphonies. Tickets are $25, including refreshments catered by Chef Dave Cooks. • Locals Concert — 3 p.m. Sunday, Oct. 18, Church of the 49ers, Columbia: A concert featuring talented local vocal and instrumental artists. Tickets are $10. • Bach’s Brunch — 12:30 p.m. Sunday, Oct. 25, Mt. Calvary Lutheran Church, Sugar Pine: This traditional champagne brunch, the culminating event of the 2015 season, will be catered by Chef Dave Cooks. Performing will be classical guitar virtuoso, Gordon Rowland, whose expertise is internationally-known. Tickets are $35, including a full brunch. To purchase tickets, visitsonorabach.org or Mountain Bookshop at The Junction shopping center in East Sonora. • What: Sonora Bach Festival. • Where: Columbia, Sonora and Sugar Pine. • Tickets: Range from free to $35. • Information: sonorabach.org", "external_links": [], "published": "2015-10-01T17:02:00.000+03:00", "crawled": "2015-10-02T07:16:20.245+03:00", "highlightTitle": ""}