{"organizations": ["Los Angeles Kings", "AP Hockey", "Facebook Miller", "Vancouver Canucks", "Canucks"], "uuid": "dc01185035d25c111de606aa21cb34c48cbfb00c", "thread": {"social": {"gplus": {"shares": 0}, "pinterest": {"shares": 0}, "vk": {"shares": 0}, "linkedin": {"shares": 0}, "facebook": {"likes": 0, "shares": 0, "comments": 0}, "stumbledupon": {"shares": 0}}, "site_full": "www.king5.com", "main_image": "http://www.gannett-cdn.com/-mm-/489efad1142179deef9ce5ef3cf126cd99e1a3f1/r=x633&amp;c=1200x630/http/cdn.tegna-tv.com/-mm-/40eaf6ae2c9eb500df889f77aadfb71dcc1e5ade/c=0-121-2480-1522/local/-/media/2015/10/14/NWGroup/KING/635803870124494793-canucks-beat-kings.jpg", "site_section": "http://rssfeeds.nwcn.com/_/20/109828944/nwcn/sports", "section_title": "NWCN - Sports", "url": "http://www.king5.com/story/sports/2015/10/14/vancouver-canucks-kings-hockey-nhl-miller/73912936/", "country": "US", "title": "Miller gets 36th shutout as Canucks blank Kings 3-0", "performance_score": 0, "site": "king5.com", "participants_count": 0, "title_full": "Miller gets 36th shutout as Canucks blank Kings 3-0", "spam_score": 0.0, "site_type": "news", "published": "2015-10-14T09:37:00.000+03:00", "replies_count": 0, "uuid": "dc01185035d25c111de606aa21cb34c48cbfb00c"}, "author": "", "url": "http://www.king5.com/story/sports/2015/10/14/vancouver-canucks-kings-hockey-nhl-miller/73912936/", "ord_in_thread": 0, "title": "Miller gets 36th shutout as Canucks blank Kings 3-0", "locations": ["USA", "CA", "Los Angeles"], "entities": {"persons": [], "locations": [], "organizations": []}, "highlightText": "", "language": "english", "persons": ["Dan Hamhuis", "Matt Bartkowski", "Jayne Kamin-Oncea", "GREG BEACHAM", "Adam Cracknell", "Jayne Kamin-Oncea-USA", "Jannik Hansen", "Brandon Prust", "Miller"], "text": "Miller gets 36th shutout as Canucks blank Kings 3-0 Adam Cracknell scored his second goal in two games for Vancouver. Post to Facebook Miller gets 36th shutout as Canucks blank Kings 3-0 Adam Cracknell scored his second goal in two games for Vancouver.  //www.king5.com/story/sports/2015/10/14/vancouver-canucks-kings-hockey-nhl-miller/73912936/   Join the Conversation To   Miller gets 36th shutout as Canucks blank Kings 3-0 By GREG BEACHAM AP Hockey Writer 11:37 p.m. PDT October 13, 2015 Oct 13, 2015; Los Angeles, CA, USA; Vancouver Canucks right wing Jannik Hansen (36), defenseman Dan Hamhuis (2), right wing Adam Cracknell (24), defenseman Matt Bartkowski (44) and right wing Brandon Prust (9) are greeted at the bench after a goal in the second period of the game against the Los Angeles Kings at Staples Center. Mandatory Credit: Jayne Kamin-Oncea-USA TODAY Sports (Photo: Jayne Kamin-Oncea, Jayne Kamin-Oncea-USA TODAY Sports) CONNECT TWEET LINKEDIN COMMENT EMAIL MORE \nLOS ANGELES (AP) - Ryan Miller made 15 saves in his 36th career shutout, Adam Cracknell scored his second goal in two games, and the Vancouver Canucks completed a Southern California sweep with a 3-0 victory over the winless Los Angeles Kings on Tuesday night. \nAlexander Edler scored and Derek Dorsett added an empty-net goal for the Canucks, who followed up a 2-1 shootout win over Anaheim on Monday by improving to 3-0-1 in the young season. \nMiller is off to a strong start after matching his career high with six shutouts last season, his first with the Canucks. \nJonathan Quick stopped 23 shots for struggling Los Angeles, which has been outscored 11-2 while losing three straight home games to open the season. Read or Share this story: http://www.king5.com/story/sports/2015/10/14/vancouver-canucks-kings-hockey-nhl-miller/73912936/ TOP VIDEOS", "external_links": [], "published": "2015-10-14T09:37:00.000+03:00", "crawled": "2015-10-14T09:57:00.358+03:00", "highlightTitle": ""}