{"organizations": ["Vols", "AP", "Arkansas"], "uuid": "251cab2c879661bc05829b94ee4cb7dc58c7cd0c", "thread": {"social": {"gplus": {"shares": 0}, "pinterest": {"shares": 0}, "vk": {"shares": 0}, "linkedin": {"shares": 0}, "facebook": {"likes": 0, "shares": 0, "comments": 0}, "stumbledupon": {"shares": 0}}, "site_full": "www.newschannel9.com", "main_image": "http://newschannel9.com/sports/features/headlines/stories//images/Vols_New_2510.jpg", "site_section": "http://www.newschannel9.com//xml/rss/sports_feed.xml", "section_title": "WTVC Sports - Headlines", "url": "http://www.newschannel9.com/sports/features/headlines/stories/vols-reserve-linebacker-out-stress-fracture-2510.shtml", "country": "US", "title": "Vols Reserve Linebacker Out With Stress Fracture", "performance_score": 0, "site": "newschannel9.com", "participants_count": 0, "title_full": "Vols Reserve Linebacker Out With Stress Fracture", "spam_score": 0.0, "site_type": "news", "published": "2015-09-30T21:24:00.000+03:00", "replies_count": 0, "uuid": "251cab2c879661bc05829b94ee4cb7dc58c7cd0c"}, "author": "", "url": "http://www.newschannel9.com/sports/features/headlines/stories/vols-reserve-linebacker-out-stress-fracture-2510.shtml", "ord_in_thread": 0, "title": "Vols Reserve Linebacker Out With Stress Fracture", "locations": ["Tenn.", "Tennessee", "Georgia", "KNOXVILLE", "Florida", "Alpharetta", "Arkansas"], "entities": {"persons": [], "locations": [], "organizations": []}, "highlightText": "", "language": "english", "persons": ["Jones", "Butch Jones", "Alton", "Sapp", "Howard"], "text": "Wednesday, September 30 2015, 06:25 PM EDT Vols Reserve Linebacker Out With Stress Fracture KNOXVILLE, Tenn. (AP) -- Tennessee reserve linebacker Quart'e Sapp is out indefinitely with a stress fracture in his foot. Volunteers coach Butch Jones said Wednesday that Sapp will miss \"an inordinate amount of time.\" Jones added that he \"can't really put a time frame on it.\" Sapp, who is from Alpharetta, Georgia, played in each of Tennessee's first four games and made three tackles. Tennessee (2-2, 0-1 SEC) hosts Arkansas (1-3, 0-1) on Saturday. Jones also said wide receiver Alton \"Pig\" Howard's status remains uncertain for the Arkansas game. Howard missed the Vols' 28-27 loss to Florida last week with an injury that hasn't been specified. Vols Reserve Linebacker Out With Stress Fracture Related Stories Check Back Often for NewsChannel9 Sponsored Events! Sports Headlines [an error occurred while processing this directive] Business News \nSurvey: US businesses added jobs in September at solid pace \nWASHINGTON (AP) -- Buoyed by strong consumer spending and steady home sales, U.S. businesses added jobs at a healthy pace in September, according to a private survey. \nWEST PALM BEACH, FL -- (Marketwired) -- 03/21/14 -- Companies that pride themselves on being eco-friendly may have conflicted ideas between marketing with ad specialties and maintaining their green reputation. ... Get This \nCOUPLE ASKS STRANGERS TO CRASH WEDDING \nFORT MYERS, Fla. (AP) -- Can you really call it crashing a wedding if you're invited to crash it? Science/Tech News \nIN THE NEWS: TODAYTIX TO EXPAND \nNEW YORK (AP) -- Like a successful Broadway show, an app for theater tickets is getting to hit the road nationally. Politics, Breaking News, US and World News. more » Tonight on WTVC NewsChannel 9 \n6:00 NewChannel 9 6:30 ABC World News Tonight7:00 Wheel of Fortune Stay Connected: \n©2015, Sinclair Broadcast Group, Inc.WTVC News Channel 9 provides local news, weather forecasts, traffic updates, notices of events and items of interest in the community, sports and entertainment programming for Chattanooga and nearby towns and communities in the Tennessee Valley and Northwest Georgia, including in Tennessee East Ridge, Hixson, Red Bank, Signal Mountain, Whitwell, Spring City, Gruetli-Laager, Tracy City. Benton, Ducktown, Copperhill, and Ocoee, Jasper, Monteagle, Ooltewah, Charleston, Middle Valley, Georgetown, Soddy-Daisy, Sewanee, Cleveland, Sale Creek, Dunlap, Dayton, Pikeville, Athens, Etowah, Sweetwater, Kimball, South Pittsburg, and New Hope; in Georgia Rock Springs, Ringgold, Lafayette, Dalton, Chatsworth, Summerville, Calhoun, Chickamauga, Fort Oglethorpe, Trenton, Chattanooga Valley, Tunnel Hill, Rossville, Lakeview, Flintstone, Fairview, and Indian Springs; in North Carolina Murphy and Andrews; and in Alabama Bridgeport, Bryant, Stevenson, Fackler, Scottsboro, Rainsville, Fort Payne, Huntsville, Madison, Hazel Green, Toney, Harvest, Athens, Tanner, and Decatur.", "external_links": [], "published": "2015-09-30T21:24:00.000+03:00", "crawled": "2015-10-01T05:40:03.205+03:00", "highlightTitle": ""}