{"organizations": ["Tuolumne County Board of Supervisors Housing Policy", "Columbia", "Board of Supervisors Chambers", "Tuolumne County Administration Center", "S. Green St.", "Mount Calvary Lutheran Church", "Tuolumne County Library", "Lake Don Pedro Baptist Church", "Calaveras Child Care Council", "Sonora Baptist Church", "All Saints Catholic Church", "Arnold", "Twain Harte School District Board of Education", "Sonora Cribbage Club", "Union Public Utility District", "Tuolumne County Planning Commission", "Tuolumne County Board of Supervisors", "Angels Camp City Council", "Strawberry Fire Protection District Board of Directors", "Sonora Elementary School Board of Trustees", "Calaveras County Chamber of Commerce", "Tuolumne County Veterans Committee", "Twain Harte Community Center", "Chesborough Room", "Toma Court", "Food Resource Coalition", "ATCAA Food Bank", "Sonora High School District Board of Trustees", "Bradford St."], "uuid": "13fdb3a48fd7102906ec636f7a49bce1cca2c057", "thread": {"social": {"gplus": {"shares": 0}, "pinterest": {"shares": 0}, "vk": {"shares": 0}, "linkedin": {"shares": 0}, "facebook": {"likes": 0, "shares": 0, "comments": 0}, "stumbledupon": {"shares": 0}}, "site_full": "www.uniondemocrat.com", "main_image": "", "site_section": "http://feeds.feedburner.com/UnionDemocrat", "section_title": "The Union Democrat, Sonora, CA News, Sports, & Weather", "url": "http://www.uniondemocrat.com/index.php?option=com_content&task=view&id=117921&Itemid=199", "country": "US", "title": "Calendar for Oct. 20, 2015", "performance_score": 0, "site": "uniondemocrat.com", "participants_count": 0, "title_full": "Calendar for Oct. 20, 2015", "spam_score": 0.0, "site_type": "news", "published": "2015-10-20T04:00:00.000+03:00", "replies_count": 0, "uuid": "13fdb3a48fd7102906ec636f7a49bce1cca2c057"}, "author": "", "url": "http://www.uniondemocrat.com/index.php?option=com_content&task=view&id=117921&Itemid=199", "ord_in_thread": 0, "title": "Calendar for Oct. 20, 2015", "locations": ["Greenley Road", "San Andreas", "Sonora", "Park Lane", "Mountain Ranch Road", "Calaveras County Library", "Ebbetts Pass", "Mi-Wuk Village", "S. Green St.", "East Sonora", "Nugget Blvd.", "Tuolumne County Library", "Tuolumne County", "Vallecito Road", "Jamestown", "Victoria Way", "Manuel Road"], "entities": {"persons": [], "locations": [], "organizations": []}, "highlightText": "", "language": "english", "persons": ["Twain Harte", "S. Washington St.", "N. Washington St.", "Don Pedro"], "text": "Calendar for Oct. 20, 2015 Calendar for Oct. 20, 2015 By Union Democrat staff October 20, 2015 01:00 am For complete arts and entertainment listings, see the Weekender, published Thursdays in The Union Democrat. COUNTY TODAY Tuolumne County Board of Supervisors, 9 a.m., Tuolumne County Administration Center, supervisors’ chambers, fourth floor, 2 S. Green St., Sonora. ATCAA Food Bank distribution, 10 a.m. to noon, All Saints Catholic Church, Twain Harte; ATCAA Food Bank, Jamestown; Church of the 49ers, Columbia; Lake Don Pedro Baptist Church, Don Pedro; Mount Calvary Lutheran Church, Mi-Wuk Village; Sonora Baptist Church, Sonora; Tuolumne County Senior Center, Sonora; Tuolumne Veteran’s Memorial Hall, Tuolumne. Runaway Bunnies storytime, toddlers ages 2 to 3, 10:30 a.m., Tuolumne County Library, 480 Greenley Road, Sonora, 533-5507. Twain Harte American Legion Post 681, noon, Twain Harte Community Center, downtown Twain Harte, 586-2618. Strawberry Fire Protection District Board of Directors, 5 p.m., Strawberry Fire Station, 31885 Tanager Drive. Sonora Cribbage Club, 6 p.m., Tuolumne County Senior Center, 540 Greenley Road, 533-3946. Sonora High School District Board of Trustees, 6 p.m., district office, 100 School St., Sonora. Parents, Families and Friends of Lesbians and Gays (PFLAG), 6:30 to 8 p.m., Tuolumne County Library, conference room, 480 Greenley Road, Sonora, 533-1665. WEDNESDAY Tuolumne Talkers, Toastmasters, 6:45 a.m., Papa’s New Roost, 20049 Highway 108, East Sonora, 586-4705. Mother Lode Fair Board committees, 8 to 11 a.m., 220 Southgate Drive, Sonora. Tuolumne-Stanislaus Integrated Water Management Plan, 9 a.m., Tuolumne Utilities District, 18885 Nugget Blvd., Sonora, 832-5536, ext. 502. Senior Legal Advocacy, 10 a.m. to 4 p.m., 88 Bradford St., Sonora, 588-1597; 10 a.m. to 2 p.m., Tuolumne County Senior Center, 540 Greenley Road, Sonora. Mother Goose storytime, children to age 2, 10:30 a.m., Tuolumne County Library, 480 Greenley Road, Sonora, 533-5507. Food Resource Coalition, noon to 1 p.m., 10059 Victoria Way, Jamestown. Tuolumne County Board of Supervisors Housing Policy, 3 p.m., Board of Supervisors Chambers, 2 S. Green St., Sonora. Twain Harte School District Board of Education, 4 p.m., district office, 18995 Twain Harte Drive, 586-3772. Sonora Elementary School Board of Trustees, 5:30 p.m., library, school, 830 Greenley Road, Sonora. Tuolumne County Resource Conservation District, 5:30 p.m., 77 N. Washington St., Sonora. Tuolumne County Planning Commission, 6 p.m., Tuolumne County Administration Center, 2 S. Green St., Sonora, 533-5633. Tuolumne County Veterans Committee, 7 p.m., Veterans Memorial Hall, 9 N. Washington St., Sonora, 984-4719. CALAVERAS TODAY Ebbetts Pass Fire Protection District, 9 a.m., Station No. 1, 1028 Manuel Road, Arnold, 795-1646. Calaveras County Master Gardeners, 10 a.m., Chesborough Room, Calaveras County Library, 891 Mountain Ranch Road, San Andreas. Storytime for children, 10:30 a.m., Murphys Volunteer Library, 480 Park Lane, Murphys, 728-3036. Calaveras County Water District, 2 p.m., 120 Toma Court, San Andreas. Calaveras Child Care Council, 4 to 6 p.m., Head Start Portable 501-D Goldstrike, San Andreas, 754-5348. Angels Camp City Council, 6 p.m., Angels Camp Fire Station, 1404 Vallecito Road, Angels Camp, 736-2181. WEDNESDAY Storytime, 11 a.m., Calaveras Central Library, 891 Mountain Ranch Road, San Andreas. Calaveras County Chamber of Commerce, contact for time and location, 736-2580. Republicans of Ebbetts Pass (REP), 11:30 a.m., Lion’s Hut, Murphys, 795-5309, 728-2567. American Legion, Ebbetts Pass Post No. 290, 7 p.m., Lions Clubhouse, School Street, Murphys, 795-6859, 728-2283. Union Public Utility District, 7 p.m., 339 Main St., Murphys, 728-3651. The Union Democrat Calendar attempts to list all non-commercial events of public interest in the greater Tuolumne and Calaveras county areas. Contributions are welcome. Call 588-4547, visit 84 S. Washington St., Sonora, or email This e-mail address is being protected from spam bots, you need JavaScript enabled to view it Follow UnionDemocrat.com", "external_links": [], "published": "2015-10-20T04:00:00.000+03:00", "crawled": "2015-10-21T08:25:54.992+03:00", "highlightTitle": ""}