{"organizations": ["National Anthem", "Gannett Tennessee Beech High", "Gannett Tennessee Buy Photo Ravenwood", "Kenwood", "Gannett Tennessee Kenwood", "Gannett Tennessee Fullscreen", "Gannett Tennessee Fullscreen Buy Photo Caroline Cowled", "Gannett Tennessee Not", "Tennessean Northwest", "Gannett Tennessee Fullscreen Buy Photo Ravenwood", "Ravenwood High School", "Gannett Tennessee Smyrna", "Gannett Tennessee Blackman", "Gannett Tennessee Beech", "Northwest", "Gannett Tennessee Greenbrier", "Vikings", "Brentwood Academy", "Ravenwood High"], "uuid": "ac5266e6bfac9a6233268312b34486b47e2558f6", "thread": {"social": {"gplus": {"shares": 0}, "pinterest": {"shares": 0}, "vk": {"shares": 0}, "linkedin": {"shares": 0}, "facebook": {"likes": 0, "shares": 0, "comments": 0}, "stumbledupon": {"shares": 0}}, "site_full": "www.tennessean.com", "main_image": "http://www.gannett-cdn.com/-mm-/ea3e6a45a118afd453943282afc554fb76e51256/c=0-71-1998-1200&amp;r=x1683&amp;c=3200x1680/local/-/media/2015/10/02/Nashville/Nashville/635794235041662657-01-Homecoming-Queen-Blackman.jpg", "site_section": "http://rssfeeds.tennessean.com/nashville/highschoolsports", "section_title": "Nashville - High School Sports", "url": "http://www.tennessean.com/picture-gallery/sports/high-school/2015/10/02/week-7-scenes-from-middle-tennessee/73243226/", "country": "US", "title": "Week 7: Scenes from Middle Tennessee", "performance_score": 0, "site": "tennessean.com", "participants_count": 0, "title_full": "Week 7: Scenes from Middle Tennessee", "spam_score": 0.0, "site_type": "news", "published": "2015-10-03T07:43:00.000+03:00", "replies_count": 0, "uuid": "ac5266e6bfac9a6233268312b34486b47e2558f6"}, "author": "", "url": "http://www.tennessean.com/picture-gallery/sports/high-school/2015/10/02/week-7-scenes-from-middle-tennessee/73243226/", "ord_in_thread": 0, "title": "Week 7: Scenes from Middle Tennessee", "locations": ["Gannett Tennessee", "Brentwood", "Ravenwood", "Smyrna", "Esau Lathon Field", "Nashville", "Clarksville", "Greenbrier", "Ensworth", "Middle Tennessee", "Gallatin"], "entities": {"persons": [], "locations": [], "organizations": []}, "highlightText": "", "language": "english", "persons": ["McGavock", "Heath Creel", "Rachel Holmes", "Preton Burnett", "George Robinson", "Brendon Knapp", "Blackman", "Jackson Graham", "Will Hester", "Jada Dotson", "Amanda May", "Brian Pena", "Dave Cardaciotto", "Ravenwood", "Collin Pelletier", "Lori Canfield", "Monica Nelson", "Helen Comer", "Dave Cardaciotto Dave Cardaciotto", "John Partipilo", "Brianna Camacho", "Jae S. Lee", "Ken Herndon"], "text": "Activate your digital access. Week 7: Scenes from Middle Tennessee Monica Nelson reacts as she is announced Blackman's Homecoming Queen as she is escorted by Heath Creel during half time of the Smyrna vs. Blackman game on Friday. Helen Comer / Gannett Tennessee Blackman senior Rachel Holmes, left, and freshman Amanda May, right, bundle up as they wait for the Smyrna vs. Blackman game to begin. Helen Comer / Gannett Tennessee Fullscreen Buy Photo Caroline Cowled and Jada Dotson keep warm before the start of the Ensworth game on Friday Oct. 2, 2015 in Nashville. John Partipilo / The Tennessean Beech HS Cheerleaders don their raingear for the game vs Gallatin. Photo by Dave Cardaciotto Dave Cardaciotto / For Gannett Tennessee Buy Photo Ravenwood cheerleaders salute during the National Anthem before the kick-off against McGavock at Ravenwood High on Friday. Jae S. Lee / The Tennessean Buy Photo Ensworth cheerleaders get the crowd going during the Ensworth-Brentwood Academy game on Friday. John Partipilo / The Tennessean Greenbrier cheerleaders were all smiles before the homecoming game. Ken Herndon / For Gannett Tennessee Fullscreen Buy Photo Despite the cold, rainy environment, Ensworth fans get loud to cheer on their team before the game against Brentwood Academy Friday in Nashville. John Partipilo / The Tennessean Northwest’s ROTC walks to midfield just before the playing of the National Anthem at the start of the Vikings’ football game against Kenwood Friday in Clarksville. George Robinson / Gannett Tennessee Fullscreen Buy Photo Ravenwood fans cheer for their team against McGavock during the first half at Ravenwood High School in Brentwood on Friday. Jae S. Lee / The Tennessean Buy Photo Fullscreen Buy Photo Ravenwood student Brendon Knapp holds a school flag as Ravenwood players get ready to take the field prior to the kick-off against McGavock at Ravenwood High School in Brentwood on Friday. Jae S. Lee / The Tennessean Buy Photo Blackman seniors Jackson Graham, left, and Collin Pelletier, right, cheer before the start of the Smyrna vs. Blackman game. Helen Comer / Gannett Tennessee Fullscreen Buy Photo Ravenwood fans cheer for their team against McGavock during the first half at Ravenwood High School in Brentwood. Jae S. Lee / The Tennessean Buy Photo Fullscreen Buy Photo Ravenwood Head Coach Will Hester smiles on the sideline during the first half against McGavock at Ravenwood in Brentwood. Jae S. Lee / The Tennessean Buy Photo Fullscreen Buy Photo A Ravenwood fan holds a sign during the first half against McGavock at Ravenwood High School in Brentwood. Jae S. Lee / The Tennessean Buy Photo Northwest High drum majors Brianna Camacho (foreground) and Lori Canfield (background) lead the Vikings band before the start of Northwest's high school football game against Kenwood Friday in Clarksville. George Robinson / Gannett Tennessee Greenbrier dance team performs at halftime. Ken Herndon / For Gannett Tennessee Beech High fans pump it up before their game with Gallatin. Dave Cardaciotto / For Gannett Tennessee Beech fans watch in the rain as their team takes on Gallatin. Dave Cardaciotto / For Gannett Tennessee Smyrna jurniors Brian Pena, left and Preton Burnett, right get the Smyrna flags ready before the start of the Smyrna vs. Blackman game. Helen Comer / Gannett Tennessee The Beech Color Guard during does it's routine during the playing of the National Anthem. Dave Cardaciotto / For Gannett Tennessee Not even swirling rain showers could dampen this Greenbrier fan's enthusiasm. Ken Herndon / For Gannett Tennessee Kenwood’s football team rushes onto the field prior to the start of its region football game against Northwest Friday night at Esau Lathon Field in Clarksville. George Robinson / Gannett Tennessee", "external_links": [], "published": "2015-10-03T07:43:00.000+03:00", "crawled": "2015-10-05T12:34:47.371+03:00", "highlightTitle": ""}