{"organizations": ["Silverton Owls", "Clarendon Broncos", "Texico Wolverines", "Littlefield Wildcats", "Amarillo News", "Ruidoso Warriors Kickoff", "Memphis Cyclones", "Waukomis Chiefs", "Tucumcari Rattlers", "KFDA", "Interstate Bank", "Bovina Mustangs", "Childress Bobcats", "Buffalo Wild Wings", "Hedley Owls"], "uuid": "0d8338aac386fc66d7268292abc8b5c220c94e74", "thread": {"social": {"gplus": {"shares": 0}, "pinterest": {"shares": 0}, "vk": {"shares": 0}, "linkedin": {"shares": 0}, "facebook": {"likes": 0, "shares": 0, "comments": 0}, "stumbledupon": {"shares": 0}}, "site_full": "www.newschannel10.com", "main_image": "http://KFDA.IMAGES.worldnow.com/images/4728402_G.jpg", "site_section": "http://www.newschannel10.com/category/72490/sports?clienttype=rss", "section_title": "KFDA - Sports", "url": "http://www.newschannel10.com/story/30328003/the-wrap-up-schedulescoreboard-week-9", "country": "US", "title": "The Wrap-Up, Schedule/Scoreboard - Week 9", "performance_score": 0, "site": "newschannel10.com", "participants_count": 0, "title_full": "The Wrap-Up, Schedule/Scoreboard - Week 9", "spam_score": 0.0, "site_type": "news", "published": "2015-10-22T22:38:00.000+03:00", "replies_count": 0, "uuid": "0d8338aac386fc66d7268292abc8b5c220c94e74"}, "author": "", "url": "http://www.newschannel10.com/story/30328003/the-wrap-up-schedulescoreboard-week-9", "ord_in_thread": 0, "title": "The Wrap-Up, Schedule/Scoreboard - Week 9", "locations": ["Amarillo", "Friona", "Lubbock Estacado Kickoff", "Tulia", "Lubbock Coronado Kickoff", "Boise City Kickoff", "San Jacinto Kickoff", "Perryton"], "entities": {"persons": [], "locations": [], "organizations": []}, "highlightText": "", "language": "english", "persons": ["McGuinness", "Follett"], "text": "The Wrap-Up, Schedule/Scoreboard - Week 9 - KFDA - NewsChannel 10 / Amarillo News, Weather, Sports Member Center: The Wrap-Up, Schedule/Scoreboard - Week 9 Oct. 23, 2015, 8 p.m. Amarillo High Kickoff: Oct. 23, 2015, 8 p.m. Oct. 23, 2015, 7:30 p.m. Lubbock Coronado Kickoff: Oct. 23, 2015, 7:30 p.m. Oct. 23, 2015, 7 p.m. Dumas Demons Kickoff: Oct. 23, 2015, 7 p.m. Oct. 23, 2015, 7:30 p.m. Caprock Kickoff: Oct. 23, 2015, 7:30 p.m. Oct. 23, 2015, 7:30 p.m. Canyon Eagles Kickoff: Oct. 23, 2015, 7:30 p.m. Oct. 23, 2015, 7 p.m. Lubbock Estacado Kickoff: Oct. 23, 2015, 7 p.m. Oct. 23, 2015, 7 p.m. Borger Kickoff: Oct. 23, 2015, 7 p.m. Oct. 23, 2015, 7 p.m. Perryton Kickoff: Oct. 23, 2015, 7 p.m. Oct. 23, 2015, 7 p.m. Bushland Falcons Kickoff: Oct. 23, 2015, 7 p.m. Oct. 23, 2015, 7:30 p.m. Friona Kickoff: Oct. 23, 2015, 7:30 p.m. Oct. 23, 2015, 7:30 p.m. Littlefield Wildcats Kickoff: Oct. 23, 2015, 7:30 p.m. Oct. 23, 2015, 7:30 p.m. Tulia Kickoff: Oct. 23, 2015, 7:30 p.m. Oct. 23, 2015, 7:30 p.m. Childress Bobcats Kickoff: Oct. 23, 2015, 7:30 p.m. Oct. 23, 2015, 7:30 p.m. Highland Park Kickoff: Oct. 23, 2015, 7:30 p.m. Oct. 23, 2015, 7 p.m. Canadian Wildcats Kickoff: Oct. 23, 2015, 7 p.m. Oct. 23, 2015, 7 p.m. Panhandle Panthers Kickoff: Oct. 23, 2015, 7 p.m. Oct. 23, 2015, 7 p.m. Boys Ranch Kickoff: Oct. 23, 2015, 7 p.m. Oct. 23, 2015, 7 p.m. Gruver Kickoff: Oct. 23, 2015, 7 p.m. Oct. 23, 2015, 7 p.m. Wheeler Kickoff: Oct. 23, 2015, 7 p.m. Oct. 23, 2015, 7 p.m. Clarendon Broncos Kickoff: Oct. 23, 2015, 7 p.m. Oct. 23, 2015, 7 p.m. Shamrock Kickoff: Oct. 23, 2015, 7 p.m. Oct. 23, 2015, 7 p.m. Bovina Mustangs Kickoff: Oct. 23, 2015, 7 p.m. Oct. 23, 2015, 7:30 p.m. Vega Kickoff: Oct. 23, 2015, 7:30 p.m. Oct. 23, 2015, 7 p.m. Memphis Cyclones Kickoff: Oct. 23, 2015, 7 p.m. Oct. 23, 2015, 6 p.m. San Jacinto Kickoff: Oct. 23, 2015, 6 p.m. Oct. 23, 2015, 7:30 p.m. Nazareth Kickoff: Oct. 23, 2015, 7:30 p.m. Oct. 23, 2015, 7:30 p.m. Silverton Owls Kickoff: Oct. 23, 2015, 7:30 p.m. Oct. 23, 2015, 7:30 p.m. Hedley Owls Kickoff: Oct. 23, 2015, 7:30 p.m. Oct. 23, 2015, 7:30 p.m. White Deer Kickoff: Oct. 23, 2015, 7:30 p.m. Oct. 23, 2015, 7:30 p.m. Petersburg Kickoff: Oct. 23, 2015, 7:30 p.m. Oct. 22, 2015, 7:30 p.m. Follett Panthers Kickoff: Oct. 22, 2015, 7:30 p.m. Oct. 22, 2015, 7:30 p.m. Lefors Kickoff: Oct. 22, 2015, 7:30 p.m. Oct. 23, 2015, 8 p.m. Clovis Wildcats (NM) Kickoff: Oct. 23, 2015, 8 p.m. Oct. 23, 2015, 8 p.m. Ruidoso Warriors Kickoff: Oct. 23, 2015, 8 p.m. Oct. 23, 2015, 8 p.m. Tucumcari Rattlers Kickoff: Oct. 23, 2015, 8 p.m. Oct. 23, 2015, 8 p.m. Texico Wolverines Kickoff: Oct. 23, 2015, 8 p.m. Oct. 23, 2015, 8 p.m. Melrose Kickoff: Oct. 23, 2015, 8 p.m. Oct. 23, 2015, 8 p.m. Mescalero Apache Chiefs Kickoff: Oct. 23, 2015, 8 p.m. Oct. 23, 2015, 7 p.m. Bishop McGuinness Kickoff: Oct. 23, 2015, 7 p.m. Oct. 23, 2015, 7 p.m. Fairview Kickoff: Oct. 23, 2015, 7 p.m. Oct. 23, 2015, 7 p.m. Burns Flat-Dill City Kickoff: Oct. 23, 2015, 7 p.m. Oct. 23, 2015, 7:30 p.m. Boise City Kickoff: Oct. 23, 2015, 7:30 p.m. Oct. 23, 2015, 7:30 p.m. Waukomis Chiefs Kickoff: Oct. 23, 2015, 7:30 p.m. Oct. 23, 2015, 7 p.m. Beaver (OK) High School Pick'em brought to you by Dominos in Amarillo. High School Pick'em brought to you by Dominos in Amarillo. Battle of the Bands brought to you by Interstate Bank. Battle of the Bands brought to you by Interstate Bank. The Wrap-Up, Game of the Week Game of the Week brought to you by Buffalo Wild Wings, 9511 I-40 East & 5416 Coulter in Amarillo. Game of the Week brought to you by Buffalo Wild Wings, 9511 I-40 East & 5416 Coulter in Amarillo.", "external_links": [], "published": "2015-10-22T22:38:00.000+03:00", "crawled": "2015-10-23T00:56:56.305+03:00", "highlightTitle": ""}