{"organizations": ["Athletic Department.NJ Hoops", "NJHoops Hardwood Talk Union County College", "Union County College Names Ling Union County College Names Ling Press Release Talk", "Patrick's High School", "NCAA", "Wheaton College", "Wheaton College's Black Student Association", "St. Anthony's High School", "Junior Varsity", "Resident Director and Community Service Coordinator at Centenary College", "Union County College", "Centenary College", "St. Patrick's High School", "Catholic High School", "St. Anthony", "Hudson Catholic High", "Marist High School", "Multicultural Admissions Committee"], "uuid": "85d934b923ddbaaf10a59a59eb739ed8ff28cf3a", "thread": {"social": {"gplus": {"shares": 0}, "pinterest": {"shares": 0}, "vk": {"shares": 0}, "linkedin": {"shares": 0}, "facebook": {"likes": 0, "shares": 0, "comments": 0}, "stumbledupon": {"shares": 0}}, "site_full": "njhoops.rivals.com", "main_image": "", "site_section": "http://studentsports.rivals.com/rss2feed.asp?type=HS&state=NJ", "section_title": "New Jersey High School Sports Headlines", "url": "https://njhoops.rivals.com/content.asp?CID=1812296", "country": "GB", "title": "Union County College Names Ling", "performance_score": 0, "site": "rivals.com", "participants_count": 0, "title_full": "Union County College Names Ling", "spam_score": 0.0, "site_type": "news", "published": "2015-10-09T23:17:00.000+03:00", "replies_count": 0, "uuid": "85d934b923ddbaaf10a59a59eb739ed8ff28cf3a"}, "author": "", "url": "https://njhoops.rivals.com/content.asp?CID=1812296", "ord_in_thread": 0, "title": "Union County College Names Ling", "locations": ["Hudson County", "Jersey City", "New England"], "entities": {"persons": [], "locations": [], "organizations": []}, "highlightText": "", "language": "english", "persons": ["Damel Ling", "Ling"], "text": "Union County College Names Ling Press Release Talk about it in NJHoops Hardwood Talk Union County College is excited to bring on board Damel Ling to take the helm of the Men's Basketball program for the start of the 2015-16 season. Not only is Coach Ling an accomplished basketball coach on the court, he also establishes an inspiring motivational atmosphere, which translates into success for his players on and off the court.Coach Ling has substantial basketball experience, which includes working as an assistant and head coach at the high school and collegiate levels. He was the assistant coach for the men's basketball team at Centenary College, head coach for the men's basketball team at Hudson Catholic High school, and head coach for the girls' basketball team at Marist High School. Since 2011, Ling has been coaching at Patrick's High School, (formerly St. Patrick's High School) which is one of the top teams in Union County.Coach Ling has been very successful throughout his ongoing coaching career. In 2003-2004, during his coaching tenure at St. Anthony's High School in Jersey City, he helped coach the team to an undefeated State Championship Title which earning them the #2 rank in the country. During his time at St. Anthony's High School, he also coached the Junior Varsity team to an 87-7 record, along with four Christmas Tournament Titles throughout the 2003-2007 seasons.Hudson Catholic High School was named one of the top defensive teams in the country under Coach Ling's control. He coached the team to a 28-1 record, earning the #7 rank in the country. Aiding the development of his players is also key priority for Coach Ling, which has led to seven individuals receiving NCAA Division I scholarships.He earned his Bachelor's degree in Political Science from Wheaton College. As a collegiate player, Ling earned the role as captain of the men's basketball team during his playing career, where he was even selected to New England's All-Rookie team in 1996. Off the court, he was a member of Wheaton College's Black Student Association and also a member of the Multicultural Admissions Committee in 1997-1998.Prior to coaching, Coach Ling spent time working in other areas. Some of these positions include Resident Director and Community Service Coordinator at Centenary College, an accomplished and dedicated Senior Enforcement Officer at Hudson County, and advisor for the Sport Management program at St. Anthony's High School.Coach Ling's extensive work and coaching experience, along with his commitment and determination for his athletes' success on and off the court, make him a significant addition to Union County College's Athletic Department.NJ Hoops provides blanket coverage of NJ basketball all year long for the past 20 years and is proud to continue to be the NJ nominating source for the McDonald's All American game\nTalk NJ Hoops on the Message Board", "external_links": [], "published": "2015-10-09T23:17:00.000+03:00", "crawled": "2015-10-10T00:26:53.069+03:00", "highlightTitle": ""}