{"organizations": ["Herald Media Fullscreen Buy Photo D.C. Everest", "Herald Media Fullscreen", "Herald Media Fullscreen Buy Photo Wausau West", "Wisconsin Valley Conference", "Herald Media Fullscreen Buy Photo Stevens Point Area Senior High School", "Nine Mile Recreation Area", "Herald Media"], "uuid": "28e01717a5b6b0e431a1bf329f18b4eea13a383f", "thread": {"social": {"gplus": {"shares": 0}, "pinterest": {"shares": 0}, "vk": {"shares": 0}, "linkedin": {"shares": 0}, "facebook": {"likes": 0, "shares": 0, "comments": 0}, "stumbledupon": {"shares": 0}}, "site_full": "www.wausaudailyherald.com", "main_image": "http://www.gannett-cdn.com/-mm-/070e4eb20d8daf7e29285cc7b72bd89515b1465e/c=0-124-3320-2000&amp;r=x1683&amp;c=3200x1680/local/-/media/2015/10/17/WIGroup/Wausau/635806900179311748-WDH-WVC-CC-Meet-01.JPG", "site_section": "http://rssfeeds.wausaudailyherald.com/wausau/sports", "section_title": "Wausau - Sports", "url": "http://www.wausaudailyherald.com/picture-gallery/sports/high-school/track/2015/10/17/wisconsin-valley-conference-cross-country-meet-saturday-oct-17/74128560/", "country": "US", "title": "Wisconsin Valley Conference cross country meet, Saturday, Oct. 17", "performance_score": 0, "site": "wausaudailyherald.com", "participants_count": 0, "title_full": "Wisconsin Valley Conference cross country meet, Saturday, Oct. 17", "spam_score": 0.0, "site_type": "news", "published": "2015-10-17T21:50:00.000+03:00", "replies_count": 0, "uuid": "28e01717a5b6b0e431a1bf329f18b4eea13a383f"}, "author": "", "url": "http://www.wausaudailyherald.com/picture-gallery/sports/high-school/track/2015/10/17/wisconsin-valley-conference-cross-country-meet-saturday-oct-17/74128560/", "ord_in_thread": 0, "title": "Wisconsin Valley Conference cross country meet, Saturday, Oct. 17", "locations": ["Wausau", "Wisconsin Valley", "Wausau East", "Marshfield", "Wisconsin Valley Conference"], "entities": {"persons": [], "locations": [], "organizations": []}, "highlightText": "", "language": "english", "persons": ["Wausau West", "Megan", "Clara Merkel", "Brooke Jaworski", "Courtney Milkowski", "Anthony Anderson", "Megan McCormick/Daily"], "text": "Wisconsin Valley Conference cross country meet, Saturday, Oct. 17 Buy Photo Wausau West's Brooke Jaworski nears the finish line to win the Wisconsin Valley Conference cross country meet at Nine Mile Recreation Area in Wausau, Saturday, Oct. 17, 2015. Megan McCormick/Daily Herald Media Fullscreen Buy Photo Wausau West's Brooke Jaworski nears the finish line to win the Wisconsin Valley Conference cross country meet at Nine Mile Recreation Area in Wausau, Saturday, Oct. 17, 2015. Megan McCormick/Daily Herald Media Fullscreen Buy Photo Wausau West's Emmy Sheehan nears the finish line to take third place during the Wisconsin Valley Conference cross country meet at Nine Mile Recreation Area in Wausau, Saturday, Oct. 17, 2015. Megan McCormick/Daily Herald Media Fullscreen Buy Photo Wausau East's Clara Merkel nears the finish line during the Wisconsin Valley Conference cross country meet at Nine Mile Recreation Area in Wausau, Saturday, Oct. 17, 2015. Megan McCormick/Daily Herald Media Fullscreen Buy Photo Stevens Point Area Senior High School's Courtney Milkowski nears the finish line to take fourth place in the Wisconsin Valley Conference cross country meet at Nine Mile Recreation Area in Wausau, Saturday, Oct. 17, 2015. Megan McCormick/Daily Herald Media Fullscreen Buy Photo The Stevens Point Area Senior High School girls cross country team runs together during the Wisconsin Valley Conference cross country meet at Nine Mile Recreation Area in Wausau, Saturday, Oct. 17, 2015. Megan McCormick/Daily Herald Media Fullscreen Buy Photo D.C. Everest's Anthony Anderson nears the finish line to win the Wisconsin Valley Conference cross country meet at Nine Mile Recreation Area in Wausau, Saturday, Oct. 17, 2015. Megan McCormick/Daily Herald Media Fullscreen Buy Photo D.C. Everest's Anthony Anderson nears the finish line to win the Wisconsin Valley Conference cross country meet at Nine Mile Recreation Area in Wausau, Saturday, Oct. 17, 2015. Megan McCormick/Daily Herald Media Fullscreen Buy Photo Wausau West's Brooke Jaworski takes the lead during the Wisconsin Valley Conference cross country meet at Nine Mile Recreation Area in Wausau, Saturday, Oct. 17, 2015. Megan McCormick/Daily Herald Media Fullscreen Buy Photo The girls JV race during the Wisconsin Valley Conference cross country meet at Nine Mile Recreation Area in Wausau, Saturday, Oct. 17, 2015. Megan McCormick/Daily Herald Media Fullscreen Buy Photo The boys JV race during the Wisconsin Valley Conference cross country meet at Nine Mile Recreation Area in Wausau, Saturday, Oct. 17, 2015. Megan McCormick/Daily Herald Media Fullscreen Buy Photo Marshfield cross country runners cheer on their teammates during the boys JV race at the Wisconsin Valley Conference cross country meet at Nine Mile Recreation Area in Wausau, Saturday, Oct. 17, 2015. Megan McCormick/Daily Herald Media Fullscreen Buy Photo The girls varsity race during the Wisconsin Valley Conference cross country meet at Nine Mile Recreation Area in Wausau, Saturday, Oct. 17, 2015. Megan McCormick/Daily Herald Media Fullscreen Buy Photo The girls varsity race during the Wisconsin Valley Conference cross country meet at Nine Mile Recreation Area in Wausau, Saturday, Oct. 17, 2015. Megan McCormick/Daily Herald Media Fullscreen Buy Photo The girls varsity race during the Wisconsin Valley Conference cross country meet at Nine Mile Recreation Area in Wausau, Saturday, Oct. 17, 2015. Megan McCormick/Daily Herald Media Fullscreen Buy Photo The girls varsity race during the Wisconsin Valley Conference cross country meet at Nine Mile Recreation Area in Wausau, Saturday, Oct. 17, 2015. Megan McCormick/Daily Herald Media Fullscreen Buy Photo The girls varsity race during the Wisconsin Valley Conference cross country meet at Nine Mile Recreation Area in Wausau, Saturday, Oct. 17, 2015. Megan McCormick/Daily Herald Media Fullscreen Buy Photo The girls varsity race during the Wisconsin Valley Conference cross country meet at Nine Mile Recreation Area in Wausau, Saturday, Oct. 17, 2015. Megan McCormick/Daily Herald Media Fullscreen Buy Photo The girls varsity race during the Wisconsin Valley Conference cross country meet at Nine Mile Recreation Area in Wausau, Saturday, Oct. 17, 2015. Megan McCormick/Daily Herald Media Fullscreen Buy Photo The girls varsity race during the Wisconsin Valley Conference cross country meet at Nine Mile Recreation Area in Wausau, Saturday, Oct. 17, 2015. Megan McCormick/Daily Herald Media Fullscreen Buy Photo The girls varsity race during the Wisconsin Valley Conference cross country meet at Nine Mile Recreation Area in Wausau, Saturday, Oct. 17, 2015. Megan McCormick/Daily Herald Media Fullscreen Buy Photo The girls varsity race during the Wisconsin Valley Conference cross country meet at Nine Mile Recreation Area in Wausau, Saturday, Oct. 17, 2015. Megan McCormick/Daily Herald Media Fullscreen Buy Photo The girls varsity race during the Wisconsin Valley Conference cross country meet at Nine Mile Recreation Area in Wausau, Saturday, Oct. 17, 2015. Megan McCormick/Daily Herald Media Fullscreen Buy Photo The boys varsity race during the Wisconsin Valley Conference cross country meet at Nine Mile Recreation Area in Wausau, Saturday, Oct. 17, 2015. Megan McCormick/Daily Herald Media Fullscreen Buy Photo The boys varsity race during the Wisconsin Valley Conference cross country meet at Nine Mile Recreation Area in Wausau, Saturday, Oct. 17, 2015. Megan McCormick/Daily Herald Media Fullscreen Buy Photo The boys varsity race during the Wisconsin Valley Conference cross country meet at Nine Mile Recreation Area in Wausau, Saturday, Oct. 17, 2015. Megan McCormick/Daily Herald Media Fullscreen Buy Photo The boys varsity race during the Wisconsin Valley Conference cross country meet at Nine Mile Recreation Area in Wausau, Saturday, Oct. 17, 2015. Megan McCormick/Daily Herald Media Fullscreen Buy Photo The boys varsity race during the Wisconsin Valley Conference cross country meet at Nine Mile Recreation Area in Wausau, Saturday, Oct. 17, 2015. Megan McCormick/Daily Herald Media Fullscreen Buy Photo The boys varsity race during the Wisconsin Valley Conference cross country meet at Nine Mile Recreation Area in Wausau, Saturday, Oct. 17, 2015. Megan McCormick/Daily Herald Media Fullscreen Buy Photo The boys varsity race during the Wisconsin Valley Conference cross country meet at Nine Mile Recreation Area in Wausau, Saturday, Oct. 17, 2015. Megan McCormick/Daily Herald Media Fullscreen Buy Photo The boys varsity race during the Wisconsin Valley Conference cross country meet at Nine Mile Recreation Area in Wausau, Saturday, Oct. 17, 2015. Megan McCormick/Daily Herald Media Fullscreen Buy Photo The boys varsity race during the Wisconsin Valley Conference cross country meet at Nine Mile Recreation Area in Wausau, Saturday, Oct. 17, 2015. Megan McCormick/Daily Herald Media Fullscreen Buy Photo The boys varsity race during the Wisconsin Valley Conference cross country meet at Nine Mile Recreation Area in Wausau, Saturday, Oct. 17, 2015. Megan McCormick/Daily Herald Media Fullscreen Buy Photo The boys varsity race during the Wisconsin Valley Conference cross country meet at Nine Mile Recreation Area in Wausau, Saturday, Oct. 17, 2015. Megan McCormick/Daily Herald Media", "external_links": [], "published": "2015-10-17T21:50:00.000+03:00", "crawled": "2015-10-17T22:13:05.059+03:00", "highlightTitle": ""}