{"organizations": ["White Sox", "Illinois", "NFL", "Uni Girona", "Tigers", "Cubs", "Chicago White Sox", "The Associated Press", "NL", "Brewers", "Detroit Tigers", "Pirates", "Chicago Cubs", "Milwaukee Brewers"], "uuid": "cbac0614c587b5ea1f2d1f81dd59886f8e3b6b5b", "thread": {"social": {"gplus": {"shares": 0}, "pinterest": {"shares": 0}, "vk": {"shares": 0}, "linkedin": {"shares": 0}, "facebook": {"likes": 0, "shares": 0, "comments": 0}, "stumbledupon": {"shares": 0}}, "site_full": "www.wgem.com", "main_image": "http://WGEM.images.worldnow.com/images/8944694_G.jpg", "site_section": "http://www.wgem.com/category/123718/sports?&clienttype=rss", "section_title": "WGEM - SPORTS", "url": "http://www.wgem.com/story/30183619/2015/10/04/sundays-area-scores-october-4", "country": "US", "title": "Sunday's Area Scores-October 4", "performance_score": 0, "site": "wgem.com", "participants_count": 0, "title_full": "Sunday's Area Scores-October 4", "spam_score": 0.0, "site_type": "news", "published": "2015-10-05T06:58:00.000+03:00", "replies_count": 0, "uuid": "cbac0614c587b5ea1f2d1f81dd59886f8e3b6b5b"}, "author": "", "url": "http://www.wgem.com/story/30183619/2015/10/04/sundays-area-scores-october-4", "ord_in_thread": 0, "title": "Sunday's Area Scores-October 4", "locations": ["US", "U.S.", "Spain", "Chicago", "Pittsburgh"], "entities": {"persons": [], "locations": [], "organizations": []}, "highlightText": "", "language": "english", "persons": ["Tyler Collins", "Cutler", "Kyle Hendricks", "Daniel Norris", "Candace Parker", "Taylor"], "text": "Sunday's Area Scores-October 4 - WGEM.com: Quincy News, Weather, Sports, and Radio Member Center: Latest Illinois sports Daniel Norris pitched one-hit ball for five innings and Tyler Collins had a bases-clearing triple as the Detroit Tigers finished their first-to-worst tumble in the AL Central with a 6-0 win over the Chicago White... More >> Daniel Norris pitched one-hit ball for five innings and Tyler Collins had a bases-clearing triple as the Detroit Tigers finished their first-to-worst tumble in the AL Central with a 6-0 win over the Chicago White Sox on... More >> Sports Minute: Here is the latest Illinois sports news from The Associated Press Kyle Hendricks allowed one hit and struck out eight in six innings, and the Chicago Cubs kept alive their hopes to host to the NL wild card game with a 1-0 victory over the Milwaukee Brewers Saturday night. Chicago won its... More >> Parker has triple-double, US women win in Spain Candace Parker had a triple-double with 14 points, 12 assists and 10 rebounds to help the U.S. women's team open its European tour with a 94-52 victory over Uni Girona on Sunday night. More >> Candace Parker had a triple-double with 14 points, 12 assists and 10 rebounds to help the U.S. women's team open its European tour with a 94-52 victory over Uni Girona on Sunday night. More >> The Latest: Taylor shows few jitters; Cutler to start By The Associated Press The latest from NFL games around the league on the fourth Sunday of the season (all times EDT): More >> By The Associated Press The latest from NFL games around the league on the fourth Sunday of the season (all times EDT): More >> Norris leads Tigers to 6-0 win over White Sox Daniel Norris pitched one-hit ball for five innings and Tyler Collins had a bases-clearing triple as the Detroit Tigers finished their first-to-worst tumble in the AL Central with a 6-0 win over the Chicago White... More >> Daniel Norris pitched one-hit ball for five innings and Tyler Collins had a bases-clearing triple as the Detroit Tigers finished their first-to-worst tumble in the AL Central with a 6-0 win over the Chicago White Sox on... More >> Cubs beat Brewers 3-1, await fate on hosting NL wild card The Chicago Cubs beat the Milwaukee Brewers 3-1 on Sunday for their eighth straight win, but still needed Pittsburgh to lose in order to host the Pirates in the NL wild-card game. More >> The Chicago Cubs beat the Milwaukee Brewers 3-1 on Sunday for their eighth straight win, but still needed Pittsburgh to lose in order to host the Pirates in the NL wild-card game. More >>", "external_links": [], "published": "2015-10-05T06:58:00.000+03:00", "crawled": "2015-10-05T12:00:32.983+03:00", "highlightTitle": ""}