{"organizations": ["National Hockey League", "National Hockey League Standings National Hockey League", "NHL", "Toronto... New Zealand Herald", "Reuters", "Startup Connection", "St. Louis", "Pittsburgh Penguins", "Chicago Blackhawks", "Toronto", "Scotiabank Saddledome", "New York Islanders", "Y. Islanders", "Christian Post", "Arizona", "Anaheim", "Anaheim 0New Jersey", "New Jersey", "Ottawa", "Dallas Stars", "Calgary Flames", "Columbus Blue Jackets", "N.Y. Rangers", "Buffalo"], "uuid": "fe0cea8a6201808491a58c36bbd4c962fdc9c3cf", "thread": {"social": {"gplus": {"shares": 0}, "pinterest": {"shares": 0}, "vk": {"shares": 0}, "linkedin": {"shares": 0}, "facebook": {"likes": 0, "shares": 0, "comments": 0}, "stumbledupon": {"shares": 0}}, "site_full": "www.onenewspage.com", "main_image": "http://cdn.newsserve.net/ONPglobe256.jpg", "site_section": "http://www.onenewspage.com/rss/latest/Sports.rss", "section_title": "Latest Sports News on One News Page", "url": "http://www.onenewspage.com/n/Sports/7559y4yvh/National-Hockey-League-Standings.htm", "country": "US", "title": "National Hockey League Standings", "performance_score": 0, "site": "onenewspage.com", "participants_count": 0, "title_full": "National Hockey League Standings", "spam_score": 0.0, "site_type": "news", "published": "2015-10-26T07:37:00.000+02:00", "replies_count": 0, "uuid": "fe0cea8a6201808491a58c36bbd4c962fdc9c3cf"}, "author": "", "url": "http://www.onenewspage.com/n/Sports/7559y4yvh/National-Hockey-League-Standings.htm", "ord_in_thread": 0, "title": "National Hockey League Standings", "locations": ["Washington", "TORONTO", "NEW YORK", "St. Louis"], "entities": {"persons": [], "locations": [], "organizations": []}, "highlightText": "", "language": "english", "persons": ["Patrick O'Sullivan", "Nick Bonino", "Duncan Keith", "Jason Demers", "Todd Richards"], "text": "National Hockey League Standings Monday, 26 October 2015 (3 minutes ago) NOTE: Two points for a win, one point for overtime loss.Philadelphia 3, N.Y. Rangers 2, SOMinnesota 3, Anaheim 0 New Jersey 4, Buffalo 3Montreal 5, Toronto 3 Arizona 4, Ottawa 1N.Y. Islanders 3, St. Louis 2, OTPittsburgh... NOTE: Two points for a win, one point for overtime loss.Philadelphia 3, N.Y. Rangers 2, SOMinnesota 3, Anaheim 0New Jersey 4, Buffalo 3Montreal 5, Toronto... New Zealand Herald 1 day ago - Sports NEW YORK – Dallas Stars defenseman Jason Demers has been suspended for two games, without pay, for elbowing Pittsburgh Penguins forward Nick Bonino during NHL... NHL 2 days ago - Sports Officials with Startup Connection, the annual St. Louis event that highlights the progress made in the innovation community, have announced which startup... bizjournals 4 days ago - Business (Reuters) - The winless Columbus Blue Jackets fired head coach Todd Richards after a dismal start to the National Hockey League season and replaced him with... Reuters 5 days ago - Sports Also reported by • bizjournals Trying to turn their season around, the Calgary Flames host the Washington Capitals at Scotiabank Saddledome in the regular season of the National Hockey League. Christian Post 5 days ago - Religion Also reported by • Business Wire (Reuters) - Three-times Stanley Cup-winning Chicago Blackhawks defenseman Duncan Keith is expected to be sidelined between four and six weeks after having knee... Reuters 5 days ago - Sports The Columbus Blue Jackets face the New York Islanders tonight with some dubious records in play should they extend their season-opening six-game losing streak.... bizjournals 6 days ago - Business *By The Canadian Press* TORONTO — Patrick O'Sullivan has a strong aversion to baked beans. The smell of freshly-cut grass can send him into an emotional... CJME 6 days ago - World You Might Like Other recent news in Sports", "external_links": [], "published": "2015-10-26T07:37:00.000+02:00", "crawled": "2015-10-26T07:39:54.809+02:00", "highlightTitle": ""}