{"organizations": ["Associated Press", "Florida Gators", "LSU Tigers", "American Athletic Conference", "Facebook Email Twitter Google", "AP", "Facebook LSU", "Temple"], "uuid": "1aedc2b191e127f72364b313496c35a05b5f3805", "thread": {"social": {"gplus": {"shares": 0}, "pinterest": {"shares": 0}, "vk": {"shares": 0}, "linkedin": {"shares": 0}, "facebook": {"likes": 0, "shares": 0, "comments": 0}, "stumbledupon": {"shares": 0}}, "site_full": "www.wwltv.com", "main_image": "http://cdn.tegna-tv.com/-mm-/956298c7264656e24fe1da76a1f3ea5c9fd23dfd/c=0-249-4910-3023&amp;r=x1683&amp;c=3200x1680/local/-/media/2015/10/18/WWL/WWL/635807762586966948-USATSI-8867858.jpg", "site_section": "http://rssfeeds.wwltv.com/_/20/110020328/wwl/sports", "section_title": "WWL - Sports", "url": "http://www.wwltv.com/story/sports/ncaa/lsu/2015/10/18/lsu-up-no-5-ap-poll/74179508/", "country": "US", "title": "LSU up to No. 5 in AP poll", "performance_score": 0, "site": "wwltv.com", "participants_count": 0, "title_full": "LSU up to No. 5 in AP poll", "spam_score": 0.0, "site_type": "news", "published": "2015-10-18T21:45:00.000+03:00", "replies_count": 0, "uuid": "1aedc2b191e127f72364b313496c35a05b5f3805"}, "author": "", "url": "http://www.wwltv.com/story/sports/ncaa/lsu/2015/10/18/lsu-up-no-5-ap-poll/74179508/", "ord_in_thread": 0, "title": "LSU up to No. 5 in AP poll", "locations": ["LA", "USA", "Houston", "Florida", "Baton Rouge", "Memphis"], "entities": {"persons": [], "locations": [], "organizations": []}, "highlightText": "", "language": "english", "persons": ["Derick E. Hingle", "Derick E. Hingle-USA", "Deion Jones", "Kevin Toliver"], "text": "Facebook Email Twitter Google+ LinkedIn Pinterest LSU up to No. 5 in AP poll Memphis and Temple jumped into The Associated Press college football poll for the first time this season, joining Houston to give the American Athletic Conference three ranked teams for the first time in the history of the three-year old league. Post to Facebook LSU up to No. 5 in AP poll Memphis and Temple jumped into The Associated Press college football poll for the first time this season, joining Houston to give the American Athletic Conference three ranked teams for the first time in the history of the three-year old league.   WWLTV.com: http://on.wwltv.com/1LDSDXL   LSU up to No. 5 in AP poll Associated Press 1:45 p.m. CDT October 18, 2015 Oct 17, 2015; Baton Rouge, LA, USA; LSU Tigers linebacker Deion Jones (45) and cornerback Kevin Toliver II (2) celebrate after a defensive stop against the Florida Gators during the fourth quarter of a game at Tiger Stadium. LSU defeated Florida 35-28. Mandatory Credit: Derick E. Hingle-USA TODAY Sports (Photo: Derick E. Hingle, Derick E. Hingle-USA TODAY Sports) CONNECT 5 TWEET LINKEDIN COMMENT EMAIL MORE \nMemphis and Temple jumped into The Associated Press college football poll for the first time this season, joining Houston to give the American Athletic Conference three ranked teams for the first time in the history of the three-year old league. Ohio State remained No. 1 in the AP Top 25 released Sunday. For the second straight week, six teams received first-place votes in the media poll, led by the Buckeyes with 28. No. 2 Baylor has 12, No. 3 Utah received 16, No. 4 TCU got three and No. 5 LSU and No. 6 Clemson each have one. The Utes and LSU Tigers each edged ahead one spot after home victories on Saturday. Michigan State stayed at No. 7 after its miracle against Michigan and Alabama is No. 8 after handing Texas A&M its first loss. Memphis (6-0) had the big upset of the weekend against Mississippi. The Tigers 37-24 victory vaulted them into the rankings at No 18. Unbeaten Temple moved to 6-0 and was ranked No. 22. No. 21 Houston is also 6-0. \nThe full poll is listed below: \n1. Ohio State", "external_links": [], "published": "2015-10-18T21:45:00.000+03:00", "crawled": "2015-10-18T22:54:55.585+03:00", "highlightTitle": ""}