{"organizations": ["Wizards", "Nerlens Noel", "Associated Press", "Wells Fargo Center", "PA", "Facebook Oubre", "Washington Wizards"], "uuid": "c1ae56a07c55588f2cf9f0c2e63bea5852b37ecf", "thread": {"social": {"gplus": {"shares": 0}, "pinterest": {"shares": 0}, "vk": {"shares": 0}, "linkedin": {"shares": 0}, "facebook": {"likes": 0, "shares": 0, "comments": 0}, "stumbledupon": {"shares": 0}}, "site_full": "www.wusa9.com", "main_image": "http://cdn.tegna-tv.com/-mm-/96cd0c2ec9532bfdb1be7a2472f5b4bd43a5bcc9/c=0-46-2369-1384&amp;r=x633&amp;c=1200x630/local/-/media/2015/10/17/WUSA/WUSA/635806377918066936-USATSI-8864266.jpg", "site_section": "http://rssfeeds.wusa9.com/_/20/108839304/WUSA-sports", "section_title": "WUSA - Sports", "url": "http://www.wusa9.com/story/sports/2015/10/17/wizards-76ers-nba/74108694/", "country": "US", "title": "Oubre, Gortat score 16 each to lead Wizards past 76ers", "performance_score": 0, "site": "wusa9.com", "participants_count": 0, "title_full": "Oubre, Gortat score 16 each to lead Wizards past 76ers", "spam_score": 0.0, "site_type": "news", "published": "2015-10-17T07:17:00.000+03:00", "replies_count": 0, "uuid": "c1ae56a07c55588f2cf9f0c2e63bea5852b37ecf"}, "author": "", "url": "http://www.wusa9.com/story/sports/2015/10/17/wizards-76ers-nba/74108694/", "ord_in_thread": 0, "title": "Oubre, Gortat score 16 each to lead Wizards past 76ers", "locations": ["USA", "Philadelphia"], "entities": {"persons": [], "locations": [], "organizations": []}, "highlightText": "", "language": "english", "persons": ["Bill Streicher-USA", "Gortat", "Kelly Oubre Jr.", "Oubre", "Bill Streicher"], "text": "Oubre, Gortat score 16 each to lead Wizards past 76ers The Washington Wizards cruised to a 127-118 preseason victory over the Philadelphia 76ers on Friday night. Post to Facebook Oubre, Gortat score 16 each to lead Wizards past 76ers The Washington Wizards cruised to a 127-118 preseason victory over the Philadelphia 76ers on Friday night.  //on.wusa9.com/1RNEhVM   Join the Conversation To   Oubre, Gortat score 16 each to lead Wizards past 76ers Associated Press, AP 12:17 a.m. EDT October 17, 2015 Oct 16, 2015; Philadelphia, PA, USA; Washington Wizards forward Kelly Oubre Jr. (12) dribble the ball past Philadelphia 76ers center Nerlens Noel (4) during the second quarter at Wells Fargo Center. Mandatory Credit: Bill Streicher-USA TODAY Sports (Photo: Bill Streicher, Bill Streicher-USA TODAY Sports) CONNECT TWEET LINKEDIN COMMENT EMAIL MORE \nPHILADELPHIA (AP) - Kelly Oubre Jr. and Marcin Gortat scored 16 points each and John Wall had 14 assists as the Washington Wizards cruised to a 127-118 preseason victory over the Philadelphia 76ers on Friday night. \nDeJuan Blair had 15 points, and Otto Porter and Brandon Beal added 13 each for the Wizards. \nScottie Wilbekin scored 21 points for the 76ers, who cut a 28-point deficit to five in the fourth quarter, but could get no closer. \nThe Wizards made their first eight shots and finished the first quarter shooting 84 percent. Washington led 69-45 at halftime and 99-71 after three quarters. \nCopyright 2015 The Associated Press. All rights reserved. This material may not be published, broadcast, rewritten or redistributed. Read or Share this story: http://on.wusa9.com/1RNEhVM TOP VIDEOS", "external_links": [], "published": "2015-10-17T07:17:00.000+03:00", "crawled": "2015-10-17T07:47:53.269+03:00", "highlightTitle": ""}