{"organizations": ["Arizona State Sun Devils", "Colorado Buffaloes", "Facebook ASU", "Arizona State", "ASU"], "uuid": "7eb6c5499dad907ec081c431baaad8b2fb30b18c", "thread": {"social": {"gplus": {"shares": 0}, "pinterest": {"shares": 0}, "vk": {"shares": 0}, "linkedin": {"shares": 0}, "facebook": {"likes": 0, "shares": 0, "comments": 0}, "stumbledupon": {"shares": 0}}, "site_full": "www.12news.com", "main_image": "http://www.gannett-cdn.com/-mm-/dd91cab7c966d9afac8d2c3217d66bedd36b3dc9/r=x1683&amp;c=3200x1680/http/cdn.tegna-tv.com/-mm-/d4c91615964a68a4eec9c94f0f7910878d46d47d/c=0-194-3813-2348/local/-/media/2015/10/11/KPNX/KPNX/635801233195872462-USATSI-8853255.jpg", "site_section": "http://rssfeeds.12news.com/kpnx/sports", "section_title": "KPNX - Sports", "url": "http://www.12news.com/story/sports/college/asu/2015/10/11/asu-dominates-colorado-storylines-and-takeaways/73768756/", "country": "US", "title": "ASU dominates Colorado: Storylines and takeaways", "performance_score": 0, "site": "12news.com", "participants_count": 0, "title_full": "ASU dominates Colorado: Storylines and takeaways", "spam_score": 0.0, "site_type": "news", "published": "2015-10-11T08:38:00.000+03:00", "replies_count": 0, "uuid": "7eb6c5499dad907ec081c431baaad8b2fb30b18c"}, "author": "", "url": "http://www.12news.com/story/sports/college/asu/2015/10/11/asu-dominates-colorado-storylines-and-takeaways/73768756/", "ord_in_thread": 0, "title": "ASU dominates Colorado: Storylines and takeaways", "locations": ["USA", "Tempe", "AZ", "Colorado"], "entities": {"persons": [], "locations": [], "organizations": []}, "highlightText": "", "language": "english", "persons": ["Robby Baker", "Kody Kohl"], "text": "ASU dominates Colorado: Storylines and takeaways Arizona State continued to build momentum with their win over Colorado on Saturday. Post to Facebook ASU dominates Colorado: Storylines and takeaways Arizona State continued to build momentum with their win over Colorado on Saturday.   12news.com: http://12ne.ws/1RADRBU   Join the Conversation To   ASU dominates Colorado: Storylines and takeaways Robby Baker , 12 Sports 10:38 p.m. MST October 10, 2015 Arizona State continued to build momentum with their win over Colorado on Saturday. Oct 10, 2015; Tempe, AZ, USA; Arizona State Sun Devils tight end Kody Kohl (83) scores a touchdown after a fumble recovery against the Colorado Buffaloes during the first half at Sun Devil Stadium. Mandatory Credit: Joe Camporeale-USA TODAY Sports (Photo: Joe Camporeale-USA TODAY Sports) \nThe ASU Sun Devils beat the Colorado Buffalos 48-23 on Saturday. \nTakin' care of business \nThis is what ASU fans expected to see weeks two and three when the Sun Devils took on Cal Poly and New Mexico. \nArizona State took care of business. \nThe Sun Devils were clicking on all cylinders Saturday, and avoided falling in a 'trap game'. It would have been very easy for Todd Graham and company to get too high on themselves following their win over UCLA, but they didn't. \nIt would have also been easy for ASU to be looking ahead to their impending matchup with the upstart Utah Utes. Oct 10, 2015; Tempe, AZ, USA; A pylon and footballs sit on the field prior to the game between the Arizona State Sun Devils and the Colorado Buffaloes at Sun Devil Stadium. Mandatory Credit: Joe Camporeale-USA TODAY Sports Joe Camporeale-USA TODAY Sports Oct 10, 2015; Tempe, AZ, USA; Houston Texans and former Arizona State Sun Devils wide receiver Jaelen Strong attends the game against the Colorado Buffaloes at Sun Devil Stadium. Mandatory Credit: Joe Camporeale-USA TODAY Sports Joe Camporeale-USA TODAY Sports Oct 10, 2015; Tempe, AZ, USA; Colorado Buffaloes quarterback Sefo Liufau (13) takes a snap against the Arizona State Sun Devils during the first half at Sun Devil Stadium. Mandatory Credit: Joe Camporeale-USA TODAY Sports Joe Camporeale-USA TODAY Sports Oct 10, 2015; Tempe, AZ, USA; Arizona State Sun Devils tight end Kody Kohl (83) scores a touchdown after a fumble recovery against the Colorado Buffaloes during the first half at Sun Devil Stadium. Mandatory Credit: Joe Camporeale-USA TODAY Sports Joe Camporeale-USA TODAY Sports Fullscreen Oct 10, 2015; Tempe, AZ, USA; Colorado Buffaloes tight end Dylan Keeney (86) is unable to make a catch while being covered by Arizona State Sun Devils defensive back Kareem Orr (25) during the first half at Sun Devil Stadium. Mandatory Credit: Joe Camporeale-USA TODAY Sports Joe Camporeale-USA TODAY Sports Oct 10, 2015; Tempe, AZ, USA; Arizona State Sun Devils head coach Todd Graham looks on against the Colorado Buffaloes during the first half at Sun Devil Stadium. Mandatory Credit: Joe Camporeale-USA TODAY Sports Joe Camporeale-USA TODAY Sports Oct 10, 2015; Tempe, AZ, USA; Arizona State Sun Devils wide receiver Tim White (12) reacts after a touchdown catch against the Colorado Buffaloes during the first half at Sun Devil Stadium. Mandatory Credit: Joe Camporeale-USA TODAY Sports Joe Camporeale-USA TODAY Sports Fullscreen Oct 10, 2015; Tempe, AZ, USA; Arizona State Sun Devils wide receiver Devin Lucien (15) and Colorado Buffaloes defensive back Ken Crawley (2) go up for a ball during the first half at Sun Devil Stadium. Mandatory Credit: Joe Camporeale-USA TODAY Sports Joe Camporeale-USA TODAY Sports Oct 10, 2015; Tempe, AZ, USA; Arizona State Sun Devils linebacker Salamo Fiso (58) tackles Colorado Buffaloes running back Patrick Carr (1) during the first half at Sun Devil Stadium. Mandatory Credit: Joe Camporeale-USA TODAY Sports Joe Camporeale-USA TODAY Sports Oct 10, 2015; Tempe, AZ, USA; Colorado Buffaloes defensive back Ahkello Witherspoon intercepts a pass intended for Arizona State Sun Devils wide receiver Devin Lucien (15) during the first half at Sun Devil Stadium. Mandatory Credit: Joe Camporeale-USA TODAY Sports Joe Camporeale-USA TODAY Sports Oct 10, 2015; Tempe, AZ, USA; Arizona State Sun Devils quarterback Mike Bercovici (2) runs with the ball against the Colorado Buffaloes during the first half at Sun Devil Stadium. Mandatory Credit: Joe Camporeale-USA TODAY Sports Joe Camporeale-USA TODAY Sports Like this topic? You may also like these photo galleries: Replay", "external_links": [], "published": "2015-10-11T08:38:00.000+03:00", "crawled": "2015-10-11T12:36:55.089+03:00", "highlightTitle": ""}