{"organizations": ["A.C. Reynolds High School", "Facebook Email Twitter Google", "Facebook Rams", "Rockets", "A.C. Reynolds"], "uuid": "c1f3bf1ca70d492dde43020bd5a9e580e61c1d76", "thread": {"social": {"gplus": {"shares": 0}, "pinterest": {"shares": 0}, "vk": {"shares": 0}, "linkedin": {"shares": 0}, "facebook": {"likes": 0, "shares": 0, "comments": 0}, "stumbledupon": {"shares": 0}}, "site_full": "www.citizen-times.com", "main_image": "http://www.gannett-cdn.com/-mm-/c170b43fac99dce87cdd8384c05f5e7a8ac88aba/c=0-40-800-492&amp;r=x633&amp;c=1600x630/local/-/media/2015/09/30/CarolinaGroup/Asheville/635792470597826787-GetImageContent-1-.jpg", "site_section": "http://rssfeeds.citizen-times.com/asheville/sports", "section_title": "Asheville - Sports", "url": "http://www.citizen-times.com/story/hshuddle/2015/10/01/fridays-wnc-football-capsules/73143480/", "country": "US", "title": "Rams give retiring Wilcher 1,000th career win", "performance_score": 0, "site": "citizen-times.com", "participants_count": 0, "title_full": "Rams give retiring Wilcher 1,000th career win", "spam_score": 0.0, "site_type": "news", "published": "2015-10-01T20:14:00.000+03:00", "replies_count": 0, "uuid": "c1f3bf1ca70d492dde43020bd5a9e580e61c1d76"}, "author": "", "url": "http://www.citizen-times.com/story/hshuddle/2015/10/01/fridays-wnc-football-capsules/73143480/", "ord_in_thread": 0, "title": "Rams give retiring Wilcher 1,000th career win", "locations": [], "entities": {"persons": [], "locations": [], "organizations": []}, "highlightText": "", "language": "english", "persons": ["Izaiah Vignali", "Wilcher", "Andrew Pearson", "Bradley Jennings", "Urijah Morrisson", "Matthew Kennedy", "Evan Goosmann", "Dexter Vandersall", "Parker Johnson", "A.C. Reynolds", "Roberson", "Brian Kennedy", "Angeli", "A. C. Reynolds", "Brendan Mann", "Daniel Vickers", "T.C. Roberson", "Holden Upright", "Christian Chavez", "Jack Sanstedt"], "text": "Facebook Email Twitter Google+ LinkedIn Pinterest Rams give retiring Wilcher 1,000th career win REYNOLDS — Roberson soccer players were soaking wet but in good spirits Wednesday night when they unfurled a congratulatory banner. Post to Facebook Rams give retiring Wilcher 1,000th career win REYNOLDS — Roberson soccer players were soaking wet but in good spirits Wednesday night when they unfurled a congratulatory banner. Check out this story on citizen-times.com: http://avlne.ws/1FHF8pw Cancel Send A link has been sent to your friend's email address. Posted! A link has been posted to your Facebook feed. Join the Conversation To find out more about Facebook commenting please read the Conversation Guidelines and FAQs Rams give retiring Wilcher 1,000th career win Andrew Pearson , apearson@citizen-times.com 1:14 p.m. EDT October 1, 2015 Buy Photo A.C. Reynolds' Brendan Mann, leaps onto his teammate, Izaiah Vignali after the Rockets scored a goal against T.C. Roberson during their game at A.C. Reynolds High School on Wednesday, Sept. 30, 2015. Angeli Wright/awright@citizen-times.com Fullscreen Buy Photo T.C. Roberson's Bradley Jennings goes up against A.C. Reynolds' Matthew Kennedy during their game at A.C. Reynolds on Wednesday. Angeli Wright/awright@citizen-times.com Fullscreen Buy Photo T.C. Roberson goalkeeper Evan Goosmann grabs a ball between his teammate Holden Upright, left, and A. C. Reynolds' Daniel Vickers during their game at A.C. Reynolds High School on Wednesday. Angeli Wright/awright@citizen-times.com Fullscreen Buy Photo T.C. Roberson's Jack Sanstedt, left, battles with A. C. Reynolds' Urijah Morrisson for control of the ball during their game at A.C. Reynolds High School on Wednesday, Sept. 30, 2015. Angeli Wright/awright@citizen-times.com Fullscreen Buy Photo A.C Reynolds' Matthew Kennedy heads the ball against T.C. Roberson's Bradley Jennings during their game at A.C. Reynolds High School on Wednesday, Sept. 30, 2015. Angeli Wright/awright@citizen-times.com Fullscreen Buy Photo A. C. Reynolds' Brian Kennedy, left, and T.C. Roberson's Dexter Vandersall go after the ball during their game at A.C. Reynolds High School on Wednesday, Sept. 30, 2015. Angeli Wright/awright@citizen-times.com Fullscreen Buy Photo T.C. Roberson's Christian Chavez kicks the ball away from his goal during the Rams' game at A.C. Reynolds High School on Wednesday, Sept. 30, 2015. Angeli Wright/awright@citizen-times.com Fullscreen Buy Photo A. C. Reynolds goalkeeper Parker Johnson blocks a T.C. Roberson shot during the first half of their game at A.C. Reynolds High School on Wednesday, Sept. 30, 2015. Angeli Wright/awright@citizen-times.com Fullscreen Buy Photo T.C. Roberson defeated A.C. Reynolds 2-1 during their game at A.C. Reynolds High School on Wednesday, Sept. 30, 2015. Angeli Wright/awright@citizen-times.com Fullscreen Buy Photo T.C. Roberson defeated A.C. Reynolds 2-1 during their game at A.C. Reynolds High School on Wednesday, Sept. 30, 2015. Angeli Wright/awright@citizen-times.com Fullscreen Buy Photo T.C. Roberson defeated A.C. Reynolds 2-1 during their game at A.C. Reynolds High School on Wednesday, Sept. 30, 2015. Angeli Wright/awright@citizen-times.com Fullscreen Buy Photo T.C. Roberson defeated A.C. Reynolds 2-1 during their game at A.C. Reynolds High School on Wednesday, Sept. 30, 2015. Angeli Wright/awright@citizen-times.com Fullscreen Buy Photo T.C. Roberson defeated A.C. Reynolds 2-1 during their game at A.C. Reynolds High School on Wednesday, Sept. 30, 2015. Angeli Wright/awright@citizen-times.com Fullscreen Buy Photo T.C. Roberson defeated A.C. Reynolds 2-1 during their game at A.C. Reynolds High School on Wednesday, Sept. 30, 2015. Angeli Wright/awright@citizen-times.com Fullscreen Buy Photo T.C. Roberson defeated A.C. Reynolds 2-1 during their game at A.C. Reynolds High School on Wednesday, Sept. 30, 2015. Angeli Wright/awright@citizen-times.com Fullscreen Buy Photo T.C. Roberson defeated A.C. Reynolds 2-1 during their game at A.C. Reynolds High School on Wednesday, Sept. 30, 2015. Angeli Wright/awright@citizen-times.com Fullscreen Buy Photo T.C. Roberson defeated A.C. Reynolds 2-1 during their game at A.C. Reynolds High School on Wednesday, Sept. 30, 2015. Angeli Wright/awright@citizen-times.com Fullscreen Buy Photo T.C. Roberson defeated A.C. Reynolds 2-1 during their game at A.C. Reynolds High School on Wednesday, Sept. 30, 2015. Angeli Wright/awright@citizen-times.com Fullscreen Buy Photo T.C. Roberson defeated A.C. Reynolds 2-1 during their game at A.C. Reynolds High School on Wednesday, Sept. 30, 2015. Angeli Wright/awright@citizen-times.com Fullscreen Buy Photo T.C. Roberson defeated A.C. Reynolds 2-1 during their game at A.C. Reynolds High School on Wednesday, Sept. 30, 2015. Angeli Wright/awright@citizen-times.com Fullscreen Buy Photo T.C. Roberson defeated A.C. Reynolds 2-1 during their game at A.C. Reynolds High School on Wednesday, Sept. 30, 2015. Angeli Wright/awright@citizen-times.com Fullscreen Buy Photo T.C. Roberson defeated A.C. Reynolds 2-1 during their game at A.C. Reynolds High School on Wednesday, Sept. 30, 2015. Angeli Wright/awright@citizen-times.com Fullscreen Buy Photo T.C. Roberson defeated A.C. Reynolds 2-1 during their game at A.C. Reynolds High School on Wednesday, Sept. 30, 2015. Angeli Wright/awright@citizen-times.com Fullscreen Buy Photo T.C. Roberson defeated A.C. Reynolds 2-1 during their game at A.C. Reynolds High School on Wednesday, Sept. 30, 2015. Angeli Wright/awright@citizen-times.com Fullscreen Buy Photo T.C. Roberson defeated A.C. Reynolds 2-1 during their game at A.C. Reynolds High School on Wednesday, Sept. 30, 2015. Angeli Wright/awright@citizen-times.com Fullscreen Buy Photo T.C. Roberson defeated A.C. Reynolds 2-1 during their game at A.C. Reynolds High School on Wednesday, Sept. 30, 2015. Angeli Wright/awright@citizen-times.com Fullscreen Buy Photo T.C. Roberson defeated A.C. Reynolds 2-1 during their game at A.C. Reynolds High School on Wednesday, Sept. 30, 2015. Angeli Wright/awright@citizen-times.com", "external_links": [], "published": "2015-10-01T20:14:00.000+03:00", "crawled": "2015-10-02T13:09:47.881+03:00", "highlightTitle": ""}