{"organizations": ["The University of Hawaii", "University of Hawaii", "CIA", "New York Police Department", "Cavaliers", "Interior Department"], "uuid": "bd9f501c9d712fd174dc8a280e8962c2020c37ac", "thread": {"social": {"gplus": {"shares": 0}, "pinterest": {"shares": 0}, "vk": {"shares": 0}, "linkedin": {"shares": 0}, "facebook": {"likes": 0, "shares": 0, "comments": 0}, "stumbledupon": {"shares": 0}}, "site_full": "www.swxrightnow.com", "main_image": "", "site_section": "http://www.swxrightnow.com/category/13566/national-sports?clienttype=rss&redirected=true", "section_title": "Sports and Weather Right Now - National Sports - Headline", "url": "http://www.swxrightnow.com/story/30320944/cavaliers-thompson-reach-agreement-on-long-term-contract", "country": "US", "title": "Cavaliers, Thompson reach agreement on long-term contract", "performance_score": 0, "site": "swxrightnow.com", "participants_count": 0, "title_full": "Cavaliers, Thompson reach agreement on long-term contract", "spam_score": 0.0, "site_type": "news", "published": "2015-10-22T03:14:00.000+03:00", "replies_count": 0, "uuid": "bd9f501c9d712fd174dc8a280e8962c2020c37ac"}, "author": "", "url": "http://www.swxrightnow.com/story/30320944/cavaliers-thompson-reach-agreement-on-long-term-contract", "ord_in_thread": 0, "title": "Cavaliers, Thompson reach agreement on long-term contract", "locations": ["US", "Washington", "WA", "Tri-Cities", "West", "Mauna Kea", "Hawaii", "UK", "D.C.", "Spokane"], "entities": {"persons": [], "locations": [], "organizations": []}, "highlightText": "", "language": "english", "persons": ["Jeb Bush", "Joe Biden", "Lucas Leonard", "John Brennan", "Bush", "Christopher", "Biden", "Thompson", "Obama"], "text": "Cavaliers, Thompson reach agreement on long-term contract - SWX Right Now-Sports for Spokane, CdA, Tri-Cities, WA Member Center:   Former UK telescope to be removed from Hawaii mountain The University of Hawaii has announced the third Mauna Kea observatory that will be decommissioned, fulfilling the governor's request to remove 25 percent of the telescopes from the mountain. More >> The University of Hawaii announced Wednesday that a third observatory will be taken down from Mauna Kea - a move that fulfills the governor's request to remove 25 percent of telescopes from the mountain considered... More >> Man   The Latest: Funeral set for slain NYPD officer The latest on the fatal shooting of a New York Police Department officer during a gunbattle and chase involving a stolen bicycle   fatal shooting of a New York Police Department officer during a gunbattle and chase involving a stolen bicycle   Bush would move Interior Department HQ to the West Jeb Bush says if he's elected president he'd try to move the Interior Department's headquarters to the West. More >> Jeb Bush said Wednesday that he would rein in regulation at the Interior Department as president and try to move its headquarters from Washington, D.C., to the West, home to 90 percent of federally owned land. More >> Ordered to drop politics, ex-coal CEO shows views on trial An outspoken critic of   charged with conspiring to violate mine safety rules before a deadly explosion is under orders not to tell jurors he's being persecuted by Democrats. More >> An outspoken critic of  , charged with conspiring to violate mine safety rules before a deadly explosion, is under orders not to tell jurors he's being persecuted by Democrats. More >> WikiLeaks publishes CIA director John Brennan's emails The Wikileaks organization has posted material from what appears to be CIA director John Brennan's personal email account, including a draft security clearance application containing personal information. More >> The WikiLeaks organization posted material Wednesday from what appears to be CIA Director John Brennan's personal email account, including a draft security clearance application containing personal information. More >> Bookended by tragedy, Biden's storied career nears the end Joe Biden's storied political career will end much the way it started nearly half a century ago: shaped by crushing personal tragedy that shook his confidence in his own ability to lead. More >> Joe Biden's storied political career will come to an end much the way it started nearly half a century ago: shaped by crushing personal tragedy that shook his deep-seated confidence in his own ability to lead. More >> Teen recounts deadly beating inside secretive church The surviving brother of a pair of teenagers viciously beaten during a church counseling session is scheduled to testify against a relative who is among six church members charged in the attack. More >> Called to a meeting in the sanctuary of their church, teenage brothers Christopher and Lucas Leonard were told to stand and answer for what they had done. More >> Obama says US will tackle prescription drug abuse Heading to a region grappling with the scourge of drug abuse,   planned to announce new steps to improve doctor training and ease access to drug treatment as part of an effort to help... More >> Traveling to a region in the throes of a drug abuse crisis,   promised Wednesday to use his bully pulpit and federal programs to try to combat the \"epidemic\" of heroin use and prescription painkiller... More >>", "external_links": [], "published": "2015-10-22T03:14:00.000+03:00", "crawled": "2015-10-22T04:05:00.750+03:00", "highlightTitle": ""}