{"organizations": ["Sheffield United.Jose Baxter", "Millwall"], "uuid": "76b45530dca134fdea671cc95986846a987b56cf", "thread": {"social": {"gplus": {"shares": 0}, "pinterest": {"shares": 0}, "vk": {"shares": 0}, "linkedin": {"shares": 0}, "facebook": {"likes": 0, "shares": 0, "comments": 0}, "stumbledupon": {"shares": 0}}, "site_full": "www.sport.co.uk", "main_image": "http://images.sport.co.uk/150x150/div2.jpg", "site_section": "http://feeds.feedburner.com/SportcoukNewsRssFeed", "section_title": "General Sports News from Sports.co.uk", "url": "http://www.sport.co.uk/football/sheff-utd-12-millwall-match-report/6983595/", "country": "JE", "title": "Sheff Utd 1-2 Millwall: Match Report", "performance_score": 0, "site": "sport.co.uk", "participants_count": 0, "title_full": "Sheff Utd 1-2 Millwall: Match Report", "spam_score": 0.0, "site_type": "news", "published": "2015-10-24T16:31:00.000+03:00", "replies_count": 0, "uuid": "76b45530dca134fdea671cc95986846a987b56cf"}, "author": "", "url": "http://www.sport.co.uk/football/sheff-utd-12-millwall-match-report/6983595/", "ord_in_thread": 0, "title": "Sheff Utd 1-2 Millwall: Match Report", "locations": ["Jordan Archer"], "entities": {"persons": [], "locations": [], "organizations": []}, "highlightText": "", "language": "english", "persons": ["Chris Basham", "Kieron Freeman", "Shane Ferguson", "George Saville", "Sheffield UnitedAiden O'Brien", "Mark Howard.Saville", "Che Adams", "Archer", "Brien", "Aiden O'Brien", "Shaun Cumming", "O'Brien", "Fred Onyedinma", "Howard", "Mark Beevers"], "text": "Sheff Utd 1-2 Millwall: Match Report 24 Oct 2015 13:31:00 Aiden O'Brien at the double as Millwall see off Sheffield UnitedAiden O'Brien scored twice to give Millwall a third straight victory, winning 2-1 at Sheffield United.Jose Baxter was on target for the hosts but Millwall had enough thanks to O'Brien.Millwall carved out a couple of early chances with Fred Onyedinma shooting wide from the right-hand side of the area and Mark Beevers heading wide after meeting George Saville's corner.United's Che Adams grazed the outside of Jordan Archer's right-hand post with a low 20-yard shot and Chris Basham had a goal-bound shot blocked.It was first blood to Millwall when O'Brien (30) got his head to a ball played into the area by Shaun Cumming and steered the ball beyond keeper Mark Howard.Saville then tested Howard with a low drive which forced the keeper to get down to his right to save.Baxter (70) equalised with a fine, first-time shot past Archer following Kieron Freeman's low cross.O'Brien (80) scored the winner, sliding in to meet Shane Ferguson's ball across the face of goal and force the ball over the line. Related Sport News", "external_links": [], "published": "2015-10-24T16:31:00.000+03:00", "crawled": "2015-10-24T20:22:43.327+03:00", "highlightTitle": ""}