{"organizations": ["Philadelphia Eagles' DeMeco Ryans", "NFL", "Philadelphia Eagles", "New Orleans Saints", "AP New Orleans Saints", "AP Philadelphia Eagles", "AP The New Orleans Saints", "ASSOCIATED PRESS New Orleans Saints"], "uuid": "554e700cb174536b98fa7e413108d61390f8dd35", "thread": {"social": {"gplus": {"shares": 0}, "pinterest": {"shares": 0}, "vk": {"shares": 0}, "linkedin": {"shares": 0}, "facebook": {"likes": 0, "shares": 0, "comments": 0}, "stumbledupon": {"shares": 0}}, "site_full": "www.thenewsstar.com", "main_image": "http://www.gannett-cdn.com/-mm-/6e46716179a4204b8c41ab80922408d0d2d92839/c=0-0-511-289&amp;r=x1683&amp;c=3200x1680/local/-/media/2015/10/12/LAGroup/Shreveport/635802693260467569-NOPH1.jpg", "site_section": "http://rssfeeds.thenewsstar.com/monroe/sports", "section_title": "Monroe - Sports", "url": "http://www.thenewsstar.com/videos/sports/college/louisiana-tech/2015/10/12/73844674/", "country": "US", "title": "Saints-Eagles", "performance_score": 0, "site": "thenewsstar.com", "participants_count": 0, "title_full": "Saints-Eagles", "spam_score": 0.0, "site_type": "news", "published": "2015-10-13T01:02:00.000+03:00", "replies_count": 0, "uuid": "554e700cb174536b98fa7e413108d61390f8dd35"}, "author": "", "url": "http://www.thenewsstar.com/videos/sports/college/louisiana-tech/2015/10/12/73844674/", "ord_in_thread": 0, "title": "Saints-Eagles", "locations": ["Philadelphia"], "entities": {"persons": [], "locations": [], "organizations": []}, "highlightText": "", "language": "english", "persons": ["Matt Rourke", "Marcus Murphy", "Josh Hill", "Drew Brees", "Jordan Matthews", "Zach Hocker", "Chris Maragos", "Michael Perez", "Riley Cooper", "Sean Payton", "Keenan Lewis", "Fletcher Cox", "Kenny Vaccaro"], "text": "Activate your digital access. Saints-Eagles New Orleans Saints' Marcus Murphy is tackled by Philadelphia Eagles' Chris Maragos during the first half of an NFL football game, Sunday. Michael Perez, ASSOCIATED PRESS New Orleans Saints' Drew Brees, left, fumbles the ball after a hit from Philadelphia Eagles' Fletcher Cox during the second half of an NFL football game, Sunday. Michael Perez, AP Philadelphia Eagles' Riley Cooper is tackled by New Orleans Saints' Keenan Lewis during the first half of an NFL football game, Sunday. Michael Perez, AP New Orleans Saints' Drew Brees is tackled by Philadelphia Eagles' Fletcher Cox during the first half of an NFL football game, Sunday. Michael Perez, AP New Orleans Saints head coach Sean Payton reacts after talking with an official during the first half of an NFL football game against the Philadelphia Eagles, Sunday. Matt Rourke, AP New Orleans Saints' Zach Hocker kicks a field goal during the second half of an NFL football game against the Philadelphia Eagles, Sunday. Michael Perez, AP The New Orleans Saints huddle during the second half of an NFL football game against the Philadelphia Eagles, Sunday. Matt Rourke, AP Philadelphia Eagles' Jordan Matthews, left, tries to break a tackle by New Orleans Saints' Kenny Vaccaro during the second half of an NFL football game, Sunday. Michael Perez, AP Philadelphia Eagles' cheerleaders perform during the second half of an NFL football game against the New Orleans Saints, Sunday, Oct. 11, 2015, in Philadelphia. Michael Perez, AP New Orleans Saints' Josh Hill, left, is tackled by Philadelphia Eagles' DeMeco Ryans during the second half of an NFL football game, Sunday. Matt Rourke, AP Like this topic? You may also like these photo galleries: Replay", "external_links": [], "published": "2015-10-13T01:02:00.000+03:00", "crawled": "2015-10-13T18:42:18.964+03:00", "highlightTitle": ""}