{"organizations": ["Associated Press College", "NFL Pats", "UNH", "NCAA", "The University of New Hampshire", "Wildcats", "University of Vermont", "Celtics", "New England Patriots", "UVM", "Knicks", "Houston Texans", "Packers"], "uuid": "accf901829414c021fc3505d6fa57c6c3b9cef82", "thread": {"social": {"gplus": {"shares": 0}, "pinterest": {"shares": 0}, "vk": {"shares": 0}, "linkedin": {"shares": 0}, "facebook": {"likes": 0, "shares": 0, "comments": 0}, "stumbledupon": {"shares": 0}}, "site_full": "www.fosters.com", "main_image": "http://www.fosters.com/storyimage/FD/20151022/SPORTS/151029660/AR/0/AR-151029660.jpg", "site_section": "http://www.fosters.com/sports/professional?template=rss&mime=xml", "section_title": "Pro Sports - fosters.com", "url": "http://www.fosters.com/article/20151022/SPORTS/151029660/14340?rssfeed=true", "country": "US", "title": "Sports briefs: C's win exhibition", "performance_score": 0, "site": "fosters.com", "participants_count": 0, "title_full": "Sports briefs: C's win exhibition", "spam_score": 0.0, "site_type": "news", "published": "2015-10-23T07:05:00.000+03:00", "replies_count": 0, "uuid": "accf901829414c021fc3505d6fa57c6c3b9cef82"}, "author": "", "url": "http://www.fosters.com/article/20151022/SPORTS/151029660/14340?rssfeed=true", "ord_in_thread": 0, "title": "Sports briefs: C's win exhibition", "locations": ["Hartford WEST HARTFORD", "Hartford", "Philadelphia", "Binghamton", "FOXBOROUGH", "Mass.", "Maryland-Baltimore County", "Green Bay", "Conn.", "Boston", "BOSTON", "UVM BURLINGTON", "Jacksonville", "America", "Vt."], "entities": {"persons": [], "locations": [], "organizations": []}, "highlightText": "", "language": "english", "persons": ["Jae Crowder", "Khyri Thornton", "Williams", "Tyler Zeller", "Derrick Williams", "Houston", "Jose Calderon", "Corran", "Sullinger", "Marcus Smart", "Mimi Borkan", "Anthony", "Brent Williams", "Thornton", "Jared Sullinger", "Brennan Williams", "David Lee", "Robert Corran"], "text": "Sports briefs: C's win exhibition fosters.com Posted Oct. 22, 2015 at 11:05 PM Updated at 11:05 PM Posted Oct. 22, 2015 at 11:05 PM BOSTON — Jared Sullinger scored 16 points and grabbed eight rebounds to help lead the Celtics to a 99-85 exhibition victory over the Knicks on Thursday night. Sullinger was 6 of 10 and had six assists in 19 minutes. Tyler Zeller finished with 15 points, Jae Crowder added 13 and David Lee had seven points and eight boards. For the Knicks, Carmelo Anthony scored eight points on 4-of-18 shooting in 31 minutes. Jose Calderon tallied 17 points and eight rebounds and Derrick Williams added 14 points. Anthony struggled, missing six of his first seven shots. He was held scoreless for over 20 minutes until a pair of baskets late in the first half. Boston's Marcus Smart dished out nine assists, tying his personal best. The Celtics wraps up their exhibition schedule against Philadelphia on Friday. — The Associated Press College soccer UNH women fall at Hartford WEST HARTFORD, Conn. — The University of New Hampshire women's soccer team fell 2-0 at Hartford on Thursday. UNH finished the regular season at 6-9-3 overall and 4-4 in conference play. The Wildcats clinched a tournament playoff spot by virtue of Binghamton's 1-0 win over Maryland-Baltimore County. Hartford is 10-2-4, 4-0-3. Mimi Borkan made two saves in net for UNH. — Staff reports NFL Pats make cuts FOXBOROUGH, Mass. — The New England Patriots have released defensive lineman Khyri Thornton from the 53-man roster and offensive lineman Brennan Williams from the practice squad. Thornton was a third-round draft pick by the Packers. The Patriots claimed him off waivers from Green Bay last month. He had already been released once and signed to the practice squad. Williams was a third-round draft choice by the Houston Texans in 2013. He was released by Houston and went to training camp with Jacksonville this summer. His father, Brent Williams, played defensive end with the Patriots from 1986-93. College Corran retires at UVM BURLINGTON, Vt. — The athletic director at the University of Vermont is retiring at the end of June. Robert Corran, who is also an associate vice president at UVM, announced Thursday he would retire from the position he has held since 2003. Corran said he has been considering retirement for the past year. He says he's proud of his accomplishments during his time at UVM. Among the milestones during Corran's time at UVM are three appearances by the men's hockey team in the NCAA men's hockey tournament, a trip to the Frozen Four in 2009 and seven consecutive America East Academic Cups. He has also overseen improvements in UVM's athletic facilities. UVM says it will conduct a nationwide search for Corran's replacement. — The Associated Press", "external_links": [], "published": "2015-10-23T07:05:00.000+03:00", "crawled": "2015-10-23T07:27:03.876+03:00", "highlightTitle": ""}