{"organizations": ["NBA", "Atlanta Hawks", "Grizzlies", "AP Conley", "AP Image", "Memphis Grizzlies", "AP", "Hawks"], "uuid": "b29f3bfdfa71731bbb841f8e7501f3504bbcbc0f", "thread": {"social": {"gplus": {"shares": 0}, "pinterest": {"shares": 0}, "vk": {"shares": 0}, "linkedin": {"shares": 0}, "facebook": {"likes": 0, "shares": 0, "comments": 0}, "stumbledupon": {"shares": 0}}, "site_full": "www.beaumontenterprise.com", "main_image": "http://ww1.hdnux.com/photos/41/53/67/8830460/3/rawImage.jpg", "site_section": "http://www.beaumontenterprise.com/sports/basketball/collectionRss/Sports-Basketball-Heds-7404.php", "section_title": "Sports Basketball Heds", "url": "http://www.beaumontenterprise.com/sports/article/Conley-s-only-FG-leads-Grizzlies-past-Hawks-82-81-6583158.php", "country": "US", "title": "Conley's only FG leads Grizzlies past Hawks, 82-81", "performance_score": 0, "site": "beaumontenterprise.com", "participants_count": 0, "title_full": "Conley's only FG leads Grizzlies past Hawks, 82-81", "spam_score": 0.0, "site_type": "news", "published": "2015-10-22T05:47:00.000+03:00", "replies_count": 0, "uuid": "b29f3bfdfa71731bbb841f8e7501f3504bbcbc0f"}, "author": "", "url": "http://www.beaumontenterprise.com/sports/article/Conley-s-only-FG-leads-Grizzlies-past-Hawks-82-81-6583158.php", "ord_in_thread": 0, "title": "Conley's only FG leads Grizzlies past Hawks, 82-81", "locations": ["Southeast Texas", "Detroit", "ATLANTA", "Atlanta", "Orlando"], "entities": {"persons": [], "locations": [], "organizations": []}, "highlightText": "", "language": "english", "persons": ["Mike Conley", "Al Horford", "Randolph", "Paul Millsap", "Kent Bazemore", "John Bazemore", "Beno Udrih", "Dennis Schroder", "Marc Gasol", "Conley", "Zach Randolph", "Jarnell Stokes", "Ryan Hollins"], "text": "Close Image 1 of 5 Atlanta Hawks guard Kent Bazemore (24) goes up for a shot against Memphis Grizzlies center Ryan Hollins (20) in the first half of an NBA preseason basketball game Wednesday, Oct. 21, 2015, in Atlanta. Atlanta Hawks guard Kent Bazemore (24) goes up for a shot against Memphis Grizzlies center Ryan Hollins (20) in the first half of an NBA preseason basketball game Wednesday, Oct. 21, 2015, in Atlanta. Photo: John Bazemore, AP Image 2 of 5 Atlanta Hawks guard Dennis Schroder (17) is fouled by Memphis Grizzlies guard Beno Udrih (19) as he goes to the basket in the first half of an NBA preseason basketball game Wednesday, Oct. 21, 2015, in Atlanta. Atlanta Hawks guard Dennis Schroder (17) is fouled by Memphis Grizzlies guard Beno Udrih (19) as he goes to the basket in the first half of an NBA preseason basketball game Wednesday, Oct. 21, 2015, in Atlanta. Photo: John Bazemore, AP Image 3 of 5 Memphis Grizzlies center Marc Gasol (33) holds his wrist after being fouled in the first half of an NBA preseason basketball game against the Atlanta Hawks Wednesday, Oct. 21, 2015, in Atlanta. Memphis Grizzlies center Marc Gasol (33) holds his wrist after being fouled in the first half of an NBA preseason basketball game against the Atlanta Hawks Wednesday, Oct. 21, 2015, in Atlanta. Photo: John Bazemore, AP Image 4 of 5 Atlanta Hawks forward Paul Millsap (4) passes the ball as he drives past Memphis Grizzlies center Marc Gasol (33) in the first half of an NBA preseason basketball game Wednesday, Oct. 21, 2015, in Atlanta. Atlanta Hawks forward Paul Millsap (4) passes the ball as he drives past Memphis Grizzlies center Marc Gasol (33) in the first half of an NBA preseason basketball game Wednesday, Oct. 21, 2015, in Atlanta. Photo: John Bazemore, AP Image 5 of 5 Memphis Grizzlies forward Jarnell Stokes (1) pulls down a rebound against Atlanta Hawks forward Tiago Splitter (11) in the first half of an NBA preseason basketball game Wednesday, Oct. 21, 2015, in Atlanta. Memphis Grizzlies forward Jarnell Stokes (1) pulls down a rebound against Atlanta Hawks forward Tiago Splitter (11) in the first half of an NBA preseason basketball game Wednesday, Oct. 21, 2015, in Atlanta. Photo: John Bazemore, AP Conley's only FG leads Grizzlies past Hawks, 82-81 1 / 5 Back to Gallery ATLANTA (AP) — Mike Conley hit a 3-pointer with 53 seconds remaining, Zach Randolph scored 19 points and the Memphis Grizzlies remained unbeaten in the preseason with an 82-81 win over the Atlanta Hawks on Wednesday night. Both teams rallied from double-digit deficits, the Hawks going ahead 77-76 on Paul Millsap 's 3-pointer from the corner with 1:07 to go. Conley responded with a 3 of his own for Memphis (6-0) — his only field goal of the night. GRIZZLIES: Randolph also had 13 rebounds. HAWKS: Kent Bazemore led with 18 points. ... Al Horford had 13 points and 14 rebounds. LIKE THE REAL THING: Both teams had starters on the court at the end, giving the game a regular-season feel. UP NEXT: The Hawks play their preseason finale Friday at Detroit, a preview of their regular season opener. The Grizzlies also close the preseason Friday, traveling to Orlando to take on the Magic. Southeast Texas sports news", "external_links": [], "published": "2015-10-22T05:47:00.000+03:00", "crawled": "2015-10-22T06:30:28.399+03:00", "highlightTitle": ""}