{"organizations": ["Steubenville Catholic Central", "Steubinville Catholic Central", "Steubenville Central Catholic"], "uuid": "fd98fd4f6d8cbbd9e8a1800494933f86e3acd55b", "thread": {"social": {"gplus": {"shares": 0}, "pinterest": {"shares": 0}, "vk": {"shares": 0}, "linkedin": {"shares": 0}, "facebook": {"likes": 0, "shares": 0, "comments": 0}, "stumbledupon": {"shares": 0}}, "site_full": "www.zanesvilletimesrecorder.com", "main_image": "http://www.gannett-cdn.com/-mm-/37150ed258e4f1e3da344453eb66069464c0484b/c=0-218-3397-2137&amp;r=x1683&amp;c=3200x1680/local/-/media/2015/10/24/OHGroup/Zanesville/635813053851862113-09-zan-1025-Ro-BSOC.JPG", "site_section": "http://rssfeeds.zanesvilletimesrecorder.com/zanesville/highschoolsports", "section_title": "Zanesville - HIgh School Sports", "url": "http://www.zanesvilletimesrecorder.com/story/sports/2015/10/24/top-seeded-bishops-take-care-crusaders/74419144/", "country": "US", "title": "Top-seeded Bishops take care of Crusaders", "performance_score": 0, "site": "zanesvilletimesrecorder.com", "participants_count": 0, "title_full": "Top-seeded Bishops take care of Crusaders", "spam_score": 0.0, "site_type": "news", "published": "2015-10-25T01:14:00.000+03:00", "replies_count": 0, "uuid": "fd98fd4f6d8cbbd9e8a1800494933f86e3acd55b"}, "author": "", "url": "http://www.zanesvilletimesrecorder.com/story/sports/2015/10/24/top-seeded-bishops-take-care-crusaders/74419144/", "ord_in_thread": 0, "title": "Top-seeded Bishops take care of Crusaders", "locations": ["Zanesville", "Steubenville"], "entities": {"persons": [], "locations": [], "organizations": []}, "highlightText": "", "language": "english", "persons": ["Carter Hagy", "Joe Zinno", "Aaron Gehlken", "Brandon Hannahs", "Kevin Herrmann", "Joey Schlich", "Michael Gibson", "Jacob Rigaud", "Mikey Irvin", "Jared Shaffer", "Andrew Nash", "Rosecrans", "Joseph Goggin", "Wyatt Lang", "Keagan McLaughlin", "Shane", "Lane Dailey"], "text": "Top-seeded Bishops take care of Crusaders Brandon Hannahs , Reporter 8:26 p.m. EDT October 24, 2015 Rosecrans' Carter Hagy and Steubenville Catholic Central's Jacob Rigaud battle for possession during the Bishops 5-1 Division III sectional finals win over the Crusaders on Saturday in Zanesville. (Photo: Shane Flanigan/Times Recorder) 8 CONNECT 4 TWEET LINKEDIN COMMENT EMAIL MORE Buy Photo Rosecrans' Carter Hagy and Steubenville Catholic Central's Jacob Rigaud battle for possession during the Bishops 5-1 Division III sectional finals win over the Crusaders on Saturday in Zanesville. Shane Flanigan/Times Recorder Fullscreen Buy Photo Rosecrans' Lane Dailey celebrates with teammates Michael Gibson and Jared Shaffer after scoring his third goal in a 5-1 Division III sectional finals win over Steubenville Catholic Central on Saturday in Zanesville. Shane Flanigan/Times Recorder Fullscreen Buy Photo Rosecrans' Carter Hagy prepares to kick the ball down field during a 5-1 Division III sectional finals win over Steubenville Catholic Central on Saturday in Zanesville. Shane Flanigan/Times Recorder Fullscreen Buy Photo Rosecrans' Joseph Goggin and Steubinville Catholic Central's Mikey Irvin battle for possession during the Bishops 5-1 Division III sectional finals win over the Crusaders on Saturday in Zanesville. Shane Flanigan/Times Recorder Fullscreen Buy Photo Rosecrans' Keagan McLaughlin clears the ball away during the Bishops 5-1 Division III sectional finals win over Steubenville Catholic Central on Saturday in Zanesville. Shane Flanigan/Times Recorder Fullscreen Buy Photo Rosecrans' Carter Hagy kicks the ball away from Steubenville Central Catholic's Brady Bolder during the Bishops 5-1 Division III sectional finals win over the Crusaders on Saturday in Zanesville. Shane Flanigan/Times Recorder Fullscreen Buy Photo Steubenville Catholic Central's Joey Schlich heads a ball away from Rosecrans' Wyatt Lang during the Bishops 5-1 Division III sectional finals win over the Crusaders on Saturday in Zanesville. Shane Flanigan/Times Recorder Fullscreen Buy Photo Rosecrans' Jared Shaffer and Steubenville Catholic Central's Mikey Irvin battle for possession during the Bishops 5-1 Division III sectional finals win over the Crusaders on Saturday in Zanesville. Shane Flanigan/Times Recorder Fullscreen Buy Photo Rosecrans' Aaron Gehlken throws the ball in bounds during the Bishops 5-1 Division III sectional finals win over Steubenville Catholic Central on Saturday in Zanesville. Shane Flanigan/Times Recorder Fullscreen Buy Photo Rosecrans' Andrew Nash battles for possession with Steubenville Catholic Central's Kevin Herrmann and Joe Zinno during the Bishops 5-1 Division III sectional finals win over the Crusaders on Saturday in Zanesville. Shane Flanigan/Times Recorder Fullscreen Buy Photo Rosecrans' Jared Shaffer and Steubenville Catholic Central's Kevin Herrmann battle for possession during the Bishops 5-1 Division III sectional finals win over the Crusaders on Saturday in Zanesville. Shane Flanigan/Times Recorder Fullscreen Buy Photo Steubenville Catholic Central's Joe Zinno battles for possession with Rosecrans' Andrew Nash and Carter Hagy during the Bishops 5-1 Division III sectional finals win over the Crusaders on Saturday in Zanesville. Shane Flanigan/Times Recorder Fullscreen Buy Photo Rosecrans' Jared Shaffer and Andrew Nash battle for possession with Steubenville Catholic Central's Jacob Rigaud during the Bishops 5-1 Division III sectional finals win over the Crusaders on Saturday in Zanesville. Shane Flanigan/Times Recorder Fullscreen Buy Photo Rosecrans' Aaron Gehlken kicks the ball during the Bishops 5-1 Division III sectional finals win over Steubenville Catholic Central on Saturday in Zanesville. Shane Flanigan/Times Recorder Like this topic? You may also like these photo galleries: Replay", "external_links": [], "published": "2015-10-25T01:14:00.000+03:00", "crawled": "2015-10-25T03:31:03.871+02:00", "highlightTitle": ""}