{"organizations": ["Whitman-Hanson", "Privacy Policy | Terms of Service | Gatehouse Media Publications", "Gatehouse Media, Inc", "Easton Country Club"], "uuid": "d2c374f0a77052fa66a13d5c64fd5a480d5ecf3b", "thread": {"social": {"gplus": {"shares": 0}, "pinterest": {"shares": 0}, "vk": {"shares": 0}, "linkedin": {"shares": 0}, "facebook": {"likes": 0, "shares": 0, "comments": 0}, "stumbledupon": {"shares": 0}}, "site_full": "www.patriotledger.com", "main_image": "http://www.patriotledger.com/Global/images/head/nameplate/patriotledger_logo.png", "site_section": "http://www.patriotledger.com/sports?template=rss&mime=xml", "section_title": "Sports - The Patriot Ledger, Quincy, MA", "url": "http://www.patriotledger.com/article/20151021/SPORTS/150939753/17218/NEWS?rssfeed=true", "country": "US", "title": "Live updates of today's high school sports", "performance_score": 0, "site": "patriotledger.com", "participants_count": 0, "title_full": "Live updates of today's high school sports", "spam_score": 0.0, "site_type": "news", "published": "2015-10-21T21:28:00.000+03:00", "replies_count": 0, "uuid": "d2c374f0a77052fa66a13d5c64fd5a480d5ecf3b"}, "author": "", "url": "http://www.patriotledger.com/article/20151021/SPORTS/150939753/17218/NEWS?rssfeed=true", "ord_in_thread": 0, "title": "Live updates of today's high school sports", "locations": ["Hanover", "Hingham", "Scituate", "Weymouth", "Oliver Ames", "Wompatuck State Park", "Canton", "Walpole", "MA", "Duxbury"], "entities": {"persons": [], "locations": [], "organizations": []}, "highlightText": "", "language": "english", "persons": ["Quincy"], "text": "Live updates of today's high school sports Here's what's we're covering. Posted Oct. 21, 2015 at 12:01 am Updated at 9:57 AM WEDNESDAY; Walpole at Weymouth, cross-country, Wompatuck State Park, Hingham, 4:30 p.m. TUESDAY:Whitman-Hanson at Hingham, cross-country, 4 p.m.; Hingham, Duxbury, Scituate, Hanover, Whitman-Hanson golf sectional at Easton Country Club; Canton at Oliver Ames, girls soccer, 6. MORE GAMES Sign Up Today Sign up for our newsletter and have the top headlines from your community delivered right to your inbox. Your privacy is important, read our privacy policy. Â© Copyright 2006-2015 Gatehouse Media, Inc. Some rights reserved Privacy Policy | Terms of Service | Gatehouse Media Publications Original content available for non-commercial use under a Creative Commons license, except where noted. The Patriot Ledger, Quincy, MA | 400 Crown Colony Drive, P.O. Box 699159, Quincy, MA 02269", "external_links": [], "published": "2015-10-21T21:28:00.000+03:00", "crawled": "2015-10-21T21:06:40.305+03:00", "highlightTitle": ""}