{"organizations": ["New York City FC", "D.C. United", "Associated Press", "Facebook Saborio", "Facebook Email Twitter Google", "DC United", "United"], "uuid": "654eb26eca61b5ac779b1d3e86344eb7e8612b64", "thread": {"social": {"gplus": {"shares": 0}, "pinterest": {"shares": 0}, "vk": {"shares": 0}, "linkedin": {"shares": 0}, "facebook": {"likes": 0, "shares": 0, "comments": 0}, "stumbledupon": {"shares": 0}}, "site_full": "www.wusa9.com", "main_image": "http://www.gannett-cdn.com/-mm-/dd91cab7c966d9afac8d2c3217d66bedd36b3dc9/r=x1683&amp;c=3200x1680/http/cdn.tegna-tv.com/-mm-/6a453edbc285ec5e1688a9f7c85bdf89832474eb/c=0-0-4657-2631/local/-/media/2015/10/02/WUSA/WUSA/635794226684566483-USATSI-8838460.jpg", "site_section": "http://rssfeeds.wusa9.com/_/20/108817924/WUSA-sports", "section_title": "WUSA - Sports", "url": "http://www.wusa9.com/story/sports/2015/10/02/dc-united-ny-city-fc/73255822/", "country": "US", "title": "Saborio scores in extra time; DC United secures playoff spot", "performance_score": 0, "site": "wusa9.com", "participants_count": 0, "title_full": "Saborio scores in extra time; DC United secures playoff spot", "spam_score": 0.0, "site_type": "news", "published": "2015-10-03T05:45:00.000+03:00", "replies_count": 0, "uuid": "654eb26eca61b5ac779b1d3e86344eb7e8612b64"}, "author": "", "url": "http://www.wusa9.com/story/sports/2015/10/02/dc-united-ny-city-fc/73255822/", "ord_in_thread": 0, "title": "Saborio scores in extra time; DC United secures playoff spot", "locations": ["USA", "Washington", "DC"], "entities": {"persons": [], "locations": [], "organizations": []}, "highlightText": "", "language": "english", "persons": ["Pinterest Saborio", "Saborio", "Geoff", "Robert F. Kennedy", "Alvaro Saboru", "Geoff Burke-USA", "Geoff Burke"], "text": "Facebook Email Twitter Google+ LinkedIn Pinterest Saborio scores in extra time; DC United secures playoff spot D.C. United beat New York City FC 2-1 on a rainy Friday night to secure an Eastern Conference playoff spot. Post to Facebook Saborio scores in extra time; DC United secures playoff spot D.C. United beat New York City FC 2-1 on a rainy Friday night to secure an Eastern Conference playoff spot.  //on.wusa9.com/1RlHDPy   Join the Conversation To   Saborio scores in extra time; DC United secures playoff spot Associated Press, AP 10:45 p.m. EDT October 2, 2015 Oct 2, 2015; Washington, DC, USA; D.C. United forward Alvaro Saboru (9) celebrates with teammates after scoring a goal against New York City FC in stoppage time during the second half at Robert F. Kennedy Memorial Stadium. United won 2-1. Mandatory Credit: Geoff Burke-USA TODAY Sports (Photo: Geoff Burke, Geoff Burke-USA TODAY Sports) CONNECT TWEET LINKEDIN COMMENT EMAIL MORE \nWASHINGTON (AP) - Alvaro Saborio knocked in a loose ball on a free kick in the 92nd minute and D.C. United beat New York City FC 2-1 on a rainy Friday night to secure an Eastern Conference playoff spot. \nD.C. United (14-12-6) snapped its six-game winless stretch to move into a first-place tie with the New York Red Bulls. NYC FC (10-15-7) had its three-game winning streak stopped. \nFrank Lampard opened the scoring in the first minute for the fastest goal in NYC FC's first season. Bill Hamid blocked David Villa's fast-break attempt and Lampard slotted the rebound for his third goal in his last four games. \nFabian Espindola tied it in the 73rd minute. Josh Saunders dove to get a hand on Chris Pontius' shot and Espindola put in the rebound. \nVilla sent a ball just over the crossbar in the 41st and rolled one wide of the near post in first-half stoppage time. CONNECT TWEET LINKEDIN COMMENT EMAIL MORE \nCopyright 2015 The Associated Press. All rights reserved. This material may not be published, broadcast, rewritten or redistributed. Read or Share this story: http://on.wusa9.com/1RlHDPy TOP VIDEOS", "external_links": [], "published": "2015-10-03T05:45:00.000+03:00", "crawled": "2015-10-03T06:32:50.756+03:00", "highlightTitle": ""}