{"organizations": ["Western Conference", "UAW", "Indiana University", "General Motors", "Fiat Chrysler The United Auto Workers", "Fiat Chrysler", "Phoenix Suns", "FBI", "Associated Press", "Los Angeles Lakers", "Khloe Kardashian Odom", "United Auto Workers", "AP", "Congressional"], "uuid": "51e82cf77fadee2f7387e09b39f27957aae3cb17", "thread": {"social": {"gplus": {"shares": 0}, "pinterest": {"shares": 0}, "vk": {"shares": 0}, "linkedin": {"shares": 0}, "facebook": {"likes": 0, "shares": 0, "comments": 0}, "stumbledupon": {"shares": 0}}, "site_full": "www.wqow.com", "main_image": "http://images.worldnow.com/AP/images/9075049_G.jpg", "site_section": "http://www.WQOW.com/Global/category.asp?C=13566&clienttype=rss", "section_title": "WQOW TV News 18 - National Sports - Headline", "url": "http://www.wqow.com/story/30326980/lamar-odoms-speech-improving-during-therapy-family-says", "country": "US", "title": "Lamar Odom's speech improving during therapy, family says", "performance_score": 0, "site": "wqow.com", "participants_count": 0, "title_full": "Lamar Odom's speech improving during therapy, family says", "spam_score": 0.0, "site_type": "news", "published": "2015-10-23T01:04:00.000+03:00", "replies_count": 0, "uuid": "51e82cf77fadee2f7387e09b39f27957aae3cb17"}, "author": "", "url": "http://www.wqow.com/story/30326980/lamar-odoms-speech-improving-during-therapy-family-says", "ord_in_thread": 0, "title": "Lamar Odom's speech improving during therapy, family says", "locations": ["San Diego", "Hawaii", "Gotham Hall", "Phoenix", "California Mexican", "Iraq", "Benghazi", "West Africa", "New York City", "New York", "Mexico", "U.S.", "Tijuana", "Charleston", "Indiana", "Alaska", "New Jersey"], "entities": {"persons": [], "locations": [], "organizations": []}, "highlightText": "", "language": "english", "persons": ["Clinton", "Agostini", "Hillary Rodham Clinton", "Odom", "Tyrone Howard", "JOSH CORNFIELD", "Lamar Odom", "Chris Christie", "D. Franklin"], "text": "The CW Lamar Odom's speech improving during therapy, family says (AP Photo/Evan Agostini, File). FILE - In this April 30, 2012, file photo, Khloe Kardashian Odom and Lamar Odom from the show \"Keeping Up With The Kardashians\" attend an E! Network upfront event at Gotham Hall in New York. A family representative says ... (AP Photo/Ross D. Franklin, File). FILE - In this April 24, 2007, file photo, Los Angeles Lakers' Lamar Odom sits on the bench during a Western Conference playoff basketball game against the Phoenix Suns in Phoenix. Odom left a Las Vegas hospital and i...   AP FACT CHECK: Clinton and critics on Benghazi, emails Congressional investigations, by definition, are about finding facts. But some facts were twisted Thursday in a showdown between Hillary Rodham Clinton and her Republican questioners over how history - and voters -... More >> Congressional investigations, by definition, are about finding facts. But some facts were twisted Thursday in a showdown between Hillary Rodham Clinton and her Republican questioners over how history - and voters - will... More >> Pentagon: American killed in raid to free Iraqis held by IS A U.S. defense official says a U.S. military operation to rescue Kurdish hostages in northern Iraq resulted in one U.S. fatality. More >> Believing that Islamic State captives held on a compound in northern Iraq faced \"imminent mass execution,\" dozens of U.S. special operations troops and Iraqi forces raided the site Thursday, freeing approximately 70 Iraqi... More >> UAW approves new contract with Fiat Chrysler The United Auto Workers union appears likely to approve a new four-year contract with Fiat Chrysler. More >> The United Auto Workers union has approved a new four-year contract with Fiat Chrysler and now will turn its attention to bargaining with General Motors. More >> FBI opens hate crime probe in Indiana attack on Muslim woman The FBI has opened a hate crime investigation into an attack on a Muslim woman in which police say a 19-year-old Indiana University college student shouted racial slurs and tried to remove her headscarf. More >> The FBI has opened a hate crime investigation into an attack on a Muslim woman in which police say an Indiana University college student shouted racial slurs and tried to remove her headscarf. More >> Nurse quarantined over Ebola fears sues Gov. Chris Christie By JOSH CORNFIELD Associated Press The health care worker who sharply criticized being quarantined at a New Jersey hospital last year because she had contact with Ebola patients in West Africa has... More >> The health care worker who sharply criticized being quarantined at a New Jersey hospital last year because she had contact with Ebola patients in West Africa said Thursday after filing a lawsuit against Gov. Chris Christie... More >> Bond lowered for friend of suspect in black church massacre A federal magistrate on Thursday lowered bond for a man accused of failing to tell authorities all he knew about the suspect in the massacre of nine black people at a Charleston church last June. More >> A federal magistrate on Thursday lowered bond for a man accused of failing to tell authorities all he knew about the suspect in the massacre of nine black people at a Charleston church last June. More >> Police officer's slaying puts 'drug courts' under scrutiny Authorities say the case against a man accused of gunning down a New York City police officer will be presented to a grand jury this week. More >> Arrested in a 19-person drug sweep, Tyrone Howard was one of only three who got sent to drug court, which offered him treatment instead of prison. More >> Major drug tunnel found on US-Mexico border in California Mexican authorities said Thursday they seized about 10 tons of marijuana in an elaborate tunnel with a rail car system that extended well into San Diego and was designed to smuggle drugs into the U.S. from Tijuana. More >> U.S. authorities say 12 tons of marijuana have been seized and 22 people arrested in connection with a cross-border tunnel to Mexico that runs the length of eight football fields. More >> Alaska tribal members get back totem pole taken by actor A stolen totem pole that went from Hollywood garden decor to the basement of a Hawaii museum will be returned to Alaska tribal members. More >> A stolen totem pole that went from the garden decor of two golden-age Hollywood actors to the basement of a Hawaii museum was returned Thursday to Alaska tribal members. More >>", "external_links": [], "published": "2015-10-23T01:04:00.000+03:00", "crawled": "2015-10-23T01:34:01.422+03:00", "highlightTitle": ""}