{"organizations": ["Seattle Seahawks Facebook Email Twitter Google", "NFL", "Seattle Seahawks", "Seahawks", "KING"], "uuid": "395dae1451c597a0491346ccea295b7c6109d063", "thread": {"social": {"gplus": {"shares": 0}, "pinterest": {"shares": 0}, "vk": {"shares": 0}, "linkedin": {"shares": 0}, "facebook": {"likes": 0, "shares": 0, "comments": 0}, "stumbledupon": {"shares": 0}}, "site_full": "www.king5.com", "main_image": "http://cdn.tegna-tv.com/-mm-/de4aece576d2b19271081952179f0d744f421782/c=0-0-4147-2343&amp;r=x1683&amp;c=3200x1680/local/-/media/2015/10/02/NWGroup/KING/635793842929084323-USATSI-8829890.jpg", "site_section": "http://rssfeeds.nwcn.com/_/20/110117256/nwcn/sports", "section_title": "NWCN - Sports", "url": "http://www.king5.com/story/sports/nfl/seahawks/2015/10/14/thomas-rawls-journey-flint-mich-seattle-seahawks/73949696/", "country": "US", "title": "Thomas Rawls' journey from Flint, Mich., to Seattle Seahawks", "performance_score": 0, "site": "king5.com", "participants_count": 0, "title_full": "Thomas Rawls' journey from Flint, Mich., to Seattle Seahawks", "spam_score": 0.0, "site_type": "news", "published": "2015-10-15T00:27:00.000+03:00", "replies_count": 0, "uuid": "395dae1451c597a0491346ccea295b7c6109d063"}, "author": "", "url": "http://www.king5.com/story/sports/nfl/seahawks/2015/10/14/thomas-rawls-journey-flint-mich-seattle-seahawks/73949696/", "ord_in_thread": 0, "title": "Thomas Rawls' journey from Flint, Mich., to Seattle Seahawks", "locations": ["Mich.", "USA", "WA", "Seattle", "Chicago", "Michigan", "Flint"], "entities": {"persons": [], "locations": [], "organizations": []}, "highlightText": "", "language": "english", "persons": ["Troy Wayrynen", "Fred Jackson", "Thomas Rawls Sr.", "Thomas Rawls", "Paul Silvi", "Sam Acho", "Rawls"], "text": "Facebook Email Twitter Google+ LinkedIn Pinterest Thomas Rawls' journey from Flint, Mich., to Seattle Seahawks Thomas Rawls grew up in one of the roughest neighborhoods in Flint, Michigan, on East Foss Avenue. Paul Silvi talk to his father Thomas Rawls Sr., his grandmother and his high school coach Fred Jackson about Rawls' journey to the NFL. Post to Facebook Thomas Rawls' journey from Flint, Mich., to Seattle Seahawks Thomas Rawls grew up in one of the roughest neighborhoods in Flint, Michigan, on East Foss Avenue. Paul Silvi talk to his father Thomas Rawls Sr., his grandmother and his high school coach Fred Jackson about Rawls' journey to the NFL.  //www.king5.com/story/sports/nfl/seahawks/2015/10/14/thomas-rawls-journey-flint-mich-seattle-seahawks/73949696/   Join the Conversation To   Thomas Rawls' journey from Flint, Mich., to Seattle Seahawks Paul Silvi reports. KING Paul Silvi, KING 5 Sports 2:27 p.m. PDT October 14, 2015 Sep 27, 2015; Seattle, WA, USA; Seattle Seahawks running back Thomas Rawls (34) breaks away from Chicago Bears linebacker Sam Acho (49) during the third quarter at CenturyLink Field. The Seahawks won 26-0. (Photo: Troy Wayrynen, USA TODAY Sports) CONNECT TWEET LINKEDIN COMMENT EMAIL MORE \nThomas Rawls grew up in one of the roughest neighborhoods in Flint, Michigan, on East Foss Avenue. Paul Silvi talk to his father Thomas Rawls Sr., his grandmother and his high school coach Fred Jackson about Rawls' journey to the NFL. Read or Share this story: http://www.king5.com/story/sports/nfl/seahawks/2015/10/14/thomas-rawls-journey-flint-mich-seattle-seahawks/73949696/ TOP VIDEOS", "external_links": [], "published": "2015-10-15T00:27:00.000+03:00", "crawled": "2015-10-15T00:38:06.541+03:00", "highlightTitle": ""}