{"organizations": ["UCLA", "Penn State", "NCAA", "Sotheby", "Oklahoma State University", "Clemson", "AP", "Western Kentucky", "NCAA College"], "uuid": "d56bd14d451d0fac90cdba87f4d57c7c8d96ae98", "thread": {"social": {"gplus": {"shares": 0}, "pinterest": {"shares": 0}, "vk": {"shares": 0}, "linkedin": {"shares": 0}, "facebook": {"likes": 0, "shares": 0, "comments": 0}, "stumbledupon": {"shares": 0}}, "site_full": "www.swxrightnow.com", "main_image": "http://images.worldnow.com/AP/images/9097196_G.jpg", "site_section": "http://www.swxrightnow.com/category/192801/central-washington?clienttype=rss", "section_title": "Sports and Weather Right Now - Central Washington", "url": "http://www.swxrightnow.com/story/30346526/stat-watch-lynch-shining-in-spotlight-for-no-16-memphis", "country": "US", "title": "Stat Watch: Lynch shining in spotlight for No. 16 Memphis", "performance_score": 0, "site": "swxrightnow.com", "participants_count": 0, "title_full": "Stat Watch: Lynch shining in spotlight for No. 16 Memphis", "spam_score": 0.0, "site_type": "news", "published": "2015-10-26T09:29:00.000+02:00", "replies_count": 0, "uuid": "d56bd14d451d0fac90cdba87f4d57c7c8d96ae98"}, "author": "", "url": "http://www.swxrightnow.com/story/30346526/stat-watch-lynch-shining-in-spotlight-for-no-16-memphis", "ord_in_thread": 0, "title": "Stat Watch: Lynch shining in spotlight for No. 16 Memphis", "locations": ["Fla", "Miami Gardens", "Florida", "Baton Rouge", "California", "Cincinnati", "Tulsa", "Calif.", "Orange County", "Austin", "Maryland", "Memphis", "Nevada", "La", "Ohio", "Miami", "Okla.", "Palm Springs", "Staten Island", "Spokane", "New York City", "Oklahoma", "WA", "Tri-Cities", "Pasadena"], "entities": {"persons": [], "locations": [], "organizations": []}, "highlightText": "", "language": "english", "persons": ["Austin Johnson", "Taubman", "Joe Biden", "Carl Nassib", "Garrett Sickels", "Paxton Lynch", "Nick Holt", "Michael", "Kim Phuc", "Dabo Swinney", "Arnold Klein", "Josh Rosen", "A. Alfred Taubman", "Leonard Fournette", "Sotheby", "Michael Jackson", "Jason Cabinda", "Biden"], "text": "Stat Watch: Lynch shining in spotlight for No. 16 Memphis - SWX Right Now-Sports for Spokane, CdA, Tri-Cities, WA Member Center: NBC Right Now Stat Watch: Lynch shining in spotlight for No. 16 Memphis (AP Photo/Sue Ogrocki). Memphis quarterback Paxton Lynch (12) passes in the first quarter of an NCAA college football game against Tulsa in Tulsa, Okla., Friday, Oct. 23, 2015. (Michael Goulding/The Orange County Register via AP). UCLA quarterback Josh Rosen looks for a receiver during the second half against California in an NCAA college football game Thursday, Oct. 22, 2015, in Pasadena, Calif. (Austin Anthony/Daily News via AP). LSU running back Leonard Fournette (7) pushes against Western Kentucky linebacker Nick Holt (10) during an NCAA college football game Saturday, Oct. 24, 2015, in Baton Rouge, La. MANDATORY CREDIT (AP Photo/Patrick Semansky). Penn State defensive end Carl Nassib, left, linebacker Jason Cabinda (40) and defensive tackle Austin Johnson (99) celebrate with teammate Garrett Sickels, second from left, after he intercepted a pass attempt by Maryland q... (AP Photo/Wilfredo Lee). Clemson head coach Dabo Swinney argues a call during the first half of an NCAA College football game, Saturday, Oct. 24, 2015 in Miami Gardens, Fla. No. 6 Clemson handed Miami its worst defeat in the program's 90-year history S... Woman faces 2nd-degree murder charges in Oklahoma crash A 25-year-old woman accused of driving a car into a crowd of people at an Oklahoma State University homecoming parade over the weekend, killing four people and injuring dozens of others, is set to make her first... More >> A 25-year-old woman accused of driving a car into a crowd of people at an Oklahoma State University homecoming parade over the weekend, killing four people and injuring dozens of others, is set to make her first court... More >> Sotheby's exhibits huge Taubman collection prior to sales A. Alfred Taubman, the late billionaire developer and former owner of Sotheby's auction house, was a boundless art collector whose taste spanned every period, genre and medium, from works of antiquity to... More >> A. Alfred Taubman, the late billionaire developer and former owner of Sotheby's auction house, was a boundless art collector whose taste spanned every period, genre and medium, from works of antiquity to contemporary art. More >> Dermatologist for Michael Jackson, other stars, dies Dr. Arnold Klein, dermatologist to the late Michael Jackson and other Hollywood celebrities, has died in Palm Springs, California. More >> Dr. Arnold Klein once said, \"Put me next to a patient, give me a needle and I'm really happy.\" More >> Florida ends bear hunt after 2nd day; limit nearly reached After just two days, Florida ended its controversial black bear hunt because a higher than expected number of bears had been killed. More >> After just two days, Florida ended its controversial black bear hunt because a higher than expected number of bears had been killed. More >> Radioactive dump that burned in Nevada had past troubles The operator of a closed radioactive waste dump that caught fire in southern Nevada had trouble over the years with leaky shipments and oversight so lax that employees took contaminated tools and building materials... More >> The operator of a closed radioactive waste dump that caught fire in southern Nevada had trouble over the years with leaky shipments and oversight so lax that employees took contaminated tools and building materials home,... More >> In NY, race for prosecutor job spotlighted in chokehold case Elections for top prosecutor in New York City's smallest borough are usually highly local matters. But this year, candidates for Staten Island district attorney are running for an office that got national... More >> Elections for top prosecutor in New York City's smallest borough are usually highly local matters. But this year, candidates for Staten Island district attorney are running for an office that got national scrutiny over... More >> Lasers may ease pain for 'napalm girl' in AP photograph In the photograph that made Kim Phuc a living symbol of the Vietnam War, her burns aren't visible - only her agony as she runs wailing toward the camera, her arms flung away from her body, naked because she has... More >> In the photograph that made Kim Phuc a living symbol of the Vietnam War, her burns aren't visible - only her agony as she runs wailing toward the camera, her arms flung away from her body, naked because she has ripped... More >> Ohio cases highlight online targeting, 'sextortion' of teens Three federal cyberstalking cases that surfaced within a few days of each other in the Cincinnati area have underscored widening challenges in protecting susceptible youths from wily predators. More >> Three federal cyberstalking cases that surfaced within a few days of each other in the Cincinnati area have underscored widening challenges in protecting susceptible youths from wily predators. More >> Study: Kids take 100-plus required tests through 12th grade Students, parents and teachers have long lamented the hours that kids spend taking standardized tests, especially since the introduction of the Common Core academic standards. But just how much time each year? More >> Students, parents and teachers have long lamented the hours that kids spend taking standardized tests, especially since the introduction of the Common Core academic standards. But just how much time each year? More >> Biden opted out on 2016 Dem race because he 'couldn't win' Vice President Joe Biden says he decided against running for president because he \"couldn't win,\" not because he would have had too little time to get a campaign up and running. More >> Vice President Joe Biden says he decided against running for president because he \"couldn't win,\" not because he would have had too little time to get a campaign up and running. More >>", "external_links": [], "published": "2015-10-26T09:29:00.000+02:00", "crawled": "2015-10-26T13:32:33.763+02:00", "highlightTitle": ""}