{"organizations": ["Louisville Cardinals", "Associated Press", "Facebook Calipari", "Facebook Email Twitter Google", "Kentucky", "KFC"], "uuid": "e59b9f21bab2dca5516caba6a558c44e4b12de8a", "thread": {"social": {"gplus": {"shares": 0}, "pinterest": {"shares": 0}, "vk": {"shares": 0}, "linkedin": {"shares": 0}, "facebook": {"likes": 0, "shares": 0, "comments": 0}, "stumbledupon": {"shares": 0}}, "site_full": "www.wcnc.com", "main_image": "http://cdn.tegna-tv.com/-mm-/3615c199f7c7d35056a22f37ffacbe578ffcb96c/c=0-147-2610-1621&amp;r=x633&amp;c=1200x630/local/-/media/2015/10/14/WCNC/WCNC/635804253171147121-USATSI-8840450.jpg", "site_section": "http://rssfeeds.wcnc.com/_/20/109971664/wcnc/sports", "section_title": "WCNC - Sports", "url": "http://www.wcnc.com/story/sports/2015/10/14/calipari-doesnt-think-pitino-knew-about-escort-allegations/73929982/", "country": "US", "title": "Calipari doesn't think Pitino knew about escort allegations", "performance_score": 0, "site": "wcnc.com", "participants_count": 0, "title_full": "Calipari doesn't think Pitino knew about escort allegations", "spam_score": 0.0, "site_type": "news", "published": "2015-10-14T20:15:00.000+03:00", "replies_count": 0, "uuid": "e59b9f21bab2dca5516caba6a558c44e4b12de8a"}, "author": "", "url": "http://www.wcnc.com/story/sports/2015/10/14/calipari-doesnt-think-pitino-knew-about-escort-allegations/73929982/", "ord_in_thread": 0, "title": "Calipari doesn't think Pitino knew about escort allegations", "locations": ["USA", "Louisville", "KY"], "entities": {"persons": [], "locations": [], "organizations": []}, "highlightText": "", "language": "english", "persons": ["Calipari", "Jamie Rhodes", "Rick Pitino", "Jamie", "Pitino", "Jamie Rhodes-USA", "John Calipari"], "text": "Facebook Email Twitter Google+ LinkedIn Pinterest Calipari doesn't think Pitino knew about escort allegations Kentucky coach John Calipari says if any of an escort's allegations that a former Louisville men's basketball staff member hired strippers are true, \"it's not good for college basketball.\" Post to Facebook Calipari doesn't think Pitino knew about escort allegations Kentucky coach John Calipari says if any of an escort's allegations that a former Louisville men's basketball staff member hired strippers are true, \"it's not good for college basketball.\"   WCNC.com: http://www.wcnc.com/story/sports/2015/10/14/calipari-doesnt-think-pitino-knew-about-escort-allegations/73929982/   Join the Conversation To   Calipari doesn't think Pitino knew about escort allegations Associated Press, AP 1:15 p.m. EDT October 14, 2015 Oct 3, 2015; Louisville, KY, USA; Louisville Cardinals head coach Rick Pitino watches his team's scrimmage at KFC YUM! Center. Mandatory Credit: Jamie Rhodes-USA TODAY Sports (Photo: Jamie Rhodes, Jamie Rhodes-USA TODAY Sports) CONNECT TWEET LINKEDIN COMMENT EMAIL MORE \nLEXINGTON, Ky. (AP) - Kentucky coach John Calipari says if any of an escort's allegations that a former Louisville men's basketball staff member hired strippers are true, \"it's not good for college basketball.\" \nCalipari added that he hopes the allegations \"aren't true\" and \"can't believe\" Rick Cardinals coach Rick Pitino \"would know anything about it.\" \nCalipari said during the Wildcats' annual media day Tuesday that he hasn't reached out to his in-state counterpart and fellow Hall of Famer about allegations in Katina Powell's book, \"Breaking Cardinal Rules: Basketball and the Escort Queen.\" \nPowell alleges former Louisville staff member Andre McGee paid her and other dancers to strip and have sex with recruits and players. \nPitino has denied knowledge of the activities in the book. Four separate investigations have been launched to review the allegations. Read or Share this story: http://www.wcnc.com/story/sports/2015/10/14/calipari-doesnt-think-pitino-knew-about-escort-allegations/73929982/ TOP VIDEOS", "external_links": [], "published": "2015-10-14T20:15:00.000+03:00", "crawled": "2015-10-14T20:28:20.418+03:00", "highlightTitle": ""}