{"organizations": ["Muscatine City High", "Muscatine", "City High's Brock Hunger", "Brock Hunger", "Little Hawks", "Vance Dillon", "City High"], "uuid": "09043bea0c780bfe4bf8c334ba275410cdfbf592", "thread": {"social": {"gplus": {"shares": 0}, "pinterest": {"shares": 0}, "vk": {"shares": 0}, "linkedin": {"shares": 0}, "facebook": {"likes": 0, "shares": 0, "comments": 0}, "stumbledupon": {"shares": 0}}, "site_full": "www.press-citizen.com", "main_image": "http://www.gannett-cdn.com/-mm-/f52eaa8df9c9efdd2efe9439b12c6394aa40f87e/c=0-125-2400-1475&amp;r=x633&amp;c=1200x630/local/-/media/2015/10/24/IowaCity/B9319397945Z.1_20151024005050_000_GIPCBETS3.1-0.jpg", "site_section": "http://rssfeeds.press-citizen.com/iowacity/sports", "section_title": "Iowa City - Sports", "url": "http://www.press-citizen.com/story/sports/high-school/2015/10/24/iowa-city-high-muscatine-prep-football/74517416/", "country": "US", "title": "City High makes a stand in win vs. Muscatine", "performance_score": 0, "site": "press-citizen.com", "participants_count": 0, "title_full": "City High makes a stand in win vs. Muscatine", "spam_score": 0.0, "site_type": "news", "published": "2015-10-24T07:53:00.000+03:00", "replies_count": 0, "uuid": "09043bea0c780bfe4bf8c334ba275410cdfbf592"}, "author": "", "url": "http://www.press-citizen.com/story/sports/high-school/2015/10/24/iowa-city-high-muscatine-prep-football/74517416/", "ord_in_thread": 0, "title": "City High makes a stand in win vs. Muscatine", "locations": ["Jordain Buckland", "Muscatine", "Iowa City"], "entities": {"persons": [], "locations": [], "organizations": []}, "highlightText": "", "language": "english", "persons": ["David Summers", "Rodney", "Will Noack", "Alphonso Soko", "Nathan Waikel", "Vance Dillon", "Jason Jones", "Jared Taylor", "Luke Wichers", "David Scrivner", "Patrick Henkhaus", "Gabe Pardekooper", "Muscatine Richard Lewis", "Bryce Frantz"], "text": "City High makes a stand in win vs. Muscatine Richard Lewis, For the Press-Citizen 11:53 p.m. CDT October 23, 2015 Buy Photo City High's Patrick Henkhaus (51) and Nathan Waikel (50) smile after beating Muscatine on Friday, Oct. 23, 2015. David Scrivner / Iowa City Press-Citizen Buy Photo Fullscreen Buy Photo City High's Brock Hunger (30) celebrates after catching an onside kick and securing the Little Hawks' win over Muscatine on Friday, Oct. 23, 2015. David Scrivner / Iowa City Press-Citizen Buy Photo Fullscreen Buy Photo City High's Brock Hunger jumps on an onside kick to secure the Little Hawks' win over Muscatine on Friday, Oct. 23, 2015. David Scrivner / Iowa City Press-Citizen Buy Photo Fullscreen Buy Photo City High's Vance Dillon breaks up a pass intended for Muscatine's David Summers during their game in Muscatine on Friday, Oct. 23, 2015. David Scrivner / Iowa City Press-Citizen Buy Photo Fullscreen Buy Photo City High's Bryce Frantz celebrates as he runs in for a touchdown during the Little Hawks' game in Muscatine on Friday, Oct. 23, 2015. David Scrivner / Iowa City Press-Citizen Buy Photo Fullscreen Buy Photo City High quarterback Jared Taylor runs down field during the Little Hawks' game in Muscatine on Friday, Oct. 23, 2015. David Scrivner / Iowa City Press-Citizen Buy Photo Fullscreen Buy Photo City High quarterback Jared Taylor gets sacked during the Little Hawks' game in Muscatine on Friday, Oct. 23, 2015. David Scrivner / Iowa City Press-Citizen Buy Photo Fullscreen Buy Photo City High's Gabe Pardekooper adjusts his helmet during a timeout from the Little Hawks' game in Muscatine on Friday, Oct. 23, 2015. David Scrivner / Iowa City Press-Citizen Buy Photo Fullscreen Buy Photo Muscatine's Alphonso Soko fights off City High's Vance Dillon during their game in Muscatine on Friday, Oct. 23, 2015. David Scrivner / Iowa City Press-Citizen Buy Photo Fullscreen Buy Photo City High's Bryce Frantz runs down field during the Little Hawks' game in Muscatine on Friday, Oct. 23, 2015. David Scrivner / Iowa City Press-Citizen Buy Photo Fullscreen Buy Photo City High's Vance Dillon celebrates his interception during the Little Hawks' game in Muscatine on Friday, Oct. 23, 2015. David Scrivner / Iowa City Press-Citizen Buy Photo Fullscreen Buy Photo City High's Rajay Rodney celebrates his touchdown during the Little Hawks' game in Muscatine on Friday, Oct. 23, 2015. David Scrivner / Iowa City Press-Citizen Buy Photo Fullscreen Buy Photo City High's Jason Jones pulls in a catch in the end zone during the Little Hawks' game in Muscatine on Friday, Oct. 23, 2015. David Scrivner / Iowa City Press-Citizen Buy Photo Fullscreen Buy Photo City High's Will Noack runs in for a touchdown during the Little Hawks' game in Muscatine on Friday, Oct. 23, 2015. David Scrivner / Iowa City Press-Citizen Buy Photo Fullscreen Buy Photo City High's Jason Jones celebrates his touchdown during Little Hawks' game in Muscatine on Friday, Oct. 23, 2015. David Scrivner / Iowa City Press-Citizen Buy Photo Fullscreen Buy Photo City High's Bryce Frantz gets tackled during the Little Hawks' game in Muscatine on Friday, Oct. 23, 2015. David Scrivner / Iowa City Press-Citizen Buy Photo Fullscreen Buy Photo City High's Jason Jones pulls in a catch in the end zone during the Little Hawks' game in Muscatine on Friday, Oct. 23, 2015. David Scrivner / Iowa City Press-Citizen Buy Photo Fullscreen Buy Photo City High's Jason Jones runs down field during the Little Hawks' game in Muscatine on Friday, Oct. 23, 2015. David Scrivner / Iowa City Press-Citizen Buy Photo Fullscreen Buy Photo City High's Bryce Frantz runs down field during the Little Hawks' game in Muscatine on Friday, Oct. 23, 2015. David Scrivner / Iowa City Press-Citizen Buy Photo Fullscreen Buy Photo City High's Jason Jones reaches out for a deep pass during the Little Hawks' game in Muscatine on Friday, Oct. 23, 2015. David Scrivner / Iowa City Press-Citizen Fullscreen Buy Photo City High players celebrate after Vance Dillon's interception during their game in Muscatine on Friday, Oct. 23, 2015. David Scrivner / Iowa City Press-Citizen Buy Photo Fullscreen Buy Photo City High's Vance Dillon picks off a pass during the Little Hawks' game in Muscatine on Friday, Oct. 23, 2015. David Scrivner / Iowa City Press-Citizen Buy Photo Fullscreen Buy Photo Muscatine's Alphonso Soko evades City High's Brock Hunger during their game in Muscatine on Friday, Oct. 23, 2015. David Scrivner / Iowa City Press-Citizen Buy Photo Fullscreen Buy Photo City High's Bryce Frantz gets tackled during the Little Hawks' game in Muscatine on Friday, Oct. 23, 2015. David Scrivner / Iowa City Press-Citizen Buy Photo Fullscreen Buy Photo City High's Jason Jones chases down Muscatine's Alphonso Soko during their game in Muscatine on Friday, Oct. 23, 2015. David Scrivner / Iowa City Press-Citizen Buy Photo Fullscreen Buy Photo Muscatine's Luke Wichers gets brought down by City High defenders during their game in Muscatine on Friday, Oct. 23, 2015. David Scrivner / Iowa City Press-Citizen Buy Photo Fullscreen Buy Photo City High and Muscatine players scramble for a fumble during their game in Muscatine on Friday, Oct. 23, 2015. David Scrivner / Iowa City Press-Citizen Buy Photo Fullscreen Buy Photo City High's Jordain Buckland recovers a fumble during the Little Hawks' game in Muscatine on Friday, Oct. 23, 2015. David Scrivner / Iowa City Press-Citizen Buy Photo Like this topic? You may also like these photo galleries: Replay", "external_links": [], "published": "2015-10-24T07:53:00.000+03:00", "crawled": "2015-10-24T16:05:08.113+03:00", "highlightTitle": ""}