{"organizations": ["Walsall", "Colchester"], "uuid": "270dd070b06a5d380b9486e6c219922911e58da6", "thread": {"social": {"gplus": {"shares": 0}, "pinterest": {"shares": 0}, "vk": {"shares": 0}, "linkedin": {"shares": 0}, "facebook": {"likes": 0, "shares": 0, "comments": 0}, "stumbledupon": {"shares": 0}}, "site_full": "www.sport.co.uk", "main_image": "http://images.sport.co.uk/150x150/div2.jpg", "site_section": "http://feeds.feedburner.com/SportcoukNewsRssFeed", "section_title": "General Sports News from Sports.co.uk", "url": "http://www.sport.co.uk/football/colchester-44-walsall-match-report/6984889/", "country": "JE", "title": "Colchester 4-4 Walsall: Match Report", "performance_score": 0, "site": "sport.co.uk", "participants_count": 0, "title_full": "Colchester 4-4 Walsall: Match Report", "spam_score": 0.0, "site_type": "news", "published": "2015-10-24T20:31:00.000+03:00", "replies_count": 0, "uuid": "270dd070b06a5d380b9486e6c219922911e58da6"}, "author": "", "url": "http://www.sport.co.uk/football/colchester-44-walsall-match-report/6984889/", "ord_in_thread": 0, "title": "Colchester 4-4 Walsall: Match Report", "locations": [], "entities": {"persons": [], "locations": [], "organizations": []}, "highlightText": "", "language": "english", "persons": ["Callum Harriott", "Jamie Jones.George Moncur", "Garvan", "Anthony Forde", "Adam Chambers", "Ambrose", "O'Connor", "Romaine Sawyers", "Milan Lalkovic", "Kieron Morris", "Darren Ambrose", "James O'Connor", "Marvin Sordell", "Owen Garvan"], "text": "Colchester 4-4 Walsall: Match Report 24 Oct 2015 17:31:00 James O'Connor secures Walsall a remarkable 4-4 draw at ColchesterJames O'Connor's stoppage-time equaliser secured Walsall a thrilling 4-4 draw with Colchester following a remarkable encounter.Walsall took an 11th-minute lead through Romaine Sawyers, who fired low into the far corner from Anthony Forde's pass.It was 2-0 on the half-hour mark when Milan Lalkovic seized on Adam Chambers' pass and fired a deflected shot past the helpless Jamie Jones.George Moncur reduced the deficit for Colchester three minutes after the break with a curled effort from the edge of the area from Darren Ambrose's pass.And Colchester equalised three minutes later when Marvin Sordell slotted in Ambrose's low cross, following Owen Garvan's pass.Evans restored Walsall's lead five minutes later when he converted Adam Chambers' cut-back, but Garvan's superb 25-yard half-volley made it 3-3 after a corner had only been partially cleared.Ambrose tapped in Callum Harriott's low cross with 11 minutes remaining for 4-3, but O'Connor dramatically levelled after meeting a pass from Kieron Morris, who hit the bar late on as a thrilling game finished all square. Related Sport News", "external_links": [], "published": "2015-10-24T20:31:00.000+03:00", "crawled": "2015-10-25T20:21:00.256+02:00", "highlightTitle": ""}