{"organizations": ["Derby Telegraph", "Election Commission", "Huffington Post", "Burton Mail", "Inc", "Grimsby Telegraph", "Hemswell Lane", "CSX", "Derby Telegraph Florida Fish and Wildlife Conservation Commission"], "uuid": "86fed465e4596dd7dfaa4cbb3d6c50a3521d8dc5", "thread": {"social": {"gplus": {"shares": 0}, "pinterest": {"shares": 0}, "vk": {"shares": 0}, "linkedin": {"shares": 0}, "facebook": {"likes": 0, "shares": 0, "comments": 0}, "stumbledupon": {"shares": 0}}, "site_full": "www.onenewspage.com", "main_image": "http://cdn.newsserve.net/ONPglobe256.jpg", "site_section": "http://www.onenewspage.com/rss/latest/Sports.rss", "section_title": "Latest Sports News on One News Page", "url": "http://www.onenewspage.com/n/Sports/7559xeyxz/After-injury-Rolle-thought-his-foot-would-be.htm", "country": "US", "title": "After injury, Rolle thought his foot would be 'facing the other way'", "performance_score": 0, "site": "onenewspage.com", "participants_count": 0, "title_full": "After injury, Rolle thought his foot would be 'facing the other way'", "spam_score": 0.0, "site_type": "news", "published": "2015-10-05T17:26:00.000+03:00", "replies_count": 0, "uuid": "86fed465e4596dd7dfaa4cbb3d6c50a3521d8dc5"}, "author": "", "url": "http://www.onenewspage.com/n/Sports/7559xeyxz/After-injury-Rolle-thought-his-foot-would-be.htm", "ord_in_thread": 0, "title": "After injury, Rolle thought his foot would be 'facing the other way'", "locations": ["US", "Bihar", "SeattlePI.com", "UK", "Caenby Corner", "India"], "entities": {"persons": [], "locations": [], "organizations": []}, "highlightText": "", "language": "english", "persons": ["James Bond", "Daniel Craig", "Stratos", "Rolle", "John Rampton", "Yohan Cabaye", "Alan Pardew", "Mathew Pipes", "John C. Cook"], "text": "After injury, Rolle thought his foot would be 'facing the other way' Monday, 5 October 2015 (3 minutes ago) After injury, Rolle thought his foot would be 'facing the other way' PALACE boss Alan Pardew admitted the club had to break their wage structure to bring Yohan Cabaye to the club this summer.After an outstanding display against... Croydon Advertiser 4 hours ago - Sport A motorcyclist in his 50s died after a collision on the A631 near Caenby Corner on Sunday.The collision happened just before midday on the A631 Hemswell Lane,... Grimsby Telegraph 5 hours ago - UK *Banka (Bihar), Oct. 2 (ANI): Addressing his first rally in Bihar after the Election Commission's declaration of the five-phased elections, Prime Minister... ANI News 3 days ago - India Amidst speculations of who will be the next 007 agent, actor Daniel Craig says he has \"no honest\" answer whether he would be continuing his role as James Bond in... DNA 3 days ago - Front Page A MOTORIST who swerved his car towards a man knocking him to the ground has been banned from driving for a year.Matthew Pipes' victim suffered \"bumps and... Derby Telegraph 3 days ago - UK A MOTORIST who swerved towards a man he had earlier assaulted knocking him to the ground has been banned from driving for a year. Mathew Pipes, 27, directed his... Burton Mail 3 days ago - UK Also reported by â€¢ Derby Telegraph Florida Fish and Wildlife Conservation Commission officials say John C. Cook, 28, was trying to go under a CSX railroad trestle on his 18-foot Stratos boat when... SeattlePI.com 4 days ago - US Recently, I was honored to have the chance to chat with John Rampton, an entrepreneur, investor and columnist for Inc. Magazine who did a profile of me for the... Huffington Post 4 days ago - Business You Might Like Other recent news in Sports", "external_links": [], "published": "2015-10-05T17:26:00.000+03:00", "crawled": "2015-10-05T17:29:17.952+03:00", "highlightTitle": ""}