{"organizations": ["Coast Guard", "Eau Claire", "Drug   Auto   Coast Guard", "Sandy Hook Elementary School"], "uuid": "920b4444150f4632a045a295733c554584c7cadf", "thread": {"social": {"gplus": {"shares": 0}, "pinterest": {"shares": 0}, "vk": {"shares": 0}, "linkedin": {"shares": 0}, "facebook": {"likes": 0, "shares": 0, "comments": 0}, "stumbledupon": {"shares": 0}}, "site_full": "www.wqow.com", "main_image": "", "site_section": "http://www.WQOW.com/Global/category.asp?C=13566&clienttype=rss", "section_title": "WQOW TV News 18 - National Sports - Headline", "url": "http://www.wqow.com/story/30212252/49ers-linebacker-aldon-smith-pleads-not-guilty-to-charges", "country": "US", "title": "49ers linebacker Aldon Smith pleads not guilty to charges", "performance_score": 0, "site": "wqow.com", "participants_count": 0, "title_full": "49ers linebacker Aldon Smith pleads not guilty to charges", "spam_score": 0.0, "site_type": "news", "published": "2015-10-08T05:32:00.000+03:00", "replies_count": 0, "uuid": "920b4444150f4632a045a295733c554584c7cadf"}, "author": "", "url": "http://www.wqow.com/story/30212252/49ers-linebacker-aldon-smith-pleads-not-guilty-to-charges", "ord_in_thread": 0, "title": "49ers linebacker Aldon Smith pleads not guilty to charges", "locations": ["Oregon", "Bahamas", "U.S.", "South Carolina", "Connecticut"], "entities": {"persons": [], "locations": [], "organizations": []}, "highlightText": "", "language": "english", "persons": ["James", "Aldon Smith", "Hurricane Joaquin"], "text": "49ers linebacker Aldon Smith pleads not guilty to charges - WQOW TV: Eau Claire, WI NEWS18 News, Weather, and Sports Member Center:   Drug   Auto   Coast Guard ends search for 33 missing crew members The Coast Guard broke the news to grieving family members Wednesday that it was abandoning the search for the 33 mariners aboard a U.S. container ship that sank last week during Hurricane Joaquin, and investigators... More >> The Coast Guard officially ended its search Wednesday for the missing crew members from a U.S. cargo ship that sank off the Bahamas during Hurricane Joaquin. More >> South Carolina still on edge from floods; 2 die in truck Rivers rose and dams bulged Wednesday as South Carolina faced another anxious day of waiting for the floodwaters to recede, and search teams found the bodies of two people who died after they drove around a... More >> It could take until the weekend for the threat of flooding to ease in storm-tattered South Carolina, where a senator warned of a potential billion-dollar cleanup bill, two more people died in the floodwaters and the... More >> Mother-son bond over guns links Oregon, Connecticut slayings The school shooting in Oregon last week has similarities to a Connecticut elementary school massacre three years ago. More >> The deadly shooting last week at an Oregon community college has an eerie parallel with the massacre at Sandy Hook Elementary School that killed 20 pupils and six adult staff members in 2012. More >> James   3  ", "external_links": [], "published": "2015-10-08T05:32:00.000+03:00", "crawled": "2015-10-08T06:02:25.370+03:00", "highlightTitle": ""}