{"organizations": ["NY Post", "Huffington Post", "Lincolnshire Echo", "Plymouth Herald", "Melon Fashion Group", "Barnet"], "uuid": "a4a8b91ca82211ee680d6ce6bd84468e894879e8", "thread": {"social": {"gplus": {"shares": 0}, "pinterest": {"shares": 0}, "vk": {"shares": 0}, "linkedin": {"shares": 0}, "facebook": {"likes": 0, "shares": 0, "comments": 0}, "stumbledupon": {"shares": 0}}, "site_full": "www.onenewspage.com", "main_image": "http://cdn.newsserve.net/ONPglobe256.jpg", "site_section": "http://www.onenewspage.com/rss/latest/Sports.rss", "section_title": "Latest Sports News on One News Page", "url": "http://www.onenewspage.com/n/Sports/7559x84jm/Meet-the-guy-who-has-been-taking-selfies.htm", "country": "US", "title": "Meet the guy who has been taking selfies for eight years", "performance_score": 0, "site": "onenewspage.com", "participants_count": 0, "title_full": "Meet the guy who has been taking selfies for eight years", "spam_score": 0.0, "site_type": "news", "published": "2015-10-01T06:50:00.000+03:00", "replies_count": 0, "uuid": "a4a8b91ca82211ee680d6ce6bd84468e894879e8"}, "author": "", "url": "http://www.onenewspage.com/n/Sports/7559x84jm/Meet-the-guy-who-has-been-taking-selfies.htm", "ord_in_thread": 0, "title": "Meet the guy who has been taking selfies for eight years", "locations": ["Montreal", "Lincolnshire", "UK", "Melbourne"], "entities": {"persons": [], "locations": [], "organizations": []}, "highlightText": "", "language": "english", "persons": ["John Kimber", "Hugo", "Peter Hook", "Mikhail Urzhumtsev", "Danny Pintauro", "Hugo Cornellier", "Michael Young"], "text": "Meet the guy who has been taking selfies for eight years Thursday, 1 October 2015 (7 minutes ago) *Melbourne, Oct. 1 (ANI): If you think that you click the highest number of selfies, then you also need to know that there is someone who has been taking selfies every day for the past eight years.* Melbourne, Oct. 1 (ANI): If you think that you click the highest number of selfies, then you also need to know that there is someone who has been taking selfies every day for the past eight years. Hugo Cornellier, a YouTube user, has been documenting his ageing since the age of 12 by taking selfies every day, and his two-minute time-lapse video is a compilation of nearly 3000 self-portraits, reports News.com.au. Talking about his clicks, the 20-year-old Montreal resident said he will keep on taking pictures as long as he is physically able as he carries his laptop where ever he goes. Cornellier further said it all started when his father bought him a time-lapse camera and he decided to document his teen years and ageing process. (ANI) This Guy Has Been Taking a Selfie Every Day for the Last Eight Years 02:12 Hugo Cornellier claims he has been taking selfies since well before they became popular. In fact, this video is his proof. For the last eight years, Hugo has been taking a selfie every single day. This video shows how he has changed from day to day from the ages of 12 to 20. Credit: YouTube/Hugo... Recent related news *East Capital Explorer today announces that Mikhail Urzhumtsev has been appointed CEO of Melon Fashion Group, one of the Company's largest holdings, as of 1... GlobeNewswire 19 hours ago - Press Releases Salad lovers across the globe can rejoice. There is in fact a salad that calls for octopus and it's Spanish. The latest creation from the YouTube... Mashable 20 hours ago - Internet Also reported by • Deccan Herald AN ARGYLE supporter, man and boy, marked 70 years of constant support for his beloved Pilgrims at the game against Barnet yesterday. John Kimber proudly put on... Plymouth Herald 22 hours ago - Sport A 20-year-old from Montreal says he’s been taking selfies before it was cool. Youtube user Hugo Cornellier has been documenting his aging since age 12 by... NY Post 1 day ago - Lifestyle Eight years on from their acrimonious split with Peter Hook, New Order are back with a stonking new album, a new lineup and a newfound joy in the electronic... guardian.co.uk 4 days ago - UK On Saturday night's episode of \"Oprah: Where Are They Now?\", former child star Danny Pintauro revealed that he has been living with a big secret for more than a... Huffington Post 4 days ago - Entertainment A lorry driver who attempted to ruin a Lincolnshire farmer after threatening to poison his crops has been jailed for eight years. Michael Young demanded £50,000... Lincolnshire Echo 6 days ago - UK You Might Like Other recent news in Sports", "external_links": [], "published": "2015-10-01T06:50:00.000+03:00", "crawled": "2015-10-01T06:57:26.018+03:00", "highlightTitle": ""}