{"organizations": ["Westgate Resorts", "Westgate Myrtle Beach Oceanfront Resort", "Westgate Branson Woods Resort", "Westgate Painted Mountain Golf Resort", "Westgate Las Vegas Resort & Casino", "Westgate Park City Resort & Spa", "Westgate Smoky Mountain Resort", "Westgate Marketplace & Deli", "Westgate Lakes Resort & Spa", "Westgate Smokehouse Grill", "Drafts Sports Bar & Grill"], "uuid": "c0fe48298ec0ba7cafb1bf2cfe6d08b8d162e88f", "thread": {"social": {"gplus": {"shares": 0}, "pinterest": {"shares": 0}, "vk": {"shares": 0}, "linkedin": {"shares": 0}, "facebook": {"likes": 0, "shares": 0, "comments": 0}, "stumbledupon": {"shares": 0}}, "site_full": "www.thestreet.com", "main_image": "http://s.thestreet.com/files/tsc/v2008/photos/all-pics/misc/m-z/newspapers-front-lead3.jpg", "site_section": "http://www.thestreet.com/feeds/rss/search.html?topicSearch=Travel&puc=relatedtopic", "section_title": "TheStreet Search RSS Feed: Travel", "url": "http://www.thestreet.com/story/13328980/1/westgate-resorts-celebrates-movie-history-by-turning-back-time-with-back-to-1985-offer.html?cm_ven=RSSFeed", "country": "US", "title": "Westgate Resorts Celebrates Movie History By Turning Back Time With Back To 1985 Offer", "performance_score": 0, "site": "thestreet.com", "participants_count": 0, "title_full": "Westgate Resorts Celebrates Movie History By Turning Back Time With Back To 1985 Offer", "spam_score": 0.0, "site_type": "news", "published": "2015-10-19T19:08:00.000+03:00", "replies_count": 0, "uuid": "c0fe48298ec0ba7cafb1bf2cfe6d08b8d162e88f"}, "author": "", "url": "http://www.thestreet.com/story/13328980/1/westgate-resorts-celebrates-movie-history-by-turning-back-time-with-back-to-1985-offer.html?cm_ven=RSSFeed", "ord_in_thread": 0, "title": "Westgate Resorts Celebrates Movie History By Turning Back Time With Back To 1985 Offer", "locations": ["United States", "Ariz.", "South Carolina", "Missouri", "Mo.", "Orlando", "Florida", "ORLANDO", "Tunica", "Mesa", "Tennessee", "Nevada", "Tenn.", "Las Vegas", "Miami", "S.C.", "Virginia", "Westgate River Ranch", "Mississippi", "Myrtle Beach", "Park City", "Fla.", "Arizona", "River Ranch", "Utah", "Williamsburg", "Gatlinburg"], "entities": {"persons": [], "locations": [], "organizations": []}, "highlightText": "", "language": "english", "persons": ["David A. Siegel", "Westgate", "Branson"], "text": "Westgate Resorts Celebrates Movie History By Turning Back Time With Back To 1985 Offer By PR Newswire | 10/19/15 - 12:08 PM EDT Reprint ORLANDO, Fla. , Oct. 19, 2015 /PRNewswire/ -- Movie buffs take note: with Oct. 21, 2015 marking a significant day in movie and pop culture history, Westgate Resorts is taking guests back in time 30 years with room rates from that famous year, 1985. On Oct. 21 , in celebration of time traveling Deloreans, power laces and plutonium, the Back to 1985 offer will give guests the chance to book stays for the price of rooms in 1985 at any of its 23 properties nationwide. Special offers include rates as low as $29 at Westgate Las Vegas Resort & Casino, $64 at Westgate Lakes Resort & Spa in Orlando, Fla. and $91 at Westgate Park City Resort & Spa in Park City, Utah , for travel dates through Feb. 29, 2016 . Other properties include Westgate Smoky Mountain Resort ( Gatlinburg, Tenn. ), Westgate Myrtle Beach Oceanfront Resort ( Myrtle Beach, S.C. ), Westgate Painted Mountain Golf Resort ( Mesa, Ariz. ), Westgate Branson Woods Resort ( Branson, Mo. ) and Westgate River Ranch ( River Ranch, Fla. ). For more information, or to book, visit www.westgate1985.com or call (800) 404-6410, but guests should act quickly - prices will revert back to the future on Oct. 22 . About Westgate Resorts Founded in 1980 by David A. Siegel , Westgate Resorts is one of the largest resort developers in the United States . Westgate features 28 themed destination resorts with over 13,000 luxury villas in premier locations throughout the United States such as Orlando, Florida ; Park City, Utah ; Las Vegas, Nevada ; Gatlinburg, Tennessee ; Myrtle Beach, South Carolina ; Williamsburg, Virginia ; Miami, Florida ; Branson, Missouri ; Mesa, Arizona ; and Tunica, Mississippi . Most Westgate Resorts locations feature a variety of unique restaurant, retail and spa concepts, including Drafts Sports Bar & Grill, Westgate Smokehouse Grill, Edge Steakhouse, Westgate Marketplace & Deli, and Serenity Spa by Westgate. For more information about Westgate Resorts, visit www.westgateresorts.com .", "external_links": [], "published": "2015-10-19T19:08:00.000+03:00", "crawled": "2015-10-19T19:25:39.044+03:00", "highlightTitle": ""}