{"organizations": ["Bangkok Airways Call Center", "Bangkok Airways", "Bangkok Airways Public Company Limited", "Hat Yai Bangkok Airways", "Bangkok Airways PCL"], "uuid": "cbc2ce6fdde4cde36a2364b7145c1dd6f929971d", "thread": {"social": {"gplus": {"shares": 0}, "pinterest": {"shares": 0}, "vk": {"shares": 0}, "linkedin": {"shares": 0}, "facebook": {"likes": 0, "shares": 0, "comments": 0}, "stumbledupon": {"shares": 0}}, "site_full": "www.nationmultimedia.com", "main_image": "http://www.nationmultimedia.com/new/2015/10/15/travel/images/30270942-01_big.jpg", "site_section": "http://www.nationmultimedia.com/home/rss/travel.rss", "section_title": "NationMultimedia.com - Travel", "url": "http://www.nationmultimedia.com/travel/Bangkok-Airways-to-connect-Phutket-and-Hat-Yai-30270942.html", "country": "TH", "title": "Bangkok Airways to connect Phutket and Hat Yai", "performance_score": 0, "site": "nationmultimedia.com", "participants_count": 0, "title_full": "Bangkok Airways to connect Phutket and Hat Yai", "spam_score": 0.0, "site_type": "news", "published": "2015-10-15T06:12:00.000+03:00", "replies_count": 0, "uuid": "cbc2ce6fdde4cde36a2364b7145c1dd6f929971d"}, "author": "", "url": "http://www.nationmultimedia.com/travel/Bangkok-Airways-to-connect-Phutket-and-Hat-Yai-30270942.html", "ord_in_thread": 0, "title": "Bangkok Airways to connect Phutket and Hat Yai", "locations": ["Southern Thailand", "Phuket", "Pattaya", "Thailand", "Malaysia", "Singapore"], "entities": {"persons": [], "locations": [], "organizations": []}, "highlightText": "", "language": "english", "persons": ["Chiang Mai", "Samui", "Hat Yai", "Puttipong", "Puttipong Prasarttong-Osoth", "Phutket"], "text": "Home » travel » Bangkok Airways to connect Phutket and Hat Yai Bangkok Airways to connect Phutket and Hat Yai October 15, 2015 10:12 am Bangkok Airways Public Company Limited led by Mr. Puttipong Prasarttong-Osoth, President ,organized the inauguration celebration of airline's new service connecting between Phuket and Hat Yai. The celebration was held at the Theptaro Ballroom of Burisriphu Hotel Hat Yai and was attended by many VIPs, travel agency representatives and local media. Mr. Puttipong Prasarttong-Osoth, President of Bangkok Airways PCL said \"Bangkok Airways foresees the potential of Phuket and Hat Yai as prominent destinations of leisure and business. Phuket is recognized as one of the world's most famous tourist attractions where millions of travelers from all over the world have visited. Hat Yai is a major commercial city of Southern Thailand and a gateway to Malaysia and Singapore. This new service between Phuket and Hat Yai will certainly enhance the growth of tourism and economy due to the convenience and ease of travel.\" \"Bangkok Airways currently operates several routes between Phuket and Thailand's most popular destinations such as Phuket-Bangkok (8 flights daily), Phuket- Chiang Mai (1 flight daily), Phuket- Samui (4 flights daily) and Phuket-U-tapao ( Pattaya ) (1 flight daily). This new direct route will certainly offer a greater choice to our passengers in Hat Yai to be able to connect to Phuket and to other destinations within Bangkok Airways network, which ultimately will drive the tourism industry in both ends,\" Mr. Puttipong added. Bangkok Airways offers daily flight between Phuket and Hat Yai, operated by ATR72-500/600 which consists of 70 economy class seats. From Phuket to Hat Yai, PG298 departs from Phuket at 07.25 hrs arrives Hat Yai at 08.30 hrs and back to Phuket by PG299 departs from Hat Yai at 09.10 hrs arrives Phuket at 10.15 hrs, For more information and reservation, please call Bangkok Airways Call Center at 1771 (24 hrs). Advance web check-in is also available for passengers of Bangkok Airways; interested passengers can simply visit www.bangkokair.com for more details. 209 Viewed", "external_links": [], "published": "2015-10-15T06:12:00.000+03:00", "crawled": "2015-10-15T20:51:21.562+03:00", "highlightTitle": ""}