{"organizations": ["Morocco Royal Air Maroc", "Royal Air Maroc", "Arabian Travel Market Dubai", "Qatar Airways Group", "Corporate Communications", "Hamad International Airport", "Agadir", "Skytrax", "Facebook", "Transport and Logistics", "Boeing", "Jordan", "Qatar Airways", "Best Airline", "Google", "Qatar Airways Cargo"], "uuid": "9077c0a21f432b2695cefb33487c9dc3ac37bbce", "thread": {"social": {"gplus": {"shares": 0}, "pinterest": {"shares": 0}, "vk": {"shares": 0}, "linkedin": {"shares": 0}, "facebook": {"likes": 0, "shares": 0, "comments": 0}, "stumbledupon": {"shares": 0}}, "site_full": "www.zawya.com", "main_image": "http://images.zawya.com/images/ui/img-logo-zawya.png", "site_section": "http://www.zawya.com/rssfeeds/tourism.xml", "section_title": "Zawya.com - Travel & Tourism News", "url": "http://www.zawya.com/story/Royal_Air_Marocs_first_direct_flight_to_Doha-ZAWYA20151022122339/", "country": "AE", "title": "Royal Air Maroc's first direct flight to Doha", "performance_score": 0, "site": "zawya.com", "participants_count": 0, "title_full": "Royal Air Maroc's first direct flight to Doha", "spam_score": 0.0, "site_type": "news", "published": "2015-10-22T16:05:00.000+03:00", "replies_count": 0, "uuid": "9077c0a21f432b2695cefb33487c9dc3ac37bbce"}, "author": "", "url": "http://www.zawya.com/story/Royal_Air_Marocs_first_direct_flight_to_Doha-ZAWYA20151022122339/", "ord_in_thread": 0, "title": "Royal Air Maroc's first direct flight to Doha", "locations": ["Qatar", "Dakar", "Morocco", "Accra", "Doha", "Casablanca", "Marrakech", "Africa", "DOHA", "Asia Pacific", "Asia", "Nouakchott", "Middle East"], "entities": {"persons": [], "locations": [], "organizations": []}, "highlightText": "", "language": "english", "persons": ["Akbar Al Baker", "Aziz Rabbah", "Al Baker", "Driss Benhima"], "text": "Tunisians to be exempted from visa to Jordan 22 October 2015 DOHA, Qatar - Qatar Airways welcomed the flagship carrier of Morocco Royal Air Maroc's first direct flight to Doha, as part of the two airlines' joint business agreement which they signed at the Arabian Travel Market Dubai in May 2015. Qatar Airways Group Chief Executive, His Excellency Mr. Akbar Al Baker joined the Kingdom of Morocco's Minister of Transport and Logistics, His Excellency Mr. Aziz Rabbah, and the Chairman and CEO of Royal Air Maroc, Mr. Driss Benhima to celebrate the commencement of the next phase of the joint business between Qatar Airways and Royal Air Maroc - paving the way for the next stage of cooperation between the two airlines. As part of this new partnership, Royal Air Maroc will operate three flights a week to Doha in conjunction with Qatar Airways. Flights between Qatar and Morocco have now increased from seven to 10 times weekly, operated jointly by Qatar Airways seven times-a-week and by Royal Air Maroc three times-a-week. Both Qatar Airways and Royal Air Maroc will be offering a consistent product with an all Boeing 787 Dreamliner operation between Doha and Casablanca. Speaking at the press conference, Mr. Al Baker said: \"Qatar Airways is delighted and proud to welcome its partner, Royal Air Maroc, to our hub and home, Hamad International Airport in Doha. \"Our new partnership will strengthen both airlines and provide greater options and a seamless network for our passengers between the Middle East and Africa, and beyond. Royal Air Maroc's thrice-weekly service between Casablanca and Doha combines with our own daily flights between the two cities to provide an enhanced operation, while the frequency increase not only supports inbound tourism and trade, but is also an important new link for onward travel in both destinations.\" Chairman and CEO of Royal Air Maroc, Mr. Driss Benhima said the partnership with Qatar Airways is crucial in the history of Royal Air Maroc. \"This joint business allows us to create a bridge between Asia and Africa that will facilitate the movement of passengers in a seamless fashion on the extensive network of Qatar Airways in Asia and the comprehensive network of Royal Air Maroc in Africa,\" he said. His Excellency Mr. Aziz Rabbah, Morocco's Minister of Transport and Logistics who was part of the VIP delegation that came to Doha on Royal Air Maroc's inaugural flight said: \"This partnership enhances the brotherly relations between the State of Qatar and the Kingdom of Morocco in the field of air transport, and will also enhance the cultural, economic and social exchanges between the two countries.\" Qatar Airways' joint business with Royal Air Maroc will offer much broader opportunities for passengers who will benefit from a greater choice of flights and connectivity to destinations such as Marrakech, Agadir, Dakar, Accra or Nouakchott, which will be complemented by frequent flyer benefits such as the ability to earn and redeem Qmiles on flights operated by Royal Air Maroc. This partnership allows both airlines to compete more effectively and share revenue on routes within the joint business, connecting more than 40 African destinations in Royal Air Maroc's network to more than 70 Qatar Airways destinations in the Middle East and Asia Pacific region. This new agreement also allows passengers the possibility of purchasing a single itinerary combining flights on both Royal Air Maroc's and Qatar Airways' global networks, allowing them access to one-stop ticketing and baggage check-in. - Ends - About Qatar Airways: Qatar Airways is one of the fastest growing airlines operating a modern fleet of 166 aircraft to 152 key business and leisure destinations across six continents. The airline has won several awards including being voted by passengers as the Airline of the Year for the third time and Best Airline in the Middle East for the ninth time at the 2015 Skytrax Awards. Qatar Airways is a member of the one world global alliance. The award-winning alliance was named the World's Best Airline Alliance 2015 by Skytrax for the third year running. Qatar Airways was the first Gulf carrier to join global airline alliance, one world, enabling its passengers to benefit from more than 1,000 airports in more than 150 countries, with 14,250 daily departures. Qatar Airways recently launched Oryx One, an enhanced interface for its inflight entertainment system, increasing the number of movies and TV shows on board from 950 to up to 2,000. Passengers flying on Qatar Airways flights served by its B787, A350, A380, A319 and select A330 aircraft can also stay in touch with their friends and family around the world by using the five-star airline's on-board Wifi and GSM service. Qatar Airways Cargo, the world's fifth largest cargo carrier, serves more than 40 exclusive freighter destinations worldwide via its Doha hub and also delivers freight to more than 150 key business and leisure destinations globally on 166 aircraft. The Qatar Airways Cargo fleet now includes six Airbus 330, eight Boeing 777 freighters and one Boeing 747 freighter. For more information, visit our homepage www.qatarairways.com or our sites on Facebook, Twitter, Google+, Instagram, and YouTube. For Qatar Airways corporate images, please click here: www.qatarairways.com/corporateimages For further information contact:Qatar Airways Group, Corporate Communications DepartmentTel: +974 40222072, Fax: +974 40225350", "external_links": [], "published": "2015-10-22T16:05:00.000+03:00", "crawled": "2015-10-22T16:29:45.783+03:00", "highlightTitle": ""}