{"organizations": ["Facebook Huckabee", "Family Research Council"], "uuid": "e3dbfa4fd33dbf6f75934b2d7d6756dc38cb1065", "thread": {"social": {"gplus": {"shares": 0}, "pinterest": {"shares": 0}, "vk": {"shares": 0}, "linkedin": {"shares": 0}, "facebook": {"likes": 0, "shares": 0, "comments": 0}, "stumbledupon": {"shares": 0}}, "site_full": "www.wcnc.com", "main_image": "http://cdn.tegna-tv.com/-mm-/cd99460b0ac4b246a7739ec00e19f3aa3ef01772/c=0-61-593-396&amp;r=x633&amp;c=1200x630/local/-/media/2015/10/22/WCNC/WCNC/635811087470297122-490032028.jpg", "site_section": "http://rssfeeds.wcnc.com/_/20/105079204/wcnc/politics", "section_title": "WCNC - Politics", "url": "http://www.wcnc.com/story/news/politics/2015/10/22/huckabee-campaigning-across-upstate-south-carolina/74386424/", "country": "US", "title": "Huckabee campaigning across upstate South Carolina", "performance_score": 0, "site": "wcnc.com", "participants_count": 0, "title_full": "Huckabee campaigning across upstate South Carolina", "spam_score": 0.0, "site_type": "news", "published": "2015-10-22T18:06:00.000+03:00", "replies_count": 0, "uuid": "e3dbfa4fd33dbf6f75934b2d7d6756dc38cb1065"}, "author": "", "url": "http://www.wcnc.com/story/news/politics/2015/10/22/huckabee-campaigning-across-upstate-south-carolina/74386424/", "ord_in_thread": 0, "title": "Huckabee campaigning across upstate South Carolina", "locations": ["South Carolina Associated Press", "U.S.", "Washington", "South Carolina Former Arkansas", "South Carolina", "South Carolina Huckabee", "D.C.", "Arkansas"], "entities": {"persons": [], "locations": [], "organizations": []}, "highlightText": "", "language": "english", "persons": ["Mike Huckabee", "Huckabee", "Drew Angerer"], "text": "Huckabee campaigning across upstate South Carolina Former Arkansas Gov. Mike Huckabee is bringing his presidential campaign back to South Carolina this week. Post to Facebook Huckabee campaigning across upstate South Carolina Former Arkansas Gov. Mike Huckabee is bringing his presidential campaign back to South Carolina this week.  //www.wcnc.com/story/news/politics/2015/10/22/huckabee-campaigning-across-upstate-south-carolina/74386424/   Huckabee campaigning across upstate South Carolina Associated Press, AP 11:06 a.m. EDT October 22, 2015 Mike Huckabee, former governor of Arkansas and 2016 Republican presidential candidate, speaks during the Values Voter Summit in Washington, D.C., U.S., on Friday, Sept. 25, 2015. The annual event, organized by the Family Research Council, gives presidential contenders a chance to address a conservative Christian audience in the crowded Republican primary contest. Photographer: Drew Angerer/Bloomberg via Getty Images (Photo: Drew Angerer) CONNECT TWEET   \nANDERSON, S.C. (AP) - Former Arkansas Gov. Mike Huckabee is bringing his presidential campaign back to South Carolina this week. \nOn Thursday, the Republican hopeful starts off in Anderson with a media availability at NewSpring Church. \nLater in the day, he's expected to make a stop at a coffee shop in Greenville. \nThursday evening, Huckabee is taking part in a Big Game Supper at Cherokee Avenue Baptist Church in Gaffney. \nFriday morning, Huckabee meets with supporters at Grapevine Restaurant in Boiling Springs before going to Greenville to participate in a national security forum hosted by Americans for Peace, Prosperity and Security.  //www.wcnc.com/story/news/politics/2015/10/22/huckabee-campaigning-across-upstate-south-carolina/74386424/ TOP VIDEOS", "external_links": [], "published": "2015-10-22T18:06:00.000+03:00", "crawled": "2015-10-22T18:53:16.689+03:00", "highlightTitle": ""}