{"organizations": ["City Council", "AP"], "uuid": "2aa083a00a8da09ddf37b58a4aeb616de5e65674", "thread": {"social": {"gplus": {"shares": 0}, "pinterest": {"shares": 0}, "vk": {"shares": 0}, "linkedin": {"shares": 0}, "facebook": {"likes": 0, "shares": 0, "comments": 0}, "stumbledupon": {"shares": 0}}, "site_full": "www.cbs8.com", "main_image": "http://images.worldnow.com/AP/images/9003228_G.jpg", "site_section": "http://www.cbs8.com/Global/category.asp?clienttype=rss_img&C=154657", "section_title": "KFMB - Politics", "url": "http://www.cbs8.com/story/30245827/turkey-bans-rally-by-activists-mourning-colleagues", "country": "US", "title": "Turkey bans rally by activists mourning colleagues", "performance_score": 0, "site": "cbs8.com", "participants_count": 0, "title_full": "Turkey bans rally by activists mourning colleagues", "spam_score": 0.0, "site_type": "news", "published": "2015-10-13T12:48:00.000+03:00", "replies_count": 0, "uuid": "2aa083a00a8da09ddf37b58a4aeb616de5e65674"}, "author": "", "url": "http://www.cbs8.com/story/30245827/turkey-bans-rally-by-activists-mourning-colleagues", "ord_in_thread": 0, "title": "Turkey bans rally by activists mourning colleagues", "locations": ["Kansas City", "Oregon", "Baltimore", "Oklahoma", "Ankara", "Istanbul", "Milwaukee", "Turkey", "Texas", "Wisconsin", "Gazi district", "Kansas City Two Kansas City"], "entities": {"persons": [], "locations": [], "organizations": []}, "highlightText": "", "language": "english", "persons": ["Clinton", "Hillary Rodham Clinton", "Erdogan", "Freddie Gray"], "text": "RSS Feeds Turkey bans rally by activists mourning colleagues (AP Photo/Cagdas Erdogan). A leftist protester runs from a barricade after protesters set it on fire, during minor clashes with Turkish security forces following a protest against Saturday's Ankara bombing attacks, in Istanbul's Gazi district, Monday, ...   AP Exclusive: Clinton server's software had hacking risk   running in Hillary Rodham Clinton's home basement when she was secretary   hackers, according to data and documents...   Fire official: 2 firefighters killed, 2 hurt in Kansas City Two Kansas City firefighters were killed and two were injured when a burning building collapsed Monday night, a fire official said. Two Kansas City firefighters have been killed and two others injured in the collapse of a burning building in which fire crews saved two people from the spreading flames, authorities said.   Freddie Gray hearing: Baltimore officers statements at issue A judge in Baltimore is holding a hearing to determine the admissibility of statements made to investigators by police officers charged in connection with Freddie Gray's death. A judge in Baltimore is holding a hearing to determine the admissibility of statements made to investigators by police officers charged in connection with Freddie Gray's death. Police defend use of Taser on city official in Texas Police officials in a small, predominantly black Texas college town are defending the decision to use a stun gun on a City Council member when he intervened as officers questioned his friends outside his apartment. Police officials in a small, predominantly black Texas college town are defending the decision to use a stun gun on a City Council member when he intervened as officers questioned his friends outside his apartment. Attorneys make closing cases in trial of Wisconsin gun shop A lawyer for a pair of Milwaukee police officers suing a gun shop for negligence told jurors Monday that the store should have to pay several million dollars in damages for selling a gun that was used to wound his... A lawyer for a pair of Milwaukee police officers suing a gun shop for negligence told jurors Monday that the store should have to pay several million dollars in damages for selling a gun that was used to wound his clients. Students return to Oregon community college after shooting Hundreds of people lined the road leading to the Oregon community college where a gunman killed nine people, holding signs reading \"UCC Strong\" as students returned Monday to the scene of the deadliest shooting in... Hundreds of people lined the road leading to the Oregon community college where a gunman killed nine people, holding signs reading \"UCC Strong\" as students returned Monday to the scene of the deadliest shooting in state... Judge: 16-year-old to be tried as adult in family stabbing A 16-year-old Oklahoma boy will stand trial as an adult in the stabbing deaths of his parents and three siblings, a judge ruled Monday, rejecting a request by defense attorneys to certify him as a juvenile... A 16-year-old Oklahoma boy will stand trial as an adult in the stabbing deaths of his parents and three siblings, a judge ruled Monday, rejecting a request by defense attorneys to certify him as a juvenile delinquent or...", "external_links": [], "published": "2015-10-13T12:48:00.000+03:00", "crawled": "2015-10-13T12:50:55.734+03:00", "highlightTitle": ""}