{"organizations": ["Nubia Rodriguez", "Islamic State", "Colorado State Penitentiary", "Sotheby", "Fiat Chrysler", "Takata Fiat Chrysler"], "uuid": "114eabf3f2fa389590b2bd69ac8b19d5841da87a", "thread": {"social": {"gplus": {"shares": 0}, "pinterest": {"shares": 0}, "vk": {"shares": 0}, "linkedin": {"shares": 0}, "facebook": {"likes": 0, "shares": 0, "comments": 0}, "stumbledupon": {"shares": 0}}, "site_full": "www.wxow.com", "main_image": "", "site_section": "http://www.wxow.com/Global/category.asp?C=13571&clienttype=rss", "section_title": "WXOW.com - Political - Headline", "url": "http://www.wxow.com/story/30339704/fiat-chrysler-independent-monitor-also-lobbies-for-takata", "country": "US", "title": "Fiat Chrysler 'independent' monitor also lobbies for Takata", "performance_score": 0, "site": "wxow.com", "participants_count": 0, "title_full": "Fiat Chrysler 'independent' monitor also lobbies for Takata", "spam_score": 0.0, "site_type": "news", "published": "2015-10-24T18:48:00.000+03:00", "replies_count": 0, "uuid": "114eabf3f2fa389590b2bd69ac8b19d5841da87a"}, "author": "", "url": "http://www.wxow.com/story/30339704/fiat-chrysler-independent-monitor-also-lobbies-for-takata", "ord_in_thread": 0, "title": "Fiat Chrysler 'independent' monitor also lobbies for Takata", "locations": ["Brooklyn", "Texas", "Afghanistan", "Iraq", "California", "Oklahoma", "East Coast", "U.S.", "Central Texas", "South Texas", "Arizona", "North", "Nevada"], "entities": {"persons": [], "locations": [], "organizations": []}, "highlightText": "", "language": "english", "persons": ["James Holmes", "A. Alfred Taubman", "Taubman", "Zack Wheeler", "Joshua L. Wheeler", "Sotheby", "Kim Phuc"], "text": "Fiat Chrysler 'independent' monitor also lobbies for Takata - WXOW News 19 La Crosse, WI â€“ News, Weather and Sports | Member Center: Storms flood roads, cause train derailment in Texas Heavy rains that brought a flood threat to North and Central Texas will spread into South Texas on Sunday as a stalled cold front causing the downpours is reinforced by remnants of Hurricane Patricia. More >> A powerful storm system rumbled through Texas on Saturday, flooding roads and causing a freight train to derail as parts of the state braced for the remnants of Hurricane Patricia to arrive. More >> California law aims to help immigrant victims get visas California has passed a law requiring local law enforcement to provide paperwork for immigrant crime victims applying for visas to remain in the country legally so long as they are otherwise eligible for the... More >> Nubia Rodriguez was assaulted and kidnapped by an ex-boyfriend, crimes that made her eligible for a special visa for immigrants in the U.S. illegally. More >> Why did Hurricane Patricia become a monster so quickly? Hurricane Patricia zoomed from tropical storm to record-beater in 30 hours flat like a jet-fueled sports car. More >> Hurricane Patricia zoomed from tropical storm to record-beater in 30 hours flat like a jet-fueled sports car. More >> Once a fetid mess, now serene wetland: NYC waters transform Amid the crammed concrete and steel of Brooklyn, a ribbon of clear water stretches out into a vast bay. Tall grass rustles along the undulating shoreline, where bursts of golden flowers, pines and cacti flourish in... More >> Amid the crammed concrete and steel of Brooklyn, a ribbon of clear water stretches out into a vast bay. Tall grass rustles along the undulating shoreline, where bursts of golden flowers, pines and cacti flourish in the... More >> Lasers may ease pain for 'napalm girl' in AP photograph In the photograph that made Kim Phuc a living symbol of the Vietnam War, her burns aren't visible - only her agony as she runs wailing toward the camera, her arms flung away from her body, naked because she has... More >> In the photograph that made Kim Phuc a living symbol of the Vietnam War, her burns aren't visible - only her agony as she runs wailing toward the camera, her arms flung away from her body, naked because she has ripped... More >> Sotheby's exhibits huge Taubman collection prior to sales A. Alfred Taubman, the late billionaire developer and former owner of Sotheby's auction house, was a boundless art collector whose taste spanned every period, genre and medium, from works of antiquity to... More >> A. Alfred Taubman, the late billionaire developer and former owner of Sotheby's auction house, was a boundless art collector whose taste spanned every period, genre and medium, from works of antiquity to contemporary art. More >> Feds confiscate lethal-injection drugs imported by 2 states Federal authorities have confiscated shipments of a lethal-injection chemical that Arizona and Texas tried to bring in from abroad, saying such imports are illegal - a move that compounds the nation's severe... More >> Federal authorities have confiscated shipments of a lethal-injection chemical that Arizona and Texas tried to bring in from abroad, saying such imports are illegal - a move that compounds the nation's severe shortage... More >> Las Vegas casinos not rushing to join daily fantasy game Casinos and sports books, the only companies who can legally offer daily fantasy sports sites in Nevada, are instead watching and waiting from the bleachers. More >> Casinos and sports books, the only companies who can legally offer daily fantasy sports sites in Nevada, are instead watching and waiting from the bleachers. More >> Colorado theater shooter James Holmes assaulted in prison Officials say an inmate assaulted theater shooter James Holmes and a security officer at the Colorado State Penitentiary. More >> Officials say an inmate assaulted theater shooter James Holmes and a security officer at the Colorado State Penitentiary. More >> Soldier killed in IS operation 'hard not to be friends with' The first American soldier to die in combat against the Islamic State group in Iraq has been identified as a 20-year Army veteran and Oklahoma native who had been deployed 11 times to Iraq and Afghanistan. More >> When Master Sgt. Joshua L. Wheeler was in town, his younger brother would take vacation time to spend with him. Zack Wheeler was absent from work Friday, this time preparing to travel to the East Coast for the return of... More >>", "external_links": [], "published": "2015-10-24T18:48:00.000+03:00", "crawled": "2015-10-24T19:46:11.820+03:00", "highlightTitle": ""}