{"organizations": ["Congress", "International Brotherhood of Teamsters", "AP"], "uuid": "5b082b2f257185e75ed272e4dcaea29e68151dfa", "thread": {"social": {"gplus": {"shares": 0}, "pinterest": {"shares": 0}, "vk": {"shares": 0}, "linkedin": {"shares": 0}, "facebook": {"likes": 0, "shares": 0, "comments": 0}, "stumbledupon": {"shares": 0}}, "site_full": "www.journal-news.com", "main_image": "http://media.cmgdigital.com/shared/img/photos/2015/10/21/3a/98/3d0b5ddf0d7b4b498c425f2476aaccba-8e8a7b09f1214614a743c527f50a12b8-0.jpg", "site_section": "http://www.journal-news.com/feeds/categories/political/", "section_title": "News | Political", "url": "http://www.journal-news.com/ap/ap/business/congress-proposes-giveaways-to-auto-trucking-indus/pCr6YT/", "country": "US", "title": "Congress proposes giveaways to auto, trucking industries", "performance_score": 0, "site": "journal-news.com", "participants_count": 0, "title_full": "Congress proposes giveaways to auto, trucking industries", "spam_score": 0.0, "site_type": "news", "published": "2015-10-21T18:59:00.000+03:00", "replies_count": 0, "uuid": "5b082b2f257185e75ed272e4dcaea29e68151dfa"}, "author": "", "url": "http://www.journal-news.com/ap/ap/business/congress-proposes-giveaways-to-auto-trucking-indus/pCr6YT/", "ord_in_thread": 0, "title": "Congress proposes giveaways to auto, trucking industries", "locations": ["Vicksburg", "Washington", "Miss", "R-Miss.", "D-Calif.", "D-Conn."], "entities": {"persons": [], "locations": [], "organizations": []}, "highlightText": "", "language": "english", "persons": ["James P. Hoffa", "Roger Wicker", "Walter Armstrong", "Dianne Feinstein", "Harnik", "Richard Blumenthal"], "text": "> Business Congress proposes giveaways to auto, trucking industries Sen. Richard Blumenthal, D-Conn., center, accompanied by, from left, Vicksburg, Miss. Police Chief Walter Armstrong, Sen. Roger Wicker, R-Miss., International Brotherhood of Teamsters President James P. Hoffa and Sen. Dianne Feinstein, D-Calif., , speaks during a news conference on the West Front of the Capitol in Washington, Wednesday, Oct. 21, 2015, to discuss bipartisan opposition to a federal mandate that would allow large trucks to pull double 33-foot trailers on the nation’s highways. (AP Photo/Andrew Harnik) Richard Blumenthal, D-Conn., center, accompanied by Sens. Roger Wicker, R-Miss., second from left, and Sen. Dianne Feinstein, D-Calif., right, speaks at a news conference on the West Front of the Capitol in Washington, Wednesday, Oct. 21, 2015, to discuss bipartisan opposition to a federal mandate that would allow large trucks to pull double 33-foot trailers on the nation’s highways. (AP Photo/Andrew Harnik)", "external_links": [], "published": "2015-10-21T18:59:00.000+03:00", "crawled": "2015-10-21T22:45:50.757+03:00", "highlightTitle": ""}