{"organizations": ["Redskins", "MALIN RISING Associated Press", "Princeton", "City Council", "El Nino", "CNN", "Royal Swedish Academy of Sciences", "La Crosse"], "uuid": "4690ea7fce0d66f08ddf719f29b3d84132d537bd", "thread": {"social": {"gplus": {"shares": 0}, "pinterest": {"shares": 0}, "vk": {"shares": 0}, "linkedin": {"shares": 0}, "facebook": {"likes": 0, "shares": 0, "comments": 0}, "stumbledupon": {"shares": 0}}, "site_full": "www.wxow.com", "main_image": "", "site_section": "http://www.wxow.com/Global/category.asp?C=13571&clienttype=rss", "section_title": "WXOW.com - Political - Headline", "url": "http://www.wxow.com/story/30242026/cnn-urged-to-add-liberal-panelist-for-debate", "country": "US", "title": "CNN urged to add liberal panelist for debate", "performance_score": 0, "site": "wxow.com", "participants_count": 0, "title_full": "CNN urged to add liberal panelist for debate", "spam_score": 0.0, "site_type": "news", "published": "2015-10-13T04:27:00.000+03:00", "replies_count": 0, "uuid": "4690ea7fce0d66f08ddf719f29b3d84132d537bd"}, "author": "", "url": "http://www.wxow.com/story/30242026/cnn-urged-to-add-liberal-panelist-for-debate", "ord_in_thread": 0, "title": "CNN urged to add liberal panelist for debate", "locations": ["San Francisco Bay Area", "California", "Oregon", "Calif.", "East Coast", "South Carolina", "El Nino", "Milwaukee", "Texas", "Wisconsin", "Memphis", "Baton Rouge", "India"], "entities": {"persons": [], "locations": [], "organizations": []}, "highlightText": "", "language": "english", "persons": ["Charles Hurt", "Jerry Brown", "PAUL WISEMAN", "Terence Olridge", "Deaton", "Angus Deaton", "Nikki Haley"], "text": "CNN urged to add liberal panelist for debate - WXOW News 19 La Crosse, WI â€“ News, Weather and Sports | Member Center: California governor bans Redskins name at public schools Four California schools will be forced to change mascots after Gov. Jerry Brown signed legislation barring public schools from using the Redskins name for sports teams. More >> Four California high schools will be forced to change mascots after Gov. Jerry Brown signed legislation making the state the first to bar public schools from using the Redskins name for sports teams. More >> California contest dubs 1,969-pound pumpkin the plumpest A rippled white gourd weighing in at 1,969 pounds took the title for plumpest pumpkin at an annual San Francisco Bay Area contest. More >> A rippled white whopper weighing in at 1,969 pounds took the title Monday for plumpest pumpkin at an annual San Francisco Bay Area contest. More >> Justices to decide on sentences for young prison 'lifers' Sheriff's Deputy Charles Hurt was on truant patrol when he came across a teenager in a Baton Rouge park on a cool fall morning. The teenager pulled a gun from his jacket, panicked, he said, and shot Hurt dead. More >> Sheriff's Deputy Charles Hurt was on truant patrol when he came across a teenager in a Baton Rouge park on a cool fall morning. The teenager pulled a gun from his jacket, panicked, he said, and shot Hurt dead. More >> Evidence mounts for El Nino that could ease Calif. drought Evidence is mounting that the El Nino ocean-warming phenomenon in the Pacific will spawn a rainy winter in California, potentially easing the state's punishing drought but also bringing the risk of chaotic... More >> Evidence is mounting that the El Nino ocean-warming phenomenon in the Pacific will spawn a rainy winter in California, potentially easing the state's punishing drought but also bringing the risk of chaotic storms like... More >> Princeton economist wins Nobel for work on poverty Scottish economist Angus Deaton has won the Nobel memorial prize in economic sciences for \"his analysis of consumption, poverty, and welfare,\" the Royal Swedish Academy of Sciences said Monday. More >> By PAUL WISEMAN and MALIN RISING Associated Press Angus Deaton has dug into obscure data to explore a range of problems: The scope of poverty in India. How poor countries treat young girls. The link... More >> Man gets weapon charge in fatal shooting of Memphis officer An off-duty Memphis police officer who died after being shot multiple times had been on the force for little more than a year and had a fiancee who is four months pregnant, authorities said. More >> Terence Olridge was heading to his job as a police officer when he and a neighbor were involved in an argument that escalated into a shootout in a normally quiet neighborhood in suburban Memphis, authorities said. More >> Police defend use of Taser on city official in Texas Police officials in a small, predominantly black Texas college town are defending the decision to use a stun gun on a City Council member when he intervened as officers questioned his friends outside his apartment. More >> Police officials in a small, predominantly black Texas college town are defending the decision to use a stun gun on a City Council member when he intervened as officers questioned his friends outside his apartment. More >> Rivers crest, I-95 opens as South Carolina turns to recovery Authorities reopened a key southbound stretch of Interstate 95 through South Carolina on Monday, more than a week after an historic storm dumped as much as 2 feet of rain that shut off the main East Coast highway... More >> As the worst of the floodwaters that roared through South Carolina washed out to sea, Gov. Nikki Haley and other officials said Monday it is time to start recovering instead of reacting to the ongoing emergency. More >> Attorneys make closing cases in trial of Wisconsin gun shop A lawyer for a pair of Milwaukee police officers suing a gun shop for negligence told jurors Monday that the store should have to pay several million dollars in damages for selling a gun that was used to wound his... More >> A lawyer for a pair of Milwaukee police officers suing a gun shop for negligence told jurors Monday that the store should have to pay several million dollars in damages for selling a gun that was used to wound his clients. More >> Students return to Oregon community college after shooting Hundreds of people lined the road leading to the Oregon community college where a gunman killed nine people, holding signs reading \"UCC Strong\" as students returned Monday to the scene of the deadliest shooting in... More >> Hundreds of people lined the road leading to the Oregon community college where a gunman killed nine people, holding signs reading \"UCC Strong\" as students returned Monday to the scene of the deadliest shooting in state... More >>", "external_links": [], "published": "2015-10-13T04:27:00.000+03:00", "crawled": "2015-10-13T05:32:25.316+03:00", "highlightTitle": ""}