{"organizations": ["Iowa Faith & Freedom Coalition", "GOP", "U.S. State Department", "State Department Reuters"], "uuid": "4fc7f273a3612321582447c796894c6fa82e9836", "thread": {"social": {"gplus": {"shares": 0}, "pinterest": {"shares": 0}, "vk": {"shares": 0}, "linkedin": {"shares": 0}, "facebook": {"likes": 0, "shares": 0, "comments": 0}, "stumbledupon": {"shares": 0}}, "site_full": "page2rss.com", "main_image": "", "site_section": "http://page2rss.com/rss/d46d20558883d5336f81c655cc400733", "section_title": "Politics To Parenting And Everything In Between By Littlebytesnews.Com", "url": "http://page2rss.com/d46d20558883d5336f81c655cc400733/7775677_7776165/obama-arrives-in-roseburg-protesters-gather", "country": "US", "title": "Obama Arrives in Roseburg, Protesters Gather", "performance_score": 0, "site": "page2rss.com", "participants_count": 0, "title_full": "Obama Arrives in Roseburg, Protesters Gather", "spam_score": 0.0, "site_type": "news", "published": "2015-10-11T16:25:00.000+03:00", "replies_count": 0, "uuid": "4fc7f273a3612321582447c796894c6fa82e9836"}, "author": "", "url": "http://page2rss.com/d46d20558883d5336f81c655cc400733/7775677_7776165/obama-arrives-in-roseburg-protesters-gather", "ord_in_thread": 0, "title": "Obama Arrives in Roseburg, Protesters Gather", "locations": ["United States", "Oregon", "Roseburg", "U.S.", "Washington", "Louisiana", "Iowa", "East Jerusalem"], "entities": {"persons": [], "locations": [], "organizations": []}, "highlightText": "", "language": "english", "persons": ["Bobby Jindal", "John Kirby", "Barack Obama", "Ben Carson", "Biden", "Obama"], "text": "11/15/10 20:26:31 11 Oct 2015 06:25 Obama Arrives in Roseburg, Protesters Gather NBCNews.com President Barack Obama arrived in the Oregon town of Roseburg on Friday, where he will meet with families of those slain and survivors of a shooting at a community college last week. Protesters began What does the president do? Not what some of the GOP candidates think. Washington Post Listening to many of the GOP presidential candidates, you might be confused as to what office they are seeking. As a result, much of the conversation sounds like “ If I found a magic lamp, what would Gun Activists Protest Obama Visit to Oregon Killing Site ABC News Holding signs saying the president was not welcome, more than 200 gun-rights activists protested Barack Obama's visit on Friday to Oregon to meet with the families of victims of last week's campus killings. PHOTO: Republican Presidential hopeful and Louisiana Gov. Bobby Jindal speaks at ABC News Republican Presidential hopeful and Louisiana Gov. Bobby Jindal speaks at the Iowa Faith & Freedom Coalition 15th Annual Family Banquet and Presidential Forum held at the Iowa State fairgrounds on September Ben Carson’s Holocaust Analogy Is Worse Than Ignorant—It Blames Victims Time More Prison Phone Calls Shouldn’t Penalize Families Voters to Political Candidates: Know Your Science! Biden Isn’t the First to Take Time Deciding on a White House Run A rhetorical disease stalks the U.S. sees acts of terrorism in East Jerusalem: State Department Reuters The United States considers violence in East Jerusalem to be acts of terrorism, a U.S. State Department spokesman said on Friday. Spokesman John Kirby told reporters the United States \"condemns in the", "external_links": [], "published": "2015-10-11T16:25:00.000+03:00", "crawled": "2015-10-11T16:49:30.031+03:00", "highlightTitle": ""}