{"organizations": ["Iowa Democrat’s Jefferson Jackson", "Iowa Democratic Party", "Democratic"], "uuid": "0c710df33ae8fa3862aa98457d1916af631797d9", "thread": {"social": {"gplus": {"shares": 0}, "pinterest": {"shares": 0}, "vk": {"shares": 0}, "linkedin": {"shares": 0}, "facebook": {"likes": 0, "shares": 0, "comments": 0}, "stumbledupon": {"shares": 0}}, "site_full": "www.desmoinesregister.com", "main_image": "http://www.gannett-cdn.com/-mm-/db30089638a6f7b8df8684b68b6dc5db958aa5f2/c=0-221-4356-2682&amp;r=x1683&amp;c=3200x1680/local/-/media/2015/10/25/IAGroup/DesMoines/635813283150643802-1024-Jefferson-Jackson-Dinner-11.jpg", "site_section": "http://rssfeeds.desmoinesregister.com/desmoines/politics", "section_title": "Des Moines - Politics", "url": "http://www.desmoinesregister.com/story/news/elections/presidential/caucus/2015/10/25/hillary-clinton-aims-fire-republicans-not-fellow-democrats-jefferson-jackson-dinner/74423564/", "country": "US", "title": "Photos: Iowa Democrat’s Jefferson Jackson dinner", "performance_score": 0, "site": "desmoinesregister.com", "participants_count": 0, "title_full": "Photos: Iowa Democrat’s Jefferson Jackson dinner", "spam_score": 0.0, "site_type": "news", "published": "2015-10-25T06:17:00.000+02:00", "replies_count": 0, "uuid": "0c710df33ae8fa3862aa98457d1916af631797d9"}, "author": "", "url": "http://www.desmoinesregister.com/story/news/elections/presidential/caucus/2015/10/25/hillary-clinton-aims-fire-republicans-not-fellow-democrats-jefferson-jackson-dinner/74423564/", "ord_in_thread": 0, "title": "Photos: Iowa Democrat’s Jefferson Jackson dinner", "locations": ["Iowa", "Des Moines"], "entities": {"persons": [], "locations": [], "organizations": []}, "highlightText": "", "language": "english", "persons": ["Hillary Clinton", "Brenie Sanders", "Jefferson Jackson", "Bernie Sanders", "Andy McGuire", "Bill Clinton", "Jane O'Meara Sanders", "Martin O'Malley", "Michael"], "text": "Photos: Iowa Democrat’s Jefferson Jackson dinner Buy Photo Democratic presidential candidate Hillary Clinton and President Bill Clinton greet people from the stage Saturday, Oct. 24, 2015, at the conclusion of the Jefferson Jackson dinner in Des Moines. Michael Zamora/The Register Fullscreen Buy Photo Democratic presidential candidate Brenie Sanders and his wife Jane O'Meara Sanders greet people from the stage Saturday, Oct. 24, 2015, at the conclusion of the Jefferson Jackson dinner in Des Moines. Michael Zamora/The Register Fullscreen Buy Photo President Bill Clinton and Democratic presidential candidate Hillary Clinton greet people from the stage Saturday, Oct. 24, 2015, at the conclusion of the Jefferson Jackson inner in Des Moines. Michael Zamora/The Register Fullscreen Buy Photo Democratic presidential candidate Martin O'Malley (rigjht) and his children greet people from the stage Saturday, Oct. 24, 2015, at the conclusion of the Jefferson Jackson dinner in Des Moines. Michael Zamora/The Register Fullscreen Buy Photo Democratic presidential candidate Hillary Clinton speaks Saturday, Oct. 24, 2015, during the Jefferson Jackson dinner in Des Moines. Michael Zamora/The Register Fullscreen Buy Photo Democratic presidential candidate Hillary Clinton speaks Saturday, Oct. 24, 2015, during the Jefferson Jackson dinner in Des Moines. Michael Zamora/The Register Fullscreen Buy Photo Democratic presidential candidate Hillary Clinton speaks Saturday, Oct. 24, 2015, during the Jefferson Jackson dinner in Des Moines. Michael Zamora/The Register Fullscreen Buy Photo Democratic presidential candidate Martin O'Malley speaks Saturday, Oct. 24, 2015, during the Jefferson Jackson dinner in Des Moines. Michael Zamora/The Register, Michael Zamora/The Register Buy Photo Fullscreen Buy Photo Democratic presidential candidate Martin O'Malley speaks Saturday, Oct. 24, 2015, during the Jefferson Jackson dinner in Des Moines. Michael Zamora/The Register Fullscreen Buy Photo Democratic presidential candidate Bernie Sanders speaks Saturday, Oct. 24, 2015, during the Jefferson Jackson dinner in Des Moines. Michael Zamora/The Register Fullscreen Buy Photo Democratic presidential candidate Bernie Sanders speaks Saturday, Oct. 24, 2015, during the Jefferson Jackson dinner in Des Moines. Michael Zamora/The Register Fullscreen Buy Photo Iowa Democratic Party chairwoman Andy McGuire (from left) brings out Democratic presidential candidates Hillary Clinton as fellow Democratic candidates Martin O'Malley and Bernie Sanders look on Saturday, Oct. 24, 2015, at the start of the Jefferson-Jackson Dinner in Des Moines. Michael Zamora/The Register Fullscreen Buy Photo Democratic presidential candidates Martin O'Malley (left) and Bernie Sanders greet each other on stage as Iowa Democratic Party chairwoman Andy McGuire brings out the presidential keynote speakers Saturday, Oct. 24, 2015, at the start of the Jefferson Jackson dinner in Des Moines. Michael Zamora/The Register Fullscreen Buy Photo Democratic presidential candidates Bernie Sanders (from left), Martin O'Malley and Hillary Clinton look out over the crowd Saturday, Oct. 24, 2015, at the start of the Jefferson Jackson dinner in Des Moines. Michael Zamora/The Register", "external_links": [], "published": "2015-10-25T06:17:00.000+02:00", "crawled": "2015-10-25T06:52:40.424+02:00", "highlightTitle": ""}