{"organizations": ["U.N.", "UN", "Amal Alamuddin Clooney", "United Nations Working Group on Arbitrary Detention", "House", "UNWGAD", "House Ways and Means Committee", "PAC"], "uuid": "72ce0f8b99e65992ca25d5c6fe0dc45f8c155177", "thread": {"social": {"gplus": {"shares": 0}, "pinterest": {"shares": 0}, "vk": {"shares": 0}, "linkedin": {"shares": 0}, "facebook": {"likes": 0, "shares": 0, "comments": 0}, "stumbledupon": {"shares": 0}}, "site_full": "page2rss.com", "main_image": "", "site_section": "http://page2rss.com/rss/d46d20558883d5336f81c655cc400733", "section_title": "Politics To Parenting And Everything In Between By Littlebytesnews.Com", "url": "http://page2rss.com/d46d20558883d5336f81c655cc400733/7773437_7773685/george-w-bush-better-health-care-in-africa-must-go-beyond-hiv", "country": "US", "title": "George W. Bush: Better Health Care in Africa Must Go Beyond HIV", "performance_score": 0, "site": "page2rss.com", "participants_count": 0, "title_full": "George W. Bush: Better Health Care in Africa Must Go Beyond HIV", "spam_score": 0.0, "site_type": "news", "published": "2015-10-09T23:05:00.000+03:00", "replies_count": 0, "uuid": "72ce0f8b99e65992ca25d5c6fe0dc45f8c155177"}, "author": "", "url": "http://page2rss.com/d46d20558883d5336f81c655cc400733/7773437_7773685/george-w-bush-better-health-care-in-africa-must-go-beyond-hiv", "ord_in_thread": 0, "title": "George W. Bush: Better Health Care in Africa Must Go Beyond HIV", "locations": ["Central African Republic", "Saudi Arabia", "Nigeria", "Washington", "Thailand", "West Bank", "Kunduz", "U.S.", "Old City", "Africa", "West Bank Israeli", "Wisconsin", "Jerusalem", "East Jerusalem"], "entities": {"persons": [], "locations": [], "organizations": []}, "highlightText": "", "language": "english", "persons": ["Federica Mogherini", "Clinton Washington Post PAUL RYAN", "Jeb Bush", "Ali Mohammed", "Donald Trump", "Boko Haram", "Ryan", "George W. Bush", "Paul Ryan", "Biden", "Joe", "Trevor Noah"], "text": "11/15/10 20:26:31 09 Oct 2015 13:05 George W. Bush: Better Health Care in Africa Must Go Beyond HIV Time More Daily Show ‘s Trevor Noah: Donald Trump Is a Perfect African President You Can Now Watch Africa’s Great Migration of Wildebeest Live Online What the U.N.’s New Development Goals Mean for Africa ‘Joe, run’ should scare Republicans The Post reported : The Draft Biden super PAC has launched an ad campaign trying to encourage Vice President Biden to enter the 2016 Democratic presidential nomination contest, using his personal story How can an introvert like Jeb Bush be a politician? Washington Post Quick, what comes to mind when you think of the stereotypical American politician? Okay, but what else beyond what probably just came to mind? How do politicians interact with people, for example? Why Ryan doesn’t want to be speaker; Republicans split on debt limit and Clinton Washington Post PAUL RYAN STICKING TO WAYS AND MEANS. It is no secret that there has a been a movement to draft House Ways and Means Committee Chairman Paul Ryan as the next Speaker of the House, but the Wisconsin Republican Statement by High Representative/Vice-President Federica Mogherini on the latest The continuing deadly violence in East Jerusalem and the West Bank, claiming lives of several people and injuring many more, poses a real risk of further escalation. Our thoughts are with the victims Statement by HR/VP Mogherini on the latest violence in East Jerusalem and West Bank Israeli Ministers Barred From Jerusalem Site; Man Stabbed A Palestinian stabbed a Jewish seminary student in Jerusalem on Thursday as the Israeli prime minister barred all Cabinet ministers and lawmakers from visiting a sensitive holy site in the Old City in NewsOnFeeds.com UN says detention of former President GMA violates international law Kicker Daily News The United Nations Working Group on Arbitrary Detention opined that GMA’s continued detention violates international law on human rights Amal Alamuddin Clooney sent via email the UNWGAD’s opinion to Human rights: Saudi Arabia, Nigeria, Central African Republic and Thailand MEPs passed four resolutions on Thursday: urging Saudi Arabia to halt the execution of Ali Mohammed al-Nimr and calling for a moratorium on the death penalty; demanding measures to starve Boko Haram in Was the attack on the Kunduz hospital a war crime? Washington Post A hospital bombed in the midst of intense fighting. Patients and staff killed and wounded, the facility destroyed. An unspeakable tragedy — and unfortunately one seen before in recent and current conflicts. Was it a war crime? CNN Story highlights After U.S. bombing of Afghan Doctors without Borders hospital, aid group demands war crimes investigation Lawyer: Hospitals have special protection in conflicts, but they lose it if they", "external_links": [], "published": "2015-10-09T23:05:00.000+03:00", "crawled": "2015-10-10T01:08:27.913+03:00", "highlightTitle": ""}