{"organizations": ["Reed Exhibitions Japan", "Reed Exhibitions Japan Ltd", "Japan Reed Exhibitions Japan Ltd.", "Reed Exhibitions", "Manufacturing World Osaka", "18th Manufacturing World Osaka"], "uuid": "e69761fb2a44e4fd2cd014826e6541c09d89b98e", "thread": {"social": {"gplus": {"shares": 0}, "pinterest": {"shares": 0}, "vk": {"shares": 0}, "linkedin": {"shares": 0}, "facebook": {"likes": 0, "shares": 0, "comments": 0}, "stumbledupon": {"shares": 0}}, "site_full": "businesswireindia.com", "main_image": "", "site_section": "http://businesswireindia.com/RSSFeeds/subcat-technology.xml", "section_title": "BusinessWire India.com - Technology", "url": "http://businesswireindia.com/news/news-details/18th-manufacturing-world-osaka-ended-with-greatest-success/45708", "country": "US", "title": "18th Manufacturing World Osaka Ended with the Greatest Success!", "performance_score": 0, "site": "businesswireindia.com", "participants_count": 0, "title_full": "18th Manufacturing World Osaka Ended with the Greatest Success!", "spam_score": 0.0, "site_type": "news", "published": "2015-10-15T11:16:00.000+03:00", "replies_count": 0, "uuid": "e69761fb2a44e4fd2cd014826e6541c09d89b98e"}, "author": "", "url": "http://businesswireindia.com/news/news-details/18th-manufacturing-world-osaka-ended-with-greatest-success/45708", "ord_in_thread": 0, "title": "18th Manufacturing World Osaka Ended with the Greatest Success!", "locations": ["United States", "Nagoya", "Western Japan", "Taiwan", "Hong Kong", "Thailand", "Indonesia", "Manufacturing World Osaka", "Korea", "Vietnam", "India", "INTEX Osaka", "Singapore", "Asia", "Germany", "Japan", "China", "Osaka"], "entities": {"persons": [], "locations": [], "organizations": []}, "highlightText": "", "language": "english", "persons": ["Takeshi Fujiwara"], "text": "Company : Reed Exhibitions Japan Ltd. Thursday, October 15, 2015 1:46PM IST (8:16AM GMT) 18th Manufacturing World Osaka Ended with the Greatest Success! The show gathered 1,063 exhibitors and 42,216 attendees under one roof – Record breaking result Osaka, Japan Reed Exhibitions Japan Ltd. , the largest show organiser in Japan, announced that 18 th Manufacturing World Osaka held from October 7 - 9, 2015 at INTEX Osaka, the Western Japan’s largest trade show for the manufacturing industry, ended with the greatest success with 1,063 exhibitors and 42,216 visitors from around the world. This Smart News Release features multimedia. View the full release here: http://www.businesswire.com/news/home/20151014006783/en/ Reed Exhibitions Japan announces 18th Manufacturing World Osaka ended up with 1,063 exhibitors 42,216 attendees, 14% up comparing to 2014 (Photo: Business Wire) “18 th Manufacturing World Osaka has been a very successful edition with absolutely exciting atmosphere by active business meetings seen everywhere in the venue,” said Takeshi Fujiwara, the show director at Reed Exhibitions. “On behalf of Show Management, I would like to thank all the exhibitors, visitors, conference speakers and the press… and everyone who was part of it. It was a great happiness for us to record the highest figures in the number of exhibitors and visitors in its 18 years history and we will endure our efforts in providing a firm base for business and to keep attracting important professionals from all over the world.” The number of visitors represents the sum of those visited 18 th Manufacturing World Osaka and 3 rd Highly-functional Material World Osaka. 14% increasing in exhibitors: 1,063 exhibitors (2015), comparing to 932 exhibitors (2014) Though the number of exhibitors in 2014 was the largest in its 17-year history, 2015 show recorded the largest number of exhibitors once again increased to 1,063 exhibitors. Most-ever 181 international exhibitors brought in latest international trend Largest-ever 181 exhibitors from 11 countries/regions outside Japan – China, Germany, Hong Kong, India, Indonesia, Korea, Singapore, Taiwan, Thailand, United States and Vietnam – tapped the Japanese market. China, Korea, Taiwan and Thailand held their own national pavilions, which made meeting spots where Asia’s most advanced technologies would create the latest international trend. The growing globalization and the Japanese economy’s recovery lead to lively exchanges between overseas exhibitors and Japanese visitors. This trend is estimated to continue in 2016. 2016 Manufacturing World series 2016 schedule of Manufacturing World series is fixed and the next edition is coming back in April 2016 at Nagoya where is another center of Japanese manufacturing industry. “1 st Manufacturing World Nagoya” , a long-awaited trade show among Japanese manufacturing industry is eventually launched in April 2016. For exhibitors: According to the big satisfaction of exhibitors and the fact that most exhibitors have already booked their exhibit space in 2016, remaining exhibit spaces has been already very limited. If you are interested in being exhibitor, contact Show Management to secure your booth now.", "external_links": [], "published": "2015-10-15T11:16:00.000+03:00", "crawled": "2015-10-15T11:49:33.742+03:00", "highlightTitle": ""}