{"organizations": ["Detroit Pistons", "Lenovo", "Georgetown University McDonough School of Business CMO", "Pistons", "LaunchPoint", "Inc.", "CMO", "Palace Sports & Entertainment"], "uuid": "e07fd6a5dd580dcca67869662fb186187f0586b7", "thread": {"social": {"gplus": {"shares": 0}, "pinterest": {"shares": 0}, "vk": {"shares": 0}, "linkedin": {"shares": 0}, "facebook": {"likes": 0, "shares": 0, "comments": 0}, "stumbledupon": {"shares": 0}}, "site_full": "science-technology.news-articles.net", "main_image": "", "site_section": "http://science-technology.news-articles.net/content/rss.php", "section_title": "Science and Technology @ News Articles Network", "url": "http://science-technology.news-articles.net/content/marketing-executives-offer-insights-advice-mashable-series-sponsored-marketo.xhtml", "country": "US", "title": "Marketing Executives Offer Insights, Advice in Mashable Q&A Series Sponsored by Marketo", "performance_score": 0, "site": "news-articles.net", "participants_count": 0, "title_full": "Marketing Executives Offer Insights, Advice in Mashable Q&A Series Sponsored by Marketo", "spam_score": 0.0, "site_type": "news", "published": "2015-10-13T01:37:00.000+03:00", "replies_count": 0, "uuid": "e07fd6a5dd580dcca67869662fb186187f0586b7"}, "author": "", "url": "http://science-technology.news-articles.net/content/marketing-executives-offer-insights-advice-mashable-series-sponsored-marketo.xhtml", "ord_in_thread": 0, "title": "Marketing Executives Offer Insights, Advice in Mashable Q&A Series Sponsored by Marketo", "locations": ["San Mateo", "Calif.", "Marketo", "Australia", "Europe", "CA", "SAN MATEO", "Japan"], "entities": {"persons": [], "locations": [], "organizations": []}, "highlightText": "", "language": "english", "persons": ["Chris M. Kormis", "Sanjay Dholakia", "Marketo"], "text": "Marketing Executives Offer Insights, Advice in Mashable Q&A Series Sponsored by Marketo   13:30:27 Marketing Executives Offer Insights, Advice in Mashable Q&A Series Sponsored by... -- SAN MATEO, Calif., Oct.   Marketo logo. Marketo logo.  ><- stripped tags -> SAN MATEO, Calif. , Oct.   Marketo, Inc., has announced the second edition of its \"Ask the CMO\" Q&A series produced by Mashable. Eight interviews, publishing through January 2016 , will focus on \"Lessons Learned,\" exploring how the early careers of top marketing executives from Lenovo, Slack, and more paved the way for future success. The series, which launched today on the Mashable site, kicks off with an [[UEdFZ2NtVnNQVndpYm05bWIyeHNiM2RjSWlCdmJtTnNhV05yUFNkc2FXNXJUMjVEYkdsamF5aDBhR2x6S1NjZ2FISmxaajFjSW1oMGRIQTZMeTl0WVhOb1lXSnNaUzVqYjIwdk1qQXhOUzh4TUM4eE1pOWpiVzh0WkdWMGNtOXBkQzF3YVhOMGIyNXpMeU5GUVUxTmIxRTBNRTV0Y1V4Y0lpQnlaV3c5WENKdWIyWnZiR3h2ZDF3aUlIUmhjbWRsZEQxY0lsOWliR0Z1YTF3aVBtbHVkR1Z5ZG1sbGR5Qm1jbTl0SUVOb1lYSnNhV1VnVFdWMGVtZGxjand2WVQ0PXw=]], chief marketing and communications officer for the Detroit Pistons and parent company Palace Sports & Entertainment, a Marketo client. The Q&A explores the changing landscape of the sports marketing industry and how the Pistons have leveraged technology and a unique marketing strategy to reach the franchise's best-ever season ticket renewal rate and three-year revenue highs. The next piece, featuring Georgetown University McDonough School of Business CMO Chris M. Kormis, will publish the week of October 26 and will explore marketing in the higher education space. In addition to running on Mashable, the interviews will live on [[UEdFZ2NtVnNQVndpYm05bWIyeHNiM2RjSWlCdmJtTnNhV05yUFNkc2FXNXJUMjVEYkdsamF5aDBhR2x6S1NjZ2FISmxaajFjSW1oMGRIQTZMeTlqYlc4dWJXRnlhMlYwYnk1amIyMHZYQ0lnY21Wc1BWd2libTltYjJ4c2IzZGNJaUIwWVhKblpYUTlYQ0pmWW14aGJtdGNJajVEVFU5T1lYUnBiMjR1WTI5dFBDOWhQZz09fA==]], Marketo's new destination for insights, expertise, and exclusive content to help senior marketers succeed in the digital era. The content hub features commentary from Marketo executives, partners and customers, industry research, and conversations with some of marketing's greatest minds. \"'Ask the CMO: Lessons Learned' is another example of how Marketo continues to invest in the success and development of marketing leaders everywhere,\" said Sanjay Dholakia , CMO, Marketo. \"With connections to some of today's biggest brands, a commanding online presence, and a creative approach to content, Mashable is an ideal partner for us as we continue to look toward the future of marketing.\" \"Lessons Learned\" is an extension of the \"Ask the CMO\" series that Marketo debuted with Mashable around SXSW 2015. To view past interviews, visit [[UEdFZ2NtVnNQVndpYm05bWIyeHNiM2RjSWlCdmJtTnNhV05yUFNkc2FXNXJUMjVEYkdsamF5aDBhR2x6S1NjZ2FISmxaajFjSW1oMGRIQTZMeTlqYlc4dWJXRnlhMlYwYnk1amIyMHZZMjl1ZG1WeWMyRjBhVzl1Y3kxaGJtUXRhVzUwWlhKMmFXVjNjeTljSWlCeVpXdzlYQ0p1YjJadmJHeHZkMXdpSUhSaGNtZGxkRDFjSWw5aWJHRnVhMXdpUG1oMGRIQTZMeTlqYlc4dWJXRnlhMlYwYnk1amIyMHZZMjl1ZG1WeWMyRjBhVzl1Y3kxaGJtUXRhVzUwWlhKMmFXVjNjeTg4TDJFK3w=]]. To learn more about Marketo, please visit [[UEdFZ2NtVnNQVndpYm05bWIyeHNiM2RjSWlCdmJtTnNhV05yUFNkc2FXNXJUMjVEYkdsamF5aDBhR2x6S1NjZ2FISmxaajFjSW1oMGRIQTZMeTkzZDNjdWJXRnlhMlYwYnk1amIyMHZYQ0lnY21Wc1BWd2libTltYjJ4c2IzZGNJaUIwWVhKblpYUTlYQ0pmWW14aGJtdGNJajUzZDNjdWJXRnlhMlYwYnk1amIyMDhMMkUrfA==]]. About Marketo Marketo (NASDAQ: MKTO ) provides the leading marketing software and solutions designed to help marketers master the art and science of digital marketing. Through a unique combination of innovation and expertise, Marketo is focused solely on helping marketers keep pace in an ever-changing digital world. Spanning today's digital, social, mobile and offline channels, Marketo's Engagement Marketing Platform powers a set of breakthrough marketing automation and marketing management applications to help marketers tackle all aspects of digital marketing from the planning and orchestration of marketing activities to the delivery of personalized interactions that can be optimized in real-time. Marketo's applications are known for their ease-of-use, and are complemented by the Marketing Nation®, a thriving network of more than 450 third-party solutions through our LaunchPoint® ecosystem and over 50,000 marketers who share and learn from each other to grow their collective marketing expertise. The result for modern marketers is unprecedented agility and superior results. Headquartered in San Mateo, CA with offices in Europe , Australia and Japan , Marketo serves as a strategic marketing partner to more than 4,100 large enterprises and fast-growing small companies across a wide variety of industries. For more information, visit www.marketo.com .", "external_links": [], "published": "2015-10-13T01:37:00.000+03:00", "crawled": "2015-10-13T01:22:31.133+03:00", "highlightTitle": ""}