{"organizations": ["Sonus Networks", "Sonus Networks, Inc", "SBC", "Voice", "SEC", "Sonus", "Unified Communications", "Inc.", "Microsoft"], "uuid": "7ddec264d0b97d463a1efd29a68e1aef7d127449", "thread": {"social": {"gplus": {"shares": 0}, "pinterest": {"shares": 0}, "vk": {"shares": 0}, "linkedin": {"shares": 0}, "facebook": {"likes": 0, "shares": 0, "comments": 0}, "stumbledupon": {"shares": 0}}, "site_full": "science-technology.news-articles.net", "main_image": "", "site_section": "http://science-technology.news-articles.net/content/rss.php", "section_title": "Science and Technology @ News Articles Network", "url": "http://science-technology.news-articles.net/content/sonus-sbc-series-swe-release-now-available.xhtml", "country": "US", "title": "Sonus SBC 5000 Series, SBC 7000 and SBC SWe Release 5.0 Now Available", "performance_score": 0, "site": "news-articles.net", "participants_count": 0, "title_full": "Sonus SBC 5000 Series, SBC 7000 and SBC SWe Release 5.0 Now Available", "spam_score": 0.0, "site_type": "news", "published": "2015-10-05T18:25:00.000+03:00", "replies_count": 0, "uuid": "7ddec264d0b97d463a1efd29a68e1aef7d127449"}, "author": "", "url": "http://science-technology.news-articles.net/content/sonus-sbc-series-swe-release-now-available.xhtml", "ord_in_thread": 0, "title": "Sonus SBC 5000 Series, SBC 7000 and SBC SWe Release 5.0 Now Available", "locations": ["Mass.", "WESTFORD", "Network-as-a-Service"], "entities": {"persons": [], "locations": [], "organizations": []}, "highlightText": "", "language": "english", "persons": ["BroadSoft", "David Tipping"], "text": "Sonus SBC 5000 Series, SBC 7000 and SBC SWe Release 5.0 Now Available   Published on 2015-10-05 07:45:58 Sonus SBC 5000 Series, SBC 7000 and SBC SWe Release 5.0 Now... -- WESTFORD, Mass.,   Sonus Networks, Inc. Corporate Logo Sonus Networks, Inc. Corporate Logo  ><- stripped tags -> WESTFORD, Mass. ,   Key Takeaways: Sonus SBC 5000 Series, SBC 7000 and SBC Software edition (SWe) Session Border Controllers (SBC) Release 5.0 generally available. Simplifies interworking with BroadSoft and Microsoft UC applications. Bridges WebRTC world to SIP infrastructure. [[UEdFZ2NtVnNQVndpYm05bWIyeHNiM2RjSWlCdmJtTnNhV05yUFNkc2FXNXJUMjVEYkdsamF5aDBhR2x6S1NjZ2NtVnNQVndpYm05bWIyeHNiM2RjSWlCb2NtVm1QVndpYUhSMGNEb3ZMM2QzZHk1emIyNTFjeTV1WlhRdlpXNWNJaUIwWVhKblpYUTlYQ0pmWW14aGJtdGNJajVUYjI1MWN5Qk9aWFIzYjNKcmN6d3ZZVDQ9fA==]], Inc. (Nasdaq: [[UEdFZ2NtVnNQVndpYm05bWIyeHNiM2RjSWlCb2NtVm1QU2RvZEhSd09pOHZjM1IxWkdsdkxUVXVabWx1WVc1amFXRnNZMjl1ZEdWdWRDNWpiMjB2Y0hKdVpYZHpQMUJoWjJVOVVYVnZkR1VtVkdsamEyVnlQVk5QVGxNbklIUmhjbWRsZEQwblgySnNZVzVySnlCMGFYUnNaVDBuVTA5T1V5Y2diMjVqYkdsamF6MG5iR2x1YTA5dVEyeHBZMnNvZEdocGN5a25JSEpsYkQwbmJtOW1iMnhzYjNjblBsTlBUbE04TDJFK3w=]]), [[UEdFZ2NtVnNQVndpYm05bWIyeHNiM2RjSWlCdmJtTnNhV05yUFNkc2FXNXJUMjVEYkdsamF5aDBhR2x6S1NjZ2NtVnNQVndpYm05bWIyeHNiM2RjSWlCb2NtVm1QVndpYUhSMGNEb3ZMM2QzZHk1emIyNTFjeTV1WlhRdlpXNHZjSEp2WkhWamRITXZjMlZ6YzJsdmJpMWliM0prWlhJdFkyOXVkSEp2Ykd4bGNuTXZjMjl1ZFhNdGMyVnpjMmx2YmkxaWIzSmtaWEl0WTI5dWRISnZiR3hsY25NdGMySmpYQ0lnZEdGeVoyVjBQVndpWDJKc1lXNXJYQ0krWVNCbmJHOWlZV3dnYkdWaFpHVnlJR2x1SUdWdVlXSnNhVzVuSUdGdVpDQnpaV04xY21sdVp5QnlaV0ZzTFhScGJXVWdZMjl0YlhWdWFXTmhkR2x2Ym5NOEwyRSt8]], announced today the general availability of the Sonus SBC 5000 Series, SBC 7000 and SBC Software edition (SWe) Session Border Controllers (SBCs) Release 5.0. This update provides new revenue opportunities for wireless service providers, offers Unified Communications (UC) migrations and broadens enterprise video interworking. Release 5.0 decreases the complexities around interworking multi-vendor wireless and UC applications and features: Enhanced revenue for service providers with wireless VoLTE interconnect; Interworking with BroadSoft's BroadWorks ® and BroadCloud ® offerings; New service support for SIP to WebRTC interworking; Lower migration costs by reusing existing customer equipment with Microsoft Lync 2010/2013 video relay; and Element Management Application (EMA) enhancements with simplified single sign-on and broader browser support, decreasing costs and increasing customer service. Quote: \"SIP-based Unified Communications are accelerating globally,\" said David Tipping , Sonus vice president and general manager, Products. \"Sonus' Release 5.0 simplifies deployments and broadens SBC interworking capabilities, allowing customers to rapidly unlock the cost savings Unified Communications brings at scale.\" Tags: Sonus Networks, SONS, Session Border Controller, SBC, SBC 5000 Series, SBC 7000, SBC Software edition, SBC SWe, WebRTC, BroadSoft, Element Management Application, EMA, SIP, VoLTE, Voice over LTE, Unified Communications, UC About Sonus: Sonus brings the next generation of Cloud-based SIP and 4G/VoLTE solutions to its customers by enabling and securing mission critical traffic for VoIP, video, IM and online collaboration. With Sonus, enterprises can intelligently secure and prioritize real-time communications, while service providers can deliver reliable, secure real-time services for mobile, UC and social applications. Sonus offers an award-winning portfolio of hardware-based and virtualized Session Border Controllers (SBCs), Diameter Signaling Controllers (DSCs), Network-as-a-Service (NaaS) capabilities, Policy/Routing servers and media/signaling gateways. Visit [[UEdFZ2NtVnNQVndpYm05bWIyeHNiM2RjSWlCdmJtTnNhV05yUFNkc2FXNXJUMjVEYkdsamF5aDBhR2x6S1NjZ2RHRnlaMlYwUFNkZllteGhibXNuSUhKbGJEMWNJbTV2Wm05c2JHOTNYQ0lnYUhKbFpqMWNJbWgwZEhBNkx5OTNkM2N1YzI5dWRYTXVibVYwWENJK2QzZDNMbk52Ym5WekxtNWxkRHd2WVQ0PXw=]] or call 1-855-GO-SONUS. Important Information Regarding Forward-Looking Statements: The information in this release contains forward-looking statements regarding future events that involve risks and uncertainties. All statements other than statements of historical facts contained in this release are forward-looking statements. Our actual results may differ materially from those contemplated by the forward-looking statements. For further information regarding risks and uncertainties associated with Sonus' business, please refer to the \"Risk Factors\" section of Sonus' most recent annual or quarterly report filed with the SEC. Any forward-looking statements represent Sonus' views only as of the date on which such statement is made and should not be relied upon as representing Sonus' views as of any subsequent date. While Sonus may elect to update forward-looking statements at some point, Sonus specifically disclaims any obligation to do so. For Sonus:", "external_links": [], "published": "2015-10-05T18:25:00.000+03:00", "crawled": "2015-10-05T18:11:30.467+03:00", "highlightTitle": ""}