{"organizations": ["ROFIN-SINAR", "Standard & Poor", "Frankfurt Stock Exchange", "ROFIN-SINAR Technologies", "ROFIN-SINAR Technologies Inc.", "ROFIN", "Silver Arrow Capital Advisors LLP"], "uuid": "beae9b94308f86c60c4808efb1cf50781edf7315", "thread": {"social": {"gplus": {"shares": 0}, "pinterest": {"shares": 0}, "vk": {"shares": 0}, "linkedin": {"shares": 0}, "facebook": {"likes": 0, "shares": 0, "comments": 0}, "stumbledupon": {"shares": 0}}, "site_full": "science-technology.news-articles.net", "main_image": "", "site_section": "http://science-technology.news-articles.net/content/rss.php", "section_title": "Science and Technology @ News Articles Network", "url": "http://science-technology.news-articles.net/content/rofin-sinar-responds-letter-from-silver-arrow-capital-advisors-llp.xhtml", "country": "US", "title": "ROFIN-SINAR Responds To Letter From Silver Arrow Capital Advisors LLP", "performance_score": 0, "site": "news-articles.net", "participants_count": 0, "title_full": "ROFIN-SINAR Responds To Letter From Silver Arrow Capital Advisors LLP", "spam_score": 0.0, "site_type": "news", "published": "2015-10-09T23:49:00.000+03:00", "replies_count": 0, "uuid": "beae9b94308f86c60c4808efb1cf50781edf7315"}, "author": "", "url": "http://science-technology.news-articles.net/content/rofin-sinar-responds-letter-from-silver-arrow-capital-advisors-llp.xhtml", "ord_in_thread": 0, "title": "ROFIN-SINAR Responds To Letter From Silver Arrow Capital Advisors LLP", "locations": ["Mich.", "PLYMOUTH", "US", "HAMBURG", "Finland", "UK", "Hamburg", "Switzerland", "Plymouth", "Singapore", "Michigan", "Germany", "China", "Sweden"], "entities": {"persons": [], "locations": [], "organizations": []}, "highlightText": "", "language": "english", "persons": ["Katharina Manok"], "text": "ROFIN-SINAR Responds To Letter From Silver Arrow Capital Advisors LLP   Published on 2015-10-09 11:15:30 ROFIN-SINAR Responds To Letter From Silver Arrow Capital Advisors LLP -- PLYMOUTH, Mich., and HAMBURG, Germany, Oct.    > PLYMOUTH, Mich. , and HAMBURG, Germany , Oct.   ROFIN-SINAR Technologies Inc. (NASDAQ: RSTI ), one of the world's leading developers and manufacturers of high-performance laser beam sources and laser-based solutions, today issued the following statement in response to a letter from Silver Arrow Capital Advisors LLP. The Board and management team of ROFIN-SINAR Technologies Inc. are committed to executing on our strategic plan to drive growth and profitability. This effort is gaining momentum, as evidenced by our very strong financial results for the most recently reported fiscal quarter, in which we doubled year-to-date net income, increased our gross margin to nearly 40% and showed strong sequential sales growth in fiber and ultra-short pulse lasers. We remain confident that our existing growth strategy will continue to deliver attractive value to all shareholders. We also welcome input from all shareholders towards our common goal of enhancing shareholder value. About ROFIN With 40 years of experience, ROFIN-SINAR Technologies is a leading developer, designer and manufacturer of lasers and laser-based system solutions for industrial material processing applications. The Company focuses on developing key innovative technologies and advanced production methods for a wide variety of industrial applications based on a broad scope of technologies. The product portfolio ranges from single laser-beam sources to highly complex systems, covering all of the key laser technologies such as CO 2 lasers, fiber, solid-state and diode lasers, and the entire power spectrum, from single-digit watts up to multi-kilowatts, as well as a comprehensive spectrum of wavelengths or pulse durations and an extensive range of laser components. ROFIN-SINAR Technologies has its operational headquarters in Plymouth, Michigan , and Hamburg, Germany , and maintains production facilities in the US, Germany , UK, Sweden , Finland , Switzerland , Singapore and China . ROFIN currently has more than 52,000 laser units installed worldwide and serves more than 4,000 customers. The Company's shares trade on the NASDAQ Global Select Market under the symbol RSTI and are listed in Germany in the \"Prime Standard\" segment of the Frankfurt Stock Exchange under ISIN US7750431022. ROFIN is part of the Standard & Poor's SmallCap 600 Index and the Russell 2000 Index. Additional information is available on the Company's home page: www.rofin.com . \"Safe Harbor\" Statement Under the Private Securities Litigation Reform Act Certain information in this press release that relates to future plans, events or performance, including statements such as \"The Board and management team of ROFIN-SINAR Technologies Inc. are committed to executing on our strategic plan to drive growth and profitability. This effort is gaining momentum, as evidenced by our very strong financial results for the most recent fiscal quarter, in which we doubled year-to-date net income, increased our gross margin to nearly 40% and showed strong sequential sales growth in fiber and ultra-short pulse lasers. We remain confident that our existing growth strategy will continue to deliver attractive value to all shareholders\" is forward-looking and is subject to important risks and uncertainties that could cause actual results to differ. Actual results could differ materially based on numerous factors, including currency risk, competition, risk relating to sales growth in CO 2 , diode, and solid-state lasers, cyclicality, conflicting patents and other intellectual property rights of fourth parties, potential infringement claims and future capital requirements, as well as other factors set forth in our annual report on Form 10-K. These forward-looking statements represent the Company's best judgment as of the date of this release based in part on preliminary information and certain assumptions which management believes to be reasonable. The Company disclaims any obligation to update these forward-looking statements. Contact: Katharina Manok", "external_links": [], "published": "2015-10-09T23:49:00.000+03:00", "crawled": "2015-10-09T23:34:08.704+03:00", "highlightTitle": ""}