{"organizations": ["Verizon", "Verizon Verizon Communications Inc.", "Networx Universal and Enterprise", "Verizon Enterprise Solutions", "Amazon Web Services", "VERIZON", "Verizon Wireless", "Microsoft", "Google", "Secure Cloud Interconnect", "Equinix"], "uuid": "f86a8f7a1afee53f16133bf5782aafd775307fba", "thread": {"social": {"gplus": {"shares": 0}, "pinterest": {"shares": 0}, "vk": {"shares": 0}, "linkedin": {"shares": 0}, "facebook": {"likes": 0, "shares": 0, "comments": 0}, "stumbledupon": {"shares": 0}}, "site_full": "science-technology.news-articles.net", "main_image": "", "site_section": "http://science-technology.news-articles.net/content/rss.php", "section_title": "Science and Technology @ News Articles Network", "url": "http://science-technology.news-articles.net/content/verizons-secure-cloud-interconnect-service-now-available-public-sector-organizations.xhtml", "country": "US", "title": "Verizon's Secure Cloud Interconnect service now available to public sector organizations", "performance_score": 0, "site": "news-articles.net", "participants_count": 0, "title_full": "Verizon's Secure Cloud Interconnect service now available to public sector organizations", "spam_score": 0.0, "site_type": "news", "published": "2015-10-14T16:57:00.000+03:00", "replies_count": 0, "uuid": "f86a8f7a1afee53f16133bf5782aafd775307fba"}, "author": "", "url": "http://science-technology.news-articles.net/content/verizons-secure-cloud-interconnect-service-now-available-public-sector-organizations.xhtml", "ord_in_thread": 0, "title": "Verizon's Secure Cloud Interconnect service now available to public sector organizations", "locations": ["America", "New York", "Asia-Pacific", "U.S.", "Americas", "Latin America", "Europe", "N.J."], "entities": {"persons": [], "locations": [], "organizations": []}, "highlightText": "", "language": "english", "persons": ["Mike Maiorana"], "text": "Verizon's Secure Cloud Interconnect service now available to public sector organizations »   Published on 2015-10-14 05:30:43 Verizon's Secure Cloud Interconnect service now available to public sector organizations -- BASKING RIDGE, N.J., Oct.   <-   BASKING RIDGE, N.J. , Oct.   Verizon Enterprise Solutions is removing another barrier to the adoption of cloud computing in the public sector by expanding availability of its Secure Cloud Interconnect service, a software-defined networking offering that delivers the security, reliability, performance, simplicity and efficiency needed to support mission-critical workloads and applications. With public sector organizations across federal, state and local, education and public safety embracing the benefits of cloud computing, many struggle with the complexity of seamlessly connecting, managing and securing their cloud environments which oftentimes extend across multiple clouds and data centers. Verizon Secure Cloud Interconnect helps simplify this complexity by providing a secure, private Internet connection that features consumption-based bandwidth, pre-provisioned on-demand resources, application performance, multiple classes of service and usage-based billing models with simple provisioning and management via a centralized online portal. The service – now available at more than 30 locations across the Americas, Latin America , Europe and the Asia-Pacific region – supports cloud (public, private and hybrid) and colocation solutions from a growing roster of connected cloud (Amazon Web Services, Google, HP, Microsoft, Salesforce, Verizon) and data center (CoreSite, Equinix, Verizon) providers. \"Public sector organizations across the U.S. rely on Verizon for secure and reliable networking,\" said Mike Maiorana , senior vice president of public sector markets, Verizon Enterprise Solutions. \"Our Secure Cloud Interconnect service builds on Verizon's strengths and addresses many of the barriers impacting public sector cloud adoption, including security, scalability, flexibility and control. Secure Cloud Interconnect delivers the connectivity our public sector clients require to support workload and application deployments across multiple cloud and data center providers.\" Nationwide Availability for the Public Sector To deliver enterprise-class performance and security, Verizon is deploying its edge routers into third-party data centers to enable pre-integration of networking and interfaces. Using the online portal, public sector organizations purchasing Secure Cloud Interconnect select their cloud partners, location and service information and the service is quickly provisioned. Federal: Secure Cloud Interconnect, now available on Verizon's Networx Universal and Enterprise contracts, currently offers connections to the FedRAMP SM -certified cloud platforms delivered by Verizon and Microsoft. Additional cloud providers will be added as network build outs and system integration work is completed. State and Local, Education, Public Safety : These organizations, which do not typically require a FedRAMP-certified cloud environment, are able to tap into the full complement of cloud and data center providers with Secure Cloud Interconnect connections. [Editor's Note: Click here for related announcement highlighting the expanding ecosystem of cloud and data center providers, including specific locations, connected to Verizon Secure Cloud Interconnect .] Secure, High-Performance Networking Solution for the Government Enterprise Secure Cloud Interconnect , built on Verizon's world-class Private IP network , offers any-to-any IP connectivity, while providing the security and reliability associated with private wide area networking solutions. Using Verizon's Private IP wireless access feature, Secure Cloud Interconnect is further extended to U.S. users of its world-class 4G LTE service. Available in more than 170 markets around the globe, Private IP delivers scalability, varying classes of service, expansive reach and exceptional service, including stringent service level agreements for latency and packet-loss. Verizon is the leading provider of communications services to the U.S. federal government. For more information, visit the Verizon Public Sector Markets website. Verizon Enterprise Solutions helps clients improve customer experience, drive growth and business performance and manage risk. With industry-specific solutions provided over the company's secure mobility, cloud, strategic networking, Internet of Things and advanced communications platforms, Verizon Enterprise Solutions helps open new opportunities around the world for innovation, investment and business transformation. Visit www.verizonenterprise.com to learn more. About Verizon Verizon Communications Inc. (NYSE, Nasdaq: VZ ), headquartered in New York , employs a diverse workforce of 178,500 and generated more than $127 billion in 2014 revenues. Verizon Wireless operates America's most reliable wireless network, with 109.5 million retail connections nationwide. Verizon also provides converged communications, information and entertainment services over America's most advanced fiber-optic network, and delivers integrated business solutions to customers worldwide. For more information, visit www.verizon.com/news/ . VERIZON'S ONLINE NEWS CENTER: Verizon news releases, executive speeches and biographies, media contacts and other information are available at Verizon's online News Center at www.verizon.com/news / . The news releases are available through an RSS feed. To subscribe, visit www.verizon.com/about/rss-feeds /. \nSOURCE Verizon", "external_links": [], "published": "2015-10-14T16:57:00.000+03:00", "crawled": "2015-10-14T16:42:21.310+03:00", "highlightTitle": ""}