{"organizations": ["U.S. Securities and Exchange Commission", "Iridium", "Gogo Business Aviation", "Aircell", "Key Capabilities Reliable", "Gogo Inc."], "uuid": "6843006c2ec1842e73717d5b37b5dbcb72e2706f", "thread": {"social": {"gplus": {"shares": 0}, "pinterest": {"shares": 0}, "vk": {"shares": 0}, "linkedin": {"shares": 0}, "facebook": {"likes": 0, "shares": 0, "comments": 0}, "stumbledupon": {"shares": 0}}, "site_full": "science-technology.news-articles.net", "main_image": "", "site_section": "http://science-technology.news-articles.net/content/rss.php", "section_title": "Science and Technology @ News Articles Network", "url": "http://science-technology.news-articles.net/content/gogo-announces-connectivity-solution-business-aircraft.xhtml", "country": "US", "title": "Gogo Announces 4G Connectivity Solution for Business Aircraft", "performance_score": 0, "site": "news-articles.net", "participants_count": 0, "title_full": "Gogo Announces 4G Connectivity Solution for Business Aircraft", "spam_score": 0.0, "site_type": "news", "published": "2015-10-14T18:12:00.000+03:00", "replies_count": 0, "uuid": "6843006c2ec1842e73717d5b37b5dbcb72e2706f"}, "author": "", "url": "http://science-technology.news-articles.net/content/gogo-announces-connectivity-solution-business-aircraft.xhtml", "ord_in_thread": 0, "title": "Gogo Announces 4G Connectivity Solution for Business Aircraft", "locations": ["Broomfield", "Las Vegas", "IL", "U.S.", "BROOMFIELD", "Canada", "CO", "Chicago", "Alaska", "Colo."], "entities": {"persons": [], "locations": [], "organizations": []}, "highlightText": "", "language": "english", "persons": ["Gogo", "Wade", "John Wade"], "text": "Gogo Announces 4G Connectivity Solution for Business Aircraft   Gogo Announces 4G Connectivity Solution for Business Aircraft -- BROOMFIELD, Colo., Oct.   GogoLOGO. GogoLOGO.  ><- stripped tags -> BROOMFIELD, Colo. , Oct.   Gogo Inc. (NASDAQ: [[UEdFZ2NtVnNQVndpYm05bWIyeHNiM2RjSWlCb2NtVm1QU2RvZEhSd09pOHZjM1IxWkdsdkxUVXVabWx1WVc1amFXRnNZMjl1ZEdWdWRDNWpiMjB2Y0hKdVpYZHpQMUJoWjJVOVVYVnZkR1VtVkdsamEyVnlQVWRQUjA4bklISmxiRDBuYm05bWIyeHNiM2NuSUhSaGNtZGxkRDBuWDJKc1lXNXJKeUIwYVhSc1pUMG5SMDlIVHljZ2IyNWpiR2xqYXowbmJHbHVhMDl1UTJ4cFkyc29kR2hwY3lrbklISmxiRDBuYm05bWIyeHNiM2NuUGtkUFIwODhMMkUrfA==]]), the leading provider of in-flight connectivity and entertainment solutions to the global aero market, announces a new 4G connectivity solution for the business aviation market. Available at the beginning of 2017, Gogo Biz 4G represents a significant increase in capability when compared to existing solutions. It will give business aircraft passengers \"the speed they need\" to power their digital lifestyles in flight – without skipping a beat. Gogo Biz 4G – Key Capabilities Reliable 4G performance Service coverage in the continental U.S. and portions of Alaska and Canada Utilizes advanced air-to-ground technology operating on licensed spectrum Loyalty programs with significant trade-in incentives available to current Gogo customers wishing to upgrade to Gogo Biz 4G John Wade , Gogo Business Aviation's executive vice president and general manager, said, \"We cracked the code on in-flight connectivity many years ago, and we're excited to continue offering more and more performance to customers. Gogo Biz 4G is a solution business aircraft operators can count on. It leverages Gogo's proven air-to-ground network and technology that has already flown hundreds of thousands of hours aboard thousands of business and commercial aircraft.\" Created specifically for the business aviation market, Gogo Biz 4G is a specially-designed application of Gogo's latest air-to-ground technology. The Gogo Biz 4G equipment package will incorporate dual-band 802.11ac Wi-Fi service and a host of other features – all from a single, lightweight box. From an installed customer base of more than 9,000 aircraft worldwide, Gogo serves more than 80,000 passengers every day. With over 1,000 employees and nearly $1 billion of in-flight technology investment to date, Gogo's track record of delivering high-performance in-flight connectivity solutions is unmatched in the market. The company's existing range of Gogo Biz solutions will remain available after Gogo Biz 4G shipments begin. \"Whether it's a turboprop that wants a simple e-mail and cockpit app solution or a large jet looking for the fastest and most robust connectivity experience available, Gogo has proven solutions to meet virtually every need,\" added Wade. Gogo Business Aviation will showcase a complete range of global and U.S. domestic in-flight connectivity and entertainment solutions – including the new Gogo Biz 4G system – at the annual NBAA convention, November 17-19 in Las Vegas . About Gogo Gogo is a leading global aero-communications service provider that offers in-flight Internet, entertainment, text messaging, voice and a host of other communications-related services to the commercial and business aviation markets. Gogo has nearly 2,400 commercial aircraft equipped with its services on 11 major airlines. More than 6,800 business aircraft are also flying with its solutions, including the world's largest fractional ownership fleets. Gogo also is a factory option at every major business aircraft manufacturer. Gogo has more than 1,000 employees and is headquartered in Chicago, IL, with additional facilities in Broomfield, CO, and various locations outside the U.S. Connect with us at www.gogoair.com and business.gogoair.com About Gogo Business Aviation Gogo Business Aviation, formerly known as Aircell, is a leading provider of in-flight connectivity equipment, services and support to the business aviation market. Through a full range of capabilities including Internet, voice, entertainment, cockpit data and more, the company increases the productivity, safety, and enjoyment of the business aviation travel experience. An AS9100-certified company, Gogo Business Aviation serves a global customer base and has an authorized dealer/distributor network that spans six continents. The only company to offer all three of business aviation's most popular network technologies – Gogo Biz ® , SwiftBroadband and Iridium – it offers solutions to fulfill any customer need, aircraft type or geography. A Collier Trophy nominee and the recipient of several dozen awards for innovation, Gogo Business Aviation is widely credited with many of the industry's most influential historical achievements, beginning with the groundbreaking airborne cellular concept that launched the company in 1991. Connect with us at http://business.gogoair.com and on Twitter at www.twitter.com/gogobizav . Cautionary Note Regarding Forward-Looking Statements Certain disclosures in this press release include certain \"forward-looking statements\" within the meaning of the federal securities laws that are based largely on our current expectations and reflect various estimates and assumptions by the Company. Forward-looking statements are subject to known and unknown risks, tends and uncertainties, many of which may be beyond our control that could cause actual results and achievements to differ materially from those expressed in such forward-looking statements, and are in some instances beyond our control. Such risks, trends and uncertainties include those described under the heading \"Risk Factors\" in the Company's Annual Report on Form 10-K filed with the U.S. Securities and Exchange Commission on February 27, 2015 . The words \"may,\" \"might,\" \"will,\" \"could\" \"should,\" \"estimate,\" \"project,\" \"plan,\" \"anticipate,\" \"expect,\" \"intend,\" \"outlook,\" \"seek,\" \"designed,\" \"assume,\" \"implied,\" \"believe\" and similar expressions generally identify forward-looking statements. Readers are cautioned not to place undue reliance on such forward-looking statements, which are being made as of the date of this press release. Any forward-looking information presented herein is made only as of the date of this press release and we undertake no obligation to update any forward-looking statements, whether as a result of new information, future events or otherwise. Media Relations Contacts:", "external_links": [], "published": "2015-10-14T18:12:00.000+03:00", "crawled": "2015-10-14T17:57:27.804+03:00", "highlightTitle": ""}