{"organizations": ["Hall", "Connected Enterprises", "Rockwell Automation, Inc.", "Facebook PlantPAx", "Rockwell Automation, Inc", "Rockwell Automation", "Complete Measurement and Process Automation Solutions and Services", "Network and Security Services"], "uuid": "22af9683a1d6dbd5bca33da034184c289218c473", "thread": {"social": {"gplus": {"shares": 0}, "pinterest": {"shares": 0}, "vk": {"shares": 0}, "linkedin": {"shares": 0}, "facebook": {"likes": 0, "shares": 0, "comments": 0}, "stumbledupon": {"shares": 0}}, "site_full": "news.scoopasia.com", "main_image": "", "site_section": "http://scoopasia.com/index.php/syndication/news/C12/", "section_title": "Press Releases - Enterprise Technology", "url": "http://news.scoopasia.com/index.php/news/rockwell_automation_and_endresshauser_to_exhibit_at_gastech_singapore_2015/", "country": "US", "title": "Rockwell Automation and Endress+Hauser to Exhibit at Gastech Singapore 2015", "performance_score": 0, "site": "scoopasia.com", "participants_count": 0, "title_full": "Rockwell Automation and Endress+Hauser to Exhibit at Gastech Singapore 2015", "spam_score": 0.0, "site_type": "news", "published": "2015-10-19T21:00:00.000+03:00", "replies_count": 0, "uuid": "22af9683a1d6dbd5bca33da034184c289218c473"}, "author": "", "url": "http://news.scoopasia.com/index.php/news/rockwell_automation_and_endresshauser_to_exhibit_at_gastech_singapore_2015/", "ord_in_thread": 0, "title": "Rockwell Automation and Endress+Hauser to Exhibit at Gastech Singapore 2015", "locations": ["Singapore", "Gastech Singapore", "Milwaukee", "Wisconsin", "Southeast Asia"], "entities": {"persons": [], "locations": [], "organizations": []}, "highlightText": "", "language": "english", "persons": ["Bob Buttermore", "Jae Kyu Kim", "Hauser"], "text": "Rockwell Automation and Endress+Hauser to Exhibit at Gastech Singapore 2015 Joint Expertise, with Complete Measurement and Process Automation Solutions and Services, Delivers Real Value to Oil and Gas Customers Singapore, 20 October 2015 -- Rockwell Automation, the largest company dedicated to industrial automation and information solutions, announced it will be participating in Gastech Singapore 2015, the world’s leading liquefied natural gas (LNG) Conference and Exhibition, held 27 – 30 October, at Singapore EXPO. Convened every 18 months in a different international location since 1973, this independently run tradeshow focuses on both the commercial and technical aspects of the LNG industry.The Rockwell Automation and Endress+Hauser strategic alliance will be exhibiting its pre-engineered, pre-tested, supported and maintained solutions – combining best-in-class instrumentation, software and control systems – to meet customer needs from exploration through refining and transportation logistics. In addition, in line with the Rockwell Automation vision of the Connected Enterprise, the company will be focusing on how oil and gas (O&G) companies can now speed high-performance production and enhance global competitiveness by securely connecting plantwide smart devices and in-the-field assets to enterprise teams and business systems. “Accelerated by the convergence of enabling technologies − such as the Internet of Things and a protected network infrastructure − O&G companies can now become Connected Enterprises by collecting and analysing critical and actionable data, and then delivering contextualised information ubiquitously and seamlessly to company business leaders,” said Bob Buttermore, Regional Director, Southeast Asia, Rockwell Automation. “As a result, operators can improve production and asset utilisation, boost operational efficiency, shorten time to market, minimise total cost of ownership and downtime, increase safety, and lower enterprise risk for a tangible competitive advantage.”“Our global partnership draws from the core competencies of both companies to produce scalable engineered solutions that include measurement, automation, services and software applications for O&G customers,” said Jae Kyu Kim, Oil and Gas Manager, Southeast Asia, Rockwell Automation. “Rockwell Automation has helped the world’s largest and most progressive O&G companies with some of the most advanced technologies and support services available. Gastech Singapore 2015 will serve as an ideal platform to showcase how our expertise, solutions and services across the O&G and LNG supply chain help customers take advantage of industry trends and overcome their key challenges.” During Gastech Singapore 2015, Rockwell Automation will be highlighting its core solutions and services in the O&G and LNG industries, including its Process Automation System based on the PlantPAx® Distributed Control System (DCS), Network and Security Services, Engineering Services, as well as Comprehensive Support Services. In addition, the company will be showcasing its emissions monitoring system, integrated information, control, power and safety (ICPS) solutions, process safety offerings, the intelligent Terminal Automation System (TAS), and the intelligent motor control solutions, which all help O&G companies maximise their productivity and reduce operational costs. Visit the Rockwell Automation booth Date: 27 – 30 October 2015 Time: 10:00 am – 4:00 pm Venue: Booth D210, Hall 3, Singapore EXPO # # # About Rockwell Automation: Rockwell Automation, Inc. (NYSE: ROK), the world’s largest company dedicated to industrial automation and information, makes its customers more productive and the world more sustainable. Headquartered in Milwaukee, Wisconsin, Rockwell Automation employs about 22,500 people serving customers in more than 80 countries. Follow ROKAutomation on Twitter Connect with ROKAutomation on Facebook PlantPAx is a trademark of Rockwell Automation, Inc. Media Contacts: Asia-Pacific Connections for Rockwell Automation +65 6334 9045", "external_links": [], "published": "2015-10-19T21:00:00.000+03:00", "crawled": "2015-10-20T12:01:59.627+03:00", "highlightTitle": ""}