{"organizations": ["Kahn Swick & Foti, LLC KSF", "Southern District of New York", "Lead Plaintiff Deadline in Class Action Lawsuit Ag Kahn Swick & Foti", "Marvell Technology Group Ltd.", "Kahn Swick & Foti"], "uuid": "de28bcfce29e83dd58d7548c17ce67c1f521d58a", "thread": {"social": {"gplus": {"shares": 0}, "pinterest": {"shares": 0}, "vk": {"shares": 0}, "linkedin": {"shares": 0}, "facebook": {"likes": 0, "shares": 0, "comments": 0}, "stumbledupon": {"shares": 0}}, "site_full": "science-technology.news-articles.net", "main_image": "", "site_section": "http://science-technology.news-articles.net/content/rss.php", "section_title": "Science and Technology @ News Articles Network", "url": "http://science-technology.news-articles.net/content/kahn-swick-foti-llc-reminds-investors-losses-excess-lead-plaintiff-deadline-class-action-lawsuit.xhtml", "country": "US", "title": "Kahn Swick & Foti, LLC Reminds Investors with Losses in Excess of $100,000 of Lead Plaintiff Deadline in Class Action Lawsuit Ag", "performance_score": 0, "site": "news-articles.net", "participants_count": 0, "title_full": "Kahn Swick & Foti, LLC Reminds Investors with Losses in Excess of $100,000 of Lead Plaintiff Deadline in Class Action Lawsuit Ag", "spam_score": 0.0, "site_type": "news", "published": "2015-10-10T11:35:00.000+03:00", "replies_count": 0, "uuid": "de28bcfce29e83dd58d7548c17ce67c1f521d58a"}, "author": "", "url": "http://science-technology.news-articles.net/content/kahn-swick-foti-llc-reminds-investors-losses-excess-lead-plaintiff-deadline-class-action-lawsuit.xhtml", "ord_in_thread": 0, "title": "Kahn Swick & Foti, LLC Reminds Investors with Losses in Excess of $100,000 of Lead Plaintiff Deadline in Class Action Lawsuit Ag", "locations": ["California", "New York", "NEW ORLEANS", "United States District Court", "LOUISIANA", "Louisiana"], "entities": {"persons": [], "locations": [], "organizations": []}, "highlightText": "", "language": "english", "persons": ["Marvell", "Lewis Kahn", "Charles C. Foti", "Jr."], "text": "Kahn Swick & Foti, LLC Reminds Investors with Losses in Excess of $100,000 of Lead Plaintiff Deadline in Class Action Lawsuit Ag   Published on 2015-10-09 22:45:29 MARVELL SHAREHOLDER ALERT BY FORMER LOUISIANA ATTORNEY GENERAL: Kahn Swick & Foti,... -- NEW ORLEANS,   <-   NEW ORLEANS ,   Kahn Swick & Foti, LLC (\"KSF\") and KSF partner, the former Attorney General of Louisiana , Charles C. Foti, Jr. , remind investors that they have until November 10, 2015 to file lead plaintiff applications in a securities class action lawsuit against Marvell Technology Group Ltd. (NasdaqGS: MRVL ) if they purchased the Company's securities between November 20, 2014 and September 10, 2015 , inclusive (the \"Class Period\"). This action is pending in the United States District Court for the Southern District of New York . What You May Do If you purchased shares of Marvell and would like to discuss your legal rights and how this case might affect you and your right to recover for your economic loss, you may, without obligation or cost to you, call toll-free at 1-877-515-1850 or email KSF Managing Partner Lewis Kahn ( lewis.kahn@ksfcounsel.com ). If you wish to serve as a lead plaintiff in this class action, you must petition the Court by November 10, 2015 . About the Lawsuit Marvell and certain of its executives are charged with failing to disclose material information during the Class Period, violating federal securities laws. On September 11, 2015 , Marvell announced its preliminary second-quarter of fiscal year 2016 results of a loss of $382.4 million , whereas analysts had predicted a profit of $11.9 million . The Company further revealed that the audit committee of the board \"is conducting an investigation of certain accounting and internal control matters,\" including whether revenue was recognized earlier than it should have been and whether senior management \"set an appropriate tone for an effective control environment.\" On this news, the price of Marvell's stock plummeted by over 16%. About Kahn Swick & Foti, LLC KSF, whose partners include the Former Louisiana Attorney General Charles C. Foti, Jr. , is a law firm focused on securities, antitrust and consumer class actions, along with merger & acquisition and breach of fiduciary litigation against publicly traded companies on behalf of shareholders. The firm has offices in New York , California and Louisiana . To learn more about KSF, you may visit www.ksfcounsel.com . Contact:", "external_links": [], "published": "2015-10-10T11:35:00.000+03:00", "crawled": "2015-10-10T11:20:50.126+03:00", "highlightTitle": ""}