{"organizations": ["Israel Aerospace Industries", "Eutelsat", "Ministry of Postal", "Facebook", "Says Frost & Sullivan By Maryanne Gicobi Social", "Spacecom"], "uuid": "8260c05a4d2e989ae29e31dc02ed65f3d33658d7", "thread": {"social": {"gplus": {"shares": 0}, "pinterest": {"shares": 0}, "vk": {"shares": 0}, "linkedin": {"shares": 0}, "facebook": {"likes": 0, "shares": 0, "comments": 0}, "stumbledupon": {"shares": 0}}, "site_full": "allafrica.com", "main_image": "http://allafrica.com/static/images/structure/aa-logo-rgba-no-text-128x128.png", "site_section": "http://allafrica.com/tools/headlines/rdf/business/headlines.rdf", "section_title": "AllAfrica News: Economy, Business and Finance", "url": "http://allafrica.com/stories/201510221635.html", "country": "US", "title": "Africa: Facebook to Use Israeli Satellite to Beam Internet to Africa", "performance_score": 0, "site": "allafrica.com", "participants_count": 0, "title_full": "Africa: Facebook to Use Israeli Satellite to Beam Internet to Africa", "spam_score": 0.0, "site_type": "news", "published": "2015-10-22T18:08:00.000+03:00", "replies_count": 0, "uuid": "8260c05a4d2e989ae29e31dc02ed65f3d33658d7"}, "author": "", "url": "http://allafrica.com/stories/201510221635.html", "ord_in_thread": 0, "title": "Africa: Facebook to Use Israeli Satellite to Beam Internet to Africa", "locations": ["Southern Africa", "West", "Africa", "Cameroon", "Gabon", "Australia", "Israel", "Sub-Saharan Africa", "Africa Africa"], "entities": {"persons": [], "locations": [], "organizations": []}, "highlightText": "", "language": "english", "persons": ["Zuckerberg", "Amos", "Mark Zuckerberg", "Amir Carmeli"], "text": "Africa: Why and How Iran Could Benefit From Australia's Expertise and Experience in Agri Food and Beverage, Says Frost & Sullivan By Maryanne Gicobi Social media giant Facebook will help communities living in remote regions in sub-Saharan Africa access fast internet connectivity using an Israeli satellite. Announcing the new development, Facebook founder Mark Zuckerberg said he was partnering with Eutelsat, a European satellite operator, to connect millions of people in sub-Saharan Africa with internet. Satellite networks are well suited to economically connect people in low to medium density population areas. The AMOS-6 satellite, built by the Israel Aerospace Industries, will be ready for launch next year, according Zuckerberg. AMOS-6 SATELLITE \"We are going to work with local partners across the regions to help communities begin accessing internet services provided through the satellite,\" said Mr Zuckerberg. Speaking to Africa Review from Israel, Amos by Spacecom -- the satellite providers -- said they have already established a satellite in Gabon airspace at a cost of $300 million. The satellite capacity has been optimised for community and direct-to-user internet access thus making it affordable. \"The satellite has high spot beams that will cover large parts of West, East and Southern Africa, this will relieve pent up demand for connectivity from the many users in Africa ,\" said Amir Carmeli, the Amos by Spacecom sales head. FREE INTERNET SERVICES Amos by Spacecom has previously worked in Cameroon with the country's Ministry of Postal and Telecommunications to provide broadband and internet connectivity services to 125 schools and community centres. Sub-Saharan Africa will start enjoying the fast internet services in April next year. \"I am happy to announce our first project to deliver internet from space, over the last year, Facebook has been exploring ways to use aircraft and satellite to beam internet access down into communities from the skies,\" said Mr Zuckerberg in a post. Mr Zuckerberg said aiming to connect people living in remote regions using the traditional connectivity infrastructure has been difficult and inefficient so there was need to invest new technologies. Africa \nFree education in South Africa is a goal worth pursuing, especially for students who are poor and want access to … see more » Copyright © 2015 The Nation. All rights reserved. Distributed by AllAfrica Global Media ( allAfrica.com ). To contact the copyright holder directly for corrections — or for permission to republish or make other authorized use of this material, click here. AllAfrica publishes around 1,600 reports a day from more than 140 news organizations and over 500 other institutions and individuals , representing a diversity of positions on every topic. We publish news and views ranging from vigorous opponents of governments to government publications and spokespersons. Publishers named above each report are responsible for their own content, which AllAfrica does not have the legal right to edit or correct. Articles and commentaries that identify allAfrica.com as the publisher are produced or commissioned by AllAfrica . To address comments or complaints, please Contact us .", "external_links": [], "published": "2015-10-22T18:08:00.000+03:00", "crawled": "2015-10-23T03:17:17.289+03:00", "highlightTitle": ""}