{"organizations": ["SES S.A.", "International Congress Center München", "SES Platform Services", "Fox International Channels Germany", "Milestone Munich", "Luxembourg SES Platform Services", "Television Entertainment Reality Network"], "uuid": "b901362323b463cc50fec09031b4e62111d7cfbf", "thread": {"social": {"gplus": {"shares": 0}, "pinterest": {"shares": 0}, "vk": {"shares": 0}, "linkedin": {"shares": 0}, "facebook": {"likes": 0, "shares": 0, "comments": 0}, "stumbledupon": {"shares": 0}}, "site_full": "businesswireindia.com", "main_image": "", "site_section": "http://businesswireindia.com/RSSFeeds/cat-business-finance.xml", "section_title": "BusinessWire India.com - Business/ Finance", "url": "http://businesswireindia.com/news/news-details/ses-platform-services-fluid-hub-passes-10-customer-milestone/45778", "country": "US", "title": "SES Platform Services' Fluid Hub Passes 10-Customer Milestone", "performance_score": 0, "site": "businesswireindia.com", "participants_count": 0, "title_full": "SES Platform Services' Fluid Hub Passes 10-Customer Milestone", "spam_score": 0.0, "site_type": "news", "published": "2015-10-20T14:23:00.000+03:00", "replies_count": 0, "uuid": "b901362323b463cc50fec09031b4e62111d7cfbf"}, "author": "", "url": "http://businesswireindia.com/news/news-details/ses-platform-services-fluid-hub-passes-10-customer-milestone/45778", "ord_in_thread": 0, "title": "SES Platform Services' Fluid Hub Passes 10-Customer Milestone", "locations": ["Munich", "Paris", "Europe", "Germany"], "entities": {"persons": [], "locations": [], "organizations": []}, "highlightText": "", "language": "english", "persons": ["Sophie Lersch", "Turner"], "text": "Tuesday, October 20, 2015 4:53PM IST (11:23AM GMT) SES Platform Services' Fluid Hub Passes 10-Customer Milestone Munich, Germany and Luxembourg SES Platform Services, a wholly-owned subsidiary of SES S.A. (NYSE Paris:SESG) (LuxX:SESG) and one of Europe’s leading technical media service providers, today announced that its FLUID HUB solution is being utilised by more than 10 broadcasters – just a few months after its launch. FLUID HUB, which provides a managed cloud service for the management and distribution of video content, was released in April. The FLUID HUB customer base currently includes broadcasters Fox International Channels Germany and Turner, as well as content creators and distributors such as Beta Film. Two customers are already using it to manage and distribute Ultra High Definition (UHD) content – including INSIGHT, the first-ever Ultra HD channel of Television Entertainment Reality Network. “To have so many customers choosing the solution so soon after launch and for UHD content reinforces how vital the service is to the broadcasting market,” said Sophie Lersch, Chief Product Officer for Services at SES Platform Services. “The feedback from our customers is very positive, with many of them emphasizing the intuitive interface and easy-to-use workflow, which enables content delivery via a few simple steps. In regards to UHD content, we are one of the first service providers capable of offering a full workflow chain all the way up to delivery to VOD portals, playout and uplink to our satellites.” FLUID HUB is a professional, secure, managed cloud environment for efficient and secure video content and metadata management and distribution to any platform, including Video-On-Demand (VOD), streaming and satellite. Currently, SES Platform Services distributes more than 2,000 hours of video content per month to all major VOD portals in central Europe. SES Platform Services will showcase its range of digital distribution technology at Medientage München at stand C1, Foyer, Basement. The event takes place at International Congress Center München (ICM) in Munich, Germany, from Wednesday, 21 October to Friday, 23 October. For information on FLUID HUB , visit the SES Platform Services website .", "external_links": [], "published": "2015-10-20T14:23:00.000+03:00", "crawled": "2015-10-20T14:57:57.207+03:00", "highlightTitle": ""}