{"organizations": ["KDF", "Kamandura Girls' High School"], "uuid": "15370d9d1679e288c08166d8013c25bdecb6b1bb", "thread": {"social": {"gplus": {"shares": 0}, "pinterest": {"shares": 0}, "vk": {"shares": 0}, "linkedin": {"shares": 0}, "facebook": {"likes": 0, "shares": 0, "comments": 0}, "stumbledupon": {"shares": 0}}, "site_full": "allafrica.com", "main_image": "http://allafrica.com/static/images/structure/aa-logo-rgba-no-text-128x128.png", "site_section": "http://allafrica.com/tools/headlines/rdf/business/headlines.rdf", "section_title": "AllAfrica News: Economy, Business and Finance", "url": "http://allafrica.com/stories/201510250166.html", "country": "US", "title": "Kenya: Hope for Industry As School Films Recognised", "performance_score": 0, "site": "allafrica.com", "participants_count": 0, "title_full": "Kenya: Hope for Industry As School Films Recognised", "spam_score": 0.0, "site_type": "news", "published": "2015-10-25T12:29:00.000+02:00", "replies_count": 0, "uuid": "15370d9d1679e288c08166d8013c25bdecb6b1bb"}, "author": "", "url": "http://allafrica.com/stories/201510250166.html", "ord_in_thread": 0, "title": "Kenya: Hope for Industry As School Films Recognised", "locations": ["Kenya", "Somalia"], "entities": {"persons": [], "locations": [], "organizations": []}, "highlightText": "", "language": "english", "persons": ["Phylis Wamaitha", "Tess", "Mark", "Sharon Gitonga", "Kamau", "Titus Ndung", "Anthony Njagi", "Cathy", "Sharon Kasandi", "Msupa"], "text": "Kenya: KDF Troops Kill 15 Al-Shabaab Terrorists in Somalia, Destroy Operations Base By Anthony Njagi The Kenyan film industry's future looks bright after 10 films from the Kenya Schools and Colleges festivals were nominated for the Out of Africa International Film Festival. This has given hope to industry players that the film and television scene in the country will never lack in material as the students have shown unmatched zeal and enthusiasm in making world-class films. Some of the film trailers have been uploaded on Youtube under the title of Afpeik films. Out of Africa International Film Festival was formed with a goal to provide a platform that brings together global independent filmmakers, producers, promoters and other stakeholders in a common space to explore their stories freely and market the films to a global audience. This year Kamandura Girls' High School scooped the top honours in the screenplay category with a titillating and well directed, acted and produced piece called Anti-Dre. The winning film in the Kenya Schools and Colleges National Drama Festival is about a girl who has had a rough upbringing and neglect from her drug addicted mother. Luckily, Cathy gets sponsored to high school. While in school, she starts a dance group called Anti-Dre, which she uses to educate her peers about the negative effects of drugs abuse. The Film features Gift Terry (Sylvia), Sharon Kasandi (Tess), Sharon Gitonga (Shiru) and Phylis Wamaitha as Msupa. Also Winnie Kamau playing as Cathy and teacher Titus Ndung'u as Mr Mark the drug dealer. Kenya \nTanzanians started voting in presidential and general elections Sunday, in what is expected to be the tightest race in … see more » Copyright © 2015 The Nation. All rights reserved. Distributed by AllAfrica Global Media ( allAfrica.com ). To contact the copyright holder directly for corrections — or for permission to republish or make other authorized use of this material, click here. AllAfrica publishes around 1,600 reports a day from more than 140 news organizations and over 500 other institutions and individuals , representing a diversity of positions on every topic. We publish news and views ranging from vigorous opponents of governments to government publications and spokespersons. Publishers named above each report are responsible for their own content, which AllAfrica does not have the legal right to edit or correct. Articles and commentaries that identify allAfrica.com as the publisher are produced or commissioned by AllAfrica . To address comments or complaints, please Contact us .", "external_links": [], "published": "2015-10-25T12:29:00.000+02:00", "crawled": "2015-10-25T18:35:29.063+02:00", "highlightTitle": ""}