{"organizations": ["Las Vegas", "Siebel", "SAP", "Oracle Corporation", "International Expansion and Service", "Inc", "Inc.", "Las Vegas Metro Chamber of Commerce and Inc. magazine's Inc.", "PeopleSoft", "JMP Securities"], "uuid": "173d115f5acf3495e27562ed5f7dc4db605cf258", "thread": {"social": {"gplus": {"shares": 0}, "pinterest": {"shares": 0}, "vk": {"shares": 0}, "linkedin": {"shares": 0}, "facebook": {"likes": 0, "shares": 0, "comments": 0}, "stumbledupon": {"shares": 0}}, "site_full": "businesswireindia.com", "main_image": "", "site_section": "http://businesswireindia.com/RSSFeeds/cat-business-finance.xml", "section_title": "BusinessWire India.com - Business/ Finance", "url": "http://businesswireindia.com/news/news-details/rimini-street-named-jmp-securities-hot-100-best-privately-held-softwar/45682", "country": "US", "title": "Rimini Street Named to JMP Securities’ “Hot 100 Best Privately Held Software Companies” List", "performance_score": 0, "site": "businesswireindia.com", "participants_count": 0, "title_full": "Rimini Street Named to JMP Securities’ “Hot 100 Best Privately Held Software Companies” List", "spam_score": 0.0, "site_type": "news", "published": "2015-10-14T09:09:00.000+03:00", "replies_count": 0, "uuid": "173d115f5acf3495e27562ed5f7dc4db605cf258"}, "author": "", "url": "http://businesswireindia.com/news/news-details/rimini-street-named-jmp-securities-hot-100-best-privately-held-softwar/45682", "ord_in_thread": 0, "title": "Rimini Street Named to JMP Securities’ “Hot 100 Best Privately Held Software Companies” List", "locations": ["Rimini", "San Francisco", "Rimini Street", "United States Rimini Street"], "entities": {"persons": [], "locations": [], "organizations": []}, "highlightText": "", "language": "english", "persons": ["Seth Ravin", "JD Edwards"], "text": "Wednesday, October 14, 2015 11:39AM IST (6:09AM GMT) Rimini Street Named to JMP Securities’ “Hot 100 Best Privately Held Software Companies” List Leading independent software support provider recognized for a fourth time by major investment bank Las Vegas, United States Rimini Street, Inc. , the leading independent provider of enterprise software support services for SAP SE’s (NYSE:SAP) Business Suite and BusinessObjects software and Oracle Corporation’s (NYSE:ORCL) Siebel , PeopleSoft , JD Edwards , E-Business Suite , Oracle Database , Oracle Middleware , Hyperion , Oracle Retail and Oracle Agile PLM software, announced that JMP Securities has named Rimini Street to its “Hot 100 Best Privately Held Software Companies” list for 2015. This is the fourth time Rimini Street has been recognized in this annual listing of leading, innovative private companies as determined by the San Francisco investment bank based on financial growth, product innovation, quality of leadership, customer traction and market potential. Strong Growth, International Expansion and Service Focus Reinforce Industry-Leading Position In the past year, Rimini Street has strengthened its position as the leading independent software support provider through its accelerated global expansion, record growth, quarterly results and new service announcements. This recognition follows other recent awards for Rimini Street, including two Stevie Awards for outstanding customer service and IT support, a 2015 Business Excellence Award honoree by the Las Vegas Metro Chamber of Commerce and Inc. magazine's Inc. 5000 listing for the fifth consecutive year, an exclusive ranking of the nation's fastest-growing private companies. “Rimini Street is honored to once again be named by JMP Securities to this prestigious list,” said Seth Ravin , CEO, Rimini Street. “We continue to focus our efforts on delivering premium, value-driven maintenance services to a rapidly expanding global client base. Rimini Street clients enjoy a response from a senior engineer within five minutes, 24x7x365, for serious issues, and can save up to 90 percent in total operating costs over a decade.” About Rimini Street, Inc. Rimini Street is the global leader in providing independent enterprise software support services. The company has redefined enterprise support services since 2005 with an innovative, award-winning program that enables Oracle and SAP licensees to save up to 90 percent on total support costs. Clients can remain on their current software release without any required upgrades for at least 15 years. Over 1,150 global, Fortune 500, midmarket, and public sector organizations from a broad range of industries have selected Rimini Street as their trusted, independent support provider. To learn more, please visit http://www.riministreet.com . Forward-Looking Statements This press release may contain forward-looking statements. The words “believe,”“may,”“will,”“estimate,”“continue,”“anticipate,”“intend,”“plan,”“expect,” and similar expressions are intended to identify forward-looking statements. These forward-looking statements are subject to risks and uncertainties, and are based on various assumptions. If the risks materialize or our assumptions prove incorrect, actual results could differ materially from the results implied by these forward-looking statements. Rimini Street assumes no obligation to update any forward-looking statements or information, which speak only as of the date of this press release. Rimini Street and the Rimini Street logo are trademarks of Rimini Street, Inc. All other company and product names may be trademarks.", "external_links": [], "published": "2015-10-14T09:09:00.000+03:00", "crawled": "2015-10-14T09:53:57.006+03:00", "highlightTitle": ""}