{"organizations": ["IGP"], "uuid": "957c2a154876fcfe824f6f39756e72c52162a8f6", "thread": {"social": {"gplus": {"shares": 0}, "pinterest": {"shares": 0}, "vk": {"shares": 0}, "linkedin": {"shares": 0}, "facebook": {"likes": 0, "shares": 0, "comments": 0}, "stumbledupon": {"shares": 0}}, "site_full": "allafrica.com", "main_image": "http://allafrica.com/static/images/structure/aa-logo-rgba-no-text-128x128.png", "site_section": "http://allafrica.com/tools/headlines/rdf/business/headlines.rdf", "section_title": "AllAfrica News: Economy, Business and Finance", "url": "http://allafrica.com/stories/201510121918.html", "country": "US", "title": "Uganda: Kayihura's Car Knocks Boda Rider Dead, Apologises to Angry Mob", "performance_score": 0, "site": "allafrica.com", "participants_count": 0, "title_full": "Uganda: Kayihura's Car Knocks Boda Rider Dead, Apologises to Angry Mob", "spam_score": 0.0, "site_type": "news", "published": "2015-10-12T14:33:00.000+03:00", "replies_count": 0, "uuid": "957c2a154876fcfe824f6f39756e72c52162a8f6"}, "author": "", "url": "http://allafrica.com/stories/201510121918.html", "ord_in_thread": 0, "title": "Uganda: Kayihura's Car Knocks Boda Rider Dead, Apologises to Angry Mob", "locations": ["Police Kale Kayihura", "Kyarumba", "Kasese", "Uganda", "Kampala", "Kilembe", "Kayihura", "Mughete"], "entities": {"persons": [], "locations": [], "organizations": []}, "highlightText": "", "language": "english", "persons": ["Margherita", "Museveni", "Eriya Kule", "Enid Ninsiima Kasese", "Kule", "Nyondo", "Kayihura"], "text": "Uganda: Independence and 2016 Elections By Enid Ninsiima Kasese — The Inspector General (IGP) of Police Kale Kayihura yesterday asked for forgiveness from the rowdy boda-boda riders in Kasese town following the death of their colleague who was knocked dead by one of the vehicles in his convoy. \"l am very sorry for the death of your colleague. I will make sure that I take care of his family and go to his home in Kyarumba for burial,\" said the IGP who was heavily guarded. \"We have already arrested the driver and he will be charged with causing death by reckless driving. I am rushing to Kampala and I will come back and we talk,\" the IGP said. His intervention followed commotion that erupted in Kasese town along Kilembe road Sunday morning as boda-boda riders pelted stones at police accusing them of killing their colleague. Police in exchange fired tear gas canisters at the protesting crowd. Eriya Kule, 32, a resident of Nyondo in Mughete parish Kyarumba sub -county, Kasese district and plied his trade at Kilembe stage near shell petrol station in Kasese town was the victim of the 8:40am accident and died on spot. As Mr Kule crossed the road heading to Margherita hotel, he was knocked by one of the vehicles in the IGP's convoy. According to his colleagues Kule had just come out of prison on defilement charges. The cyclists attempted to torch one of the vehicles in the IGP's convoy but were restrained by police. The IGP later returned at the scene under heavy guard to console the boda boda riders. \"Your boys drive recklessly on the road. We request you to arrest yourself and record a statement with your juniors because any slight mistake that we make, we are arrested, charged and made to pay heavily,\" the boda-boda riders shouted. They asked the IGP to answer why he was being driven at high speed and why there was no lead car with a siren to alert other motorist to clear the way for him. Kayihura is in the district to ensure security ahead of president Museveni's scheduled visit tomorrow (Tuesday) where they will pass out crime preventers. Uganda \nRefinery area families protest delayed resettlement, give government sixty days to act. see more » Copyright © 2015 The Monitor. All rights reserved. Distributed by AllAfrica Global Media ( allAfrica.com ). To contact the copyright holder directly for corrections — or for permission to republish or make other authorized use of this material, click here. AllAfrica publishes around 2,000 reports a day from more than 130 news organizations and over 200 other institutions and individuals , representing a diversity of positions on every topic. We publish news and views ranging from vigorous opponents of governments to government publications and spokespersons. Publishers named above each report are responsible for their own content, which AllAfrica does not have the legal right to edit or correct. Articles and commentaries that identify allAfrica.com as the publisher are produced or commissioned by AllAfrica . To address comments or complaints, please Contact us .", "external_links": [], "published": "2015-10-12T14:33:00.000+03:00", "crawled": "2015-10-12T21:50:27.671+03:00", "highlightTitle": ""}