{"organizations": ["West End Neighborhood House", "Cypress Capital Management", "Array Financial", "WSFS Financial Corporation WSFS Financial Corporation", "Piedmont Baseball League", "Wilmington University", "Christiana Trust", "WSFS Financial Corporation", "Dover Air Force Base", "M&T Bank Corporation", "University of Delaware", "WSFS Wealth Investments", "Golf Committee Member for the Catholic Youth Ministries", "WSFS", "WSFS Bank", "Delaware State Chamber Small Business Alliance Advisory Council", "Serviam Girls Academy Finance Committee"], "uuid": "75e1009c59c109100a64454bfd6b48d9b9f553e5", "thread": {"social": {"gplus": {"shares": 0}, "pinterest": {"shares": 0}, "vk": {"shares": 0}, "linkedin": {"shares": 0}, "facebook": {"likes": 0, "shares": 0, "comments": 0}, "stumbledupon": {"shares": 0}}, "site_full": "globenewswire.com", "main_image": "http://globenewswire.com/Attachment/LogoDisplay/347389?filename=347389.jpg&amp;size=1", "site_section": "http://globenewswire.com//Rss/industry/8779/Mortgage%20Finance", "section_title": "GlobeNewswire: Industry News on Mortgage Finance", "url": "http://globenewswire.com/news-release/2015/10/21/778727/0/en/TrustCo-Announces-Solid-Third-Quarter-2015-Earnings.html?f=22&fvtc=3&fvtv=8779", "country": "US", "title": "Photo Release -- WSFS Strengthens Commercial Banking Division With Three Experienced Relationship Managers", "performance_score": 0, "site": "globenewswire.com", "participants_count": 0, "title_full": "Photo Release -- WSFS Strengthens Commercial Banking Division With Three Experienced Relationship Managers", "spam_score": 0.0, "site_type": "news", "published": "2015-10-20T23:16:00.000+03:00", "replies_count": 0, "uuid": "75e1009c59c109100a64454bfd6b48d9b9f553e5"}, "author": "", "url": "http://globenewswire.com/news-release/2015/10/21/778727/0/en/TrustCo-Announces-Solid-Third-Quarter-2015-Earnings.html?f=22&fvtc=3&fvtv=8779", "ord_in_thread": 0, "title": "Photo Release -- WSFS Strengthens Commercial Banking Division With Three Experienced Relationship Managers", "locations": ["United States", "Delaware Valley", "Miami", "Delaware", "Virginia", "Maryland", "Pennsylvania", "Nevada"], "entities": {"persons": [], "locations": [], "organizations": []}, "highlightText": "", "language": "english", "persons": ["Steve Clark", "John Matarese", "Kristin Pearce", "Kristin", "John", "Christopher Scarpitti", "Christopher"], "text": "http://www.globenewswire.com/NewsRoom/AttachmentNg/8157a1e6-e063-429b-9b2a-d70af7ebf9d3 Christopher Scarpitti joins WSFS as Vice President and Senior Relationship Manager in the Business Banking Division. He brings with him over 20 years of local banking experience with M&T Bank Corporation, 18 of which were spent in commercial banking serving clients in Delaware, Pennsylvania and Maryland. He has held positions in business development and client management, with the last seven years spent overseeing the local commercial and industrial portfolio. Christopher received his B.S. in Banking and Finance from Wilmington University in 1995 and continued on to receive his MBA from Wilmington University in 2000. He currently serves on the Delaware State Chamber Small Business Alliance Advisory Council and Superstars in Business Selection Committee. In his free time, Christopher is a volunteer at Piedmont Baseball League and Cub Scout Pack 830. John Matarese joins WSFS as Vice President and Relationship Manager in the Middle Market Division. John joins WSFS following nine years with M&T Bank Corporation where he was most recently a Middle Market Relationship Manager. Prior to that role, John acted as a credit analyst and a portfolio manager. John received his B.S. in Business Administration from the University of Delaware in 2003. He serves as a Board Member for the West End Neighborhood House, a Golf Committee Member for the Catholic Youth Ministries and Honorary Commander at the Dover Air Force Base. Kristin Pearce joins WSFS as Vice President, Relationship Manager in the Business Banking Division. Prior to joining WSFS, Kristin spent nine years at M&T Bank Corporation. During her time there, she acted as a credit analyst, commercial banking portfolio manager and as a relationship manager. In her previous position, Kristin also served on the inaugural Diversity Development Program to help establish and engrain diversity initiatives throughout the bank. Kristin received her MBA from the University of Delaware in 2013. She is an alumna of the University of Miami, where she received her B.S. in Business Administration in 2006. In her spare time, Kristin serves as a member of the Serviam Girls Academy Finance Committee. “Having a seasoned team, such as this one, join WSFS is really exciting for us and our community,” said Steve Clark, acting Chief Commercial Banking Officer. “Their depth and breadth of knowledge of the local business market and financial expertise will benefit both new and existing commercial banking clients.” About WSFS Financial Corporation WSFS Financial Corporation is a multi-billion dollar financial services company. Its primary subsidiary, WSFS Bank, is the oldest and largest locally managed bank and trust company headquartered in the Delaware Valley. As of June 30, WSFS Financial Corporation had $5.1 billion in assets on its balance sheet and $9.5 billion in fiduciary assets, including approximately $1.2 billion in assets under management. As of October 13, 2015, WSFS operates from 63 offices located in Delaware (44), Pennsylvania (17), Virginia (1) and Nevada (1) and provides comprehensive financial services including commercial banking, retail banking and trust and wealth management. Other subsidiaries or divisions include Christiana Trust, WSFS Wealth Investments, Cypress Capital Management, LLC, Cash Connect ® , Array Financial and Arrow Land Transfer. Serving the Delaware Valley since 1832, WSFS Bank is the seventh oldest bank in the United States continuously operating under the same name. For more information, please visit wsfsbank.com. \nThe photos are also available via AP PhotoExpress. Media Contact: Cortney Klein (302) 571-5253 cklein@wsfsbank.com Related Articles other press releases by WSFS Financial Corporation", "external_links": [], "published": "2015-10-20T23:16:00.000+03:00", "crawled": "2015-10-22T10:05:57.506+03:00", "highlightTitle": ""}