{"organizations": ["MEPDECK Solutions Pte.", "NDT", "Port Harcourt Chamber of Commerce"], "uuid": "2c9dcf3b5e96aa756d73cfd02dc01b28da633c70", "thread": {"social": {"gplus": {"shares": 0}, "pinterest": {"shares": 0}, "vk": {"shares": 0}, "linkedin": {"shares": 0}, "facebook": {"likes": 0, "shares": 0, "comments": 0}, "stumbledupon": {"shares": 0}}, "site_full": "allafrica.com", "main_image": "http://allafrica.com/static/images/structure/aa-logo-rgba-no-text-128x128.png", "site_section": "http://allafrica.com/tools/headlines/rdf/business/headlines.rdf", "section_title": "AllAfrica News: Economy, Business and Finance", "url": "http://allafrica.com/stories/201510170064.html", "country": "US", "title": "Nigeria: Elshcon, Singaporean Firm Partner On Marine Products", "performance_score": 0, "site": "allafrica.com", "participants_count": 0, "title_full": "Nigeria: Elshcon, Singaporean Firm Partner On Marine Products", "spam_score": 0.0, "site_type": "news", "published": "2015-10-17T15:18:00.000+03:00", "replies_count": 0, "uuid": "2c9dcf3b5e96aa756d73cfd02dc01b28da633c70"}, "author": "", "url": "http://allafrica.com/stories/201510170064.html", "ord_in_thread": 0, "title": "Nigeria: Elshcon, Singaporean Firm Partner On Marine Products", "locations": ["Nigeria", "Thailand", "Malaysia", "Gulf of Guinea", "Singapore", "Indonesia", "Elshcon", "Vietnam"], "entities": {"persons": [], "locations": [], "organizations": []}, "highlightText": "", "language": "english", "persons": ["Emi Membere-Otaji", "Membere-Otaji", "MEPDECK", "Elshcon", "Nelson Lau"], "text": "Nigeria: Tope Agbeyo Bags 'Outstanding Philanthropic Achievement' Award Elshcon Nigeria Limited (Elshcon) has signed agreement to represent MEPDECK Solutions Pte. Limited, a leading one-stop systems provider of anchoring, towing and mooring systems for the marine and offshore market in Singapore. The representative agreement empowers Elshcon to promote, represent and market all MEPDECK's products within the Gulf of Guinea. By mutual agreement, MEPDECK also represents Elshcon's goods and services within Singapore, Malaysia, Indonesia, Vietnam and Thailand. Speaking at the signing of the agreement, Managing Director/CEO of Elshcon, Dr. Emi Membere-Otaji expressed his confidence in this synergy, adding that it was an exciting development given the dynamic evolvement of Elshcon. Membere-Otaji, who will be inaugurated next month as the President of Port Harcourt Chamber of Commerce, said the development would widen market opportunities for both companies. In his remarks, the Managing Director and Chief Executive Officer of MEP DECK, Mr. Nelson Lau expressed his belief that this integration was a perfect fit for prospective clients in order to develop a more comprehensive market for marine and offshore products within the Gulf of Guinea. The products in view to be distributed and marketed by Elshcon include those for anchoring, towing and mooring systems namely: anchors, anchor chains and fittings, hull fittings, steel wire ropes, synthetic ropes, and handling systems. Others are for cargo handling systems including: dry bulk, liquid mud, methanol, mud tank and integrated cargo control system. The rest includes gas mixing systems and NDT wire rope testing; deck machineries and cranes: towing/mooring winches, windlass, capstan, deck cranes, hydraulic power pack, shark jaw and towing pin. Founded in 1990, Elshcon is an integrated Nigerian indigenous group of companies operating in the energy and marine sectors with focus on value, client satisfaction and retention. The company's management expertise and experience in the oil and gas as well as maritime industry is reputed as second to none. Nigeria \nFOLLOWING the confirmation of President Muhammadu Buhari's nominees for ministerial appointment by the Nigerian Senate … see more » Copyright © 2015 This Day. All rights reserved. Distributed by AllAfrica Global Media ( allAfrica.com ). To contact the copyright holder directly for corrections — or for permission to republish or make other authorized use of this material, click here. AllAfrica publishes around 1,700 reports a day from more than 140 news organizations and over 500 other institutions and individuals , representing a diversity of positions on every topic. We publish news and views ranging from vigorous opponents of governments to government publications and spokespersons. Publishers named above each report are responsible for their own content, which AllAfrica does not have the legal right to edit or correct. Articles and commentaries that identify allAfrica.com as the publisher are produced or commissioned by AllAfrica . To address comments or complaints, please Contact us .", "external_links": [], "published": "2015-10-17T15:18:00.000+03:00", "crawled": "2015-10-18T01:54:45.872+03:00", "highlightTitle": ""}