{"organizations": ["Siebel", "Expansion Across Greater China Wednesday", "Oracle Corporation", "ChemChina", "APAC", "Inc", "Inc.", "CIO for China National Chemical Corporation", "PeopleSoft", "Tempel Steel Company", "APAC Growth The Company", "NCH Corporation", "Rimini Street Software Technical Services", "Sympatex Holding GmbH", "SAP", "Expansion Across Greater China Company", "Greater China Energy/Natural Resources & Chemical", "Ltd.", "ERP"], "uuid": "4d3e8ea8d1ad9ea306e983c565fe080338a631bb", "thread": {"social": {"gplus": {"shares": 0}, "pinterest": {"shares": 0}, "vk": {"shares": 0}, "linkedin": {"shares": 0}, "facebook": {"likes": 0, "shares": 0, "comments": 0}, "stumbledupon": {"shares": 0}}, "site_full": "businesswireindia.com", "main_image": "", "site_section": "http://businesswireindia.com/RSSFeeds/cat-business-finance.xml", "section_title": "BusinessWire India.com - Business/ Finance", "url": "http://businesswireindia.com/news/news-details/rimini-street-appoints-industry-veteran-lead-growth-expansion-across-g/45684", "country": "US", "title": "Rimini Street Appoints Industry Veteran to Lead Growth and Expansion Across Greater China", "performance_score": 0, "site": "businesswireindia.com", "participants_count": 0, "title_full": "Rimini Street Appoints Industry Veteran to Lead Growth and Expansion Across Greater China", "spam_score": 0.0, "site_type": "news", "published": "2015-10-14T09:31:00.000+03:00", "replies_count": 0, "uuid": "4d3e8ea8d1ad9ea306e983c565fe080338a631bb"}, "author": "", "url": "http://businesswireindia.com/news/news-details/rimini-street-appoints-industry-veteran-lead-growth-expansion-across-g/45684", "ord_in_thread": 0, "title": "Rimini Street Appoints Industry Veteran to Lead Growth and Expansion Across Greater China", "locations": ["Las Vegas", "Rimini", "HK", "Taiwan", "Hong Kong", "Rimini Street", "United States Rimini Street", "Beijing", "Greater China", "China"], "entities": {"persons": [], "locations": [], "organizations": []}, "highlightText": "", "language": "english", "persons": ["Accenture", "Seth Ravin", "JD Edwards", "Chou", "Frank Chou"], "text": "Wednesday, October 14, 2015 12:01PM IST (6:31AM GMT) Rimini Street Appoints Industry Veteran to Lead Growth and Expansion Across Greater China Company builds on 231% growth across APAC region Beijing, China and Las Vegas, United States Rimini Street, Inc. , the leading independent provider of enterprise software support services for SAP SE’s (NYSE:SAP) Business Suite and BusinessObjects software and Oracle Corporation’s (NYSE:ORCL) Siebel , PeopleSoft , JD Edwards , E-Business Suite , Oracle Database , Oracle Middleware , Hyperion , Oracle Retail and Oracle Agile PLM software, announced the appointment of Frank Chou as general manager, Greater China. In this newly created role, Chou is responsible for leading the growth and expansion of Rimini Street’s service offerings across Greater China, which includes China, Hong Kong and Taiwan. The region represents one of the largest market opportunities for the Company’s new class of enterprise software support services for Oracle and SAP clients. The company is expanding operations in Greater China due to strong local market demand as well as continued fast-paced growth throughout the APAC region, including a 231% increase in APAC revenue in the 12-month period ending June 30, 2015, compared with the prior 12-month period. This Smart News Release features multimedia. View the full release here: http://www.businesswire.com/news/home/20151013006888/en/ Frank Chou brings CIO and IT leadership experience to Rimini Street as the company's newly appointed general manager for Greater China. (Photo: Business Wire) Chou Brings CIO and IT Leadership Experience to Rimini Street Prior to joining Rimini Street, Chou served as the CIO for China National Chemical Corporation (ChemChina), where he led management transformation and IT initiatives. During his time at ChemChina, he was recognized and named as one of the Chinese Chief Information Officer Union's “Top 100 CIOs of 2014.” Before this, Chou spent over 20 years as a consultant with Accenture, culminating his tenure there as the lead partner for the firm's Greater China Energy/Natural Resources & Chemical practice. “Dissatisfaction with the software vendor’s maintenance and support is a common occurrence among CIOs and IT users in Greater China,” said Chou. “The independent software maintenance and support offered by Rimini Street creates new ’rules of the game’ by bringing a more compelling and value-driven choice to CIOs in this region. We have had enthusiastic response to our market entry here, and look forward to continuing to deliver our award-winning services and support to Oracle and SAP licensees across the Greater China region.” Expansion in Greater China to Build on Continuing APAC Growth The Company’s expansion into Greater China addresses one of the largest ERP markets in the world. Rimini Street currently supports 67 global companies with operations in Greater China, including ChemChina, Sympatex Holding GmbH, NCH Corporation, Tempel Steel Company and Southco, Inc. The Company is building on robust growth across the entire APAC region, with a 142% percent increase in signed clients as of June 30, 2015, compared to a year ago. Rimini Street (HK) Ltd. commenced operations in Hong Kong in July 2015, and Rimini Street will operate its Greater China headquarters from Beijing as Rimini Street Software Technical Services (Beijing) Ltd. “We entered the Greater China market based on growing demand and opportunity in the region, and are now expanding our local infrastructure, operation and capabilities,” said Seth Ravin , Rimini Street CEO. “As a CIO who personally embraced the value and benefits of independent maintenance by selecting Rimini Street support for his prior employer, and has deep IT industry and regional experience, we believe Mr. Chou is uniquely qualified to lead Rimini Street’s expansion and investment in Greater China. We are very pleased to welcome Mr. Chou to our global executive leadership team.” To learn more, follow @riministreet on Twitter and find Rimini Street on Facebook and LinkedIn . About Rimini Street, Inc. Rimini Street is the global leader in providing independent enterprise software support services. The company has redefined enterprise support services since 2005 with an innovative, award-winning program that enables Oracle and SAP licensees to save up to 90 percent on total support costs. Clients can remain on their current software release without any required upgrades for at least 15 years. Over 1,150 global, Fortune 500, midmarket, and public sector organizations from a broad range of industries have selected Rimini Street as their trusted, independent support provider. To learn more, please visit http://www.riministreet.com . Forward-Looking Statements This press release may contain forward-looking statements. The words “believe,”“may,”“will,”“estimate,”“continue,”“anticipate,”“intend,”“plan,”“expect,” and similar expressions are intended to identify forward-looking statements. These forward-looking statements are subject to risks and uncertainties, and are based on various assumptions. If the risks materialize or our assumptions prove incorrect, actual results could differ materially from the results implied by these forward-looking statements. Rimini Street assumes no obligation to update any forward-looking statements or information, which speak only as of the date of this press release. Rimini Street and the Rimini Street logo are trademarks of Rimini Street, Inc. All other company and product names may be trademarks of their respective owners. Copyright © 2015. All rights reserved.", "external_links": [], "published": "2015-10-14T09:31:00.000+03:00", "crawled": "2015-10-14T09:53:42.327+03:00", "highlightTitle": ""}