{"organizations": ["Transterra Media", "Tech Startup", "Security Wall", "Startup Istanbul", "Startup Istanbul Challenge"], "uuid": "0e9022a1ed2a26d418f42013ffde0c0bf0b073f9", "thread": {"social": {"gplus": {"shares": 0}, "pinterest": {"shares": 0}, "vk": {"shares": 0}, "linkedin": {"shares": 0}, "facebook": {"likes": 0, "shares": 0, "comments": 0}, "stumbledupon": {"shares": 0}}, "site_full": "allafrica.com", "main_image": "http://allafrica.com/static/images/structure/aa-logo-rgba-no-text-128x128.png", "site_section": "http://allafrica.com/tools/headlines/rdf/business/headlines.rdf", "section_title": "AllAfrica News: Economy, Business and Finance", "url": "http://allafrica.com/stories/201510141180.html", "country": "US", "title": "Kenya: Kenyan Tech Startup - Nims - Wins Istanbul Challenge 2015", "performance_score": 0, "site": "allafrica.com", "participants_count": 0, "title_full": "Kenya: Kenyan Tech Startup - Nims - Wins Istanbul Challenge 2015", "spam_score": 0.0, "site_type": "news", "published": "2015-10-14T14:23:00.000+03:00", "replies_count": 0, "uuid": "0e9022a1ed2a26d418f42013ffde0c0bf0b073f9"}, "author": "", "url": "http://allafrica.com/stories/201510141180.html", "ord_in_thread": 0, "title": "Kenya: Kenyan Tech Startup - Nims - Wins Istanbul Challenge 2015", "locations": ["Iran", "Hungary", "Nigeria", "Pakistan", "Kenya", "Greece", "Isreael", "Tunis", "Indonesia", "Dubai", "Bulgaria"], "entities": {"persons": [], "locations": [], "organizations": []}, "highlightText": "", "language": "english", "persons": ["Hajj Guider", "Nims", "Baraka Jefwa Nims", "Melissa Climate", "Louis Wajeiya", "Ian Karega"], "text": "Kenya: Surviving the Floods - Tips for Road and Home By Baraka Jefwa Nims, a Kenyan startup, emerged as the winner of the Startup Istanbul Challenge 2015 with igrow and taskulu taking second and third positions respectively. The announcement was made through a post on Nims' official blog; the post highlighted the improving quality of competitors at the Startup Istanbul Challenge over the years and described this as a reason for startups to participate. \"The event Startup Istanbul is with each passing year attracting more and more startup sign ups and has positioned itself as the global events to watch out for. It is by all means the event to attend for anyone or companies looking into invest in startups with great innovations,\" the post read. Nims was founded by Louis Wajeiya and Ian Karega with the main aim of eliminating fraud and improving transparency and efficiency, Nims was one of over 100 startups from over 40 different countries participating in Startup Istanbul Challenge 2015. Startup Istanbul Challenge 2015 took five days to conclude, day 1 and 2 of this year's challenge had activities involving; Pitching, Training and mentor ship of the selected 100 startups. The third day was set aside for the remaining 50 selected startups to pitch to the judging panel with only investors having being invited to attend the demo. At the end of the third day, the top 16 startups are selected, the 16 selected startups were: iGrow from Indonesia, Mytoddlr from Nigeria, Nims from Kenya, WePress from Dubai, Security Wall from Pakistan, Expensya from Tunis, Taskulu from Iran, Waveit from Isreael, Pockee from Greece, Melissa Climate from Bulgaria, WebHR from Pakistan, Hajj Guider from Pakistan, Gaming Battle Ground, Welcome from Greece, Transterra Media, Picturesqe from Hungary. The 16 then compete in the Semi Finals on day 4; where the semi-finalists pitch for a chance to make it to the finals. And on the fifth day the winners are announced. \"The quality of pitches this year was in very high level and it was very tough choice when it came to naming the top 3 winners. After all, the jury made their decision and the winners were announced,\" read a statement by the event organizers. Kenya \nUchumi Supermarkets has exited the Uganda and Tanzania markets in a drastic reorganisation to stop financial bleeding. see more » Copyright © 2015 CIO East Africa. All rights reserved. Distributed by AllAfrica Global Media ( allAfrica.com ). To contact the copyright holder directly for corrections — or for permission to republish or make other authorized use of this material, click here. AllAfrica publishes around 1,700 reports a day from more than 140 news organizations and over 500 other institutions and individuals , representing a diversity of positions on every topic. We publish news and views ranging from vigorous opponents of governments to government publications and spokespersons. Publishers named above each report are responsible for their own content, which AllAfrica does not have the legal right to edit or correct. Articles and commentaries that identify allAfrica.com as the publisher are produced or commissioned by AllAfrica . To address comments or complaints, please Contact us .", "external_links": [], "published": "2015-10-14T14:23:00.000+03:00", "crawled": "2015-10-14T19:31:07.367+03:00", "highlightTitle": ""}