{"organizations": ["The Economic Times", "ET Bureau", "Finance", "Commerce and Industry", "West Bengal FM Amit Mitra", "HIDCO", "West Bengal Housing Infrastructure Development Corporation"], "uuid": "fa902f3dc2c6717cadd62559d6da793aa6768738", "thread": {"social": {"gplus": {"shares": 0}, "pinterest": {"shares": 0}, "vk": {"shares": 0}, "linkedin": {"shares": 0}, "facebook": {"likes": 0, "shares": 0, "comments": 0}, "stumbledupon": {"shares": 0}}, "site_full": "economictimes.indiatimes.com", "main_image": "http://economictimes.indiatimes.com/thumb/msid-49347300,width-600,resizemode-4/west-bengal-fm-amit-mitra-invites-bengaluru-investors.jpg", "site_section": "http://economictimes.indiatimes.com/news/news/economy/news/economy/finance/rssfeeds/1286551815.cms", "section_title": "Finance-Economy-News-The Economic Times", "url": "http://economictimes.indiatimes.com/news/economy/finance/west-bengal-fm-amit-mitra-invites-bengaluru-investors/articleshow/49347281.cms", "country": "IL", "title": "West Bengal FM Amit Mitra invites Bengaluru investors", "performance_score": 0, "site": "indiatimes.com", "participants_count": 0, "title_full": "West Bengal FM Amit Mitra invites Bengaluru investors", "spam_score": 0.0, "site_type": "news", "published": "2015-10-14T08:00:00.000+03:00", "replies_count": 0, "uuid": "fa902f3dc2c6717cadd62559d6da793aa6768738"}, "author": "", "url": "http://economictimes.indiatimes.com/news/economy/finance/west-bengal-fm-amit-mitra-invites-bengaluru-investors/articleshow/49347281.cms", "ord_in_thread": 0, "title": "West Bengal FM Amit Mitra invites Bengaluru investors", "locations": ["Kalyani", "Asansol", "Dabram", "Dumurjula", "Bolpur", "West Bengal"], "entities": {"persons": [], "locations": [], "organizations": []}, "highlightText": "", "language": "english", "persons": ["Debashis Sen", "Mitra", "Baruipu", "Amit Mitra", "Sudip Dutta"], "text": "West Bengal FM Amit Mitra invites Bengaluru investors By ET Bureau | 14 Oct, 2015, 10.30AM IST ET SPECIAL: Love visual aspect of news? Enjoy this exclusive slideshows treat! Amit Mitra, West Bengal's Minister of Finance, IT, Commerce and Industry, was in Bengaluru on Tues day to draw investors to the state's six new townships. He was participating in the Inves tors Meet of the `Bengal New Township Initiative' roadshow organised by The Economic Times in associ ation with the Government of West Bengal and the West Bengal Housing Infrastructure Development Corporation (HIDCO). The townships, which will be developed in Dabram, Bolpur, Asansol, Kalyani, Dumurjula and Baruipu, would be theme-based. They will focus on providing housing for the masses and creating economic opportunities, said Mitra. Mitra promised investor-friendly policies and maximum transparency to investors. He was accompanied by Debashis Sen, chairman of HIDCO and Sudip Dutta, COO of IIDC, who is the project advisor.  ", "external_links": [], "published": "2015-10-14T08:00:00.000+03:00", "crawled": "2015-10-14T16:35:26.657+03:00", "highlightTitle": ""}