{"organizations": ["Orange S.A.", "Sisvel UK", "Sisvel S.p.A.", "Sisvel Group", "Sisvel Wireless", "ATSS", "Sisvel"], "uuid": "6d04d16f2909e69ab73cf7c8008a6facd1df1b68", "thread": {"social": {"gplus": {"shares": 0}, "pinterest": {"shares": 0}, "vk": {"shares": 0}, "linkedin": {"shares": 0}, "facebook": {"likes": 0, "shares": 0, "comments": 0}, "stumbledupon": {"shares": 0}}, "site_full": "businesswireindia.com", "main_image": "", "site_section": "http://businesswireindia.com/RSSFeeds/cat-business-finance.xml", "section_title": "BusinessWire India.com - Business/ Finance", "url": "http://businesswireindia.com/news/news-details/orange-sa-joins-sisvels-wi-fi-licensing-program/45576", "country": "US", "title": "Orange S.A. Joins Sisvel’s Wi-Fi Licensing Program", "performance_score": 0, "site": "businesswireindia.com", "participants_count": 0, "title_full": "Orange S.A. Joins Sisvel’s Wi-Fi Licensing Program", "spam_score": 0.0, "site_type": "news", "published": "2015-10-06T13:18:00.000+03:00", "replies_count": 0, "uuid": "6d04d16f2909e69ab73cf7c8008a6facd1df1b68"}, "author": "", "url": "http://businesswireindia.com/news/news-details/orange-sa-joins-sisvels-wi-fi-licensing-program/45576", "ord_in_thread": 0, "title": "Orange S.A. Joins Sisvel’s Wi-Fi Licensing Program", "locations": ["United States", "United Kingdom Sisvel UK", "Hong Kong", "Tokyo", "Sisvel Germany", "DC", "Luxembourg", "Sisvel", "United Kingdom", "London", "Italy", "Metropolitan Washington", "Sisvel UK", "Stuttgart", "Germany", "Sisvel US", "China", "Japan"], "entities": {"persons": [], "locations": [], "organizations": []}, "highlightText": "", "language": "english", "persons": ["Luc Savage", "Nicholas Webb", "Orange", "Sisvel"], "text": "Tuesday, October 6, 2015 3:48PM IST (10:18AM GMT) Orange S.A. Joins Sisvel’s Wi-Fi Licensing Program London, United Kingdom Sisvel UK announced today that Orange S.A. has joined Sisvel’s Wi-Fi Licensing Program which aggregates Wi-Fi patents from different patent holders. The licensing program will assure the growth and interoperability of Wi-Fi by providing fair, reasonable and non-discriminatory access to worldwide patent rights that are essential to the IEEE’s 802.11 Wi-Fi standard and related Wi-Fi Alliance specifications. “We are thrilled to have Orange as a partner,\" said Nicholas Webb, Managing Director of Sisvel UK. \"Orange's participation confirms the Group’s commitment to maximize the value which our license will provide to implementers of Wi-Fi technology”. “We are delighted to join Sisvel’s Wi-Fi Licensing Program which provides a great platform to obtain a license to our Wi-Fi patents and we are pleased for the opportunity to facilitate agreements to make the 802.11 Wi-Fi standard widely available to users” indicated Luc Savage, Orange Vice President, Intellectual Property and Licensing. Participation in Sisvel’s Wi-Fi Joint Licensing Agreement is open to new owners of Wi-Fi standard essential patents. Information about the terms and conditions of Sisvel licenses under these patents, including royalty rates and the types of products covered, is available from Sisvel upon request by companies requiring a license. You may contact Sisvel at the following e-mail address: wifi@sisvel.com About 802.11 IEEE 802.11 is a family of specifications for wireless local area network (WLAN) communications in the bands from 2.4, up to 5 GHz that has continued to evolve since the official publication of the first wireless LAN standard in IEEE Std. 802.11-1997 and many subsequent enhancements. The IEEE 802.11n specification added multiple-input multiple-output (MIMO) and several other enhancements, and was formally adopted as IEEE Std. 802.11n-2009. More recently, the IEEE has further enhanced WLAN throughput in the 802.11ac specification. About Sisvel Started in 1982 when Sisvel S.p.A. was founded in Italy, the Sisvel Group has become a world leader in managing intellectual property and maximizing the value of patent rights. The Sisvel Group is global in scope and reach, with subsidiaries in Italy (Sisvel and Sisvel Technology in None Torinese), the United States (Sisvel US and Audio MPEG in Metropolitan Washington, DC), China (Sisvel Hong Kong), Japan (Sisvel Japan in Tokyo), Germany (Sisvel Germany in Stuttgart), Luxembourg (Sisvel International), and the United Kingdom (Sisvel UK), with over one hundred professionals worldwide with engineers, legal, and licensing expertise. Sisvel has a long history of managing successful patent portfolios including those related to the audio compression standards known as MP3 and MPEG Audio, and widespread technologies such as OSD (On Screen Display), ATSS (Automatic Tuning & Sorting System), and WSS (Wide Screen Signalling - for automatic switching of television image formats). Sisvel currently operates patent pools and joint licensing programs for the DVB-T, DVB-T2, LTE/LTE-A and Wi-Fi standards, together with its Sisvel Wireless licensing program and is in the process of creating a new licensing program for DVB-C2. For additional information, please visit: www.sisvel.com", "external_links": [], "published": "2015-10-06T13:18:00.000+03:00", "crawled": "2015-10-06T14:00:13.524+03:00", "highlightTitle": ""}