{"organizations": ["Trade Ministry Launches Labour Force", "International Craft Industry Fair"], "uuid": "276d4e02877d0a56bc3a54ac43427006c81f64a9", "thread": {"social": {"gplus": {"shares": 0}, "pinterest": {"shares": 0}, "vk": {"shares": 0}, "linkedin": {"shares": 0}, "facebook": {"likes": 0, "shares": 0, "comments": 0}, "stumbledupon": {"shares": 0}}, "site_full": "allafrica.com", "main_image": "http://allafrica.com/static/images/structure/aa-logo-rgba-no-text-128x128.png", "site_section": "http://allafrica.com/tools/headlines/rdf/business/headlines.rdf", "section_title": "AllAfrica News: Economy, Business and Finance", "url": "http://allafrica.com/stories/201510161827.html", "country": "US", "title": "Algeria: Sellal Calls for Promoting Algerian Craft-Trade Products", "performance_score": 0, "site": "allafrica.com", "participants_count": 0, "title_full": "Algeria: Sellal Calls for Promoting Algerian Craft-Trade Products", "spam_score": 0.0, "site_type": "news", "published": "2015-10-16T19:39:00.000+03:00", "replies_count": 0, "uuid": "276d4e02877d0a56bc3a54ac43427006c81f64a9"}, "author": "", "url": "http://allafrica.com/stories/201510161827.html", "ord_in_thread": 0, "title": "Algeria: Sellal Calls for Promoting Algerian Craft-Trade Products", "locations": ["Niger", "Burkina-Faso", "Mali", "Pakistan", "Senegal", "Gambia", "Syria", "Western Sahara", "Palestine", "Tunisia", "Algeria", "Mauritania", "India"], "entities": {"persons": [], "locations": [], "organizations": []}, "highlightText": "", "language": "english", "persons": ["Abdelmalek Sellal"], "text": "Gambia: Trade Ministry Launches Labour Force Survey Report Algiers — Prime Minister Abdelmalek Sellal on Thursday here stressed the need for \"promoting\" the Algerian craft-trade products so that this sector of craft industry \"contributes\" to the country's economic development. During the inauguration of the 20th International Craft Industry Fair, placed under the theme \"Craft industry, a partner in sustainable development,\" Sellal called for \"modernizing\" the local product in a bid to be making it competitive on the international market. In this regard, the Premier emphasized the importance of training and qualifications to produce quality and innovative products, asserting that that State \"encourages\" professional craftsmen to develop this sector. More than 750 exhibitors are taking part in this fair, including 116 foreign craftsmen from 11 countries (Tunisia, Syria, Palestine, India, Pakistan, Senegal, Burkina-Faso, Mali, Western Sahara, Niger, and Mauritania). This edition aims at raising artisans of the importance to improve the quality of the craft products. The fair is an opportunity for the promotion of the Algerian craft products and the exchange of experience between artisans. Algeria \nSome 150 exhibitors are expected at the fifth International Trade Show Hassi Messaoud Products and Services Suppliers … see more » Copyright © 2015 Algerie Presse Service. All rights reserved. Distributed by AllAfrica Global Media ( allAfrica.com ). To contact the copyright holder directly for corrections — or for permission to republish or make other authorized use of this material, click here. AllAfrica publishes around 1,700 reports a day from more than 140 news organizations and over 500 other institutions and individuals , representing a diversity of positions on every topic. We publish news and views ranging from vigorous opponents of governments to government publications and spokespersons. Publishers named above each report are responsible for their own content, which AllAfrica does not have the legal right to edit or correct. Articles and commentaries that identify allAfrica.com as the publisher are produced or commissioned by AllAfrica . To address comments or complaints, please Contact us .", "external_links": [], "published": "2015-10-16T19:39:00.000+03:00", "crawled": "2015-10-17T04:34:30.515+03:00", "highlightTitle": ""}