{"organizations": ["InterContinental Hotels Group", "Hotels Inc.", "THERLY Hotels Inc.", "SoTHERLY Hotels Inc.", "Sotherly Hotels Inc", "THERLY Hotels Inc", "SoTHERLY Hotels Inc", "Starwood Hotels"], "uuid": "319647b2259cf765d1571d4a5fe0cf595d35f84b", "thread": {"social": {"gplus": {"shares": 0}, "pinterest": {"shares": 0}, "vk": {"shares": 0}, "linkedin": {"shares": 0}, "facebook": {"likes": 0, "shares": 0, "comments": 0}, "stumbledupon": {"shares": 0}}, "site_full": "globenewswire.com", "main_image": "http://globenewswire.com/Attachment/LogoDisplay/347311?filename=347311.jpg&amp;size=1", "site_section": "http://globenewswire.com//Rss/subjectcode/17/Financing%20Agreements", "section_title": "GlobeNewswire: Financing Agreements", "url": "http://globenewswire.com/news-release/2015/09/11/767772/0/en/CORRECTING-and-REPLACING-SoTHERLY-Hotels-Inc-Sells-Excess-Land-in-Atlanta.html?f=22&fvtc=1&fvtv=Financing%20Agreements", "country": "US", "title": "CORRECTING and REPLACING -- SoTHERLY Hotels Inc. Sells Excess Land in Atlanta", "performance_score": 0, "site": "globenewswire.com", "participants_count": 0, "title_full": "CORRECTING and REPLACING -- SoTHERLY Hotels Inc. Sells Excess Land in Atlanta", "spam_score": 0.0, "site_type": "news", "published": "2015-09-11T17:48:00.000+03:00", "replies_count": 0, "uuid": "319647b2259cf765d1571d4a5fe0cf595d35f84b"}, "author": "", "url": "http://globenewswire.com/news-release/2015/09/11/767772/0/en/CORRECTING-and-REPLACING-SoTHERLY-Hotels-Inc-Sells-Excess-Land-in-Atlanta.html?f=22&fvtc=1&fvtv=Financing%20Agreements", "ord_in_thread": 0, "title": "CORRECTING and REPLACING -- SoTHERLY Hotels Inc. Sells Excess Land in Atlanta", "locations": ["SOHO", "Virginia", "Southern United States", "WILLIAMSBURG", "Va.", "Atlanta", "West Francis Street Williamsburg", "Williamsburg"], "entities": {"persons": [], "locations": [], "organizations": []}, "highlightText": "", "language": "english", "persons": ["Scott Kucinski"], "text": "CORRECTING and REPLACING -- SoTHERLY Hotels Inc. Sells Excess Land in Atlanta September 11, 2015 10:48 ET | Source: Sotherly Hotels Inc. WILLIAMSBURG, Va., Sept. 11,   In a release issued under the same headline earlier today by S o THERLY Hotels Inc. (NASDAQ: SOHO ), please note that in the first paragraph of the release, the gross sales price should be $2.2 million, not $2.4 million as previously stated. The corrected release follows: S o THERLY Hotels Inc. (NASDAQ: SOHO ) (the “Company”) today announced that the Company has sold a 0.3 acre parcel of excess land in Atlanta for a gross sales price of $2.2 million. The land parcel was purchased by the Company in March 2014 as part of the Georgian Terrace acquisition. About S o THERLY Hotels Inc. SoTHERLY Hotels Inc. is a self-managed and self-administered lodging REIT focused on the acquisition, renovation, upbranding and repositioning of upscale and upper upscale full-service hotels in the Southern United States. Currently, the Company’s portfolio consists of investments in twelve hotel properties and comprise 3,010 rooms. Most of the Company’s properties operate under the Hilton Worldwide, InterContinental Hotels Group and Starwood Hotels and Resorts brands. S o THERLY Hotels Inc. was organized in 2004 and is headquartered in Williamsburg, Virginia. For more information, please visit www.sotherlyhotels.com . CONTACT: Contact at the Company: Scott Kucinski Vice President – Operations and Investor Relations SoTHERLY Hotels Inc. 410 West Francis Street Williamsburg, Virginia 23185 (757) 229-5648 Related Articles", "external_links": [], "published": "2015-09-11T17:48:00.000+03:00", "crawled": "2015-09-11T18:34:50.385+03:00", "highlightTitle": ""}