{"organizations": ["Commission", "About Triangle Capital Corporation Triangle Capital Corporation", "Rotolo Consultants, Inc.", "Rotolo Consultants, Inc", "SEC", "Triangle Capital Corporation", "NYSE"], "uuid": "38f4ef0248f8a4474e13424913ad64d6b31c4365", "thread": {"social": {"gplus": {"shares": 0}, "pinterest": {"shares": 0}, "vk": {"shares": 0}, "linkedin": {"shares": 0}, "facebook": {"likes": 0, "shares": 0, "comments": 0}, "stumbledupon": {"shares": 0}}, "site_full": "globenewswire.com", "main_image": "http://globenewswire.com/Attachment/LogoDisplay/341605?filename=341605.jpg&amp;size=1", "site_section": "http://globenewswire.com//Rss/subjectcode/17/Financing%20Agreements", "section_title": "GlobeNewswire: Financing Agreements", "url": "http://globenewswire.com/news-release/2015/09/03/766061/0/en/Triangle-Capital-Corporation-Invests-10-3-Million-in-Rotolo-Consultants-Inc.html?f=22&fvtc=1&fvtv=Financing%20Agreements", "country": "US", "title": "Triangle Capital Corporation Invests $10.3 Million in Rotolo Consultants, Inc.", "performance_score": 0, "site": "globenewswire.com", "participants_count": 0, "title_full": "Triangle Capital Corporation Invests $10.3 Million in Rotolo Consultants, Inc.", "spam_score": 0.0, "site_type": "news", "published": "2015-09-03T23:02:00.000+03:00", "replies_count": 0, "uuid": "38f4ef0248f8a4474e13424913ad64d6b31c4365"}, "author": "", "url": "http://globenewswire.com/news-release/2015/09/03/766061/0/en/Triangle-Capital-Corporation-Invests-10-3-Million-in-Rotolo-Consultants-Inc.html?f=22&fvtc=1&fvtv=Financing%20Agreements", "ord_in_thread": 0, "title": "Triangle Capital Corporation Invests $10.3 Million in Rotolo Consultants, Inc.", "locations": ["United States", "LA", "Raleigh", "N.C.", "Slidell", "RALEIGH", "Glenwood Avenue"], "entities": {"persons": [], "locations": [], "organizations": []}, "highlightText": "", "language": "english", "persons": ["Rotolo", "Steven C. Lilly"], "text": "Triangle Capital Corporation Invests $10.3 Million in Rotolo Consultants, Inc. September 03, 2015 16:02 ET | Source: Triangle Capital Corporation RALEIGH, N.C., Sept. 03,   Triangle Capital Corporation (NYSE: TCAP ) (“Triangle” or the “Company”), a leading provider of capital to lower middle market companies, announced today that it closed a $10.3 million investment in Rotolo Consultants, Inc. and its affiliates (“Rotolo”) consisting of second lien debt and equity. Headquartered in Slidell, LA, Rotolo is a leading provider of landscaping maintenance and construction services throughout the southern United States. About Triangle Capital Corporation Triangle Capital Corporation ( www.TCAP.com ) invests capital in established companies in the lower middle market to fund growth, changes of control and other corporate events. Triangle offers a wide variety of investment structures with a primary focus on mezzanine financing with equity components. Triangle’s investment objective is to seek attractive returns by generating current income from debt investments and capital appreciation from equity related investments. Triangle’s investment philosophy is to partner with business owners, management teams and financial sponsors to provide flexible financing solutions. Triangle typically invests $5.0 million - $35.0 million per transaction in companies with annual revenues between $20.0 million and $200.0 million and EBITDA between $3.0 million and $35.0 million. Triangle has elected to be treated as a business development company under the Investment Company Act of 1940 (\"1940 Act\"). Triangle is required to comply with a series of regulatory requirements under the 1940 Act as well as applicable NYSE, federal and state laws and regulations. Triangle has elected to be treated as a regulated investment company under the Internal Revenue Code of 1986. Failure to comply with any of the laws and regulations that apply to Triangle could have a material adverse effect on Triangle and its stockholders. Forward Looking Statements This press release may contain forward looking statements within the meaning of the Private Securities Litigation Reform Act of 1995. Any such statements, other than statements of historical fact, are likely to be affected by other unknowable future events and conditions, including elements of the future that are or are not under the Company's control, and that the Company may or may not have considered; accordingly, such statements cannot be guarantees or assurances of any aspect of future performance. Actual developments and results are highly likely to vary materially from these estimates and projections of the future and some of these uncertainties are enumerated in Triangle’s filings with the   Commission. Certain factors that could cause actual results to differ materially from those contained in the forward-looking statements are included in our annual reports on Form 10-K, quarterly reports on Form 10-Q and current reports on Form 8-K, each as filed with the   Commission. Copies are available on the SEC’s website at www.sec.gov and stockholders may receive a hard copy of the completed audited financial statements free of charge upon request to the Company at 3700 Glenwood Avenue, Suite 530, Raleigh, NC 27612. Such statements speak only as of the time when made, and the Company undertakes no obligation to update any such statement now or in the future. Contacts Sheri Blair Colquitt Vice President, Investor Relations 919-719-4784 scolquitt@tcap.com Steven C. Lilly Chief Financial Officer 919-719-4789 slilly@tcap.com Related Articles", "external_links": [], "published": "2015-09-03T23:02:00.000+03:00", "crawled": "2015-09-04T03:56:26.595+03:00", "highlightTitle": ""}