{"organizations": ["NASA", "ASRC", "CEA", "Consumer Electronics Association"], "uuid": "b68dc97623958048ab352ed268fd5f792a02298c", "thread": {"social": {"gplus": {"shares": 0}, "pinterest": {"shares": 0}, "vk": {"shares": 0}, "linkedin": {"shares": 0}, "facebook": {"likes": 0, "shares": 0, "comments": 0}, "stumbledupon": {"shares": 0}}, "site_full": "businesswireindia.com", "main_image": "", "site_section": "http://businesswireindia.com/RSSFeeds/cat-business-finance.xml", "section_title": "BusinessWire India.com - Business/ Finance", "url": "http://businesswireindia.com/news/news-details/virtual-becomes-reality-at-ces2016/45451", "country": "US", "title": "Virtual Becomes Reality at #CES2016", "performance_score": 0, "site": "businesswireindia.com", "participants_count": 0, "title_full": "Virtual Becomes Reality at #CES2016", "spam_score": 0.0, "site_type": "news", "published": "2015-09-29T09:10:00.000+03:00", "replies_count": 0, "uuid": "b68dc97623958048ab352ed268fd5f792a02298c"}, "author": "", "url": "http://businesswireindia.com/news/news-details/virtual-becomes-reality-at-ces2016/45451", "ord_in_thread": 0, "title": "Virtual Becomes Reality at #CES2016", "locations": ["Las Vegas", "United States", "CES Tech East", "U.S.", "Va.", "Nevada", "Arlington"], "entities": {"persons": [], "locations": [], "organizations": []}, "highlightText": "", "language": "english", "persons": ["Virtuix", "Aurelie Cornett", "Sphero", "Karen Chupka"], "text": "Company : Consumer Electronics Association (CEA) Tuesday, September 29, 2015 11:40AM IST (6:10AM GMT) (BW)(VA-CEA) Virtual Becomes Reality at #CES2016 Gaming and Virtual Reality Exhibits grow by 77 percent and the first Marketplace for Augmented Reality is created Arlington, Va., United States Reflecting the fast growth of virtual reality, the Consumer Electronics Association (CEA) ® announced the expansion of the Gaming & Virtual Reality Marketplace at CES ® 2016. Owned and produced by CEA, CES is the world’s gathering place for all who thrive on the business of consumer technologies and will run January 6-9, 2016, in Las Vegas, Nevada. This Smart News Release features multimedia. View the full release here: http://www.businesswire.com/news/home/20150928006480/en/ More than 40 exhibitors will showcase the next wave of immersive multimedia for virtual reality systems and environments, and today’s latest gaming hardware, software and accessories designed for mobile, PC’s and consoles. In total, the Gaming & Virtual Reality Marketplace will expand by 77 percent over its footprint at the 2015 CES. Key exhibitors within this space include: Oculus VR , Virtuix , Sphero and more. “Developments in virtual and augmented reality have made significant strides to allow us to engage in a 360-degree gaming experience, explore the inside of foreign landmarks, treat phobias, better train medical professionals, virtually attend an event and much more,” said Karen Chupka, senior vice president of corporate business strategy and CES, CEA. “The Gaming & Virtual Reality Marketplace at CES 2016 will showcase all of these immersive innovations that are advancing this futuristic industry.” According to CEA research, virtual reality headsets are expected to really take off in 2016 with projected sales to increase by 500 percent over 2015 to reach 1.2 million units sold. Total revenues are projected to reach $540 million, a 440 percent increase by the end of 2015. New for 2016, CES will launch the Augmented Reality Marketplace across a minimum of 3,000 net square feet of exhibit space to showcase new, disruptive technologies that can change how we learn and experience the world. Exhibitors such as ASRC Federal for NASA , Marxent and Occipital among others will feature the latest in augmented reality technology including headsets, structure sensors, software and more. Both the Gaming & Virtual Reality and Augmented Reality Marketplaces will be located at CES Tech East , in South Hall 2 of the Las Vegas Convention and World Trade Center adjacent to each other to leverage the synergies. Companies interested in exhibiting in either of these Marketplaces should contact Aurelie Cornett at acornett@CE.org . For more information on CES, please visit CESweb.org . Note to Editors: The official name of the global technology event is “CES ® .” Please do not use “Consumer Electronics Show” or “International CES” to refer to the event. About CES: CES is the world’s gathering place for all who thrive on the business of consumer technologies. It has served as the proving ground for innovators and breakthrough technologies for more than 40 years—the global stage where next-generation innovations are introduced to the marketplace. As the largest hands-on event of its kind, CES features all aspects of the industry. And because it is owned and produced by the Consumer Electronics Association (CEA), the technology trade association representing the $285 billion U.S. consumer electronics industry, it attracts the world’s business leaders and pioneering thinkers to a forum where the industry’s most relevant issues are addressed. Check out CES video highlights . Follow CES online at www.CESweb.org and on social .", "external_links": [], "published": "2015-09-29T09:10:00.000+03:00", "crawled": "2015-09-29T10:52:44.204+03:00", "highlightTitle": ""}