{"organizations": ["Wells Fargo & Company Bill Ford", "Study Finds Bank of America Chicago Marathon", "Ford Motor Company ST. LOUIS", "Bank of America", "Ford Volunteer Corps", "Wells Fargo", "Ford", "Ford Motor Company", "CSR Circuit"], "uuid": "2e47e1ce11d4a69eb73f3396cc437f04088586b4", "thread": {"social": {"gplus": {"shares": 0}, "pinterest": {"shares": 0}, "vk": {"shares": 0}, "linkedin": {"shares": 0}, "facebook": {"likes": 0, "shares": 0, "comments": 0}, "stumbledupon": {"shares": 0}}, "site_full": "businesswireindia.com", "main_image": "", "site_section": "http://businesswireindia.com/RSSFeeds/cat-business-finance.xml", "section_title": "BusinessWire India.com - Business/ Finance", "url": "http://businesswireindia.com/news/news-details/corporate-social-responsibility-weekly-recap-august-26-2015-september-/45091", "country": "US", "title": "Corporate Social Responsibility Weekly Recap (August 26, 2015 – September 2, 2015)", "performance_score": 0, "site": "businesswireindia.com", "participants_count": 0, "title_full": "Corporate Social Responsibility Weekly Recap (August 26, 2015 – September 2, 2015)", "spam_score": 0.0, "site_type": "news", "published": "2015-09-04T07:15:00.000+03:00", "replies_count": 0, "uuid": "2e47e1ce11d4a69eb73f3396cc437f04088586b4"}, "author": "", "url": "http://businesswireindia.com/news/news-details/corporate-social-responsibility-weekly-recap-august-26-2015-september-/45091", "ord_in_thread": 0, "title": "Corporate Social Responsibility Weekly Recap (August 26, 2015 – September 2, 2015)", "locations": ["United States", "New York", "Chicago", "St. Louis", "CHICAGO", "DETROIT"], "entities": {"persons": [], "locations": [], "organizations": []}, "highlightText": "", "language": "english", "persons": ["Matt VanTassel"], "text": "Friday, September 4, 2015 9:45AM IST (4:15AM GMT) Corporate Social Responsibility Weekly Recap (August 26, 2015 – September 2, 2015) New York, United States The following releases focus on Corporate Social Responsibility and moved during the week of August 26, 2015 – September 2, 2015. CHICAGO -- Study Finds Bank of America Chicago Marathon Delivers More Than $254 Million to Chicago Economy Source: Bank of America DETROIT -- Ford Inspires Tomorrow’s Leaders Today with New Global Grant, Innovative Employee Civic Leadership Program Source: Ford Motor Company ST. LOUIS -- Wells Fargo HomeLIFT Program to Help St. Louis Homebuyers Source: Wells Fargo & Company Bill Ford to Celebrate 10th Anniversary of Ford Volunteer Corps, Announce New ‘Better World’ Initiatives Source: Ford Motor Company Follow the CSR Circuit newsfeed on www.twitter.com/BWCSRNews ALL TIME-OFFS ARE IN EASTERN TIME View source version on businesswire.com: http://www.businesswire.com/news/home/20150903005255/en/ For News Release background on Business Wire click here CONTACTS : Business Wire Matt VanTassel, 212-752-9600 More News from Business Wire 27/08/2015 4:20PM \nThe following releases focus on Corporate Social Responsibility and moved during the week of August 19, 2015 – August 26, 2015. RYE BROOK, N.Y. -- Xylem Commends 2015 Stockholm Junior Water Prize Winner ... 21/08/2015 11:25AM \nThe following releases focus on Corporate Social Responsibility and moved during the week of August 12, 2015 – August 19, 2015. TACOMA, Wash. -- Give an Hour Receives $1.6 Million from United Health ... 17/08/2015 5:40PM \nBusiness Wire's video content is now available on AP Video Hub, a state-of-the-art online delivery platform that provides broadcast quality video to the world's leading digital publishers, news portals, and ... Similar News", "external_links": [], "published": "2015-09-04T07:15:00.000+03:00", "crawled": "2015-09-04T10:57:25.322+03:00", "highlightTitle": ""}