{"organizations": ["Celent", "MetLife Asia", "Asia Insurance Review", "Data Analytics", "Advanced Data Analytics", "MetLife", "Inc", "Inc.", "MetLife MetLife", "ADA"], "uuid": "68afd9e546b15a684bd775f30b772aed384b9cad", "thread": {"social": {"gplus": {"shares": 0}, "pinterest": {"shares": 0}, "vk": {"shares": 0}, "linkedin": {"shares": 0}, "facebook": {"likes": 0, "shares": 0, "comments": 0}, "stumbledupon": {"shares": 0}}, "site_full": "businesswireindia.com", "main_image": "", "site_section": "http://businesswireindia.com/RSSFeeds/cat-business-finance.xml", "section_title": "BusinessWire India.com - Business/ Finance", "url": "http://businesswireindia.com/news/news-details/metlife-wins-innovation-award-asia-insurance-technology-awards-2015/45071", "country": "US", "title": "MetLife Wins the Innovation Award in the Asia Insurance Technology Awards 2015", "performance_score": 0, "site": "businesswireindia.com", "participants_count": 0, "title_full": "MetLife Wins the Innovation Award in the Asia Insurance Technology Awards 2015", "spam_score": 0.0, "site_type": "news", "published": "2015-09-02T14:41:00.000+03:00", "replies_count": 0, "uuid": "68afd9e546b15a684bd775f30b772aed384b9cad"}, "author": "", "url": "http://businesswireindia.com/news/news-details/metlife-wins-innovation-award-asia-insurance-technology-awards-2015/45071", "ord_in_thread": 0, "title": "MetLife Wins the Innovation Award in the Asia Insurance Technology Awards 2015", "locations": ["United States", "Hong Kong", "Latin America", "Europe", "Asia Pacific", "Asia", "Middle East", "Japan"], "entities": {"persons": [], "locations": [], "organizations": []}, "highlightText": "", "language": "english", "persons": ["Ralph Brunner", "Eunice Cheng", "Chris Townsend"], "text": "Wednesday, September 2, 2015 5:11PM IST (11:41AM GMT) MetLife Wins the Innovation Award in the Asia Insurance Technology Awards 2015 Hong Kong MetLife, Inc. (NYSE: MET) today announced that it won the Innovation Award for its Advanced Data Analytics (ADA) efforts in the Asia Insurance Technology Awards (AITA) 2015. Technology innovation is disrupting industries on a huge scale. For the insurance industry, this has resulted in the creation of new opportunities to differentiate and to better serve its customers. MetLife is committed to delivering a truly customer-centric experience through its digitalized business model and its powerful data analytic capability. “We are very proud that our innovations in technology and data analytics have been recognized at the Asia Insurance Technology Awards 2015,” said Mr. Chris Townsend, President of Asia, MetLife. “MetLife is dedicated to understanding our customers and their preferences. We believe that advanced data modelling and behavioral economics will help provide a holistic knowledge of what drives value for our customers.” With this commitment at the core of MetLife’s business, MetLife Asia established the Center of Excellence for Data Analytics (COEDA) in July 2014 staffed with data scientists. “We’re transforming big data into customer insights that enable us to deliver better, more personalized service,” said Ralph Brunner, Chief Marketing Officer, Asia, MetLife, who leads the ADA program. “This is driving double-digit increases in customer purchase behavior as we better identify and serve their true needs and wants.\" The Asia Insurance Technology Awards are jointly held by Celent, a research and consulting firm focused on the application of information technology in the global financial services industry, and the Asia Insurance Review. Established in 2010, the awards recognize excellence and innovation in the use of technology within the insurance industry in the Asia Pacific Region. About MetLife MetLife, Inc. (NYSE: MET), through its subsidiaries and affiliates (“MetLife”), is one of the largest life insurance companies in the world. Founded in 1868, MetLife is a global provider of life insurance, annuities, employee benefits and asset management. Serving approximately 100 million customers, MetLife has operations in nearly 50 countries and holds leading market positions in the United States, Japan, Latin America, Asia, Europe and the Middle East. For more information, visit www.metlife.com . View source version on businesswire.com: http://www.businesswire.com/news/home/20150902005582/en/ For News Release background on MetLife, Inc. click here CONTACTS : MetLife, Inc. Eunice Cheng, +852-9277-0859", "external_links": [], "published": "2015-09-02T14:41:00.000+03:00", "crawled": "2015-09-02T16:10:51.462+03:00", "highlightTitle": ""}