{"organizations": ["IMIL", "Igarashi Group", "Tata Capital", "Blackstone Private Equity", "PTI", "Blackstone Group", "Tata", "Agile Electric Sub Assembly Pvt Ltd", "Blackstone", "Igarashi Electric Works Ltd", "MAPE Securities Private Limited and Alpha FDI Holdings Pte Ltd"], "uuid": "d4be82970f4b9319b3ae9c58ab46a5eb2c8e5325", "thread": {"social": {"gplus": {"shares": 0}, "pinterest": {"shares": 0}, "vk": {"shares": 0}, "linkedin": {"shares": 0}, "facebook": {"likes": 0, "shares": 0, "comments": 0}, "stumbledupon": {"shares": 0}}, "site_full": "economictimes.indiatimes.com", "main_image": "http://economictimes.indiatimes.com/thumb/msid-48283592,width-600,resizemode-4/divestment_bccl.jpg", "site_section": "http://economictimes.indiatimes.com/rssfeeds/13358311.cms", "section_title": "Finance-Banking/Finance-Industry-The Economic Times", "url": "http://economictimes.indiatimes.com/industry/banking/finance/blackstone-sells-stake-in-agile-to-4-firms-including-tata-unit/articleshow/48283577.cms", "country": "IL", "title": "Blackstone sells stake in Agile to 4 firms including Tata unit", "performance_score": 0, "site": "indiatimes.com", "participants_count": 0, "title_full": "Blackstone sells stake in Agile to 4 firms including Tata unit", "spam_score": 0.0, "site_type": "news", "published": "2015-07-30T15:49:00.000+03:00", "replies_count": 0, "uuid": "d4be82970f4b9319b3ae9c58ab46a5eb2c8e5325"}, "author": "", "url": "http://economictimes.indiatimes.com/industry/banking/finance/blackstone-sells-stake-in-agile-to-4-firms-including-tata-unit/articleshow/48283577.cms", "ord_in_thread": 0, "title": "Blackstone sells stake in Agile to 4 firms including Tata unit", "locations": ["India"], "entities": {"persons": [], "locations": [], "organizations": []}, "highlightText": "", "language": "english", "persons": ["Amit Dixit", "Igarashi", "Akhil Awasthi"], "text": "Blackstone sells stake in Agile to 4 firms including Tata unit By PTI | 30 Jul, 2015, 06.19PM   NEW DELHI: Blackstone Group today said it has sold its 97.9 per cent stake in Agile Electric Sub Assembly Pvt Ltd (Agile) to four different entities including Tata Capital Growth Fund. A private equity fund managed by Blackstone on behalf of its private equity investors took the process of selling its 97.9 per cent stake in Agile, the Group said in a release. Among others, the stake of Blackstone Group in India's electric motor manufacturer Agile was sold to Igarashi Electric Works Ltd (IEWL), MAPE Securities Private Limited and Alpha FDI Holdings Pte Ltd. IMIL is a publicly listed subsidiary of Agile. \"Agile has been an excellent investment for Blackstone. The company...has delivered strong growth during our investment horizon. Investment by a global motor manufacturer, Igarashi, is the logical step in taking the company to the next level,\" Amit Dixit, Senior Managing Director & Co-Head of Blackstone Private Equity in India, said in the statement. Akhil Awasthi, Managing Partner, Tata Capital Growth Fund I said: \"Agile, with proven engineering expertise and innovation, is well poised to capitalise on the growing trend of manufacturing in India. With support of the Igarashi Group and its global tier 1 relationships Agile should scale greater heights.\"   Follow this section for latest news on Finance To post this comment you must Log In/Connect with:", "external_links": [], "published": "2015-07-30T15:49:00.000+03:00", "crawled": "2015-07-30T19:20:08.674+03:00", "highlightTitle": ""}