{"organizations": ["OIC Board of Directors", "OIC", "National Instruments", "IBM", "OIC Public Relations Danielle Tarp", "Inc."], "uuid": "f0aa1c1401355785f0f0f89995cf93903643ec21", "thread": {"social": {"gplus": {"shares": 0}, "pinterest": {"shares": 0}, "vk": {"shares": 0}, "linkedin": {"shares": 0}, "facebook": {"likes": 0, "shares": 0, "comments": 0}, "stumbledupon": {"shares": 0}}, "site_full": "businesswireindia.com", "main_image": "", "site_section": "http://businesswireindia.com/RSSFeeds/cat-business-finance.xml", "section_title": "BusinessWire India.com - Business/ Finance", "url": "http://businesswireindia.com/news/news-details/open-interconnect-consortium-announces-new-members-standards-milestone/44554", "country": "US", "title": "Open Interconnect Consortium Announces New Members and Standards Milestone", "performance_score": 0, "site": "businesswireindia.com", "participants_count": 0, "title_full": "Open Interconnect Consortium Announces New Members and Standards Milestone", "spam_score": 0.0, "site_type": "news", "published": "2015-07-21T09:21:00.000+03:00", "replies_count": 0, "uuid": "f0aa1c1401355785f0f0f89995cf93903643ec21"}, "author": "", "url": "http://businesswireindia.com/news/news-details/open-interconnect-consortium-announces-new-members-standards-milestone/44554", "ord_in_thread": 0, "title": "Open Interconnect Consortium Announces New Members and Standards Milestone", "locations": ["United States", "North America", "Taiwan", "Delaware", "Argentina", "Portland", "South Korea"], "entities": {"persons": [], "locations": [], "organizations": []}, "highlightText": "", "language": "english", "persons": ["Mike Richmond"], "text": "Company : Open Interconnect Consortium, Inc. Tuesday, July 21, 2015 11:51AM IST (6:21AM GMT) (BW)(OR-OPEN-INTERCONNECT) Open Interconnect Consortium Announces New Members and Standards Milestone IBM, National Instruments and Others Join Internet of Things Consortium to Achieve Interoperability in the Industry; OIC Specification 0.9.1 Available to Members Ore., Portland, United States Today, the Open Interconnect Consortium, Inc. (OIC) announced a number of new member organizations, including IBM and National Instruments. New companies and nonprofits that have joined the consortium hail from regions around the world including Argentina, South Korea, North America and Taiwan. They offer products and services in a variety of sectors ranging from manufacturing to education. “The OIC’s continued success in adding leading technology companies to our organization highlights the industry’s commitment to ensuring interoperability of the billions of devices,” said Mike Richmond, executive director at the Open Interconnect Consortium. “These new members will allow us to further extend our expertise in the industrial sector as we look to drive standards for the internet of things.” The organizations new to OIC’s membership roster include: VU Security This builds on the OIC announcement of 25 new member organizations across industries and international markets in May. The OIC is building an open source framework and developing a standard with the goal of defining the connectivity requirements and ensuring interoperability of the billions of devices making up the internet of things. With this framework, technologies can wirelessly connect and intelligently manage the flow of information among devices, regardless of form factor, operating system or service provider. Additionally, the OIC specification 0.9.1 and corresponding IoTivity code release are now available. The specification has passed IP review by all member companies and has been approved by the OIC Board of Directors. This specification allows members and industry participants flexibility to develop and certify interoperable products built using any implementation of the framework. For additional information on membership benefits including access to the specification and how to join the OIC, visit www.openinterconnect.org/join . About Open Interconnect Consortium The Open Interconnect Consortium, a Delaware non-profit corporation, is being founded by leading technology companies with the goal of defining the connectivity requirements and ensuring interoperability of the billions of devices that will make up the emerging Internet of Things (IoT). All trademarks included are property of their respective owners. View source version on businesswire.com: http://www.businesswire.com/news/home/20150717005837/en/ For News Release background on Open Interconnect Consortium, Inc. click here CONTACTS : OIC Public Relations Danielle Tarp, 415-856-5182 OICPR@blancandotus.com", "external_links": [], "published": "2015-07-21T09:21:00.000+03:00", "crawled": "2015-07-21T09:28:37.066+03:00", "highlightTitle": ""}