{"organizations": ["SES", "StarTimes Group", "SES S.A.", "SES Platform Services", "StarTimes"], "uuid": "18b1223adf5688a54b9bf079c1f5e158176f4c56", "thread": {"social": {"gplus": {"shares": 0}, "pinterest": {"shares": 0}, "vk": {"shares": 0}, "linkedin": {"shares": 0}, "facebook": {"likes": 0, "shares": 0, "comments": 0}, "stumbledupon": {"shares": 0}}, "site_full": "businesswireindia.com", "main_image": "", "site_section": "http://businesswireindia.com/RSSFeeds/cat-business-finance.xml", "section_title": "BusinessWire India.com - Business/ Finance", "url": "http://businesswireindia.com/news/news-details/startimes-entrusts-ses-platform-services-deliver-tv-content-across-sub/44689", "country": "US", "title": "StarTimes Entrusts SES Platform Services to Deliver TV Content across Sub-Saharan Africa", "performance_score": 0, "site": "businesswireindia.com", "participants_count": 0, "title_full": "StarTimes Entrusts SES Platform Services to Deliver TV Content across Sub-Saharan Africa", "spam_score": 0.0, "site_type": "news", "published": "2015-07-31T13:24:00.000+03:00", "replies_count": 0, "uuid": "18b1223adf5688a54b9bf079c1f5e158176f4c56"}, "author": "", "url": "http://businesswireindia.com/news/news-details/startimes-entrusts-ses-platform-services-deliver-tv-content-across-sub/44689", "ord_in_thread": 0, "title": "StarTimes Entrusts SES Platform Services to Deliver TV Content across Sub-Saharan Africa", "locations": ["Paris", "Africa", "Germany", "Sub-Saharan Africa", "Sub-Saharan Africa Luxembourg"], "entities": {"persons": [], "locations": [], "organizations": []}, "highlightText": "", "language": "english", "persons": ["Wilfried Urner"], "text": "Friday, July 31, 2015 3:54PM IST (10:24AM GMT) StarTimes Entrusts SES Platform Services to Deliver TV Content across Sub-Saharan Africa Luxembourg SES Platform Services, a wholly-owned subsidiary of SES S.A. (NYSE Paris:SESG) (LuxX:SESG), announced today that StarTimes, the fastest-growing digital TV operator in Africa, will distribute TV channels for their direct-to-home (DTH) subscribers across Sub-Saharan Africa via SES Platform Services’ broadcast facility in Germany. Under the new multi-year agreement, SES Platform Services will be providing signal turnaround, video processing, and uplinking services for StarTimes’ SD and HD channels. StarTimes has more than 5 million DTT and DTH subscribers across 16 countries in Africa and currently provides English-language TV content to viewers across the region via the SES-5 satellite located at 5 degrees East. “We want TV audiences in Africa to perceive StarTimes as a reliable DTH platform operator broadcasting engaging content at competitive rates to its subscribers. We are confident that SES and SES Platform Services have the space and ground infrastructure and the expertise to help us grow our TV business by delivering a wider range of attractive offerings across the continent,” said StarTimes Group Chairman and President Pang Xinxing. “The new contract reiterates StarTimes’ utmost confidence in SES’s and SES Platform Services’ capabilities to provide both space and ground segment services to grow their business in Sub-Saharan Africa. We are proud to be a valued partner of StarTimes, supporting their growth ambitions in new African markets,” said Wilfried Urner, Chief Executive Officer of SES Platform Services.", "external_links": [], "published": "2015-07-31T13:24:00.000+03:00", "crawled": "2015-07-31T14:24:58.421+03:00", "highlightTitle": ""}