{"organizations": ["First Fashion-Branded Residences", "Versace Home", "Turner & Townsend", "United Kingdom Luxury", "AYKON Nine Elms", "DICO UK Property Holdings Ltd", "Kohn Pedersen Fox Associates", "Versace Home London", "DAMAC International Limited", "Versace Home Launched"], "uuid": "1e1dfcf731d71b7bf3a3c27f0cfc3300be1dabe4", "thread": {"social": {"gplus": {"shares": 0}, "pinterest": {"shares": 0}, "vk": {"shares": 0}, "linkedin": {"shares": 0}, "facebook": {"likes": 0, "shares": 0, "comments": 0}, "stumbledupon": {"shares": 0}}, "site_full": "businesswireindia.com", "main_image": "", "site_section": "http://businesswireindia.com/RSSFeeds/cat-business-finance.xml", "section_title": "BusinessWire India.com - Business/ Finance", "url": "http://businesswireindia.com/news/news-details/aykon-nine-elms-londons-first-fashion-branded-residences-with-versace-/44538", "country": "US", "title": "AYKON Nine Elms : London’s First Fashion-Branded Residences with Versace Home Launched", "performance_score": 0, "site": "businesswireindia.com", "participants_count": 0, "title_full": "AYKON Nine Elms : London’s First Fashion-Branded Residences with Versace Home Launched", "spam_score": 0.0, "site_type": "news", "published": "2015-07-20T12:00:00.000+03:00", "replies_count": 0, "uuid": "1e1dfcf731d71b7bf3a3c27f0cfc3300be1dabe4"}, "author": "", "url": "http://businesswireindia.com/news/news-details/aykon-nine-elms-londons-first-fashion-branded-residences-with-versace-/44538", "ord_in_thread": 0, "title": "AYKON Nine Elms : London’s First Fashion-Branded Residences with Versace Home Launched", "locations": ["Battersea", "River Thames", "UK", "Knightsbridge", "London"], "entities": {"persons": [], "locations": [], "organizations": []}, "highlightText": "", "language": "english", "persons": ["Chelsea", "Hussain Sajwani", "Gian Giacomo Ferraris", "Mayfair", "Versace"], "text": "Monday, July 20, 2015 2:30PM IST (9:00AM GMT) AYKON Nine Elms : London’s First Fashion-Branded Residences with Versace Home Launched 50 Storey AYKON Nine Elms to feature Interiors by Versace Home London, United Kingdom Luxury real estate developer DICO UK Property Holdings Ltd, a wholly owned subsidiary of DAMAC International Limited, has announced the first of its fashion residences in London with a 50-storey, 360 unit project with interior designs by Versace. The lobby, amenities and interiors for each property will be expertly designed and fitted out by Versace Home. This Smart News Release features multimedia. View the full release here: http://www.businesswire.com/news/home/20150716006400/en/ AYKON Nine Elms is set to be an iconic tower in the heart of London. (Photo: Business Wire) Amenities will include a state of the art gymnasium, indoor swimming pool and spa, an owners lounge, children’s play area, roof garden and cinema, all designed by Versace Home. AYKON Nine Elms is located at the heart of the UK capital’s Nine Elms regeneration area adjacent to Battersea, overlooking the River Thames. The tower is due for completion in 2020. AYKON Nine Elms will be the first private residence project of scale in London to be fully designed and conceptualized by a luxury fashion house, with Versace involved in all aspects of interior design. AYKON Nine Elms combines a mix of premium penthouses, three-, two-, one-bedroom and Manhattan Studio units with City and River views along the Thames to the Palace of Westminster and the London Eye. Gian Giacomo Ferraris, CEO of Versace said: “Versace is synonymous with fashion and luxury and its participation in the real estate business provides the opportunity to fully experience the Versace lifestyle. In recent years, the private residential projects have become a strategic part of the Versace world. Today, thanks to the collaboration with DICO UK Property Holdings Ltd and DAMAC - a developer who we have worked with for many years and who shares our vision for the highest standards - we bring the ultimate expression of Versace’s lifestyle to the very heart of London.” London continues to be one of the most sustainable real estate markets in the world, with solid year-on-year price growth circa 6% according to real estate advisory firm, JLL. Analysts expect house price inflation in the region of 5-7% in the coming years. \"There is a huge appetite from our current global customer base for luxury property investments in London,” said Hussain Sajwani, Chairman of DAMAC. “AYKON Nine Elms presents an unrivalled opportunity for them to access the stable and established London market. AYKON Nine Elms, with Versace-branded living, is a truly unique concept and a fantastic addition to the residential market in this amazing cultural and vibrant city.\" \"It also presents prospective buyers with an unrivalled opportunity to own a luxurious central London home, in close proximity to the luxury shopping destinations Knightsbridge and Mayfair, Chelsea and the planned Linear Park.\" Iinternationally recognised companies are working on the project including one of the world’s preeminent architecture firms, Kohn Pedersen Fox Associates, Turner & Townsend and consultants including JLL and WSP.", "external_links": [], "published": "2015-07-20T12:00:00.000+03:00", "crawled": "2015-07-20T13:35:13.723+03:00", "highlightTitle": ""}