{"organizations": ["Region Manager and Research Director", "Home Service", "Singapore Post", "IL&FS Transportation Networks Limited", "Forrester Research", "CMO", "Forrester Research Vice-President", "State Bank of India", "Singapore Forrester Research, Inc."], "uuid": "2e05af2e4584c11dfa861e04637664f5e6817d5e", "thread": {"social": {"gplus": {"shares": 0}, "pinterest": {"shares": 0}, "vk": {"shares": 0}, "linkedin": {"shares": 0}, "facebook": {"likes": 0, "shares": 0, "comments": 0}, "stumbledupon": {"shares": 0}}, "site_full": "businesswireindia.com", "main_image": "", "site_section": "http://businesswireindia.com/RSSFeeds/cat-business-finance.xml", "section_title": "BusinessWire India.com - Business/ Finance", "url": "http://businesswireindia.com/news/news-details/forrester-research-announces-its-inaugural-asia-pacific-cmo-cio-summit/44587", "country": "US", "title": "Forrester Research Announces Its Inaugural Asia Pacific CMO + CIO Summits", "performance_score": 0, "site": "businesswireindia.com", "participants_count": 0, "title_full": "Forrester Research Announces Its Inaugural Asia Pacific CMO + CIO Summits", "spam_score": 0.0, "site_type": "news", "published": "2015-07-23T09:17:00.000+03:00", "replies_count": 0, "uuid": "2e05af2e4584c11dfa861e04637664f5e6817d5e"}, "author": "", "url": "http://businesswireindia.com/news/news-details/forrester-research-announces-its-inaugural-asia-pacific-cmo-cio-summit/44587", "ord_in_thread": 0, "title": "Forrester Research Announces Its Inaugural Asia Pacific CMO + CIO Summits", "locations": ["Mumbai", "Singapore", "Australia", "Greater China", "Asia Pacific", "India", "Sydney"], "entities": {"persons": [], "locations": [], "organizations": []}, "highlightText": "", "language": "english", "persons": ["Sudhir Kanvinde", "Pankaj Batra", "Jenny Williams", "Dane Anderson", "Kajal Ghose", "Timothy Lee"], "text": "Thursday, July 23, 2015 11:47AM IST (6:17AM GMT) (BW)(FORRESTER-RESEARCH) Forrester Research Announces Its Inaugural Asia Pacific CMO + CIO Summits CMOs and CIOs must partner to identify and pursue opportunities enabled by digital technologies in the age of the customer Singapore Forrester Research, Inc. (Nasdaq: FORR) announced a series of CMO and CIO Summits for Asia Pacific 2015 in Singapore, Sydney and Mumbai. For the first time in Asia Pacific, these summits will focus on the needs of both CMOs and CIOs, who must work together to lead their organizations in identifying and mobilizing against the opportunities enabled by digital technologies in the age of the customer. “The partnership between marketing and technology departments is critical for companies to gain a deep understanding of the emerging customer life cycle – new behaviors and expectations enabled by digital technologies,” says Dane Anderson, Forrester Research Vice-President, Region Manager and Research Director, Asia Pacific. “Forrester’s regional Summits will offer insight and tools to help CMOs and CIOs bringing their core capabilities together to collaborate and grow their business by winning, serving, and retaining customers.” The Summit in Mumbai will also feature the official launch the 2015 Forrester Research Customer Experience Index for India. Forrester’s CX Index™ is the market’s leading customer experience measurement and decision tool. The CX Index gives companies the ability to measure the quality of their customers’ experience and connect those measures to actions and results, as well as compare their CX performance within and across industries. Forrester will also launch its CX Index for Australia at its Summit for Marketing Leaders in Sydney on September 15. Keynote speakers at the Asia Pacific CMO+CIO Summits include: Pankaj Batra , Chief Marketing Officer, Home Service, Pizza Hut Asia Franchise (Singapore) Timothy Lee , Vice President of Global Strategy, Head of Greater China, Singapore Post eCommerce (Singapore) Jenny Williams , Chief Marketing Officer, Hospitals Contribution Fund (Sydney) Kajal Ghose , Chief General Manager, State Bank of India (Mumbai) Sudhir Kanvinde , CIO, IL&FS Transportation Networks Limited (Mumbai) About Forrester’s 2015 Summits in Asia Pacific:", "external_links": [], "published": "2015-07-23T09:17:00.000+03:00", "crawled": "2015-07-23T09:26:20.170+03:00", "highlightTitle": ""}