{"organizations": ["The Catholic Syrian Bank Limited", "IIT", "Catholic Syrian Bank Ltd By ET Bureau", "Catholic Syrian Bank Ltd Anand Krishnamurthy", "Catholic Syrian Bank", "Catholic Syrian Bank Limited"], "uuid": "31b932ebcde8df44a728e91e033c6e2e59795e2e", "thread": {"social": {"gplus": {"shares": 0}, "pinterest": {"shares": 0}, "vk": {"shares": 0}, "linkedin": {"shares": 0}, "facebook": {"likes": 0, "shares": 0, "comments": 0}, "stumbledupon": {"shares": 0}}, "site_full": "economictimes.indiatimes.com", "main_image": "http://img.economictimes.indiatimes.com/photo/6325547.cms", "site_section": "http://economictimes.indiatimes.com/rssfeeds/13358319.cms", "section_title": "Banking-Banking/Finance-Industry-The Economic Times", "url": "http://economictimes.indiatimes.com/industry/banking/finance/banking/anand-krishnamurthy-appointed-new-md-and-ceo-for-catholic-syrian-bank-ltd/articleshow/48190333.cms", "country": "IL", "title": "Anand Krishnamurthy appointed new MD and CEO for Catholic Syrian Bank Ltd", "performance_score": 0, "site": "indiatimes.com", "participants_count": 0, "title_full": "Anand Krishnamurthy appointed new MD and CEO for Catholic Syrian Bank Ltd", "spam_score": 0.0, "site_type": "news", "published": "2015-07-23T16:28:00.000+03:00", "replies_count": 0, "uuid": "31b932ebcde8df44a728e91e033c6e2e59795e2e"}, "author": "", "url": "http://economictimes.indiatimes.com/industry/banking/finance/banking/anand-krishnamurthy-appointed-new-md-and-ceo-for-catholic-syrian-bank-ltd/articleshow/48190333.cms", "ord_in_thread": 0, "title": "Anand Krishnamurthy appointed new MD and CEO for Catholic Syrian Bank Ltd", "locations": ["Tamil Nadu", "Maharashtra", "Chennai", "Karnataka", "Kerala", "Kolkata", "India"], "entities": {"persons": [], "locations": [], "organizations": []}, "highlightText": "", "language": "english", "persons": ["Krishnamurthy", "Anand", "Anand Krishnamurthy"], "text": "Anand Krishnamurthy appointed new MD and CEO for Catholic Syrian Bank Ltd By ET Bureau | 23 Jul, 2015, 06.58PM IST ET SPECIAL: Love visual aspect of news? Enjoy this exclusive slideshows treat! KOCHI: The board of directors of The Catholic Syrian Bank Limited has appointed Anand Krishnamurthy as the managing director and chief executive officer (MD&CEO) of the bank. The Catholic Syrian Bank Limited is one of the oldest private sector banks in India with a history of over 94 years, and a strong base in Kerala along with significant presence in Tamil Nadu, Karnataka and Maharashtra. Krishnamurthy has about 22 years of experience in the field of banking having previously worked with HSBC for that period. He has been associated with the Catholic Syrian Bank since April 7, 2014 and has been responsible for corporate banking, SME business and the integrated treasury operations of the bank as its head of wholesale banking and treasury. He holds a bachelor's degree in technology (mechanical engineering) from IIT, Chennai and a post graduate diploma in management from IIM, Kolkata. S.Santhanakrishnan, part-time chairman of the bank, said, \"As MD & CEO, Anand will continue to focus on initiatives to transform ourselves into a full service contemporary bank.\"  ", "external_links": [], "published": "2015-07-23T16:28:00.000+03:00", "crawled": "2015-07-23T17:00:42.082+03:00", "highlightTitle": ""}