{"organizations": ["Institute of Chartered Accountants", "Worldwide Branding", "Solutions Inc.", "Worldwide Branding for Excellence in Finance Juby Joseph Recognized", "British Columbia", "Washington State Board of Accountancy", "Solutions Inc", "The Institute of Chartered Accountants of India, Institute of Cost and Works Accountants of India, Institute of Company Secretaries of India", "Certified Public Accountants", "Worldwide Branding for Excellence"], "uuid": "9d4c59b5a329fd5773bee6c91dde216c0d3a789b", "thread": {"social": {"gplus": {"shares": 0}, "pinterest": {"shares": 0}, "vk": {"shares": 0}, "linkedin": {"shares": 0}, "facebook": {"likes": 0, "shares": 0, "comments": 0}, "stumbledupon": {"shares": 0}}, "site_full": "www.24-7pressrelease.com", "main_image": "http://www.24-7pressrelease.com/images/icon-247pressrelease.jpg", "site_section": "http://rss.24-7pressrelease.com/rss/business_finance.xml", "section_title": "Press Release and Top Business   Finance News From 24-7 Press Release Newswire", "url": "http://www.24-7pressrelease.com/press-release/juby-joseph-recognized-by-worldwide-branding-for-excellence-in-finance-411430.php", "country": "US", "title": "Juby Joseph Recognized by Worldwide Branding for Excellence in Finance", "performance_score": 0, "site": "24-7pressrelease.com", "participants_count": 0, "title_full": "Juby Joseph Recognized by Worldwide Branding for Excellence in Finance", "spam_score": 0.0, "site_type": "news", "published": "2015-08-19T10:00:00.000+03:00", "replies_count": 0, "uuid": "9d4c59b5a329fd5773bee6c91dde216c0d3a789b"}, "author": "", "url": "http://www.24-7pressrelease.com/press-release/juby-joseph-recognized-by-worldwide-branding-for-excellence-in-finance-411430.php", "ord_in_thread": 0, "title": "Juby Joseph Recognized by Worldwide Branding for Excellence in Finance", "locations": ["United Arab Emirates", "United States", "The Netherlands", "Spain", "Ireland", "Italy", "United Kingdom", "Switzerland", "India", "France", "USA", "Mexico", "Canada", "Brazil", "Belgium", "Australia", "South Africa", "Germany", "Sweden"], "entities": {"persons": [], "locations": [], "organizations": []}, "highlightText": "", "language": "english", "persons": ["Joseph", "Juby Joseph"], "text": "Juby Joseph Recognized by Worldwide Branding for Excellence in Finance Mr. Joseph has 25 years of experience in tax and accounting services Over the years, Mr. Joseph has graduated from many professional institutes and universities DELTA, BC, August 19,   Juby Joseph, Chief Financial Officer of Resources 2 Solutions Inc., has been recognized by Worldwide Branding for showing dedication, leadership and excellence in finance. Having spent over 25 years in the financial industry, Mr. Joseph has become skilled in the fields of multi jurisdictional tax, accounting and big data services, as well as creating out-of-the-box solutions. As chief financial officer of Resources 2 Solutions Inc., he is the go to guy in growing the company and discovering new revenue streams, as well as offering clients effective business solutions. Constantly reminding himself that he has not yet \"painted his last leaf,\" Mr. Joseph is a firm believer in the life-long learning process. He owes his success to always putting his full effort into every project he takes on, whether big or small. Mr. Joseph hopes to give back to others what he has been blessed with, through pro bono work and other cases that are close to his heart. Over the years, Mr. Joseph has graduated from many professional institutes and universities including The Institute of Chartered Accountants of India, Institute of Cost and Works Accountants of India, Institute of Company Secretaries of India, Certified General Accountants of BC, Canada, and Certified Public Accountants from the Washington State Board of Accountancy, USA. Additionally, he earned a Master of Commerce and a Bachelor of Law, as well as an Advanced Specialty Certificate in Forensic Investigation with a core focus on the prevention of economic losses due to fraud. He is a member of the British Columbia chapter of the Institute of Chartered Accountants, as well as Business Networking International. Resources 2 Solutions Inc. is a business solutions and services company that provides solutions for tax, accounting and big data services across Canada, the United States and India. For more information about Resources 2 Solutions Inc, please visit http://www.resources2solutions.com .About Worldwide Branding For over 15 years, Worldwide Branding has been the leading, one-stop-shop, personal branding company, both in the United States and abroad. From writing professional biographies and press releases, to creating and driving traffic to personal websites, our team of branding experts tailor each product specifically for our clients' needs. We are dedicated to empowering our 600,000 clients with effective branding tools to help them achieve success. From healthcare to finance to education and law, our constituents represent every major industry and occupation, at all career levels. An international company, we provide our members with access to members in over 52 countries including, the United States, Canada, Australia, the United Kingdom, France, The Netherlands, Germany, Ireland, Spain, Switzerland, South Africa, Belgium, Mexico, Italy, Brazil, Sweden and The United Arab Emirates, just to name a few. For more information, please visit http://www.worldwidebranding.com . # # #", "external_links": [], "published": "2015-08-19T10:00:00.000+03:00", "crawled": "2015-08-19T11:00:37.051+03:00", "highlightTitle": ""}