{"organizations": ["Consumer Group Kurt Salmon", "Consumer Group Shanghai", "Consumer Group", "China Global"], "uuid": "5d208d8fda998b621915fc3bbb01dae5d3d5653e", "thread": {"social": {"gplus": {"shares": 0}, "pinterest": {"shares": 0}, "vk": {"shares": 0}, "linkedin": {"shares": 0}, "facebook": {"likes": 0, "shares": 0, "comments": 0}, "stumbledupon": {"shares": 0}}, "site_full": "businesswireindia.com", "main_image": "", "site_section": "http://businesswireindia.com/RSSFeeds/cat-business-finance.xml", "section_title": "BusinessWire India.com - Business/ Finance", "url": "http://businesswireindia.com/news/news-details/benjamin-zheng-joins-kurt-salmon-as-managing-partner-its-asia-pacific-/44892", "country": "US", "title": "Benjamin Zheng Joins Kurt Salmon as Managing Partner in Its Asia Pacific Retail and Consumer Group", "performance_score": 0, "site": "businesswireindia.com", "participants_count": 0, "title_full": "Benjamin Zheng Joins Kurt Salmon as Managing Partner in Its Asia Pacific Retail and Consumer Group", "spam_score": 0.0, "site_type": "news", "published": "2015-08-19T09:03:00.000+03:00", "replies_count": 0, "uuid": "5d208d8fda998b621915fc3bbb01dae5d3d5653e"}, "author": "", "url": "http://businesswireindia.com/news/news-details/benjamin-zheng-joins-kurt-salmon-as-managing-partner-its-asia-pacific-/44892", "ord_in_thread": 0, "title": "Benjamin Zheng Joins Kurt Salmon as Managing Partner in Its Asia Pacific Retail and Consumer Group", "locations": ["Singapore", "United States of America", "Australia", "Asia Pacific", "Greater China", "Japan", "China"], "entities": {"persons": [], "locations": [], "organizations": []}, "highlightText": "", "language": "english", "persons": ["Madison Riley", "Ben", "Kurt Salmon", "Benjamin Zheng", "Zheng", "Benjamin Zheng Joins Kurt Salmon"], "text": "Wednesday, August 19, 2015 11:33AM IST (6:03AM GMT) (BW)(KURT-SALMON) Benjamin Zheng Joins Kurt Salmon as Managing Partner in Its Asia Pacific Retail and Consumer Group Shanghai, China Global management consulting firm Kurt Salmon is pleased to welcome Benjamin Zheng as a managing partner in its Asia Pacific Retail and Consumer Group. Mr. Zheng brings over 20 years of supply chain and logistics experience, having led initiatives in supply chain management, operations excellence, strategic transformation, e-commerce business modeling and digital strategy for companies worldwide. In his role with Kurt Salmon, he will be responsible for leading the practice and growing its market share in Greater China by further developing and integrating a portfolio of solutions and capabilities with retail strategy and adapting them to the rapidly evolving Asia Pacific region. “It’s an incredible opportunity to combine my experience and expertise with Kurt Salmon’s long-term commitment to China and contribute to a leap forward in the industry,” Mr. Zheng said. “I look forward to participating in Kurt Salmon’s continuous innovative effort in omnichannel offerings and to driving new growth in the increasingly complex Asia Pacific marketplace.” A truly international executive, Mr. Zheng has aided companies headquartered in and doing business across China, Singapore, Japan, Australia, the United States of America and other markets. He has also held positions as chief information officer and head of the Asia Pacific supply chain process for a multinational conglomerate, giving him an insider’s perspective of the challenges Kurt Salmon’s clients face. “Ben’s global supply chain experience, combined with his expertise in all things digital and his truly international perspective, makes him uniquely positioned to drive organizations’ successful omnichannel initiatives both locally and globally,” said Madison Riley, managing partner of Kurt Salmon’s Asia Pacific Retail and Consumer Group. “As the industry grows increasingly international, from sourcing to selling to fulfillment, he’ll be invaluable both to our team and to clients pursuing complex, forward-looking business goals.” About Kurt Salmon’s Global Retail and Consumer Group Kurt Salmon is a global management consulting firm dedicated to building the market leaders of tomorrow—whatever tomorrow might look like. In nearly a century of working with the world’s most consistently successful companies, Kurt Salmon’s Retail and Consumer Group offers well-honed experience to help you turn your business operations into a source of competitive advantage. Over the years, we have worked with 30 of the world’s top 50 retailers, as well as scores of global and specialty brands, to design and align how they operate in order to shape and satisfy the desires of their customers—now and in the future. We call it delivering “success for what’s next.” Our clients tell us the results are transformative.", "external_links": [], "published": "2015-08-19T09:03:00.000+03:00", "crawled": "2015-08-19T09:26:22.119+03:00", "highlightTitle": ""}