{"organizations": ["Chevrolet Impala", "Zacks Investment Research", "Buick Regal", "Ford Motor Co", "PCAR", "General Motors", "General Motors Co", "Inc", "General Motors Defers Oshawa Assembly", "Chevrolet Equinox", "Zacks Equity Research", "GM", "PACCAR Inc", "Cadillac"], "uuid": "627fdd46a4378d2c192a32b149e7140ee76c7410", "thread": {"social": {"gplus": {"shares": 0}, "pinterest": {"shares": 0}, "vk": {"shares": 0}, "linkedin": {"shares": 0}, "facebook": {"likes": 0, "shares": 0, "comments": 0}, "stumbledupon": {"shares": 0}}, "site_full": "finance.yahoo.com", "main_image": "http://l2.yimg.com/bt/api/res/1.2/6rik6AZwuPGCiADf_9dhPQ--/YXBwaWQ9eW5ld3M7cT03NTt3PTYwMA--/http://l.yimg.com/os/mit/media/m/social/images/social_default_logo-1481777.png", "site_section": "http://finance.yahoo.com/rss/headline?s=GM", "section_title": "Yahoo! Finance: GM News", "url": "http://finance.yahoo.com/news/general-motors-defers-oshawa-assembly-160004973.html", "country": "GB", "title": "General Motors Defers Oshawa Assembly Line Closure to '17", "performance_score": 0, "site": "yahoo.com", "participants_count": 0, "title_full": "General Motors Defers Oshawa Assembly Line Closure to '17", "spam_score": 0.0, "site_type": "news", "published": "2015-08-21T19:00:00.000+03:00", "replies_count": 0, "uuid": "627fdd46a4378d2c192a32b149e7140ee76c7410"}, "author": "", "url": "http://finance.yahoo.com/news/general-motors-defers-oshawa-assembly-160004973.html", "ord_in_thread": 0, "title": "General Motors Defers Oshawa Assembly Line Closure to '17", "locations": ["Canada", "Oshawa", "St. Catharines", "Ontario"], "entities": {"persons": [], "locations": [], "organizations": []}, "highlightText": "", "language": "english", "persons": ["Harley-Davidson"], "text": "General Motors Defers Oshawa Assembly Line Closure to '17 By Zacks Equity Research 2 hours ago  Content preferences Done Shares of General Motors Co. GM dropped 2.5% to $30.84 on Aug 20 owing to a decline in the overall market. Meanwhile, the automaker announced that it will continue operations at its Oshawa, Ontario assembly line till 2017. General Motors has been planning the closure of this plant for over a decade now.The company announced that it will be investing C$12 million ($9.14 million) in the plant to boost production of Chevrolet Equinox SUVs and for some related changes at the separate CAMI Assembly. It is expected that the investment will help the automaker fulfill the rising demand for Chevrolet Equinox in North America.At present, Chevrolet Equinox is being produced in the nearby CAMI assembly plant in Ingersoll, Ontario. The CAMI plant manufactures more Equinox chassis than its capacity to paint and assemble them. Thus, the excess gets sent to the nearby Oshawa plant.The assembly line in question is one of the two remaining Oshawa assembly lines of General Motors. It manufactures the previous model of Chevrolet Impala, along with the Chevrolet Equinox. Meanwhile, the other Oshawa assembly line manufactures the current models of Chevrolet Impala, Buick Regal, Chevrolet Camaro and Cadillac XTS.In 2005, General Motors announced for the first time, the plans of closing the plant in 2008. However, the closure was put off till 2013 in the following year. Thereafter, 2016 was announced to be the last operational year.General Motors currently employs around 9,000 people in Canada. The company has invested approximately $800 million in its Oshawa and St. Catharines, Ontario, operations over the past three years. Recently, the company announced an additional $800 million investment in its CAMI operations in Ingersoll.General Motors currently carries a Zacks Rank #3 (Hold). Better-ranked automobile stocks include Ford Motor Co. F, PACCAR Inc. PCAR and Harley-Davidson, Inc. HOG. All the stocks carry a Zacks Rank #2 (Buy).Want the latest recommendations from Zacks Investment Research? Today, you can download 7 Best Stocks for the Next 30 Days. Click to get this free report >> Want the latest recommendations from Zacks Investment Research? Today, you can download 7 Best Stocks for the Next 30 Days. Click to get this free report", "external_links": [], "published": "2015-08-21T19:00:00.000+03:00", "crawled": "2015-08-21T21:38:13.230+03:00", "highlightTitle": ""}