{"organizations": ["United States Rimini Street, Inc.", "Las Vegas", "SAP", "Oracle Corporation", "SAP AG", "ERP Vendors New Gartner", "Gartner", "Inc", "ERP", "PeopleSoft"], "uuid": "476c36173a7b6695202400b3ed84e434429c4198", "thread": {"social": {"gplus": {"shares": 0}, "pinterest": {"shares": 0}, "vk": {"shares": 0}, "linkedin": {"shares": 0}, "facebook": {"likes": 0, "shares": 0, "comments": 0}, "stumbledupon": {"shares": 0}}, "site_full": "businesswireindia.com", "main_image": "", "site_section": "http://businesswireindia.com/RSSFeeds/cat-business-finance.xml", "section_title": "BusinessWire India.com - Business/ Finance", "url": "http://businesswireindia.com/news/news-details/gartner-seeing-steady-increase-inquiries-about-cancelling-maintenance-/44745", "country": "US", "title": "Gartner Seeing Steady Increase in Inquiries About Cancelling Maintenance Agreements with ERP Vendors", "performance_score": 0, "site": "businesswireindia.com", "participants_count": 0, "title_full": "Gartner Seeing Steady Increase in Inquiries About Cancelling Maintenance Agreements with ERP Vendors", "spam_score": 0.0, "site_type": "news", "published": "2015-08-06T12:07:00.000+03:00", "replies_count": 0, "uuid": "476c36173a7b6695202400b3ed84e434429c4198"}, "author": "", "url": "http://businesswireindia.com/news/news-details/gartner-seeing-steady-increase-inquiries-about-cancelling-maintenance-/44745", "ord_in_thread": 0, "title": "Gartner Seeing Steady Increase in Inquiries About Cancelling Maintenance Agreements with ERP Vendors", "locations": ["Rimini Street"], "entities": {"persons": [], "locations": [], "organizations": []}, "highlightText": "", "language": "english", "persons": ["Seth Ravin", "JD Edwards"], "text": "Thursday, August 6, 2015 2:37PM IST (9:07AM GMT) (BW)(NV-RIMINI-STREET) Gartner Seeing Steady Increase in Inquiries About Cancelling Maintenance Agreements with ERP Vendors New Gartner report details the increasing maintenance cancelation inquiries and the alternative support options being explored Las Vegas, United States Rimini Street, Inc., the leading independent provider of enterprise software support for SAP AG’s (NYSE:SAP) Business Suite and BusinessObjects software and Oracle Corporation’s (NYSE:ORCL) Siebel , PeopleSoft , JD Edwards , E-Business Suite , Oracle Database , Hyperion and Oracle Retail software, announced that Gartner recently released a new report titled, “What to Consider Before Cancelling Your ERP Vendor's Maintenance Agreement and Switching to Third-Party Support.” In this report, Gartner presents the Key Challenges and Recommendations for ERP leaders evaluating ERP maintenance and support options. Guidance for Assessing All Your Support Options A growing number of enterprise software licensees are considering alternatives to annual maintenance from the enterprise software vendor. IT organizations are increasingly being asked to shift spending away from maintaining the status quo to supporting core business growth objectives. While the market for independent support options has matured, there are still many questions and misperceptions regarding the cancelling of vendor maintenance agreements which are addressed in this new Gartner report. “Enterprise software licensees are struggling with the low value and poor service received from increasingly expensive vendor annual maintenance fees and this report verifies that many licensees are actively considering independent support options,” said Seth Ravin , CEO, Rimini Street. “Rimini Street offers Oracle and SAP licensees a more robust service offering, a more responsive service model, exceptional client value and the ability to free up funds to drive innovations the business needs today. We are proud to have already helped nearly 1,100 clients, including more than 100 Fortune 500 and Fortune Global 100 organizations, achieve maximum value from their IT investments.” About Rimini Street, Inc. Rimini Street is the global leader in providing independent enterprise software support services. The company has redefined enterprise support services since 2005 with an innovative, award-winning program that enables Oracle and SAP licensees to save up to 90 percent on total support costs. Clients can remain on their current software release without any required upgrades for at least 15 years. Over 1000 global, Fortune 500, midmarket, and public sector organizations from a broad range of industries have selected Rimini Street as their trusted, independent support provider. To learn more, please visit www.riministreet.com Forward-Looking Statements This press release may contain forward-looking statements. The words “believe,”“may,”“will,”“estimate,”“continue,”“anticipate,”“intend,”“plan,”“expect,” and similar expressions are intended to identify forward-looking statements. These forward-looking statements are subject to risks and uncertainties, and are based on various assumptions. If the risks materialize or our assumptions prove incorrect, actual results could differ materially from the results implied by these forward-looking statements. Rimini Street assumes no obligation to update any forward-looking statements or information, which speak only as of the date of this press release. Rimini Street and the Rimini Street logo are trademarks of Rimini Street, Inc. All other company and product names may be trademarks of their respective owners. Copyright © 2015. All rights reserved.", "external_links": [], "published": "2015-08-06T12:07:00.000+03:00", "crawled": "2015-08-06T13:09:44.487+03:00", "highlightTitle": ""}