{"organizations": ["Hilton Worldwide", "DoubleTree", "Hilton Hotels & Resorts", "Hilton", "Conrad Hotels & Resorts", "United States Hilton", "Waldorf Astoria Hotels & Resorts", "Triple Points"], "uuid": "7962f2553b96407fef2c954392ce8f4249ae2358", "thread": {"social": {"gplus": {"shares": 0}, "pinterest": {"shares": 0}, "vk": {"shares": 0}, "linkedin": {"shares": 0}, "facebook": {"likes": 0, "shares": 0, "comments": 0}, "stumbledupon": {"shares": 0}}, "site_full": "businesswireindia.com", "main_image": "", "site_section": "http://businesswireindia.com/RSSFeeds/cat-business-finance.xml", "section_title": "BusinessWire India.com - Business/ Finance", "url": "http://businesswireindia.com/news/news-details/hilton-hhonors-triple-your-trip-promotion-returns-offering-members-thr/44923", "country": "US", "title": "Hilton HHonors Triple Your Trip Promotion Returns Offering Members Three Times the Value", "performance_score": 0, "site": "businesswireindia.com", "participants_count": 0, "title_full": "Hilton HHonors Triple Your Trip Promotion Returns Offering Members Three Times the Value", "spam_score": 0.0, "site_type": "news", "published": "2015-08-21T08:30:00.000+03:00", "replies_count": 0, "uuid": "7962f2553b96407fef2c954392ce8f4249ae2358"}, "author": "", "url": "http://businesswireindia.com/news/news-details/hilton-hhonors-triple-your-trip-promotion-returns-offering-members-thr/44923", "ord_in_thread": 0, "title": "Hilton HHonors Triple Your Trip Promotion Returns Offering Members Three Times the Value", "locations": ["Va."], "entities": {"persons": [], "locations": [], "organizations": []}, "highlightText": "", "language": "english", "persons": ["Mark Weinstein", "J.D. Power", "Mclean"], "text": "Friday, August 21, 2015 11:00AM IST (5:30AM GMT) Hilton HHonors Triple Your Trip Promotion Returns Offering Members Three Times the Value Global promotion gives members Double Points during the week and Triple Points on weekends Mclean, Va., United States Hilton HHonors , the loyalty program for Hilton Worldwide’s 12 distinct hotel brands, announced the return of Triple Your Trip. A member-favorite, the promotion allows guests who book directly through Hilton to earn Double Points Monday through Thursday nights and Triple Points on Friday, Saturday and Sunday nights from September 1 – December 31, 2015 at all Hilton Hotels & Resorts, Waldorf Astoria Hotels & Resorts, Conrad Hotels & Resorts, Canopy by Hilton, Curio - A Collection by Hilton, DoubleTree by Hilton, Embassy Suites Hotels, Hilton Garden Inn, Hampton Hotels, Homewood Suites by Hilton, Home2 Suites by Hilton and Hilton Grand Vacations properties. “All 4,440 of our hotels are participating in the Triple Your Trip promotion– something we know means a lot to our members,” said Mark Weinstein, global head of loyalty and partnerships, Hilton Worldwide. “We’re always listening to ensure our members feel like their feedback is heard and influences important program decisions like bringing back favorite promotions, launching Digital Key and providing offerings like free Wi-Fi for those who book directly with us.” In addition to being able to earn Bonus Points from Triple Your Trip , when guests book directly through Hilton (Hilton.com, the HHonors app, reservations call center or our corporate travel partners), they receive benefits that are not available through third-party sites, like Hilton’s Best Price Guarantee , HHonors Points, free Wi-Fi and more. To participate in Triple Your Trip , members must register at HHonors.com/Triple before checking out from an eligible stay. For more information or to become a Hilton HHonors member, visit HHonors.com . About Hilton Worldwide Hilton Worldwide (NYSE: HLT) is a leading global hospitality company, spanning the lodging sector from luxury and full-service hotels and resorts to extended-stay suites and focused-service hotels. For 96 years, Hilton Worldwide has been dedicated to continuing its tradition of providing exceptional guest experiences. The company's portfolio of twelve world-class global brands is comprised of more than 4,440 managed, franchised, owned and leased hotels and timeshare properties, with more than 730,000 rooms in 97 countries and territories, including Hilton Hotels & Resorts, Waldorf Astoria Hotels & Resorts, Conrad Hotels & Resorts, Canopy by Hilton, Curio – A Collection by Hilton, DoubleTree by Hilton, Embassy Suites by Hilton, Hilton Garden Inn, Hampton by Hilton, Homewood Suites by Hilton, Home2 Suites by Hilton and Hilton Grand Vacations. The company also manages an award-winning customer loyalty program, Hilton HHonors®. Hilton HHonors members who book directly through preferred Hilton channels have access to benefits including free standard Wi-Fi, as well as digital amenities that are available exclusively through the industry-leading Hilton HHonors app, where HHonors members can check-in, choose their room, and access their room using a Digital Key. Visit news.hiltonworldwide.com for more information and connect with Hilton Worldwide at facebook.com/hiltonworldwide , twitter.com/hiltonworldwide , youtube.com/hiltonworldwide , flickr.com/hiltonworldwide , and linkedin.com/company/hilton-worldwide . About Hilton HHonors Hilton HHonors is the award-recognized guest-loyalty program for Hilton Worldwide’s 12 distinct hotel brands, spanning more than 4,440 hotels, resorts and timeshare properties across 97 countries and territories. This year, J.D. Power awarded Hilton HHonors as “Highest in Customer Satisfaction with Hotel Loyalty/Rewards Programs in a Tie”. Hilton HHonors members who book directly through preferred Hilton channels have access to benefits including free standard Wi-Fi, as well as digital amenities that are available exclusively through the industry-leading Hilton HHonors mobile app , where HHonors members can check-in, choose their room, and access their room using a Digital Key. With 46 million members, HHonors offers hundreds of ways to earn and redeem Points. Members can redeem their Points for free nights, premium merchandise, charitable contributions, or unique events through the HHonors auction platform (hhonors.com/auctions) , such as exclusive artist experiences and hotel concert events with Live Nation® or a race experience with the McLaren-Honda Formula 1 team. There is no cost to join, and travelers may enroll online by visiting www.HiltonHHonors.com or connect with Hilton HHonors at news.hiltonhhonors.com .", "external_links": [], "published": "2015-08-21T08:30:00.000+03:00", "crawled": "2015-08-21T11:57:37.763+03:00", "highlightTitle": ""}