{"organizations": ["North Carolina Mesothelioma Victims Center", "The North Carolina Mesothelioma Victims Center", "US Navy", "North Carolina Mesothelioma Victims Center Now Urges A Diagnosed Navy", "Mesothelioma Victims Center", "Feed North Carolina Mesothelioma Victims Center Now Urges A Diagnosed Navy", "National Institutes of Health", "CDC", "UNC Lineberger Comprehensive Cancer Center Chapel Hill", "Wake Forest University Baptist Medical Center Comprehensive Cancer Center Winston-Salem", "US Navy Veteran", "Duke Cancer Institute Durham", "US Navy Veterans"], "uuid": "b30f7b462c39c3c87a5217c54d321332efeee9ae", "thread": {"social": {"gplus": {"shares": 0}, "pinterest": {"shares": 0}, "vk": {"shares": 0}, "linkedin": {"shares": 0}, "facebook": {"likes": 0, "shares": 0, "comments": 0}, "stumbledupon": {"shares": 0}}, "site_full": "www.24-7pressrelease.com", "main_image": "http://www.24-7pressrelease.com/attachments/041/press_release_distribution_0410968_93006_1.jpg", "site_section": "http://rss.24-7pressrelease.com/rss/home_and_family_personal_finance.xml", "section_title": "Press Release and Top HomeFamily   Personal Finance News From 24-7 Press Release Newswire", "url": "http://www.24-7pressrelease.com/press-release/north-carolina-mesothelioma-victims-center-now-urges-a-diagnosed-navy-veteran-in-north-carolina-to-call-them-about-how-to-get-the-best-lawyers-for-better-compensation-results-410968.php", "country": "US", "title": "North Carolina Mesothelioma Victims Center Now Urges A Diagnosed Navy Veteran In North Carolina To Call Them About How To Get The Best Lawyers For Better Compensation Results", "performance_score": 0, "site": "24-7pressrelease.com", "participants_count": 0, "title_full": "North Carolina Mesothelioma Victims Center Now Urges A Diagnosed Navy Veteran In North Carolina To Call Them About How To Get The Best Lawyers For Better Compensation Results", "spam_score": 0.0, "site_type": "news", "published": "2015-08-31T10:00:00.000+03:00", "replies_count": 0, "uuid": "b30f7b462c39c3c87a5217c54d321332efeee9ae"}, "author": "", "url": "http://www.24-7pressrelease.com/press-release/north-carolina-mesothelioma-victims-center-now-urges-a-diagnosed-navy-veteran-in-north-carolina-to-call-them-about-how-to-get-the-best-lawyers-for-better-compensation-results-410968.php", "ord_in_thread": 0, "title": "North Carolina Mesothelioma Victims Center Now Urges A Diagnosed Navy Veteran In North Carolina To Call Them About How To Get The Best Lawyers For Better Compensation Results", "locations": ["Winston-Salem", "Fayetteville", "Missouri", "New Mexico", "Alabama", "Iowa", "Florida", "Charlotte", "Greensboro", "California", "North Dakota", "Oregon", "Massachusetts", "Indiana", "WASHINGTON", "Tennessee", "Maryland", "Louisiana", "Nevada", "Ohio", "West Virginia", "Asheville", "Idaho", "Minnesota", "US", "Raleigh", "Washington", "Virginia", "Illinois", "DC", "Texas", "Connecticut", "Wyoming", "Oklahoma", "New York", "Kansas", "Arizona", "North Carolina", "Kentucky", "Alaska", "Utah", "Georgia", "New Jersey", "Michigan", "Colorado", "Maine", "Pennsylvania", "Nebraska", "Arkansas"], "entities": {"persons": [], "locations": [], "organizations": []}, "highlightText": "", "language": "english", "persons": ["M. Thomas Martin"], "text": "Email This Story Printer Friendly PDF Version RSS Feed North Carolina Mesothelioma Victims Center Now Urges A Diagnosed Navy Veteran In North Carolina To Call Them About How To Get The Best Lawyers For Better Compensation Results The last thing the North Carolina Mesothelioma Victims Center wants to see is a diagnosed victim who served in the US Navy get shortchanged because they did not get the best possible lawyers to advance their compensation claim. We cannot emphasize this enough-the treatment for mesothelioma, and the compensation process for this rare form of cancer must begin simultaneously for the best possible results WASHINGTON, DC, August 31,   The North Carolina Mesothelioma Victims Center says, \"We are urging a recently diagnosed victim of mesothelioma in North Carolina, and their family to take getting the best possible compensation seriously, and to call us at 866-714-6466 so we can suggest the specific names, and contact information for the nation's most experienced mesothelioma lawyers. We are especially focused on making certain US Navy Veterans, and or industrial trades workers get the best possible compensation. \"As we would like to explain the nation's top mesothelioma lawyers are like extremely skilled craftsmen, and it really pays to have a great deal of experience when it comes to designing a compensation claim for this rare form of cancer caused by asbestos exposure. The is especially true if we are talking about a US Navy Veteran, or an industrial, or manufacturing worker.\" http://NorthCarolina.MesotheliomaVictimsCenter.Com The North Carolina Mesothelioma Victims Center has one incredibly important compensation tip for a diagnosed victim of mesothelioma, or their family: \"There is some incredibly bad advice on the Internet that makes it sound like a person can simply sign up for a mesothelioma compensation claim, and or start the mesothelioma compensation process after receiving treatment. * \"Our advice is if a diagnosed victim of mesothelioma in North Carolina, or their family picks poorly when it comes to a lawyer to advance a mesothelioma compensation claim the mistake could cost the person with this rare form of cancer hundreds of thousands of dollars, or more. Also we cannot emphasize this enough-the treatment for mesothelioma, and the compensation process for this rare form of cancer must begin simultaneously for the best possible results.\" Aside from offering instant access to the nation's most skilled mesothelioma lawyers the Center is offering the best possible mesothelioma treatment options in North Carolina. The North Carolina Mesothelioma Victims Center strongly recommends the following three heath care facilities with the offer to help a diagnosed victim, or their family get to the right physicians at each hospital. * Duke Cancer Institute Durham, North Carolina: http://www.dukecancerinstitute.org/ * UNC Lineberger Comprehensive Cancer Center Chapel Hill, North Carolina: https://unclineberger.org/ * Wake Forest University Baptist Medical Center Comprehensive Cancer Center Winston-Salem, North Carolina: http://www.wakehealth.edu/Comprehensive-Cancer-Center/ The North Carolina Mesothelioma Victims Center want's to emphasize their's is a statewide initiative available to a diagnosed victim anywhere in North Carolina including communities such as Raleigh, Winston-Salem, Charlotte, Greensboro, Fayetteville, Asheville, or Wilmington.The average age for a diagnosed victim of mesothelioma is 72 years old. This year between 2500, and 3000 US citizens will be diagnosed with mesothelioma. Mesothelioma is a rare form of cancer that is attributable to exposure to asbestos. High risk work groups for exposure to asbestos in North Carolina include Veterans of the US Navy, power plant workers, shipyard workers, steel mill workers, oil refinery workers, pulp, or paper mill workers, factory workers, plumbers, electricians, miners, auto mechanics, machinists, and construction workers. Typically the exposure to asbestos occurred in the 1950's, 1960's, 1970's, or 1980's. http://NorthCarolina.MesotheliomaVictimsCenter.Com According to the CDC the states indicated with the highest incidence of mesothelioma include Maine, Massachusetts, Connecticut, Maryland, New Jersey, Pennsylvania, Ohio, West Virginia, Virginia, Michigan, Illinois, Minnesota, Louisiana, Washington, and Oregon. However, based on the calls the Mesothelioma Victims Center receives a diagnosed victim of mesothelioma could live in any state including New York, Florida, California, Texas, Illinois, Ohio, Iowa, Indiana, Missouri, Kentucky, Tennessee, North Carolina, Georgia, Alabama, Oklahoma, Arkansas, Kansas, Nebraska, North Dakota, Wyoming, Colorado, Nevada, New Mexico, Utah, Arizona, Idaho, or Alaska. The North Carolina Mesothelioma Victims Center says, \"If you call us at 866-714-6466, we will see to it that you have instant access to the nation's most experienced mesothelioma attorneys, who consistently get the best possible financial compensation results for their clients. \"Before you retain the services of a law firm to advance a mesothelioma compensation claim please call us first to ensure you really are dealing with one of the nation's most skilled mesothelioma lawyers.\" http://NorthCarolina.MesotheliomaVictimsCenter.Com For more information about mesothelioma please refer to the National Institutes of Health's web site related to this rare form of cancer: http://www.nlm.nih.gov/medlineplus/mesothelioma.html # # # Read more Press Releases from M. Thomas Martin:", "external_links": [], "published": "2015-08-31T10:00:00.000+03:00", "crawled": "2015-08-31T10:30:13.253+03:00", "highlightTitle": ""}