{"organizations": ["Manulife Financial", "Hobart College", "Lincoln Financial Group", "LFS", "Merrill Lynch International", "Constitution Advisory Group", "BCR Financial Services", "American Express Financial Advisors", "The Travelers Companies", "FINRA", "Lincoln Financial Network", "Lincoln Financial Securities Corp."], "uuid": "80073d50a04e6c82c0d9dae90b33d499772c112c", "thread": {"social": {"gplus": {"shares": 0}, "pinterest": {"shares": 0}, "vk": {"shares": 0}, "linkedin": {"shares": 0}, "facebook": {"likes": 0, "shares": 0, "comments": 0}, "stumbledupon": {"shares": 0}}, "site_full": "www.thestreet.com", "main_image": "http://s.thestreet.com/files/tsc/v2008/photos/all-pics/press_releases_9_lead.jpg", "site_section": "http://www.thestreet.com/feeds/rss/search.html?topicSearch=Travel&puc=relatedtopic", "section_title": "TheStreet Search RSS Feed: Travel", "url": "http://www.thestreet.com/story/13251933/1/lincoln-financial-network-announces-2014-advisors-of-the-year.html?cm_ven=RSSFeed", "country": "US", "title": "Lincoln Financial Network Announces 2014 Advisors Of The Year", "performance_score": 0, "site": "thestreet.com", "participants_count": 0, "title_full": "Lincoln Financial Network Announces 2014 Advisors Of The Year", "spam_score": 0.0, "site_type": "news", "published": "2015-08-11T18:19:00.000+03:00", "replies_count": 0, "uuid": "80073d50a04e6c82c0d9dae90b33d499772c112c"}, "author": "", "url": "http://www.thestreet.com/story/13251933/1/lincoln-financial-network-announces-2014-advisors-of-the-year.html?cm_ven=RSSFeed", "ord_in_thread": 0, "title": "Lincoln Financial Network Announces 2014 Advisors Of The Year", "locations": ["Hartford", "Pa", "N.Y", "Geneva", "Pitkin Street", "East Hartford", "Conn", "Pa.", "Pittsburgh", "London"], "entities": {"persons": [], "locations": [], "organizations": []}, "highlightText": "", "language": "english", "persons": ["David Berkowitz", "Mark Rychel Rychel", "Mark Rychel", "Lincoln", "Sullivan Sullivan", "Art Sullivan", "Rychel", "Sullivan"], "text": "Lincoln Financial Network Announces 2014 Advisors Of The Year By Business Wire | 08/11/15 - 11:19 AM EDT Reprint Lincoln Financial Network (LFN), the retail wealth management affiliate of Lincoln Financial Group (NYSE:LNC), today announced its 2014 Advisors of the Year: Mark Rychel , CFP ® , of BCR Financial Services in Pittsburgh, Pa. and Art Sullivan , CFP ® , of Constitution Advisor Group in East Hartford, Conn. This annual recognition is awarded to the leading financial advisors among thousands affiliated with LFN's broker-dealer, Lincoln Financial Securities Corp. (LFS). In a tradition dating back to 2008, the LFN Advisors of the Year will have their names engraved on plaques, which are presented and displayed in Lincoln offices. \"This award is the highest acknowledgment we give to our advisors,\" said David Berkowitz, president of LFN. \"It is a direct reflection of their strong dedication to the business and unwavering commitment to serving their clients. I applaud their hard work and thank them for their contributions to our organization.\" Art Sullivan Sullivan, founding partner and head of asset strategies for Constitution Advisory Group, and registered representative of LFS, has more than 30 years of experience in the financial services industry. In his practice, Sullivan specializes in asset allocation and investment management. Prior to joining Lincoln 25 years ago, Sullivan served as an investment portfolio specialist with The Travelers Companies and senior financial advisor with Manulife Financial in Hartford, Conn. Sullivan received a bachelor of science degree in economics from Hobart College in Geneva, N.Y. He holds the professional designation of CERTIFIED FINANCIAL PLANNER ™ (CFP ® ), as well as FINRA series 7, 24, 63 and 66 registrations. Sullivan's office is located at 207 Pitkin Street, East Hartford, Conn. Mark Rychel Rychel, founding partner of BCR Financial Services and registered representative of LFS, has been in the financial services industry for 20 years. Prior to founding BCR Financial Services in 1997, Rychel served as an advisor for American Express Financial Advisors in Pittsburgh, Pa. Early in his career, he worked on institutional accounts for Merrill Lynch International in London. 1 of 2", "external_links": [], "published": "2015-08-11T18:19:00.000+03:00", "crawled": "2015-08-11T18:35:10.715+03:00", "highlightTitle": ""}