{"organizations": ["MIT Sloan School of Management", "Hotwire", "Metromile", "Catholic University of America", "Facebook", "Global Analytics Team"], "uuid": "bc8e59847933d95599b5492e937531567f5f0599", "thread": {"social": {"gplus": {"shares": 0}, "pinterest": {"shares": 0}, "vk": {"shares": 0}, "linkedin": {"shares": 0}, "facebook": {"likes": 0, "shares": 0, "comments": 0}, "stumbledupon": {"shares": 0}}, "site_full": "www.thestreet.com", "main_image": "http://s.thestreet.com/files/tsc/v2008/photos/all-pics/press_releases_3_lead.jpg", "site_section": "http://www.thestreet.com/feeds/rss/search.html?topicSearch=Travel&puc=relatedtopic", "section_title": "TheStreet Search RSS Feed: Travel", "url": "http://www.thestreet.com/story/13241646/1/pedal-your-way-around-the-city-with-bike-sharing-programs.html?cm_ven=RSSFeed", "country": "US", "title": "Metromile Names Joe Selsavage As Chief Financial Officer", "performance_score": 0, "site": "thestreet.com", "participants_count": 0, "title_full": "Metromile Names Joe Selsavage As Chief Financial Officer", "spam_score": 0.0, "site_type": "news", "published": "2015-08-03T20:36:00.000+03:00", "replies_count": 0, "uuid": "bc8e59847933d95599b5492e937531567f5f0599"}, "author": "", "url": "http://www.thestreet.com/story/13241646/1/pedal-your-way-around-the-city-with-bike-sharing-programs.html?cm_ven=RSSFeed", "ord_in_thread": 0, "title": "Metromile Names Joe Selsavage As Chief Financial Officer", "locations": ["United States", "SAN FRANCISCO", "Washington", "Metromile", "D.C."], "entities": {"persons": [], "locations": [], "organizations": []}, "highlightText": "", "language": "english", "persons": ["Dan", "Metromile", "Dan Preston", "Joe Selsavage", "Joe"], "text": "Metromile Names Joe Selsavage As Chief Financial Officer By PR Newswire | 08/03/15 - 01:36 PM EDT Reprint SAN FRANCISCO , Aug. 3, 2015 /PRNewswire/ -- Today, Metromile , a pioneer in pay-per-mile car insurance in the United States , announced that Joe Selsavage has joined the company as Chief Financial Officer, effective today, Aug. 3 . Joe was most recently CFO for Hotwire, a leading discount travel site, where he led Hotwire's global finance and accounting. He brings more than 25 years of broad-range experience to Metromile and will oversee finance and accounting for the company. Joe will report to Metromile CEO Dan Preston . \"Joe's proven track record as a CFO, taking a company from launch to a well-known global company and his extensive experience in finance and accounting made him the perfect candidate to step into this important role on our management team,\" said Dan Preston , CEO of Metromile. \"We're excited to have Joe on board and we are confident that he will be a key player in taking Metromile to the next level.\"Joe joined Hotwire right after its launch in 2001 and was instrumental in the design and implementation of almost every component of Hotwire's financial infrastructure. In addition to his Finance responsibilities, Joe was also responsible for overseeing various other functions at different times including Hotwire's Global Analytics Team, Global Hotel Supply Team and the Global Car Rental Team. \"I'm excited to step into this role and look forward to working with Dan and the entire Metromile team at such a pivotal time in the company's growth,\" said Joe Selsavage , CFO of Metromile. \"Metromile presents a unique opportunity to work at a company revolutionizing an industry that has been unchanged for many years and is rapidly scaling with some of the best talent in the business.\"Before Hotwire, Joe spent more than 10 years in accounting and management functions for various organizations in the Washington, D.C. area. He received a MBA from the MIT Sloan School of Management and a BA in Economics and Finance and an MA in Accounting from the Catholic University of America . For more information about Metromile, visit metromile.com or follow Metromile on Facebook , Twitter , and LinkedIn . About Metromile", "external_links": [], "published": "2015-08-03T20:36:00.000+03:00", "crawled": "2015-08-03T21:13:16.091+03:00", "highlightTitle": ""}