{"organizations": ["Scripps Networks Interactive", "UKTV", "Food Network", "TVN", "HGTV", "Asian Food Channel", "BBC Worldwide", "Scripps Networks Interactive Inc.", "Bank of America Merrill Lynch Media, Communication & Entertainment Conference", "NYSE", "Scripps Networks Interactive To Participate At Bank Of America Merrill Lynch Conference Scripps Networks Interactive To Participate At Bank Of America Merrill Lynch Conference By Business Wire", "Cooking Channel, Travel Channel and Great American Country"], "uuid": "f0e646612ba50833d67a86e5c30823e238ee3742", "thread": {"social": {"gplus": {"shares": 0}, "pinterest": {"shares": 0}, "vk": {"shares": 0}, "linkedin": {"shares": 0}, "facebook": {"likes": 0, "shares": 0, "comments": 0}, "stumbledupon": {"shares": 0}}, "site_full": "www.thestreet.com", "main_image": "http://s.thestreet.com/files/tsc/v2008/photos/all-pics/press_releases_1_lead.jpg", "site_section": "http://www.thestreet.com/feeds/rss/search.html?topicSearch=Travel&puc=relatedtopic", "section_title": "TheStreet Search RSS Feed: Travel", "url": "http://www.thestreet.com/story/13265341/1/scripps-networks-interactive-to-participate-at-bank-of-america-merrill-lynch-conference.html?cm_ven=RSSFeed", "country": "US", "title": "Scripps Networks Interactive To Participate At Bank Of America Merrill Lynch Conference", "performance_score": 0, "site": "thestreet.com", "participants_count": 0, "title_full": "Scripps Networks Interactive To Participate At Bank Of America Merrill Lynch Conference", "spam_score": 0.0, "site_type": "news", "published": "2015-08-25T14:22:00.000+03:00", "replies_count": 0, "uuid": "f0e646612ba50833d67a86e5c30823e238ee3742"}, "author": "", "url": "http://www.thestreet.com/story/13265341/1/scripps-networks-interactive-to-participate-at-bank-of-america-merrill-lynch-conference.html?cm_ven=RSSFeed", "ord_in_thread": 0, "title": "Scripps Networks Interactive To Participate At Bank Of America Merrill Lynch Conference", "locations": ["South America", "U.S.", "Poland", "Knoxville", "Africa", "Tenn", "Europe", "Beverly Hills", "Calif", "North", "Asia", "Middle East"], "entities": {"persons": [], "locations": [], "organizations": []}, "highlightText": "", "language": "english", "persons": ["Burton Jablin", "Lori Hickok"], "text": "Scripps Networks Interactive To Participate At Bank Of America Merrill Lynch Conference By Business Wire | 08/25/15 - 07:22 AM EDT Reprint Burton Jablin, Chief Operating Officer; and Lori Hickok, Chief Financial Officer, Scripps Networks Interactive Inc. (NYSE: SNI) will discuss the company's business strategies at the Bank of America Merrill Lynch Media, Communication & Entertainment Conference on Wednesday, Sept. 9, in Beverly Hills, Calif. The presentation will be webcast live at 11:15 a.m. PT / 2:35 p.m. ET. The webcast can be accessed at the investor relations page on the company's website. A replay of the webcast will be available on the company's investor relations webpage one hour after the conclusion of the live event and will remain available for 120 days. About Scripps Networks Interactive Scripps Networks Interactive (NYSE: SNI) is one of the leading developers of engaging lifestyle content in the home, food and travel categories for television, the Internet and emerging platforms. The company's lifestyle media portfolio comprises popular television and Internet brands HGTV, DIY Network, Food Network, Cooking Channel, Travel Channel and Great American Country, which collectively engage more than 190 million U.S. consumers each month. International operations include TVN , Poland's premier multi-platform media company; UKTV , an independent commercial joint venture with BBC Worldwide; Asian Food Channel , the first pan-regional TV food network in Asia; and lifestyle channel Fine Living . The company's global networks and websites reach millions of consumers across North and South America, Asia, Europe, the Middle East and Africa. Scripps Networks Interactive is headquartered in Knoxville, Tenn. For more information, please visit http://www.scrippsnetworksinteractive.com . View source version on businesswire.com: http://www.businesswire.com/news/home/20150825005104/en/ Copyright Business Wire 2010", "external_links": [], "published": "2015-08-25T14:22:00.000+03:00", "crawled": "2015-08-25T14:53:38.504+03:00", "highlightTitle": ""}