{"organizations": ["Board of Directors", "Williams Island", "University of Witwatersrand", "Acqualina Residences", "Inc.", "Inc", "Acqualina Spa", "OMAG", "ESPA"], "uuid": "97c20da5cfb457ee70eccd7fbf1904a597b05c6e", "thread": {"social": {"gplus": {"shares": 0}, "pinterest": {"shares": 0}, "vk": {"shares": 0}, "linkedin": {"shares": 0}, "facebook": {"likes": 0, "shares": 0, "comments": 0}, "stumbledupon": {"shares": 0}}, "site_full": "www.thestreet.com", "main_image": "http://s.thestreet.com/files/tsc/v2008/photos/all-pics/press_releases_5_lead.jpg", "site_section": "http://www.thestreet.com/feeds/rss/search.html?topicSearch=Travel&puc=relatedtopic", "section_title": "TheStreet Search RSS Feed: Travel", "url": "http://www.thestreet.com/story/13270400/1/omagine-inc-appoints-alan-m-matus-as-director.html?cm_ven=RSSFeed", "country": "US", "title": "Omagine, Inc. Appoints Alan M. Matus As Director", "performance_score": 0, "site": "thestreet.com", "participants_count": 0, "title_full": "Omagine, Inc. Appoints Alan M. Matus As Director", "spam_score": 0.0, "site_type": "news", "published": "2015-08-28T21:00:00.000+03:00", "replies_count": 0, "uuid": "97c20da5cfb457ee70eccd7fbf1904a597b05c6e"}, "author": "", "url": "http://www.thestreet.com/story/13270400/1/omagine-inc-appoints-alan-m-matus-as-director.html?cm_ven=RSSFeed", "ord_in_thread": 0, "title": "Omagine, Inc. Appoints Alan M. Matus As Director", "locations": ["Florida Riviera", "Miami", "Williams Island", "U.S", "NEW YORK", "South Africa", "Florida", "Johannesburg", "Omagine"], "entities": {"persons": [], "locations": [], "organizations": []}, "highlightText": "", "language": "english", "persons": ["Frank J. Drohan", "Alan", "Alan M. Matus", "Andrew Harper", "Omagine", "Matus"], "text": "Omagine, Inc. Appoints Alan M. Matus As Director By GlobeNewswire | 08/28/15 - 02:00 PM EDT Reprint NEW YORK, Aug. 28, 2015 (GLOBE NEWSWIRE) -- Omagine, Inc. (OTCQB:OMAG) today announced that Alan M. Matus has been appointed as an independent Director of Omagine, Inc. (\"Omagine\" or the \"Company\") effective September 1, 2015. With Mr. Matus' appointment, the majority of the Company's Board of Directors now consists of non-executive independent outside directors. Mr. Matus has five decades of residential, hospitality and commercial real estate development experience. He is a seasoned real estate industry executive and owner who has personally directed the development, planning, architectural design, financing, construction and marketing of many public and private developments both internationally and in the U.S. Mr. Matus graduated as a Chartered Accountant (a CPA equivalency) from the University of Witwatersrand, Johannesburg, South Africa. Mr. Matus is an owner and operator of Acqualina Residences and Resort , a beachfront luxury resort just north of Miami, Florida which he developed and opened in 2006 ( www.Acqualinaresort.com ). Its Mediterranean villa d√©cor offering ocean and Intracoastal views was designed with a distinct European feel. The resort, including the 20,000 square foot Acqualina Spa by global spa leaders ESPA, is a recipient of the coveted Forbes Travel Guide Five Star Award, the AAA Five Diamond Award and the Andrew Harper's Reader's Choice Award for Top 20 Beach and Family Resorts worldwide. In 2015 Acqualina Mansions , comprising 79 ultra-luxurious residences, was added to the resort and an additional 265 residences are currently being planned for the future. Mr. Matus joined Williams Island as its President and Chief Executive Officer in the 1980's to conceive, develop, build and manage this two billion dollar landmark residential and resort community on the Intracoastal Waterway in Aventura, Florida ( http://www.williamsislandclub.com ). This renowned 80-acre community has been heralded worldwide as a \"world unto itself\". It is also known as the \"Florida Riviera\". Mr. Matus currently resides in Williams Island and is active in professional industry organizations. Omagine's president, Frank J. Drohan, remarked: \"Alan brings a highly diverse skill set to the Board and to our business with his development, ownership and operational expertise, finance experience and other relevant real estate development skills. He has international experience, great taste and a terrific design sense. Alan's focus on customer amenities and experiences and his distinguished professional accomplishments in the real estate development business will greatly benefit our Company, its shareholders and our vision for the Omagine Project. I am greatly pleased that we were successful in recruiting someone of Alan's stature and proven ability to our Board and we look forward to his contributions to our continued success.\" 1 of 2", "external_links": [], "published": "2015-08-28T21:00:00.000+03:00", "crawled": "2015-08-28T21:45:20.944+03:00", "highlightTitle": ""}