{"organizations": ["Choose Chicago", "Chicago Athletic Hotel", "Gene Siskel Film Center", "Lane Alexander", "Pritzker Military Library", "Columbia College", "Chicago Cultural Mile", "Fine Arts Building Studios", "Metro Club", "Chicago Youth Symphony Orchestras", "Skydeck Chicago", "Metropolitan Towers", "Chicago Trolley", "Art Institute of Chicago , Seven Lions", "Hilton Chicago", "Chicago Department of Cultural Affairs", "Schaffner Communications", "American Rhythm Center", "William Harris Lee & Co.", "Trump International Hotel", "Chicago Public Library", "Ossia Musical Forum", "Columbia College Chicago", "Museum of Contemporary Photography", "Department of Cultural Affairs", "National Museum of Mexican Art", "Blue Plate Catering", "National Louis University", "Business Development Center", "The Art Institute of Chicago", "Coalition Energy", "The Chicago Cultural Mile Association", "Chicago Youth Poetry Festival", "Hard Rock Hotel Chicago", "Hilton Garden Inn Chicago", "Chicago Architecture Foundation", "Chicago Symphony Orchestra", "Roosevelt University", "Tower Chicago", "Chicago Human Rhythm Project", "Chicago Cultural Mile Association", "Young Chicago Authors", "Art Institute of Chicago"], "uuid": "d6ee0578ca0ed29c913e1c13a7e161855738bce2", "thread": {"social": {"gplus": {"shares": 0}, "pinterest": {"shares": 0}, "vk": {"shares": 0}, "linkedin": {"shares": 0}, "facebook": {"likes": 0, "shares": 0, "comments": 0}, "stumbledupon": {"shares": 0}}, "site_full": "www.thestreet.com", "main_image": "http://s.thestreet.com/files/tsc/v2008/photos/all-pics/misc/m-z/newspapers-front-lead3.jpg", "site_section": "http://www.thestreet.com/feeds/rss/search.html?topicSearch=Travel&puc=relatedtopic", "section_title": "TheStreet Search RSS Feed: Travel", "url": "http://www.thestreet.com/story/13242985/1/organizers-announce-plans-for-halloween-celebration-unlike-chicago-has-ever-experienced.html?cm_ven=RSSFeed", "country": "US", "title": "Organizers Announce Plans For Halloween Celebration Unlike Chicago Has Ever Experienced", "performance_score": 0, "site": "thestreet.com", "participants_count": 0, "title_full": "Organizers Announce Plans For Halloween Celebration Unlike Chicago Has Ever Experienced", "spam_score": 0.0, "site_type": "news", "published": "2015-08-04T17:00:00.000+03:00", "replies_count": 0, "uuid": "d6ee0578ca0ed29c913e1c13a7e161855738bce2"}, "author": "", "url": "http://www.thestreet.com/story/13242985/1/organizers-announce-plans-for-halloween-celebration-unlike-chicago-has-ever-experienced.html?cm_ven=RSSFeed", "ord_in_thread": 0, "title": "Organizers Announce Plans For Halloween Celebration Unlike Chicago Has Ever Experienced", "locations": ["Balbo", "Columbus Drive", "Maggie Daley Park", "Chicago", "CHICAGO", "Chicago Park District"], "entities": {"persons": [], "locations": [], "organizations": []}, "highlightText": "", "language": "english", "persons": ["David", "Kevin Coval", "John Pastuovic", "Dawoud Bey", "Chuck", "David Thurm", "Anna Shapiro", "Mwata Bowden", "Tesori", "Mark Kelly", "Kelly", "J.R. Davis", "Lupe Fiasco", "Steve James", "Sharene Shariatzadeh", "Carlos Tortolero", "Terri Hemmert", "Double Decker", "Joe Shanahan", "JR Davis", "Monroe", "Michelle Boone"], "text": "Organizers Announce Plans For Halloween Celebration Unlike Chicago Has Ever Experienced By PR Newswire | 08/04/15 - 10:00 AM EDT Reprint CHICAGO , Aug. 4, 2015 /PRNewswire/ -- The Chicago Cultural Mile Association today announced its plan to sponsor a first-of its-kind Halloween spectacle on the Chicago Cultural Mile. The Halloween Gathering, scheduled for Saturday, October 24, 2015 , will gather Chicago's vast and diverse creative communities for an all-day festival, culminating with a festive nighttime parade to which the City of Chicago and neighboring communities are invited. Drawing together world-renowned institutions, such as the Field Museum, The Art Institute of Chicago , the Chicago Symphony Orchestra, Columbia College Chicago and the Association for the Advancement of Creative Musicians, as well as unique local organizations such as Louder Than a Bomb, the Silent Theatre Company and guilds of artists in assorted fields, this dramatic display will activate Halloween as the \"artist's holiday\" along one of the most prestigious cultural avenues in the world. The Halloween Gathering was announced at a news conference at The Art Institute of Chicago and featured JR Davis, Chairman and President, and Sharene Shariatzadeh , Executive Director of the Chicago Cultural Mile Association, Mark Kelly , Halloween Gathering Artistic Director and VP of Student Success at Columbia College Chicago , Michelle Boone , Commissioner of the City of Chicago Department of Cultural Affairs and Special Events, David Thurm , COO of The Art Institute of Chicago and Mwata Bowden, Artistic Director of the Association for the Advancement of Creative Musicians' Great Black Music Ensemble. \"We are calling on all members of the cultural community to participate in what we believe will become an iconic annual event,\" according to J.R. Davis . \"It is our hope that he Halloween Gathering will celebrate the power and scope of Chicago's artistic community and ignite the imagination of an audience of all ages.\" The Halloween Gathering event will officially begin at 2:00pm with The Halloween Gathering Festival . \"Parks and institutions along the Chicago Cultural Mile will be alive with family-friendly activities including mask-making workshops, free dance and theatre performances, pop-up installations, interactive experiences and more,\" explained Sharene Shariatzadeh . \"Festival attractions will include a children's costume parade around the ribbon at Maggie Daley Park; children's workshops in Millennium Park and a Zombie Thriller Dance Performance on the Summer Stage, which attendees will be encouraged to join.\"Additionally, street performances and art displays will pop up during the afternoon at points along the Chicago Cultural Mile, The event will culminate at The Halloween Gathering Procession, beginning at 6:00pm on Columbus Drive and travelling north from Balbo to Monroe. The Procession will delight the crowd with spectacle, illumination, music and performance, and will be led by the Halloween Gathering Creative Spirit Fellows. \"These Creative Spirit Fellows are being honored for their contributions to Chicago's artistic landscape,\" Kelly said. \" Chicago is a city with unparalleled depth of artistic communities and endeavors. This event seeks to harness their energy and celebrate the contributions they make to Chicago and to the world. This will be a parade like no other,\" says Kelly. \"Imagine dramatic lighting framing the street, hundreds of lanterns in the procession, masks, costumes, moving performances, sonic delights, and creative contingents ablaze with emotion, attitude, whimsy, and spectacle.\"A partial list of Chicago Cultural Mile Association Creative Spirt Fellows includes: film maker and documentarian Steve James ; artist, writer and teacher Dawoud Bey ; poet and founder of Louder Than A Bomb: The Chicago Youth Poetry Festival and Artistic Director of Young Chicago Authors, Kevin Coval ; theatre director Anna Shapiro ; musician Lupe Fiasco; Metro Club owner Joe Shanahan ; founder and president of the National Museum of Mexican Art, Carlos Tortolero ; co-founder and director of the Chicago Human Rhythm Project, Lane Alexander ; and radio personality Terri Hemmert . Chicago Cultural Mile Association partner organizations include: Adler Planetarium, American Rhythm Center, Art Institute of Chicago , Auditorium Theatre of Roosevelt University , Blue Plate Catering, Chicago Architecture Foundation, Chicago Athletic Hotel, Chicago Human Rhythm Project, Chicago Park District, Chicago Public Library, Chicago Trolley and Double Decker, Chicago Symphony Orchestra, Chicago Youth Symphony Orchestras, Choose Chicago, Chuck's Manufacturing, City of Chicago , Department of Cultural Affairs and Special Events, The Cliff Dwellers, Coalition Energy, Columbia College Chicago , Comfort Suites, David's Tea, The Field Museum, the Fine Arts Building Studios, Gene Siskel Film Center at the School of the Art Institute of Chicago , Hard Rock Hotel Chicago, Harris Theater at Millennium Park, Hilton Chicago, Hilton Garden Inn Chicago, Hostelling International, Italian Village Restaurants, Mercat a la Planxa, Metropolitan Towers, Millennium Garages, Millennium Park, Modern Classics, Museum of Contemporary Photography at Columbia College , National Louis University , Ossia Musical Forum, Pritzker Military Library, Park Grill Millennium Park, Renaissance Blackstone Hotel, The Residence at 330, Roosevelt University , Schaffner Communications, School of the Art Institute of Chicago , Seven Lions, Skydeck Chicago, SouthLoop Living,Tesori, Trump International Hotel and Tower Chicago, William Harris Lee & Co., Women's Business Development Center, World Chicago. Contact: John Pastuovic 312-925-9092", "external_links": [], "published": "2015-08-04T17:00:00.000+03:00", "crawled": "2015-08-04T17:05:40.985+03:00", "highlightTitle": ""}