{"organizations": ["Staples Canada Inc", "Staples Canada", "Almont"], "uuid": "31c8471e4176cca047ffc734c8fe747e128d80c2", "thread": {"social": {"gplus": {"shares": 0}, "pinterest": {"shares": 0}, "vk": {"shares": 0}, "linkedin": {"shares": 0}, "facebook": {"likes": 0, "shares": 0, "comments": 0}, "stumbledupon": {"shares": 0}}, "site_full": "www.thestreet.com", "main_image": "http://s.thestreet.com/files/tsc/v2008/photos/all-pics/press_releases_2_lead.jpg", "site_section": "http://www.thestreet.com/feeds/rss/search.html?topicSearch=Travel&puc=relatedtopic", "section_title": "TheStreet Search RSS Feed: Travel", "url": "http://www.thestreet.com/story/13255437/1/five-teachers-help-build-a-school-in-ecuador-with-support-from-staples-canada-and-free-the-children.html?cm_ven=RSSFeed", "country": "US", "title": "Five Teachers Help Build A School In Ecuador With Support From Staples Canada And Free The Children", "performance_score": 0, "site": "thestreet.com", "participants_count": 0, "title_full": "Five Teachers Help Build A School In Ecuador With Support From Staples Canada And Free The Children", "spam_score": 0.0, "site_type": "news", "published": "2015-08-13T21:19:00.000+03:00", "replies_count": 0, "uuid": "31c8471e4176cca047ffc734c8fe747e128d80c2"}, "author": "", "url": "http://www.thestreet.com/story/13255437/1/five-teachers-help-build-a-school-in-ecuador-with-support-from-staples-canada-and-free-the-children.html?cm_ven=RSSFeed", "ord_in_thread": 0, "title": "Five Teachers Help Build A School In Ecuador With Support From Staples Canada And Free The Children", "locations": ["United States", "Ecuador", "Staples Canada", "Quebec", "TORONTO", "Europe", "Boston", "Toronto", "Sault", "South America", "Canada", "Staples", "Australia", "Ottawa", "Asia", "North", "New Zealand"], "entities": {"persons": [], "locations": [], "organizations": []}, "highlightText": "", "language": "english", "persons": ["Marg Graff", "Pete Gibel", "Saint Lambert", "Anne-Marie Robinson-Sisk", "Marie", "Anick Champagne-Hickey", "Michel Bouthot"], "text": "Five Teachers Help Build A School In Ecuador With Support From Staples Canada And Free The Children By PR Newswire | 08/13/15 - 02:19 PM EDT Reprint Teacher Appreciation Contest winners make education more accessible with Staples -funded school building project TORONTO , Aug. 13, 2015 /CNW/ - Five winners in the Staples Me to We Teacher Appreciation Contest traveled to Ecuador to take part in a Staples -funded school building project. Staples Canada announced its $10,000 donation to Free The Children to help fund the school in April. \"Every day, teachers make a significant difference in students' lives, helping them learn and grow,\" said Pete Gibel, senior vice president of merchandising at Staples Canada . \"We're celebrating teachers and are honoured to help them make an even greater impact on education through our Teacher Appreciation initiative.\"The Staples Me to We Teacher Appreciation Contest sought to celebrate teachers who created positive social change in their school or community. The winners were announced in April. They are: Anick Champagne-Hickey , Sault Ste. Marie, ON Marg Graff , Almont, ON Michel Bouthot , Saint Lambert, QC Anne-Marie Robinson-Sisk , Ottawa, ON Winners departed for a nine-day Me to We Volunteer Trip to Ecuador on August 1 . Working alongside local community members, the teachers participated in a school building project for the community of Mondana. They also had the chance to connect with community members, sit with a group of skilled female artisans to learn how they generate income through traditional jewellery making, and go on an excursion through the Amazon rainforest. The teachers will share stories of their experience through personal blog posts on blog.staples.ca . Teacher Appreciation Days As part of Staples' ongoing efforts to acknowledge the importance of educators in the lives of Canadian students, Teachers can save even more on their back-to- school needs. Staples has 3 dedicated Teacher Appreciation Days ( August 27 , September 3 and 12) where teachers can save 15% off most in-store purchases, 10% off in-store electronics, plus they can save 10% on any other day between August 24- September 13 (dates differ in Quebec ). About Staples Staples makes it easy to make more happen with more products and more ways to shop. Through its world-class retail, online and delivery capabilities, Staples lets customers shop however and whenever they want, whether it's in-store, online or on mobile devices. Staples offers more products than ever, such as technology, facilities and breakroom supplies, furniture, safety supplies, medical supplies, and Copy & Print services. Headquartered outside of Boston in the United States with offices in Toronto, Canada , Staples operates throughout North and South America , Europe , Asia , Australia and New Zealand. More information about Staples (Nasdaq: SPLS) is available at www.staples.com and www.staples.ca . SOURCE Staples Canada Inc. Copyright 2011 PR Newswire. All rights reserved. This material may not be published, broadcast, rewritten or redistributed. Check Out Our Best Services for Investors \nPortfolio Manager Jim Cramer and Director of Research Jack Mohr reveal their investment tactics while giving advanced notice before every trade. Product Features:", "external_links": [], "published": "2015-08-13T21:19:00.000+03:00", "crawled": "2015-08-13T22:06:58.578+03:00", "highlightTitle": ""}