{"organizations": ["Goldman Sachs", "BNY Mellon", "PR Newswire", "Rocketrip Names Jake Farmakis Director Of Customer Success Rocketrip Names Jake Farmakis", "Canaan Partners", "DevCon", "Dreyfus", "TripSavvy", "Boston College"], "uuid": "4ad7c62cebb0409ae3e3f4a1627e4f64c66a7854", "thread": {"social": {"gplus": {"shares": 0}, "pinterest": {"shares": 0}, "vk": {"shares": 0}, "linkedin": {"shares": 0}, "facebook": {"likes": 0, "shares": 0, "comments": 0}, "stumbledupon": {"shares": 0}}, "site_full": "www.thestreet.com", "main_image": "http://s.thestreet.com/files/tsc/v2008/photos/all-pics/press_releases_3_lead.jpg", "site_section": "http://www.thestreet.com/feeds/rss/search.html?topicSearch=Travel&puc=relatedtopic", "section_title": "TheStreet Search RSS Feed: Travel", "url": "http://www.thestreet.com/story/13241081/1/rocketrip-names-jake-farmakis-director-of-customer-success.html?cm_ven=RSSFeed", "country": "US", "title": "Rocketrip Names Jake Farmakis Director Of Customer Success", "performance_score": 0, "site": "thestreet.com", "participants_count": 0, "title_full": "Rocketrip Names Jake Farmakis Director Of Customer Success", "spam_score": 0.0, "site_type": "news", "published": "2015-08-03T16:02:00.000+03:00", "replies_count": 0, "uuid": "4ad7c62cebb0409ae3e3f4a1627e4f64c66a7854"}, "author": "", "url": "http://www.thestreet.com/story/13241081/1/rocketrip-names-jake-farmakis-director-of-customer-success.html?cm_ven=RSSFeed", "ord_in_thread": 0, "title": "Rocketrip Names Jake Farmakis Director Of Customer Success", "locations": ["Genacast Ventures", "New York City", "New York", "Rocketrip", "NEW YORK"], "entities": {"persons": [], "locations": [], "organizations": []}, "highlightText": "", "language": "english", "persons": ["Jake", "Paradine", "Rocketrip", "Jake Farmakis Director", "Emily Hurd", "Farmakis"], "text": "Rocketrip Names Jake Farmakis Director Of Customer Success By PR Newswire | 08/03/15 - 09:02 AM EDT Reprint NEW YORK , August 3, 2015 /PRNewswire/ -- Rocketrip , a platform that rewards employees for saving money on business travel, today named Jake Farmakis Director of Customer Success. A former financial consultant and the founder of TripSavvy, Farmakis joins Rocketrip with a wealth of industry experience and dedication to improving the corporate travel experience. Prior to joining Rocketrip, Farmakis was the CEO and founder of TripSavvy, a private social network for business travelers where employees rate, review, and share tips about travel experiences. Originally called Paradine, his company was named the \"Best Travel App for Business Travelers\" at Concur's The Perfect Trip DevCon in the fall of 2014. TripSavvy established partnerships with some of world's leading travel platforms. Farmakis became passionate about improving business travel during his five years as a road warrior in financial services. Before launching TripSavvy, he served as a financial consultant at Dreyfus, a BNY Mellon company, addressing client investment needs using their suite of mutual fund and separately managed account products. Farmakis began his career in Equity Sales at Goldman Sachs. He graduated cum laude from Boston College with a B.S. in finance and marketing. \"Jake is a perfect fit for Rocketrip. His commitment to improving business travel, his expertise in travel management, and his experience managing customer relationships will be valuable to our team,\" said Emily Hurd , VP of Business Development and Marketing. \"Jake will help our customers reap the benefits of rewarding cost-conscious travel.\"\"People increasingly book business travel the way they book personal travel, and Rocketrip is perfectly situated to take advantage of this shift,\" said Farmakis. \"By fostering a culture of choice and rewarding employees who act in the company's best interest, Rocketrip has the power to transform the travel culture of an entire organization. I'm excited to guide companies through that change, and I'm honored to join Rocketrip's amazing team in New York .\" About Rocketrip Rocketrip ( http://www.rocketrip.com ) is the first commercially available travel management platform that rewards employees for saving money on business travel. Rocketrip's algorithms integrate a company's travel policy with real-time trip pricing and availability to create a personalized Budget to Beat for each trip. Employees book using their favorite travel websites or a travel management company, and they receive a percentage of the savings when they book under budget. Rocketrip also provides employers with insights and analytics on company spending, savings and employee travel behavior, giving them the ability to optimize their travel policy and rewards program. Rocketrip is based in New York City and has received funding from Canaan Partners, Genacast Ventures, Crunchfund, Y Combinator and angel investors.", "external_links": [], "published": "2015-08-03T16:02:00.000+03:00", "crawled": "2015-08-03T16:18:17.084+03:00", "highlightTitle": ""}