{"organizations": ["Venus Beach Cafe", "Devon Smugglers", "Torquay", "Torre Abbey", "Avon Dam Reservoir"], "uuid": "66143022dc97cd441ed34fd2af45214cae27d5e0", "thread": {"social": {"gplus": {"shares": 0}, "pinterest": {"shares": 0}, "vk": {"shares": 0}, "linkedin": {"shares": 0}, "facebook": {"likes": 0, "shares": 0, "comments": 0}, "stumbledupon": {"shares": 0}}, "site_full": "www.express.co.uk", "main_image": "http://cdn.images.express.co.uk/img/dynamic/133/590x/Adventure-596557.jpg", "site_section": "http://www.express.co.uk/posts/rss/132/travel", "section_title": "Daily Express :: Travel Feed", "url": "http://www.express.co.uk/travel/activity/596557/Coves-waterfalls-Devon", "country": "IE", "title": "Smugglers coves and stunning waterfalls - 10 things to do in delightful Devon", "performance_score": 0, "site": "express.co.uk", "participants_count": 0, "title_full": "Smugglers coves and stunning waterfalls - 10 things to do in delightful Devon", "spam_score": 0.0, "site_type": "news", "published": "2015-08-06T02:00:00.000+03:00", "replies_count": 0, "uuid": "66143022dc97cd441ed34fd2af45214cae27d5e0"}, "author": "", "url": "http://www.express.co.uk/travel/activity/596557/Coves-waterfalls-Devon", "ord_in_thread": 0, "title": "Smugglers coves and stunning waterfalls - 10 things to do in delightful Devon", "locations": ["Bantham Beach", "Kingsbridge", "Blackpool Sands", "Salcome", "England", "Teign Valley", "River Avon", "Babbacombe", "Shipley Bridge", "Devon", "Canonteign Falls", "Salcombe", "South West", "Start Bay", "Lydford Gorge", "Tavistock"], "entities": {"persons": [], "locations": [], "organizations": []}, "highlightText": "", "language": "english", "persons": ["Anstey", "Tarka", "Devon"], "text": "Smugglers coves and stunning waterfalls - 10 things to do in delightful Devon Smugglers coves and stunning waterfalls - 10 things to do in delightful Devon DISCOVER a smugglers cove, spectacular waterfalls and stunning beaches. PUBLISHED: 00:00, Thu, Aug 6, 2015 | UPDATED: 16:29, Thu, Aug 6, 2015 GETTY 1. Explore Hope Cove - once a favourite haunt for smugglers. Now, it's a charming holiday destination five miles west of Salcome with two beaches. The Hope Cove pub there has also recently been renovated, so a great place to pop in for a pint. www.visitdevon.co.uk 2. Try surfing at Bantham Beach. It's a one of Devon's premier beaches, loved by families, plus the good news is, it's within driving distance of Salcombe and Kingsbridge. www.banthamdevon.co.uk 3. Be surprised by the Avon Dam Reservoir, near South Brent. It's a great little place just off the main A38 south Devon expressway and the perfect place for a relaxing walk. If you park in Shipley Bridge car park, you can take the valley walk which follows the River Avon up to the shores of the reservoir. 4. Travel back in time to the 1920's to see Coleton Fishacre, Kingswear, Devon. The National Trust-owned house and garden property was created in the time of the jazz age in the Arts and Crafts style. www.nationaltrust.org.uk/coleton-fishacre 5. Be amazed by England's highest manmade waterfalls, Canonteign Falls, in south Devon. The 70 metre high waterfall in the Teign Valley is a magnificent example of a Victorian folly. www.canonteignfalls.co.uk GETTY White Lady falls at Lydford Gorge 6. Marvel at the spectacular 30metre waterfall at Lydford Gorge, near Tavistock. It's the deepest gorge in the South West and a great place to walk round at any time of year. nationaltrust.org.uk/lydford-gorge/ 7. Bask in a sheltered bay at Blackpool Sands, in south Devon. It's an amazing and award-winning 'Blue Flag' family beach with turquoise blue sea. There are kayaks for hire, a lifeguard on hand and the Venus Beach Cafe sells wonderful, organic food. www.blackpoolsands.co.uk 8. Be intrigued by Torre Abbey, Torquay which, in September becomes the hub of the annual Agatha Christie Festival. There's even a free, 'Agatha Christie trail map' which takes you on a tour of famous mysterious locations from her books. One nice walk is to Anstey's Cove, a peaceful, shingle beach on the coast path between Torquay and Babbacombe. www.englishriviera.co.uk/agathachristie/literary-trail 9. Enjoy the stunning views from Start Bay in Devon. It's a 15 mile stretch of spectacular coast with wonderful views and golden shingle beaches. 10. Take to The Tarka Trail, in Devon. This series of 30 miles worth of footpaths and cycle paths follows the route taken by Tarka the Otter in the well-known book. www.devon.gov.uk/tarkatrail Related articles", "external_links": [], "published": "2015-08-06T02:00:00.000+03:00", "crawled": "2015-08-07T07:43:43.491+03:00", "highlightTitle": ""}