{"organizations": ["Helsinki City Marathon", "Motherwell", "Hong Kong Lehmann Maupin Hong Kong", "Leipzig School", "New York School"], "uuid": "6a0248199d2b8503450df3ab6a8af6aece9f35fb", "thread": {"social": {"gplus": {"shares": 0}, "pinterest": {"shares": 0}, "vk": {"shares": 0}, "linkedin": {"shares": 0}, "facebook": {"likes": 0, "shares": 0, "comments": 0}, "stumbledupon": {"shares": 0}}, "site_full": "www.nationmultimedia.com", "main_image": "http://www.nationmultimedia.com/new/2015/08/14/travel/images/30266414-01_big.jpg", "site_section": "http://www.nationmultimedia.com/home/rss/travel.rss", "section_title": "NationMultimedia.com - Travel", "url": "http://www.nationmultimedia.com/travel/Solo-exhibition-by-Matthias-Weischer-30266414.html", "country": "TH", "title": "Solo exhibition by Matthias Weischer", "performance_score": 0, "site": "nationmultimedia.com", "participants_count": 0, "title_full": "Solo exhibition by Matthias Weischer", "spam_score": 0.0, "site_type": "news", "published": "2015-08-13T21:00:00.000+03:00", "replies_count": 0, "uuid": "6a0248199d2b8503450df3ab6a8af6aece9f35fb"}, "author": "", "url": "http://www.nationmultimedia.com/travel/Solo-exhibition-by-Matthias-Weischer-30266414.html", "ord_in_thread": 0, "title": "Solo exhibition by Matthias Weischer", "locations": ["Argentina Buenos Aires", "Philippines", "Hong Kong", "Esplanade KLCC Park", "Malaysia Malaysia", "Thailand", "Indonesia", "MALAYSIA", "Buenos Aires", "Kuala Lumpur", "Italy", "Malaysia", "Australia", "Llanwrtyd Wells", "Asia", "China", "United Kingdom Held", "Britain", "Hong Kong Pearl", "Finland", "HELSINKI", "Wales", "Helsinki", "America", "Helsinki City Marathon", "Brazil", "Japan", "New Zealand", "South Korea"], "entities": {"persons": [], "locations": [], "organizations": []}, "highlightText": "", "language": "english", "persons": ["Barnett Newman", "Jackson Pollock", "William Baziotes", "Philip Guston", "Mark Rothko", "Robert Motherwell", "David Hare", "Willem de Kooning", "Matthias Weischer", "Carlos Gardel", "Weischer"], "text": "Home » travel » Solo exhibition by Matthias Weischer FESTIVAL DIARY Solo exhibition by Matthias Weischer THE NATION August 14, 2015 1:00 am Considered one of the single most important contemporary German artists today, Weischer has gained critical acclaim for ... SOLO EXHIBITION BY MATTHIAS WEISCHER September 8 to October 3, Hong Kong Lehmann Maupin Hong Kong will present the first solo exhibition in Asia of well-known contemporary painter Matthias Weischer. Considered one of the single most important contemporary German artists today, Weischer has gained critical acclaim for his participation in the Leipzig School, a movement linked to the modern revival of figurative painting. FORM, GESTURE, FEELING: ROBERT MOTHERWELL A CENTENARY EXHIBITION 1915-1991 September 8 to November 1, Hong Kong Pearl Lam Galleries launch their autumn programme in Hong Kong with a major exhibition of historical works by New York School painter Robert Motherwell to celebrate the centenary of his birth. Motherwell was a principle figure in the development of Abstract Expressionism, a leading spokesman for avant-garde art in America, and a champion of the theory of automatism and free association. His circle included Philip Guston, Willem de Kooning, Jackson Pollock, Mark Rothko, William Baziotes, David Hare and Barnett Newman. The exhibition will be the first major show of Motherwell's work in Asia and will include 15 works including works from his important Great Wall of China series. MALAYSIA INTERNATIONAL MASK FESTIVAL August 13 to 16, Kuala Lumpur, Malaysia Malaysia is highlighting unique performances arts that use masks as a prop in its first ever mask festival.Visitors to the event at Esplanade KLCC Park in Kuala Lumpur will be exposed to traditional masks from all over the world during the parade. Among the participating countries are Indonesia, Japan, South Korea, the Philippines, Brazil, Thailand, China, Italy, Australia, New Zealand, and Malaysia. WORLD BOG SNORKELLING August 30, Wales, United Kingdom Held in the Waen Rhydd Peat Bog in Llanwrtyd Wells, the smallest town in Britain and located in the heart of mid-Wales, the mucky endurance test challenges contestants to swim two lengths of a 55m trench, with only flippers and a snorkel to help them through the quagmire. Conventional swimming strokes are not allowed. Hundreds of participants from around the world and plenty of spectators are expected at the event. HELSINKI CITY MARATHON August 15, Helsinki, Finland First held in 1980, the Helsinki City Marathon snakes round the Finnish capital to finish in the Helsinki Olympic Stadium. The Helsinki City Marathon is Finland's biggest running event, with more than 6,000 runners taking part every year. There is also a mini-marathon for children in the morning starting at 10, just before the Helsinki City Marathon. Visit www.HelsinkiCityMarathon.fi/frontpage. FESTIVAL DE TANGO August 12 to 25, Buenos Aires, Argentina Buenos Aires and tango are as inseparable as, well, a pair of tango dancers. The Argentine capital stages this annual festival, with events spread out across the city. Dancers and musicians perform at various venues and there are free classes for beginners, with thousands of Carlos Gardel fans stumbling through their first tango steps. Remember, it takes two to tango so it is best to bring along a partner. 159 Viewed", "external_links": [], "published": "2015-08-13T21:00:00.000+03:00", "crawled": "2015-08-13T21:47:53.195+03:00", "highlightTitle": ""}