{"organizations": ["Travelzoo Launches", "Travelzoo", "St. Regis", "Starwood Hotels & Resorts", "Starwood Hotels & Resorts Hawaii", "SEC", "Travelzoo Inc", "Travelzoo Japan K.K.", "Ltd.", "Travelzoo Travelzoo Inc."], "uuid": "044a4167675c312e814b1c01c041ed17f64998c3", "thread": {"social": {"gplus": {"shares": 0}, "pinterest": {"shares": 0}, "vk": {"shares": 0}, "linkedin": {"shares": 0}, "facebook": {"likes": 0, "shares": 0, "comments": 0}, "stumbledupon": {"shares": 0}}, "site_full": "www.thestreet.com", "main_image": "http://s.thestreet.com/files/tsc/v2008/photos/all-pics/press_releases_8_lead.jpg", "site_section": "http://www.thestreet.com/feeds/rss/search.html?topicSearch=Travel&puc=relatedtopic", "section_title": "TheStreet Search RSS Feed: Travel", "url": "http://www.thestreet.com/story/13252033/1/travelzoo-launches-a-nationwide-search-for-five-lucky-names.html?cm_ven=RSSFeed", "country": "US", "title": "Travelzoo Launches A Nationwide Search For Five Lucky Names", "performance_score": 0, "site": "thestreet.com", "participants_count": 0, "title_full": "Travelzoo Launches A Nationwide Search For Five Lucky Names", "spam_score": 0.0, "site_type": "news", "published": "2015-08-11T18:49:00.000+03:00", "replies_count": 0, "uuid": "044a4167675c312e814b1c01c041ed17f64998c3"}, "author": "", "url": "http://www.thestreet.com/story/13252033/1/travelzoo-launches-a-nationwide-search-for-five-lucky-names.html?cm_ven=RSSFeed", "ord_in_thread": 0, "title": "Travelzoo Launches A Nationwide Search For Five Lucky Names", "locations": ["Sheraton", "Hawaiian Islands of Oahu", "North America", "Kauai", "Hawaii", "Big Island", "Europe", "NEW YORK", "Asia", "Asia Pacific", "Maui"], "entities": {"persons": [], "locations": [], "organizations": []}, "highlightText": "", "language": "english", "persons": ["Maria Martinez Priya Patel", "Justin Soffer"], "text": "Travelzoo Launches A Nationwide Search For Five Lucky Names By PR Newswire | 08/11/15 - 11:49 AM EDT Reprint NEW YORK , Aug. 11, 2015 /PRNewswire/ -- Travelzoo (NASDAQ: TZOO), a global Internet media company, launched a nationwide search today for people with five lucky names. One winner for each name will win a 5-night luxury Hawaii getaway for two courtesy of Starwood Hotels & Resorts Hawaii. The five #luckynames are: Maria Martinez Priya Patel \"Chances are you know someone with one of the names we selected,\" said Justin Soffer , vice president of marketing for Travelzoo. \"Unlike most contests where the winners are chosen completely at random, we thought it would be fun to choose the winning names first. And this contest is perfectly suited for social media since it will inspire people to share and tag friends who are eligible to enter.\"To share with friends or if you have one the names listed above, you can enter the sweepstakes at www.travelzoo.com/blog/luckynames . About Travelzoo Travelzoo Inc. is a global Internet media company. With more than 27 million members in North America , Europe , and Asia Pacific and 25 offices worldwide, TravelzooÂ® publishes deals from more than 2,000 travel, entertainment and local companies. Travelzoo Deal Experts review offers to find the best deals and confirm their true value. In Asia Pacific , Travelzoo is independently owned and operated by Travelzoo ( Asia ) Ltd. and Travelzoo Japan K.K. under a license agreement with Travelzoo Inc. About Starwood Hotels & Resorts Hawaii With 11 properties across the diverse Hawaiian Islands of Oahu , Maui , Kauai and the Big Island, Starwood Hotels & Resorts Hawaii offers the best hotel destinations to celebrate romance, reconnect with family, focus on business or launch an adventure. Located on or just footsteps away from the Islands' best beaches, Starwood Hotels & Resorts in Hawaii is a collection of iconic and historic hotels and resorts - properties with expansive and breathtaking backdrops, innovative guest programming and luxurious amenities representing internationally renowned hotel brands from Sheraton, Westin, Luxury Collection and St. Regis. For more information about Starwood Hotels & Resorts in Hawaii , please call (866) 716-8140 or visit starwoodhawaii.com. For booking information please call (866) 716-8140 or visit www.starwoodhawaii.com . Certain statements contained in this press release that are not historical facts may be forward-looking statements within the meaning of Section 27A of the Securities Act of 1933 and Section 21E of the Securities and Exchange Act of 1934. These forward-looking statements may include, but are not limited to, statements about our plans, objectives, expectations, prospects and intentions, markets in which we participate and other statements contained in this press release that are not historical facts. When used in this press release, the words \"expect\", \"predict\", \"project\", \"anticipate\", \"believe\", \"estimate\", \"intend\", \"plan\", \"seek\" and similar expressions are generally intended to identify forward-looking statements. Because these forward-looking statements involve risks and uncertainties, there are important factors that could cause actual results to differ materially from those expressed or implied by these forward-looking statements, including changes in our plans, objectives, expectations, prospects and intentions and other factors discussed in our filings with the SEC. We cannot guarantee any future levels of activity, performance or achievements. Travelzoo undertakes no obligation to update forward-looking statements to reflect events or circumstances occurring after the date of this press release. Travelzoo and Top 20 are registered trademarks of Travelzoo. All other names are trademarks and/or registered trademarks of their respective owners. 1 of 2", "external_links": [], "published": "2015-08-11T18:49:00.000+03:00", "crawled": "2015-08-11T19:08:09.080+03:00", "highlightTitle": ""}