{"organizations": ["S.C. Kelly Miller", "JTV", "First Shopping Network To Broadcast Reality Show Jewelry Television® First Shopping Network To Broadcast Reality"], "uuid": "98b12cdaa43a722673c7e75e47c36d595a020476", "thread": {"social": {"gplus": {"shares": 0}, "pinterest": {"shares": 0}, "vk": {"shares": 0}, "linkedin": {"shares": 0}, "facebook": {"likes": 0, "shares": 0, "comments": 0}, "stumbledupon": {"shares": 0}}, "site_full": "www.thestreet.com", "main_image": "http://s.thestreet.com/files/tsc/v2008/photos/all-pics/press_releases_7_lead.jpg", "site_section": "http://www.thestreet.com/feeds/rss/search.html?topicSearch=Travel&puc=relatedtopic", "section_title": "TheStreet Search RSS Feed: Travel", "url": "http://www.thestreet.com/story/13240542/1/jewelry-television-first-shopping-network-to-broadcast-reality-show.html?cm_ven=RSSFeed", "country": "US", "title": "Jewelry Television® First Shopping Network To Broadcast Reality Show", "performance_score": 0, "site": "thestreet.com", "participants_count": 0, "title_full": "Jewelry Television® First Shopping Network To Broadcast Reality Show", "spam_score": 0.0, "site_type": "news", "published": "2015-08-01T15:00:00.000+03:00", "replies_count": 0, "uuid": "98b12cdaa43a722673c7e75e47c36d595a020476"}, "author": "", "url": "http://www.thestreet.com/story/13240542/1/jewelry-television-first-shopping-network-to-broadcast-reality-show.html?cm_ven=RSSFeed", "ord_in_thread": 0, "title": "Jewelry Television® First Shopping Network To Broadcast Reality Show", "locations": ["Tenn.", "Del", "Wilmington", "Austin", "Saint Louis", "Knoxville", "Texas", "Myrtle Beach", "KNOXVILLE", "Mo"], "entities": {"persons": [], "locations": [], "organizations": []}, "highlightText": "", "language": "english", "persons": ["Jill Johnson", "Carson", "Tamara Cimalore", "Ashley Hoffman", "Deborah Wilson Taylor"], "text": "Jewelry Television® First Shopping Network To Broadcast Reality Show By PR Newswire | 08/01/15 - 08:00 AM EDT Reprint KNOXVILLE, Tenn. , Aug. 1, 2015 /PRNewswire/ -- In an unprecedented move for the television-shopping industry, Jewelry Television® (JTV), is announcing that it will air Rock Star Designer, the first reality show broadcast on a home-shopping network. \"JTV Rock Star Designer,\" has involved a national search for talented jewelry designers, one of whom will win a $5,000 cash prize and the opportunity to design and sell a jewelry collection on the national jewelry and gemstone shopping network. The reality series will debut on Aug. 7 at 7:30 p.m. EDT , leading into the network's most-watched show, \"Girlfriend Friday.\" There will also be an encore presentation every Wednesday at 2 a.m. EDT beginning Aug. 12. Experience the interactive Multimedia News Release here: http://www.multivu.com/players/English/7372631-jewelry-television In March 2015 , JTV issued a call for entries and received applications from designers around the country. Each aspiring designer was required to submit examples of their jewelry designs and a biographical video describing why he/she should be JTV's first \"Rock Star Designer.\" The public voted on its favorite entries, narrowing the field to 10 semi-finalists. A team of JTV executives, jewelry buyers and marketing professionals reviewed the work of the top 10 and narrowed the field to five finalists who traveled to JTV's corporate headquarters in Knoxville, Tenn. , and competed head-to-head in jewelry design competitions. You can learn more about the five finalists on the Rock Star site. They are: Tamara Cimalore - Wilmington, Del. Ashley Hoffman - Myrtle Beach, S.C. Kelly Miller - Saint Louis, Mo. Deborah Wilson Taylor - Austin, Texas \"JTV Rock Star Designer\" emcee, Kristie Carson , will present contestants with a series of challenges devised to test creativity, jewelry and gemstone knowledge , design skills, business acumen and ability to work under pressure. One contestant will be eliminated after each challenge until a winner is announced on Sept. 25 . 'We are dipping our toe into the branded-entertainment arena to entertain our current viewers as well as attract new audiences,\" said Jill Johnson , vice president of marketing at JTV. \"This is a full-scale television production with original sets, wardrobe, crew and nationally recognized celebrity judges. We hope to make this an annual competition.\"With the surging popularity in crowd-sourced design, JTV is getting a first-hand look at what emerging jewelry designers are creating and how that merchandise may drive trends and consumer purchasing decisions. 1 of 3", "external_links": [], "published": "2015-08-01T15:00:00.000+03:00", "crawled": "2015-08-01T16:28:57.201+03:00", "highlightTitle": ""}