{"organizations": ["Abacus", "Sabre", "SEC", "Abacus Travel Systems", "Sabre Corporation", "Abacus National Marketing Companies Sabre", "Company Sabre Corporation", "Abacus National Marketing Companies By PR Newswire", "Abacus Distribution Systems"], "uuid": "f6f991f4be20c3fb5f400faf2be05160e2a3c28d", "thread": {"social": {"gplus": {"shares": 0}, "pinterest": {"shares": 0}, "vk": {"shares": 0}, "linkedin": {"shares": 0}, "facebook": {"likes": 0, "shares": 0, "comments": 0}, "stumbledupon": {"shares": 0}}, "site_full": "www.thestreet.com", "main_image": "http://s.thestreet.com/files/tsc/v2008/photos/all-pics/press_releases_8_lead.jpg", "site_section": "http://www.thestreet.com/feeds/rss/search.html?topicSearch=Travel&puc=relatedtopic", "section_title": "TheStreet Search RSS Feed: Travel", "url": "http://www.thestreet.com/story/13239035/1/sabre-completes-acquisitions-of-abacus-national-marketing-companies.html?cm_ven=RSSFeed", "country": "US", "title": "Sabre Completes Acquisitions Of Abacus National Marketing Companies", "performance_score": 0, "site": "thestreet.com", "participants_count": 0, "title_full": "Sabre Completes Acquisitions Of Abacus National Marketing Companies", "spam_score": 0.0, "site_type": "news", "published": "2015-07-30T23:15:00.000+03:00", "replies_count": 0, "uuid": "f6f991f4be20c3fb5f400faf2be05160e2a3c28d"}, "author": "", "url": "http://www.thestreet.com/story/13239035/1/sabre-completes-acquisitions-of-abacus-national-marketing-companies.html?cm_ven=RSSFeed", "ord_in_thread": 0, "title": "Sabre Completes Acquisitions Of Abacus National Marketing Companies", "locations": ["USA", "Hong Kong", "Singapore", "Texas", "Southlake", "SOUTHLAKE"], "entities": {"persons": [], "locations": [], "organizations": []}, "highlightText": "", "language": "english", "persons": ["Barry Sievert", "Pam Wong"], "text": "Sabre Completes Acquisitions Of Abacus National Marketing Companies By PR Newswire | 07/30/15 - 04:15 PM EDT Reprint SOUTHLAKE, Texas , July 30, 2015 /PRNewswire/ -- Sabre Corporation (NASDAQ: SABR) today announced that it has completed the acquisition of Abacus national marketing company, Abacus Travel Systems, a Singapore company. Sabre completed the previously announced acquisition of Abacus Distribution Systems ( Hong Kong ) on July 3, 2015 . About the Company Sabre Corporation is a leading technology provider to the global travel and tourism industry. Sabre's software, data, mobile and distribution solutions are used by hundreds of airlines and thousands of hotels to manage vital operations, such as passenger and guest reservations, revenue management, and flight, network and crew management. Sabre also operates the world's leading travel marketplace, processing more than $110 billion of annual travel spend. Headquartered in Southlake, Texas , USA, Sabre operates in approximately 60 countries around the world. Website Information We routinely post important information for investors on our website, www.sabre.com , in the Investor Relations section. We intend to use this website as a means of disclosing material, non-public information and for complying with our disclosure obligations under Regulation FD. Accordingly, investors should monitor the Investor Relations section of our website, in addition to following our press releases, SEC filings, public conference calls, presentations and webcasts. The information contained on, or that may be accessed through, our website is not incorporated by reference into, and is not a part of, this document. Media Contact: Pam Wong +447 968 902 626 pam.wong@sabre.com Investor Relations Contact: Barry Sievert +1 682-605-0214 barry.sievert@sabre.com Logo - http://photos.prnewswire.com/prnh/20131216/DA33636LOGO-b", "external_links": [], "published": "2015-07-30T23:15:00.000+03:00", "crawled": "2015-07-30T23:31:26.327+03:00", "highlightTitle": ""}