{"organizations": ["Broad Institute", "St. Jude", "Lillian R. Cannon Comprehensive Cancer Center", "Department of Oncology", "St. Jude Children's Research Hospital", "St. Jude Cancer Center", "Boston Children's Hospital", "Dana Farber Cancer Institute", "Institutional Review Board for Dana Farber Cancer Institute and Boston Children's Hospital", "National Cancer Institute", "St. Jude Comprehensive Cancer Center", "NCI", "Washington University School of Medicine"], "uuid": "cf99ef8069eb81417d2839ae65064a7ac5a0d496", "thread": {"social": {"gplus": {"shares": 0}, "pinterest": {"shares": 0}, "vk": {"shares": 0}, "linkedin": {"shares": 0}, "facebook": {"likes": 0, "shares": 0, "comments": 0}, "stumbledupon": {"shares": 0}}, "site_full": "www.thestreet.com", "main_image": "http://s.thestreet.com/files/tsc/v2008/photos/all-pics/press_releases_5_lead.jpg", "site_section": "http://www.thestreet.com/feeds/rss/search.html?topicSearch=Travel&puc=relatedtopic", "section_title": "TheStreet Search RSS Feed: Travel", "url": "http://www.thestreet.com/story/13227555/1/st-jude-childrens-research-hospital-names-charles-roberts-md-phd-director-of-its-cancer-center.html?cm_ven=RSSFeed", "country": "US", "title": "St. Jude Children's Research Hospital Names Charles Roberts, M.D., Ph.D., Director Of Its Cancer Center", "performance_score": 0, "site": "thestreet.com", "participants_count": 0, "title_full": "St. Jude Children's Research Hospital Names Charles Roberts, M.D., Ph.D., Director Of Its Cancer Center", "spam_score": 0.0, "site_type": "news", "published": "2015-07-22T18:58:00.000+03:00", "replies_count": 0, "uuid": "cf99ef8069eb81417d2839ae65064a7ac5a0d496"}, "author": "", "url": "http://www.thestreet.com/story/13227555/1/st-jude-childrens-research-hospital-names-charles-roberts-md-phd-director-of-its-cancer-center.html?cm_ven=RSSFeed", "ord_in_thread": 0, "title": "St. Jude Children's Research Hospital Names Charles Roberts, M.D., Ph.D., Director Of Its Cancer Center", "locations": ["Tenn.", "MEMPHIS", "Missouri", "Boston Children's Hospital", "Boston", "St. Louis"], "entities": {"persons": [], "locations": [], "organizations": []}, "highlightText": "", "language": "english", "persons": ["Charles Roberts", "James R. Downing", "Charles W. M. Roberts", "Roberts"], "text": "St. Jude Children's Research Hospital Names Charles Roberts, M.D., Ph.D., Director Of Its Cancer Center By PR Newswire | 07/22/15 - 11:58 AM EDT Reprint MEMPHIS, Tenn. , July 22, 2015 /PRNewswire-USNewswire/ -- St. Jude Children's Research Hospital has named Charles W. M. Roberts , M.D., Ph.D., as executive vice president and director of the St. Jude Comprehensive Cancer Center , the first and only National Cancer Institute (NCI)-designated Comprehensive Cancer Center devoted solely to children. Roberts will also serve as full member in the Department of Oncology and hold the Lillian R. Cannon Comprehensive Cancer Center Director Endowed Chair. \"As a world-class investigator, compassionate physician and experienced leader, Dr. Roberts is well suited to guide the Cancer Center, which connects scientists and clinicians to drive advances in research and treatment,\" said James R. Downing , M.D., St. Jude president and chief executive officer. Roberts will assume the director role September 1 . He joins St. Jude from Dana Farber Cancer Institute in Boston , where he served as deputy chief scientific officer. He is an international leader in cancer epigenetics, and his research has provided new insights into the central role of chromatin remodeling in germline and sporadic cancers. Roberts has also co-led an initiative on DNA sequencing of pediatric solid tumors at the Broad Institute. Beyond scientific accomplishments, he is a noted a pediatric oncologist at Boston Children's Hospital. He chaired the pediatric Institutional Review Board for Dana Farber Cancer Institute and Boston Children's Hospital and co-led the pediatric solid tumor disease program. \"The St. Jude Cancer Center reflects leading excellence in research, patient care, education and community outreach,\" Roberts said. \"It's an honor to join the St. Jude faculty, and I look forward to continuing the advancement of scientific research to find cures for pediatric cancers.\" Roberts received his medical and doctoral degrees from Washington University School of Medicine in St. Louis, Missouri . He completed his pediatric residency and pediatric hematology/oncology fellowship at Boston Children's Hospital. The St. Jude Cancer Center is crucial in helping the hospital fulfill its mission of finding cures and saving children. In the most recent NCI review, the Cancer Center was honored to receive the highest possible score of \"exceptional.\" 1 of 2", "external_links": [], "published": "2015-07-22T18:58:00.000+03:00", "crawled": "2015-07-22T19:14:05.777+03:00", "highlightTitle": ""}