{"organizations": ["Brooks & Dunn", "Westgate Las Vegas", "Air Force"], "uuid": "d22bf2ce5fa1830d5c246f6a3a175947367b4b34", "thread": {"social": {"gplus": {"shares": 0}, "pinterest": {"shares": 0}, "vk": {"shares": 0}, "linkedin": {"shares": 0}, "facebook": {"likes": 0, "shares": 0, "comments": 0}, "stumbledupon": {"shares": 0}}, "site_full": "experience.usatoday.com", "main_image": "http://www.gannett-cdn.com/-mm-/d56a4f7c254b83827e23692971e805e1c7a76eb8/r=500x332&r=400x400&c=400x400/local/-/media/2015/06/30/USATODAY/ExperienceLasVegas/635712945880931078-CelineDion-GerardSchachmes5-Hi.jpg", "site_section": "http://rssfeeds.usatoday.com/UsatodaycomTravel-TopStories", "section_title": "USATODAY - Travel Top Stories", "url": "http://experience.usatoday.com/food-and-wine/story/best-of-food-and-wine/food/2015/06/29/american-barbecue-regions-smackdown/29351475/", "country": "US", "title": "Where to experience the '90s in Las Vegas", "performance_score": 0, "site": "usatoday.com", "participants_count": 0, "title_full": "Where to experience the '90s in Las Vegas", "spam_score": 0.0, "site_type": "news", "published": "2015-07-01T04:39:00.000+03:00", "replies_count": 0, "uuid": "ab0981d5a0474a7a487f57f06f1ce1d4cf7f24c9"}, "author": "", "url": "http://experience.usatoday.com/las-vegas/story/best-of-vegas/2015/06/30/1990s-vintage-las-vegas/29542495/", "ord_in_thread": 0, "title": "Where to experience the '90s in Las Vegas", "locations": ["Las Vegas", "Las Vegas Where", "USA", "Luxor"], "entities": {"persons": [], "locations": [], "organizations": []}, "highlightText": "", "language": "english", "persons": ["Selena", "Dunn", "Hilary Billings", "Gerard Schachmes", "Elvis", "Al Powers", "Leonardo DiCaprio", "Denise Truscello", "Suzanne Somers", "Celine Dion", "Denise Truscello Fullscreen Here", "Denise Truscello Spears", "Britney Spears", "Reba McEntire", "Brooks", "Jane", "Denise Truscello Mariah Carey", "Jennifer Lopez", "Michael Becker", "Justin McIntosh", "Mariah Carey"], "text": "Where to experience the '90s in Las Vegas by Hilary Billings , Special for USA TODAY | Published on June 30, 2015 0 Our hearts will go on! Top-selling female artist Celine Dion returns to Caesars Palace in August. Catch her singing all of your favorite hits (and covers) as her music is brought to life with breathtaking visuals and a 31-musician orchestra and band. And yes, you may cry. Gerard Schachmes At Britney Spears' show, 'Piece of Me' at Planet Hollywood, the princess of pop will drive you crazy (in a good way) in with fantastical set pieces, hypnotic lighting and theatrics, and infectious dance numbers. Denise Truscello Spears’ chart-topping songs have been remixed to give the show a nightclub feel, ensuring you’ll be on your feet showing off your own dance moves. You may in fact leave the theater shouting, “Baby, one more time!” Denise Truscello It’s no fantasy — five-time Grammy winner Mariah Carey has set up shop at Caesars Palace with her first-ever Vegas residency. Denise Truscello Mariah Carey has more No. 1 records than Elvis and sings them all in her show (no, seriously). Prepare for an evening of constant sing-alongs, storytelling, reminiscing and dancing. Denise Truscello Fullscreen Here’s your one chance, Fancy, to see a Vegas country residency unlike any other. Multi-media entertainment mogul and country queen Reba McEntire joins the best-selling country music duo Brooks and Dunn for the first time ever at The Colosseum at Caesars Palace. Justin McIntosh You’ll be doing the boot scootin’ boogie to their biggest hits all night long at 'Reba, Brooks & Dunn: Together in Vegas.' Denise Truscello While Leonardo DiCaprio cannot be found among the relics, lovers of the 1997 movie will also love revisiting history in Titanic: The Artifact Exhibition, featuring 20 never-before-seen artifacts at Luxor. MGM Resorts International Visitors can learn about passengers’ stories, view their left behind treasures, admire The Big Piece — a massive 15 ton portion of the hull — and experience a replica promenade deck and iceberg. MGM Resorts International Each visitor receives a boarding pass from an actual passenger on the Titanic. At the end of the visit, you can find out if they survived by finding their name on the wall memorial. MGM Resorts International Fullscreen Suzanne Somers flourished in the ‘90s. Not only did the 'Three’s Company' star keep the nation hooked on the ThighMaster, she wrote numerous books, starred in the popular family show 'Step by Step' and co-hosted 'Candid Camera'. Now you can see her live as she entertains guests with comedy and song in 'SUZANNE Sizzles' at Westgate Las Vegas. Denise Truscello Grammy Award winners Boyz II Men bring '90s R&B back at The Mirage. Al Powers, PowersImagery.com Sing along to timeless songs like \"I'll Make Love to You\" with the best-selling R&B group of all time. Denise Truscello 'In Living Color' Fly Girl and 'Selena' star, Jennifer Lopez is debuting her show at Planet Hollywood early next year. We know it will feature a combination of ballads, funk and Latin music, and high-energy dancing in true J.Lo style. Michael Becker Who didn’t love launching themselves headfirst down a Slip ‘n Slide? Relive your favorite front lawn games at Vegas’ new Cowabunga Bay Water Park featuring one-of-a-kind water slides, a wave pool and an interactive children’s area. Cowabunga Bay Water Park Fullscreen Ever wondered how you’d fare in a G.I. Jane or Air Force One-type situation? Now’s your chance. Become a special operations assaulter for the day at Adventure Combat Ops. Participants embark on fully immersive and sensory-overwhelming missions with the finest non-lethal weapons and tactical gear. Appropriately called, “controlled chaos,” this is as real as it gets without enlisting. You better hope the time devoted to playing with Super Soakers growing up was well spent…because it’s game on. Adventure Combat Ops Like this topic? You may also like these photo galleries: Replay", "external_links": [], "published": "2015-07-01T04:39:00.000+03:00", "crawled": "2015-07-01T21:21:31.000+03:00", "highlightTitle": ""}