{"organizations": ["Burger Bar & Cantina", "FS Food Group", "Columbia", "Tacos & Tequila", "EDENS", "New York Times"], "uuid": "6938011db9ed23ebe5c8cdad2b69c922dda3c995", "thread": {"social": {"gplus": {"shares": 0}, "pinterest": {"shares": 0}, "vk": {"shares": 0}, "linkedin": {"shares": 0}, "facebook": {"likes": 0, "shares": 0, "comments": 0}, "stumbledupon": {"shares": 0}}, "site_full": "www.thestreet.com", "main_image": "http://s.thestreet.com/files/tsc/v2008/photos/all-pics/press_releases_8_lead.jpg", "site_section": "http://www.thestreet.com/feeds/rss/search.html?topicSearch=Travel&puc=relatedtopic", "section_title": "TheStreet Search RSS Feed: Travel", "url": "http://www.thestreet.com/story/13225278/1/midwood-smokehouse-coming-to-cross-hill-market.html?cm_ven=RSSFeed", "country": "US", "title": "Midwood Smokehouse Coming To Cross Hill Market", "performance_score": 0, "site": "thestreet.com", "participants_count": 0, "title_full": "Midwood Smokehouse Coming To Cross Hill Market", "spam_score": 0.0, "site_type": "news", "published": "2015-07-21T16:18:00.000+03:00", "replies_count": 0, "uuid": "6938011db9ed23ebe5c8cdad2b69c922dda3c995"}, "author": "", "url": "http://www.thestreet.com/story/13225278/1/midwood-smokehouse-coming-to-cross-hill-market.html?cm_ven=RSSFeed", "ord_in_thread": 0, "title": "Midwood Smokehouse Coming To Cross Hill Market", "locations": ["Miami", "Washington", "S.C.", "Houston", "Midwood", "Dallas", "Atlanta", "Boston", "D.C.", "Charlotte", "Midwood Smokehouse"], "entities": {"persons": [], "locations": [], "organizations": []}, "highlightText": "", "language": "english", "persons": ["Frank Scibelli", "Lyle Darnall", "Paco", "Scibelli"], "text": "Midwood Smokehouse Coming To Cross Hill Market By PR Newswire | 07/21/15 - 09:18 AM EDT Reprint COLUMBIA, S.C. , July 21, 2015 /PRNewswire/ -- EDENS is proud to welcome Frank Scibelli , founder of FS Food Group, and his down-home, authentic regional-style barbecue concept Midwood Smokehouse to Cross Hill Market. Once you've dined at Midwood Smokehouse, be prepared for the inevitable cravings that follow. Seasoned pit masters keep true to traditional barbecue plates, but also incorporate those flavors into salads, sandwiches, burgers and tacos. Their staff is committed to doing everything the right way, which is why they make barbecue sauce from scratch and adhere to a 'round the clock' smoking schedule. For Midwood Smokehouse, Scibelli traveled throughout the country to visit the landmarks of American barbecue, seeking the expertise of 'cue experts from around the country. The original location in Charlotte is no stranger to acclaim. In four short years, the restaurant's commitment to quality barbecue has garnered national attention and customers' online acknowledgement as some of the best food in Charlotte . From The New York Times to Travel Channel's BBQ Crawl, Midwood Smokehouse continues to stoke the media fire. \"Frank has created concepts such as Bad Daddy's Burger Bar & Cantina 1511 that have a strong commitment in maintaining scratch kitchens using fresh, quality ingredients,\" says Lyle Darnall , Managing Director at EDENS. \"He continues to maintain that legacy with Paco's Tacos & Tequila, Mama Ricotta's, Midwood Smokehouse and Plate Perfect Catering. We are excited to introduce and share a restaurant of Midwood Smokehouse's caliber with the Columbia community\". The restaurant will be in the former American Roadside Burger location and will soon be under construction. It is expected to open this fall. About EDENS: EDENS develops, owns and operates community shopping centers in primary markets across the country. Focusing on innovative development and redevelopment together with key acquisitions in urban areas, the company has built an institutional-quality portfolio of 136 retail centers. EDENS has regional headquarters in Boston , Washington, D.C. , Atlanta , Miami , Dallas , Houston and Columbia, SC . For additional information about the company and its retail real estate portfolio, please visit www.edens.com . Logo - http://photos.prnewswire.com/prnh/20131220/NY36979LOGO To view the original version on PR Newswire, visit: http://www.prnewswire.com/news-releases/midwood-smokehouse-coming-to-cross-hill-market-300116058.html SOURCE EDENS Copyright 2011 PR Newswire. All rights reserved. This material may not be published, broadcast, rewritten or redistributed. Check Out Our Best Services for Investors \nPortfolio Manager Jim Cramer and Director of Research Jack Mohr reveal their investment tactics while giving advanced notice before every trade. Product Features:", "external_links": [], "published": "2015-07-21T16:18:00.000+03:00", "crawled": "2015-07-21T16:30:37.604+03:00", "highlightTitle": ""}