{"organizations": ["Lagi Hits di Tangerang Aeon Mall &", "IKEA"], "uuid": "e5b6ae75d8a46ea8c146d8f045edff06b87f77cc", "thread": {"social": {"gplus": {"shares": 0}, "pinterest": {"shares": 0}, "vk": {"shares": 0}, "linkedin": {"shares": 0}, "facebook": {"likes": 0, "shares": 0, "comments": 0}, "stumbledupon": {"shares": 0}}, "site_full": "travel.detik.com", "main_image": "http://images.detik.com/content/2015/07/23/1519/182356_aeon10.jpg?w=650", "site_section": "http://rss.detik.com/index.php/travel_stories", "section_title": "travel.detik", "url": "http://travel.detik.com/read/2015/07/23/182058/2973915/1519/aeon-mall--2-tempat-belanja-yang-lagi-hits-di-tangerang", "country": "ID", "title": "Aeon Mall & 2 Tempat Belanja yang Lagi Hits di Tangerang", "performance_score": 6, "site": "detik.com", "participants_count": 0, "title_full": "Aeon Mall & 2 Tempat Belanja yang Lagi Hits di Tangerang", "spam_score": 0.0, "site_type": "news", "published": "2015-07-23T14:30:00.000+03:00", "replies_count": 0, "uuid": "e5b6ae75d8a46ea8c146d8f045edff06b87f77cc"}, "author": "", "url": "http://travel.detik.com/read/2015/07/23/182058/2973915/1519/aeon-mall--2-tempat-belanja-yang-lagi-hits-di-tangerang", "ord_in_thread": 0, "title": "Aeon Mall & 2 Tempat Belanja yang Lagi Hits di Tangerang", "locations": ["Indonesia", "Tangerang", "China"], "entities": {"persons": [], "locations": [], "organizations": []}, "highlightText": "", "language": "english", "persons": ["Jabodetabek", "Yang", "dan mungkin", "Jepang", "Baca Juga", "dan masih", "dan makan", "dan gerai", "Mal Alam Sutera", "Alam Sutera", "Kamis"], "text": "Aeon Mall & 2 Tempat Belanja yang Lagi Hits di Tangerang Fitraya Ramadhanny   18:20 WIB Suasana di dalam Aeon Mall (Randy/detikTravel) Tangerang - Tangerang belakangan jadi destinasi wisata belanja bagi mereka yang tinggal di Jabodetabek. Ini lantaran ada beberapa tempat belanja baru yang begitu spesial atau punya konsep unik yang membuat traveler jadi penasaran.Sejumlah tempat belanja baru di Tangerang memang menarik untuk dikunjungi para traveler. Apalagi yang ingin menikmati jalan-jalan di akhir pekan pertama setelah pulang dari mudik Lebaran. Dihimpun detikTravel dari berbagai sumber, Kamis (23/7/2015) ada 3 tempat belanja yang lagi hits didatangi wisatawan.Yang pertama adalah Aeon Mall yang dibuka pada 30 Mei 2015 di BSD City. Aeon Mall merupakan mal dengan konsep Jepang pertama yang hadir di Indonesia. Eksterior dan interior mal bertema Jepang mulai dari kolam kecil, replika pohon sakura mini, sampai dekorasi sejumlah toko.Mayoritas toko bernuansa Jepang di Aeon Mall masih didominasi oleh restoran, mulai dari sushi hingga variasi pilihan ramen yang ramai di foodcourt. Jika masuk ke pusat perbelanjaan Aeon, traveler dapat menemukan beragam jenis mainan khas Jepang, seperti Gundam, Doraemon, Pikachu, dan masih banyak lainnya.Tempat belanja top yang kedua adalah Mal Alam Sutera di Jl Jalur Sutera Barat Kav 16, Alam Sutera. Ini adalah mal berkonsep hijau dan modern seluas 7,8 hektar dan menjadi pusat belanja hiburan dan gaya hidup. Pohon palem dan aneka tumnbuhan hijau lain menghias Mal Alam Sutera dan memberikan suasana nyaman.Untuk belanja dan makan, ada banyak butik dan gerai yang bisa dipilih pengunjung. Mulai dari aparel olahraga, busana resmi, aneka butik sampai elektronik. Gerai makanan lebih banyak lagi mulai makanan Indonesia, Jepang, China, Eropa, roti, es krim, gerai kopi dan lain-lain.Yang ketiga dan mungkin paling ditunggu-tunggu sejak lama adalah IKEA, tempat belanja furniture dan aksesoris rumah paling populer di dunia. Gerai asli Swedia ini membuka cabang Indonesia tepatnya di kawasan Alam Sutera, Tangerang.Dalam bangunan 2 lantai ini tersedia berbagai barang rumah tangga yang disebar di area seluas 35 ribu m2. Benda-benda furniture yang dijual sungguh menarik dan inspiratif. Model barang-barang IKEA sering dianggap sebagai trend setter furniture dan perabotan rumah. IKEA juga dilengkapi dengan tempat makan berkapasitas 700 tempat duduk dan tempat parkir luas untuk 1.000 mobil.Ketiga tempat belanja itu bisa dibilang memang yang sekarang sedang hits di Tangerang. Jangan heran kalau di akhir pekan banyak yang berkunjung, tidak hanya warga Tangerang tapi juga traveler dari kawasan Jabodetabek dan mungkin termasuk Anda nantinya. Tampak depan Mal Alam Sutera (mallalamsutera.com) Suasana di dalam toko IKEA (wolipop.detik.com) Baca Juga", "external_links": [], "published": "2015-07-23T14:30:00.000+03:00", "crawled": "2015-07-23T14:58:07.259+03:00", "highlightTitle": ""}