{"organizations": ["Travelers' Choice Amusement Parks", "TripAdvisor", "TripAdvisor Travelers"], "uuid": "73e54da29cbb0a65a866ae8cb996f668924e93f2", "thread": {"social": {"gplus": {"shares": 0}, "pinterest": {"shares": 0}, "vk": {"shares": 0}, "linkedin": {"shares": 0}, "facebook": {"likes": 0, "shares": 0, "comments": 0}, "stumbledupon": {"shares": 0}}, "site_full": "www.thestreet.com", "main_image": "http://s.thestreet.com/files/tsc/v2008/photos/contrib/uploads/all-pics/press_releases_7_article_600px.jpg", "site_section": "http://www.thestreet.com/feeds/rss/search.html?topicSearch=Travel&puc=relatedtopic", "section_title": "TheStreet Search RSS Feed: Travel", "url": "http://www.thestreet.com/story/13218817/1/worlds-top-amusement-parks-named-in-2015-tripadvisor-travelers-choice-awards.html?cm_ven=RSSFeed", "country": "US", "title": "World's Top Amusement Parks Named In 2015 TripAdvisor Travelers' Choice Awards", "performance_score": 0, "site": "thestreet.com", "participants_count": 0, "title_full": "World's Top Amusement Parks Named In 2015 TripAdvisor Travelers' Choice Awards", "spam_score": 0.0, "site_type": "news", "published": "2015-07-15T13:00:00.000+03:00", "replies_count": 0, "uuid": "73e54da29cbb0a65a866ae8cb996f668924e93f2"}, "author": "", "url": "http://www.thestreet.com/story/13218817/1/worlds-top-amusement-parks-named-in-2015-tripadvisor-travelers-choice-awards.html?cm_ven=RSSFeed", "ord_in_thread": 0, "title": "World's Top Amusement Parks Named In 2015 TripAdvisor Travelers' Choice Awards", "locations": ["South America", "U.S.", "NEWTON", "Canada", "Mass.", "U.S", "Europe", "South Pacific", "Asia", "U.K.", "India"], "entities": {"persons": [], "locations": [], "organizations": []}, "highlightText": "", "language": "english", "persons": ["Barbara Messing"], "text": "World's Top Amusement Parks Named In 2015 TripAdvisor Travelers' Choice Awards By GlobeNewswire | 07/15/15 - 06:00 AM EDT Universal's Islands of Adventures #1 in the World; TripAdvisor Shares Guide to Orlando Highlighting Airfare, Restaurants and Family-Friendly Hotels Bookable on the Site World's Largest Travel Site Also Names Best Water Parks Across the Globe NEWTON, Mass., July 15, 2015 (GLOBE NEWSWIRE) -- TripAdvisor ® , the world's largest travel site*, today announced its Travelers' Choice™ awards for amusement parks and water parks around the globe. This year's awards honor 244 attractions in total, including the top 25 in the world and dedicated lists for Asia, Canada, Europe, India, South America, South Pacific, the U.K. and the U.S. The annual awards are based on the millions of valuable reviews and opinions from TripAdvisor travelers across the globe. Award winners were determined using an algorithm that took into account the quantity and quality of reviews for amusement parks and water parks worldwide, gathered over a 12-month period. \"Thrill-seekers can get their tickets to excitement at these Travelers' Choice award-winning attractions that have received rave reviews from the TripAdvisor community,\" said Barbara Messing, chief marketing officer for TripAdvisor. \"Appealing to the young and young at heart, these entertaining enclaves offer a variety of budget-friendly accommodations and dining options that are highly-rated on TripAdvisor.\" Top 10 Travelers' Choice Amusement Parks in the U.S. and World Amusement Parks – U.S.", "external_links": [], "published": "2015-07-15T13:00:00.000+03:00", "crawled": "2015-07-15T13:29:28.000+03:00", "highlightTitle": ""}