{"organizations": ["Canaccord Genuity", "Inc."], "uuid": "b31f910513dfa59db3e462d95bcd3b94913b723e", "thread": {"social": {"gplus": {"shares": 0}, "pinterest": {"shares": 0}, "vk": {"shares": 0}, "linkedin": {"shares": 0}, "facebook": {"likes": 0, "shares": 0, "comments": 0}, "stumbledupon": {"shares": 0}}, "site_full": "www.thestreet.com", "main_image": "http://s.thestreet.com/files/tsc/v2008/photos/all-pics/press_releases_3_lead.jpg", "site_section": "http://www.thestreet.com/feeds/rss/search.html?topicSearch=Travel&puc=relatedtopic", "section_title": "TheStreet Search RSS Feed: Travel", "url": "http://www.thestreet.com/story/13235807/1/homeaway-announces-upcoming-august-conference-participation.html?cm_ven=RSSFeed", "country": "US", "title": "HomeAway Announces Upcoming August Conference Participation", "performance_score": 0, "site": "thestreet.com", "participants_count": 0, "title_full": "HomeAway Announces Upcoming August Conference Participation", "spam_score": 0.0, "site_type": "news", "published": "2015-07-29T16:00:00.000+03:00", "replies_count": 0, "uuid": "b31f910513dfa59db3e462d95bcd3b94913b723e"}, "author": "", "url": "http://www.thestreet.com/story/13235807/1/homeaway-announces-upcoming-august-conference-participation.html?cm_ven=RSSFeed", "ord_in_thread": 0, "title": "HomeAway Announces Upcoming August Conference Participation", "locations": ["United States", "Spain", "Texas", "Boston", "United Kingdom", "France", "Massachusetts", "Austin", "Brazil", "Vail", "Australia", "Asia Pacific", "Colorado", "Germany", "New Zealand", "VRBO.com"], "entities": {"persons": [], "locations": [], "organizations": []}, "highlightText": "", "language": "english", "persons": ["Lynn Atchison", "Brian Sharples"], "text": "HomeAway Announces Upcoming August Conference Participation By GlobeNewswire | 07/29/15 - 09:00 AM EDT Reprint AUSTIN, Texas, July 29, 2015 (GLOBE NEWSWIRE) -- HomeAway, Inc. (Nasdaq:AWAY), the world's leading online marketplace for the vacation rental industry, today announced participation in the following upcoming conferences: President and Chief Executive Officer Brian Sharples and Chief Financial Officer Lynn Atchison will participate in the 17 th Annual Pacific Crest Global Technology Leadership Forum to be held August 10-11, 2015 at The Sonnenalp in Vail, Colorado. HomeAway will participate in a fireside chat scheduled for Monday, August 10 at 2:30 p.m. MDT. Chief Financial Officer Lynn Atchison will participate in the Canaccord Genuity 35 th Annual Growth Conference to be held August 12-13, 2015 at the InterContinental Hotel in Boston, Massachusetts. HomeAway will participate in a fireside chat scheduled for Wednesday, August 12 at 2:30 p.m. EDT. Both presentations will be webcast live on the Internet, accessible through the Investor Relations section of HomeAway's website at http://investors.homeaway.com . In addition to the live webcasts, replays will be available on HomeAway's website following each event. About HomeAway HomeAway, Inc. based in Austin, Texas, is the world leader in vacation rentals, with sites representing over one million paid listings of vacation rental homes in 190 countries. Through HomeAway, owners and property managers offer an extensive selection of vacation homes that provide travelers with memorable experiences and benefits, including more room to relax and added privacy, for less than the cost of traditional hotel accommodations. The company also makes it easy for vacation rental owners and property managers to advertise their properties and manage bookings online. The HomeAway portfolio includes the leading vacation rental websites HomeAway.com, VRBO.com and VacationRentals.com in the United States; HomeAway.co.uk and OwnersDirect.co.uk in the United Kingdom; HomeAway.de in Germany; Abritel.fr and Homelidays.com in France; HomeAway.es and Toprural.es in Spain; AlugueTemporada.com.br in Brazil; HomeAway.com.au and Stayz.com.au in Australia; and Bookabach.co.nz in New Zealand. The Asia Pacific short-term rental site, travelmob.com, is also majority owned by HomeAway. 1 of 2", "external_links": [], "published": "2015-07-29T16:00:00.000+03:00", "crawled": "2015-07-29T16:17:23.358+03:00", "highlightTitle": ""}