{"organizations": ["Wall Street Journal", "Lucky", "LLC", "C&G", "Ice & Go LLC", "Entrepreneur Magazine", "M&M ARC Inc.", "Lucky Oil Company", "Custard Cookie Sandwiches", "Scott Stevens of Ice & Go LLC", "TravelCenters of America Minit Mart", "Makes Bold Move Into Convenience & Gas Channel Rita's Makes Bold Move Into Convenience & Gas Channel By PR Newswire"], "uuid": "2db420ad4910831100e413ba6531a66c6377ba0d", "thread": {"social": {"gplus": {"shares": 0}, "pinterest": {"shares": 0}, "vk": {"shares": 0}, "linkedin": {"shares": 0}, "facebook": {"likes": 0, "shares": 0, "comments": 0}, "stumbledupon": {"shares": 0}}, "site_full": "www.thestreet.com", "main_image": "http://s.thestreet.com/files/tsc/v2008/photos/all-pics/misc/m-z/newspapers-front-lead3.jpg", "site_section": "http://www.thestreet.com/feeds/rss/search.html?topicSearch=Travel&puc=relatedtopic", "section_title": "TheStreet Search RSS Feed: Travel", "url": "http://www.thestreet.com/story/13234333/1/ritas-makes-bold-move-into-convenience-gas-channel.html?cm_ven=RSSFeed", "country": "US", "title": "Rita's Makes Bold Move Into Convenience & Gas Channel", "performance_score": 0, "site": "thestreet.com", "participants_count": 0, "title_full": "Rita's Makes Bold Move Into Convenience & Gas Channel", "spam_score": 0.0, "site_type": "news", "published": "2015-07-28T18:27:00.000+03:00", "replies_count": 0, "uuid": "2db420ad4910831100e413ba6531a66c6377ba0d"}, "author": "", "url": "http://www.thestreet.com/story/13234333/1/ritas-makes-bold-move-into-convenience-gas-channel.html?cm_ven=RSSFeed", "ord_in_thread": 0, "title": "Rita's Makes Bold Move Into Convenience & Gas Channel", "locations": ["United States", "Philippines", "Caribbean", "Colo.", "Ore.", "Trevose", "West Coast", "Mont.", "California", "Cairo Road", "Calif.", "East Coast", "Pa.", "Middle East", "Idaho", "TREVOSE", "Minnesota", "Wash.", "Hawaii", "Stillwater", "Newbury Park", "Paducah", "Canada", "Nev.", "Kentucky", "Midwest"], "entities": {"persons": [], "locations": [], "organizations": []}, "highlightText": "", "language": "english", "persons": ["Stevens", "Meenu Sandhu", "Rita", "Scott Stevens", "Sandhu", "Madhusudan Sandhu", "Blendini", "Mo Boutara"], "text": "Rita's Makes Bold Move Into Convenience & Gas Channel By PR Newswire | 07/28/15 - 11:27 AM EDT Reprint TREVOSE, Pa. , July 28, 2015 /PRNewswire/ -- Today, Rita's Italian Ice , the world's largest Italian Ice concept with more than 600 stores, officially announced it will enter the convenience and gas channel nationwide with two area development agreements. The agreements were awarded to M&M ARC Inc. for the development of the West and to Ice & Go LLC for the development of the Midwest, South and Northeast. Together, the two agreements call for 60 units by 2025 — the first of which opened its doors last month in Newbury Park, California at the Chevron Extra Mile convenience store and recently celebrated its grand opening. \"The convenience and gas channel allows us to further penetrate the market, while presenting franchisees with even more opportunity,\" said Mo Boutara , senior director of franchise development at Rita's Franchise Company. \"We're thrilled to have two incredible business partners on our team as we embark on this new venture.\"M&M ARC Inc., Rita's area developer for the West Coast, is led by convenience and gas expert Meenu Sandhu and her husband, Madhusudan Sandhu , who together have more than 40 years of experience in the industry, including the ownership and management of five successful convenience and gas locations in California . As part of the aggressive 10-year plan, Sandhu and her team will open 30 Rita's Italian Ice locations across her territory, which includes: Calif., Colo., Hawaii , Idaho , Mont., Nev., Ore., Wash. and Wyo. \"I first set my eyes on opening a Rita's more than a year ago and once I realized the opportunity and full potential of the convenience and gas space, I knew I had to do something bigger,\" said Meenu Sandhu , owner of M&M ARC Inc. \"I'm thrilled to have my plans finally come to fruition and I look forward to spreading my love of Rita's up and down the West Coast.\"Farther East in Paducah, Kentucky , franchisee TA Operating, LLC prepares to open Rita's Ice at the TravelCenters of America Minit Mart located at 5425 Cairo Road, while area developer Scott Stevens of Ice & Go LLC will lead the charge in developing Rita's presence in the convenience and gas space throughout the Midwest and along the East Coast, developing 30 stores within 10 years. Stevens, who also serves as president and chief manager of Lucky Oil Company, is slated to open Rita's Ice in August 2015 at Lucky's Station, a branded Gulf station in Stillwater, Minnesota . \"We've taken Rita's proven Italian Ice concept and tailored it to the convenience store channel,\" said Scott Stevens , owner of Ice & Go LLC. \"Rita's C&G model has potential to be hugely successful for franchisees, as well as the entire Rita's system, and I couldn't be more excited to grow my portfolio and bring my business and personal vision to life.\"With more than 30 years in business, Rita's Italian Ice has been aggressively expanding across the United States and internationally, with innovative new concepts and locations now open in the Philippines and Canada , and coming soon in the Middle East and the Caribbean . For more information on purchasing your own Rita's Italian Ice franchise, please visit www.ownaritas.com . About Rita's Franchise Company Ranked #1 in Nation's Restaurant News \"Consumer Picks 2014\" for Service and Value in the Frozen Treat category and 14th overall in the Limited-Service category, Rita's Franchise Company is the largest Italian Ice concept in the world. Headquartered in Trevose, Pa. , Rita's was also named one of the Top 25 Franchise High Performers by the Wall Street Journal's \"Startup Journal\" and ranks #81 on Entrepreneur Magazine's \"2014 Franchise 500\" list. About Rita's Italian Ice The popular chain offers a variety of \"cool treats,\" including: its famous Italian Ice, made fresh daily with real fruit and available in more than sixty-five flavors; Old-Fashioned Frozen Custard; Sundaes; Light Custard; Frozen Custard Cakes; Custard Cookie Sandwiches made with OREO®; layered Gelatis; and its signature Misto® and Blendini® creations. Since 1984, Rita's has been dedicated to serving a big dose of happiness with its freshly made, delicious treats in a fun-filled atmosphere. For more information, call 1-800-677-7482 or visit www.ritasice.com . To view the original version on PR Newswire, visit: http://www.prnewswire.com/news-releases/ritas-makes-bold-move-into-convenience--gas-channel-300119812.html SOURCE Rita's Franchise Company Copyright 2011 PR Newswire. All rights reserved. This material may not be published, broadcast, rewritten or redistributed. Check Out Our Best Services for Investors \nPortfolio Manager Jim Cramer and Director of Research Jack Mohr reveal their investment tactics while giving advanced notice before every trade. Product Features:", "external_links": [], "published": "2015-07-28T18:27:00.000+03:00", "crawled": "2015-07-28T18:42:56.757+03:00", "highlightTitle": ""}