{"organizations": ["Christian Collins", "The United Nations", "UN", "Influential Network", "Mobile-First", "Christian Collins , Crawford Collins", "Vanity Fair Social Club", "United Nations", "UN Peace Bell"], "uuid": "62ceebb7ec6490ff5d5feaf7bf361f5818f9729f", "thread": {"social": {"gplus": {"shares": 0}, "pinterest": {"shares": 0}, "vk": {"shares": 0}, "linkedin": {"shares": 0}, "facebook": {"likes": 0, "shares": 0, "comments": 0}, "stumbledupon": {"shares": 0}}, "site_full": "www.thestreet.com", "main_image": "http://s.thestreet.com/files/tsc/v2008/photos/all-pics/press_releases_7_lead.jpg", "site_section": "http://www.thestreet.com/feeds/rss/search.html?topicSearch=Travel&puc=relatedtopic", "section_title": "TheStreet Search RSS Feed: Travel", "url": "http://www.thestreet.com/story/13294494/1/influential-partners-with-the-united-nations-to-launch-the-forgiveforpeace-campaign.html?cm_ven=RSSFeed", "country": "US", "title": "Influential Partners With The United Nations To Launch The #ForgiveForPeace Campaign", "performance_score": 0, "site": "thestreet.com", "participants_count": 0, "title_full": "Influential Partners With The United Nations To Launch The #ForgiveForPeace Campaign", "spam_score": 0.0, "site_type": "news", "published": "2015-09-21T02:30:00.000+03:00", "replies_count": 0, "uuid": "62ceebb7ec6490ff5d5feaf7bf361f5818f9729f"}, "author": "", "url": "http://www.thestreet.com/story/13294494/1/influential-partners-with-the-united-nations-to-launch-the-forgiveforpeace-campaign.html?cm_ven=RSSFeed", "ord_in_thread": 0, "title": "Influential Partners With The United Nations To Launch The #ForgiveForPeace Campaign", "locations": ["New York City", "LOS ANGELES"], "entities": {"persons": [], "locations": [], "organizations": []}, "highlightText": "", "language": "english", "persons": ["Brent Rivera", "Ryan Detert", "Aaron Carpenter", "Crawford Collins", "Ray Chambers", "Wesley Stromberg"], "text": "Influential Partners With The United Nations To Launch The #ForgiveForPeace Campaign By PR Newswire | 09/20/15 - 07:30 PM EDT Reprint LOS ANGELES , Sept. 20, 2015 /PRNewswire/ -- Influential , the only Mobile-First social media influencer marketing platform, has partnered with The United Nations to launch the #ForgiveForPeace campaign on the International Day of Peace, September 21 st . Influential is implementing its industry-leading, demographically-targeted social media technology and activating some of its top influencers to set the social trend of world peace on the International Day of Peace, through a full-scale social media campaign. Five of Influential's top social stars, Brent Rivera , Christian Collins , Crawford Collins , Aaron Carpenter , and Wesley Stromberg have been appointed as Youth Ambassadors for UN International Day of Peace and will travel to The United Nations in New York City on the International Day of Peace. The campaign was announced today at the Vanity Fair Social Club event for the Emmys, where the influencers joined Influential CEO, Ryan Detert , who served as the moderator of a panel that featured the five young stars. The influencers will be on-hand at The United Nations on the morning of the International Day of Peace to participate in the ceremonial ringing of the UN Peace Bell with UN Secretary-General Ban Ki-Moon and many other world leaders. \"In this day and age, when the digital star can spread a message online in a matter of seconds, I am honored to name some of the internet's most dynamic and respected personalities: Aaron Carpenter , Brent Rivera , Christian Collins , Crawford Collins and Wesley Stromberg from the Influential Network as our Youth Ambassadors for UN International Day of Peace. These bright young men have consistently shown that they use their online power for social good and they are teaming with us to help spread this important peace day message of #ForgiveForPeace to teens, and ultimately, everyone around the world,\" said Ray Chambers , Assistant Secretary General of the United Nations. \"Influential and our network of influencers are humbled and honored to be partnering with The United Nations for the International Day of Peace,\" said Ryan Detert , CEO of Influential. \"We are beyond thrilled to have the opportunity to help in creating such an important message of global peace and unity.\" About Influential Influential is the only Mobile-First influencer platform. Influential's invite-only patent-pending app is used by over 2,000 of the most highly engaged influencers on Twitter, Instagram, Vine, and Snapchat, representing over one billion followers. www.Influential.co Photo - http://photos.prnewswire.com/prnh/20150920/268597", "external_links": [], "published": "2015-09-21T02:30:00.000+03:00", "crawled": "2015-09-21T03:27:32.054+03:00", "highlightTitle": ""}